example_04/python/auto_tvm_log/v9h-mnist-NCHW-opencl.log
{"input": ["opencl -keys=powervr,opencl,gpu -device=powervr -max_num_threads=256 -thread_warp_size=1", "conv2d_nchw_spatial_pack.powervr", [["TENSOR", [1, 1, 32, 32], "float32"], ["TENSOR", [8, 1, 5, 5], "float32"], [1, 1], [0, 0, 0, 0], [1, 1], "float32"], {}], "config": {"index": 314806, "code_hash": null, "entity": [["tile_co", "sp", [-1, 4, 2]], ["tile_oh", "sp", [-1, 2, 14]], ["tile_ow", "sp", [-1, 4, 1]], ["reorder_0", "re", [0, 1, 2, 3, 4, 5, 6, 9, 7, 8]], ["ann_reduce", "an", ["none", "none"]], ["ann_spatial", "an", ["unroll", "unroll", "unroll"]]]}, "result": [[0.0004996275142857143], 0, 125.89501547813416, 1629701096.270585], "version": 0.2, "tvm_version": "0.8.dev0"}
{"input": ["opencl -keys=powervr,opencl,gpu -device=powervr -max_num_threads=256 -thread_warp_size=1", "conv2d_nchw_spatial_pack.powervr", [["TENSOR", [1, 8, 18, 18], "float32"], ["TENSOR", [16, 8, 5, 5], "float32"], [1, 1], [0, 0, 0, 0], [1, 1], "float32"], {}], "config": {"index": 130653, "code_hash": null, "entity": [["tile_co", "sp", [-1, 8, 1]], ["tile_oh", "sp", [-1, 2, 7]], ["tile_ow", "sp", [-1, 1, 2]], ["reorder_0", "re", [0, 1, 2, 3, 4, 5, 6, 9, 7, 8]], ["ann_reduce", "an", ["none", "unroll"]], ["ann_spatial", "an", ["unroll", "unroll", "vec"]]]}, "result": [[0.0006683447811158798], 0, 116.44027543067932, 1629702351.8306253], "version": 0.2, "tvm_version": "0.8.dev0"}
{"input": ["opencl -keys=powervr,opencl,gpu -device=powervr -max_num_threads=256 -thread_warp_size=1", "dense.powervr", [["TENSOR", [1, 256], "float32"], ["TENSOR", [10, 256], "float32"], null, "float32"], {}], "config": {"index": 55, "code_hash": null, "entity": [["tile_y", "sp", [-1, 1, 1]], ["tile_x", "sp", [-1, 2, 1]], ["c_unroll", "sp", [-1, 64]]]}, "result": [[0.00014334682612695494], 0, 114.22335505485535, 1629702810.044636], "version": 0.2, "tvm_version": "0.8.dev0"}
