example_03/model-01-half-NCHW-B1-opencl-C2000-T21-09-02-12-02.json
{"i": [["[\"39e4bafedfe85ad162fcb6a68723e5cd\", 1, 2, 320, 240, 2, 2, 4, 4, 1, 2, 1, 1, 1, 2, 640, 480]", "opencl -keys=opencl,gpu -max_num_threads=256 -thread_warp_size=1", [2, 16, 64, 4096, 409600, 512, 2, 2], "llvm -keys=cpu -link-params=0 -mtriple=aarch64-linux-gnu", 0, []], [[], [["SP", 3, 0, 1, [1, 1, 1, 1], 1], ["SP", 3, 5, 2, [2, 1, 1, 1], 1], ["SP", 3, 10, 640, [2, 2, 1, 2], 1], ["SP", 3, 15, 480, [1, 12, 2, 2], 1], ["SP", 3, 20, 2, [1, 1], 1], ["SP", 3, 23, 4, [2, 1], 1], ["SP", 3, 26, 4, [4, 1], 1], ["RE", 3, [0, 5, 10, 15, 1, 6, 11, 16, 2, 7, 12, 17, 20, 23, 26, 21, 24, 27, 3, 8, 13, 18, 22, 25, 28, 4, 9, 14, 19]], ["FSP", 5, 0, 0, 3], ["FSP", 5, 4, 1, 3], ["FSP", 5, 8, 2, 3], ["FSP", 5, 12, 3, 3], ["RE", 5, [0, 4, 8, 12, 1, 5, 9, 13, 2, 6, 10, 14, 3, 7, 11, 15]], ["CA", 3, 5, 11], ["CHR", 2, "shared", [3]], ["CA", 3, 4, 14], ["CHR", 1, "shared", [4]], ["CA", 2, 5, 14], ["CI", 1], ["FU", 7, [0, 1, 2, 3]], ["AN", 7, 0, 5], ["FU", 7, [1, 2, 3, 4]], ["AN", 7, 1, 4], ["FU", 7, [2, 3, 4, 5]], ["AN", 7, 2, 6], ["FU", 4, [0, 1, 2, 3]], ["SP", 4, 0, 16, [1], 1], ["AN", 4, 1, 2], ["FFSP", 4, 0, [3, 2, 1, 0], 1, 1], ["AN", 4, 1, 6], ["FU", 2, [0, 1, 2, 3]], ["SP", 2, 0, 42, [1], 1], ["AN", 2, 1, 2], ["FFSP", 2, 0, [3, 2, 1, 0], 1, 1], ["AN", 2, 1, 6], ["PR", 5, 0, "auto_unroll_max_step$512"]]]], "r": [[0.032471, 0.0321852, 0.00481265], 0, 4.11933, 1630555398], "v": "v0.6"}
{"i": [["[\"39e4bafedfe85ad162fcb6a68723e5cd\", 1, 2, 320, 240, 2, 2, 4, 4, 1, 2, 1, 1, 1, 2, 640, 480]", "opencl -keys=opencl,gpu -max_num_threads=256 -thread_warp_size=1", [2, 16, 64, 4096, 409600, 512, 2, 2], "llvm -keys=cpu -link-params=0 -mtriple=aarch64-linux-gnu", 0, []], [[], [["SP", 3, 0, 1, [1, 1, 1, 1], 1], ["SP", 3, 5, 2, [1, 1, 1, 1], 1], ["SP", 3, 10, 640, [1, 1, 8, 1], 1], ["SP", 3, 15, 480, [1, 10, 1, 2], 1], ["SP", 3, 20, 2, [2, 1], 1], ["SP", 3, 23, 4, [1, 4], 1], ["SP", 3, 26, 4, [1, 2], 1], ["RE", 3, [0, 5, 10, 15, 1, 6, 11, 16, 2, 7, 12, 17, 20, 23, 26, 21, 24, 27, 3, 8, 13, 18, 22, 25, 28, 4, 9, 14, 19]], ["FSP", 5, 0, 0, 3], ["FSP", 5, 4, 1, 3], ["FSP", 5, 8, 2, 3], ["FSP", 5, 12, 3, 3], ["RE", 5, [0, 4, 8, 12, 1, 5, 9, 13, 2, 6, 10, 14, 3, 7, 11, 15]], ["CA", 3, 5, 11], ["CHR", 2, "shared", [3]], ["CA", 3, 4, 14], ["CHR", 1, "shared", [4]], ["CA", 2, 5, 14], ["CI", 1], ["FU", 7, [0, 1, 2, 3]], ["AN", 7, 0, 5], ["FU", 7, [1, 2, 3, 4]], ["AN", 7, 1, 4], ["FU", 7, [2, 3, 4, 5]], ["AN", 7, 2, 6], ["FU", 4, [0, 1, 2, 3]], ["SP", 4, 0, 16, [4], 1], ["AN", 4, 1, 2], ["FFSP", 4, 0, [3, 2, 1, 0], 1, 1], ["AN", 4, 1, 6], ["FU", 2, [0, 1, 2, 3]], ["SP", 2, 0, 66, [22], 1], ["AN", 2, 1, 2], ["FFSP", 2, 0, [3, 2, 1, 0], 1, 1], ["AN", 2, 1, 6], ["PR", 5, 0, "auto_unroll_max_step$64"]]]], "r": [[0.0894934, 0.0893514, 0.0893656], 0, 10.2474, 1630555409], "v": "v0.6"}
{"i": [["[\"39e4bafedfe85ad162fcb6a68723e5cd\", 1, 2, 320, 240, 2, 2, 4, 4, 1, 2, 1, 1, 1, 2, 640, 480]", "opencl -keys=opencl,gpu -max_num_threads=256 -thread_warp_size=1", [2, 16, 64, 4096, 409600, 512, 2, 2], "llvm -keys=cpu -link-params=0 -mtriple=aarch64-linux-gnu", 0, []], [[], [["SP", 3, 0, 1, [1, 1, 1, 1], 1], ["SP", 3, 5, 2, [1, 1, 1, 1], 1], ["SP", 3, 10, 640, [1, 2, 1, 1], 1], ["SP", 3, 15, 480, [1, 16, 5, 1], 1], ["SP", 3, 20, 2, [1, 1], 1], ["SP", 3, 23, 4, [2, 2], 1], ["SP", 3, 26, 4, [1, 1], 1], ["RE", 3, [0, 5, 10, 15, 1, 6, 11, 16, 2, 7, 12, 17, 20, 23, 26, 21, 24, 27, 3, 8, 13, 18, 22, 25, 28, 4, 9, 14, 19]], ["FSP", 5, 0, 0, 3], ["FSP", 5, 4, 1, 3], ["FSP", 5, 8, 2, 3], ["FSP", 5, 12, 3, 3], ["RE", 5, [0, 4, 8, 12, 1, 5, 9, 13, 2, 6, 10, 14, 3, 7, 11, 15]], ["CA", 3, 5, 11], ["CHR", 2, "shared", [3]], ["CA", 3, 4, 14], ["CHR", 1, "shared", [4]], ["CA", 2, 5, 14], ["CI", 1], ["FU", 7, [0, 1, 2, 3]], ["AN", 7, 0, 5], ["FU", 7, [1, 2, 3, 4]], ["AN", 7, 1, 4], ["FU", 7, [2, 3, 4, 5]], ["AN", 7, 2, 6], ["FU", 4, [0, 1, 2, 3]], ["SP", 4, 0, 8, [1], 1], ["AN", 4, 1, 2], ["FFSP", 4, 0, [3, 2, 1, 0], 1, 1], ["AN", 4, 1, 6], ["FU", 2, [0, 1, 2, 3]], ["SP", 2, 0, 24, [1], 1], ["AN", 2, 1, 2], ["FFSP", 2, 0, [3, 2, 1, 0], 1, 1], ["AN", 2, 1, 6], ["PR", 5, 0, "auto_unroll_max_step$0"]]]], "r": [[0.0313363, 0.0336611, 0.0316552], 0, 8.18113, 1630555417], "v": "v0.6"}
{"i": [["[\"39e4bafedfe85ad162fcb6a68723e5cd\", 1, 2, 320, 240, 2, 2, 4, 4, 1, 2, 1, 1, 1, 2, 640, 480]", "opencl -keys=opencl,gpu -max_num_threads=256 -thread_warp_size=1", [2, 16, 64, 4096, 409600, 512, 2, 2], "llvm -keys=cpu -link-params=0 -mtriple=aarch64-linux-gnu", 0, []], [[], [["SP", 3, 0, 1, [1, 1, 1, 1], 1], ["SP", 3, 5, 2, [1, 1, 1, 1], 1], ["SP", 3, 10, 640, [1, 1, 8, 1], 1], ["SP", 3, 15, 480, [1, 10, 1, 2], 1], ["SP", 3, 20, 2, [2, 1], 1], ["SP", 3, 23, 4, [1, 4], 1], ["SP", 3, 26, 4, [1, 2], 1], ["RE", 3, [0, 5, 10, 15, 1, 6, 11, 16, 2, 7, 12, 17, 20, 23, 26, 21, 24, 27, 3, 8, 13, 18, 22, 25, 28, 4, 9, 14, 19]], ["FSP", 5, 0, 0, 3], ["FSP", 5, 4, 1, 3], ["FSP", 5, 8, 2, 3], ["FSP", 5, 12, 3, 3], ["RE", 5, [0, 4, 8, 12, 1, 5, 9, 13, 2, 6, 10, 14, 3, 7, 11, 15]], ["CA", 3, 5, 11], ["CHR", 2, "shared", [3]], ["CA", 3, 4, 14], ["CHR", 1, "shared", [4]], ["CA", 2, 5, 14], ["CI", 1], ["FU", 7, [0, 1, 2, 3]], ["AN", 7, 0, 5], ["FU", 7, [1, 2, 3, 4]], ["AN", 7, 1, 4], ["FU", 7, [2, 3, 4, 5]], ["AN", 7, 2, 6], ["FU", 4, [0, 1, 2, 3]], ["SP", 4, 0, 16, [1], 1], ["AN", 4, 1, 2], ["FFSP", 4, 0, [3, 2, 1, 0], 1, 1], ["AN", 4, 1, 6], ["FU", 2, [0, 1, 2, 3]], ["SP", 2, 0, 66, [1], 1], ["AN", 2, 1, 2], ["FFSP", 2, 0, [3, 2, 1, 0], 1, 1], ["AN", 2, 1, 6], ["PR", 5, 0, "auto_unroll_max_step$0"]]]], "r": [[0.146649, 0.049385, 0.0488811], 0, 9.16414, 1630555476], "v": "v0.6"}
{"i": [["[\"39e4bafedfe85ad162fcb6a68723e5cd\", 1, 2, 320, 240, 2, 2, 4, 4, 1, 2, 1, 1, 1, 2, 640, 480]", "opencl -keys=opencl,gpu -max_num_threads=256 -thread_warp_size=1", [2, 16, 64, 4096, 409600, 512, 2, 2], "llvm -keys=cpu -link-params=0 -mtriple=aarch64-linux-gnu", 0, []], [[], [["SP", 3, 0, 1, [1, 1, 1, 1], 1], ["SP", 3, 5, 2, [1, 1, 1, 2], 1], ["SP", 3, 10, 640, [1, 5, 2, 1], 1], ["SP", 3, 15, 480, [2, 6, 1, 1], 1], ["SP", 3, 20, 2, [2, 1], 1], ["SP", 3, 23, 4, [2, 1], 1], ["SP", 3, 26, 4, [1, 1], 1], ["RE", 3, [0, 5, 10, 15, 1, 6, 11, 16, 2, 7, 12, 17, 20, 23, 26, 21, 24, 27, 3, 8, 13, 18, 22, 25, 28, 4, 9, 14, 19]], ["FSP", 5, 0, 0, 3], ["FSP", 5, 4, 1, 3], ["FSP", 5, 8, 2, 3], ["FSP", 5, 12, 3, 3], ["RE", 5, [0, 4, 8, 12, 1, 5, 9, 13, 2, 6, 10, 14, 3, 7, 11, 15]], ["CA", 3, 5, 11], ["CHR", 2, "shared", [3]], ["CA", 3, 4, 14], ["CHR", 1, "shared", [4]], ["CA", 2, 5, 14], ["CI", 1], ["FU", 7, [0, 1, 2, 3]], ["AN", 7, 0, 5], ["FU", 7, [1, 2, 3, 4]], ["AN", 7, 1, 4], ["FU", 7, [2, 3, 4, 5]], ["AN", 7, 2, 6], ["FU", 4, [0, 1, 2, 3]], ["SP", 4, 0, 16, [1], 1], ["AN", 4, 1, 2], ["FFSP", 4, 0, [3, 2, 1, 0], 1, 1], ["AN", 4, 1, 6], ["FU", 2, [0, 1, 2, 3]], ["SP", 2, 0, 12, [1], 1], ["AN", 2, 1, 2], ["FFSP", 2, 0, [3, 2, 1, 0], 1, 1], ["AN", 2, 1, 6], ["PR", 5, 0, "auto_unroll_max_step$64"]]]], "r": [[0.00887211, 0.00886006, 0.00883119], 0, 8.50167, 1630555485], "v": "v0.6"}
{"i": [["[\"39e4bafedfe85ad162fcb6a68723e5cd\", 1, 2, 320, 240, 2, 2, 4, 4, 1, 2, 1, 1, 1, 2, 640, 480]", "opencl -keys=opencl,gpu -max_num_threads=256 -thread_warp_size=1", [2, 16, 64, 4096, 409600, 512, 2, 2], "llvm -keys=cpu -link-params=0 -mtriple=aarch64-linux-gnu", 0, []], [[], [["SP", 3, 0, 1, [1, 1, 1, 1], 1], ["SP", 3, 5, 2, [1, 1, 2, 1], 1], ["SP", 3, 10, 640, [1, 10, 2, 1], 1], ["SP", 3, 15, 480, [1, 1, 1, 3], 1], ["SP", 3, 20, 2, [2, 1], 1], ["SP", 3, 23, 4, [2, 2], 1], ["SP", 3, 26, 4, [2, 2], 1], ["RE", 3, [0, 5, 10, 15, 1, 6, 11, 16, 2, 7, 12, 17, 20, 23, 26, 21, 24, 27, 3, 8, 13, 18, 22, 25, 28, 4, 9, 14, 19]], ["FSP", 5, 0, 0, 3], ["FSP", 5, 4, 1, 3], ["FSP", 5, 8, 2, 3], ["FSP", 5, 12, 3, 3], ["RE", 5, [0, 4, 8, 12, 1, 5, 9, 13, 2, 6, 10, 14, 3, 7, 11, 15]], ["CA", 3, 5, 11], ["CHR", 2, "shared", [3]], ["CA", 3, 4, 14], ["CHR", 1, "shared", [4]], ["CA", 2, 5, 14], ["CI", 1], ["FU", 7, [0, 1, 2, 3]], ["AN", 7, 0, 5], ["FU", 7, [1, 2, 3, 4]], ["AN", 7, 1, 4], ["FU", 7, [2, 3, 4, 5]], ["AN", 7, 2, 6], ["FU", 4, [0, 1, 2, 3]], ["SP", 4, 0, 64, [1], 1], ["AN", 4, 1, 2], ["FFSP", 4, 0, [3, 2, 1, 0], 1, 1], ["AN", 4, 1, 6], ["FU", 2, [0, 1, 2, 3]], ["SP", 2, 0, 60, [1], 1], ["AN", 2, 1, 2], ["FFSP", 2, 0, [3, 2, 1, 0], 1, 1], ["AN", 2, 1, 6], ["PR", 5, 0, "auto_unroll_max_step$1024"]]]], "r": [[0.0105482, 0.0105304, 0.0104927], 0, 9.1548, 1630555494], "v": "v0.6"}
{"i": [["[\"39e4bafedfe85ad162fcb6a68723e5cd\", 1, 2, 320, 240, 2, 2, 4, 4, 1, 2, 1, 1, 1, 2, 640, 480]", "opencl -keys=opencl,gpu -max_num_threads=256 -thread_warp_size=1", [2, 16, 64, 4096, 409600, 512, 2, 2], "llvm -keys=cpu -link-params=0 -mtriple=aarch64-linux-gnu", 0, []], [[], [["SP", 3, 0, 1, [1, 1, 1, 1], 1], ["SP", 3, 5, 2, [1, 1, 1, 1], 1], ["SP", 3, 10, 640, [1, 8, 1, 1], 1], ["SP", 3, 15, 480, [2, 8, 1, 3], 1], ["SP", 3, 20, 2, [1, 1], 1], ["SP", 3, 23, 4, [4, 1], 1], ["SP", 3, 26, 4, [1, 2], 1], ["RE", 3, [0, 5, 10, 15, 1, 6, 11, 16, 2, 7, 12, 17, 20, 23, 26, 21, 24, 27, 3, 8, 13, 18, 22, 25, 28, 4, 9, 14, 19]], ["FSP", 5, 0, 0, 3], ["FSP", 5, 4, 1, 3], ["FSP", 5, 8, 2, 3], ["FSP", 5, 12, 3, 3], ["RE", 5, [0, 4, 8, 12, 1, 5, 9, 13, 2, 6, 10, 14, 3, 7, 11, 15]], ["CA", 3, 5, 11], ["CHR", 2, "shared", [3]], ["CA", 3, 4, 14], ["CHR", 1, "shared", [4]], ["CA", 2, 5, 14], ["CI", 1], ["FU", 7, [0, 1, 2, 3]], ["AN", 7, 0, 5], ["FU", 7, [1, 2, 3, 4]], ["AN", 7, 1, 4], ["FU", 7, [2, 3, 4, 5]], ["AN", 7, 2, 6], ["FU", 4, [0, 1, 2, 3]], ["SP", 4, 0, 8, [1], 1], ["AN", 4, 1, 2], ["FFSP", 4, 0, [3, 2, 1, 0], 1, 1], ["AN", 4, 1, 6], ["FU", 2, [0, 1, 2, 3]], ["SP", 2, 0, 16, [16], 1], ["AN", 2, 1, 2], ["FFSP", 2, 0, [3, 2, 1, 0], 1, 1], ["AN", 2, 1, 6], ["PR", 5, 0, "auto_unroll_max_step$64"]]]], "r": [[0.025619, 0.0258272, 0.0257514], 0, 9.01672, 1630555503], "v": "v0.6"}
{"i": [["[\"39e4bafedfe85ad162fcb6a68723e5cd\", 1, 2, 320, 240, 2, 2, 4, 4, 1, 2, 1, 1, 1, 2, 640, 480]", "opencl -keys=opencl,gpu -max_num_threads=256 -thread_warp_size=1", [2, 16, 64, 4096, 409600, 512, 2, 2], "llvm -keys=cpu -link-params=0 -mtriple=aarch64-linux-gnu", 0, []], [[], [["SP", 3, 0, 1, [1, 1, 1, 1], 1], ["SP", 3, 5, 2, [1, 1, 1, 2], 1], ["SP", 3, 10, 640, [1, 1, 8, 1], 1], ["SP", 3, 15, 480, [1, 10, 1, 2], 1], ["SP", 3, 20, 2, [2, 1], 1], ["SP", 3, 23, 4, [1, 4], 1], ["SP", 3, 26, 4, [1, 4], 1], ["RE", 3, [0, 5, 10, 15, 1, 6, 11, 16, 2, 7, 12, 17, 20, 23, 26, 21, 24, 27, 3, 8, 13, 18, 22, 25, 28, 4, 9, 14, 19]], ["FSP", 5, 0, 0, 3], ["FSP", 5, 4, 1, 3], ["FSP", 5, 8, 2, 3], ["FSP", 5, 12, 3, 3], ["RE", 5, [0, 4, 8, 12, 1, 5, 9, 13, 2, 6, 10, 14, 3, 7, 11, 15]], ["CA", 3, 5, 11], ["CHR", 2, "shared", [3]], ["CA", 3, 4, 14], ["CHR", 1, "shared", [4]], ["CA", 2, 5, 14], ["CI", 1], ["FU", 7, [0, 1, 2, 3]], ["AN", 7, 0, 5], ["FU", 7, [1, 2, 3, 4]], ["AN", 7, 1, 4], ["FU", 7, [2, 3, 4, 5]], ["AN", 7, 2, 6], ["FU", 4, [0, 1, 2, 3]], ["SP", 4, 0, 16, [1], 1], ["AN", 4, 1, 2], ["FFSP", 4, 0, [3, 2, 1, 0], 1, 1], ["AN", 4, 1, 6], ["FU", 2, [0, 1, 2, 3]], ["SP", 2, 0, 66, [1], 1], ["AN", 2, 1, 2], ["FFSP", 2, 0, [3, 2, 1, 0], 1, 1], ["AN", 2, 1, 6], ["PR", 5, 0, "auto_unroll_max_step$64"]]]], "r": [[0.0432779, 0.00820972, 0.00876428], 0, 9.35323, 1630555513], "v": "v0.6"}
{"i": [["[\"39e4bafedfe85ad162fcb6a68723e5cd\", 1, 2, 320, 240, 2, 2, 4, 4, 1, 2, 1, 1, 1, 2, 640, 480]", "opencl -keys=opencl,gpu -max_num_threads=256 -thread_warp_size=1", [2, 16, 64, 4096, 409600, 512, 2, 2], "llvm -keys=cpu -link-params=0 -mtriple=aarch64-linux-gnu", 0, []], [[], [["SP", 3, 0, 1, [1, 1, 1, 1], 1], ["SP", 3, 5, 2, [1, 1, 1, 1], 1], ["SP", 3, 10, 640, [4, 2, 1, 1], 1], ["SP", 3, 15, 480, [2, 8, 1, 3], 1], ["SP", 3, 20, 2, [1, 1], 1], ["SP", 3, 23, 4, [4, 1], 1], ["SP", 3, 26, 4, [1, 2], 1], ["RE", 3, [0, 5, 10, 15, 1, 6, 11, 16, 2, 7, 12, 17, 20, 23, 26, 21, 24, 27, 3, 8, 13, 18, 22, 25, 28, 4, 9, 14, 19]], ["FSP", 5, 0, 0, 3], ["FSP", 5, 4, 1, 3], ["FSP", 5, 8, 2, 3], ["FSP", 5, 12, 3, 3], ["RE", 5, [0, 4, 8, 12, 1, 5, 9, 13, 2, 6, 10, 14, 3, 7, 11, 15]], ["CA", 3, 5, 11], ["CHR", 2, "shared", [3]], ["CA", 3, 4, 14], ["CHR", 1, "shared", [4]], ["CA", 2, 5, 14], ["CI", 1], ["FU", 7, [0, 1, 2, 3]], ["AN", 7, 0, 5], ["FU", 7, [1, 2, 3, 4]], ["AN", 7, 1, 4], ["FU", 7, [2, 3, 4, 5]], ["AN", 7, 2, 6], ["FU", 4, [0, 1, 2, 3]], ["SP", 4, 0, 8, [1], 1], ["AN", 4, 1, 2], ["FFSP", 4, 0, [3, 2, 1, 0], 1, 1], ["AN", 4, 1, 6], ["FU", 2, [0, 1, 2, 3]], ["SP", 2, 0, 16, [1], 1], ["AN", 2, 1, 2], ["FFSP", 2, 0, [3, 2, 1, 0], 1, 1], ["AN", 2, 1, 6], ["PR", 5, 0, "auto_unroll_max_step$64"]]]], "r": [[0.0148098, 0.0158405, 0.0149459], 0, 9.20739, 1630555523], "v": "v0.6"}
{"i": [["[\"39e4bafedfe85ad162fcb6a68723e5cd\", 1, 2, 320, 240, 2, 2, 4, 4, 1, 2, 1, 1, 1, 2, 640, 480]", "opencl -keys=opencl,gpu -max_num_threads=256 -thread_warp_size=1", [2, 16, 64, 4096, 409600, 512, 2, 2], "llvm -keys=cpu -link-params=0 -mtriple=aarch64-linux-gnu", 0, []], [[], [["SP", 3, 0, 1, [1, 1, 1, 1], 1], ["SP", 3, 5, 2, [1, 2, 1, 1], 1], ["SP", 3, 10, 640, [1, 1, 10, 1], 1], ["SP", 3, 15, 480, [1, 1, 1, 60], 1], ["SP", 3, 20, 2, [1, 1], 1], ["SP", 3, 23, 4, [2, 2], 1], ["SP", 3, 26, 4, [2, 2], 1], ["RE", 3, [0, 5, 10, 15, 1, 6, 11, 16, 2, 7, 12, 17, 20, 23, 26, 21, 24, 27, 3, 8, 13, 18, 22, 25, 28, 4, 9, 14, 19]], ["FSP", 5, 0, 0, 3], ["FSP", 5, 4, 1, 3], ["FSP", 5, 8, 2, 3], ["FSP", 5, 12, 3, 3], ["RE", 5, [0, 4, 8, 12, 1, 5, 9, 13, 2, 6, 10, 14, 3, 7, 11, 15]], ["CA", 3, 5, 11], ["CHR", 2, "shared", [3]], ["CA", 3, 4, 14], ["CHR", 1, "shared", [4]], ["CA", 2, 5, 14], ["CI", 1], ["FU", 7, [0, 1, 2, 3]], ["AN", 7, 0, 5], ["FU", 7, [1, 2, 3, 4]], ["AN", 7, 1, 4], ["FU", 7, [2, 3, 4, 5]], ["AN", 7, 2, 6], ["FU", 4, [0, 1, 2, 3]], ["SP", 4, 0, 16, [1], 1], ["AN", 4, 1, 2], ["FFSP", 4, 0, [3, 2, 1, 0], 1, 1], ["AN", 4, 1, 6], ["FU", 2, [0, 1, 2, 3]], ["SP", 2, 0, 169, [1], 1], ["AN", 2, 1, 2], ["FFSP", 2, 0, [3, 2, 1, 0], 1, 1], ["AN", 2, 1, 6], ["PR", 5, 0, "auto_unroll_max_step$16"]]]], "r": [[0.725975, 0.672861, 0.687878], 0, 15.6908, 1630555589], "v": "v0.6"}
{"i": [["[\"39e4bafedfe85ad162fcb6a68723e5cd\", 1, 2, 320, 240, 2, 2, 4, 4, 1, 2, 1, 1, 1, 2, 640, 480]", "opencl -keys=opencl,gpu -max_num_threads=256 -thread_warp_size=1", [2, 16, 64, 4096, 409600, 512, 2, 2], "llvm -keys=cpu -link-params=0 -mtriple=aarch64-linux-gnu", 0, []], [[], [["SP", 3, 0, 1, [1, 1, 1, 1], 1], ["SP", 3, 5, 2, [1, 1, 1, 1], 1], ["SP", 3, 10, 640, [1, 2, 1, 1], 1], ["SP", 3, 15, 480, [2, 2, 3, 20], 1], ["SP", 3, 20, 2, [1, 2], 1], ["SP", 3, 23, 4, [1, 1], 1], ["SP", 3, 26, 4, [1, 4], 1], ["RE", 3, [0, 5, 10, 15, 1, 6, 11, 16, 2, 7, 12, 17, 20, 23, 26, 21, 24, 27, 3, 8, 13, 18, 22, 25, 28, 4, 9, 14, 19]], ["FSP", 5, 0, 0, 3], ["FSP", 5, 4, 1, 3], ["FSP", 5, 8, 2, 3], ["FSP", 5, 12, 3, 3], ["RE", 5, [0, 4, 8, 12, 1, 5, 9, 13, 2, 6, 10, 14, 3, 7, 11, 15]], ["CA", 3, 5, 11], ["CHR", 2, "shared", [3]], ["CA", 3, 4, 14], ["CHR", 1, "shared", [4]], ["CA", 2, 5, 14], ["CI", 1], ["FU", 7, [0, 1, 2, 3]], ["AN", 7, 0, 5], ["FU", 7, [1, 2, 3, 4]], ["AN", 7, 1, 4], ["FU", 7, [2, 3, 4, 5]], ["AN", 7, 2, 6], ["FU", 4, [0, 1, 2, 3]], ["SP", 4, 0, 8, [1], 1], ["AN", 4, 1, 2], ["FFSP", 4, 0, [3, 2, 1, 0], 1, 1], ["AN", 4, 1, 6], ["FU", 2, [0, 1, 2, 3]], ["SP", 2, 0, 126, [6], 1], ["AN", 2, 1, 2], ["FFSP", 2, 0, [3, 2, 1, 0], 1, 1], ["AN", 2, 1, 6], ["PR", 5, 0, "auto_unroll_max_step$1024"]]]], "r": [[0.133295, 0.13159, 0.130561], 0, 22.8781, 1630555611], "v": "v0.6"}
{"i": [["[\"39e4bafedfe85ad162fcb6a68723e5cd\", 1, 2, 320, 240, 2, 2, 4, 4, 1, 2, 1, 1, 1, 2, 640, 480]", "opencl -keys=opencl,gpu -max_num_threads=256 -thread_warp_size=1", [2, 16, 64, 4096, 409600, 512, 2, 2], "llvm -keys=cpu -link-params=0 -mtriple=aarch64-linux-gnu", 0, []], [[], [["SP", 3, 0, 1, [1, 1, 1, 1], 1], ["SP", 3, 5, 2, [1, 1, 1, 1], 1], ["SP", 3, 10, 640, [1, 8, 1, 1], 1], ["SP", 3, 15, 480, [2, 8, 1, 3], 1], ["SP", 3, 20, 2, [1, 1], 1], ["SP", 3, 23, 4, [4, 1], 1], ["SP", 3, 26, 4, [2, 2], 1], ["RE", 3, [0, 5, 10, 15, 1, 6, 11, 16, 2, 7, 12, 17, 20, 23, 26, 21, 24, 27, 3, 8, 13, 18, 22, 25, 28, 4, 9, 14, 19]], ["FSP", 5, 0, 0, 3], ["FSP", 5, 4, 1, 3], ["FSP", 5, 8, 2, 3], ["FSP", 5, 12, 3, 3], ["RE", 5, [0, 4, 8, 12, 1, 5, 9, 13, 2, 6, 10, 14, 3, 7, 11, 15]], ["CA", 3, 5, 11], ["CHR", 2, "shared", [3]], ["CA", 3, 4, 14], ["CHR", 1, "shared", [4]], ["CA", 2, 5, 14], ["CI", 1], ["FU", 7, [0, 1, 2, 3]], ["AN", 7, 0, 5], ["FU", 7, [1, 2, 3, 4]], ["AN", 7, 1, 4], ["FU", 7, [2, 3, 4, 5]], ["AN", 7, 2, 6], ["FU", 4, [0, 1, 2, 3]], ["SP", 4, 0, 8, [4], 1], ["AN", 4, 1, 2], ["FFSP", 4, 0, [3, 2, 1, 0], 1, 1], ["AN", 4, 1, 6], ["FU", 2, [0, 1, 2, 3]], ["SP", 2, 0, 16, [1], 1], ["AN", 2, 1, 2], ["FFSP", 2, 0, [3, 2, 1, 0], 1, 1], ["AN", 2, 1, 6], ["PR", 5, 0, "auto_unroll_max_step$64"]]]], "r": [[0.036212, 0.00494965, 0.00484594], 0, 8.59692, 1630555631], "v": "v0.6"}
{"i": [["[\"39e4bafedfe85ad162fcb6a68723e5cd\", 1, 2, 320, 240, 2, 2, 4, 4, 1, 2, 1, 1, 1, 2, 640, 480]", "opencl -keys=opencl,gpu -max_num_threads=256 -thread_warp_size=1", [2, 16, 64, 4096, 409600, 512, 2, 2], "llvm -keys=cpu -link-params=0 -mtriple=aarch64-linux-gnu", 0, []], [[], [["SP", 3, 0, 1, [1, 1, 1, 1], 1], ["SP", 3, 5, 2, [1, 1, 2, 1], 1], ["SP", 3, 10, 640, [1, 5, 2, 1], 1], ["SP", 3, 15, 480, [2, 6, 1, 1], 1], ["SP", 3, 20, 2, [2, 1], 1], ["SP", 3, 23, 4, [2, 1], 1], ["SP", 3, 26, 4, [2, 1], 1], ["RE", 3, [0, 5, 10, 15, 1, 6, 11, 16, 2, 7, 12, 17, 20, 23, 26, 21, 24, 27, 3, 8, 13, 18, 22, 25, 28, 4, 9, 14, 19]], ["FSP", 5, 0, 0, 3], ["FSP", 5, 4, 1, 3], ["FSP", 5, 8, 2, 3], ["FSP", 5, 12, 3, 3], ["RE", 5, [0, 4, 8, 12, 1, 5, 9, 13, 2, 6, 10, 14, 3, 7, 11, 15]], ["CA", 3, 5, 11], ["CHR", 2, "shared", [3]], ["CA", 3, 4, 14], ["CHR", 1, "shared", [4]], ["CA", 2, 5, 14], ["CI", 1], ["FU", 7, [0, 1, 2, 3]], ["AN", 7, 0, 5], ["FU", 7, [1, 2, 3, 4]], ["AN", 7, 1, 4], ["FU", 7, [2, 3, 4, 5]], ["AN", 7, 2, 6], ["FU", 4, [0, 1, 2, 3]], ["SP", 4, 0, 16, [1], 1], ["AN", 4, 1, 2], ["FFSP", 4, 0, [3, 2, 1, 0], 1, 1], ["AN", 4, 1, 6], ["FU", 2, [0, 1, 2, 3]], ["SP", 2, 0, 12, [1], 1], ["AN", 2, 1, 2], ["FFSP", 2, 0, [3, 2, 1, 0], 1, 1], ["AN", 2, 1, 6], ["PR", 5, 0, "auto_unroll_max_step$64"]]]], "r": [[0.00728197, 0.00721448, 0.00781371], 0, 8.875, 1630555640], "v": "v0.6"}
{"i": [["[\"39e4bafedfe85ad162fcb6a68723e5cd\", 1, 2, 320, 240, 2, 2, 4, 4, 1, 2, 1, 1, 1, 2, 640, 480]", "opencl -keys=opencl,gpu -max_num_threads=256 -thread_warp_size=1", [2, 16, 64, 4096, 409600, 512, 2, 2], "llvm -keys=cpu -link-params=0 -mtriple=aarch64-linux-gnu", 0, []], [[], [["SP", 3, 0, 1, [1, 1, 1, 1], 1], ["SP", 3, 5, 2, [1, 1, 2, 1], 1], ["SP", 3, 10, 640, [2, 2, 2, 1], 1], ["SP", 3, 15, 480, [1, 4, 5, 2], 1], ["SP", 3, 20, 2, [2, 1], 1], ["SP", 3, 23, 4, [2, 1], 1], ["SP", 3, 26, 4, [2, 1], 1], ["RE", 3, [0, 5, 10, 15, 1, 6, 11, 16, 2, 7, 12, 17, 20, 23, 26, 21, 24, 27, 3, 8, 13, 18, 22, 25, 28, 4, 9, 14, 19]], ["FSP", 5, 0, 0, 3], ["FSP", 5, 4, 1, 3], ["FSP", 5, 8, 2, 3], ["FSP", 5, 12, 3, 3], ["RE", 5, [0, 4, 8, 12, 1, 5, 9, 13, 2, 6, 10, 14, 3, 7, 11, 15]], ["CA", 3, 5, 11], ["CHR", 2, "shared", [3]], ["CA", 3, 4, 14], ["CHR", 1, "shared", [4]], ["CA", 2, 5, 14], ["CI", 1], ["FU", 7, [0, 1, 2, 3]], ["AN", 7, 0, 5], ["FU", 7, [1, 2, 3, 4]], ["AN", 7, 1, 4], ["FU", 7, [2, 3, 4, 5]], ["AN", 7, 2, 6], ["FU", 4, [0, 1, 2, 3]], ["SP", 4, 0, 16, [1], 1], ["AN", 4, 1, 2], ["FFSP", 4, 0, [3, 2, 1, 0], 1, 1], ["AN", 4, 1, 6], ["FU", 2, [0, 1, 2, 3]], ["SP", 2, 0, 66, [1], 1], ["AN", 2, 1, 2], ["FFSP", 2, 0, [3, 2, 1, 0], 1, 1], ["AN", 2, 1, 6], ["PR", 5, 0, "auto_unroll_max_step$1024"]]]], "r": [[0.523297, 0.526807, 0.526657], 0, 23.3399, 1630555663], "v": "v0.6"}
{"i": [["[\"39e4bafedfe85ad162fcb6a68723e5cd\", 1, 2, 320, 240, 2, 2, 4, 4, 1, 2, 1, 1, 1, 2, 640, 480]", "opencl -keys=opencl,gpu -max_num_threads=256 -thread_warp_size=1", [2, 16, 64, 4096, 409600, 512, 2, 2], "llvm -keys=cpu -link-params=0 -mtriple=aarch64-linux-gnu", 0, []], [[], [["SP", 3, 0, 1, [1, 1, 1, 1], 1], ["SP", 3, 5, 2, [1, 1, 1, 2], 1], ["SP", 3, 10, 640, [1, 8, 1, 4], 1], ["SP", 3, 15, 480, [1, 2, 6, 2], 1], ["SP", 3, 20, 2, [1, 1], 1], ["SP", 3, 23, 4, [2, 1], 1], ["SP", 3, 26, 4, [4, 1], 1], ["RE", 3, [0, 5, 10, 15, 1, 6, 11, 16, 2, 7, 12, 17, 20, 23, 26, 21, 24, 27, 3, 8, 13, 18, 22, 25, 28, 4, 9, 14, 19]], ["FSP", 5, 0, 0, 3], ["FSP", 5, 4, 1, 3], ["FSP", 5, 8, 2, 3], ["FSP", 5, 12, 3, 3], ["RE", 5, [0, 4, 8, 12, 1, 5, 9, 13, 2, 6, 10, 14, 3, 7, 11, 15]], ["CA", 3, 5, 11], ["CHR", 2, "shared", [3]], ["CA", 3, 4, 14], ["CHR", 1, "shared", [4]], ["CA", 2, 5, 14], ["CI", 1], ["FU", 7, [0, 1, 2, 3]], ["AN", 7, 0, 5], ["FU", 7, [1, 2, 3, 4]], ["AN", 7, 1, 4], ["FU", 7, [2, 3, 4, 5]], ["AN", 7, 2, 6], ["FU", 4, [0, 1, 2, 3]], ["SP", 4, 0, 16, [1], 1], ["AN", 4, 1, 2], ["FFSP", 4, 0, [3, 2, 1, 0], 1, 1], ["AN", 4, 1, 6], ["FU", 2, [0, 1, 2, 3]], ["SP", 2, 0, 75, [25], 1], ["AN", 2, 1, 2], ["FFSP", 2, 0, [3, 2, 1, 0], 1, 1], ["AN", 2, 1, 6], ["PR", 5, 0, "auto_unroll_max_step$64"]]]], "r": [[0.208178, 0.0990437, 0.0287779], 0, 13.1993, 1630555680], "v": "v0.6"}
{"i": [["[\"39e4bafedfe85ad162fcb6a68723e5cd\", 1, 2, 320, 240, 2, 2, 4, 4, 1, 2, 1, 1, 1, 2, 640, 480]", "opencl -keys=opencl,gpu -max_num_threads=256 -thread_warp_size=1", [2, 16, 64, 4096, 409600, 512, 2, 2], "llvm -keys=cpu -link-params=0 -mtriple=aarch64-linux-gnu", 0, []], [[], [["SP", 3, 0, 1, [1, 1, 1, 1], 1], ["SP", 3, 5, 2, [1, 2, 1, 1], 1], ["SP", 3, 10, 640, [1, 20, 2, 1], 1], ["SP", 3, 15, 480, [2, 1, 2, 4], 1], ["SP", 3, 20, 2, [1, 1], 1], ["SP", 3, 23, 4, [4, 1], 1], ["SP", 3, 26, 4, [2, 1], 1], ["RE", 3, [0, 5, 10, 15, 1, 6, 11, 16, 2, 7, 12, 17, 20, 23, 26, 21, 24, 27, 3, 8, 13, 18, 22, 25, 28, 4, 9, 14, 19]], ["FSP", 5, 0, 0, 3], ["FSP", 5, 4, 1, 3], ["FSP", 5, 8, 2, 3], ["FSP", 5, 12, 3, 3], ["RE", 5, [0, 4, 8, 12, 1, 5, 9, 13, 2, 6, 10, 14, 3, 7, 11, 15]], ["CA", 3, 5, 11], ["CHR", 2, "shared", [3]], ["CA", 3, 4, 14], ["CHR", 1, "shared", [4]], ["CA", 2, 5, 14], ["CI", 1], ["FU", 7, [0, 1, 2, 3]], ["AN", 7, 0, 5], ["FU", 7, [1, 2, 3, 4]], ["AN", 7, 1, 4], ["FU", 7, [2, 3, 4, 5]], ["AN", 7, 2, 6], ["FU", 4, [0, 1, 2, 3]], ["SP", 4, 0, 8, [1], 1], ["AN", 4, 1, 2], ["FFSP", 4, 0, [3, 2, 1, 0], 1, 1], ["AN", 4, 1, 6], ["FU", 2, [0, 1, 2, 3]], ["SP", 2, 0, 99, [1], 1], ["AN", 2, 1, 2], ["FFSP", 2, 0, [3, 2, 1, 0], 1, 1], ["AN", 2, 1, 6], ["PR", 5, 0, "auto_unroll_max_step$16"]]]], "r": [[0.00797303, 0.008506, 0.00807385], 0, 8.49718, 1630555691], "v": "v0.6"}
{"i": [["[\"39e4bafedfe85ad162fcb6a68723e5cd\", 1, 2, 320, 240, 2, 2, 4, 4, 1, 2, 1, 1, 1, 2, 640, 480]", "opencl -keys=opencl,gpu -max_num_threads=256 -thread_warp_size=1", [2, 16, 64, 4096, 409600, 512, 2, 2], "llvm -keys=cpu -link-params=0 -mtriple=aarch64-linux-gnu", 0, []], [[], [["SP", 3, 0, 1, [1, 1, 1, 1], 1], ["SP", 3, 5, 2, [1, 1, 1, 1], 1], ["SP", 3, 10, 640, [1, 10, 1, 2], 1], ["SP", 3, 15, 480, [1, 2, 1, 8], 1], ["SP", 3, 20, 2, [1, 2], 1], ["SP", 3, 23, 4, [1, 4], 1], ["SP", 3, 26, 4, [1, 4], 1], ["RE", 3, [0, 5, 10, 15, 1, 6, 11, 16, 2, 7, 12, 17, 20, 23, 26, 21, 24, 27, 3, 8, 13, 18, 22, 25, 28, 4, 9, 14, 19]], ["FSP", 5, 0, 0, 3], ["FSP", 5, 4, 1, 3], ["FSP", 5, 8, 2, 3], ["FSP", 5, 12, 3, 3], ["RE", 5, [0, 4, 8, 12, 1, 5, 9, 13, 2, 6, 10, 14, 3, 7, 11, 15]], ["CA", 3, 5, 11], ["CHR", 2, "shared", [3]], ["CA", 3, 4, 14], ["CHR", 1, "shared", [4]], ["CA", 2, 5, 14], ["CI", 1], ["FU", 7, [0, 1, 2, 3]], ["AN", 7, 0, 5], ["FU", 7, [1, 2, 3, 4]], ["AN", 7, 1, 4], ["FU", 7, [2, 3, 4, 5]], ["AN", 7, 2, 6], ["FU", 4, [0, 1, 2, 3]], ["SP", 4, 0, 64, [1], 1], ["AN", 4, 1, 2], ["FFSP", 4, 0, [3, 2, 1, 0], 1, 1], ["AN", 4, 1, 6], ["FU", 2, [0, 1, 2, 3]], ["SP", 2, 0, 110, [1], 1], ["AN", 2, 1, 2], ["FFSP", 2, 0, [3, 2, 1, 0], 1, 1], ["AN", 2, 1, 6], ["PR", 5, 0, "auto_unroll_max_step$64"]]]], "r": [[0.0156487, 0.0154769, 0.0156968], 0, 9.73376, 1630555701], "v": "v0.6"}
{"i": [["[\"39e4bafedfe85ad162fcb6a68723e5cd\", 1, 2, 320, 240, 2, 2, 4, 4, 1, 2, 1, 1, 1, 2, 640, 480]", "opencl -keys=opencl,gpu -max_num_threads=256 -thread_warp_size=1", [2, 16, 64, 4096, 409600, 512, 2, 2], "llvm -keys=cpu -link-params=0 -mtriple=aarch64-linux-gnu", 0, []], [[], [["SP", 3, 0, 1, [1, 1, 1, 1], 1], ["SP", 3, 5, 2, [1, 1, 1, 2], 1], ["SP", 3, 10, 640, [1, 2, 1, 1], 1], ["SP", 3, 15, 480, [2, 2, 3, 20], 1], ["SP", 3, 20, 2, [2, 1], 1], ["SP", 3, 23, 4, [1, 1], 1], ["SP", 3, 26, 4, [1, 4], 1], ["RE", 3, [0, 5, 10, 15, 1, 6, 11, 16, 2, 7, 12, 17, 20, 23, 26, 21, 24, 27, 3, 8, 13, 18, 22, 25, 28, 4, 9, 14, 19]], ["FSP", 5, 0, 0, 3], ["FSP", 5, 4, 1, 3], ["FSP", 5, 8, 2, 3], ["FSP", 5, 12, 3, 3], ["RE", 5, [0, 4, 8, 12, 1, 5, 9, 13, 2, 6, 10, 14, 3, 7, 11, 15]], ["CA", 3, 5, 11], ["CHR", 2, "shared", [3]], ["CA", 3, 4, 14], ["CHR", 1, "shared", [4]], ["CA", 2, 5, 14], ["CI", 1], ["FU", 7, [0, 1, 2, 3]], ["AN", 7, 0, 5], ["FU", 7, [1, 2, 3, 4]], ["AN", 7, 1, 4], ["FU", 7, [2, 3, 4, 5]], ["AN", 7, 2, 6], ["FU", 4, [0, 1, 2, 3]], ["SP", 4, 0, 8, [1], 1], ["AN", 4, 1, 2], ["FFSP", 4, 0, [3, 2, 1, 0], 1, 1], ["AN", 4, 1, 6], ["FU", 2, [0, 1, 2, 3]], ["SP", 2, 0, 126, [18], 1], ["AN", 2, 1, 2], ["FFSP", 2, 0, [3, 2, 1, 0], 1, 1], ["AN", 2, 1, 6], ["PR", 5, 0, "auto_unroll_max_step$16"]]]], "r": [[0.354855, 0.344644, 0.340291], 0, 12.6975, 1630555714], "v": "v0.6"}
{"i": [["[\"39e4bafedfe85ad162fcb6a68723e5cd\", 1, 2, 320, 240, 2, 2, 4, 4, 1, 2, 1, 1, 1, 2, 640, 480]", "opencl -keys=opencl,gpu -max_num_threads=256 -thread_warp_size=1", [2, 16, 64, 4096, 409600, 512, 2, 2], "llvm -keys=cpu -link-params=0 -mtriple=aarch64-linux-gnu", 0, []], [[], [["SP", 3, 0, 1, [1, 1, 1, 1], 1], ["SP", 3, 5, 2, [1, 2, 1, 1], 1], ["SP", 3, 10, 640, [1, 1, 8, 2], 1], ["SP", 3, 15, 480, [1, 1, 12, 2], 1], ["SP", 3, 20, 2, [1, 1], 1], ["SP", 3, 23, 4, [2, 1], 1], ["SP", 3, 26, 4, [1, 4], 1], ["RE", 3, [0, 5, 10, 15, 1, 6, 11, 16, 2, 7, 12, 17, 20, 23, 26, 21, 24, 27, 3, 8, 13, 18, 22, 25, 28, 4, 9, 14, 19]], ["FSP", 5, 0, 0, 3], ["FSP", 5, 4, 1, 3], ["FSP", 5, 8, 2, 3], ["FSP", 5, 12, 3, 3], ["RE", 5, [0, 4, 8, 12, 1, 5, 9, 13, 2, 6, 10, 14, 3, 7, 11, 15]], ["CA", 3, 5, 11], ["CHR", 2, "shared", [3]], ["CA", 3, 4, 14], ["CHR", 1, "shared", [4]], ["CA", 2, 5, 14], ["CI", 1], ["FU", 7, [0, 1, 2, 3]], ["AN", 7, 0, 5], ["FU", 7, [1, 2, 3, 4]], ["AN", 7, 1, 4], ["FU", 7, [2, 3, 4, 5]], ["AN", 7, 2, 6], ["FU", 4, [0, 1, 2, 3]], ["SP", 4, 0, 16, [4], 1], ["AN", 4, 1, 2], ["FFSP", 4, 0, [3, 2, 1, 0], 1, 1], ["AN", 4, 1, 6], ["FU", 2, [0, 1, 2, 3]], ["SP", 2, 0, 513, [1], 1], ["AN", 2, 1, 2], ["FFSP", 2, 0, [3, 2, 1, 0], 1, 1], ["AN", 2, 1, 6], ["PR", 5, 0, "auto_unroll_max_step$0"]]]], "r": [[0.0945208, 0.0948457, 0.0923591], 0, 9.45947, 1630555723], "v": "v0.6"}
{"i": [["[\"39e4bafedfe85ad162fcb6a68723e5cd\", 1, 2, 320, 240, 2, 2, 4, 4, 1, 2, 1, 1, 1, 2, 640, 480]", "opencl -keys=opencl,gpu -max_num_threads=256 -thread_warp_size=1", [2, 16, 64, 4096, 409600, 512, 2, 2], "llvm -keys=cpu -link-params=0 -mtriple=aarch64-linux-gnu", 0, []], [[], [["SP", 3, 0, 1, [1, 1, 1, 1], 1], ["SP", 3, 5, 2, [1, 1, 1, 2], 1], ["SP", 3, 10, 640, [2, 4, 1, 4], 1], ["SP", 3, 15, 480, [1, 2, 6, 2], 1], ["SP", 3, 20, 2, [1, 1], 1], ["SP", 3, 23, 4, [1, 1], 1], ["SP", 3, 26, 4, [4, 1], 1], ["RE", 3, [0, 5, 10, 15, 1, 6, 11, 16, 2, 7, 12, 17, 20, 23, 26, 21, 24, 27, 3, 8, 13, 18, 22, 25, 28, 4, 9, 14, 19]], ["FSP", 5, 0, 0, 3], ["FSP", 5, 4, 1, 3], ["FSP", 5, 8, 2, 3], ["FSP", 5, 12, 3, 3], ["RE", 5, [0, 4, 8, 12, 1, 5, 9, 13, 2, 6, 10, 14, 3, 7, 11, 15]], ["CA", 3, 5, 11], ["CHR", 2, "shared", [3]], ["CA", 3, 4, 14], ["CHR", 1, "shared", [4]], ["CA", 2, 5, 14], ["CI", 1], ["FU", 7, [0, 1, 2, 3]], ["AN", 7, 0, 5], ["FU", 7, [1, 2, 3, 4]], ["AN", 7, 1, 4], ["FU", 7, [2, 3, 4, 5]], ["AN", 7, 2, 6], ["FU", 4, [0, 1, 2, 3]], ["SP", 4, 0, 16, [1], 1], ["AN", 4, 1, 2], ["FFSP", 4, 0, [3, 2, 1, 0], 1, 1], ["AN", 4, 1, 6], ["FU", 2, [0, 1, 2, 3]], ["SP", 2, 0, 75, [25], 1], ["AN", 2, 1, 2], ["FFSP", 2, 0, [3, 2, 1, 0], 1, 1], ["AN", 2, 1, 6], ["PR", 5, 0, "auto_unroll_max_step$64"]]]], "r": [[0.0955829, 0.0937881, 0.0932367], 0, 12.7023, 1630555736], "v": "v0.6"}
{"i": [["[\"39e4bafedfe85ad162fcb6a68723e5cd\", 1, 2, 320, 240, 2, 2, 4, 4, 1, 2, 1, 1, 1, 2, 640, 480]", "opencl -keys=opencl,gpu -max_num_threads=256 -thread_warp_size=1", [2, 16, 64, 4096, 409600, 512, 2, 2], "llvm -keys=cpu -link-params=0 -mtriple=aarch64-linux-gnu", 0, []], [[], [["SP", 3, 0, 1, [1, 1, 1, 1], 1], ["SP", 3, 5, 2, [1, 1, 2, 1], 1], ["SP", 3, 10, 640, [1, 5, 1, 1], 1], ["SP", 3, 15, 480, [2, 6, 1, 1], 1], ["SP", 3, 20, 2, [2, 1], 1], ["SP", 3, 23, 4, [2, 1], 1], ["SP", 3, 26, 4, [2, 1], 1], ["RE", 3, [0, 5, 10, 15, 1, 6, 11, 16, 2, 7, 12, 17, 20, 23, 26, 21, 24, 27, 3, 8, 13, 18, 22, 25, 28, 4, 9, 14, 19]], ["FSP", 5, 0, 0, 3], ["FSP", 5, 4, 1, 3], ["FSP", 5, 8, 2, 3], ["FSP", 5, 12, 3, 3], ["RE", 5, [0, 4, 8, 12, 1, 5, 9, 13, 2, 6, 10, 14, 3, 7, 11, 15]], ["CA", 3, 5, 11], ["CHR", 2, "shared", [3]], ["CA", 3, 4, 14], ["CHR", 1, "shared", [4]], ["CA", 2, 5, 14], ["CI", 1], ["FU", 7, [0, 1, 2, 3]], ["AN", 7, 0, 5], ["FU", 7, [1, 2, 3, 4]], ["AN", 7, 1, 4], ["FU", 7, [2, 3, 4, 5]], ["AN", 7, 2, 6], ["FU", 4, [0, 1, 2, 3]], ["SP", 4, 0, 16, [1], 1], ["AN", 4, 1, 2], ["FFSP", 4, 0, [3, 2, 1, 0], 1, 1], ["AN", 4, 1, 6], ["FU", 2, [0, 1, 2, 3]], ["SP", 2, 0, 12, [1], 1], ["AN", 2, 1, 2], ["FFSP", 2, 0, [3, 2, 1, 0], 1, 1], ["AN", 2, 1, 6], ["PR", 5, 0, "auto_unroll_max_step$64"]]]], "r": [[0.00741106, 0.00738508, 0.00723298], 0, 8.47572, 1630555746], "v": "v0.6"}
{"i": [["[\"39e4bafedfe85ad162fcb6a68723e5cd\", 1, 2, 320, 240, 2, 2, 4, 4, 1, 2, 1, 1, 1, 2, 640, 480]", "opencl -keys=opencl,gpu -max_num_threads=256 -thread_warp_size=1", [2, 16, 64, 4096, 409600, 512, 2, 2], "llvm -keys=cpu -link-params=0 -mtriple=aarch64-linux-gnu", 0, []], [[], [["SP", 3, 0, 1, [1, 1, 1, 1], 1], ["SP", 3, 5, 2, [2, 1, 1, 1], 1], ["SP", 3, 10, 640, [2, 1, 1, 5], 1], ["SP", 3, 15, 480, [1, 2, 4, 4], 1], ["SP", 3, 20, 2, [2, 1], 1], ["SP", 3, 23, 4, [1, 2], 1], ["SP", 3, 26, 4, [1, 2], 1], ["RE", 3, [0, 5, 10, 15, 1, 6, 11, 16, 2, 7, 12, 17, 20, 23, 26, 21, 24, 27, 3, 8, 13, 18, 22, 25, 28, 4, 9, 14, 19]], ["FSP", 5, 0, 0, 3], ["FSP", 5, 4, 1, 3], ["FSP", 5, 8, 2, 3], ["FSP", 5, 12, 3, 3], ["RE", 5, [0, 4, 8, 12, 1, 5, 9, 13, 2, 6, 10, 14, 3, 7, 11, 15]], ["CA", 3, 5, 11], ["CHR", 2, "shared", [3]], ["CA", 3, 4, 14], ["CHR", 1, "shared", [4]], ["CA", 2, 5, 14], ["CI", 1], ["FU", 7, [0, 1, 2, 3]], ["AN", 7, 0, 5], ["FU", 7, [1, 2, 3, 4]], ["AN", 7, 1, 4], ["FU", 7, [2, 3, 4, 5]], ["AN", 7, 2, 6], ["FU", 4, [0, 1, 2, 3]], ["SP", 4, 0, 8, [1], 1], ["AN", 4, 1, 2], ["FFSP", 4, 0, [3, 2, 1, 0], 1, 1], ["AN", 4, 1, 6], ["FU", 2, [0, 1, 2, 3]], ["SP", 2, 0, 396, [1], 1], ["AN", 2, 1, 2], ["FFSP", 2, 0, [3, 2, 1, 0], 1, 1], ["AN", 2, 1, 6], ["PR", 5, 0, "auto_unroll_max_step$0"]]]], "r": [[0.719629, 0.689595, 0.678728], 0, 16.6187, 1630555763], "v": "v0.6"}
{"i": [["[\"39e4bafedfe85ad162fcb6a68723e5cd\", 1, 2, 320, 240, 2, 2, 4, 4, 1, 2, 1, 1, 1, 2, 640, 480]", "opencl -keys=opencl,gpu -max_num_threads=256 -thread_warp_size=1", [2, 16, 64, 4096, 409600, 512, 2, 2], "llvm -keys=cpu -link-params=0 -mtriple=aarch64-linux-gnu", 0, []], [[], [["SP", 3, 0, 1, [1, 1, 1, 1], 1], ["SP", 3, 5, 2, [1, 1, 1, 2], 1], ["SP", 3, 10, 640, [1, 1, 8, 4], 1], ["SP", 3, 15, 480, [1, 2, 6, 2], 1], ["SP", 3, 20, 2, [1, 1], 1], ["SP", 3, 23, 4, [2, 1], 1], ["SP", 3, 26, 4, [1, 1], 1], ["RE", 3, [0, 5, 10, 15, 1, 6, 11, 16, 2, 7, 12, 17, 20, 23, 26, 21, 24, 27, 3, 8, 13, 18, 22, 25, 28, 4, 9, 14, 19]], ["FSP", 5, 0, 0, 3], ["FSP", 5, 4, 1, 3], ["FSP", 5, 8, 2, 3], ["FSP", 5, 12, 3, 3], ["RE", 5, [0, 4, 8, 12, 1, 5, 9, 13, 2, 6, 10, 14, 3, 7, 11, 15]], ["CA", 3, 5, 11], ["CHR", 2, "shared", [3]], ["CA", 3, 4, 14], ["CHR", 1, "shared", [4]], ["CA", 2, 5, 14], ["CI", 1], ["FU", 7, [0, 1, 2, 3]], ["AN", 7, 0, 5], ["FU", 7, [1, 2, 3, 4]], ["AN", 7, 1, 4], ["FU", 7, [2, 3, 4, 5]], ["AN", 7, 2, 6], ["FU", 4, [0, 1, 2, 3]], ["SP", 4, 0, 16, [1], 1], ["AN", 4, 1, 2], ["FFSP", 4, 0, [3, 2, 1, 0], 1, 1], ["AN", 4, 1, 6], ["FU", 2, [0, 1, 2, 3]], ["SP", 2, 0, 75, [1], 1], ["AN", 2, 1, 2], ["FFSP", 2, 0, [3, 2, 1, 0], 1, 1], ["AN", 2, 1, 6], ["PR", 5, 0, "auto_unroll_max_step$64"]]]], "r": [[0.936066, 1.03832, 0.917435], 0, 19.7729, 1630555832], "v": "v0.6"}
{"i": [["[\"39e4bafedfe85ad162fcb6a68723e5cd\", 1, 2, 320, 240, 2, 2, 4, 4, 1, 2, 1, 1, 1, 2, 640, 480]", "opencl -keys=opencl,gpu -max_num_threads=256 -thread_warp_size=1", [2, 16, 64, 4096, 409600, 512, 2, 2], "llvm -keys=cpu -link-params=0 -mtriple=aarch64-linux-gnu", 0, []], [[], [["SP", 3, 0, 1, [1, 1, 1, 1], 1], ["SP", 3, 5, 2, [1, 1, 2, 1], 1], ["SP", 3, 10, 640, [1, 10, 2, 1], 1], ["SP", 3, 15, 480, [1, 1, 1, 3], 1], ["SP", 3, 20, 2, [2, 1], 1], ["SP", 3, 23, 4, [1, 4], 1], ["SP", 3, 26, 4, [2, 2], 1], ["RE", 3, [0, 5, 10, 15, 1, 6, 11, 16, 2, 7, 12, 17, 20, 23, 26, 21, 24, 27, 3, 8, 13, 18, 22, 25, 28, 4, 9, 14, 19]], ["FSP", 5, 0, 0, 3], ["FSP", 5, 4, 1, 3], ["FSP", 5, 8, 2, 3], ["FSP", 5, 12, 3, 3], ["RE", 5, [0, 4, 8, 12, 1, 5, 9, 13, 2, 6, 10, 14, 3, 7, 11, 15]], ["CA", 3, 5, 11], ["CHR", 2, "shared", [3]], ["CA", 3, 4, 14], ["CHR", 1, "shared", [4]], ["CA", 2, 5, 14], ["CI", 1], ["FU", 7, [0, 1, 2, 3]], ["AN", 7, 0, 5], ["FU", 7, [1, 2, 3, 4]], ["AN", 7, 1, 4], ["FU", 7, [2, 3, 4, 5]], ["AN", 7, 2, 6], ["FU", 4, [0, 1, 2, 3]], ["SP", 4, 0, 64, [1], 1], ["AN", 4, 1, 2], ["FFSP", 4, 0, [3, 2, 1, 0], 1, 1], ["AN", 4, 1, 6], ["FU", 2, [0, 1, 2, 3]], ["SP", 2, 0, 60, [1], 1], ["AN", 2, 1, 2], ["FFSP", 2, 0, [3, 2, 1, 0], 1, 1], ["AN", 2, 1, 6], ["PR", 5, 0, "auto_unroll_max_step$1024"]]]], "r": [[0.0769441, 0.0785637, 0.0769731], 0, 9.82419, 1630555842], "v": "v0.6"}
{"i": [["[\"39e4bafedfe85ad162fcb6a68723e5cd\", 1, 2, 320, 240, 2, 2, 4, 4, 1, 2, 1, 1, 1, 2, 640, 480]", "opencl -keys=opencl,gpu -max_num_threads=256 -thread_warp_size=1", [2, 16, 64, 4096, 409600, 512, 2, 2], "llvm -keys=cpu -link-params=0 -mtriple=aarch64-linux-gnu", 0, []], [[], [["SP", 3, 0, 1, [1, 1, 1, 1], 1], ["SP", 3, 5, 2, [1, 2, 1, 1], 1], ["SP", 3, 10, 640, [2, 2, 2, 1], 1], ["SP", 3, 15, 480, [1, 12, 2, 2], 1], ["SP", 3, 20, 2, [1, 1], 1], ["SP", 3, 23, 4, [1, 2], 1], ["SP", 3, 26, 4, [4, 1], 1], ["RE", 3, [0, 5, 10, 15, 1, 6, 11, 16, 2, 7, 12, 17, 20, 23, 26, 21, 24, 27, 3, 8, 13, 18, 22, 25, 28, 4, 9, 14, 19]], ["FSP", 5, 0, 0, 3], ["FSP", 5, 4, 1, 3], ["FSP", 5, 8, 2, 3], ["FSP", 5, 12, 3, 3], ["RE", 5, [0, 4, 8, 12, 1, 5, 9, 13, 2, 6, 10, 14, 3, 7, 11, 15]], ["CA", 3, 5, 11], ["CHR", 2, "shared", [3]], ["CA", 3, 4, 14], ["CHR", 1, "shared", [4]], ["CA", 2, 5, 14], ["CI", 1], ["FU", 7, [0, 1, 2, 3]], ["AN", 7, 0, 5], ["FU", 7, [1, 2, 3, 4]], ["AN", 7, 1, 4], ["FU", 7, [2, 3, 4, 5]], ["AN", 7, 2, 6], ["FU", 4, [0, 1, 2, 3]], ["SP", 4, 0, 16, [1], 1], ["AN", 4, 1, 2], ["FFSP", 4, 0, [3, 2, 1, 0], 1, 1], ["AN", 4, 1, 6], ["FU", 2, [0, 1, 2, 3]], ["SP", 2, 0, 42, [42], 1], ["AN", 2, 1, 2], ["FFSP", 2, 0, [3, 2, 1, 0], 1, 1], ["AN", 2, 1, 6], ["PR", 5, 0, "auto_unroll_max_step$512"]]]], "r": [[0.289403, 0.292, 0.291767], 0, 29.1722, 1630555871], "v": "v0.6"}
{"i": [["[\"39e4bafedfe85ad162fcb6a68723e5cd\", 1, 2, 320, 240, 2, 2, 4, 4, 1, 2, 1, 1, 1, 2, 640, 480]", "opencl -keys=opencl,gpu -max_num_threads=256 -thread_warp_size=1", [2, 16, 64, 4096, 409600, 512, 2, 2], "llvm -keys=cpu -link-params=0 -mtriple=aarch64-linux-gnu", 0, []], [[], [["SP", 3, 0, 1, [1, 1, 1, 1], 1], ["SP", 3, 5, 2, [1, 2, 1, 1], 1], ["SP", 3, 10, 640, [2, 1, 8, 1], 1], ["SP", 3, 15, 480, [1, 8, 2, 1], 1], ["SP", 3, 20, 2, [1, 1], 1], ["SP", 3, 23, 4, [4, 1], 1], ["SP", 3, 26, 4, [2, 1], 1], ["RE", 3, [0, 5, 10, 15, 1, 6, 11, 16, 2, 7, 12, 17, 20, 23, 26, 21, 24, 27, 3, 8, 13, 18, 22, 25, 28, 4, 9, 14, 19]], ["FSP", 5, 0, 0, 3], ["FSP", 5, 4, 1, 3], ["FSP", 5, 8, 2, 3], ["FSP", 5, 12, 3, 3], ["RE", 5, [0, 4, 8, 12, 1, 5, 9, 13, 2, 6, 10, 14, 3, 7, 11, 15]], ["CA", 3, 5, 11], ["CHR", 2, "shared", [3]], ["CA", 3, 4, 14], ["CHR", 1, "shared", [4]], ["CA", 2, 5, 14], ["CI", 1], ["FU", 7, [0, 1, 2, 3]], ["AN", 7, 0, 5], ["FU", 7, [1, 2, 3, 4]], ["AN", 7, 1, 4], ["FU", 7, [2, 3, 4, 5]], ["AN", 7, 2, 6], ["FU", 4, [0, 1, 2, 3]], ["SP", 4, 0, 8, [1], 1], ["AN", 4, 1, 2], ["FFSP", 4, 0, [3, 2, 1, 0], 1, 1], ["AN", 4, 1, 6], ["FU", 2, [0, 1, 2, 3]], ["SP", 2, 0, 55, [1], 1], ["AN", 2, 1, 2], ["FFSP", 2, 0, [3, 2, 1, 0], 1, 1], ["AN", 2, 1, 6], ["PR", 5, 0, "auto_unroll_max_step$512"]]]], "r": [[0.00756055, 0.00750521, 0.0080961], 0, 9.68795, 1630555895], "v": "v0.6"}
{"i": [["[\"39e4bafedfe85ad162fcb6a68723e5cd\", 1, 2, 320, 240, 2, 2, 4, 4, 1, 2, 1, 1, 1, 2, 640, 480]", "opencl -keys=opencl,gpu -max_num_threads=256 -thread_warp_size=1", [2, 16, 64, 4096, 409600, 512, 2, 2], "llvm -keys=cpu -link-params=0 -mtriple=aarch64-linux-gnu", 0, []], [[], [["SP", 3, 0, 1, [1, 1, 1, 1], 1], ["SP", 3, 5, 2, [1, 2, 1, 1], 1], ["SP", 3, 10, 640, [1, 1, 8, 2], 1], ["SP", 3, 15, 480, [1, 3, 8, 1], 1], ["SP", 3, 20, 2, [2, 1], 1], ["SP", 3, 23, 4, [4, 1], 1], ["SP", 3, 26, 4, [1, 1], 1], ["RE", 3, [0, 5, 10, 15, 1, 6, 11, 16, 2, 7, 12, 17, 20, 23, 26, 21, 24, 27, 3, 8, 13, 18, 22, 25, 28, 4, 9, 14, 19]], ["FSP", 5, 0, 0, 3], ["FSP", 5, 4, 1, 3], ["FSP", 5, 8, 2, 3], ["FSP", 5, 12, 3, 3], ["RE", 5, [0, 4, 8, 12, 1, 5, 9, 13, 2, 6, 10, 14, 3, 7, 11, 15]], ["CA", 3, 5, 11], ["CHR", 2, "shared", [3]], ["CA", 3, 4, 14], ["CHR", 1, "shared", [4]], ["CA", 2, 5, 14], ["CI", 1], ["FU", 7, [0, 1, 2, 3]], ["AN", 7, 0, 5], ["FU", 7, [1, 2, 3, 4]], ["AN", 7, 1, 4], ["FU", 7, [2, 3, 4, 5]], ["AN", 7, 2, 6], ["FU", 4, [0, 1, 2, 3]], ["SP", 4, 0, 8, [1], 1], ["AN", 4, 1, 2], ["FFSP", 4, 0, [3, 2, 1, 0], 1, 1], ["AN", 4, 1, 6], ["FU", 2, [0, 1, 2, 3]], ["SP", 2, 0, 176, [1], 1], ["AN", 2, 1, 2], ["FFSP", 2, 0, [3, 2, 1, 0], 1, 1], ["AN", 2, 1, 6], ["PR", 5, 0, "auto_unroll_max_step$512"]]]], "r": [[0.192239, 0.190109, 0.194807], 0, 25.2902, 1630555921], "v": "v0.6"}
{"i": [["[\"39e4bafedfe85ad162fcb6a68723e5cd\", 1, 2, 320, 240, 2, 2, 4, 4, 1, 2, 1, 1, 1, 2, 640, 480]", "opencl -keys=opencl,gpu -max_num_threads=256 -thread_warp_size=1", [2, 16, 64, 4096, 409600, 512, 2, 2], "llvm -keys=cpu -link-params=0 -mtriple=aarch64-linux-gnu", 0, []], [[], [["SP", 3, 0, 1, [1, 1, 1, 1], 1], ["SP", 3, 5, 2, [1, 1, 1, 2], 1], ["SP", 3, 10, 640, [1, 16, 5, 1], 1], ["SP", 3, 15, 480, [1, 1, 1, 6], 1], ["SP", 3, 20, 2, [1, 2], 1], ["SP", 3, 23, 4, [2, 2], 1], ["SP", 3, 26, 4, [1, 1], 1], ["RE", 3, [0, 5, 10, 15, 1, 6, 11, 16, 2, 7, 12, 17, 20, 23, 26, 21, 24, 27, 3, 8, 13, 18, 22, 25, 28, 4, 9, 14, 19]], ["FSP", 5, 0, 0, 3], ["FSP", 5, 4, 1, 3], ["FSP", 5, 8, 2, 3], ["FSP", 5, 12, 3, 3], ["RE", 5, [0, 4, 8, 12, 1, 5, 9, 13, 2, 6, 10, 14, 3, 7, 11, 15]], ["CA", 3, 5, 11], ["CHR", 2, "shared", [3]], ["CA", 3, 4, 14], ["CHR", 1, "shared", [4]], ["CA", 2, 5, 14], ["CI", 1], ["FU", 7, [0, 1, 2, 3]], ["AN", 7, 0, 5], ["FU", 7, [1, 2, 3, 4]], ["AN", 7, 1, 4], ["FU", 7, [2, 3, 4, 5]], ["AN", 7, 2, 6], ["FU", 4, [0, 1, 2, 3]], ["SP", 4, 0, 8, [1], 1], ["AN", 4, 1, 2], ["FFSP", 4, 0, [3, 2, 1, 0], 1, 1], ["AN", 4, 1, 6], ["FU", 2, [0, 1, 2, 3]], ["SP", 2, 0, 48, [48], 1], ["AN", 2, 1, 2], ["FFSP", 2, 0, [3, 2, 1, 0], 1, 1], ["AN", 2, 1, 6], ["PR", 5, 0, "auto_unroll_max_step$512"]]]], "r": [[0.041472, 0.0403281, 0.0406257], 0, 17.8162, 1630555948], "v": "v0.6"}
{"i": [["[\"39e4bafedfe85ad162fcb6a68723e5cd\", 1, 2, 320, 240, 2, 2, 4, 4, 1, 2, 1, 1, 1, 2, 640, 480]", "opencl -keys=opencl,gpu -max_num_threads=256 -thread_warp_size=1", [2, 16, 64, 4096, 409600, 512, 2, 2], "llvm -keys=cpu -link-params=0 -mtriple=aarch64-linux-gnu", 0, []], [[], [["SP", 3, 0, 1, [1, 1, 1, 1], 1], ["SP", 3, 5, 2, [1, 2, 1, 1], 1], ["SP", 3, 10, 640, [1, 1, 40, 2], 1], ["SP", 3, 15, 480, [1, 1, 4, 1], 1], ["SP", 3, 20, 2, [1, 1], 1], ["SP", 3, 23, 4, [2, 1], 1], ["SP", 3, 26, 4, [4, 1], 1], ["RE", 3, [0, 5, 10, 15, 1, 6, 11, 16, 2, 7, 12, 17, 20, 23, 26, 21, 24, 27, 3, 8, 13, 18, 22, 25, 28, 4, 9, 14, 19]], ["FSP", 5, 0, 0, 3], ["FSP", 5, 4, 1, 3], ["FSP", 5, 8, 2, 3], ["FSP", 5, 12, 3, 3], ["RE", 5, [0, 4, 8, 12, 1, 5, 9, 13, 2, 6, 10, 14, 3, 7, 11, 15]], ["CA", 3, 5, 11], ["CHR", 2, "shared", [3]], ["CA", 3, 4, 14], ["CHR", 1, "shared", [4]], ["CA", 2, 5, 14], ["CI", 1], ["FU", 7, [0, 1, 2, 3]], ["AN", 7, 0, 5], ["FU", 7, [1, 2, 3, 4]], ["AN", 7, 1, 4], ["FU", 7, [2, 3, 4, 5]], ["AN", 7, 2, 6], ["FU", 4, [0, 1, 2, 3]], ["SP", 4, 0, 8, [1], 1], ["AN", 4, 1, 2], ["FFSP", 4, 0, [3, 2, 1, 0], 1, 1], ["AN", 4, 1, 6], ["FU", 2, [0, 1, 2, 3]], ["SP", 2, 0, 567, [1], 1], ["AN", 2, 1, 2], ["FFSP", 2, 0, [3, 2, 1, 0], 1, 1], ["AN", 2, 1, 6], ["PR", 5, 0, "auto_unroll_max_step$0"]]]], "r": [[0.318436, 0.315879, 0.318109], 0, 11.483, 1630555969], "v": "v0.6"}
