example_03/model-01-NCHW-B1-opencl-C1000-T21-09-01-18-25.json
{"i": [["[\"3de659bda0b18c5fe8c5c8f8ce54ea9d\", 1, 15, 106, 84, 15, 15, 4, 4, 1, 15, 1, 1, 1, 15, 212, 168, 1, 15, 212, 168]", "opencl -keys=opencl,gpu -max_num_threads=256 -thread_warp_size=1", [2, 16, 64, 4096, 409600, 512, 2, 1], "llvm -keys=cpu -link-params=0 -mtriple=aarch64-linux-gnu", 0, []], [[], [["CI", 5], ["SP", 3, 0, 1, [1, 1, 1, 1], 1], ["SP", 3, 5, 15, [1, 1, 1, 1], 1], ["SP", 3, 10, 212, [1, 1, 1, 1], 1], ["SP", 3, 15, 168, [1, 4, 1, 6], 1], ["SP", 3, 20, 15, [1, 5], 1], ["SP", 3, 23, 4, [4, 1], 1], ["SP", 3, 26, 4, [1, 4], 1], ["RE", 3, [0, 5, 10, 15, 1, 6, 11, 16, 2, 7, 12, 17, 20, 23, 26, 21, 24, 27, 3, 8, 13, 18, 22, 25, 28, 4, 9, 14, 19]], ["FSP", 7, 0, 1, 3], ["FSP", 7, 4, 2, 3], ["FSP", 7, 8, 3, 3], ["FSP", 7, 12, 4, 3], ["RE", 7, [0, 4, 8, 12, 1, 5, 9, 13, 2, 6, 10, 14, 3, 7, 11, 15]], ["CA", 3, 7, 11], ["CHR", 2, "shared", [3]], ["CA", 3, 4, 14], ["CHR", 1, "shared", [4]], ["CA", 2, 5, 14], ["CI", 1], ["FU", 9, [0, 1, 2, 3]], ["AN", 9, 0, 5], ["FU", 9, [1, 2, 3, 4]], ["AN", 9, 1, 4], ["FU", 9, [2, 3, 4, 5]], ["AN", 9, 2, 6], ["FU", 4, [0, 1, 2, 3]], ["SP", 4, 0, 240, [1], 1], ["AN", 4, 1, 2], ["FFSP", 4, 0, [4, 3, 2, 1], 1, 1], ["AN", 4, 1, 6], ["FU", 2, [0, 1, 2, 3]], ["SP", 2, 0, 60, [1], 1], ["AN", 2, 1, 2], ["FFSP", 2, 0, [4, 3, 2, 1], 1, 1], ["AN", 2, 1, 6], ["PR", 5, 0, "auto_unroll_max_step$64"]]]], "r": [[0.689097, 0.690236, 0.689894], 0, 10.3253, 1630492010], "v": "v0.6"}
{"i": [["[\"3de659bda0b18c5fe8c5c8f8ce54ea9d\", 1, 15, 106, 84, 15, 15, 4, 4, 1, 15, 1, 1, 1, 15, 212, 168, 1, 15, 212, 168]", "opencl -keys=opencl,gpu -max_num_threads=256 -thread_warp_size=1", [2, 16, 64, 4096, 409600, 512, 2, 1], "llvm -keys=cpu -link-params=0 -mtriple=aarch64-linux-gnu", 0, []], [[], [["CI", 5], ["SP", 3, 0, 1, [1, 1, 1, 1], 1], ["SP", 3, 5, 15, [1, 3, 1, 1], 1], ["SP", 3, 10, 212, [2, 2, 1, 1], 1], ["SP", 3, 15, 168, [1, 1, 2, 1], 1], ["SP", 3, 20, 15, [1, 15], 1], ["SP", 3, 23, 4, [1, 4], 1], ["SP", 3, 26, 4, [1, 2], 1], ["RE", 3, [0, 5, 10, 15, 1, 6, 11, 16, 2, 7, 12, 17, 20, 23, 26, 21, 24, 27, 3, 8, 13, 18, 22, 25, 28, 4, 9, 14, 19]], ["FSP", 7, 0, 1, 3], ["FSP", 7, 4, 2, 3], ["FSP", 7, 8, 3, 3], ["FSP", 7, 12, 4, 3], ["RE", 7, [0, 4, 8, 12, 1, 5, 9, 13, 2, 6, 10, 14, 3, 7, 11, 15]], ["CA", 3, 7, 11], ["CHR", 2, "shared", [3]], ["CA", 3, 4, 14], ["CHR", 1, "shared", [4]], ["CA", 2, 5, 14], ["CI", 1], ["FU", 9, [0, 1, 2, 3]], ["AN", 9, 0, 5], ["FU", 9, [1, 2, 3, 4]], ["AN", 9, 1, 4], ["FU", 9, [2, 3, 4, 5]], ["AN", 9, 2, 6], ["FU", 4, [0, 1, 2, 3]], ["SP", 4, 0, 8, [1], 1], ["AN", 4, 1, 2], ["FFSP", 4, 0, [4, 3, 2, 1], 1, 1], ["AN", 4, 1, 6], ["FU", 2, [0, 1, 2, 3]], ["SP", 2, 0, 12, [1], 1], ["AN", 2, 1, 2], ["FFSP", 2, 0, [4, 3, 2, 1], 1, 1], ["AN", 2, 1, 6], ["PR", 5, 0, "auto_unroll_max_step$16"]]]], "r": [[0.42439, 0.422147, 0.423031], 0, 12.5853, 1630492022], "v": "v0.6"}
{"i": [["[\"3de659bda0b18c5fe8c5c8f8ce54ea9d\", 1, 15, 106, 84, 15, 15, 4, 4, 1, 15, 1, 1, 1, 15, 212, 168, 1, 15, 212, 168]", "opencl -keys=opencl,gpu -max_num_threads=256 -thread_warp_size=1", [2, 16, 64, 4096, 409600, 512, 2, 1], "llvm -keys=cpu -link-params=0 -mtriple=aarch64-linux-gnu", 0, []], [[], [["CI", 5], ["SP", 3, 0, 1, [1, 1, 1, 1], 1], ["SP", 3, 5, 15, [1, 3, 1, 1], 1], ["SP", 3, 10, 212, [2, 2, 1, 1], 1], ["SP", 3, 15, 168, [1, 1, 2, 1], 1], ["SP", 3, 20, 15, [15, 1], 1], ["SP", 3, 23, 4, [1, 4], 1], ["SP", 3, 26, 4, [1, 2], 1], ["RE", 3, [0, 5, 10, 15, 1, 6, 11, 16, 2, 7, 12, 17, 20, 23, 26, 21, 24, 27, 3, 8, 13, 18, 22, 25, 28, 4, 9, 14, 19]], ["FSP", 7, 0, 1, 3], ["FSP", 7, 4, 2, 3], ["FSP", 7, 8, 3, 3], ["FSP", 7, 12, 4, 3], ["RE", 7, [0, 4, 8, 12, 1, 5, 9, 13, 2, 6, 10, 14, 3, 7, 11, 15]], ["CA", 3, 7, 11], ["CHR", 2, "shared", [3]], ["CA", 3, 4, 14], ["CHR", 1, "shared", [4]], ["CA", 2, 5, 14], ["CI", 1], ["FU", 9, [0, 1, 2, 3]], ["AN", 9, 0, 5], ["FU", 9, [1, 2, 3, 4]], ["AN", 9, 1, 4], ["FU", 9, [2, 3, 4, 5]], ["AN", 9, 2, 6], ["FU", 4, [0, 1, 2, 3]], ["SP", 4, 0, 8, [1], 1], ["AN", 4, 1, 2], ["FFSP", 4, 0, [4, 3, 2, 1], 1, 1], ["AN", 4, 1, 6], ["FU", 2, [0, 1, 2, 3]], ["SP", 2, 0, 12, [3], 1], ["AN", 2, 1, 2], ["FFSP", 2, 0, [4, 3, 2, 1], 1, 1], ["AN", 2, 1, 6], ["PR", 5, 0, "auto_unroll_max_step$16"]]]], "r": [[0.276594, 0.277229, 0.277343], 0, 11.0894, 1630492033], "v": "v0.6"}
{"i": [["[\"3de659bda0b18c5fe8c5c8f8ce54ea9d\", 1, 15, 106, 84, 15, 15, 4, 4, 1, 15, 1, 1, 1, 15, 212, 168, 1, 15, 212, 168]", "opencl -keys=opencl,gpu -max_num_threads=256 -thread_warp_size=1", [2, 16, 64, 4096, 409600, 512, 2, 1], "llvm -keys=cpu -link-params=0 -mtriple=aarch64-linux-gnu", 0, []], [[], [["CI", 5], ["SP", 3, 0, 1, [1, 1, 1, 1], 1], ["SP", 3, 5, 15, [1, 3, 1, 1], 1], ["SP", 3, 10, 212, [2, 2, 1, 1], 1], ["SP", 3, 15, 168, [1, 1, 2, 1], 1], ["SP", 3, 20, 15, [1, 3], 1], ["SP", 3, 23, 4, [1, 4], 1], ["SP", 3, 26, 4, [1, 2], 1], ["RE", 3, [0, 5, 10, 15, 1, 6, 11, 16, 2, 7, 12, 17, 20, 23, 26, 21, 24, 27, 3, 8, 13, 18, 22, 25, 28, 4, 9, 14, 19]], ["FSP", 7, 0, 1, 3], ["FSP", 7, 4, 2, 3], ["FSP", 7, 8, 3, 3], ["FSP", 7, 12, 4, 3], ["RE", 7, [0, 4, 8, 12, 1, 5, 9, 13, 2, 6, 10, 14, 3, 7, 11, 15]], ["CA", 3, 7, 11], ["CHR", 2, "shared", [3]], ["CA", 3, 4, 14], ["CHR", 1, "shared", [4]], ["CA", 2, 5, 14], ["CI", 1], ["FU", 9, [0, 1, 2, 3]], ["AN", 9, 0, 5], ["FU", 9, [1, 2, 3, 4]], ["AN", 9, 1, 4], ["FU", 9, [2, 3, 4, 5]], ["AN", 9, 2, 6], ["FU", 4, [0, 1, 2, 3]], ["SP", 4, 0, 8, [1], 1], ["AN", 4, 1, 2], ["FFSP", 4, 0, [4, 3, 2, 1], 1, 1], ["AN", 4, 1, 6], ["FU", 2, [0, 1, 2, 3]], ["SP", 2, 0, 12, [1], 1], ["AN", 2, 1, 2], ["FFSP", 2, 0, [4, 3, 2, 1], 1, 1], ["AN", 2, 1, 6], ["PR", 5, 0, "auto_unroll_max_step$64"]]]], "r": [[0.257918, 0.0723227, 0.0728059], 0, 10.5194, 1630492044], "v": "v0.6"}
{"i": [["[\"3de659bda0b18c5fe8c5c8f8ce54ea9d\", 1, 15, 106, 84, 15, 15, 4, 4, 1, 15, 1, 1, 1, 15, 212, 168, 1, 15, 212, 168]", "opencl -keys=opencl,gpu -max_num_threads=256 -thread_warp_size=1", [2, 16, 64, 4096, 409600, 512, 2, 1], "llvm -keys=cpu -link-params=0 -mtriple=aarch64-linux-gnu", 0, []], [[], [["CI", 5], ["SP", 3, 0, 1, [1, 1, 1, 1], 1], ["SP", 3, 5, 15, [1, 3, 1, 1], 1], ["SP", 3, 10, 212, [2, 2, 1, 1], 1], ["SP", 3, 15, 168, [1, 1, 2, 1], 1], ["SP", 3, 20, 15, [1, 15], 1], ["SP", 3, 23, 4, [1, 4], 1], ["SP", 3, 26, 4, [1, 2], 1], ["RE", 3, [0, 5, 10, 15, 1, 6, 11, 16, 2, 7, 12, 17, 20, 23, 26, 21, 24, 27, 3, 8, 13, 18, 22, 25, 28, 4, 9, 14, 19]], ["FSP", 7, 0, 1, 3], ["FSP", 7, 4, 2, 3], ["FSP", 7, 8, 3, 3], ["FSP", 7, 12, 4, 3], ["RE", 7, [0, 4, 8, 12, 1, 5, 9, 13, 2, 6, 10, 14, 3, 7, 11, 15]], ["CA", 3, 7, 11], ["CHR", 2, "shared", [3]], ["CA", 3, 4, 14], ["CHR", 1, "shared", [4]], ["CA", 2, 5, 14], ["CI", 1], ["FU", 9, [0, 1, 2, 3]], ["AN", 9, 0, 5], ["FU", 9, [1, 2, 3, 4]], ["AN", 9, 1, 4], ["FU", 9, [2, 3, 4, 5]], ["AN", 9, 2, 6], ["FU", 4, [0, 1, 2, 3]], ["SP", 4, 0, 8, [2], 1], ["AN", 4, 1, 2], ["FFSP", 4, 0, [4, 3, 2, 1], 1, 1], ["AN", 4, 1, 6], ["FU", 2, [0, 1, 2, 3]], ["SP", 2, 0, 12, [1], 1], ["AN", 2, 1, 2], ["FFSP", 2, 0, [4, 3, 2, 1], 1, 1], ["AN", 2, 1, 6], ["PR", 5, 0, "auto_unroll_max_step$16"]]]], "r": [[0.374579, 0.374815, 0.374899], 0, 13.5916, 1630492057], "v": "v0.6"}
{"i": [["[\"3de659bda0b18c5fe8c5c8f8ce54ea9d\", 1, 15, 106, 84, 15, 15, 4, 4, 1, 15, 1, 1, 1, 15, 212, 168, 1, 15, 212, 168]", "opencl -keys=opencl,gpu -max_num_threads=256 -thread_warp_size=1", [2, 16, 64, 4096, 409600, 512, 2, 1], "llvm -keys=cpu -link-params=0 -mtriple=aarch64-linux-gnu", 0, []], [[], [["CI", 5], ["SP", 3, 0, 1, [1, 1, 1, 1], 1], ["SP", 3, 5, 15, [1, 3, 1, 1], 1], ["SP", 3, 10, 212, [2, 2, 1, 1], 1], ["SP", 3, 15, 168, [1, 1, 2, 1], 1], ["SP", 3, 20, 15, [1, 3], 1], ["SP", 3, 23, 4, [1, 4], 1], ["SP", 3, 26, 4, [1, 2], 1], ["RE", 3, [0, 5, 10, 15, 1, 6, 11, 16, 2, 7, 12, 17, 20, 23, 26, 21, 24, 27, 3, 8, 13, 18, 22, 25, 28, 4, 9, 14, 19]], ["FSP", 7, 0, 1, 3], ["FSP", 7, 4, 2, 3], ["FSP", 7, 8, 3, 3], ["FSP", 7, 12, 4, 3], ["RE", 7, [0, 4, 8, 12, 1, 5, 9, 13, 2, 6, 10, 14, 3, 7, 11, 15]], ["CA", 3, 7, 11], ["CHR", 2, "shared", [3]], ["CA", 3, 4, 14], ["CHR", 1, "shared", [4]], ["CA", 2, 5, 14], ["CI", 1], ["FU", 9, [0, 1, 2, 3]], ["AN", 9, 0, 5], ["FU", 9, [1, 2, 3, 4]], ["AN", 9, 1, 4], ["FU", 9, [2, 3, 4, 5]], ["AN", 9, 2, 6], ["FU", 4, [0, 1, 2, 3]], ["SP", 4, 0, 8, [1], 1], ["AN", 4, 1, 2], ["FFSP", 4, 0, [4, 3, 2, 1], 1, 1], ["AN", 4, 1, 6], ["FU", 2, [0, 1, 2, 3]], ["SP", 2, 0, 12, [1], 1], ["AN", 2, 1, 2], ["FFSP", 2, 0, [4, 3, 2, 1], 1, 1], ["AN", 2, 1, 6], ["PR", 5, 0, "auto_unroll_max_step$16"]]]], "r": [[0.071766, 0.0704083, 0.0721919], 0, 9.73233, 1630492067], "v": "v0.6"}
{"i": [["[\"3de659bda0b18c5fe8c5c8f8ce54ea9d\", 1, 15, 106, 84, 15, 15, 4, 4, 1, 15, 1, 1, 1, 15, 212, 168, 1, 15, 212, 168]", "opencl -keys=opencl,gpu -max_num_threads=256 -thread_warp_size=1", [2, 16, 64, 4096, 409600, 512, 2, 1], "llvm -keys=cpu -link-params=0 -mtriple=aarch64-linux-gnu", 0, []], [[], [["CI", 5], ["SP", 3, 0, 1, [1, 1, 1, 1], 1], ["SP", 3, 5, 15, [1, 3, 1, 1], 1], ["SP", 3, 10, 212, [2, 2, 1, 1], 1], ["SP", 3, 15, 168, [1, 1, 2, 1], 1], ["SP", 3, 20, 15, [1, 1], 1], ["SP", 3, 23, 4, [4, 1], 1], ["SP", 3, 26, 4, [1, 2], 1], ["RE", 3, [0, 5, 10, 15, 1, 6, 11, 16, 2, 7, 12, 17, 20, 23, 26, 21, 24, 27, 3, 8, 13, 18, 22, 25, 28, 4, 9, 14, 19]], ["FSP", 7, 0, 1, 3], ["FSP", 7, 4, 2, 3], ["FSP", 7, 8, 3, 3], ["FSP", 7, 12, 4, 3], ["RE", 7, [0, 4, 8, 12, 1, 5, 9, 13, 2, 6, 10, 14, 3, 7, 11, 15]], ["CA", 3, 7, 11], ["CHR", 2, "shared", [3]], ["CA", 3, 4, 14], ["CHR", 1, "shared", [4]], ["CA", 2, 5, 14], ["CI", 1], ["FU", 9, [0, 1, 2, 3]], ["AN", 9, 0, 5], ["FU", 9, [1, 2, 3, 4]], ["AN", 9, 1, 4], ["FU", 9, [2, 3, 4, 5]], ["AN", 9, 2, 6], ["FU", 4, [0, 1, 2, 3]], ["SP", 4, 0, 8, [1], 1], ["AN", 4, 1, 2], ["FFSP", 4, 0, [4, 3, 2, 1], 1, 1], ["AN", 4, 1, 6], ["FU", 2, [0, 1, 2, 3]], ["SP", 2, 0, 12, [1], 1], ["AN", 2, 1, 2], ["FFSP", 2, 0, [4, 3, 2, 1], 1, 1], ["AN", 2, 1, 6], ["PR", 5, 0, "auto_unroll_max_step$64"]]]], "r": [[0.0591993, 0.0636217, 0.0587137], 0, 8.69812, 1630492075], "v": "v0.6"}
{"i": [["[\"3de659bda0b18c5fe8c5c8f8ce54ea9d\", 1, 15, 106, 84, 15, 15, 4, 4, 1, 15, 1, 1, 1, 15, 212, 168, 1, 15, 212, 168]", "opencl -keys=opencl,gpu -max_num_threads=256 -thread_warp_size=1", [2, 16, 64, 4096, 409600, 512, 2, 1], "llvm -keys=cpu -link-params=0 -mtriple=aarch64-linux-gnu", 0, []], [[], [["CI", 5], ["SP", 3, 0, 1, [1, 1, 1, 1], 1], ["SP", 3, 5, 15, [1, 1, 1, 1], 1], ["SP", 3, 10, 212, [1, 1, 1, 1], 1], ["SP", 3, 15, 168, [1, 2, 1, 12], 1], ["SP", 3, 20, 15, [1, 5], 1], ["SP", 3, 23, 4, [4, 1], 1], ["SP", 3, 26, 4, [1, 4], 1], ["RE", 3, [0, 5, 10, 15, 1, 6, 11, 16, 2, 7, 12, 17, 20, 23, 26, 21, 24, 27, 3, 8, 13, 18, 22, 25, 28, 4, 9, 14, 19]], ["FSP", 7, 0, 1, 3], ["FSP", 7, 4, 2, 3], ["FSP", 7, 8, 3, 3], ["FSP", 7, 12, 4, 3], ["RE", 7, [0, 4, 8, 12, 1, 5, 9, 13, 2, 6, 10, 14, 3, 7, 11, 15]], ["CA", 3, 7, 11], ["CHR", 2, "shared", [3]], ["CA", 3, 4, 14], ["CHR", 1, "shared", [4]], ["CA", 2, 5, 14], ["CI", 1], ["FU", 9, [0, 1, 2, 3]], ["AN", 9, 0, 5], ["FU", 9, [1, 2, 3, 4]], ["AN", 9, 1, 4], ["FU", 9, [2, 3, 4, 5]], ["AN", 9, 2, 6], ["FU", 4, [0, 1, 2, 3]], ["SP", 4, 0, 240, [1], 1], ["AN", 4, 1, 2], ["FFSP", 4, 0, [4, 3, 2, 1], 1, 1], ["AN", 4, 1, 6], ["FU", 2, [0, 1, 2, 3]], ["SP", 2, 0, 60, [4], 1], ["AN", 2, 1, 2], ["FFSP", 2, 0, [4, 3, 2, 1], 1, 1], ["AN", 2, 1, 6], ["PR", 5, 0, "auto_unroll_max_step$64"]]]], "r": [[1.55319, 1.5533, 1.55323], 0, 25.3535, 1630492101], "v": "v0.6"}
{"i": [["[\"3de659bda0b18c5fe8c5c8f8ce54ea9d\", 1, 15, 106, 84, 15, 15, 4, 4, 1, 15, 1, 1, 1, 15, 212, 168, 1, 15, 212, 168]", "opencl -keys=opencl,gpu -max_num_threads=256 -thread_warp_size=1", [2, 16, 64, 4096, 409600, 512, 2, 1], "llvm -keys=cpu -link-params=0 -mtriple=aarch64-linux-gnu", 0, []], [[], [["CI", 5], ["SP", 3, 0, 1, [1, 1, 1, 1], 1], ["SP", 3, 5, 15, [1, 3, 1, 1], 1], ["SP", 3, 10, 212, [1, 2, 2, 1], 1], ["SP", 3, 15, 168, [1, 1, 2, 1], 1], ["SP", 3, 20, 15, [1, 3], 1], ["SP", 3, 23, 4, [1, 4], 1], ["SP", 3, 26, 4, [1, 2], 1], ["RE", 3, [0, 5, 10, 15, 1, 6, 11, 16, 2, 7, 12, 17, 20, 23, 26, 21, 24, 27, 3, 8, 13, 18, 22, 25, 28, 4, 9, 14, 19]], ["FSP", 7, 0, 1, 3], ["FSP", 7, 4, 2, 3], ["FSP", 7, 8, 3, 3], ["FSP", 7, 12, 4, 3], ["RE", 7, [0, 4, 8, 12, 1, 5, 9, 13, 2, 6, 10, 14, 3, 7, 11, 15]], ["CA", 3, 7, 11], ["CHR", 2, "shared", [3]], ["CA", 3, 4, 14], ["CHR", 1, "shared", [4]], ["CA", 2, 5, 14], ["CI", 1], ["FU", 9, [0, 1, 2, 3]], ["AN", 9, 0, 5], ["FU", 9, [1, 2, 3, 4]], ["AN", 9, 1, 4], ["FU", 9, [2, 3, 4, 5]], ["AN", 9, 2, 6], ["FU", 4, [0, 1, 2, 3]], ["SP", 4, 0, 8, [4], 1], ["AN", 4, 1, 2], ["FFSP", 4, 0, [4, 3, 2, 1], 1, 1], ["AN", 4, 1, 6], ["FU", 2, [0, 1, 2, 3]], ["SP", 2, 0, 12, [1], 1], ["AN", 2, 1, 2], ["FFSP", 2, 0, [4, 3, 2, 1], 1, 1], ["AN", 2, 1, 6], ["PR", 5, 0, "auto_unroll_max_step$1024"]]]], "r": [[0.0999906, 0.100061, 0.10005], 0, 11.1208, 1630492112], "v": "v0.6"}
{"i": [["[\"3de659bda0b18c5fe8c5c8f8ce54ea9d\", 1, 15, 106, 84, 15, 15, 4, 4, 1, 15, 1, 1, 1, 15, 212, 168, 1, 15, 212, 168]", "opencl -keys=opencl,gpu -max_num_threads=256 -thread_warp_size=1", [2, 16, 64, 4096, 409600, 512, 2, 1], "llvm -keys=cpu -link-params=0 -mtriple=aarch64-linux-gnu", 0, []], [[], [["CI", 5], ["SP", 3, 0, 1, [1, 1, 1, 1], 1], ["SP", 3, 5, 15, [1, 3, 1, 1], 1], ["SP", 3, 10, 212, [2, 2, 1, 1], 1], ["SP", 3, 15, 168, [1, 1, 2, 1], 1], ["SP", 3, 20, 15, [5, 1], 1], ["SP", 3, 23, 4, [1, 1], 1], ["SP", 3, 26, 4, [1, 4], 1], ["RE", 3, [0, 5, 10, 15, 1, 6, 11, 16, 2, 7, 12, 17, 20, 23, 26, 21, 24, 27, 3, 8, 13, 18, 22, 25, 28, 4, 9, 14, 19]], ["FSP", 7, 0, 1, 3], ["FSP", 7, 4, 2, 3], ["FSP", 7, 8, 3, 3], ["FSP", 7, 12, 4, 3], ["RE", 7, [0, 4, 8, 12, 1, 5, 9, 13, 2, 6, 10, 14, 3, 7, 11, 15]], ["CA", 3, 7, 11], ["CHR", 2, "shared", [3]], ["CA", 3, 4, 14], ["CHR", 1, "shared", [4]], ["CA", 2, 5, 14], ["CI", 1], ["FU", 9, [0, 1, 2, 3]], ["AN", 9, 0, 5], ["FU", 9, [1, 2, 3, 4]], ["AN", 9, 1, 4], ["FU", 9, [2, 3, 4, 5]], ["AN", 9, 2, 6], ["FU", 4, [0, 1, 2, 3]], ["SP", 4, 0, 8, [1], 1], ["AN", 4, 1, 2], ["FFSP", 4, 0, [4, 3, 2, 1], 1, 1], ["AN", 4, 1, 6], ["FU", 2, [0, 1, 2, 3]], ["SP", 2, 0, 12, [1], 1], ["AN", 2, 1, 2], ["FFSP", 2, 0, [4, 3, 2, 1], 1, 1], ["AN", 2, 1, 6], ["PR", 5, 0, "auto_unroll_max_step$512"]]]], "r": [[0.300389, 0.28576, 0.29148], 0, 18.1782, 1630492129], "v": "v0.6"}
{"i": [["[\"3de659bda0b18c5fe8c5c8f8ce54ea9d\", 1, 15, 106, 84, 15, 15, 4, 4, 1, 15, 1, 1, 1, 15, 212, 168, 1, 15, 212, 168]", "opencl -keys=opencl,gpu -max_num_threads=256 -thread_warp_size=1", [2, 16, 64, 4096, 409600, 512, 2, 1], "llvm -keys=cpu -link-params=0 -mtriple=aarch64-linux-gnu", 0, []], [[], [["CI", 5], ["SP", 3, 0, 1, [1, 1, 1, 1], 1], ["SP", 3, 5, 15, [1, 3, 1, 1], 1], ["SP", 3, 10, 212, [2, 2, 1, 1], 1], ["SP", 3, 15, 168, [1, 1, 2, 1], 1], ["SP", 3, 20, 15, [1, 15], 1], ["SP", 3, 23, 4, [1, 4], 1], ["SP", 3, 26, 4, [1, 2], 1], ["RE", 3, [0, 5, 10, 15, 1, 6, 11, 16, 2, 7, 12, 17, 20, 23, 26, 21, 24, 27, 3, 8, 13, 18, 22, 25, 28, 4, 9, 14, 19]], ["FSP", 7, 0, 1, 3], ["FSP", 7, 4, 2, 3], ["FSP", 7, 8, 3, 3], ["FSP", 7, 12, 4, 3], ["RE", 7, [0, 4, 8, 12, 1, 5, 9, 13, 2, 6, 10, 14, 3, 7, 11, 15]], ["CA", 3, 7, 11], ["CHR", 2, "shared", [3]], ["CA", 3, 4, 14], ["CHR", 1, "shared", [4]], ["CA", 2, 5, 14], ["CI", 1], ["FU", 9, [0, 1, 2, 3]], ["AN", 9, 0, 5], ["FU", 9, [1, 2, 3, 4]], ["AN", 9, 1, 4], ["FU", 9, [2, 3, 4, 5]], ["AN", 9, 2, 6], ["FU", 4, [0, 1, 2, 3]], ["SP", 4, 0, 8, [4], 1], ["AN", 4, 1, 2], ["FFSP", 4, 0, [4, 3, 2, 1], 1, 1], ["AN", 4, 1, 6], ["FU", 2, [0, 1, 2, 3]], ["SP", 2, 0, 12, [1], 1], ["AN", 2, 1, 2], ["FFSP", 2, 0, [4, 3, 2, 1], 1, 1], ["AN", 2, 1, 6], ["PR", 5, 0, "auto_unroll_max_step$16"]]]], "r": [[0.377666, 0.377173, 0.376572], 0, 12.5491, 1630492145], "v": "v0.6"}
{"i": [["[\"3de659bda0b18c5fe8c5c8f8ce54ea9d\", 1, 15, 106, 84, 15, 15, 4, 4, 1, 15, 1, 1, 1, 15, 212, 168, 1, 15, 212, 168]", "opencl -keys=opencl,gpu -max_num_threads=256 -thread_warp_size=1", [2, 16, 64, 4096, 409600, 512, 2, 1], "llvm -keys=cpu -link-params=0 -mtriple=aarch64-linux-gnu", 0, []], [[], [["CI", 5], ["SP", 3, 0, 1, [1, 1, 1, 1], 1], ["SP", 3, 5, 15, [1, 3, 1, 1], 1], ["SP", 3, 10, 212, [2, 2, 1, 1], 1], ["SP", 3, 15, 168, [1, 1, 2, 1], 1], ["SP", 3, 20, 15, [1, 3], 1], ["SP", 3, 23, 4, [1, 4], 1], ["SP", 3, 26, 4, [1, 2], 1], ["RE", 3, [0, 5, 10, 15, 1, 6, 11, 16, 2, 7, 12, 17, 20, 23, 26, 21, 24, 27, 3, 8, 13, 18, 22, 25, 28, 4, 9, 14, 19]], ["FSP", 7, 0, 1, 3], ["FSP", 7, 4, 2, 3], ["FSP", 7, 8, 3, 3], ["FSP", 7, 12, 4, 3], ["RE", 7, [0, 4, 8, 12, 1, 5, 9, 13, 2, 6, 10, 14, 3, 7, 11, 15]], ["CA", 3, 7, 11], ["CHR", 2, "shared", [3]], ["CA", 3, 4, 14], ["CHR", 1, "shared", [4]], ["CA", 2, 5, 14], ["CI", 1], ["FU", 9, [0, 1, 2, 3]], ["AN", 9, 0, 5], ["FU", 9, [1, 2, 3, 4]], ["AN", 9, 1, 4], ["FU", 9, [2, 3, 4, 5]], ["AN", 9, 2, 6], ["FU", 4, [0, 1, 2, 3]], ["SP", 4, 0, 8, [1], 1], ["AN", 4, 1, 2], ["FFSP", 4, 0, [4, 3, 2, 1], 1, 1], ["AN", 4, 1, 6], ["FU", 2, [0, 1, 2, 3]], ["SP", 2, 0, 12, [1], 1], ["AN", 2, 1, 2], ["FFSP", 2, 0, [4, 3, 2, 1], 1, 1], ["AN", 2, 1, 6], ["PR", 5, 0, "auto_unroll_max_step$0"]]]], "r": [[0.123202, 0.118658, 0.120916], 0, 9.32918, 1630492155], "v": "v0.6"}
{"i": [["[\"3de659bda0b18c5fe8c5c8f8ce54ea9d\", 1, 15, 106, 84, 15, 15, 4, 4, 1, 15, 1, 1, 1, 15, 212, 168, 1, 15, 212, 168]", "opencl -keys=opencl,gpu -max_num_threads=256 -thread_warp_size=1", [2, 16, 64, 4096, 409600, 512, 2, 1], "llvm -keys=cpu -link-params=0 -mtriple=aarch64-linux-gnu", 0, []], [[], [["CI", 5], ["SP", 3, 0, 1, [1, 1, 1, 1], 1], ["SP", 3, 5, 15, [1, 15, 1, 1], 1], ["SP", 3, 10, 212, [1, 1, 4, 1], 1], ["SP", 3, 15, 168, [1, 21, 4, 1], 1], ["SP", 3, 20, 15, [1, 1], 1], ["SP", 3, 23, 4, [4, 1], 1], ["SP", 3, 26, 4, [1, 4], 1], ["RE", 3, [0, 5, 10, 15, 1, 6, 11, 16, 2, 7, 12, 17, 20, 23, 26, 21, 24, 27, 3, 8, 13, 18, 22, 25, 28, 4, 9, 14, 19]], ["FSP", 7, 0, 1, 3], ["FSP", 7, 4, 2, 3], ["FSP", 7, 8, 3, 3], ["FSP", 7, 12, 4, 3], ["RE", 7, [0, 4, 8, 12, 1, 5, 9, 13, 2, 6, 10, 14, 3, 7, 11, 15]], ["CA", 3, 7, 11], ["CHR", 2, "shared", [3]], ["CA", 3, 4, 14], ["CHR", 1, "shared", [4]], ["CA", 2, 5, 14], ["CI", 1], ["FU", 9, [0, 1, 2, 3]], ["AN", 9, 0, 5], ["FU", 9, [1, 2, 3, 4]], ["AN", 9, 1, 4], ["FU", 9, [2, 3, 4, 5]], ["AN", 9, 2, 6], ["FU", 4, [0, 1, 2, 3]], ["SP", 4, 0, 16, [1], 1], ["AN", 4, 1, 2], ["FFSP", 4, 0, [4, 3, 2, 1], 1, 1], ["AN", 4, 1, 6], ["FU", 2, [0, 1, 2, 3]], ["SP", 2, 0, 49, [1], 1], ["AN", 2, 1, 2], ["FFSP", 2, 0, [4, 3, 2, 1], 1, 1], ["AN", 2, 1, 6], ["PR", 5, 0, "auto_unroll_max_step$512"]]]], "r": [[0.0115417, 0.011455, 0.0114317], 0, 8.88799, 1630492164], "v": "v0.6"}
{"i": [["[\"3de659bda0b18c5fe8c5c8f8ce54ea9d\", 1, 15, 106, 84, 15, 15, 4, 4, 1, 15, 1, 1, 1, 15, 212, 168, 1, 15, 212, 168]", "opencl -keys=opencl,gpu -max_num_threads=256 -thread_warp_size=1", [2, 16, 64, 4096, 409600, 512, 2, 1], "llvm -keys=cpu -link-params=0 -mtriple=aarch64-linux-gnu", 0, []], [[], [["CI", 5], ["SP", 3, 0, 1, [1, 1, 1, 1], 1], ["SP", 3, 5, 15, [1, 3, 1, 1], 1], ["SP", 3, 10, 212, [1, 2, 2, 1], 1], ["SP", 3, 15, 168, [1, 1, 2, 1], 1], ["SP", 3, 20, 15, [1, 1], 1], ["SP", 3, 23, 4, [2, 2], 1], ["SP", 3, 26, 4, [1, 2], 1], ["RE", 3, [0, 5, 10, 15, 1, 6, 11, 16, 2, 7, 12, 17, 20, 23, 26, 21, 24, 27, 3, 8, 13, 18, 22, 25, 28, 4, 9, 14, 19]], ["FSP", 7, 0, 1, 3], ["FSP", 7, 4, 2, 3], ["FSP", 7, 8, 3, 3], ["FSP", 7, 12, 4, 3], ["RE", 7, [0, 4, 8, 12, 1, 5, 9, 13, 2, 6, 10, 14, 3, 7, 11, 15]], ["CA", 3, 7, 11], ["CHR", 2, "shared", [3]], ["CA", 3, 4, 14], ["CHR", 1, "shared", [4]], ["CA", 2, 5, 14], ["CI", 1], ["FU", 9, [0, 1, 2, 3]], ["AN", 9, 0, 5], ["FU", 9, [1, 2, 3, 4]], ["AN", 9, 1, 4], ["FU", 9, [2, 3, 4, 5]], ["AN", 9, 2, 6], ["FU", 4, [0, 1, 2, 3]], ["SP", 4, 0, 8, [1], 1], ["AN", 4, 1, 2], ["FFSP", 4, 0, [4, 3, 2, 1], 1, 1], ["AN", 4, 1, 6], ["FU", 2, [0, 1, 2, 3]], ["SP", 2, 0, 12, [1], 1], ["AN", 2, 1, 2], ["FFSP", 2, 0, [4, 3, 2, 1], 1, 1], ["AN", 2, 1, 6], ["PR", 5, 0, "auto_unroll_max_step$64"]]]], "r": [[0.231766, 0.0603206, 0.0601412], 0, 9.61337, 1630492173], "v": "v0.6"}
{"i": [["[\"3de659bda0b18c5fe8c5c8f8ce54ea9d\", 1, 15, 106, 84, 15, 15, 4, 4, 1, 15, 1, 1, 1, 15, 212, 168, 1, 15, 212, 168]", "opencl -keys=opencl,gpu -max_num_threads=256 -thread_warp_size=1", [2, 16, 64, 4096, 409600, 512, 2, 1], "llvm -keys=cpu -link-params=0 -mtriple=aarch64-linux-gnu", 0, []], [[], [["CI", 5], ["SP", 3, 0, 1, [1, 1, 1, 1], 1], ["SP", 3, 5, 15, [1, 3, 1, 1], 1], ["SP", 3, 10, 212, [2, 2, 1, 1], 1], ["SP", 3, 15, 168, [1, 1, 2, 1], 1], ["SP", 3, 20, 15, [5, 1], 1], ["SP", 3, 23, 4, [4, 1], 1], ["SP", 3, 26, 4, [1, 2], 1], ["RE", 3, [0, 5, 10, 15, 1, 6, 11, 16, 2, 7, 12, 17, 20, 23, 26, 21, 24, 27, 3, 8, 13, 18, 22, 25, 28, 4, 9, 14, 19]], ["FSP", 7, 0, 1, 3], ["FSP", 7, 4, 2, 3], ["FSP", 7, 8, 3, 3], ["FSP", 7, 12, 4, 3], ["RE", 7, [0, 4, 8, 12, 1, 5, 9, 13, 2, 6, 10, 14, 3, 7, 11, 15]], ["CA", 3, 7, 11], ["CHR", 2, "shared", [3]], ["CA", 3, 4, 14], ["CHR", 1, "shared", [4]], ["CA", 2, 5, 14], ["CI", 1], ["FU", 9, [0, 1, 2, 3]], ["AN", 9, 0, 5], ["FU", 9, [1, 2, 3, 4]], ["AN", 9, 1, 4], ["FU", 9, [2, 3, 4, 5]], ["AN", 9, 2, 6], ["FU", 4, [0, 1, 2, 3]], ["SP", 4, 0, 8, [1], 1], ["AN", 4, 1, 2], ["FFSP", 4, 0, [4, 3, 2, 1], 1, 1], ["AN", 4, 1, 6], ["FU", 2, [0, 1, 2, 3]], ["SP", 2, 0, 12, [1], 1], ["AN", 2, 1, 2], ["FFSP", 2, 0, [4, 3, 2, 1], 1, 1], ["AN", 2, 1, 6], ["PR", 5, 0, "auto_unroll_max_step$1024"]]]], "r": [[0.13905, 0.14214, 0.139275], 0, 14.9475, 1630492188], "v": "v0.6"}
{"i": [["[\"3de659bda0b18c5fe8c5c8f8ce54ea9d\", 1, 15, 106, 84, 15, 15, 4, 4, 1, 15, 1, 1, 1, 15, 212, 168, 1, 15, 212, 168]", "opencl -keys=opencl,gpu -max_num_threads=256 -thread_warp_size=1", [2, 16, 64, 4096, 409600, 512, 2, 1], "llvm -keys=cpu -link-params=0 -mtriple=aarch64-linux-gnu", 0, []], [[], [["CI", 5], ["SP", 3, 0, 1, [1, 1, 1, 1], 1], ["SP", 3, 5, 15, [1, 1, 1, 1], 1], ["SP", 3, 10, 212, [1, 1, 1, 1], 1], ["SP", 3, 15, 168, [1, 2, 1, 12], 1], ["SP", 3, 20, 15, [1, 1], 1], ["SP", 3, 23, 4, [4, 1], 1], ["SP", 3, 26, 4, [1, 4], 1], ["RE", 3, [0, 5, 10, 15, 1, 6, 11, 16, 2, 7, 12, 17, 20, 23, 26, 21, 24, 27, 3, 8, 13, 18, 22, 25, 28, 4, 9, 14, 19]], ["FSP", 7, 0, 1, 3], ["FSP", 7, 4, 2, 3], ["FSP", 7, 8, 3, 3], ["FSP", 7, 12, 4, 3], ["RE", 7, [0, 4, 8, 12, 1, 5, 9, 13, 2, 6, 10, 14, 3, 7, 11, 15]], ["CA", 3, 7, 11], ["CHR", 2, "shared", [3]], ["CA", 3, 4, 14], ["CHR", 1, "shared", [4]], ["CA", 2, 5, 14], ["CI", 1], ["FU", 9, [0, 1, 2, 3]], ["AN", 9, 0, 5], ["FU", 9, [1, 2, 3, 4]], ["AN", 9, 1, 4], ["FU", 9, [2, 3, 4, 5]], ["AN", 9, 2, 6], ["FU", 4, [0, 1, 2, 3]], ["SP", 4, 0, 240, [1], 1], ["AN", 4, 1, 2], ["FFSP", 4, 0, [4, 3, 2, 1], 1, 1], ["AN", 4, 1, 6], ["FU", 2, [0, 1, 2, 3]], ["SP", 2, 0, 60, [1], 1], ["AN", 2, 1, 2], ["FFSP", 2, 0, [4, 3, 2, 1], 1, 1], ["AN", 2, 1, 6], ["PR", 5, 0, "auto_unroll_max_step$64"]]]], "r": [[0.377142, 0.375815, 0.285711], 0, 14.939, 1630492207], "v": "v0.6"}
{"i": [["[\"3de659bda0b18c5fe8c5c8f8ce54ea9d\", 1, 15, 106, 84, 15, 15, 4, 4, 1, 15, 1, 1, 1, 15, 212, 168, 1, 15, 212, 168]", "opencl -keys=opencl,gpu -max_num_threads=256 -thread_warp_size=1", [2, 16, 64, 4096, 409600, 512, 2, 1], "llvm -keys=cpu -link-params=0 -mtriple=aarch64-linux-gnu", 0, []], [[], [["CI", 5], ["SP", 3, 0, 1, [1, 1, 1, 1], 1], ["SP", 3, 5, 15, [1, 3, 1, 1], 1], ["SP", 3, 10, 212, [2, 1, 2, 1], 1], ["SP", 3, 15, 168, [1, 1, 2, 1], 1], ["SP", 3, 20, 15, [1, 1], 1], ["SP", 3, 23, 4, [2, 2], 1], ["SP", 3, 26, 4, [1, 2], 1], ["RE", 3, [0, 5, 10, 15, 1, 6, 11, 16, 2, 7, 12, 17, 20, 23, 26, 21, 24, 27, 3, 8, 13, 18, 22, 25, 28, 4, 9, 14, 19]], ["FSP", 7, 0, 1, 3], ["FSP", 7, 4, 2, 3], ["FSP", 7, 8, 3, 3], ["FSP", 7, 12, 4, 3], ["RE", 7, [0, 4, 8, 12, 1, 5, 9, 13, 2, 6, 10, 14, 3, 7, 11, 15]], ["CA", 3, 7, 11], ["CHR", 2, "shared", [3]], ["CA", 3, 4, 14], ["CHR", 1, "shared", [4]], ["CA", 2, 5, 14], ["CI", 1], ["FU", 9, [0, 1, 2, 3]], ["AN", 9, 0, 5], ["FU", 9, [1, 2, 3, 4]], ["AN", 9, 1, 4], ["FU", 9, [2, 3, 4, 5]], ["AN", 9, 2, 6], ["FU", 4, [0, 1, 2, 3]], ["SP", 4, 0, 8, [1], 1], ["AN", 4, 1, 2], ["FFSP", 4, 0, [4, 3, 2, 1], 1, 1], ["AN", 4, 1, 6], ["FU", 2, [0, 1, 2, 3]], ["SP", 2, 0, 12, [3], 1], ["AN", 2, 1, 2], ["FFSP", 2, 0, [4, 3, 2, 1], 1, 1], ["AN", 2, 1, 6], ["PR", 5, 0, "auto_unroll_max_step$64"]]]], "r": [[0.0604466, 0.0606787, 0.0631569], 0, 8.65522, 1630492215], "v": "v0.6"}
{"i": [["[\"3de659bda0b18c5fe8c5c8f8ce54ea9d\", 1, 15, 106, 84, 15, 15, 4, 4, 1, 15, 1, 1, 1, 15, 212, 168, 1, 15, 212, 168]", "opencl -keys=opencl,gpu -max_num_threads=256 -thread_warp_size=1", [2, 16, 64, 4096, 409600, 512, 2, 1], "llvm -keys=cpu -link-params=0 -mtriple=aarch64-linux-gnu", 0, []], [[], [["CI", 5], ["SP", 3, 0, 1, [1, 1, 1, 1], 1], ["SP", 3, 5, 15, [1, 15, 1, 1], 1], ["SP", 3, 10, 212, [1, 2, 1, 1], 1], ["SP", 3, 15, 168, [1, 2, 2, 21], 1], ["SP", 3, 20, 15, [1, 1], 1], ["SP", 3, 23, 4, [1, 1], 1], ["SP", 3, 26, 4, [2, 1], 1], ["RE", 3, [0, 5, 10, 15, 1, 6, 11, 16, 2, 7, 12, 17, 20, 23, 26, 21, 24, 27, 3, 8, 13, 18, 22, 25, 28, 4, 9, 14, 19]], ["FSP", 7, 0, 1, 3], ["FSP", 7, 4, 2, 3], ["FSP", 7, 8, 3, 3], ["FSP", 7, 12, 4, 3], ["RE", 7, [0, 4, 8, 12, 1, 5, 9, 13, 2, 6, 10, 14, 3, 7, 11, 15]], ["CA", 3, 7, 11], ["CHR", 2, "shared", [3]], ["CA", 3, 4, 14], ["CHR", 1, "shared", [4]], ["CA", 2, 5, 14], ["CI", 1], ["FU", 9, [0, 1, 2, 3]], ["AN", 9, 0, 5], ["FU", 9, [1, 2, 3, 4]], ["AN", 9, 1, 4], ["FU", 9, [2, 3, 4, 5]], ["AN", 9, 2, 6], ["FU", 4, [0, 1, 2, 3]], ["SP", 4, 0, 4, [1], 1], ["AN", 4, 1, 2], ["FFSP", 4, 0, [4, 3, 2, 1], 1, 1], ["AN", 4, 1, 6], ["FU", 2, [0, 1, 2, 3]], ["SP", 2, 0, 86, [1], 1], ["AN", 2, 1, 2], ["FFSP", 2, 0, [4, 3, 2, 1], 1, 1], ["AN", 2, 1, 6], ["PR", 5, 0, "auto_unroll_max_step$16"]]]], "r": [[0.017966, 0.016554, 0.0161089], 0, 8.54969, 1630492224], "v": "v0.6"}
{"i": [["[\"3de659bda0b18c5fe8c5c8f8ce54ea9d\", 1, 15, 106, 84, 15, 15, 4, 4, 1, 15, 1, 1, 1, 15, 212, 168, 1, 15, 212, 168]", "opencl -keys=opencl,gpu -max_num_threads=256 -thread_warp_size=1", [2, 16, 64, 4096, 409600, 512, 2, 1], "llvm -keys=cpu -link-params=0 -mtriple=aarch64-linux-gnu", 0, []], [[], [["CI", 5], ["SP", 3, 0, 1, [1, 1, 1, 1], 1], ["SP", 3, 5, 15, [1, 1, 1, 1], 1], ["SP", 3, 10, 212, [1, 1, 1, 1], 1], ["SP", 3, 15, 168, [1, 2, 1, 12], 1], ["SP", 3, 20, 15, [1, 5], 1], ["SP", 3, 23, 4, [4, 1], 1], ["SP", 3, 26, 4, [1, 4], 1], ["RE", 3, [0, 5, 10, 15, 1, 6, 11, 16, 2, 7, 12, 17, 20, 23, 26, 21, 24, 27, 3, 8, 13, 18, 22, 25, 28, 4, 9, 14, 19]], ["FSP", 7, 0, 1, 3], ["FSP", 7, 4, 2, 3], ["FSP", 7, 8, 3, 3], ["FSP", 7, 12, 4, 3], ["RE", 7, [0, 4, 8, 12, 1, 5, 9, 13, 2, 6, 10, 14, 3, 7, 11, 15]], ["CA", 3, 7, 11], ["CHR", 2, "shared", [3]], ["CA", 3, 4, 14], ["CHR", 1, "shared", [4]], ["CA", 2, 5, 14], ["CI", 1], ["FU", 9, [0, 1, 2, 3]], ["AN", 9, 0, 5], ["FU", 9, [1, 2, 3, 4]], ["AN", 9, 1, 4], ["FU", 9, [2, 3, 4, 5]], ["AN", 9, 2, 6], ["FU", 4, [0, 1, 2, 3]], ["SP", 4, 0, 240, [1], 1], ["AN", 4, 1, 2], ["FFSP", 4, 0, [4, 3, 2, 1], 1, 1], ["AN", 4, 1, 6], ["FU", 2, [0, 1, 2, 3]], ["SP", 2, 0, 60, [1], 1], ["AN", 2, 1, 2], ["FFSP", 2, 0, [4, 3, 2, 1], 1, 1], ["AN", 2, 1, 6], ["PR", 5, 0, "auto_unroll_max_step$64"]]]], "r": [[1.34586, 1.34625, 1.34637], 0, 22.9666, 1630492247], "v": "v0.6"}
{"i": [["[\"3de659bda0b18c5fe8c5c8f8ce54ea9d\", 1, 15, 106, 84, 15, 15, 4, 4, 1, 15, 1, 1, 1, 15, 212, 168, 1, 15, 212, 168]", "opencl -keys=opencl,gpu -max_num_threads=256 -thread_warp_size=1", [2, 16, 64, 4096, 409600, 512, 2, 1], "llvm -keys=cpu -link-params=0 -mtriple=aarch64-linux-gnu", 0, []], [[], [["CI", 5], ["SP", 3, 0, 1, [1, 1, 1, 1], 1], ["SP", 3, 5, 15, [1, 15, 1, 1], 1], ["SP", 3, 10, 212, [1, 2, 2, 1], 1], ["SP", 3, 15, 168, [1, 1, 14, 1], 1], ["SP", 3, 20, 15, [1, 3], 1], ["SP", 3, 23, 4, [1, 1], 1], ["SP", 3, 26, 4, [1, 4], 1], ["RE", 3, [0, 5, 10, 15, 1, 6, 11, 16, 2, 7, 12, 17, 20, 23, 26, 21, 24, 27, 3, 8, 13, 18, 22, 25, 28, 4, 9, 14, 19]], ["FSP", 7, 0, 1, 3], ["FSP", 7, 4, 2, 3], ["FSP", 7, 8, 3, 3], ["FSP", 7, 12, 4, 3], ["RE", 7, [0, 4, 8, 12, 1, 5, 9, 13, 2, 6, 10, 14, 3, 7, 11, 15]], ["CA", 3, 7, 11], ["CHR", 2, "shared", [3]], ["CA", 3, 4, 14], ["CHR", 1, "shared", [4]], ["CA", 2, 5, 14], ["CI", 1], ["FU", 9, [0, 1, 2, 3]], ["AN", 9, 0, 5], ["FU", 9, [1, 2, 3, 4]], ["AN", 9, 1, 4], ["FU", 9, [2, 3, 4, 5]], ["AN", 9, 2, 6], ["FU", 4, [0, 1, 2, 3]], ["SP", 4, 0, 60, [2], 1], ["AN", 4, 1, 2], ["FFSP", 4, 0, [4, 3, 2, 1], 1, 1], ["AN", 4, 1, 6], ["FU", 2, [0, 1, 2, 3]], ["SP", 2, 0, 51, [1], 1], ["AN", 2, 1, 2], ["FFSP", 2, 0, [4, 3, 2, 1], 1, 1], ["AN", 2, 1, 6], ["PR", 5, 0, "auto_unroll_max_step$1024"]]]], "r": [[0.0135965, 0.0135651, 0.0135678], 0, 9.34136, 1630492256], "v": "v0.6"}
{"i": [["[\"3de659bda0b18c5fe8c5c8f8ce54ea9d\", 1, 15, 106, 84, 15, 15, 4, 4, 1, 15, 1, 1, 1, 15, 212, 168, 1, 15, 212, 168]", "opencl -keys=opencl,gpu -max_num_threads=256 -thread_warp_size=1", [2, 16, 64, 4096, 409600, 512, 2, 1], "llvm -keys=cpu -link-params=0 -mtriple=aarch64-linux-gnu", 0, []], [[], [["CI", 5], ["SP", 3, 0, 1, [1, 1, 1, 1], 1], ["SP", 3, 5, 15, [1, 3, 1, 1], 1], ["SP", 3, 10, 212, [2, 2, 1, 1], 1], ["SP", 3, 15, 168, [1, 1, 2, 1], 1], ["SP", 3, 20, 15, [1, 1], 1], ["SP", 3, 23, 4, [1, 4], 1], ["SP", 3, 26, 4, [1, 2], 1], ["RE", 3, [0, 5, 10, 15, 1, 6, 11, 16, 2, 7, 12, 17, 20, 23, 26, 21, 24, 27, 3, 8, 13, 18, 22, 25, 28, 4, 9, 14, 19]], ["FSP", 7, 0, 1, 3], ["FSP", 7, 4, 2, 3], ["FSP", 7, 8, 3, 3], ["FSP", 7, 12, 4, 3], ["RE", 7, [0, 4, 8, 12, 1, 5, 9, 13, 2, 6, 10, 14, 3, 7, 11, 15]], ["CA", 3, 7, 11], ["CHR", 2, "shared", [3]], ["CA", 3, 4, 14], ["CHR", 1, "shared", [4]], ["CA", 2, 5, 14], ["CI", 1], ["FU", 9, [0, 1, 2, 3]], ["AN", 9, 0, 5], ["FU", 9, [1, 2, 3, 4]], ["AN", 9, 1, 4], ["FU", 9, [2, 3, 4, 5]], ["AN", 9, 2, 6], ["FU", 4, [0, 1, 2, 3]], ["SP", 4, 0, 8, [1], 1], ["AN", 4, 1, 2], ["FFSP", 4, 0, [4, 3, 2, 1], 1, 1], ["AN", 4, 1, 6], ["FU", 2, [0, 1, 2, 3]], ["SP", 2, 0, 12, [1], 1], ["AN", 2, 1, 2], ["FFSP", 2, 0, [4, 3, 2, 1], 1, 1], ["AN", 2, 1, 6], ["PR", 5, 0, "auto_unroll_max_step$64"]]]], "r": [[0.0595414, 0.0586551, 0.0592372], 0, 8.42664, 1630492265], "v": "v0.6"}
{"i": [["[\"3de659bda0b18c5fe8c5c8f8ce54ea9d\", 1, 15, 106, 84, 15, 15, 4, 4, 1, 15, 1, 1, 1, 15, 212, 168, 1, 15, 212, 168]", "opencl -keys=opencl,gpu -max_num_threads=256 -thread_warp_size=1", [2, 16, 64, 4096, 409600, 512, 2, 1], "llvm -keys=cpu -link-params=0 -mtriple=aarch64-linux-gnu", 0, []], [[], [["CI", 5], ["SP", 3, 0, 1, [1, 1, 1, 1], 1], ["SP", 3, 5, 15, [1, 3, 1, 1], 1], ["SP", 3, 10, 212, [2, 2, 1, 1], 1], ["SP", 3, 15, 168, [1, 1, 2, 1], 1], ["SP", 3, 20, 15, [1, 1], 1], ["SP", 3, 23, 4, [1, 4], 1], ["SP", 3, 26, 4, [1, 2], 1], ["RE", 3, [0, 5, 10, 15, 1, 6, 11, 16, 2, 7, 12, 17, 20, 23, 26, 21, 24, 27, 3, 8, 13, 18, 22, 25, 28, 4, 9, 14, 19]], ["FSP", 7, 0, 1, 3], ["FSP", 7, 4, 2, 3], ["FSP", 7, 8, 3, 3], ["FSP", 7, 12, 4, 3], ["RE", 7, [0, 4, 8, 12, 1, 5, 9, 13, 2, 6, 10, 14, 3, 7, 11, 15]], ["CA", 3, 7, 11], ["CHR", 2, "shared", [3]], ["CA", 3, 4, 14], ["CHR", 1, "shared", [4]], ["CA", 2, 5, 14], ["CI", 1], ["FU", 9, [0, 1, 2, 3]], ["AN", 9, 0, 5], ["FU", 9, [1, 2, 3, 4]], ["AN", 9, 1, 4], ["FU", 9, [2, 3, 4, 5]], ["AN", 9, 2, 6], ["FU", 4, [0, 1, 2, 3]], ["SP", 4, 0, 8, [1], 1], ["AN", 4, 1, 2], ["FFSP", 4, 0, [4, 3, 2, 1], 1, 1], ["AN", 4, 1, 6], ["FU", 2, [0, 1, 2, 3]], ["SP", 2, 0, 12, [1], 1], ["AN", 2, 1, 2], ["FFSP", 2, 0, [4, 3, 2, 1], 1, 1], ["AN", 2, 1, 6], ["PR", 5, 0, "auto_unroll_max_step$16"]]]], "r": [[0.060492, 0.0651866, 0.0588512], 0, 15.6106, 1630492280], "v": "v0.6"}
{"i": [["[\"3de659bda0b18c5fe8c5c8f8ce54ea9d\", 1, 15, 106, 84, 15, 15, 4, 4, 1, 15, 1, 1, 1, 15, 212, 168, 1, 15, 212, 168]", "opencl -keys=opencl,gpu -max_num_threads=256 -thread_warp_size=1", [2, 16, 64, 4096, 409600, 512, 2, 1], "llvm -keys=cpu -link-params=0 -mtriple=aarch64-linux-gnu", 0, []], [[], [["CI", 5], ["SP", 3, 0, 1, [1, 1, 1, 1], 1], ["SP", 3, 5, 15, [1, 3, 1, 5], 1], ["SP", 3, 10, 212, [2, 1, 2, 1], 1], ["SP", 3, 15, 168, [1, 2, 1, 4], 1], ["SP", 3, 20, 15, [1, 3], 1], ["SP", 3, 23, 4, [1, 4], 1], ["SP", 3, 26, 4, [2, 2], 1], ["RE", 3, [0, 5, 10, 15, 1, 6, 11, 16, 2, 7, 12, 17, 20, 23, 26, 21, 24, 27, 3, 8, 13, 18, 22, 25, 28, 4, 9, 14, 19]], ["FSP", 7, 0, 1, 3], ["FSP", 7, 4, 2, 3], ["FSP", 7, 8, 3, 3], ["FSP", 7, 12, 4, 3], ["RE", 7, [0, 4, 8, 12, 1, 5, 9, 13, 2, 6, 10, 14, 3, 7, 11, 15]], ["CA", 3, 7, 11], ["CHR", 2, "shared", [3]], ["CA", 3, 4, 14], ["CHR", 1, "shared", [4]], ["CA", 2, 5, 14], ["CI", 1], ["FU", 9, [0, 1, 2, 3]], ["AN", 9, 0, 5], ["FU", 9, [1, 2, 3, 4]], ["AN", 9, 1, 4], ["FU", 9, [2, 3, 4, 5]], ["AN", 9, 2, 6], ["FU", 4, [0, 1, 2, 3]], ["SP", 4, 0, 240, [1], 1], ["AN", 4, 1, 2], ["FFSP", 4, 0, [4, 3, 2, 1], 1, 1], ["AN", 4, 1, 6], ["FU", 2, [0, 1, 2, 3]], ["SP", 2, 0, 105, [1], 1], ["AN", 2, 1, 2], ["FFSP", 2, 0, [4, 3, 2, 1], 1, 1], ["AN", 2, 1, 6], ["PR", 5, 0, "auto_unroll_max_step$64"]]]], "r": [[0.184796, 0.192472, 0.188477], 0, 21.2093, 1630492301], "v": "v0.6"}
{"i": [["[\"3de659bda0b18c5fe8c5c8f8ce54ea9d\", 1, 4, 106, 84, 4, 4, 4, 4, 1, 4, 1, 1, 1, 4, 212, 168, 1, 4, 212, 168]", "opencl -keys=opencl,gpu -max_num_threads=256 -thread_warp_size=1", [2, 16, 64, 4096, 409600, 512, 2, 1], "llvm -keys=cpu -link-params=0 -mtriple=aarch64-linux-gnu", 0, []], [[], [["CI", 5], ["SP", 3, 0, 1, [1, 1, 1, 1], 1], ["SP", 3, 5, 4, [1, 1, 1, 4], 1], ["SP", 3, 10, 212, [4, 1, 1, 1], 1], ["SP", 3, 15, 168, [1, 1, 1, 1], 1], ["SP", 3, 20, 4, [2, 2], 1], ["SP", 3, 23, 4, [4, 1], 1], ["SP", 3, 26, 4, [1, 2], 1], ["RE", 3, [0, 5, 10, 15, 1, 6, 11, 16, 2, 7, 12, 17, 20, 23, 26, 21, 24, 27, 3, 8, 13, 18, 22, 25, 28, 4, 9, 14, 19]], ["FSP", 7, 0, 1, 3], ["FSP", 7, 4, 2, 3], ["FSP", 7, 8, 3, 3], ["FSP", 7, 12, 4, 3], ["RE", 7, [0, 4, 8, 12, 1, 5, 9, 13, 2, 6, 10, 14, 3, 7, 11, 15]], ["CA", 3, 7, 11], ["CHR", 2, "shared", [3]], ["CA", 3, 4, 14], ["CHR", 1, "shared", [4]], ["CA", 2, 5, 14], ["CI", 1], ["FU", 9, [0, 1, 2, 3]], ["AN", 9, 0, 5], ["FU", 9, [1, 2, 3, 4]], ["AN", 9, 1, 4], ["FU", 9, [2, 3, 4, 5]], ["AN", 9, 2, 6], ["FU", 4, [0, 1, 2, 3]], ["SP", 4, 0, 64, [1], 1], ["AN", 4, 1, 2], ["FFSP", 4, 0, [4, 3, 2, 1], 1, 1], ["AN", 4, 1, 6], ["FU", 2, [0, 1, 2, 3]], ["SP", 2, 0, 16, [1], 1], ["AN", 2, 1, 2], ["FFSP", 2, 0, [4, 3, 2, 1], 1, 1], ["AN", 2, 1, 6], ["PR", 5, 0, "auto_unroll_max_step$64"]]]], "r": [[0.0342302, 0.033231, 0.0331893], 0, 38.6245, 1630492560], "v": "v0.6"}
{"i": [["[\"3de659bda0b18c5fe8c5c8f8ce54ea9d\", 1, 4, 106, 84, 4, 4, 4, 4, 1, 4, 1, 1, 1, 4, 212, 168, 1, 4, 212, 168]", "opencl -keys=opencl,gpu -max_num_threads=256 -thread_warp_size=1", [2, 16, 64, 4096, 409600, 512, 2, 1], "llvm -keys=cpu -link-params=0 -mtriple=aarch64-linux-gnu", 0, []], [[], [["CI", 5], ["SP", 3, 0, 1, [1, 1, 1, 1], 1], ["SP", 3, 5, 4, [1, 1, 1, 4], 1], ["SP", 3, 10, 212, [1, 1, 4, 1], 1], ["SP", 3, 15, 168, [2, 1, 1, 1], 1], ["SP", 3, 20, 4, [4, 1], 1], ["SP", 3, 23, 4, [4, 1], 1], ["SP", 3, 26, 4, [1, 1], 1], ["RE", 3, [0, 5, 10, 15, 1, 6, 11, 16, 2, 7, 12, 17, 20, 23, 26, 21, 24, 27, 3, 8, 13, 18, 22, 25, 28, 4, 9, 14, 19]], ["FSP", 7, 0, 1, 3], ["FSP", 7, 4, 2, 3], ["FSP", 7, 8, 3, 3], ["FSP", 7, 12, 4, 3], ["RE", 7, [0, 4, 8, 12, 1, 5, 9, 13, 2, 6, 10, 14, 3, 7, 11, 15]], ["CA", 3, 7, 11], ["CHR", 2, "shared", [3]], ["CA", 3, 4, 14], ["CHR", 1, "shared", [4]], ["CA", 2, 5, 14], ["CI", 1], ["FU", 9, [0, 1, 2, 3]], ["AN", 9, 0, 5], ["FU", 9, [1, 2, 3, 4]], ["AN", 9, 1, 4], ["FU", 9, [2, 3, 4, 5]], ["AN", 9, 2, 6], ["FU", 4, [0, 1, 2, 3]], ["SP", 4, 0, 64, [1], 1], ["AN", 4, 1, 2], ["FFSP", 4, 0, [4, 3, 2, 1], 1, 1], ["AN", 4, 1, 6], ["FU", 2, [0, 1, 2, 3]], ["SP", 2, 0, 16, [4], 1], ["AN", 2, 1, 2], ["FFSP", 2, 0, [4, 3, 2, 1], 1, 1], ["AN", 2, 1, 6], ["PR", 5, 0, "auto_unroll_max_step$64"]]]], "r": [[0.00758957, 0.00817548, 0.00772581], 0, 32.1199, 1630492692], "v": "v0.6"}
{"i": [["[\"3de659bda0b18c5fe8c5c8f8ce54ea9d\", 1, 4, 106, 84, 4, 4, 4, 4, 1, 4, 1, 1, 1, 4, 212, 168, 1, 4, 212, 168]", "opencl -keys=opencl,gpu -max_num_threads=256 -thread_warp_size=1", [2, 16, 64, 4096, 409600, 512, 2, 1], "llvm -keys=cpu -link-params=0 -mtriple=aarch64-linux-gnu", 0, []], [[], [["CI", 5], ["SP", 3, 0, 1, [1, 1, 1, 1], 1], ["SP", 3, 5, 4, [1, 4, 1, 1], 1], ["SP", 3, 10, 212, [1, 2, 2, 1], 1], ["SP", 3, 15, 168, [2, 7, 3, 2], 1], ["SP", 3, 20, 4, [1, 2], 1], ["SP", 3, 23, 4, [1, 1], 1], ["SP", 3, 26, 4, [1, 1], 1], ["RE", 3, [0, 5, 10, 15, 1, 6, 11, 16, 2, 7, 12, 17, 20, 23, 26, 21, 24, 27, 3, 8, 13, 18, 22, 25, 28, 4, 9, 14, 19]], ["FSP", 7, 0, 1, 3], ["FSP", 7, 4, 2, 3], ["FSP", 7, 8, 3, 3], ["FSP", 7, 12, 4, 3], ["RE", 7, [0, 4, 8, 12, 1, 5, 9, 13, 2, 6, 10, 14, 3, 7, 11, 15]], ["CA", 3, 7, 11], ["CHR", 2, "shared", [3]], ["CA", 3, 4, 14], ["CHR", 1, "shared", [4]], ["CA", 2, 5, 14], ["CI", 1], ["FU", 9, [0, 1, 2, 3]], ["AN", 9, 0, 5], ["FU", 9, [1, 2, 3, 4]], ["AN", 9, 1, 4], ["FU", 9, [2, 3, 4, 5]], ["AN", 9, 2, 6], ["FU", 4, [0, 1, 2, 3]], ["SP", 4, 0, 2, [1], 1], ["AN", 4, 1, 2], ["FFSP", 4, 0, [4, 3, 2, 1], 1, 1], ["AN", 4, 1, 6], ["FU", 2, [0, 1, 2, 3]], ["SP", 2, 0, 24, [1], 1], ["AN", 2, 1, 2], ["FFSP", 2, 0, [4, 3, 2, 1], 1, 1], ["AN", 2, 1, 6], ["PR", 5, 0, "auto_unroll_max_step$16"]]]], "r": [[0.00597582, 0.00608724, 0.00602757], 0, 39.3932, 1630492832], "v": "v0.6"}
{"i": [["[\"3de659bda0b18c5fe8c5c8f8ce54ea9d\", 1, 4, 106, 84, 4, 4, 4, 4, 1, 4, 1, 1, 1, 4, 212, 168, 1, 4, 212, 168]", "opencl -keys=opencl,gpu -max_num_threads=256 -thread_warp_size=1", [2, 16, 64, 4096, 409600, 512, 2, 1], "llvm -keys=cpu -link-params=0 -mtriple=aarch64-linux-gnu", 0, []], [[], [["CI", 5], ["SP", 3, 0, 1, [1, 1, 1, 1], 1], ["SP", 3, 5, 4, [1, 1, 2, 2], 1], ["SP", 3, 10, 212, [1, 1, 4, 1], 1], ["SP", 3, 15, 168, [1, 1, 1, 1], 1], ["SP", 3, 20, 4, [2, 2], 1], ["SP", 3, 23, 4, [4, 1], 1], ["SP", 3, 26, 4, [1, 1], 1], ["RE", 3, [0, 5, 10, 15, 1, 6, 11, 16, 2, 7, 12, 17, 20, 23, 26, 21, 24, 27, 3, 8, 13, 18, 22, 25, 28, 4, 9, 14, 19]], ["FSP", 7, 0, 1, 3], ["FSP", 7, 4, 2, 3], ["FSP", 7, 8, 3, 3], ["FSP", 7, 12, 4, 3], ["RE", 7, [0, 4, 8, 12, 1, 5, 9, 13, 2, 6, 10, 14, 3, 7, 11, 15]], ["CA", 3, 7, 11], ["CHR", 2, "shared", [3]], ["CA", 3, 4, 14], ["CHR", 1, "shared", [4]], ["CA", 2, 5, 14], ["CI", 1], ["FU", 9, [0, 1, 2, 3]], ["AN", 9, 0, 5], ["FU", 9, [1, 2, 3, 4]], ["AN", 9, 1, 4], ["FU", 9, [2, 3, 4, 5]], ["AN", 9, 2, 6], ["FU", 4, [0, 1, 2, 3]], ["SP", 4, 0, 64, [1], 1], ["AN", 4, 1, 2], ["FFSP", 4, 0, [4, 3, 2, 1], 1, 1], ["AN", 4, 1, 6], ["FU", 2, [0, 1, 2, 3]], ["SP", 2, 0, 16, [1], 1], ["AN", 2, 1, 2], ["FFSP", 2, 0, [4, 3, 2, 1], 1, 1], ["AN", 2, 1, 6], ["PR", 5, 0, "auto_unroll_max_step$64"]]]], "r": [[0.0113517, 0.0113584, 0.0116774], 0, 8.58803, 1630492841], "v": "v0.6"}
{"i": [["[\"3de659bda0b18c5fe8c5c8f8ce54ea9d\", 1, 4, 106, 84, 4, 4, 4, 4, 1, 4, 1, 1, 1, 4, 212, 168, 1, 4, 212, 168]", "opencl -keys=opencl,gpu -max_num_threads=256 -thread_warp_size=1", [2, 16, 64, 4096, 409600, 512, 2, 1], "llvm -keys=cpu -link-params=0 -mtriple=aarch64-linux-gnu", 0, []], [[], [["CI", 5], ["SP", 3, 0, 1, [1, 1, 1, 1], 1], ["SP", 3, 5, 4, [1, 1, 1, 1], 1], ["SP", 3, 10, 212, [1, 4, 53, 1], 1], ["SP", 3, 15, 168, [1, 84, 1, 2], 1], ["SP", 3, 20, 4, [4, 1], 1], ["SP", 3, 23, 4, [1, 1], 1], ["SP", 3, 26, 4, [1, 2], 1], ["RE", 3, [0, 5, 10, 15, 1, 6, 11, 16, 2, 7, 12, 17, 20, 23, 26, 21, 24, 27, 3, 8, 13, 18, 22, 25, 28, 4, 9, 14, 19]], ["FSP", 7, 0, 1, 3], ["FSP", 7, 4, 2, 3], ["FSP", 7, 8, 3, 3], ["FSP", 7, 12, 4, 3], ["RE", 7, [0, 4, 8, 12, 1, 5, 9, 13, 2, 6, 10, 14, 3, 7, 11, 15]], ["CA", 3, 7, 11], ["CI", 1], ["FU", 7, [0, 1, 2, 3]], ["AN", 7, 0, 5], ["FU", 7, [1, 2, 3, 4]], ["AN", 7, 1, 4], ["FU", 7, [2, 3, 4, 5]], ["AN", 7, 2, 6], ["PR", 3, 0, "auto_unroll_max_step$16"], ["AN", 3, 28, 2], ["AN", 7, 6, 2]]]], "r": [[0.0341741, 0.00858228, 0.007756], 0, 41.8181, 1630493133], "v": "v0.6"}
{"i": [["[\"3de659bda0b18c5fe8c5c8f8ce54ea9d\", 1, 4, 106, 84, 4, 4, 4, 4, 1, 4, 1, 1, 1, 4, 212, 168, 1, 4, 212, 168]", "opencl -keys=opencl,gpu -max_num_threads=256 -thread_warp_size=1", [2, 16, 64, 4096, 409600, 512, 2, 1], "llvm -keys=cpu -link-params=0 -mtriple=aarch64-linux-gnu", 0, []], [[], [["CI", 5], ["SP", 3, 0, 1, [1, 1, 1, 1], 1], ["SP", 3, 5, 4, [1, 1, 1, 1], 1], ["SP", 3, 10, 212, [1, 4, 53, 1], 1], ["SP", 3, 15, 168, [1, 84, 1, 2], 1], ["SP", 3, 20, 4, [2, 1], 1], ["SP", 3, 23, 4, [1, 1], 1], ["SP", 3, 26, 4, [2, 2], 1], ["RE", 3, [0, 5, 10, 15, 1, 6, 11, 16, 2, 7, 12, 17, 20, 23, 26, 21, 24, 27, 3, 8, 13, 18, 22, 25, 28, 4, 9, 14, 19]], ["FSP", 7, 0, 1, 3], ["FSP", 7, 4, 2, 3], ["FSP", 7, 8, 3, 3], ["FSP", 7, 12, 4, 3], ["RE", 7, [0, 4, 8, 12, 1, 5, 9, 13, 2, 6, 10, 14, 3, 7, 11, 15]], ["CA", 3, 7, 11], ["CI", 1], ["FU", 7, [0, 1, 2, 3]], ["AN", 7, 0, 5], ["FU", 7, [1, 2, 3, 4]], ["AN", 7, 1, 4], ["FU", 7, [2, 3, 4, 5]], ["AN", 7, 2, 6], ["PR", 3, 0, "auto_unroll_max_step$64"], ["AN", 3, 28, 2], ["AN", 7, 6, 2]]]], "r": [[0.00748321, 0.00743692, 0.00807473], 0, 22.5948, 1630493256], "v": "v0.6"}
{"i": [["[\"f09f3f33f76116d85452966717e745d5\", 1, 16, 424, 336, 1, 16, 212, 168]", "opencl -keys=opencl,gpu -max_num_threads=256 -thread_warp_size=1", [2, 16, 64, 4096, 409600, 512, 2, 1], "llvm -keys=cpu -link-params=0 -mtriple=aarch64-linux-gnu", 0, []], [[], [["FU", 2, [4, 5]], ["SP", 2, 4, 4, [1], 1], ["RF", 2, 5, 4], ["RE", 2, [0, 1, 2, 3, 5, 4]], ["CI", 1], ["FU", 3, [0, 1, 2, 3]], ["SP", 3, 0, 569856, [42], 1], ["AN", 3, 0, 5], ["AN", 3, 1, 6], ["FU", 2, [0, 1, 2, 3]], ["SP", 2, 0, 569856, [21], 1], ["AN", 2, 0, 5], ["AN", 2, 1, 6], ["PR", 2, 0, "auto_unroll_max_step$1024"], ["PR", 3, 0, "auto_unroll_max_step$0"], ["AN", 2, 3, 2]]]], "r": [[0.00532654, 0.0053367, 0.00571006], 0, 3.00112, 1630493373], "v": "v0.6"}
{"i": [["[\"f09f3f33f76116d85452966717e745d5\", 1, 16, 424, 336, 1, 16, 212, 168]", "opencl -keys=opencl,gpu -max_num_threads=256 -thread_warp_size=1", [2, 16, 64, 4096, 409600, 512, 2, 1], "llvm -keys=cpu -link-params=0 -mtriple=aarch64-linux-gnu", 0, []], [[], [["FU", 2, [4, 5]], ["SP", 2, 4, 4, [4], 1], ["RF", 2, 4, 4], ["CI", 1], ["FU", 3, [0, 1, 2, 3]], ["SP", 3, 0, 569856, [42], 1], ["AN", 3, 0, 5], ["AN", 3, 1, 6], ["FU", 2, [0, 1, 2, 3, 4]], ["SP", 2, 0, 1139712, [21], 1], ["AN", 2, 0, 5], ["AN", 2, 1, 6], ["PR", 2, 0, "auto_unroll_max_step$512"], ["PR", 3, 0, "auto_unroll_max_step$512"]]]], "r": [[0.00538698, 0.0053946, 0.00540916], 0, 8.22665, 1630493381], "v": "v0.6"}
{"i": [["[\"f09f3f33f76116d85452966717e745d5\", 1, 16, 424, 336, 1, 16, 212, 168]", "opencl -keys=opencl,gpu -max_num_threads=256 -thread_warp_size=1", [2, 16, 64, 4096, 409600, 512, 2, 1], "llvm -keys=cpu -link-params=0 -mtriple=aarch64-linux-gnu", 0, []], [[], [["FU", 2, [4, 5]], ["SP", 2, 4, 4, [1], 1], ["RF", 2, 5, 4], ["RE", 2, [0, 1, 2, 3, 5, 4]], ["CI", 1], ["FU", 3, [0, 1, 2, 3]], ["SP", 3, 0, 569856, [42], 1], ["AN", 3, 0, 5], ["AN", 3, 1, 6], ["FU", 2, [0, 1, 2, 3]], ["SP", 2, 0, 569856, [21], 1], ["AN", 2, 0, 5], ["AN", 2, 1, 6], ["PR", 2, 0, "auto_unroll_max_step$64"], ["PR", 3, 0, "auto_unroll_max_step$512"], ["AN", 2, 3, 2]]]], "r": [[0.00527384, 0.00528611, 0.00544529], 0, 49.1649, 1630493530], "v": "v0.6"}
{"i": [["[\"f09f3f33f76116d85452966717e745d5\", 1, 16, 424, 336, 1, 16, 212, 168]", "opencl -keys=opencl,gpu -max_num_threads=256 -thread_warp_size=1", [2, 16, 64, 4096, 409600, 512, 2, 1], "llvm -keys=cpu -link-params=0 -mtriple=aarch64-linux-gnu", 0, []], [[], [["FU", 2, [4, 5]], ["SP", 2, 4, 4, [4], 1], ["RF", 2, 4, 4], ["CI", 1], ["FU", 3, [0, 1, 2, 3]], ["SP", 3, 0, 569856, [42], 1], ["AN", 3, 0, 5], ["AN", 3, 1, 6], ["FU", 2, [0, 1, 2, 3, 4]], ["SP", 2, 0, 1139712, [21], 1], ["AN", 2, 0, 5], ["AN", 2, 1, 6], ["PR", 2, 0, "auto_unroll_max_step$512"], ["PR", 3, 0, "auto_unroll_max_step$0"]]]], "r": [[0.00542754, 0.00531089, 0.00533211], 0, 47.4892, 1630493678], "v": "v0.6"}
{"i": [["[\"f09f3f33f76116d85452966717e745d5\", 1, 16, 424, 336, 1, 16, 212, 168]", "opencl -keys=opencl,gpu -max_num_threads=256 -thread_warp_size=1", [2, 16, 64, 4096, 409600, 512, 2, 1], "llvm -keys=cpu -link-params=0 -mtriple=aarch64-linux-gnu", 0, []], [[], [["FU", 2, [4, 5]], ["SP", 2, 4, 4, [4], 1], ["RF", 2, 4, 4], ["CI", 1], ["FU", 3, [0, 1, 2, 3]], ["SP", 3, 0, 569856, [42], 1], ["AN", 3, 0, 5], ["AN", 3, 1, 6], ["FU", 2, [0, 1, 2, 3, 4]], ["SP", 2, 0, 1139712, [21], 1], ["AN", 2, 0, 5], ["AN", 2, 1, 6], ["PR", 2, 0, "auto_unroll_max_step$1024"], ["PR", 3, 0, "auto_unroll_max_step$16"]]]], "r": [[0.00527472, 0.00528386, 0.00531888], 0, 42.0875, 1630493820], "v": "v0.6"}
{"i": [["[\"f09f3f33f76116d85452966717e745d5\", 1, 16, 424, 336, 1, 16, 212, 168]", "opencl -keys=opencl,gpu -max_num_threads=256 -thread_warp_size=1", [2, 16, 64, 4096, 409600, 512, 2, 1], "llvm -keys=cpu -link-params=0 -mtriple=aarch64-linux-gnu", 0, []], [[], [["FU", 2, [4, 5]], ["SP", 2, 4, 4, [1], 1], ["RF", 2, 5, 4], ["RE", 2, [0, 1, 2, 3, 5, 4]], ["CI", 1], ["FU", 3, [0, 1, 2, 3]], ["SP", 3, 0, 569856, [42], 1], ["AN", 3, 0, 5], ["AN", 3, 1, 6], ["FU", 2, [0, 1, 2, 3]], ["SP", 2, 0, 569856, [16], 1], ["AN", 2, 0, 5], ["AN", 2, 1, 6], ["PR", 2, 0, "auto_unroll_max_step$1024"], ["PR", 3, 0, "auto_unroll_max_step$512"], ["AN", 2, 3, 2]]]], "r": [[0.0339296, 0.00530953, 0.00528407], 0, 30.5418, 1630493951], "v": "v0.6"}
{"i": [["[\"f09f3f33f76116d85452966717e745d5\", 1, 16, 424, 336, 1, 16, 212, 168]", "opencl -keys=opencl,gpu -max_num_threads=256 -thread_warp_size=1", [2, 16, 64, 4096, 409600, 512, 2, 1], "llvm -keys=cpu -link-params=0 -mtriple=aarch64-linux-gnu", 0, []], [[], [["FU", 2, [4, 5]], ["SP", 2, 4, 4, [4], 1], ["RF", 2, 4, 4], ["CI", 1], ["FU", 3, [0, 1, 2, 3]], ["SP", 3, 0, 569856, [42], 1], ["AN", 3, 0, 5], ["AN", 3, 1, 6], ["FU", 2, [0, 1, 2, 3, 4]], ["SP", 2, 0, 1139712, [16], 1], ["AN", 2, 0, 5], ["AN", 2, 1, 6], ["PR", 2, 0, "auto_unroll_max_step$1024"], ["PR", 3, 0, "auto_unroll_max_step$512"]]]], "r": [[0.0391941, 0.00552865, 0.00582424], 0, 8.16968, 1630493959], "v": "v0.6"}
{"i": [["[\"cf7c7a3bf9871fe4aa3fe21c1222fdb0\", 1, 15, 424, 336, 1, 15, 424, 336]", "opencl -keys=opencl,gpu -max_num_threads=256 -thread_warp_size=1", [2, 16, 64, 4096, 409600, 512, 2, 1], "llvm -keys=cpu -link-params=0 -mtriple=aarch64-linux-gnu", 0, []], [[], [["SP", 3, 3, 15, [3], 1], ["RF", 3, 4, 3], ["RE", 3, [0, 1, 2, 4, 3]], ["CI", 2], ["SP", 1, 3, 15, [3], 1], ["RF", 1, 3, 3], ["FU", 6, [0, 1, 2, 3]], ["SP", 6, 0, 2136960, [40], 1], ["AN", 6, 0, 5], ["AN", 6, 1, 6], ["FU", 5, [0, 1, 2]], ["SP", 5, 0, 142464, [2], 1], ["AN", 5, 0, 5], ["AN", 5, 1, 6], ["FU", 4, [0, 1, 2]], ["SP", 4, 0, 142464, [28], 1], ["AN", 4, 0, 5], ["AN", 4, 1, 6], ["FU", 2, [0, 1, 2]], ["SP", 2, 0, 142464, [2], 1], ["AN", 2, 0, 5], ["AN", 2, 1, 6], ["FU", 1, [0, 1, 2, 3]], ["SP", 1, 0, 712320, [1], 1], ["AN", 1, 0, 5], ["AN", 1, 1, 6], ["PR", 1, 0, "auto_unroll_max_step$0"], ["PR", 2, 0, "auto_unroll_max_step$512"], ["PR", 4, 0, "auto_unroll_max_step$512"], ["PR", 5, 0, "auto_unroll_max_step$512"], ["AN", 4, 3, 2]]]], "r": [[0.039822, 0.0398651, 0.0419127], 0, 44.4637, 1630494413], "v": "v0.6"}
{"i": [["[\"cf7c7a3bf9871fe4aa3fe21c1222fdb0\", 1, 15, 424, 336, 1, 15, 424, 336]", "opencl -keys=opencl,gpu -max_num_threads=256 -thread_warp_size=1", [2, 16, 64, 4096, 409600, 512, 2, 1], "llvm -keys=cpu -link-params=0 -mtriple=aarch64-linux-gnu", 0, []], [[], [["CI", 2], ["SP", 1, 3, 15, [3], 1], ["RF", 1, 4, 3], ["RE", 1, [0, 1, 2, 4, 3]], ["FU", 5, [0, 1, 2, 3]], ["SP", 5, 0, 2136960, [64], 1], ["AN", 5, 0, 5], ["AN", 5, 1, 6], ["FU", 4, [0, 1, 2]], ["SP", 4, 0, 142464, [2], 1], ["AN", 4, 0, 5], ["AN", 4, 1, 6], ["FU", 2, [0, 1, 2]], ["SP", 2, 0, 142464, [21], 1], ["AN", 2, 0, 5], ["AN", 2, 1, 6], ["FU", 1, [0, 1, 2]], ["SP", 1, 0, 142464, [1], 1], ["AN", 1, 0, 5], ["AN", 1, 1, 6], ["PR", 1, 0, "auto_unroll_max_step$512"], ["PR", 2, 0, "auto_unroll_max_step$16"], ["PR", 4, 0, "auto_unroll_max_step$0"], ["AN", 1, 3, 2]]]], "r": [[0.0330198, 0.0312668, 0.031294], 0, 31.7584, 1630494544], "v": "v0.6"}
{"i": [["[\"cf7c7a3bf9871fe4aa3fe21c1222fdb0\", 1, 15, 424, 336, 1, 15, 424, 336]", "opencl -keys=opencl,gpu -max_num_threads=256 -thread_warp_size=1", [2, 16, 64, 4096, 409600, 512, 2, 1], "llvm -keys=cpu -link-params=0 -mtriple=aarch64-linux-gnu", 0, []], [[], [["SP", 3, 3, 15, [1], 1], ["RF", 3, 3, 3], ["CI", 2], ["SP", 1, 3, 15, [5], 1], ["RF", 1, 3, 3], ["FU", 6, [0, 1, 2, 3]], ["SP", 6, 0, 2136960, [10], 1], ["AN", 6, 0, 5], ["AN", 6, 1, 6], ["FU", 5, [0, 1, 2]], ["SP", 5, 0, 142464, [1], 1], ["AN", 5, 0, 5], ["AN", 5, 1, 6], ["FU", 4, [0, 1, 2, 3]], ["SP", 4, 0, 2136960, [20], 1], ["AN", 4, 0, 5], ["AN", 4, 1, 6], ["FU", 2, [0, 1, 2]], ["SP", 2, 0, 142464, [32], 1], ["AN", 2, 0, 5], ["AN", 2, 1, 6], ["FU", 1, [0, 1, 2, 3]], ["SP", 1, 0, 427392, [2], 1], ["AN", 1, 0, 5], ["AN", 1, 1, 6], ["PR", 1, 0, "auto_unroll_max_step$0"], ["PR", 2, 0, "auto_unroll_max_step$16"], ["PR", 4, 0, "auto_unroll_max_step$64"], ["PR", 5, 0, "auto_unroll_max_step$0"]]]], "r": [[0.0489414, 0.0466392, 0.0474079], 0, 9.41258, 1630494554], "v": "v0.6"}
{"i": [["[\"cf7c7a3bf9871fe4aa3fe21c1222fdb0\", 1, 15, 424, 336, 1, 15, 424, 336]", "opencl -keys=opencl,gpu -max_num_threads=256 -thread_warp_size=1", [2, 16, 64, 4096, 409600, 512, 2, 1], "llvm -keys=cpu -link-params=0 -mtriple=aarch64-linux-gnu", 0, []], [[], [["SP", 3, 3, 15, [3], 1], ["RF", 3, 4, 3], ["RE", 3, [0, 1, 2, 4, 3]], ["CI", 2], ["SP", 1, 3, 15, [3], 1], ["RF", 1, 3, 3], ["FU", 6, [0, 1, 2, 3]], ["SP", 6, 0, 2136960, [2], 1], ["AN", 6, 0, 5], ["AN", 6, 1, 6], ["FU", 5, [0, 1, 2]], ["SP", 5, 0, 142464, [2], 1], ["AN", 5, 0, 5], ["AN", 5, 1, 6], ["FU", 4, [0, 1, 2]], ["SP", 4, 0, 142464, [7], 1], ["AN", 4, 0, 5], ["AN", 4, 1, 6], ["FU", 2, [0, 1, 2]], ["SP", 2, 0, 142464, [2], 1], ["AN", 2, 0, 5], ["AN", 2, 1, 6], ["FU", 1, [0, 1, 2, 3]], ["SP", 1, 0, 712320, [1], 1], ["AN", 1, 0, 5], ["AN", 1, 1, 6], ["PR", 1, 0, "auto_unroll_max_step$1024"], ["PR", 2, 0, "auto_unroll_max_step$512"], ["PR", 4, 0, "auto_unroll_max_step$512"], ["PR", 5, 0, "auto_unroll_max_step$512"], ["AN", 4, 3, 2]]]], "r": [[0.0419116, 0.0418039, 0.0418009], 0, 49.923, 1630494704], "v": "v0.6"}
{"i": [["[\"cf7c7a3bf9871fe4aa3fe21c1222fdb0\", 1, 15, 424, 336, 1, 15, 424, 336]", "opencl -keys=opencl,gpu -max_num_threads=256 -thread_warp_size=1", [2, 16, 64, 4096, 409600, 512, 2, 1], "llvm -keys=cpu -link-params=0 -mtriple=aarch64-linux-gnu", 0, []], [[], [["SP", 3, 3, 15, [3], 1], ["RF", 3, 4, 3], ["RE", 3, [0, 1, 2, 4, 3]], ["CI", 2], ["SP", 1, 3, 15, [3], 1], ["RF", 1, 3, 3], ["FU", 6, [0, 1, 2, 3]], ["SP", 6, 0, 2136960, [2], 1], ["AN", 6, 0, 5], ["AN", 6, 1, 6], ["FU", 5, [0, 1, 2]], ["SP", 5, 0, 142464, [32], 1], ["AN", 5, 0, 5], ["AN", 5, 1, 6], ["FU", 4, [0, 1, 2]], ["SP", 4, 0, 142464, [28], 1], ["AN", 4, 0, 5], ["AN", 4, 1, 6], ["FU", 2, [0, 1, 2]], ["SP", 2, 0, 142464, [24], 1], ["AN", 2, 0, 5], ["AN", 2, 1, 6], ["FU", 1, [0, 1, 2, 3]], ["SP", 1, 0, 712320, [1], 1], ["AN", 1, 0, 5], ["AN", 1, 1, 6], ["PR", 1, 0, "auto_unroll_max_step$1024"], ["PR", 2, 0, "auto_unroll_max_step$512"], ["PR", 4, 0, "auto_unroll_max_step$512"], ["PR", 5, 0, "auto_unroll_max_step$512"], ["AN", 4, 3, 2]]]], "r": [[0.041145, 0.0409267, 0.044786], 0, 50.0511, 1630494854], "v": "v0.6"}
{"i": [["[\"cf7c7a3bf9871fe4aa3fe21c1222fdb0\", 1, 15, 424, 336, 1, 15, 424, 336]", "opencl -keys=opencl,gpu -max_num_threads=256 -thread_warp_size=1", [2, 16, 64, 4096, 409600, 512, 2, 1], "llvm -keys=cpu -link-params=0 -mtriple=aarch64-linux-gnu", 0, []], [[], [["SP", 3, 3, 15, [3], 1], ["RF", 3, 4, 3], ["RE", 3, [0, 1, 2, 4, 3]], ["CI", 2], ["FU", 5, [0, 1, 2, 3]], ["SP", 5, 0, 2136960, [30], 1], ["AN", 5, 0, 5], ["AN", 5, 1, 6], ["FU", 4, [0, 1, 2]], ["SP", 4, 0, 142464, [28], 1], ["AN", 4, 0, 5], ["AN", 4, 1, 6], ["FU", 3, [0, 1, 2]], ["SP", 3, 0, 142464, [16], 1], ["AN", 3, 0, 5], ["AN", 3, 1, 6], ["FU", 1, [0, 1, 2]], ["SP", 1, 0, 142464, [2], 1], ["AN", 1, 0, 5], ["AN", 1, 1, 6], ["PR", 1, 0, "auto_unroll_max_step$1024"], ["PR", 3, 0, "auto_unroll_max_step$0"], ["PR", 4, 0, "auto_unroll_max_step$64"], ["AN", 3, 3, 2]]]], "r": [[0.0355701, 0.036296, 0.03643], 0, 49.6395, 1630495004], "v": "v0.6"}
{"i": [["[\"cf7c7a3bf9871fe4aa3fe21c1222fdb0\", 1, 15, 424, 336, 1, 15, 424, 336]", "opencl -keys=opencl,gpu -max_num_threads=256 -thread_warp_size=1", [2, 16, 64, 4096, 409600, 512, 2, 1], "llvm -keys=cpu -link-params=0 -mtriple=aarch64-linux-gnu", 0, []], [[], [["SP", 3, 3, 15, [15], 1], ["RF", 3, 3, 3], ["CI", 2], ["FU", 5, [0, 1, 2, 3]], ["SP", 5, 0, 2136960, [8], 1], ["AN", 5, 0, 5], ["AN", 5, 1, 6], ["FU", 4, [0, 1, 2]], ["SP", 4, 0, 142464, [2], 1], ["AN", 4, 0, 5], ["AN", 4, 1, 6], ["FU", 3, [0, 1, 2, 3]], ["SP", 3, 0, 427392, [2], 1], ["AN", 3, 0, 5], ["AN", 3, 1, 6], ["FU", 1, [0, 1, 2]], ["SP", 1, 0, 142464, [2], 1], ["AN", 1, 0, 5], ["AN", 1, 1, 6], ["PR", 1, 0, "auto_unroll_max_step$512"], ["PR", 3, 0, "auto_unroll_max_step$64"], ["PR", 4, 0, "auto_unroll_max_step$1024"]]]], "r": [[0.0326198, 0.0338256, 0.04325], 0, 19.9008, 1630495374], "v": "v0.6"}
{"i": [["[\"5a5d7a8547d34798d6f42c3bb7a23a25\", 1, 16, 424, 336, 16, 16, 3, 3, 1, 16, 1, 1, 1, 16, 424, 336]", "opencl -keys=opencl,gpu -max_num_threads=256 -thread_warp_size=1", [2, 16, 64, 4096, 409600, 512, 2, 1], "llvm -keys=cpu -link-params=0 -mtriple=aarch64-linux-gnu", 0, []], [[], [["CI", 5], ["SP", 3, 0, 1, [1, 1, 1, 1], 1], ["SP", 3, 5, 16, [1, 2, 2, 4], 1], ["SP", 3, 10, 424, [1, 2, 2, 2], 1], ["SP", 3, 15, 336, [1, 14, 3, 2], 1], ["SP", 3, 20, 16, [1, 1], 1], ["SP", 3, 23, 3, [3, 1], 1], ["SP", 3, 26, 3, [1, 3], 1], ["RE", 3, [0, 5, 10, 15, 1, 6, 11, 16, 2, 7, 12, 17, 20, 23, 26, 21, 24, 27, 3, 8, 13, 18, 22, 25, 28, 4, 9, 14, 19]], ["FSP", 6, 0, 1, 3], ["FSP", 6, 4, 2, 3], ["FSP", 6, 8, 3, 3], ["FSP", 6, 12, 4, 3], ["RE", 6, [0, 4, 8, 12, 1, 5, 9, 13, 2, 6, 10, 14, 3, 7, 11, 15]], ["CA", 3, 6, 11], ["CHR", 2, "shared", [3]], ["CA", 3, 4, 14], ["CHR", 1, "shared", [4]], ["CA", 2, 5, 14], ["CI", 1], ["FU", 8, [0, 1, 2, 3]], ["AN", 8, 0, 5], ["FU", 8, [1, 2, 3, 4]], ["AN", 8, 1, 4], ["FU", 8, [2, 3, 4, 5]], ["AN", 8, 2, 6], ["FU", 4, [0, 1, 2, 3]], ["SP", 4, 0, 24, [3], 1], ["AN", 4, 1, 2], ["FFSP", 4, 0, [4, 3, 2, 1], 1, 1], ["AN", 4, 1, 6], ["FU", 2, [0, 1, 2, 3]], ["SP", 2, 0, 32, [8], 1], ["AN", 2, 1, 2], ["FFSP", 2, 0, [4, 3, 2, 1], 1, 1], ["AN", 2, 1, 6], ["PR", 5, 0, "auto_unroll_max_step$512"]]]], "r": [[0.0952617, 0.0974371, 0.0963069], 0, 38.5429, 1630495531], "v": "v0.6"}
{"i": [["[\"5a5d7a8547d34798d6f42c3bb7a23a25\", 1, 16, 424, 336, 16, 16, 3, 3, 1, 16, 1, 1, 1, 16, 424, 336]", "opencl -keys=opencl,gpu -max_num_threads=256 -thread_warp_size=1", [2, 16, 64, 4096, 409600, 512, 2, 1], "llvm -keys=cpu -link-params=0 -mtriple=aarch64-linux-gnu", 0, []], [[], [["CI", 5], ["SP", 3, 0, 1, [1, 1, 1, 1], 1], ["SP", 3, 5, 16, [1, 2, 4, 2], 1], ["SP", 3, 10, 424, [1, 2, 2, 2], 1], ["SP", 3, 15, 336, [1, 14, 1, 2], 1], ["SP", 3, 20, 16, [1, 1], 1], ["SP", 3, 23, 3, [1, 3], 1], ["SP", 3, 26, 3, [3, 1], 1], ["RE", 3, [0, 5, 10, 15, 1, 6, 11, 16, 2, 7, 12, 17, 20, 23, 26, 21, 24, 27, 3, 8, 13, 18, 22, 25, 28, 4, 9, 14, 19]], ["FSP", 6, 0, 1, 3], ["FSP", 6, 4, 2, 3], ["FSP", 6, 8, 3, 3], ["FSP", 6, 12, 4, 3], ["RE", 6, [0, 4, 8, 12, 1, 5, 9, 13, 2, 6, 10, 14, 3, 7, 11, 15]], ["CA", 3, 6, 11], ["CHR", 2, "shared", [3]], ["CA", 3, 4, 14], ["CHR", 1, "shared", [4]], ["CA", 2, 5, 14], ["CI", 1], ["FU", 8, [0, 1, 2, 3]], ["AN", 8, 0, 5], ["FU", 8, [1, 2, 3, 4]], ["AN", 8, 1, 4], ["FU", 8, [2, 3, 4, 5]], ["AN", 8, 2, 6], ["FU", 4, [0, 1, 2, 3]], ["SP", 4, 0, 24, [3], 1], ["AN", 4, 1, 2], ["FFSP", 4, 0, [4, 3, 2, 1], 1, 1], ["AN", 4, 1, 6], ["FU", 2, [0, 1, 2, 3]], ["SP", 2, 0, 32, [2], 1], ["AN", 2, 1, 2], ["FFSP", 2, 0, [4, 3, 2, 1], 1, 1], ["AN", 2, 1, 6], ["PR", 5, 0, "auto_unroll_max_step$512"]]]], "r": [[0.0379046, 0.0215643, 0.0217988], 0, 34.9385, 1630495672], "v": "v0.6"}
{"i": [["[\"5a5d7a8547d34798d6f42c3bb7a23a25\", 1, 16, 424, 336, 16, 16, 3, 3, 1, 16, 1, 1, 1, 16, 424, 336]", "opencl -keys=opencl,gpu -max_num_threads=256 -thread_warp_size=1", [2, 16, 64, 4096, 409600, 512, 2, 1], "llvm -keys=cpu -link-params=0 -mtriple=aarch64-linux-gnu", 0, []], [[], [["CI", 5], ["SP", 3, 0, 1, [1, 1, 1, 1], 1], ["SP", 3, 5, 16, [1, 2, 4, 2], 1], ["SP", 3, 10, 424, [1, 2, 2, 2], 1], ["SP", 3, 15, 336, [1, 14, 1, 2], 1], ["SP", 3, 20, 16, [1, 1], 1], ["SP", 3, 23, 3, [3, 1], 1], ["SP", 3, 26, 3, [1, 3], 1], ["RE", 3, [0, 5, 10, 15, 1, 6, 11, 16, 2, 7, 12, 17, 20, 23, 26, 21, 24, 27, 3, 8, 13, 18, 22, 25, 28, 4, 9, 14, 19]], ["FSP", 6, 0, 1, 3], ["FSP", 6, 4, 2, 3], ["FSP", 6, 8, 3, 3], ["FSP", 6, 12, 4, 3], ["RE", 6, [0, 4, 8, 12, 1, 5, 9, 13, 2, 6, 10, 14, 3, 7, 11, 15]], ["CA", 3, 6, 11], ["CHR", 2, "shared", [3]], ["CA", 3, 4, 14], ["CHR", 1, "shared", [4]], ["CA", 2, 5, 14], ["CI", 1], ["FU", 8, [0, 1, 2, 3]], ["AN", 8, 0, 5], ["FU", 8, [1, 2, 3, 4]], ["AN", 8, 1, 4], ["FU", 8, [2, 3, 4, 5]], ["AN", 8, 2, 6], ["FU", 4, [0, 1, 2, 3]], ["SP", 4, 0, 24, [3], 1], ["AN", 4, 1, 2], ["FFSP", 4, 0, [4, 3, 2, 1], 1, 1], ["AN", 4, 1, 6], ["FU", 2, [0, 1, 2, 3]], ["SP", 2, 0, 32, [2], 1], ["AN", 2, 1, 2], ["FFSP", 2, 0, [4, 3, 2, 1], 1, 1], ["AN", 2, 1, 6], ["PR", 5, 0, "auto_unroll_max_step$512"]]]], "r": [[0.156252, 0.0235229, 0.0242631], 0, 10.2543, 1630495683], "v": "v0.6"}
{"i": [["[\"5a5d7a8547d34798d6f42c3bb7a23a25\", 1, 16, 424, 336, 16, 16, 3, 3, 1, 16, 1, 1, 1, 16, 424, 336]", "opencl -keys=opencl,gpu -max_num_threads=256 -thread_warp_size=1", [2, 16, 64, 4096, 409600, 512, 2, 1], "llvm -keys=cpu -link-params=0 -mtriple=aarch64-linux-gnu", 0, []], [[], [["CI", 5], ["SP", 3, 0, 1, [1, 1, 1, 1], 1], ["SP", 3, 5, 16, [1, 4, 1, 4], 1], ["SP", 3, 10, 424, [1, 1, 8, 1], 1], ["SP", 3, 15, 336, [1, 14, 1, 2], 1], ["SP", 3, 20, 16, [1, 1], 1], ["SP", 3, 23, 3, [3, 1], 1], ["SP", 3, 26, 3, [1, 3], 1], ["RE", 3, [0, 5, 10, 15, 1, 6, 11, 16, 2, 7, 12, 17, 20, 23, 26, 21, 24, 27, 3, 8, 13, 18, 22, 25, 28, 4, 9, 14, 19]], ["FSP", 6, 0, 1, 3], ["FSP", 6, 4, 2, 3], ["FSP", 6, 8, 3, 3], ["FSP", 6, 12, 4, 3], ["RE", 6, [0, 4, 8, 12, 1, 5, 9, 13, 2, 6, 10, 14, 3, 7, 11, 15]], ["CA", 3, 6, 11], ["CHR", 2, "shared", [3]], ["CA", 3, 4, 14], ["CHR", 1, "shared", [4]], ["CA", 2, 5, 14], ["CI", 1], ["FU", 8, [0, 1, 2, 3]], ["AN", 8, 0, 5], ["FU", 8, [1, 2, 3, 4]], ["AN", 8, 1, 4], ["FU", 8, [2, 3, 4, 5]], ["AN", 8, 2, 6], ["FU", 4, [0, 1, 2, 3]], ["SP", 4, 0, 24, [3], 1], ["AN", 4, 1, 2], ["FFSP", 4, 0, [4, 3, 2, 1], 1, 1], ["AN", 4, 1, 6], ["FU", 2, [0, 1, 2, 3]], ["SP", 2, 0, 32, [1], 1], ["AN", 2, 1, 2], ["FFSP", 2, 0, [4, 3, 2, 1], 1, 1], ["AN", 2, 1, 6], ["PR", 5, 0, "auto_unroll_max_step$512"]]]], "r": [[0.0229616, 0.0230033, 0.0246736], 0, 41.4708, 1630496275], "v": "v0.6"}
{"i": [["[\"cf7c7a3bf9871fe4aa3fe21c1222fdb0\", 1, 4, 424, 336, 1, 4, 424, 336]", "opencl -keys=opencl,gpu -max_num_threads=256 -thread_warp_size=1", [2, 16, 64, 4096, 409600, 512, 2, 1], "llvm -keys=cpu -link-params=0 -mtriple=aarch64-linux-gnu", 0, []], [[], [["SP", 3, 3, 4, [1], 1], ["RF", 3, 4, 3], ["RE", 3, [0, 1, 2, 4, 3]], ["CI", 2], ["SP", 1, 3, 4, [1], 1], ["RF", 1, 4, 3], ["RE", 1, [0, 1, 2, 4, 3]], ["FU", 6, [0, 1, 2, 3]], ["SP", 6, 0, 569856, [2], 1], ["AN", 6, 0, 5], ["AN", 6, 1, 6], ["FU", 5, [0, 1, 2]], ["SP", 5, 0, 142464, [48], 1], ["AN", 5, 0, 5], ["AN", 5, 1, 6], ["FU", 4, [0, 1, 2]], ["SP", 4, 0, 142464, [2], 1], ["AN", 4, 0, 5], ["AN", 4, 1, 6], ["FU", 2, [0, 1, 2]], ["SP", 2, 0, 142464, [32], 1], ["AN", 2, 0, 5], ["AN", 2, 1, 6], ["FU", 1, [0, 1, 2]], ["SP", 1, 0, 142464, [2], 1], ["AN", 1, 0, 5], ["AN", 1, 1, 6], ["PR", 1, 0, "auto_unroll_max_step$0"], ["PR", 2, 0, "auto_unroll_max_step$64"], ["PR", 4, 0, "auto_unroll_max_step$512"], ["PR", 5, 0, "auto_unroll_max_step$64"], ["AN", 1, 3, 2], ["AN", 4, 3, 2]]]], "r": [[0.0731809, 0.0732604, 0.0112229], 0, 26.4873, 1630496560], "v": "v0.6"}
{"i": [["[\"cf7c7a3bf9871fe4aa3fe21c1222fdb0\", 1, 4, 424, 336, 1, 4, 424, 336]", "opencl -keys=opencl,gpu -max_num_threads=256 -thread_warp_size=1", [2, 16, 64, 4096, 409600, 512, 2, 1], "llvm -keys=cpu -link-params=0 -mtriple=aarch64-linux-gnu", 0, []], [[], [["CI", 2], ["SP", 1, 3, 4, [4], 1], ["RF", 1, 4, 3], ["RE", 1, [0, 1, 2, 4, 3]], ["FU", 5, [0, 1, 2, 3]], ["SP", 5, 0, 569856, [2], 1], ["AN", 5, 0, 5], ["AN", 5, 1, 6], ["FU", 4, [0, 1, 2]], ["SP", 4, 0, 142464, [64], 1], ["AN", 4, 0, 5], ["AN", 4, 1, 6], ["FU", 2, [0, 1, 2]], ["SP", 2, 0, 142464, [12], 1], ["AN", 2, 0, 5], ["AN", 2, 1, 6], ["FU", 1, [0, 1, 2]], ["SP", 1, 0, 142464, [42], 1], ["AN", 1, 0, 5], ["AN", 1, 1, 6], ["PR", 1, 0, "auto_unroll_max_step$512"], ["PR", 2, 0, "auto_unroll_max_step$16"], ["PR", 4, 0, "auto_unroll_max_step$1024"], ["AN", 1, 3, 2]]]], "r": [[0.00984303, 0.00982827, 0.00963055], 0, 33.7132, 1630496694], "v": "v0.6"}
{"i": [["[\"cf7c7a3bf9871fe4aa3fe21c1222fdb0\", 1, 4, 424, 336, 1, 4, 424, 336]", "opencl -keys=opencl,gpu -max_num_threads=256 -thread_warp_size=1", [2, 16, 64, 4096, 409600, 512, 2, 1], "llvm -keys=cpu -link-params=0 -mtriple=aarch64-linux-gnu", 0, []], [[], [["CI", 2], ["SP", 1, 3, 4, [2], 1], ["RF", 1, 3, 3], ["FU", 5, [0, 1, 2, 3]], ["SP", 5, 0, 569856, [48], 1], ["AN", 5, 0, 5], ["AN", 5, 1, 6], ["FU", 4, [0, 1, 2]], ["SP", 4, 0, 142464, [14], 1], ["AN", 4, 0, 5], ["AN", 4, 1, 6], ["FU", 2, [0, 1, 2]], ["SP", 2, 0, 142464, [12], 1], ["AN", 2, 0, 5], ["AN", 2, 1, 6], ["FU", 1, [0, 1, 2, 3]], ["SP", 1, 0, 284928, [14], 1], ["AN", 1, 0, 5], ["AN", 1, 1, 6], ["PR", 1, 0, "auto_unroll_max_step$0"], ["PR", 2, 0, "auto_unroll_max_step$64"], ["PR", 4, 0, "auto_unroll_max_step$16"]]]], "r": [[0.00921196, 0.00927427, 0.00966892], 0, 43.9596, 1630496738], "v": "v0.6"}
{"i": [["[\"cf7c7a3bf9871fe4aa3fe21c1222fdb0\", 1, 4, 424, 336, 1, 4, 424, 336]", "opencl -keys=opencl,gpu -max_num_threads=256 -thread_warp_size=1", [2, 16, 64, 4096, 409600, 512, 2, 1], "llvm -keys=cpu -link-params=0 -mtriple=aarch64-linux-gnu", 0, []], [[], [["CI", 2], ["SP", 1, 3, 4, [4], 1], ["RF", 1, 4, 3], ["RE", 1, [0, 1, 2, 4, 3]], ["FU", 5, [0, 1, 2, 3]], ["SP", 5, 0, 569856, [28], 1], ["AN", 5, 0, 5], ["AN", 5, 1, 6], ["FU", 4, [0, 1, 2]], ["SP", 4, 0, 142464, [2], 1], ["AN", 4, 0, 5], ["AN", 4, 1, 6], ["FU", 2, [0, 1, 2]], ["SP", 2, 0, 142464, [12], 1], ["AN", 2, 0, 5], ["AN", 2, 1, 6], ["FU", 1, [0, 1, 2]], ["SP", 1, 0, 142464, [42], 1], ["AN", 1, 0, 5], ["AN", 1, 1, 6], ["PR", 1, 0, "auto_unroll_max_step$512"], ["PR", 2, 0, "auto_unroll_max_step$16"], ["PR", 4, 0, "auto_unroll_max_step$1024"], ["AN", 1, 3, 2]]]], "r": [[0.0678617, 0.00976169, 0.0104227], 0, 9.17207, 1630496747], "v": "v0.6"}
{"i": [["[\"cf7c7a3bf9871fe4aa3fe21c1222fdb0\", 1, 4, 424, 336, 1, 4, 424, 336]", "opencl -keys=opencl,gpu -max_num_threads=256 -thread_warp_size=1", [2, 16, 64, 4096, 409600, 512, 2, 1], "llvm -keys=cpu -link-params=0 -mtriple=aarch64-linux-gnu", 0, []], [[], [["CI", 2], ["SP", 1, 3, 4, [4], 1], ["RF", 1, 4, 3], ["RE", 1, [0, 1, 2, 4, 3]], ["FU", 5, [0, 1, 2, 3]], ["SP", 5, 0, 569856, [56], 1], ["AN", 5, 0, 5], ["AN", 5, 1, 6], ["FU", 4, [0, 1, 2]], ["SP", 4, 0, 142464, [64], 1], ["AN", 4, 0, 5], ["AN", 4, 1, 6], ["FU", 2, [0, 1, 2]], ["SP", 2, 0, 142464, [6], 1], ["AN", 2, 0, 5], ["AN", 2, 1, 6], ["FU", 1, [0, 1, 2]], ["SP", 1, 0, 142464, [42], 1], ["AN", 1, 0, 5], ["AN", 1, 1, 6], ["PR", 1, 0, "auto_unroll_max_step$512"], ["PR", 2, 0, "auto_unroll_max_step$0"], ["PR", 4, 0, "auto_unroll_max_step$1024"], ["AN", 1, 3, 2]]]], "r": [[0.00920633, 0.00926464, 0.00924894], 0, 15.807, 1630496763], "v": "v0.6"}
