example_03/model-01-NCHW-B1-opencl-C2000-T21-08-29-15-57.json
{"i": [["[\"e4ec3906e80d2af01a06496bf02db0d3\", 1, 64, 27, 21, 15, 64, 1, 1, 1, 15, 1, 1, 1, 15, 27, 21]", "opencl -keys=mali,opencl,gpu -device=mali -max_num_threads=256 -thread_warp_size=1", [2, 16, 64, 4096, 40960, 512, 2, 2], "llvm -keys=cpu -link-params=0 -mtriple=aarch64-linux-gnu", 2, []], [[], [["CI", 6], ["CHW", 5, "local"], ["SP", 5, 0, 1, [1, 1, 1, 1], 1], ["SP", 5, 5, 5, [1, 1, 1, 5], 1], ["SP", 5, 10, 27, [1, 9, 1, 1], 1], ["SP", 5, 15, 7, [1, 1, 7, 1], 1], ["SP", 5, 20, 1, [1, 1, 1, 1], 1], ["SP", 5, 25, 3, [1, 1, 1, 1], 1], ["SP", 5, 30, 3, [1, 1, 1, 1], 1], ["SP", 5, 35, 64, [1, 64], 1], ["SP", 5, 38, 1, [1, 1], 1], ["SP", 5, 41, 1, [1, 1], 1], ["RE", 5, [0, 5, 10, 15, 20, 25, 30, 1, 6, 11, 16, 21, 26, 31, 2, 7, 12, 17, 22, 27, 32, 35, 38, 41, 36, 39, 42, 3, 8, 13, 18, 23, 28, 33, 37, 40, 43, 4, 9, 14, 19, 24, 29, 34]], ["FSP", 6, 0, 2, 3], ["FSP", 6, 4, 3, 3], ["FSP", 6, 8, 4, 3], ["FSP", 6, 12, 5, 3], ["FSP", 6, 16, 6, 3], ["FSP", 6, 20, 7, 3], ["FSP", 6, 24, 8, 3], ["RE", 6, [0, 4, 8, 12, 16, 20, 24, 1, 5, 9, 13, 17, 21, 25, 2, 6, 10, 14, 18, 22, 26, 3, 7, 11, 15, 19, 23, 27]], ["CA", 5, 6, 20], ["CI", 4], ["CI", 2], ["CI", 1], ["FU", 9, [0, 1, 2, 3]], ["SP", 9, 0, 8505, [2], 1], ["AN", 9, 0, 5], ["AN", 9, 1, 6], ["FU", 6, [0, 1, 2, 3, 4, 5, 6]], ["AN", 6, 0, 5], ["FU", 6, [1, 2, 3, 4, 5, 6, 7]], ["AN", 6, 1, 4], ["FU", 6, [2, 3, 4, 5, 6, 7, 8]], ["AN", 6, 2, 6], ["PR", 5, 0, "auto_unroll_max_step$0"], ["AN", 5, 43, 2], ["AN", 6, 9, 2]]]], "r": [[0.0139516, 0.00194348, 0.00195002], 0, 2.9323, 1630223892], "v": "v0.6"}
{"i": [["[\"e4ec3906e80d2af01a06496bf02db0d3\", 1, 64, 27, 21, 15, 64, 1, 1, 1, 15, 1, 1, 1, 15, 27, 21]", "opencl -keys=mali,opencl,gpu -device=mali -max_num_threads=256 -thread_warp_size=1", [2, 16, 64, 4096, 40960, 512, 2, 2], "llvm -keys=cpu -link-params=0 -mtriple=aarch64-linux-gnu", 2, []], [[], [["CI", 6], ["CHW", 5, "local"], ["SP", 5, 0, 1, [1, 1, 1, 1], 1], ["SP", 5, 5, 5, [1, 5, 1, 1], 1], ["SP", 5, 10, 27, [1, 1, 3, 1], 1], ["SP", 5, 15, 7, [1, 1, 1, 7], 1], ["SP", 5, 20, 1, [1, 1, 1, 1], 1], ["SP", 5, 25, 3, [1, 1, 1, 3], 1], ["SP", 5, 30, 3, [1, 1, 1, 1], 1], ["SP", 5, 35, 64, [1, 32], 1], ["SP", 5, 38, 1, [1, 1], 1], ["SP", 5, 41, 1, [1, 1], 1], ["RE", 5, [0, 5, 10, 15, 20, 25, 30, 1, 6, 11, 16, 21, 26, 31, 2, 7, 12, 17, 22, 27, 32, 35, 38, 41, 36, 39, 42, 3, 8, 13, 18, 23, 28, 33, 37, 40, 43, 4, 9, 14, 19, 24, 29, 34]], ["FSP", 6, 0, 2, 3], ["FSP", 6, 4, 3, 3], ["FSP", 6, 8, 4, 3], ["FSP", 6, 12, 5, 3], ["FSP", 6, 16, 6, 3], ["FSP", 6, 20, 7, 3], ["FSP", 6, 24, 8, 3], ["RE", 6, [0, 4, 8, 12, 16, 20, 24, 1, 5, 9, 13, 17, 21, 25, 2, 6, 10, 14, 18, 22, 26, 3, 7, 11, 15, 19, 23, 27]], ["CA", 5, 6, 20], ["CI", 4], ["CI", 2], ["CI", 1], ["FU", 9, [0, 1, 2, 3]], ["SP", 9, 0, 8505, [2], 1], ["AN", 9, 0, 5], ["AN", 9, 1, 6], ["FU", 6, [0, 1, 2, 3, 4, 5, 6]], ["AN", 6, 0, 5], ["FU", 6, [1, 2, 3, 4, 5, 6, 7]], ["AN", 6, 1, 4], ["FU", 6, [2, 3, 4, 5, 6, 7, 8]], ["AN", 6, 2, 6], ["PR", 5, 0, "auto_unroll_max_step$512"], ["AN", 5, 43, 2], ["AN", 6, 9, 2]]]], "r": [[0.00643871, 0.00640819, 0.00644179], 0, 8.29181, 1630223901], "v": "v0.6"}
{"i": [["[\"e4ec3906e80d2af01a06496bf02db0d3\", 1, 64, 27, 21, 15, 64, 1, 1, 1, 15, 1, 1, 1, 15, 27, 21]", "opencl -keys=mali,opencl,gpu -device=mali -max_num_threads=256 -thread_warp_size=1", [2, 16, 64, 4096, 40960, 512, 2, 2], "llvm -keys=cpu -link-params=0 -mtriple=aarch64-linux-gnu", 2, []], [[], [["CI", 6], ["CHW", 5, "local"], ["SP", 5, 0, 1, [1, 1, 1, 1], 1], ["SP", 5, 5, 5, [1, 1, 1, 1], 1], ["SP", 5, 10, 27, [1, 1, 3, 1], 1], ["SP", 5, 15, 7, [1, 7, 1, 1], 1], ["SP", 5, 20, 1, [1, 1, 1, 1], 1], ["SP", 5, 25, 3, [1, 1, 1, 3], 1], ["SP", 5, 30, 3, [1, 1, 1, 3], 1], ["SP", 5, 35, 64, [1, 2], 1], ["SP", 5, 38, 1, [1, 1], 1], ["SP", 5, 41, 1, [1, 1], 1], ["RE", 5, [0, 5, 10, 15, 20, 25, 30, 1, 6, 11, 16, 21, 26, 31, 2, 7, 12, 17, 22, 27, 32, 35, 38, 41, 36, 39, 42, 3, 8, 13, 18, 23, 28, 33, 37, 40, 43, 4, 9, 14, 19, 24, 29, 34]], ["FSP", 6, 0, 2, 3], ["FSP", 6, 4, 3, 3], ["FSP", 6, 8, 4, 3], ["FSP", 6, 12, 5, 3], ["FSP", 6, 16, 6, 3], ["FSP", 6, 20, 7, 3], ["FSP", 6, 24, 8, 3], ["RE", 6, [0, 4, 8, 12, 16, 20, 24, 1, 5, 9, 13, 17, 21, 25, 2, 6, 10, 14, 18, 22, 26, 3, 7, 11, 15, 19, 23, 27]], ["CA", 5, 6, 20], ["CI", 4], ["CI", 2], ["CI", 1], ["FU", 9, [0, 1, 2, 3]], ["SP", 9, 0, 8505, [4], 1], ["AN", 9, 0, 5], ["AN", 9, 1, 6], ["FU", 6, [0, 1, 2, 3, 4, 5, 6]], ["AN", 6, 0, 5], ["FU", 6, [1, 2, 3, 4, 5, 6, 7]], ["AN", 6, 1, 4], ["FU", 6, [2, 3, 4, 5, 6, 7, 8]], ["AN", 6, 2, 6], ["PR", 5, 0, "auto_unroll_max_step$512"], ["AN", 5, 43, 2], ["AN", 6, 9, 2]]]], "r": [[0.00149633, 0.00103524, 0.000629465], 0, 8.42672, 1630223909], "v": "v0.6"}
{"i": [["[\"e4ec3906e80d2af01a06496bf02db0d3\", 1, 64, 27, 21, 15, 64, 1, 1, 1, 15, 1, 1, 1, 15, 27, 21]", "opencl -keys=mali,opencl,gpu -device=mali -max_num_threads=256 -thread_warp_size=1", [2, 16, 64, 4096, 40960, 512, 2, 2], "llvm -keys=cpu -link-params=0 -mtriple=aarch64-linux-gnu", 2, []], [[], [["CI", 6], ["CHW", 5, "local"], ["SP", 5, 0, 1, [1, 1, 1, 1], 1], ["SP", 5, 5, 5, [1, 5, 1, 1], 1], ["SP", 5, 10, 27, [1, 3, 9, 1], 1], ["SP", 5, 15, 7, [1, 1, 7, 1], 1], ["SP", 5, 20, 1, [1, 1, 1, 1], 1], ["SP", 5, 25, 3, [1, 1, 1, 3], 1], ["SP", 5, 30, 3, [1, 1, 1, 1], 1], ["SP", 5, 35, 64, [32, 1], 1], ["SP", 5, 38, 1, [1, 1], 1], ["SP", 5, 41, 1, [1, 1], 1], ["RE", 5, [0, 5, 10, 15, 20, 25, 30, 1, 6, 11, 16, 21, 26, 31, 2, 7, 12, 17, 22, 27, 32, 35, 38, 41, 36, 39, 42, 3, 8, 13, 18, 23, 28, 33, 37, 40, 43, 4, 9, 14, 19, 24, 29, 34]], ["FSP", 6, 0, 2, 3], ["FSP", 6, 4, 3, 3], ["FSP", 6, 8, 4, 3], ["FSP", 6, 12, 5, 3], ["FSP", 6, 16, 6, 3], ["FSP", 6, 20, 7, 3], ["FSP", 6, 24, 8, 3], ["RE", 6, [0, 4, 8, 12, 16, 20, 24, 1, 5, 9, 13, 17, 21, 25, 2, 6, 10, 14, 18, 22, 26, 3, 7, 11, 15, 19, 23, 27]], ["CA", 5, 6, 20], ["CI", 4], ["CI", 2], ["CI", 1], ["FU", 9, [0, 1, 2, 3]], ["SP", 9, 0, 8505, [2], 1], ["AN", 9, 0, 5], ["AN", 9, 1, 6], ["FU", 6, [0, 1, 2, 3, 4, 5, 6]], ["AN", 6, 0, 5], ["FU", 6, [1, 2, 3, 4, 5, 6, 7]], ["AN", 6, 1, 4], ["FU", 6, [2, 3, 4, 5, 6, 7, 8]], ["AN", 6, 2, 6], ["PR", 5, 0, "auto_unroll_max_step$16"], ["AN", 5, 43, 2], ["AN", 6, 9, 2]]]], "r": [[0.00809892, 0.00114006, 0.00115367], 0, 8.73035, 1630223918], "v": "v0.6"}
{"i": [["[\"e4ec3906e80d2af01a06496bf02db0d3\", 1, 64, 27, 21, 15, 64, 1, 1, 1, 15, 1, 1, 1, 15, 27, 21]", "opencl -keys=mali,opencl,gpu -device=mali -max_num_threads=256 -thread_warp_size=1", [2, 16, 64, 4096, 40960, 512, 2, 2], "llvm -keys=cpu -link-params=0 -mtriple=aarch64-linux-gnu", 2, []], [[], [["CI", 6], ["CHW", 5, "local"], ["SP", 5, 0, 1, [1, 1, 1, 1], 1], ["SP", 5, 5, 5, [1, 1, 1, 1], 1], ["SP", 5, 10, 27, [1, 3, 3, 1], 1], ["SP", 5, 15, 7, [1, 7, 1, 1], 1], ["SP", 5, 20, 1, [1, 1, 1, 1], 1], ["SP", 5, 25, 3, [1, 1, 1, 3], 1], ["SP", 5, 30, 3, [1, 1, 1, 3], 1], ["SP", 5, 35, 64, [4, 4], 1], ["SP", 5, 38, 1, [1, 1], 1], ["SP", 5, 41, 1, [1, 1], 1], ["RE", 5, [0, 5, 10, 15, 20, 25, 30, 1, 6, 11, 16, 21, 26, 31, 2, 7, 12, 17, 22, 27, 32, 35, 38, 41, 36, 39, 42, 3, 8, 13, 18, 23, 28, 33, 37, 40, 43, 4, 9, 14, 19, 24, 29, 34]], ["FSP", 6, 0, 2, 3], ["FSP", 6, 4, 3, 3], ["FSP", 6, 8, 4, 3], ["FSP", 6, 12, 5, 3], ["FSP", 6, 16, 6, 3], ["FSP", 6, 20, 7, 3], ["FSP", 6, 24, 8, 3], ["RE", 6, [0, 4, 8, 12, 16, 20, 24, 1, 5, 9, 13, 17, 21, 25, 2, 6, 10, 14, 18, 22, 26, 3, 7, 11, 15, 19, 23, 27]], ["CA", 5, 6, 20], ["CI", 4], ["CI", 2], ["CI", 1], ["FU", 9, [0, 1, 2, 3]], ["SP", 9, 0, 8505, [2], 1], ["AN", 9, 0, 5], ["AN", 9, 1, 6], ["FU", 6, [0, 1, 2, 3, 4, 5, 6]], ["AN", 6, 0, 5], ["FU", 6, [1, 2, 3, 4, 5, 6, 7]], ["AN", 6, 1, 4], ["FU", 6, [2, 3, 4, 5, 6, 7, 8]], ["AN", 6, 2, 6], ["PR", 5, 0, "auto_unroll_max_step$16"], ["AN", 5, 43, 2], ["AN", 6, 9, 2]]]], "r": [[0.00290259, 0.00288552, 0.00288922], 0, 8.32296, 1630223927], "v": "v0.6"}
{"i": [["[\"e4ec3906e80d2af01a06496bf02db0d3\", 1, 64, 27, 21, 15, 64, 1, 1, 1, 15, 1, 1, 1, 15, 27, 21]", "opencl -keys=mali,opencl,gpu -device=mali -max_num_threads=256 -thread_warp_size=1", [2, 16, 64, 4096, 40960, 512, 2, 2], "llvm -keys=cpu -link-params=0 -mtriple=aarch64-linux-gnu", 2, []], [[], [["CI", 6], ["CHW", 5, "local"], ["SP", 5, 0, 1, [1, 1, 1, 1], 1], ["SP", 5, 5, 5, [1, 1, 1, 1], 1], ["SP", 5, 10, 27, [1, 3, 3, 1], 1], ["SP", 5, 15, 7, [1, 1, 7, 1], 1], ["SP", 5, 20, 1, [1, 1, 1, 1], 1], ["SP", 5, 25, 3, [1, 3, 1, 1], 1], ["SP", 5, 30, 3, [1, 1, 1, 1], 1], ["SP", 5, 35, 64, [16, 4], 1], ["SP", 5, 38, 1, [1, 1], 1], ["SP", 5, 41, 1, [1, 1], 1], ["RE", 5, [0, 5, 10, 15, 20, 25, 30, 1, 6, 11, 16, 21, 26, 31, 2, 7, 12, 17, 22, 27, 32, 35, 38, 41, 36, 39, 42, 3, 8, 13, 18, 23, 28, 33, 37, 40, 43, 4, 9, 14, 19, 24, 29, 34]], ["FSP", 6, 0, 2, 3], ["FSP", 6, 4, 3, 3], ["FSP", 6, 8, 4, 3], ["FSP", 6, 12, 5, 3], ["FSP", 6, 16, 6, 3], ["FSP", 6, 20, 7, 3], ["FSP", 6, 24, 8, 3], ["RE", 6, [0, 4, 8, 12, 16, 20, 24, 1, 5, 9, 13, 17, 21, 25, 2, 6, 10, 14, 18, 22, 26, 3, 7, 11, 15, 19, 23, 27]], ["CA", 5, 6, 20], ["CI", 4], ["CI", 2], ["CI", 1], ["FU", 9, [0, 1, 2, 3]], ["SP", 9, 0, 8505, [2], 1], ["AN", 9, 0, 5], ["AN", 9, 1, 6], ["FU", 6, [0, 1, 2, 3, 4, 5, 6]], ["AN", 6, 0, 5], ["FU", 6, [1, 2, 3, 4, 5, 6, 7]], ["AN", 6, 1, 4], ["FU", 6, [2, 3, 4, 5, 6, 7, 8]], ["AN", 6, 2, 6], ["PR", 5, 0, "auto_unroll_max_step$1024"], ["AN", 5, 43, 2], ["AN", 6, 9, 2]]]], "r": [[0.0135785, 0.0018824, 0.00188854], 0, 8.49713, 1630223936], "v": "v0.6"}
{"i": [["[\"e4ec3906e80d2af01a06496bf02db0d3\", 1, 64, 27, 21, 15, 64, 1, 1, 1, 15, 1, 1, 1, 15, 27, 21]", "opencl -keys=mali,opencl,gpu -device=mali -max_num_threads=256 -thread_warp_size=1", [2, 16, 64, 4096, 40960, 512, 2, 2], "llvm -keys=cpu -link-params=0 -mtriple=aarch64-linux-gnu", 2, []], [[], [["CI", 6], ["CHW", 5, "local"], ["SP", 5, 0, 1, [1, 1, 1, 1], 1], ["SP", 5, 5, 5, [1, 1, 1, 5], 1], ["SP", 5, 10, 27, [1, 9, 1, 3], 1], ["SP", 5, 15, 7, [1, 1, 1, 7], 1], ["SP", 5, 20, 1, [1, 1, 1, 1], 1], ["SP", 5, 25, 3, [1, 1, 1, 3], 1], ["SP", 5, 30, 3, [1, 1, 1, 1], 1], ["SP", 5, 35, 64, [2, 1], 1], ["SP", 5, 38, 1, [1, 1], 1], ["SP", 5, 41, 1, [1, 1], 1], ["RE", 5, [0, 5, 10, 15, 20, 25, 30, 1, 6, 11, 16, 21, 26, 31, 2, 7, 12, 17, 22, 27, 32, 35, 38, 41, 36, 39, 42, 3, 8, 13, 18, 23, 28, 33, 37, 40, 43, 4, 9, 14, 19, 24, 29, 34]], ["FSP", 6, 0, 2, 3], ["FSP", 6, 4, 3, 3], ["FSP", 6, 8, 4, 3], ["FSP", 6, 12, 5, 3], ["FSP", 6, 16, 6, 3], ["FSP", 6, 20, 7, 3], ["FSP", 6, 24, 8, 3], ["RE", 6, [0, 4, 8, 12, 16, 20, 24, 1, 5, 9, 13, 17, 21, 25, 2, 6, 10, 14, 18, 22, 26, 3, 7, 11, 15, 19, 23, 27]], ["CA", 5, 6, 20], ["CI", 4], ["CI", 2], ["CI", 1], ["FU", 9, [0, 1, 2, 3]], ["SP", 9, 0, 8505, [2], 1], ["AN", 9, 0, 5], ["AN", 9, 1, 6], ["FU", 6, [0, 1, 2, 3, 4, 5, 6]], ["AN", 6, 0, 5], ["FU", 6, [1, 2, 3, 4, 5, 6, 7]], ["AN", 6, 1, 4], ["FU", 6, [2, 3, 4, 5, 6, 7, 8]], ["AN", 6, 2, 6], ["PR", 5, 0, "auto_unroll_max_step$0"], ["AN", 5, 43, 2], ["AN", 6, 9, 2]]]], "r": [[0.03848, 0.0114568, 0.0128351], 0, 8.58888, 1630223944], "v": "v0.6"}
{"i": [["[\"e4ec3906e80d2af01a06496bf02db0d3\", 1, 64, 27, 21, 15, 64, 1, 1, 1, 15, 1, 1, 1, 15, 27, 21]", "opencl -keys=mali,opencl,gpu -device=mali -max_num_threads=256 -thread_warp_size=1", [2, 16, 64, 4096, 40960, 512, 2, 2], "llvm -keys=cpu -link-params=0 -mtriple=aarch64-linux-gnu", 2, []], [[], [["CI", 6], ["CHW", 5, "local"], ["SP", 5, 0, 1, [1, 1, 1, 1], 1], ["SP", 5, 5, 5, [1, 1, 1, 1], 1], ["SP", 5, 10, 27, [1, 3, 3, 1], 1], ["SP", 5, 15, 7, [1, 1, 1, 1], 1], ["SP", 5, 20, 1, [1, 1, 1, 1], 1], ["SP", 5, 25, 3, [1, 1, 1, 3], 1], ["SP", 5, 30, 3, [1, 3, 1, 1], 1], ["SP", 5, 35, 64, [1, 4], 1], ["SP", 5, 38, 1, [1, 1], 1], ["SP", 5, 41, 1, [1, 1], 1], ["RE", 5, [0, 5, 10, 15, 20, 25, 30, 1, 6, 11, 16, 21, 26, 31, 2, 7, 12, 17, 22, 27, 32, 35, 38, 41, 36, 39, 42, 3, 8, 13, 18, 23, 28, 33, 37, 40, 43, 4, 9, 14, 19, 24, 29, 34]], ["FSP", 6, 0, 2, 3], ["FSP", 6, 4, 3, 3], ["FSP", 6, 8, 4, 3], ["FSP", 6, 12, 5, 3], ["FSP", 6, 16, 6, 3], ["FSP", 6, 20, 7, 3], ["FSP", 6, 24, 8, 3], ["RE", 6, [0, 4, 8, 12, 16, 20, 24, 1, 5, 9, 13, 17, 21, 25, 2, 6, 10, 14, 18, 22, 26, 3, 7, 11, 15, 19, 23, 27]], ["CA", 5, 6, 20], ["CI", 4], ["CI", 2], ["CI", 1], ["FU", 9, [0, 1, 2, 3]], ["SP", 9, 0, 8505, [2], 1], ["AN", 9, 0, 5], ["AN", 9, 1, 6], ["FU", 6, [0, 1, 2, 3, 4, 5, 6]], ["AN", 6, 0, 5], ["FU", 6, [1, 2, 3, 4, 5, 6, 7]], ["AN", 6, 1, 4], ["FU", 6, [2, 3, 4, 5, 6, 7, 8]], ["AN", 6, 2, 6], ["PR", 5, 0, "auto_unroll_max_step$0"], ["AN", 5, 43, 2], ["AN", 6, 9, 2]]]], "r": [[0.0066908, 0.000980118, 0.00096347], 0, 8.35449, 1630223953], "v": "v0.6"}
{"i": [["[\"e4ec3906e80d2af01a06496bf02db0d3\", 1, 64, 27, 21, 15, 64, 1, 1, 1, 15, 1, 1, 1, 15, 27, 21]", "opencl -keys=mali,opencl,gpu -device=mali -max_num_threads=256 -thread_warp_size=1", [2, 16, 64, 4096, 40960, 512, 2, 2], "llvm -keys=cpu -link-params=0 -mtriple=aarch64-linux-gnu", 2, []], [[], [["CI", 6], ["CHW", 5, "local"], ["SP", 5, 0, 1, [1, 1, 1, 1], 1], ["SP", 5, 5, 5, [1, 1, 5, 1], 1], ["SP", 5, 10, 27, [3, 1, 9, 1], 1], ["SP", 5, 15, 7, [1, 7, 1, 1], 1], ["SP", 5, 20, 1, [1, 1, 1, 1], 1], ["SP", 5, 25, 3, [3, 1, 1, 1], 1], ["SP", 5, 30, 3, [1, 1, 1, 1], 1], ["SP", 5, 35, 64, [32, 1], 1], ["SP", 5, 38, 1, [1, 1], 1], ["SP", 5, 41, 1, [1, 1], 1], ["RE", 5, [0, 5, 10, 15, 20, 25, 30, 1, 6, 11, 16, 21, 26, 31, 2, 7, 12, 17, 22, 27, 32, 35, 38, 41, 36, 39, 42, 3, 8, 13, 18, 23, 28, 33, 37, 40, 43, 4, 9, 14, 19, 24, 29, 34]], ["FSP", 6, 0, 2, 3], ["FSP", 6, 4, 3, 3], ["FSP", 6, 8, 4, 3], ["FSP", 6, 12, 5, 3], ["FSP", 6, 16, 6, 3], ["FSP", 6, 20, 7, 3], ["FSP", 6, 24, 8, 3], ["RE", 6, [0, 4, 8, 12, 16, 20, 24, 1, 5, 9, 13, 17, 21, 25, 2, 6, 10, 14, 18, 22, 26, 3, 7, 11, 15, 19, 23, 27]], ["CA", 5, 6, 20], ["CI", 4], ["CI", 2], ["CI", 1], ["FU", 9, [0, 1, 2, 3]], ["SP", 9, 0, 8505, [4], 1], ["AN", 9, 0, 5], ["AN", 9, 1, 6], ["FU", 6, [0, 1, 2, 3, 4, 5, 6]], ["AN", 6, 0, 5], ["FU", 6, [1, 2, 3, 4, 5, 6, 7]], ["AN", 6, 1, 4], ["FU", 6, [2, 3, 4, 5, 6, 7, 8]], ["AN", 6, 2, 6], ["PR", 5, 0, "auto_unroll_max_step$0"], ["AN", 5, 43, 2], ["AN", 6, 9, 2]]]], "r": [[0.0122267, 0.0127402, 0.0121056], 0, 8.90729, 1630223962], "v": "v0.6"}
{"i": [["[\"e4ec3906e80d2af01a06496bf02db0d3\", 1, 64, 27, 21, 15, 64, 1, 1, 1, 15, 1, 1, 1, 15, 27, 21]", "opencl -keys=mali,opencl,gpu -device=mali -max_num_threads=256 -thread_warp_size=1", [2, 16, 64, 4096, 40960, 512, 2, 2], "llvm -keys=cpu -link-params=0 -mtriple=aarch64-linux-gnu", 2, []], [[], [["CI", 6], ["CHW", 5, "local"], ["SP", 5, 0, 1, [1, 1, 1, 1], 1], ["SP", 5, 5, 5, [1, 1, 1, 5], 1], ["SP", 5, 10, 27, [1, 1, 3, 3], 1], ["SP", 5, 15, 7, [1, 1, 1, 1], 1], ["SP", 5, 20, 1, [1, 1, 1, 1], 1], ["SP", 5, 25, 3, [3, 1, 1, 1], 1], ["SP", 5, 30, 3, [1, 1, 1, 3], 1], ["SP", 5, 35, 64, [1, 16], 1], ["SP", 5, 38, 1, [1, 1], 1], ["SP", 5, 41, 1, [1, 1], 1], ["RE", 5, [0, 5, 10, 15, 20, 25, 30, 1, 6, 11, 16, 21, 26, 31, 2, 7, 12, 17, 22, 27, 32, 35, 38, 41, 36, 39, 42, 3, 8, 13, 18, 23, 28, 33, 37, 40, 43, 4, 9, 14, 19, 24, 29, 34]], ["FSP", 6, 0, 2, 3], ["FSP", 6, 4, 3, 3], ["FSP", 6, 8, 4, 3], ["FSP", 6, 12, 5, 3], ["FSP", 6, 16, 6, 3], ["FSP", 6, 20, 7, 3], ["FSP", 6, 24, 8, 3], ["RE", 6, [0, 4, 8, 12, 16, 20, 24, 1, 5, 9, 13, 17, 21, 25, 2, 6, 10, 14, 18, 22, 26, 3, 7, 11, 15, 19, 23, 27]], ["CA", 5, 6, 20], ["CI", 4], ["CI", 2], ["CI", 1], ["FU", 9, [0, 1, 2, 3]], ["SP", 9, 0, 8505, [1], 1], ["AN", 9, 0, 5], ["AN", 9, 1, 6], ["FU", 6, [0, 1, 2, 3, 4, 5, 6]], ["AN", 6, 0, 5], ["FU", 6, [1, 2, 3, 4, 5, 6, 7]], ["AN", 6, 1, 4], ["FU", 6, [2, 3, 4, 5, 6, 7, 8]], ["AN", 6, 2, 6], ["PR", 5, 0, "auto_unroll_max_step$512"], ["AN", 5, 43, 2], ["AN", 6, 9, 2]]]], "r": [[0.0423491, 0.00924767, 0.00730567], 0, 12.1096, 1630223974], "v": "v0.6"}
{"i": [["[\"e4ec3906e80d2af01a06496bf02db0d3\", 1, 64, 27, 21, 15, 64, 1, 1, 1, 15, 1, 1, 1, 15, 27, 21]", "opencl -keys=mali,opencl,gpu -device=mali -max_num_threads=256 -thread_warp_size=1", [2, 16, 64, 4096, 40960, 512, 2, 2], "llvm -keys=cpu -link-params=0 -mtriple=aarch64-linux-gnu", 2, []], [[], [["CI", 6], ["CHW", 5, "local"], ["SP", 5, 0, 1, [1, 1, 1, 1], 1], ["SP", 5, 5, 5, [1, 5, 1, 1], 1], ["SP", 5, 10, 27, [1, 1, 27, 1], 1], ["SP", 5, 15, 7, [1, 1, 1, 7], 1], ["SP", 5, 20, 1, [1, 1, 1, 1], 1], ["SP", 5, 25, 3, [1, 1, 3, 1], 1], ["SP", 5, 30, 3, [1, 1, 1, 3], 1], ["SP", 5, 35, 64, [1, 16], 1], ["SP", 5, 38, 1, [1, 1], 1], ["SP", 5, 41, 1, [1, 1], 1], ["RE", 5, [0, 5, 10, 15, 20, 25, 30, 1, 6, 11, 16, 21, 26, 31, 2, 7, 12, 17, 22, 27, 32, 35, 38, 41, 36, 39, 42, 3, 8, 13, 18, 23, 28, 33, 37, 40, 43, 4, 9, 14, 19, 24, 29, 34]], ["FSP", 6, 0, 2, 3], ["FSP", 6, 4, 3, 3], ["FSP", 6, 8, 4, 3], ["FSP", 6, 12, 5, 3], ["FSP", 6, 16, 6, 3], ["FSP", 6, 20, 7, 3], ["FSP", 6, 24, 8, 3], ["RE", 6, [0, 4, 8, 12, 16, 20, 24, 1, 5, 9, 13, 17, 21, 25, 2, 6, 10, 14, 18, 22, 26, 3, 7, 11, 15, 19, 23, 27]], ["CA", 5, 6, 20], ["CI", 4], ["CI", 2], ["CI", 1], ["FU", 9, [0, 1, 2, 3]], ["SP", 9, 0, 8505, [35], 1], ["AN", 9, 0, 5], ["AN", 9, 1, 6], ["FU", 6, [0, 1, 2, 3, 4, 5, 6]], ["AN", 6, 0, 5], ["FU", 6, [1, 2, 3, 4, 5, 6, 7]], ["AN", 6, 1, 4], ["FU", 6, [2, 3, 4, 5, 6, 7, 8]], ["AN", 6, 2, 6], ["PR", 5, 0, "auto_unroll_max_step$16"], ["AN", 5, 43, 2], ["AN", 6, 9, 2]]]], "r": [[0.0437129, 0.0439812, 0.0444081], 0, 8.55193, 1630223986], "v": "v0.6"}
{"i": [["[\"e4ec3906e80d2af01a06496bf02db0d3\", 1, 64, 27, 21, 15, 64, 1, 1, 1, 15, 1, 1, 1, 15, 27, 21]", "opencl -keys=mali,opencl,gpu -device=mali -max_num_threads=256 -thread_warp_size=1", [2, 16, 64, 4096, 40960, 512, 2, 2], "llvm -keys=cpu -link-params=0 -mtriple=aarch64-linux-gnu", 2, []], [[], [["CI", 6], ["CHW", 5, "local"], ["SP", 5, 0, 1, [1, 1, 1, 1], 1], ["SP", 5, 5, 5, [1, 5, 1, 1], 1], ["SP", 5, 10, 27, [1, 1, 1, 1], 1], ["SP", 5, 15, 7, [1, 1, 7, 1], 1], ["SP", 5, 20, 1, [1, 1, 1, 1], 1], ["SP", 5, 25, 3, [1, 1, 3, 1], 1], ["SP", 5, 30, 3, [1, 1, 1, 1], 1], ["SP", 5, 35, 64, [16, 2], 1], ["SP", 5, 38, 1, [1, 1], 1], ["SP", 5, 41, 1, [1, 1], 1], ["RE", 5, [0, 5, 10, 15, 20, 25, 30, 1, 6, 11, 16, 21, 26, 31, 2, 7, 12, 17, 22, 27, 32, 35, 38, 41, 36, 39, 42, 3, 8, 13, 18, 23, 28, 33, 37, 40, 43, 4, 9, 14, 19, 24, 29, 34]], ["FSP", 6, 0, 2, 3], ["FSP", 6, 4, 3, 3], ["FSP", 6, 8, 4, 3], ["FSP", 6, 12, 5, 3], ["FSP", 6, 16, 6, 3], ["FSP", 6, 20, 7, 3], ["FSP", 6, 24, 8, 3], ["RE", 6, [0, 4, 8, 12, 16, 20, 24, 1, 5, 9, 13, 17, 21, 25, 2, 6, 10, 14, 18, 22, 26, 3, 7, 11, 15, 19, 23, 27]], ["CA", 5, 6, 20], ["CI", 4], ["CI", 2], ["CI", 1], ["FU", 9, [0, 1, 2, 3]], ["SP", 9, 0, 8505, [2], 1], ["AN", 9, 0, 5], ["AN", 9, 1, 6], ["FU", 6, [0, 1, 2, 3, 4, 5, 6]], ["AN", 6, 0, 5], ["FU", 6, [1, 2, 3, 4, 5, 6, 7]], ["AN", 6, 1, 4], ["FU", 6, [2, 3, 4, 5, 6, 7, 8]], ["AN", 6, 2, 6], ["PR", 5, 0, "auto_unroll_max_step$512"], ["AN", 5, 43, 2], ["AN", 6, 9, 2]]]], "r": [[0.00135909, 0.00187627, 0.00149331], 0, 8.92085, 1630223995], "v": "v0.6"}
{"i": [["[\"e4ec3906e80d2af01a06496bf02db0d3\", 1, 64, 27, 21, 15, 64, 1, 1, 1, 15, 1, 1, 1, 15, 27, 21]", "opencl -keys=mali,opencl,gpu -device=mali -max_num_threads=256 -thread_warp_size=1", [2, 16, 64, 4096, 40960, 512, 2, 2], "llvm -keys=cpu -link-params=0 -mtriple=aarch64-linux-gnu", 2, []], [[], [["CI", 6], ["CHW", 5, "local"], ["SP", 5, 0, 1, [1, 1, 1, 1], 1], ["SP", 5, 5, 5, [1, 1, 1, 5], 1], ["SP", 5, 10, 27, [1, 3, 9, 1], 1], ["SP", 5, 15, 7, [1, 1, 7, 1], 1], ["SP", 5, 20, 1, [1, 1, 1, 1], 1], ["SP", 5, 25, 3, [1, 3, 1, 1], 1], ["SP", 5, 30, 3, [1, 1, 3, 1], 1], ["SP", 5, 35, 64, [1, 64], 1], ["SP", 5, 38, 1, [1, 1], 1], ["SP", 5, 41, 1, [1, 1], 1], ["RE", 5, [0, 5, 10, 15, 20, 25, 30, 1, 6, 11, 16, 21, 26, 31, 2, 7, 12, 17, 22, 27, 32, 35, 38, 41, 36, 39, 42, 3, 8, 13, 18, 23, 28, 33, 37, 40, 43, 4, 9, 14, 19, 24, 29, 34]], ["FSP", 6, 0, 2, 3], ["FSP", 6, 4, 3, 3], ["FSP", 6, 8, 4, 3], ["FSP", 6, 12, 5, 3], ["FSP", 6, 16, 6, 3], ["FSP", 6, 20, 7, 3], ["FSP", 6, 24, 8, 3], ["RE", 6, [0, 4, 8, 12, 16, 20, 24, 1, 5, 9, 13, 17, 21, 25, 2, 6, 10, 14, 18, 22, 26, 3, 7, 11, 15, 19, 23, 27]], ["CA", 5, 6, 20], ["CI", 4], ["CI", 2], ["CI", 1], ["FU", 9, [0, 1, 2, 3]], ["SP", 9, 0, 8505, [4], 1], ["AN", 9, 0, 5], ["AN", 9, 1, 6], ["FU", 6, [0, 1, 2, 3, 4, 5, 6]], ["AN", 6, 0, 5], ["FU", 6, [1, 2, 3, 4, 5, 6, 7]], ["AN", 6, 1, 4], ["FU", 6, [2, 3, 4, 5, 6, 7, 8]], ["AN", 6, 2, 6], ["PR", 5, 0, "auto_unroll_max_step$1024"], ["AN", 5, 43, 2], ["AN", 6, 9, 2]]]], "r": [[0.0171583, 0.015739, 0.015399], 0, 18.3561, 1630224013], "v": "v0.6"}
{"i": [["[\"e4ec3906e80d2af01a06496bf02db0d3\", 1, 64, 27, 21, 15, 64, 1, 1, 1, 15, 1, 1, 1, 15, 27, 21]", "opencl -keys=mali,opencl,gpu -device=mali -max_num_threads=256 -thread_warp_size=1", [2, 16, 64, 4096, 40960, 512, 2, 2], "llvm -keys=cpu -link-params=0 -mtriple=aarch64-linux-gnu", 2, []], [[], [["CI", 6], ["CHW", 5, "local"], ["SP", 5, 0, 1, [1, 1, 1, 1], 1], ["SP", 5, 5, 5, [1, 1, 1, 1], 1], ["SP", 5, 10, 27, [1, 1, 27, 1], 1], ["SP", 5, 15, 7, [1, 1, 1, 7], 1], ["SP", 5, 20, 1, [1, 1, 1, 1], 1], ["SP", 5, 25, 3, [1, 1, 3, 1], 1], ["SP", 5, 30, 3, [1, 1, 1, 3], 1], ["SP", 5, 35, 64, [16, 2], 1], ["SP", 5, 38, 1, [1, 1], 1], ["SP", 5, 41, 1, [1, 1], 1], ["RE", 5, [0, 5, 10, 15, 20, 25, 30, 1, 6, 11, 16, 21, 26, 31, 2, 7, 12, 17, 22, 27, 32, 35, 38, 41, 36, 39, 42, 3, 8, 13, 18, 23, 28, 33, 37, 40, 43, 4, 9, 14, 19, 24, 29, 34]], ["FSP", 6, 0, 2, 3], ["FSP", 6, 4, 3, 3], ["FSP", 6, 8, 4, 3], ["FSP", 6, 12, 5, 3], ["FSP", 6, 16, 6, 3], ["FSP", 6, 20, 7, 3], ["FSP", 6, 24, 8, 3], ["RE", 6, [0, 4, 8, 12, 16, 20, 24, 1, 5, 9, 13, 17, 21, 25, 2, 6, 10, 14, 18, 22, 26, 3, 7, 11, 15, 19, 23, 27]], ["CA", 5, 6, 20], ["CI", 4], ["CI", 2], ["CI", 1], ["FU", 9, [0, 1, 2, 3]], ["SP", 9, 0, 8505, [2], 1], ["AN", 9, 0, 5], ["AN", 9, 1, 6], ["FU", 6, [0, 1, 2, 3, 4, 5, 6]], ["AN", 6, 0, 5], ["FU", 6, [1, 2, 3, 4, 5, 6, 7]], ["AN", 6, 1, 4], ["FU", 6, [2, 3, 4, 5, 6, 7, 8]], ["AN", 6, 2, 6], ["PR", 5, 0, "auto_unroll_max_step$0"], ["AN", 5, 43, 2], ["AN", 6, 9, 2]]]], "r": [[0.0375882, 0.0634807, 0.0378785], 0, 8.88012, 1630224031], "v": "v0.6"}
{"i": [["[\"e4ec3906e80d2af01a06496bf02db0d3\", 1, 64, 27, 21, 15, 64, 1, 1, 1, 15, 1, 1, 1, 15, 27, 21]", "opencl -keys=mali,opencl,gpu -device=mali -max_num_threads=256 -thread_warp_size=1", [2, 16, 64, 4096, 40960, 512, 2, 2], "llvm -keys=cpu -link-params=0 -mtriple=aarch64-linux-gnu", 2, []], [[], [["CI", 6], ["CHW", 5, "local"], ["SP", 5, 0, 1, [1, 1, 1, 1], 1], ["SP", 5, 5, 5, [1, 5, 1, 1], 1], ["SP", 5, 10, 27, [1, 1, 27, 1], 1], ["SP", 5, 15, 7, [1, 7, 1, 1], 1], ["SP", 5, 20, 1, [1, 1, 1, 1], 1], ["SP", 5, 25, 3, [1, 3, 1, 1], 1], ["SP", 5, 30, 3, [1, 1, 1, 3], 1], ["SP", 5, 35, 64, [16, 2], 1], ["SP", 5, 38, 1, [1, 1], 1], ["SP", 5, 41, 1, [1, 1], 1], ["RE", 5, [0, 5, 10, 15, 20, 25, 30, 1, 6, 11, 16, 21, 26, 31, 2, 7, 12, 17, 22, 27, 32, 35, 38, 41, 36, 39, 42, 3, 8, 13, 18, 23, 28, 33, 37, 40, 43, 4, 9, 14, 19, 24, 29, 34]], ["FSP", 6, 0, 2, 3], ["FSP", 6, 4, 3, 3], ["FSP", 6, 8, 4, 3], ["FSP", 6, 12, 5, 3], ["FSP", 6, 16, 6, 3], ["FSP", 6, 20, 7, 3], ["FSP", 6, 24, 8, 3], ["RE", 6, [0, 4, 8, 12, 16, 20, 24, 1, 5, 9, 13, 17, 21, 25, 2, 6, 10, 14, 18, 22, 26, 3, 7, 11, 15, 19, 23, 27]], ["CA", 5, 6, 20], ["CI", 4], ["CI", 2], ["CI", 1], ["FU", 9, [0, 1, 2, 3]], ["SP", 9, 0, 8505, [1], 1], ["AN", 9, 0, 5], ["AN", 9, 1, 6], ["FU", 6, [0, 1, 2, 3, 4, 5, 6]], ["AN", 6, 0, 5], ["FU", 6, [1, 2, 3, 4, 5, 6, 7]], ["AN", 6, 1, 4], ["FU", 6, [2, 3, 4, 5, 6, 7, 8]], ["AN", 6, 2, 6], ["PR", 5, 0, "auto_unroll_max_step$0"], ["AN", 5, 43, 2], ["AN", 6, 9, 2]]]], "r": [[0.00538053, 0.000858038, 0.00082694], 0, 8.35338, 1630224040], "v": "v0.6"}
{"i": [["[\"e4ec3906e80d2af01a06496bf02db0d3\", 1, 64, 27, 21, 15, 64, 1, 1, 1, 15, 1, 1, 1, 15, 27, 21]", "opencl -keys=mali,opencl,gpu -device=mali -max_num_threads=256 -thread_warp_size=1", [2, 16, 64, 4096, 40960, 512, 2, 2], "llvm -keys=cpu -link-params=0 -mtriple=aarch64-linux-gnu", 2, []], [[], [["CI", 6], ["CHW", 5, "local"], ["SP", 5, 0, 1, [1, 1, 1, 1], 1], ["SP", 5, 5, 5, [1, 1, 5, 1], 1], ["SP", 5, 10, 27, [1, 3, 1, 1], 1], ["SP", 5, 15, 7, [1, 1, 1, 7], 1], ["SP", 5, 20, 1, [1, 1, 1, 1], 1], ["SP", 5, 25, 3, [1, 1, 1, 3], 1], ["SP", 5, 30, 3, [1, 1, 3, 1], 1], ["SP", 5, 35, 64, [8, 2], 1], ["SP", 5, 38, 1, [1, 1], 1], ["SP", 5, 41, 1, [1, 1], 1], ["RE", 5, [0, 5, 10, 15, 20, 25, 30, 1, 6, 11, 16, 21, 26, 31, 2, 7, 12, 17, 22, 27, 32, 35, 38, 41, 36, 39, 42, 3, 8, 13, 18, 23, 28, 33, 37, 40, 43, 4, 9, 14, 19, 24, 29, 34]], ["FSP", 6, 0, 2, 3], ["FSP", 6, 4, 3, 3], ["FSP", 6, 8, 4, 3], ["FSP", 6, 12, 5, 3], ["FSP", 6, 16, 6, 3], ["FSP", 6, 20, 7, 3], ["FSP", 6, 24, 8, 3], ["RE", 6, [0, 4, 8, 12, 16, 20, 24, 1, 5, 9, 13, 17, 21, 25, 2, 6, 10, 14, 18, 22, 26, 3, 7, 11, 15, 19, 23, 27]], ["CA", 5, 6, 20], ["CI", 4], ["CI", 2], ["CI", 1], ["FU", 9, [0, 1, 2, 3]], ["SP", 9, 0, 8505, [2], 1], ["AN", 9, 0, 5], ["AN", 9, 1, 6], ["FU", 6, [0, 1, 2, 3, 4, 5, 6]], ["AN", 6, 0, 5], ["FU", 6, [1, 2, 3, 4, 5, 6, 7]], ["AN", 6, 1, 4], ["FU", 6, [2, 3, 4, 5, 6, 7, 8]], ["AN", 6, 2, 6], ["PR", 5, 0, "auto_unroll_max_step$16"], ["AN", 5, 43, 2], ["AN", 6, 9, 2]]]], "r": [[0.0449967, 0.008309, 0.00829889], 0, 9.18014, 1630224049], "v": "v0.6"}
{"i": [["[\"e4ec3906e80d2af01a06496bf02db0d3\", 1, 64, 27, 21, 15, 64, 1, 1, 1, 15, 1, 1, 1, 15, 27, 21]", "opencl -keys=mali,opencl,gpu -device=mali -max_num_threads=256 -thread_warp_size=1", [2, 16, 64, 4096, 40960, 512, 2, 2], "llvm -keys=cpu -link-params=0 -mtriple=aarch64-linux-gnu", 2, []], [[], [["CI", 6], ["CHW", 5, "local"], ["SP", 5, 0, 1, [1, 1, 1, 1], 1], ["SP", 5, 5, 5, [1, 1, 1, 5], 1], ["SP", 5, 10, 27, [1, 9, 1, 1], 1], ["SP", 5, 15, 7, [1, 1, 1, 1], 1], ["SP", 5, 20, 1, [1, 1, 1, 1], 1], ["SP", 5, 25, 3, [1, 1, 3, 1], 1], ["SP", 5, 30, 3, [1, 1, 3, 1], 1], ["SP", 5, 35, 64, [1, 1], 1], ["SP", 5, 38, 1, [1, 1], 1], ["SP", 5, 41, 1, [1, 1], 1], ["RE", 5, [0, 5, 10, 15, 20, 25, 30, 1, 6, 11, 16, 21, 26, 31, 2, 7, 12, 17, 22, 27, 32, 35, 38, 41, 36, 39, 42, 3, 8, 13, 18, 23, 28, 33, 37, 40, 43, 4, 9, 14, 19, 24, 29, 34]], ["FSP", 6, 0, 2, 3], ["FSP", 6, 4, 3, 3], ["FSP", 6, 8, 4, 3], ["FSP", 6, 12, 5, 3], ["FSP", 6, 16, 6, 3], ["FSP", 6, 20, 7, 3], ["FSP", 6, 24, 8, 3], ["RE", 6, [0, 4, 8, 12, 16, 20, 24, 1, 5, 9, 13, 17, 21, 25, 2, 6, 10, 14, 18, 22, 26, 3, 7, 11, 15, 19, 23, 27]], ["CA", 5, 6, 20], ["CI", 4], ["CI", 2], ["CI", 1], ["FU", 9, [0, 1, 2, 3]], ["SP", 9, 0, 8505, [4], 1], ["AN", 9, 0, 5], ["AN", 9, 1, 6], ["FU", 6, [0, 1, 2, 3, 4, 5, 6]], ["AN", 6, 0, 5], ["FU", 6, [1, 2, 3, 4, 5, 6, 7]], ["AN", 6, 1, 4], ["FU", 6, [2, 3, 4, 5, 6, 7, 8]], ["AN", 6, 2, 6], ["PR", 5, 0, "auto_unroll_max_step$1024"], ["AN", 5, 43, 2], ["AN", 6, 9, 2]]]], "r": [[0.000665384, 0.000735097, 0.000719684], 0, 8.39956, 1630224058], "v": "v0.6"}
{"i": [["[\"e4ec3906e80d2af01a06496bf02db0d3\", 1, 64, 27, 21, 15, 64, 1, 1, 1, 15, 1, 1, 1, 15, 27, 21]", "opencl -keys=mali,opencl,gpu -device=mali -max_num_threads=256 -thread_warp_size=1", [2, 16, 64, 4096, 40960, 512, 2, 2], "llvm -keys=cpu -link-params=0 -mtriple=aarch64-linux-gnu", 2, []], [[], [["CI", 6], ["CHW", 5, "local"], ["SP", 5, 0, 1, [1, 1, 1, 1], 1], ["SP", 5, 5, 5, [1, 1, 5, 1], 1], ["SP", 5, 10, 27, [1, 1, 1, 1], 1], ["SP", 5, 15, 7, [1, 1, 7, 1], 1], ["SP", 5, 20, 1, [1, 1, 1, 1], 1], ["SP", 5, 25, 3, [1, 1, 3, 1], 1], ["SP", 5, 30, 3, [1, 3, 1, 1], 1], ["SP", 5, 35, 64, [8, 4], 1], ["SP", 5, 38, 1, [1, 1], 1], ["SP", 5, 41, 1, [1, 1], 1], ["RE", 5, [0, 5, 10, 15, 20, 25, 30, 1, 6, 11, 16, 21, 26, 31, 2, 7, 12, 17, 22, 27, 32, 35, 38, 41, 36, 39, 42, 3, 8, 13, 18, 23, 28, 33, 37, 40, 43, 4, 9, 14, 19, 24, 29, 34]], ["FSP", 6, 0, 2, 3], ["FSP", 6, 4, 3, 3], ["FSP", 6, 8, 4, 3], ["FSP", 6, 12, 5, 3], ["FSP", 6, 16, 6, 3], ["FSP", 6, 20, 7, 3], ["FSP", 6, 24, 8, 3], ["RE", 6, [0, 4, 8, 12, 16, 20, 24, 1, 5, 9, 13, 17, 21, 25, 2, 6, 10, 14, 18, 22, 26, 3, 7, 11, 15, 19, 23, 27]], ["CA", 5, 6, 20], ["CI", 4], ["CI", 2], ["CI", 1], ["FU", 9, [0, 1, 2, 3]], ["SP", 9, 0, 8505, [2], 1], ["AN", 9, 0, 5], ["AN", 9, 1, 6], ["FU", 6, [0, 1, 2, 3, 4, 5, 6]], ["AN", 6, 0, 5], ["FU", 6, [1, 2, 3, 4, 5, 6, 7]], ["AN", 6, 1, 4], ["FU", 6, [2, 3, 4, 5, 6, 7, 8]], ["AN", 6, 2, 6], ["PR", 5, 0, "auto_unroll_max_step$16"], ["AN", 5, 43, 2], ["AN", 6, 9, 2]]]], "r": [[0.00652079, 0.0065325, 0.000913235], 0, 8.54328, 1630224067], "v": "v0.6"}
{"i": [["[\"e4ec3906e80d2af01a06496bf02db0d3\", 1, 64, 27, 21, 15, 64, 1, 1, 1, 15, 1, 1, 1, 15, 27, 21]", "opencl -keys=mali,opencl,gpu -device=mali -max_num_threads=256 -thread_warp_size=1", [2, 16, 64, 4096, 40960, 512, 2, 2], "llvm -keys=cpu -link-params=0 -mtriple=aarch64-linux-gnu", 2, []], [[], [["CI", 6], ["CHW", 5, "local"], ["SP", 5, 0, 1, [1, 1, 1, 1], 1], ["SP", 5, 5, 5, [1, 1, 1, 5], 1], ["SP", 5, 10, 27, [1, 1, 9, 1], 1], ["SP", 5, 15, 7, [1, 7, 1, 1], 1], ["SP", 5, 20, 1, [1, 1, 1, 1], 1], ["SP", 5, 25, 3, [3, 1, 1, 1], 1], ["SP", 5, 30, 3, [1, 1, 3, 1], 1], ["SP", 5, 35, 64, [16, 4], 1], ["SP", 5, 38, 1, [1, 1], 1], ["SP", 5, 41, 1, [1, 1], 1], ["RE", 5, [0, 5, 10, 15, 20, 25, 30, 1, 6, 11, 16, 21, 26, 31, 2, 7, 12, 17, 22, 27, 32, 35, 38, 41, 36, 39, 42, 3, 8, 13, 18, 23, 28, 33, 37, 40, 43, 4, 9, 14, 19, 24, 29, 34]], ["FSP", 6, 0, 2, 3], ["FSP", 6, 4, 3, 3], ["FSP", 6, 8, 4, 3], ["FSP", 6, 12, 5, 3], ["FSP", 6, 16, 6, 3], ["FSP", 6, 20, 7, 3], ["FSP", 6, 24, 8, 3], ["RE", 6, [0, 4, 8, 12, 16, 20, 24, 1, 5, 9, 13, 17, 21, 25, 2, 6, 10, 14, 18, 22, 26, 3, 7, 11, 15, 19, 23, 27]], ["CA", 5, 6, 20], ["CI", 4], ["CI", 2], ["CI", 1], ["FU", 9, [0, 1, 2, 3]], ["SP", 9, 0, 8505, [2], 1], ["AN", 9, 0, 5], ["AN", 9, 1, 6], ["FU", 6, [0, 1, 2, 3, 4, 5, 6]], ["AN", 6, 0, 5], ["FU", 6, [1, 2, 3, 4, 5, 6, 7]], ["AN", 6, 1, 4], ["FU", 6, [2, 3, 4, 5, 6, 7, 8]], ["AN", 6, 2, 6], ["PR", 5, 0, "auto_unroll_max_step$16"], ["AN", 5, 43, 2], ["AN", 6, 9, 2]]]], "r": [[0.0155916, 0.0143535, 0.00311024], 0, 8.60687, 1630224076], "v": "v0.6"}
{"i": [["[\"e4ec3906e80d2af01a06496bf02db0d3\", 1, 64, 27, 21, 15, 64, 1, 1, 1, 15, 1, 1, 1, 15, 27, 21]", "opencl -keys=mali,opencl,gpu -device=mali -max_num_threads=256 -thread_warp_size=1", [2, 16, 64, 4096, 40960, 512, 2, 2], "llvm -keys=cpu -link-params=0 -mtriple=aarch64-linux-gnu", 2, []], [[], [["CI", 6], ["CHW", 5, "local"], ["SP", 5, 0, 1, [1, 1, 1, 1], 1], ["SP", 5, 5, 5, [1, 5, 1, 1], 1], ["SP", 5, 10, 27, [3, 1, 9, 1], 1], ["SP", 5, 15, 7, [1, 1, 7, 1], 1], ["SP", 5, 20, 1, [1, 1, 1, 1], 1], ["SP", 5, 25, 3, [1, 1, 1, 1], 1], ["SP", 5, 30, 3, [1, 1, 1, 1], 1], ["SP", 5, 35, 64, [2, 16], 1], ["SP", 5, 38, 1, [1, 1], 1], ["SP", 5, 41, 1, [1, 1], 1], ["RE", 5, [0, 5, 10, 15, 20, 25, 30, 1, 6, 11, 16, 21, 26, 31, 2, 7, 12, 17, 22, 27, 32, 35, 38, 41, 36, 39, 42, 3, 8, 13, 18, 23, 28, 33, 37, 40, 43, 4, 9, 14, 19, 24, 29, 34]], ["FSP", 6, 0, 2, 3], ["FSP", 6, 4, 3, 3], ["FSP", 6, 8, 4, 3], ["FSP", 6, 12, 5, 3], ["FSP", 6, 16, 6, 3], ["FSP", 6, 20, 7, 3], ["FSP", 6, 24, 8, 3], ["RE", 6, [0, 4, 8, 12, 16, 20, 24, 1, 5, 9, 13, 17, 21, 25, 2, 6, 10, 14, 18, 22, 26, 3, 7, 11, 15, 19, 23, 27]], ["CA", 5, 6, 20], ["CI", 4], ["CI", 2], ["CI", 1], ["FU", 9, [0, 1, 2, 3]], ["SP", 9, 0, 8505, [2], 1], ["AN", 9, 0, 5], ["AN", 9, 1, 6], ["FU", 6, [0, 1, 2, 3, 4, 5, 6]], ["AN", 6, 0, 5], ["FU", 6, [1, 2, 3, 4, 5, 6, 7]], ["AN", 6, 1, 4], ["FU", 6, [2, 3, 4, 5, 6, 7, 8]], ["AN", 6, 2, 6], ["PR", 5, 0, "auto_unroll_max_step$64"], ["AN", 5, 43, 2], ["AN", 6, 9, 2]]]], "r": [[0.016437, 0.00242578, 0.00244404], 0, 8.9565, 1630224085], "v": "v0.6"}
{"i": [["[\"e4ec3906e80d2af01a06496bf02db0d3\", 1, 64, 27, 21, 15, 64, 1, 1, 1, 15, 1, 1, 1, 15, 27, 21]", "opencl -keys=mali,opencl,gpu -device=mali -max_num_threads=256 -thread_warp_size=1", [2, 16, 64, 4096, 40960, 512, 2, 2], "llvm -keys=cpu -link-params=0 -mtriple=aarch64-linux-gnu", 2, []], [[], [["CI", 6], ["CHW", 5, "local"], ["SP", 5, 0, 1, [1, 1, 1, 1], 1], ["SP", 5, 5, 5, [1, 5, 1, 1], 1], ["SP", 5, 10, 27, [1, 3, 9, 1], 1], ["SP", 5, 15, 7, [1, 1, 1, 7], 1], ["SP", 5, 20, 1, [1, 1, 1, 1], 1], ["SP", 5, 25, 3, [1, 1, 1, 1], 1], ["SP", 5, 30, 3, [1, 3, 1, 1], 1], ["SP", 5, 35, 64, [1, 4], 1], ["SP", 5, 38, 1, [1, 1], 1], ["SP", 5, 41, 1, [1, 1], 1], ["RE", 5, [0, 5, 10, 15, 20, 25, 30, 1, 6, 11, 16, 21, 26, 31, 2, 7, 12, 17, 22, 27, 32, 35, 38, 41, 36, 39, 42, 3, 8, 13, 18, 23, 28, 33, 37, 40, 43, 4, 9, 14, 19, 24, 29, 34]], ["FSP", 6, 0, 2, 3], ["FSP", 6, 4, 3, 3], ["FSP", 6, 8, 4, 3], ["FSP", 6, 12, 5, 3], ["FSP", 6, 16, 6, 3], ["FSP", 6, 20, 7, 3], ["FSP", 6, 24, 8, 3], ["RE", 6, [0, 4, 8, 12, 16, 20, 24, 1, 5, 9, 13, 17, 21, 25, 2, 6, 10, 14, 18, 22, 26, 3, 7, 11, 15, 19, 23, 27]], ["CA", 5, 6, 20], ["CI", 4], ["CI", 2], ["CI", 1], ["FU", 9, [0, 1, 2, 3]], ["SP", 9, 0, 8505, [2], 1], ["AN", 9, 0, 5], ["AN", 9, 1, 6], ["FU", 6, [0, 1, 2, 3, 4, 5, 6]], ["AN", 6, 0, 5], ["FU", 6, [1, 2, 3, 4, 5, 6, 7]], ["AN", 6, 1, 4], ["FU", 6, [2, 3, 4, 5, 6, 7, 8]], ["AN", 6, 2, 6], ["PR", 5, 0, "auto_unroll_max_step$512"], ["AN", 5, 43, 2], ["AN", 6, 9, 2]]]], "r": [[0.00188979, 0.00189548, 0.00200994], 0, 9.89889, 1630224096], "v": "v0.6"}
{"i": [["[\"e4ec3906e80d2af01a06496bf02db0d3\", 1, 64, 27, 21, 15, 64, 1, 1, 1, 15, 1, 1, 1, 15, 27, 21]", "opencl -keys=mali,opencl,gpu -device=mali -max_num_threads=256 -thread_warp_size=1", [2, 16, 64, 4096, 40960, 512, 2, 2], "llvm -keys=cpu -link-params=0 -mtriple=aarch64-linux-gnu", 2, []], [[], [["CI", 6], ["CHW", 5, "local"], ["SP", 5, 0, 1, [1, 1, 1, 1], 1], ["SP", 5, 5, 5, [1, 5, 1, 1], 1], ["SP", 5, 10, 27, [1, 1, 3, 9], 1], ["SP", 5, 15, 7, [1, 1, 1, 7], 1], ["SP", 5, 20, 1, [1, 1, 1, 1], 1], ["SP", 5, 25, 3, [1, 1, 1, 3], 1], ["SP", 5, 30, 3, [1, 1, 1, 1], 1], ["SP", 5, 35, 64, [8, 1], 1], ["SP", 5, 38, 1, [1, 1], 1], ["SP", 5, 41, 1, [1, 1], 1], ["RE", 5, [0, 5, 10, 15, 20, 25, 30, 1, 6, 11, 16, 21, 26, 31, 2, 7, 12, 17, 22, 27, 32, 35, 38, 41, 36, 39, 42, 3, 8, 13, 18, 23, 28, 33, 37, 40, 43, 4, 9, 14, 19, 24, 29, 34]], ["FSP", 6, 0, 2, 3], ["FSP", 6, 4, 3, 3], ["FSP", 6, 8, 4, 3], ["FSP", 6, 12, 5, 3], ["FSP", 6, 16, 6, 3], ["FSP", 6, 20, 7, 3], ["FSP", 6, 24, 8, 3], ["RE", 6, [0, 4, 8, 12, 16, 20, 24, 1, 5, 9, 13, 17, 21, 25, 2, 6, 10, 14, 18, 22, 26, 3, 7, 11, 15, 19, 23, 27]], ["CA", 5, 6, 20], ["CI", 4], ["CI", 2], ["CI", 1], ["FU", 9, [0, 1, 2, 3]], ["SP", 9, 0, 8505, [2], 1], ["AN", 9, 0, 5], ["AN", 9, 1, 6], ["FU", 6, [0, 1, 2, 3, 4, 5, 6]], ["AN", 6, 0, 5], ["FU", 6, [1, 2, 3, 4, 5, 6, 7]], ["AN", 6, 1, 4], ["FU", 6, [2, 3, 4, 5, 6, 7, 8]], ["AN", 6, 2, 6], ["PR", 5, 0, "auto_unroll_max_step$512"], ["AN", 5, 43, 2], ["AN", 6, 9, 2]]]], "r": [[0.0227381, 0.023288, 0.0204519], 0, 12.4781, 1630224109], "v": "v0.6"}
{"i": [["[\"e4ec3906e80d2af01a06496bf02db0d3\", 1, 64, 27, 21, 15, 64, 1, 1, 1, 15, 1, 1, 1, 15, 27, 21]", "opencl -keys=mali,opencl,gpu -device=mali -max_num_threads=256 -thread_warp_size=1", [2, 16, 64, 4096, 40960, 512, 2, 2], "llvm -keys=cpu -link-params=0 -mtriple=aarch64-linux-gnu", 2, []], [[], [["CI", 6], ["CHW", 5, "local"], ["SP", 5, 0, 1, [1, 1, 1, 1], 1], ["SP", 5, 5, 5, [1, 5, 1, 1], 1], ["SP", 5, 10, 27, [1, 1, 9, 1], 1], ["SP", 5, 15, 7, [1, 1, 1, 7], 1], ["SP", 5, 20, 1, [1, 1, 1, 1], 1], ["SP", 5, 25, 3, [1, 1, 3, 1], 1], ["SP", 5, 30, 3, [1, 1, 1, 1], 1], ["SP", 5, 35, 64, [1, 16], 1], ["SP", 5, 38, 1, [1, 1], 1], ["SP", 5, 41, 1, [1, 1], 1], ["RE", 5, [0, 5, 10, 15, 20, 25, 30, 1, 6, 11, 16, 21, 26, 31, 2, 7, 12, 17, 22, 27, 32, 35, 38, 41, 36, 39, 42, 3, 8, 13, 18, 23, 28, 33, 37, 40, 43, 4, 9, 14, 19, 24, 29, 34]], ["FSP", 6, 0, 2, 3], ["FSP", 6, 4, 3, 3], ["FSP", 6, 8, 4, 3], ["FSP", 6, 12, 5, 3], ["FSP", 6, 16, 6, 3], ["FSP", 6, 20, 7, 3], ["FSP", 6, 24, 8, 3], ["RE", 6, [0, 4, 8, 12, 16, 20, 24, 1, 5, 9, 13, 17, 21, 25, 2, 6, 10, 14, 18, 22, 26, 3, 7, 11, 15, 19, 23, 27]], ["CA", 5, 6, 20], ["CI", 4], ["CI", 2], ["CI", 1], ["FU", 9, [0, 1, 2, 3]], ["SP", 9, 0, 8505, [35], 1], ["AN", 9, 0, 5], ["AN", 9, 1, 6], ["FU", 6, [0, 1, 2, 3, 4, 5, 6]], ["AN", 6, 0, 5], ["FU", 6, [1, 2, 3, 4, 5, 6, 7]], ["AN", 6, 1, 4], ["FU", 6, [2, 3, 4, 5, 6, 7, 8]], ["AN", 6, 2, 6], ["PR", 5, 0, "auto_unroll_max_step$16"], ["AN", 5, 43, 2], ["AN", 6, 9, 2]]]], "r": [[0.0026161, 0.00261223, 0.00273865], 0, 9.18892, 1630224122], "v": "v0.6"}
{"i": [["[\"e4ec3906e80d2af01a06496bf02db0d3\", 1, 64, 27, 21, 15, 64, 1, 1, 1, 15, 1, 1, 1, 15, 27, 21]", "opencl -keys=mali,opencl,gpu -device=mali -max_num_threads=256 -thread_warp_size=1", [2, 16, 64, 4096, 40960, 512, 2, 2], "llvm -keys=cpu -link-params=0 -mtriple=aarch64-linux-gnu", 2, []], [[], [["CI", 6], ["CHW", 5, "local"], ["SP", 5, 0, 1, [1, 1, 1, 1], 1], ["SP", 5, 5, 5, [1, 5, 1, 1], 1], ["SP", 5, 10, 27, [1, 3, 3, 3], 1], ["SP", 5, 15, 7, [1, 1, 1, 1], 1], ["SP", 5, 20, 1, [1, 1, 1, 1], 1], ["SP", 5, 25, 3, [1, 1, 3, 1], 1], ["SP", 5, 30, 3, [1, 3, 1, 1], 1], ["SP", 5, 35, 64, [4, 2], 1], ["SP", 5, 38, 1, [1, 1], 1], ["SP", 5, 41, 1, [1, 1], 1], ["RE", 5, [0, 5, 10, 15, 20, 25, 30, 1, 6, 11, 16, 21, 26, 31, 2, 7, 12, 17, 22, 27, 32, 35, 38, 41, 36, 39, 42, 3, 8, 13, 18, 23, 28, 33, 37, 40, 43, 4, 9, 14, 19, 24, 29, 34]], ["FSP", 6, 0, 2, 3], ["FSP", 6, 4, 3, 3], ["FSP", 6, 8, 4, 3], ["FSP", 6, 12, 5, 3], ["FSP", 6, 16, 6, 3], ["FSP", 6, 20, 7, 3], ["FSP", 6, 24, 8, 3], ["RE", 6, [0, 4, 8, 12, 16, 20, 24, 1, 5, 9, 13, 17, 21, 25, 2, 6, 10, 14, 18, 22, 26, 3, 7, 11, 15, 19, 23, 27]], ["CA", 5, 6, 20], ["CI", 4], ["CI", 2], ["CI", 1], ["FU", 9, [0, 1, 2, 3]], ["SP", 9, 0, 8505, [2], 1], ["AN", 9, 0, 5], ["AN", 9, 1, 6], ["FU", 6, [0, 1, 2, 3, 4, 5, 6]], ["AN", 6, 0, 5], ["FU", 6, [1, 2, 3, 4, 5, 6, 7]], ["AN", 6, 1, 4], ["FU", 6, [2, 3, 4, 5, 6, 7, 8]], ["AN", 6, 2, 6], ["PR", 5, 0, "auto_unroll_max_step$1024"], ["AN", 5, 43, 2], ["AN", 6, 9, 2]]]], "r": [[0.00642458, 0.0009016, 0.000918974], 0, 9.32314, 1630224132], "v": "v0.6"}
{"i": [["[\"e4ec3906e80d2af01a06496bf02db0d3\", 1, 64, 27, 21, 15, 64, 1, 1, 1, 15, 1, 1, 1, 15, 27, 21]", "opencl -keys=mali,opencl,gpu -device=mali -max_num_threads=256 -thread_warp_size=1", [2, 16, 64, 4096, 40960, 512, 2, 2], "llvm -keys=cpu -link-params=0 -mtriple=aarch64-linux-gnu", 2, []], [[], [["CI", 6], ["CHW", 5, "local"], ["SP", 5, 0, 1, [1, 1, 1, 1], 1], ["SP", 5, 5, 5, [1, 5, 1, 1], 1], ["SP", 5, 10, 27, [1, 1, 3, 9], 1], ["SP", 5, 15, 7, [1, 1, 1, 1], 1], ["SP", 5, 20, 1, [1, 1, 1, 1], 1], ["SP", 5, 25, 3, [1, 3, 1, 1], 1], ["SP", 5, 30, 3, [1, 1, 3, 1], 1], ["SP", 5, 35, 64, [8, 4], 1], ["SP", 5, 38, 1, [1, 1], 1], ["SP", 5, 41, 1, [1, 1], 1], ["RE", 5, [0, 5, 10, 15, 20, 25, 30, 1, 6, 11, 16, 21, 26, 31, 2, 7, 12, 17, 22, 27, 32, 35, 38, 41, 36, 39, 42, 3, 8, 13, 18, 23, 28, 33, 37, 40, 43, 4, 9, 14, 19, 24, 29, 34]], ["FSP", 6, 0, 2, 3], ["FSP", 6, 4, 3, 3], ["FSP", 6, 8, 4, 3], ["FSP", 6, 12, 5, 3], ["FSP", 6, 16, 6, 3], ["FSP", 6, 20, 7, 3], ["FSP", 6, 24, 8, 3], ["RE", 6, [0, 4, 8, 12, 16, 20, 24, 1, 5, 9, 13, 17, 21, 25, 2, 6, 10, 14, 18, 22, 26, 3, 7, 11, 15, 19, 23, 27]], ["CA", 5, 6, 20], ["CI", 4], ["CI", 2], ["CI", 1], ["FU", 9, [0, 1, 2, 3]], ["SP", 9, 0, 8505, [2], 1], ["AN", 9, 0, 5], ["AN", 9, 1, 6], ["FU", 6, [0, 1, 2, 3, 4, 5, 6]], ["AN", 6, 0, 5], ["FU", 6, [1, 2, 3, 4, 5, 6, 7]], ["AN", 6, 1, 4], ["FU", 6, [2, 3, 4, 5, 6, 7, 8]], ["AN", 6, 2, 6], ["PR", 5, 0, "auto_unroll_max_step$1024"], ["AN", 5, 43, 2], ["AN", 6, 9, 2]]]], "r": [[0.000780325, 0.000810156, 0.00084142], 0, 10.1913, 1630224142], "v": "v0.6"}
{"i": [["[\"e4ec3906e80d2af01a06496bf02db0d3\", 1, 64, 27, 21, 15, 64, 1, 1, 1, 15, 1, 1, 1, 15, 27, 21]", "opencl -keys=mali,opencl,gpu -device=mali -max_num_threads=256 -thread_warp_size=1", [2, 16, 64, 4096, 40960, 512, 2, 2], "llvm -keys=cpu -link-params=0 -mtriple=aarch64-linux-gnu", 2, []], [[], [["CI", 6], ["CHW", 5, "local"], ["SP", 5, 0, 1, [1, 1, 1, 1], 1], ["SP", 5, 5, 5, [5, 1, 1, 1], 1], ["SP", 5, 10, 27, [1, 3, 3, 1], 1], ["SP", 5, 15, 7, [1, 1, 1, 7], 1], ["SP", 5, 20, 1, [1, 1, 1, 1], 1], ["SP", 5, 25, 3, [1, 1, 3, 1], 1], ["SP", 5, 30, 3, [1, 1, 1, 3], 1], ["SP", 5, 35, 64, [8, 1], 1], ["SP", 5, 38, 1, [1, 1], 1], ["SP", 5, 41, 1, [1, 1], 1], ["RE", 5, [0, 5, 10, 15, 20, 25, 30, 1, 6, 11, 16, 21, 26, 31, 2, 7, 12, 17, 22, 27, 32, 35, 38, 41, 36, 39, 42, 3, 8, 13, 18, 23, 28, 33, 37, 40, 43, 4, 9, 14, 19, 24, 29, 34]], ["FSP", 6, 0, 2, 3], ["FSP", 6, 4, 3, 3], ["FSP", 6, 8, 4, 3], ["FSP", 6, 12, 5, 3], ["FSP", 6, 16, 6, 3], ["FSP", 6, 20, 7, 3], ["FSP", 6, 24, 8, 3], ["RE", 6, [0, 4, 8, 12, 16, 20, 24, 1, 5, 9, 13, 17, 21, 25, 2, 6, 10, 14, 18, 22, 26, 3, 7, 11, 15, 19, 23, 27]], ["CA", 5, 6, 20], ["CI", 4], ["CI", 2], ["CI", 1], ["FU", 9, [0, 1, 2, 3]], ["SP", 9, 0, 8505, [2], 1], ["AN", 9, 0, 5], ["AN", 9, 1, 6], ["FU", 6, [0, 1, 2, 3, 4, 5, 6]], ["AN", 6, 0, 5], ["FU", 6, [1, 2, 3, 4, 5, 6, 7]], ["AN", 6, 1, 4], ["FU", 6, [2, 3, 4, 5, 6, 7, 8]], ["AN", 6, 2, 6], ["PR", 5, 0, "auto_unroll_max_step$16"], ["AN", 5, 43, 2], ["AN", 6, 9, 2]]]], "r": [[0.0954318, 0.0905586, 0.0902176], 0, 9.37885, 1630224153], "v": "v0.6"}
{"i": [["[\"e4ec3906e80d2af01a06496bf02db0d3\", 1, 64, 27, 21, 15, 64, 1, 1, 1, 15, 1, 1, 1, 15, 27, 21]", "opencl -keys=mali,opencl,gpu -device=mali -max_num_threads=256 -thread_warp_size=1", [2, 16, 64, 4096, 40960, 512, 2, 2], "llvm -keys=cpu -link-params=0 -mtriple=aarch64-linux-gnu", 2, []], [[], [["CI", 6], ["CHW", 5, "local"], ["SP", 5, 0, 1, [1, 1, 1, 1], 1], ["SP", 5, 5, 5, [1, 5, 1, 1], 1], ["SP", 5, 10, 27, [3, 1, 3, 1], 1], ["SP", 5, 15, 7, [1, 7, 1, 1], 1], ["SP", 5, 20, 1, [1, 1, 1, 1], 1], ["SP", 5, 25, 3, [1, 1, 3, 1], 1], ["SP", 5, 30, 3, [1, 3, 1, 1], 1], ["SP", 5, 35, 64, [8, 1], 1], ["SP", 5, 38, 1, [1, 1], 1], ["SP", 5, 41, 1, [1, 1], 1], ["RE", 5, [0, 5, 10, 15, 20, 25, 30, 1, 6, 11, 16, 21, 26, 31, 2, 7, 12, 17, 22, 27, 32, 35, 38, 41, 36, 39, 42, 3, 8, 13, 18, 23, 28, 33, 37, 40, 43, 4, 9, 14, 19, 24, 29, 34]], ["FSP", 6, 0, 2, 3], ["FSP", 6, 4, 3, 3], ["FSP", 6, 8, 4, 3], ["FSP", 6, 12, 5, 3], ["FSP", 6, 16, 6, 3], ["FSP", 6, 20, 7, 3], ["FSP", 6, 24, 8, 3], ["RE", 6, [0, 4, 8, 12, 16, 20, 24, 1, 5, 9, 13, 17, 21, 25, 2, 6, 10, 14, 18, 22, 26, 3, 7, 11, 15, 19, 23, 27]], ["CA", 5, 6, 20], ["CI", 4], ["CI", 2], ["CI", 1], ["FU", 9, [0, 1, 2, 3]], ["SP", 9, 0, 8505, [2], 1], ["AN", 9, 0, 5], ["AN", 9, 1, 6], ["FU", 6, [0, 1, 2, 3, 4, 5, 6]], ["AN", 6, 0, 5], ["FU", 6, [1, 2, 3, 4, 5, 6, 7]], ["AN", 6, 1, 4], ["FU", 6, [2, 3, 4, 5, 6, 7, 8]], ["AN", 6, 2, 6], ["PR", 5, 0, "auto_unroll_max_step$0"], ["AN", 5, 43, 2], ["AN", 6, 9, 2]]]], "r": [[0.00671331, 0.000949105, 0.000970709], 0, 8.31655, 1630224161], "v": "v0.6"}
{"i": [["[\"e4ec3906e80d2af01a06496bf02db0d3\", 1, 64, 27, 21, 15, 64, 1, 1, 1, 15, 1, 1, 1, 15, 27, 21]", "opencl -keys=mali,opencl,gpu -device=mali -max_num_threads=256 -thread_warp_size=1", [2, 16, 64, 4096, 40960, 512, 2, 2], "llvm -keys=cpu -link-params=0 -mtriple=aarch64-linux-gnu", 2, []], [[], [["CI", 6], ["CHW", 5, "local"], ["SP", 5, 0, 1, [1, 1, 1, 1], 1], ["SP", 5, 5, 5, [1, 1, 1, 1], 1], ["SP", 5, 10, 27, [1, 3, 1, 3], 1], ["SP", 5, 15, 7, [1, 1, 1, 7], 1], ["SP", 5, 20, 1, [1, 1, 1, 1], 1], ["SP", 5, 25, 3, [1, 1, 3, 1], 1], ["SP", 5, 30, 3, [1, 1, 1, 3], 1], ["SP", 5, 35, 64, [16, 4], 1], ["SP", 5, 38, 1, [1, 1], 1], ["SP", 5, 41, 1, [1, 1], 1], ["RE", 5, [0, 5, 10, 15, 20, 25, 30, 1, 6, 11, 16, 21, 26, 31, 2, 7, 12, 17, 22, 27, 32, 35, 38, 41, 36, 39, 42, 3, 8, 13, 18, 23, 28, 33, 37, 40, 43, 4, 9, 14, 19, 24, 29, 34]], ["FSP", 6, 0, 2, 3], ["FSP", 6, 4, 3, 3], ["FSP", 6, 8, 4, 3], ["FSP", 6, 12, 5, 3], ["FSP", 6, 16, 6, 3], ["FSP", 6, 20, 7, 3], ["FSP", 6, 24, 8, 3], ["RE", 6, [0, 4, 8, 12, 16, 20, 24, 1, 5, 9, 13, 17, 21, 25, 2, 6, 10, 14, 18, 22, 26, 3, 7, 11, 15, 19, 23, 27]], ["CA", 5, 6, 20], ["CI", 4], ["CI", 2], ["CI", 1], ["FU", 9, [0, 1, 2, 3]], ["SP", 9, 0, 8505, [2], 1], ["AN", 9, 0, 5], ["AN", 9, 1, 6], ["FU", 6, [0, 1, 2, 3, 4, 5, 6]], ["AN", 6, 0, 5], ["FU", 6, [1, 2, 3, 4, 5, 6, 7]], ["AN", 6, 1, 4], ["FU", 6, [2, 3, 4, 5, 6, 7, 8]], ["AN", 6, 2, 6], ["PR", 5, 0, "auto_unroll_max_step$64"], ["AN", 5, 43, 2], ["AN", 6, 9, 2]]]], "r": [[0.0117524, 0.0136439, 0.0125107], 0, 9.01674, 1630224170], "v": "v0.6"}
{"i": [["[\"e4ec3906e80d2af01a06496bf02db0d3\", 1, 64, 27, 21, 15, 64, 1, 1, 1, 15, 1, 1, 1, 15, 27, 21]", "opencl -keys=mali,opencl,gpu -device=mali -max_num_threads=256 -thread_warp_size=1", [2, 16, 64, 4096, 40960, 512, 2, 2], "llvm -keys=cpu -link-params=0 -mtriple=aarch64-linux-gnu", 2, []], [[], [["CI", 6], ["CHW", 5, "local"], ["SP", 5, 0, 1, [1, 1, 1, 1], 1], ["SP", 5, 5, 5, [1, 1, 5, 1], 1], ["SP", 5, 10, 27, [1, 9, 1, 1], 1], ["SP", 5, 15, 7, [1, 1, 1, 7], 1], ["SP", 5, 20, 1, [1, 1, 1, 1], 1], ["SP", 5, 25, 3, [1, 1, 1, 1], 1], ["SP", 5, 30, 3, [1, 1, 1, 3], 1], ["SP", 5, 35, 64, [4, 16], 1], ["SP", 5, 38, 1, [1, 1], 1], ["SP", 5, 41, 1, [1, 1], 1], ["RE", 5, [0, 5, 10, 15, 20, 25, 30, 1, 6, 11, 16, 21, 26, 31, 2, 7, 12, 17, 22, 27, 32, 35, 38, 41, 36, 39, 42, 3, 8, 13, 18, 23, 28, 33, 37, 40, 43, 4, 9, 14, 19, 24, 29, 34]], ["FSP", 6, 0, 2, 3], ["FSP", 6, 4, 3, 3], ["FSP", 6, 8, 4, 3], ["FSP", 6, 12, 5, 3], ["FSP", 6, 16, 6, 3], ["FSP", 6, 20, 7, 3], ["FSP", 6, 24, 8, 3], ["RE", 6, [0, 4, 8, 12, 16, 20, 24, 1, 5, 9, 13, 17, 21, 25, 2, 6, 10, 14, 18, 22, 26, 3, 7, 11, 15, 19, 23, 27]], ["CA", 5, 6, 20], ["CI", 4], ["CI", 2], ["CI", 1], ["FU", 9, [0, 1, 2, 3]], ["SP", 9, 0, 8505, [2], 1], ["AN", 9, 0, 5], ["AN", 9, 1, 6], ["FU", 6, [0, 1, 2, 3, 4, 5, 6]], ["AN", 6, 0, 5], ["FU", 6, [1, 2, 3, 4, 5, 6, 7]], ["AN", 6, 1, 4], ["FU", 6, [2, 3, 4, 5, 6, 7, 8]], ["AN", 6, 2, 6], ["PR", 5, 0, "auto_unroll_max_step$16"], ["AN", 5, 43, 2], ["AN", 6, 9, 2]]]], "r": [[0.000974429, 0.000956756, 0.000983749], 0, 8.94674, 1630224180], "v": "v0.6"}
{"i": [["[\"e4ec3906e80d2af01a06496bf02db0d3\", 1, 64, 27, 21, 15, 64, 1, 1, 1, 15, 1, 1, 1, 15, 27, 21]", "opencl -keys=mali,opencl,gpu -device=mali -max_num_threads=256 -thread_warp_size=1", [2, 16, 64, 4096, 40960, 512, 2, 2], "llvm -keys=cpu -link-params=0 -mtriple=aarch64-linux-gnu", 2, []], [[], [["CI", 6], ["CHW", 5, "local"], ["SP", 5, 0, 1, [1, 1, 1, 1], 1], ["SP", 5, 5, 5, [1, 5, 1, 1], 1], ["SP", 5, 10, 27, [1, 3, 9, 1], 1], ["SP", 5, 15, 7, [1, 1, 1, 7], 1], ["SP", 5, 20, 1, [1, 1, 1, 1], 1], ["SP", 5, 25, 3, [1, 1, 1, 3], 1], ["SP", 5, 30, 3, [1, 3, 1, 1], 1], ["SP", 5, 35, 64, [16, 4], 1], ["SP", 5, 38, 1, [1, 1], 1], ["SP", 5, 41, 1, [1, 1], 1], ["RE", 5, [0, 5, 10, 15, 20, 25, 30, 1, 6, 11, 16, 21, 26, 31, 2, 7, 12, 17, 22, 27, 32, 35, 38, 41, 36, 39, 42, 3, 8, 13, 18, 23, 28, 33, 37, 40, 43, 4, 9, 14, 19, 24, 29, 34]], ["FSP", 6, 0, 2, 3], ["FSP", 6, 4, 3, 3], ["FSP", 6, 8, 4, 3], ["FSP", 6, 12, 5, 3], ["FSP", 6, 16, 6, 3], ["FSP", 6, 20, 7, 3], ["FSP", 6, 24, 8, 3], ["RE", 6, [0, 4, 8, 12, 16, 20, 24, 1, 5, 9, 13, 17, 21, 25, 2, 6, 10, 14, 18, 22, 26, 3, 7, 11, 15, 19, 23, 27]], ["CA", 5, 6, 20], ["CI", 4], ["CI", 2], ["CI", 1], ["FU", 9, [0, 1, 2, 3]], ["SP", 9, 0, 8505, [2], 1], ["AN", 9, 0, 5], ["AN", 9, 1, 6], ["FU", 6, [0, 1, 2, 3, 4, 5, 6]], ["AN", 6, 0, 5], ["FU", 6, [1, 2, 3, 4, 5, 6, 7]], ["AN", 6, 1, 4], ["FU", 6, [2, 3, 4, 5, 6, 7, 8]], ["AN", 6, 2, 6], ["PR", 5, 0, "auto_unroll_max_step$512"], ["AN", 5, 43, 2], ["AN", 6, 9, 2]]]], "r": [[0.00732112, 0.00741095, 0.00111944], 0, 10.0856, 1630224190], "v": "v0.6"}
{"i": [["[\"e4ec3906e80d2af01a06496bf02db0d3\", 1, 64, 27, 21, 15, 64, 1, 1, 1, 15, 1, 1, 1, 15, 27, 21]", "opencl -keys=mali,opencl,gpu -device=mali -max_num_threads=256 -thread_warp_size=1", [2, 16, 64, 4096, 40960, 512, 2, 2], "llvm -keys=cpu -link-params=0 -mtriple=aarch64-linux-gnu", 2, []], [[], [["CI", 6], ["CHW", 5, "local"], ["SP", 5, 0, 1, [1, 1, 1, 1], 1], ["SP", 5, 5, 5, [1, 1, 1, 5], 1], ["SP", 5, 10, 27, [1, 1, 1, 1], 1], ["SP", 5, 15, 7, [1, 7, 1, 1], 1], ["SP", 5, 20, 1, [1, 1, 1, 1], 1], ["SP", 5, 25, 3, [1, 1, 1, 3], 1], ["SP", 5, 30, 3, [1, 3, 1, 1], 1], ["SP", 5, 35, 64, [1, 1], 1], ["SP", 5, 38, 1, [1, 1], 1], ["SP", 5, 41, 1, [1, 1], 1], ["RE", 5, [0, 5, 10, 15, 20, 25, 30, 1, 6, 11, 16, 21, 26, 31, 2, 7, 12, 17, 22, 27, 32, 35, 38, 41, 36, 39, 42, 3, 8, 13, 18, 23, 28, 33, 37, 40, 43, 4, 9, 14, 19, 24, 29, 34]], ["FSP", 6, 0, 2, 3], ["FSP", 6, 4, 3, 3], ["FSP", 6, 8, 4, 3], ["FSP", 6, 12, 5, 3], ["FSP", 6, 16, 6, 3], ["FSP", 6, 20, 7, 3], ["FSP", 6, 24, 8, 3], ["RE", 6, [0, 4, 8, 12, 16, 20, 24, 1, 5, 9, 13, 17, 21, 25, 2, 6, 10, 14, 18, 22, 26, 3, 7, 11, 15, 19, 23, 27]], ["CA", 5, 6, 20], ["CI", 4], ["CI", 2], ["CI", 1], ["FU", 9, [0, 1, 2, 3]], ["SP", 9, 0, 8505, [2], 1], ["AN", 9, 0, 5], ["AN", 9, 1, 6], ["FU", 6, [0, 1, 2, 3, 4, 5, 6]], ["AN", 6, 0, 5], ["FU", 6, [1, 2, 3, 4, 5, 6, 7]], ["AN", 6, 1, 4], ["FU", 6, [2, 3, 4, 5, 6, 7, 8]], ["AN", 6, 2, 6], ["PR", 5, 0, "auto_unroll_max_step$1024"], ["AN", 5, 43, 2], ["AN", 6, 9, 2]]]], "r": [[0.000551864, 0.000507273, 0.000569277], 0, 10.1007, 1630224202], "v": "v0.6"}
{"i": [["[\"e4ec3906e80d2af01a06496bf02db0d3\", 1, 64, 27, 21, 15, 64, 1, 1, 1, 15, 1, 1, 1, 15, 27, 21]", "opencl -keys=mali,opencl,gpu -device=mali -max_num_threads=256 -thread_warp_size=1", [2, 16, 64, 4096, 40960, 512, 2, 2], "llvm -keys=cpu -link-params=0 -mtriple=aarch64-linux-gnu", 2, []], [[], [["CI", 6], ["CHW", 5, "local"], ["SP", 5, 0, 1, [1, 1, 1, 1], 1], ["SP", 5, 5, 5, [1, 5, 1, 1], 1], ["SP", 5, 10, 27, [1, 3, 1, 3], 1], ["SP", 5, 15, 7, [1, 1, 1, 7], 1], ["SP", 5, 20, 1, [1, 1, 1, 1], 1], ["SP", 5, 25, 3, [1, 1, 1, 3], 1], ["SP", 5, 30, 3, [1, 3, 1, 1], 1], ["SP", 5, 35, 64, [8, 8], 1], ["SP", 5, 38, 1, [1, 1], 1], ["SP", 5, 41, 1, [1, 1], 1], ["RE", 5, [0, 5, 10, 15, 20, 25, 30, 1, 6, 11, 16, 21, 26, 31, 2, 7, 12, 17, 22, 27, 32, 35, 38, 41, 36, 39, 42, 3, 8, 13, 18, 23, 28, 33, 37, 40, 43, 4, 9, 14, 19, 24, 29, 34]], ["FSP", 6, 0, 2, 3], ["FSP", 6, 4, 3, 3], ["FSP", 6, 8, 4, 3], ["FSP", 6, 12, 5, 3], ["FSP", 6, 16, 6, 3], ["FSP", 6, 20, 7, 3], ["FSP", 6, 24, 8, 3], ["RE", 6, [0, 4, 8, 12, 16, 20, 24, 1, 5, 9, 13, 17, 21, 25, 2, 6, 10, 14, 18, 22, 26, 3, 7, 11, 15, 19, 23, 27]], ["CA", 5, 6, 20], ["CI", 4], ["CI", 2], ["CI", 1], ["FU", 9, [0, 1, 2, 3]], ["SP", 9, 0, 8505, [1], 1], ["AN", 9, 0, 5], ["AN", 9, 1, 6], ["FU", 6, [0, 1, 2, 3, 4, 5, 6]], ["AN", 6, 0, 5], ["FU", 6, [1, 2, 3, 4, 5, 6, 7]], ["AN", 6, 1, 4], ["FU", 6, [2, 3, 4, 5, 6, 7, 8]], ["AN", 6, 2, 6], ["PR", 5, 0, "auto_unroll_max_step$512"], ["AN", 5, 43, 2], ["AN", 6, 9, 2]]]], "r": [[0.00635235, 0.00637169, 0.00633575], 0, 11.8046, 1630224215], "v": "v0.6"}
{"i": [["[\"e4ec3906e80d2af01a06496bf02db0d3\", 1, 64, 27, 21, 15, 64, 1, 1, 1, 15, 1, 1, 1, 15, 27, 21]", "opencl -keys=mali,opencl,gpu -device=mali -max_num_threads=256 -thread_warp_size=1", [2, 16, 64, 4096, 40960, 512, 2, 2], "llvm -keys=cpu -link-params=0 -mtriple=aarch64-linux-gnu", 2, []], [[], [["CI", 6], ["CHW", 5, "local"], ["SP", 5, 0, 1, [1, 1, 1, 1], 1], ["SP", 5, 5, 5, [1, 1, 1, 1], 1], ["SP", 5, 10, 27, [1, 3, 1, 9], 1], ["SP", 5, 15, 7, [1, 1, 7, 1], 1], ["SP", 5, 20, 1, [1, 1, 1, 1], 1], ["SP", 5, 25, 3, [1, 1, 1, 1], 1], ["SP", 5, 30, 3, [1, 1, 1, 3], 1], ["SP", 5, 35, 64, [16, 4], 1], ["SP", 5, 38, 1, [1, 1], 1], ["SP", 5, 41, 1, [1, 1], 1], ["RE", 5, [0, 5, 10, 15, 20, 25, 30, 1, 6, 11, 16, 21, 26, 31, 2, 7, 12, 17, 22, 27, 32, 35, 38, 41, 36, 39, 42, 3, 8, 13, 18, 23, 28, 33, 37, 40, 43, 4, 9, 14, 19, 24, 29, 34]], ["FSP", 6, 0, 2, 3], ["FSP", 6, 4, 3, 3], ["FSP", 6, 8, 4, 3], ["FSP", 6, 12, 5, 3], ["FSP", 6, 16, 6, 3], ["FSP", 6, 20, 7, 3], ["FSP", 6, 24, 8, 3], ["RE", 6, [0, 4, 8, 12, 16, 20, 24, 1, 5, 9, 13, 17, 21, 25, 2, 6, 10, 14, 18, 22, 26, 3, 7, 11, 15, 19, 23, 27]], ["CA", 5, 6, 20], ["CI", 4], ["CI", 2], ["CI", 1], ["FU", 9, [0, 1, 2, 3]], ["SP", 9, 0, 8505, [2], 1], ["AN", 9, 0, 5], ["AN", 9, 1, 6], ["FU", 6, [0, 1, 2, 3, 4, 5, 6]], ["AN", 6, 0, 5], ["FU", 6, [1, 2, 3, 4, 5, 6, 7]], ["AN", 6, 1, 4], ["FU", 6, [2, 3, 4, 5, 6, 7, 8]], ["AN", 6, 2, 6], ["PR", 5, 0, "auto_unroll_max_step$512"], ["AN", 5, 43, 2], ["AN", 6, 9, 2]]]], "r": [[0.0277585, 0.0265663, 0.0329613], 0, 17.8552, 1630224236], "v": "v0.6"}
{"i": [["[\"e4ec3906e80d2af01a06496bf02db0d3\", 1, 64, 27, 21, 15, 64, 1, 1, 1, 15, 1, 1, 1, 15, 27, 21]", "opencl -keys=mali,opencl,gpu -device=mali -max_num_threads=256 -thread_warp_size=1", [2, 16, 64, 4096, 40960, 512, 2, 2], "llvm -keys=cpu -link-params=0 -mtriple=aarch64-linux-gnu", 2, []], [[], [["CI", 6], ["CHW", 5, "local"], ["SP", 5, 0, 1, [1, 1, 1, 1], 1], ["SP", 5, 5, 5, [1, 1, 1, 5], 1], ["SP", 5, 10, 27, [1, 1, 1, 1], 1], ["SP", 5, 15, 7, [1, 1, 1, 7], 1], ["SP", 5, 20, 1, [1, 1, 1, 1], 1], ["SP", 5, 25, 3, [1, 1, 1, 3], 1], ["SP", 5, 30, 3, [1, 3, 1, 1], 1], ["SP", 5, 35, 64, [1, 1], 1], ["SP", 5, 38, 1, [1, 1], 1], ["SP", 5, 41, 1, [1, 1], 1], ["RE", 5, [0, 5, 10, 15, 20, 25, 30, 1, 6, 11, 16, 21, 26, 31, 2, 7, 12, 17, 22, 27, 32, 35, 38, 41, 36, 39, 42, 3, 8, 13, 18, 23, 28, 33, 37, 40, 43, 4, 9, 14, 19, 24, 29, 34]], ["FSP", 6, 0, 2, 3], ["FSP", 6, 4, 3, 3], ["FSP", 6, 8, 4, 3], ["FSP", 6, 12, 5, 3], ["FSP", 6, 16, 6, 3], ["FSP", 6, 20, 7, 3], ["FSP", 6, 24, 8, 3], ["RE", 6, [0, 4, 8, 12, 16, 20, 24, 1, 5, 9, 13, 17, 21, 25, 2, 6, 10, 14, 18, 22, 26, 3, 7, 11, 15, 19, 23, 27]], ["CA", 5, 6, 20], ["CI", 4], ["CI", 2], ["CI", 1], ["FU", 9, [0, 1, 2, 3]], ["SP", 9, 0, 8505, [2], 1], ["AN", 9, 0, 5], ["AN", 9, 1, 6], ["FU", 6, [0, 1, 2, 3, 4, 5, 6]], ["AN", 6, 0, 5], ["FU", 6, [1, 2, 3, 4, 5, 6, 7]], ["AN", 6, 1, 4], ["FU", 6, [2, 3, 4, 5, 6, 7, 8]], ["AN", 6, 2, 6], ["PR", 5, 0, "auto_unroll_max_step$1024"], ["AN", 5, 43, 2], ["AN", 6, 9, 2]]]], "r": [[0.00640925, 0.0015486, 0.00100115], 0, 8.87247, 1630224256], "v": "v0.6"}
{"i": [["[\"e4ec3906e80d2af01a06496bf02db0d3\", 1, 64, 27, 21, 15, 64, 1, 1, 1, 15, 1, 1, 1, 15, 27, 21]", "opencl -keys=mali,opencl,gpu -device=mali -max_num_threads=256 -thread_warp_size=1", [2, 16, 64, 4096, 40960, 512, 2, 2], "llvm -keys=cpu -link-params=0 -mtriple=aarch64-linux-gnu", 2, []], [[], [["CI", 6], ["CHW", 5, "local"], ["SP", 5, 0, 1, [1, 1, 1, 1], 1], ["SP", 5, 5, 5, [1, 1, 1, 1], 1], ["SP", 5, 10, 27, [1, 9, 1, 3], 1], ["SP", 5, 15, 7, [7, 1, 1, 1], 1], ["SP", 5, 20, 1, [1, 1, 1, 1], 1], ["SP", 5, 25, 3, [1, 1, 1, 1], 1], ["SP", 5, 30, 3, [1, 1, 3, 1], 1], ["SP", 5, 35, 64, [1, 64], 1], ["SP", 5, 38, 1, [1, 1], 1], ["SP", 5, 41, 1, [1, 1], 1], ["RE", 5, [0, 5, 10, 15, 20, 25, 30, 1, 6, 11, 16, 21, 26, 31, 2, 7, 12, 17, 22, 27, 32, 35, 38, 41, 36, 39, 42, 3, 8, 13, 18, 23, 28, 33, 37, 40, 43, 4, 9, 14, 19, 24, 29, 34]], ["FSP", 6, 0, 2, 3], ["FSP", 6, 4, 3, 3], ["FSP", 6, 8, 4, 3], ["FSP", 6, 12, 5, 3], ["FSP", 6, 16, 6, 3], ["FSP", 6, 20, 7, 3], ["FSP", 6, 24, 8, 3], ["RE", 6, [0, 4, 8, 12, 16, 20, 24, 1, 5, 9, 13, 17, 21, 25, 2, 6, 10, 14, 18, 22, 26, 3, 7, 11, 15, 19, 23, 27]], ["CA", 5, 6, 20], ["CI", 4], ["CI", 2], ["CI", 1], ["FU", 9, [0, 1, 2, 3]], ["SP", 9, 0, 8505, [2], 1], ["AN", 9, 0, 5], ["AN", 9, 1, 6], ["FU", 6, [0, 1, 2, 3, 4, 5, 6]], ["AN", 6, 0, 5], ["FU", 6, [1, 2, 3, 4, 5, 6, 7]], ["AN", 6, 1, 4], ["FU", 6, [2, 3, 4, 5, 6, 7, 8]], ["AN", 6, 2, 6], ["PR", 5, 0, "auto_unroll_max_step$0"], ["AN", 5, 43, 2], ["AN", 6, 9, 2]]]], "r": [[0.00198622, 0.00195036, 0.00198186], 0, 8.61255, 1630224265], "v": "v0.6"}
{"i": [["[\"e4ec3906e80d2af01a06496bf02db0d3\", 1, 64, 27, 21, 15, 64, 1, 1, 1, 15, 1, 1, 1, 15, 27, 21]", "opencl -keys=mali,opencl,gpu -device=mali -max_num_threads=256 -thread_warp_size=1", [2, 16, 64, 4096, 40960, 512, 2, 2], "llvm -keys=cpu -link-params=0 -mtriple=aarch64-linux-gnu", 2, []], [[], [["CI", 6], ["CHW", 5, "local"], ["SP", 5, 0, 1, [1, 1, 1, 1], 1], ["SP", 5, 5, 5, [1, 5, 1, 1], 1], ["SP", 5, 10, 27, [1, 1, 1, 1], 1], ["SP", 5, 15, 7, [1, 1, 7, 1], 1], ["SP", 5, 20, 1, [1, 1, 1, 1], 1], ["SP", 5, 25, 3, [1, 3, 1, 1], 1], ["SP", 5, 30, 3, [1, 1, 1, 1], 1], ["SP", 5, 35, 64, [16, 2], 1], ["SP", 5, 38, 1, [1, 1], 1], ["SP", 5, 41, 1, [1, 1], 1], ["RE", 5, [0, 5, 10, 15, 20, 25, 30, 1, 6, 11, 16, 21, 26, 31, 2, 7, 12, 17, 22, 27, 32, 35, 38, 41, 36, 39, 42, 3, 8, 13, 18, 23, 28, 33, 37, 40, 43, 4, 9, 14, 19, 24, 29, 34]], ["FSP", 6, 0, 2, 3], ["FSP", 6, 4, 3, 3], ["FSP", 6, 8, 4, 3], ["FSP", 6, 12, 5, 3], ["FSP", 6, 16, 6, 3], ["FSP", 6, 20, 7, 3], ["FSP", 6, 24, 8, 3], ["RE", 6, [0, 4, 8, 12, 16, 20, 24, 1, 5, 9, 13, 17, 21, 25, 2, 6, 10, 14, 18, 22, 26, 3, 7, 11, 15, 19, 23, 27]], ["CA", 5, 6, 20], ["CI", 4], ["CI", 2], ["CI", 1], ["FU", 9, [0, 1, 2, 3]], ["SP", 9, 0, 8505, [2], 1], ["AN", 9, 0, 5], ["AN", 9, 1, 6], ["FU", 6, [0, 1, 2, 3, 4, 5, 6]], ["AN", 6, 0, 5], ["FU", 6, [1, 2, 3, 4, 5, 6, 7]], ["AN", 6, 1, 4], ["FU", 6, [2, 3, 4, 5, 6, 7, 8]], ["AN", 6, 2, 6], ["PR", 5, 0, "auto_unroll_max_step$512"], ["AN", 5, 43, 2], ["AN", 6, 9, 2]]]], "r": [[0.00188541, 0.00189797, 0.00190782], 0, 9.41923, 1630224274], "v": "v0.6"}
{"i": [["[\"e4ec3906e80d2af01a06496bf02db0d3\", 1, 64, 27, 21, 15, 64, 1, 1, 1, 15, 1, 1, 1, 15, 27, 21]", "opencl -keys=mali,opencl,gpu -device=mali -max_num_threads=256 -thread_warp_size=1", [2, 16, 64, 4096, 40960, 512, 2, 2], "llvm -keys=cpu -link-params=0 -mtriple=aarch64-linux-gnu", 2, []], [[], [["CI", 6], ["CHW", 5, "local"], ["SP", 5, 0, 1, [1, 1, 1, 1], 1], ["SP", 5, 5, 5, [1, 1, 1, 1], 1], ["SP", 5, 10, 27, [1, 1, 3, 1], 1], ["SP", 5, 15, 7, [1, 7, 1, 1], 1], ["SP", 5, 20, 1, [1, 1, 1, 1], 1], ["SP", 5, 25, 3, [1, 1, 3, 1], 1], ["SP", 5, 30, 3, [1, 1, 1, 3], 1], ["SP", 5, 35, 64, [16, 4], 1], ["SP", 5, 38, 1, [1, 1], 1], ["SP", 5, 41, 1, [1, 1], 1], ["RE", 5, [0, 5, 10, 15, 20, 25, 30, 1, 6, 11, 16, 21, 26, 31, 2, 7, 12, 17, 22, 27, 32, 35, 38, 41, 36, 39, 42, 3, 8, 13, 18, 23, 28, 33, 37, 40, 43, 4, 9, 14, 19, 24, 29, 34]], ["FSP", 6, 0, 2, 3], ["FSP", 6, 4, 3, 3], ["FSP", 6, 8, 4, 3], ["FSP", 6, 12, 5, 3], ["FSP", 6, 16, 6, 3], ["FSP", 6, 20, 7, 3], ["FSP", 6, 24, 8, 3], ["RE", 6, [0, 4, 8, 12, 16, 20, 24, 1, 5, 9, 13, 17, 21, 25, 2, 6, 10, 14, 18, 22, 26, 3, 7, 11, 15, 19, 23, 27]], ["CA", 5, 6, 20], ["CI", 4], ["CI", 2], ["CI", 1], ["FU", 9, [0, 1, 2, 3]], ["SP", 9, 0, 8505, [8], 1], ["AN", 9, 0, 5], ["AN", 9, 1, 6], ["FU", 6, [0, 1, 2, 3, 4, 5, 6]], ["AN", 6, 0, 5], ["FU", 6, [1, 2, 3, 4, 5, 6, 7]], ["AN", 6, 1, 4], ["FU", 6, [2, 3, 4, 5, 6, 7, 8]], ["AN", 6, 2, 6], ["PR", 5, 0, "auto_unroll_max_step$512"], ["AN", 5, 43, 2], ["AN", 6, 9, 2]]]], "r": [[0.00191888, 0.000832941, 0.00106544], 0, 8.45782, 1630224283], "v": "v0.6"}
{"i": [["[\"e4ec3906e80d2af01a06496bf02db0d3\", 1, 64, 27, 21, 15, 64, 1, 1, 1, 15, 1, 1, 1, 15, 27, 21]", "opencl -keys=mali,opencl,gpu -device=mali -max_num_threads=256 -thread_warp_size=1", [2, 16, 64, 4096, 40960, 512, 2, 2], "llvm -keys=cpu -link-params=0 -mtriple=aarch64-linux-gnu", 2, []], [[], [["CI", 6], ["CHW", 5, "local"], ["SP", 5, 0, 1, [1, 1, 1, 1], 1], ["SP", 5, 5, 5, [1, 1, 5, 1], 1], ["SP", 5, 10, 27, [1, 1, 3, 1], 1], ["SP", 5, 15, 7, [1, 1, 1, 1], 1], ["SP", 5, 20, 1, [1, 1, 1, 1], 1], ["SP", 5, 25, 3, [1, 1, 1, 3], 1], ["SP", 5, 30, 3, [1, 3, 1, 1], 1], ["SP", 5, 35, 64, [1, 2], 1], ["SP", 5, 38, 1, [1, 1], 1], ["SP", 5, 41, 1, [1, 1], 1], ["RE", 5, [0, 5, 10, 15, 20, 25, 30, 1, 6, 11, 16, 21, 26, 31, 2, 7, 12, 17, 22, 27, 32, 35, 38, 41, 36, 39, 42, 3, 8, 13, 18, 23, 28, 33, 37, 40, 43, 4, 9, 14, 19, 24, 29, 34]], ["FSP", 6, 0, 2, 3], ["FSP", 6, 4, 3, 3], ["FSP", 6, 8, 4, 3], ["FSP", 6, 12, 5, 3], ["FSP", 6, 16, 6, 3], ["FSP", 6, 20, 7, 3], ["FSP", 6, 24, 8, 3], ["RE", 6, [0, 4, 8, 12, 16, 20, 24, 1, 5, 9, 13, 17, 21, 25, 2, 6, 10, 14, 18, 22, 26, 3, 7, 11, 15, 19, 23, 27]], ["CA", 5, 6, 20], ["CI", 4], ["CI", 2], ["CI", 1], ["FU", 9, [0, 1, 2, 3]], ["SP", 9, 0, 8505, [4], 1], ["AN", 9, 0, 5], ["AN", 9, 1, 6], ["FU", 6, [0, 1, 2, 3, 4, 5, 6]], ["AN", 6, 0, 5], ["FU", 6, [1, 2, 3, 4, 5, 6, 7]], ["AN", 6, 1, 4], ["FU", 6, [2, 3, 4, 5, 6, 7, 8]], ["AN", 6, 2, 6], ["PR", 5, 0, "auto_unroll_max_step$16"], ["AN", 5, 43, 2], ["AN", 6, 9, 2]]]], "r": [[0.0017744, 0.000941692, 0.000687344], 0, 8.42959, 1630224292], "v": "v0.6"}
{"i": [["[\"e4ec3906e80d2af01a06496bf02db0d3\", 1, 64, 27, 21, 15, 64, 1, 1, 1, 15, 1, 1, 1, 15, 27, 21]", "opencl -keys=mali,opencl,gpu -device=mali -max_num_threads=256 -thread_warp_size=1", [2, 16, 64, 4096, 40960, 512, 2, 2], "llvm -keys=cpu -link-params=0 -mtriple=aarch64-linux-gnu", 2, []], [[], [["CI", 6], ["CHW", 5, "local"], ["SP", 5, 0, 1, [1, 1, 1, 1], 1], ["SP", 5, 5, 5, [1, 5, 1, 1], 1], ["SP", 5, 10, 27, [1, 3, 3, 3], 1], ["SP", 5, 15, 7, [1, 1, 7, 1], 1], ["SP", 5, 20, 1, [1, 1, 1, 1], 1], ["SP", 5, 25, 3, [1, 1, 1, 1], 1], ["SP", 5, 30, 3, [1, 3, 1, 1], 1], ["SP", 5, 35, 64, [4, 2], 1], ["SP", 5, 38, 1, [1, 1], 1], ["SP", 5, 41, 1, [1, 1], 1], ["RE", 5, [0, 5, 10, 15, 20, 25, 30, 1, 6, 11, 16, 21, 26, 31, 2, 7, 12, 17, 22, 27, 32, 35, 38, 41, 36, 39, 42, 3, 8, 13, 18, 23, 28, 33, 37, 40, 43, 4, 9, 14, 19, 24, 29, 34]], ["FSP", 6, 0, 2, 3], ["FSP", 6, 4, 3, 3], ["FSP", 6, 8, 4, 3], ["FSP", 6, 12, 5, 3], ["FSP", 6, 16, 6, 3], ["FSP", 6, 20, 7, 3], ["FSP", 6, 24, 8, 3], ["RE", 6, [0, 4, 8, 12, 16, 20, 24, 1, 5, 9, 13, 17, 21, 25, 2, 6, 10, 14, 18, 22, 26, 3, 7, 11, 15, 19, 23, 27]], ["CA", 5, 6, 20], ["CI", 4], ["CI", 2], ["CI", 1], ["FU", 9, [0, 1, 2, 3]], ["SP", 9, 0, 8505, [2], 1], ["AN", 9, 0, 5], ["AN", 9, 1, 6], ["FU", 6, [0, 1, 2, 3, 4, 5, 6]], ["AN", 6, 0, 5], ["FU", 6, [1, 2, 3, 4, 5, 6, 7]], ["AN", 6, 1, 4], ["FU", 6, [2, 3, 4, 5, 6, 7, 8]], ["AN", 6, 2, 6], ["PR", 5, 0, "auto_unroll_max_step$1024"], ["AN", 5, 43, 2], ["AN", 6, 9, 2]]]], "r": [[0.015447, 0.015448, 0.00229349], 0, 12.3075, 1630224304], "v": "v0.6"}
{"i": [["[\"e4ec3906e80d2af01a06496bf02db0d3\", 1, 64, 27, 21, 15, 64, 1, 1, 1, 15, 1, 1, 1, 15, 27, 21]", "opencl -keys=mali,opencl,gpu -device=mali -max_num_threads=256 -thread_warp_size=1", [2, 16, 64, 4096, 40960, 512, 2, 2], "llvm -keys=cpu -link-params=0 -mtriple=aarch64-linux-gnu", 2, []], [[], [["CI", 6], ["CHW", 5, "local"], ["SP", 5, 0, 1, [1, 1, 1, 1], 1], ["SP", 5, 5, 5, [1, 5, 1, 1], 1], ["SP", 5, 10, 27, [1, 1, 9, 1], 1], ["SP", 5, 15, 7, [1, 1, 1, 1], 1], ["SP", 5, 20, 1, [1, 1, 1, 1], 1], ["SP", 5, 25, 3, [1, 3, 1, 1], 1], ["SP", 5, 30, 3, [1, 1, 1, 1], 1], ["SP", 5, 35, 64, [4, 8], 1], ["SP", 5, 38, 1, [1, 1], 1], ["SP", 5, 41, 1, [1, 1], 1], ["RE", 5, [0, 5, 10, 15, 20, 25, 30, 1, 6, 11, 16, 21, 26, 31, 2, 7, 12, 17, 22, 27, 32, 35, 38, 41, 36, 39, 42, 3, 8, 13, 18, 23, 28, 33, 37, 40, 43, 4, 9, 14, 19, 24, 29, 34]], ["FSP", 6, 0, 2, 3], ["FSP", 6, 4, 3, 3], ["FSP", 6, 8, 4, 3], ["FSP", 6, 12, 5, 3], ["FSP", 6, 16, 6, 3], ["FSP", 6, 20, 7, 3], ["FSP", 6, 24, 8, 3], ["RE", 6, [0, 4, 8, 12, 16, 20, 24, 1, 5, 9, 13, 17, 21, 25, 2, 6, 10, 14, 18, 22, 26, 3, 7, 11, 15, 19, 23, 27]], ["CA", 5, 6, 20], ["CI", 4], ["CI", 2], ["CI", 1], ["FU", 9, [0, 1, 2, 3]], ["SP", 9, 0, 8505, [2], 1], ["AN", 9, 0, 5], ["AN", 9, 1, 6], ["FU", 6, [0, 1, 2, 3, 4, 5, 6]], ["AN", 6, 0, 5], ["FU", 6, [1, 2, 3, 4, 5, 6, 7]], ["AN", 6, 1, 4], ["FU", 6, [2, 3, 4, 5, 6, 7, 8]], ["AN", 6, 2, 6], ["PR", 5, 0, "auto_unroll_max_step$0"], ["AN", 5, 43, 2], ["AN", 6, 9, 2]]]], "r": [[0.0120501, 0.0120346, 0.012049], 0, 7.94015, 1630224315], "v": "v0.6"}
