example_03/model-01-half-NCHW-B1-opencl-C2000-T21-09-02-12-19.json
{"i": [["[\"f09f3f33f76116d85452966717e745d5\", 1, 32, 160, 120, 1, 32, 80, 60]", "opencl -keys=opencl,gpu -max_num_threads=256 -thread_warp_size=1", [2, 16, 64, 4096, 409600, 512, 2, 2], "llvm -keys=cpu -link-params=0 -mtriple=aarch64-linux-gnu", 0, []], [[], [["CI", 1], ["FU", 2, [0, 1, 2, 3]], ["SP", 2, 0, 153600, [1], 1], ["AN", 2, 0, 5], ["AN", 2, 1, 6], ["PR", 2, 0, "auto_unroll_max_step$16"]]]], "r": [[0.00292026, 0.00300129, 0.00297278], 0, 2.79253, 1630556363], "v": "v0.6"}
{"i": [["[\"f09f3f33f76116d85452966717e745d5\", 1, 32, 160, 120, 1, 32, 80, 60]", "opencl -keys=opencl,gpu -max_num_threads=256 -thread_warp_size=1", [2, 16, 64, 4096, 409600, 512, 2, 2], "llvm -keys=cpu -link-params=0 -mtriple=aarch64-linux-gnu", 0, []], [[], [["CI", 1], ["FU", 2, [0, 1, 2, 3]], ["SP", 2, 0, 153600, [50], 1], ["AN", 2, 0, 5], ["AN", 2, 1, 6], ["PR", 2, 0, "auto_unroll_max_step$64"]]]], "r": [[0.00674598, 0.00099273, 0.00106981], 0, 8.14744, 1630556371], "v": "v0.6"}
{"i": [["[\"f09f3f33f76116d85452966717e745d5\", 1, 32, 160, 120, 1, 32, 80, 60]", "opencl -keys=opencl,gpu -max_num_threads=256 -thread_warp_size=1", [2, 16, 64, 4096, 409600, 512, 2, 2], "llvm -keys=cpu -link-params=0 -mtriple=aarch64-linux-gnu", 0, []], [[], [["CI", 1], ["FU", 2, [0, 1, 2, 3]], ["SP", 2, 0, 153600, [10], 1], ["AN", 2, 0, 5], ["AN", 2, 1, 6], ["PR", 2, 0, "auto_unroll_max_step$64"]]]], "r": [[0.00685509, 0.00100033, 0.00118403], 0, 7.88627, 1630556379], "v": "v0.6"}
{"i": [["[\"f09f3f33f76116d85452966717e745d5\", 1, 32, 160, 120, 1, 32, 80, 60]", "opencl -keys=opencl,gpu -max_num_threads=256 -thread_warp_size=1", [2, 16, 64, 4096, 409600, 512, 2, 2], "llvm -keys=cpu -link-params=0 -mtriple=aarch64-linux-gnu", 0, []], [[], [["CI", 1], ["FU", 2, [0, 1, 2, 3]], ["SP", 2, 0, 153600, [6], 1], ["AN", 2, 0, 5], ["AN", 2, 1, 6], ["PR", 2, 0, "auto_unroll_max_step$512"]]]], "r": [[0.00684687, 0.00681182, 0.000966104], 0, 7.84463, 1630556387], "v": "v0.6"}
{"i": [["[\"f09f3f33f76116d85452966717e745d5\", 1, 32, 160, 120, 1, 32, 80, 60]", "opencl -keys=opencl,gpu -max_num_threads=256 -thread_warp_size=1", [2, 16, 64, 4096, 409600, 512, 2, 2], "llvm -keys=cpu -link-params=0 -mtriple=aarch64-linux-gnu", 0, []], [[], [["CI", 1], ["FU", 2, [0, 1, 2, 3]], ["SP", 2, 0, 153600, [64], 1], ["AN", 2, 0, 5], ["AN", 2, 1, 6], ["PR", 2, 0, "auto_unroll_max_step$16"]]]], "r": [[0.000926354, 0.000952804, 0.00107747], 0, 8.25978, 1630556395], "v": "v0.6"}
{"i": [["[\"f09f3f33f76116d85452966717e745d5\", 1, 32, 160, 120, 1, 32, 80, 60]", "opencl -keys=opencl,gpu -max_num_threads=256 -thread_warp_size=1", [2, 16, 64, 4096, 409600, 512, 2, 2], "llvm -keys=cpu -link-params=0 -mtriple=aarch64-linux-gnu", 0, []], [[], [["CI", 1], ["FU", 2, [0, 1, 2, 3]], ["SP", 2, 0, 153600, [8], 1], ["AN", 2, 0, 5], ["AN", 2, 1, 6], ["PR", 2, 0, "auto_unroll_max_step$16"]]]], "r": [[0.00681804, 0.00674811, 0.000975302], 0, 8.16111, 1630556403], "v": "v0.6"}
{"i": [["[\"f09f3f33f76116d85452966717e745d5\", 1, 32, 160, 120, 1, 32, 80, 60]", "opencl -keys=opencl,gpu -max_num_threads=256 -thread_warp_size=1", [2, 16, 64, 4096, 409600, 512, 2, 2], "llvm -keys=cpu -link-params=0 -mtriple=aarch64-linux-gnu", 0, []], [[], [["FU", 2, [4, 5]], ["SP", 2, 4, 4, [4], 1], ["AN", 2, 5, 6], ["CI", 1], ["FU", 2, [0, 1, 2, 3]], ["AN", 2, 0, 5], ["PR", 2, 0, "auto_unroll_max_step$16"]]]], "r": [[0.0212303, 0.00319614, 0.00346921], 0, 8.19565, 1630556411], "v": "v0.6"}
{"i": [["[\"f09f3f33f76116d85452966717e745d5\", 1, 32, 160, 120, 1, 32, 80, 60]", "opencl -keys=opencl,gpu -max_num_threads=256 -thread_warp_size=1", [2, 16, 64, 4096, 409600, 512, 2, 2], "llvm -keys=cpu -link-params=0 -mtriple=aarch64-linux-gnu", 0, []], [[], [["CI", 1], ["FU", 2, [0, 1, 2, 3]], ["SP", 2, 0, 153600, [32], 1], ["AN", 2, 0, 5], ["AN", 2, 1, 6], ["PR", 2, 0, "auto_unroll_max_step$64"]]]], "r": [[0.00679902, 0.00686316, 0.00683507], 0, 7.95566, 1630556419], "v": "v0.6"}
{"i": [["[\"f09f3f33f76116d85452966717e745d5\", 1, 32, 160, 120, 1, 32, 80, 60]", "opencl -keys=opencl,gpu -max_num_threads=256 -thread_warp_size=1", [2, 16, 64, 4096, 409600, 512, 2, 2], "llvm -keys=cpu -link-params=0 -mtriple=aarch64-linux-gnu", 0, []], [[], [["CI", 1], ["FU", 2, [0, 1, 2, 3]], ["SP", 2, 0, 153600, [15], 1], ["AN", 2, 0, 5], ["AN", 2, 1, 6], ["PR", 2, 0, "auto_unroll_max_step$64"]]]], "r": [[0.00676176, 0.00672104, 0.000986899], 0, 8.06435, 1630556427], "v": "v0.6"}
{"i": [["[\"f09f3f33f76116d85452966717e745d5\", 1, 32, 160, 120, 1, 32, 80, 60]", "opencl -keys=opencl,gpu -max_num_threads=256 -thread_warp_size=1", [2, 16, 64, 4096, 409600, 512, 2, 2], "llvm -keys=cpu -link-params=0 -mtriple=aarch64-linux-gnu", 0, []], [[], [["CI", 1], ["FU", 2, [0, 1, 2, 3]], ["SP", 2, 0, 153600, [40], 1], ["AN", 2, 0, 5], ["AN", 2, 1, 6], ["PR", 2, 0, "auto_unroll_max_step$64"]]]], "r": [[0.006682, 0.00673931, 0.000954436], 0, 8.03326, 1630556435], "v": "v0.6"}
{"i": [["[\"f09f3f33f76116d85452966717e745d5\", 1, 32, 160, 120, 1, 32, 80, 60]", "opencl -keys=opencl,gpu -max_num_threads=256 -thread_warp_size=1", [2, 16, 64, 4096, 409600, 512, 2, 2], "llvm -keys=cpu -link-params=0 -mtriple=aarch64-linux-gnu", 0, []], [[], [["FU", 2, [4, 5]], ["SP", 2, 4, 4, [1], 1], ["AN", 2, 5, 6], ["CI", 1], ["FU", 2, [0, 1, 2, 3]], ["AN", 2, 0, 5], ["PR", 2, 0, "auto_unroll_max_step$512"]]]], "r": [[0.00288573, 0.00312264, 0.00316317], 0, 8.09598, 1630556443], "v": "v0.6"}
{"i": [["[\"f09f3f33f76116d85452966717e745d5\", 1, 32, 160, 120, 1, 32, 80, 60]", "opencl -keys=opencl,gpu -max_num_threads=256 -thread_warp_size=1", [2, 16, 64, 4096, 409600, 512, 2, 2], "llvm -keys=cpu -link-params=0 -mtriple=aarch64-linux-gnu", 0, []], [[], [["CI", 1], ["FU", 2, [0, 1, 2, 3]], ["SP", 2, 0, 153600, [25], 1], ["AN", 2, 0, 5], ["AN", 2, 1, 6], ["PR", 2, 0, "auto_unroll_max_step$64"]]]], "r": [[0.00102879, 0.00114637, 0.00102694], 0, 8.23739, 1630556452], "v": "v0.6"}
{"i": [["[\"f09f3f33f76116d85452966717e745d5\", 1, 32, 160, 120, 1, 32, 80, 60]", "opencl -keys=opencl,gpu -max_num_threads=256 -thread_warp_size=1", [2, 16, 64, 4096, 409600, 512, 2, 2], "llvm -keys=cpu -link-params=0 -mtriple=aarch64-linux-gnu", 0, []], [[], [["CI", 1], ["FU", 2, [0, 1, 2, 3]], ["SP", 2, 0, 153600, [6], 1], ["AN", 2, 0, 5], ["AN", 2, 1, 6], ["PR", 2, 0, "auto_unroll_max_step$64"]]]], "r": [[0.00684524, 0.00700107, 0.00703592], 0, 8.24003, 1630556460], "v": "v0.6"}
{"i": [["[\"f09f3f33f76116d85452966717e745d5\", 1, 32, 160, 120, 1, 32, 80, 60]", "opencl -keys=opencl,gpu -max_num_threads=256 -thread_warp_size=1", [2, 16, 64, 4096, 409600, 512, 2, 2], "llvm -keys=cpu -link-params=0 -mtriple=aarch64-linux-gnu", 0, []], [[], [["CI", 1], ["FU", 2, [0, 1, 2, 3]], ["SP", 2, 0, 153600, [50], 1], ["AN", 2, 0, 5], ["AN", 2, 1, 6], ["PR", 2, 0, "auto_unroll_max_step$1024"]]]], "r": [[0.00675798, 0.00676667, 0.00673616], 0, 7.9052, 1630556468], "v": "v0.6"}
{"i": [["[\"f09f3f33f76116d85452966717e745d5\", 1, 32, 160, 120, 1, 32, 80, 60]", "opencl -keys=opencl,gpu -max_num_threads=256 -thread_warp_size=1", [2, 16, 64, 4096, 409600, 512, 2, 2], "llvm -keys=cpu -link-params=0 -mtriple=aarch64-linux-gnu", 0, []], [[], [["CI", 1], ["FU", 2, [0, 1, 2, 3]], ["SP", 2, 0, 153600, [15], 1], ["AN", 2, 0, 5], ["AN", 2, 1, 6], ["PR", 2, 0, "auto_unroll_max_step$0"]]]], "r": [[0.00675273, 0.00674067, 0.00680491], 0, 7.88271, 1630556476], "v": "v0.6"}
{"i": [["[\"f09f3f33f76116d85452966717e745d5\", 1, 32, 160, 120, 1, 32, 80, 60]", "opencl -keys=opencl,gpu -max_num_threads=256 -thread_warp_size=1", [2, 16, 64, 4096, 409600, 512, 2, 2], "llvm -keys=cpu -link-params=0 -mtriple=aarch64-linux-gnu", 0, []], [[], [["CI", 1], ["FU", 2, [0, 1, 2, 3]], ["SP", 2, 0, 153600, [3], 1], ["AN", 2, 0, 5], ["AN", 2, 1, 6], ["PR", 2, 0, "auto_unroll_max_step$512"]]]], "r": [[0.00528395, 0.00102326, 0.00112732], 0, 8.18508, 1630556484], "v": "v0.6"}
{"i": [["[\"f09f3f33f76116d85452966717e745d5\", 1, 32, 160, 120, 1, 32, 80, 60]", "opencl -keys=opencl,gpu -max_num_threads=256 -thread_warp_size=1", [2, 16, 64, 4096, 409600, 512, 2, 2], "llvm -keys=cpu -link-params=0 -mtriple=aarch64-linux-gnu", 0, []], [[], [["CI", 1], ["FU", 2, [0, 1, 2, 3]], ["SP", 2, 0, 153600, [16], 1], ["AN", 2, 0, 5], ["AN", 2, 1, 6], ["PR", 2, 0, "auto_unroll_max_step$1024"]]]], "r": [[0.00683402, 0.00685678, 0.00683151], 0, 7.99395, 1630556492], "v": "v0.6"}
{"i": [["[\"f09f3f33f76116d85452966717e745d5\", 1, 32, 160, 120, 1, 32, 80, 60]", "opencl -keys=opencl,gpu -max_num_threads=256 -thread_warp_size=1", [2, 16, 64, 4096, 409600, 512, 2, 2], "llvm -keys=cpu -link-params=0 -mtriple=aarch64-linux-gnu", 0, []], [[], [["CI", 1], ["FU", 2, [0, 1, 2, 3]], ["SP", 2, 0, 153600, [60], 1], ["AN", 2, 0, 5], ["AN", 2, 1, 6], ["PR", 2, 0, "auto_unroll_max_step$0"]]]], "r": [[0.00690651, 0.000996337, 0.00101821], 0, 7.9339, 1630556500], "v": "v0.6"}
{"i": [["[\"f09f3f33f76116d85452966717e745d5\", 1, 32, 160, 120, 1, 32, 80, 60]", "opencl -keys=opencl,gpu -max_num_threads=256 -thread_warp_size=1", [2, 16, 64, 4096, 409600, 512, 2, 2], "llvm -keys=cpu -link-params=0 -mtriple=aarch64-linux-gnu", 0, []], [[], [["CI", 1], ["FU", 2, [0, 1, 2, 3]], ["SP", 2, 0, 153600, [5], 1], ["AN", 2, 0, 5], ["AN", 2, 1, 6], ["PR", 2, 0, "auto_unroll_max_step$512"]]]], "r": [[0.000938494, 0.000943025, 0.000956806], 0, 7.96444, 1630556508], "v": "v0.6"}
{"i": [["[\"f09f3f33f76116d85452966717e745d5\", 1, 32, 160, 120, 1, 32, 80, 60]", "opencl -keys=opencl,gpu -max_num_threads=256 -thread_warp_size=1", [2, 16, 64, 4096, 409600, 512, 2, 2], "llvm -keys=cpu -link-params=0 -mtriple=aarch64-linux-gnu", 0, []], [[], [["CI", 1], ["FU", 2, [0, 1, 2, 3]], ["SP", 2, 0, 153600, [48], 1], ["AN", 2, 0, 5], ["AN", 2, 1, 6], ["PR", 2, 0, "auto_unroll_max_step$1024"]]]], "r": [[0.000946667, 0.00100299, 0.00107685], 0, 8.14342, 1630556516], "v": "v0.6"}
{"i": [["[\"f09f3f33f76116d85452966717e745d5\", 1, 32, 160, 120, 1, 32, 80, 60]", "opencl -keys=opencl,gpu -max_num_threads=256 -thread_warp_size=1", [2, 16, 64, 4096, 409600, 512, 2, 2], "llvm -keys=cpu -link-params=0 -mtriple=aarch64-linux-gnu", 0, []], [[], [["CI", 1], ["FU", 2, [0, 1, 2, 3]], ["SP", 2, 0, 153600, [25], 1], ["AN", 2, 0, 5], ["AN", 2, 1, 6], ["PR", 2, 0, "auto_unroll_max_step$16"]]]], "r": [[0.00676624, 0.000939395, 0.000969829], 0, 8.05692, 1630556524], "v": "v0.6"}
{"i": [["[\"f09f3f33f76116d85452966717e745d5\", 1, 32, 160, 120, 1, 32, 80, 60]", "opencl -keys=opencl,gpu -max_num_threads=256 -thread_warp_size=1", [2, 16, 64, 4096, 409600, 512, 2, 2], "llvm -keys=cpu -link-params=0 -mtriple=aarch64-linux-gnu", 0, []], [[], [["CI", 1], ["FU", 2, [0, 1, 2, 3]], ["SP", 2, 0, 153600, [20], 1], ["AN", 2, 0, 5], ["AN", 2, 1, 6], ["PR", 2, 0, "auto_unroll_max_step$64"]]]], "r": [[0.00668351, 0.000943575, 0.000970255], 0, 7.99231, 1630556532], "v": "v0.6"}
{"i": [["[\"f09f3f33f76116d85452966717e745d5\", 1, 32, 160, 120, 1, 32, 80, 60]", "opencl -keys=opencl,gpu -max_num_threads=256 -thread_warp_size=1", [2, 16, 64, 4096, 409600, 512, 2, 2], "llvm -keys=cpu -link-params=0 -mtriple=aarch64-linux-gnu", 0, []], [[], [["CI", 1], ["FU", 2, [0, 1, 2, 3]], ["SP", 2, 0, 153600, [15], 1], ["AN", 2, 0, 5], ["AN", 2, 1, 6], ["PR", 2, 0, "auto_unroll_max_step$1024"]]]], "r": [[0.00676573, 0.000929988, 0.000943049], 0, 7.88523, 1630556540], "v": "v0.6"}
{"i": [["[\"f09f3f33f76116d85452966717e745d5\", 1, 32, 160, 120, 1, 32, 80, 60]", "opencl -keys=opencl,gpu -max_num_threads=256 -thread_warp_size=1", [2, 16, 64, 4096, 409600, 512, 2, 2], "llvm -keys=cpu -link-params=0 -mtriple=aarch64-linux-gnu", 0, []], [[], [["FU", 2, [4, 5]], ["SP", 2, 4, 4, [1], 1], ["AN", 2, 5, 6], ["CI", 1], ["FU", 2, [0, 1, 2, 3]], ["AN", 2, 0, 5], ["PR", 2, 0, "auto_unroll_max_step$1024"]]]], "r": [[0.0204741, 0.0205015, 0.0208265], 0, 8.01946, 1630556548], "v": "v0.6"}
{"i": [["[\"f09f3f33f76116d85452966717e745d5\", 1, 32, 160, 120, 1, 32, 80, 60]", "opencl -keys=opencl,gpu -max_num_threads=256 -thread_warp_size=1", [2, 16, 64, 4096, 409600, 512, 2, 2], "llvm -keys=cpu -link-params=0 -mtriple=aarch64-linux-gnu", 0, []], [[], [["CI", 1], ["FU", 2, [0, 1, 2, 3]], ["SP", 2, 0, 153600, [12], 1], ["AN", 2, 0, 5], ["AN", 2, 1, 6], ["PR", 2, 0, "auto_unroll_max_step$512"]]]], "r": [[0.00680436, 0.00715947, 0.000992959], 0, 7.9574, 1630556556], "v": "v0.6"}
{"i": [["[\"f09f3f33f76116d85452966717e745d5\", 1, 32, 160, 120, 1, 32, 80, 60]", "opencl -keys=opencl,gpu -max_num_threads=256 -thread_warp_size=1", [2, 16, 64, 4096, 409600, 512, 2, 2], "llvm -keys=cpu -link-params=0 -mtriple=aarch64-linux-gnu", 0, []], [[], [["CI", 1], ["FU", 2, [0, 1, 2, 3]], ["SP", 2, 0, 153600, [4], 1], ["AN", 2, 0, 5], ["AN", 2, 1, 6], ["PR", 2, 0, "auto_unroll_max_step$16"]]]], "r": [[0.006674, 0.000904596, 0.000925549], 0, 8.11487, 1630556564], "v": "v0.6"}
{"i": [["[\"f09f3f33f76116d85452966717e745d5\", 1, 32, 160, 120, 1, 32, 80, 60]", "opencl -keys=opencl,gpu -max_num_threads=256 -thread_warp_size=1", [2, 16, 64, 4096, 409600, 512, 2, 2], "llvm -keys=cpu -link-params=0 -mtriple=aarch64-linux-gnu", 0, []], [[], [["CI", 1], ["FU", 2, [0, 1, 2, 3]], ["SP", 2, 0, 153600, [12], 1], ["AN", 2, 0, 5], ["AN", 2, 1, 6], ["PR", 2, 0, "auto_unroll_max_step$0"]]]], "r": [[0.0067866, 0.00680704, 0.00695467], 0, 7.60676, 1630556571], "v": "v0.6"}
{"i": [["[\"f09f3f33f76116d85452966717e745d5\", 1, 32, 160, 120, 1, 32, 80, 60]", "opencl -keys=opencl,gpu -max_num_threads=256 -thread_warp_size=1", [2, 16, 64, 4096, 409600, 512, 2, 2], "llvm -keys=cpu -link-params=0 -mtriple=aarch64-linux-gnu", 0, []], [[], [["FU", 2, [4, 5]], ["SP", 2, 4, 4, [1], 1], ["AN", 2, 5, 6], ["CI", 1], ["FU", 2, [0, 1, 2, 3]], ["AN", 2, 0, 5], ["PR", 2, 0, "auto_unroll_max_step$16"]]]], "r": [[0.0203784, 0.00293504, 0.00292886], 0, 8.11607, 1630556579], "v": "v0.6"}
{"i": [["[\"f09f3f33f76116d85452966717e745d5\", 1, 32, 160, 120, 1, 32, 80, 60]", "opencl -keys=opencl,gpu -max_num_threads=256 -thread_warp_size=1", [2, 16, 64, 4096, 409600, 512, 2, 2], "llvm -keys=cpu -link-params=0 -mtriple=aarch64-linux-gnu", 0, []], [[], [["CI", 1], ["FU", 2, [0, 1, 2, 3]], ["SP", 2, 0, 153600, [30], 1], ["AN", 2, 0, 5], ["AN", 2, 1, 6], ["PR", 2, 0, "auto_unroll_max_step$512"]]]], "r": [[0.00677569, 0.00677929, 0.00683004], 0, 7.96609, 1630556587], "v": "v0.6"}
{"i": [["[\"f09f3f33f76116d85452966717e745d5\", 1, 32, 160, 120, 1, 32, 80, 60]", "opencl -keys=opencl,gpu -max_num_threads=256 -thread_warp_size=1", [2, 16, 64, 4096, 409600, 512, 2, 2], "llvm -keys=cpu -link-params=0 -mtriple=aarch64-linux-gnu", 0, []], [[], [["CI", 1], ["FU", 2, [0, 1, 2, 3]], ["SP", 2, 0, 153600, [1], 1], ["AN", 2, 0, 5], ["AN", 2, 1, 6], ["PR", 2, 0, "auto_unroll_max_step$1024"]]]], "r": [[0.0029123, 0.0029986, 0.00305652], 0, 8.25432, 1630556596], "v": "v0.6"}
{"i": [["[\"f09f3f33f76116d85452966717e745d5\", 1, 32, 160, 120, 1, 32, 80, 60]", "opencl -keys=opencl,gpu -max_num_threads=256 -thread_warp_size=1", [2, 16, 64, 4096, 409600, 512, 2, 2], "llvm -keys=cpu -link-params=0 -mtriple=aarch64-linux-gnu", 0, []], [[], [["CI", 1], ["FU", 2, [0, 1, 2, 3]], ["SP", 2, 0, 153600, [50], 1], ["AN", 2, 0, 5], ["AN", 2, 1, 6], ["PR", 2, 0, "auto_unroll_max_step$0"]]]], "r": [[0.000953868, 0.001002, 0.0010737], 0, 8.34742, 1630556604], "v": "v0.6"}
{"i": [["[\"f09f3f33f76116d85452966717e745d5\", 1, 32, 160, 120, 1, 32, 80, 60]", "opencl -keys=opencl,gpu -max_num_threads=256 -thread_warp_size=1", [2, 16, 64, 4096, 409600, 512, 2, 2], "llvm -keys=cpu -link-params=0 -mtriple=aarch64-linux-gnu", 0, []], [[], [["CI", 1], ["FU", 2, [0, 1, 2, 3]], ["SP", 2, 0, 153600, [3], 1], ["AN", 2, 0, 5], ["AN", 2, 1, 6], ["PR", 2, 0, "auto_unroll_max_step$0"]]]], "r": [[0.00713547, 0.0072588, 0.0074497], 0, 8.23649, 1630556612], "v": "v0.6"}
{"i": [["[\"f09f3f33f76116d85452966717e745d5\", 1, 32, 160, 120, 1, 32, 80, 60]", "opencl -keys=opencl,gpu -max_num_threads=256 -thread_warp_size=1", [2, 16, 64, 4096, 409600, 512, 2, 2], "llvm -keys=cpu -link-params=0 -mtriple=aarch64-linux-gnu", 0, []], [[], [["CI", 1], ["FU", 2, [0, 1, 2, 3]], ["SP", 2, 0, 153600, [5], 1], ["AN", 2, 0, 5], ["AN", 2, 1, 6], ["PR", 2, 0, "auto_unroll_max_step$64"]]]], "r": [[0.0009826, 0.00105242, 0.000927067], 0, 7.62303, 1630556620], "v": "v0.6"}
{"i": [["[\"f09f3f33f76116d85452966717e745d5\", 1, 32, 160, 120, 1, 32, 80, 60]", "opencl -keys=opencl,gpu -max_num_threads=256 -thread_warp_size=1", [2, 16, 64, 4096, 409600, 512, 2, 2], "llvm -keys=cpu -link-params=0 -mtriple=aarch64-linux-gnu", 0, []], [[], [["CI", 1], ["FU", 2, [0, 1, 2, 3]], ["SP", 2, 0, 153600, [16], 1], ["AN", 2, 0, 5], ["AN", 2, 1, 6], ["PR", 2, 0, "auto_unroll_max_step$512"]]]], "r": [[0.00686877, 0.00680527, 0.00740759], 0, 8.23456, 1630556629], "v": "v0.6"}
{"i": [["[\"f09f3f33f76116d85452966717e745d5\", 1, 32, 160, 120, 1, 32, 80, 60]", "opencl -keys=opencl,gpu -max_num_threads=256 -thread_warp_size=1", [2, 16, 64, 4096, 409600, 512, 2, 2], "llvm -keys=cpu -link-params=0 -mtriple=aarch64-linux-gnu", 0, []], [[], [["FU", 2, [4, 5]], ["SP", 2, 4, 4, [2], 1], ["AN", 2, 5, 6], ["CI", 1], ["FU", 2, [0, 1, 2, 3]], ["AN", 2, 0, 5], ["PR", 2, 0, "auto_unroll_max_step$64"]]]], "r": [[0.00291801, 0.00293033, 0.00299357], 0, 7.97512, 1630556637], "v": "v0.6"}
{"i": [["[\"f09f3f33f76116d85452966717e745d5\", 1, 32, 160, 120, 1, 32, 80, 60]", "opencl -keys=opencl,gpu -max_num_threads=256 -thread_warp_size=1", [2, 16, 64, 4096, 409600, 512, 2, 2], "llvm -keys=cpu -link-params=0 -mtriple=aarch64-linux-gnu", 0, []], [[], [["CI", 1], ["FU", 2, [0, 1, 2, 3]], ["SP", 2, 0, 153600, [60], 1], ["AN", 2, 0, 5], ["AN", 2, 1, 6], ["PR", 2, 0, "auto_unroll_max_step$1024"]]]], "r": [[0.000980864, 0.000974932, 0.00102706], 0, 7.87836, 1630556644], "v": "v0.6"}
{"i": [["[\"f09f3f33f76116d85452966717e745d5\", 1, 32, 160, 120, 1, 32, 80, 60]", "opencl -keys=opencl,gpu -max_num_threads=256 -thread_warp_size=1", [2, 16, 64, 4096, 409600, 512, 2, 2], "llvm -keys=cpu -link-params=0 -mtriple=aarch64-linux-gnu", 0, []], [[], [["CI", 1], ["FU", 2, [0, 1, 2, 3]], ["SP", 2, 0, 153600, [4], 1], ["AN", 2, 0, 5], ["AN", 2, 1, 6], ["PR", 2, 0, "auto_unroll_max_step$1024"]]]], "r": [[0.00662111, 0.00681533, 0.00694743], 0, 8.13156, 1630556653], "v": "v0.6"}
{"i": [["[\"f09f3f33f76116d85452966717e745d5\", 1, 32, 160, 120, 1, 32, 80, 60]", "opencl -keys=opencl,gpu -max_num_threads=256 -thread_warp_size=1", [2, 16, 64, 4096, 409600, 512, 2, 2], "llvm -keys=cpu -link-params=0 -mtriple=aarch64-linux-gnu", 0, []], [[], [["CI", 1], ["FU", 2, [0, 1, 2, 3]], ["SP", 2, 0, 153600, [25], 1], ["AN", 2, 0, 5], ["AN", 2, 1, 6], ["PR", 2, 0, "auto_unroll_max_step$1024"]]]], "r": [[0.0067504, 0.000985211, 0.00106447], 0, 8.18518, 1630556661], "v": "v0.6"}
{"i": [["[\"f09f3f33f76116d85452966717e745d5\", 1, 32, 160, 120, 1, 32, 80, 60]", "opencl -keys=opencl,gpu -max_num_threads=256 -thread_warp_size=1", [2, 16, 64, 4096, 409600, 512, 2, 2], "llvm -keys=cpu -link-params=0 -mtriple=aarch64-linux-gnu", 0, []], [[], [["CI", 1], ["FU", 2, [0, 1, 2, 3]], ["SP", 2, 0, 153600, [20], 1], ["AN", 2, 0, 5], ["AN", 2, 1, 6], ["PR", 2, 0, "auto_unroll_max_step$16"]]]], "r": [[0.00681916, 0.00685433, 0.00687793], 0, 7.75234, 1630556668], "v": "v0.6"}
{"i": [["[\"f09f3f33f76116d85452966717e745d5\", 1, 32, 160, 120, 1, 32, 80, 60]", "opencl -keys=opencl,gpu -max_num_threads=256 -thread_warp_size=1", [2, 16, 64, 4096, 409600, 512, 2, 2], "llvm -keys=cpu -link-params=0 -mtriple=aarch64-linux-gnu", 0, []], [[], [["CI", 1], ["FU", 2, [0, 1, 2, 3]], ["SP", 2, 0, 153600, [10], 1], ["AN", 2, 0, 5], ["AN", 2, 1, 6], ["PR", 2, 0, "auto_unroll_max_step$1024"]]]], "r": [[0.00683902, 0.000941659, 0.000962595], 0, 7.95921, 1630556676], "v": "v0.6"}
{"i": [["[\"f09f3f33f76116d85452966717e745d5\", 1, 32, 160, 120, 1, 32, 80, 60]", "opencl -keys=opencl,gpu -max_num_threads=256 -thread_warp_size=1", [2, 16, 64, 4096, 409600, 512, 2, 2], "llvm -keys=cpu -link-params=0 -mtriple=aarch64-linux-gnu", 0, []], [[], [["CI", 1], ["FU", 2, [0, 1, 2, 3]], ["SP", 2, 0, 153600, [30], 1], ["AN", 2, 0, 5], ["AN", 2, 1, 6], ["PR", 2, 0, "auto_unroll_max_step$1024"]]]], "r": [[0.000945408, 0.00101197, 0.00108238], 0, 8.39047, 1630556685], "v": "v0.6"}
{"i": [["[\"f09f3f33f76116d85452966717e745d5\", 1, 32, 160, 120, 1, 32, 80, 60]", "opencl -keys=opencl,gpu -max_num_threads=256 -thread_warp_size=1", [2, 16, 64, 4096, 409600, 512, 2, 2], "llvm -keys=cpu -link-params=0 -mtriple=aarch64-linux-gnu", 0, []], [[], [["CI", 1], ["FU", 2, [0, 1, 2, 3]], ["SP", 2, 0, 153600, [16], 1], ["AN", 2, 0, 5], ["AN", 2, 1, 6], ["PR", 2, 0, "auto_unroll_max_step$64"]]]], "r": [[0.00680669, 0.00686029, 0.000984073], 0, 8.05107, 1630556693], "v": "v0.6"}
{"i": [["[\"f09f3f33f76116d85452966717e745d5\", 1, 32, 160, 120, 1, 32, 80, 60]", "opencl -keys=opencl,gpu -max_num_threads=256 -thread_warp_size=1", [2, 16, 64, 4096, 409600, 512, 2, 2], "llvm -keys=cpu -link-params=0 -mtriple=aarch64-linux-gnu", 0, []], [[], [["FU", 2, [4, 5]], ["SP", 2, 4, 4, [4], 1], ["AN", 2, 5, 6], ["CI", 1], ["FU", 2, [0, 1, 2, 3]], ["AN", 2, 0, 5], ["PR", 2, 0, "auto_unroll_max_step$64"]]]], "r": [[0.0214911, 0.00295513, 0.00303692], 0, 8.14923, 1630556701], "v": "v0.6"}
{"i": [["[\"f09f3f33f76116d85452966717e745d5\", 1, 32, 160, 120, 1, 32, 80, 60]", "opencl -keys=opencl,gpu -max_num_threads=256 -thread_warp_size=1", [2, 16, 64, 4096, 409600, 512, 2, 2], "llvm -keys=cpu -link-params=0 -mtriple=aarch64-linux-gnu", 0, []], [[], [["CI", 1], ["FU", 2, [0, 1, 2, 3]], ["SP", 2, 0, 153600, [64], 1], ["AN", 2, 0, 5], ["AN", 2, 1, 6], ["PR", 2, 0, "auto_unroll_max_step$0"]]]], "r": [[0.00715364, 0.000948, 0.000993692], 0, 8.05543, 1630556709], "v": "v0.6"}
{"i": [["[\"f09f3f33f76116d85452966717e745d5\", 1, 32, 160, 120, 1, 32, 80, 60]", "opencl -keys=opencl,gpu -max_num_threads=256 -thread_warp_size=1", [2, 16, 64, 4096, 409600, 512, 2, 2], "llvm -keys=cpu -link-params=0 -mtriple=aarch64-linux-gnu", 0, []], [[], [["CI", 1], ["FU", 2, [0, 1, 2, 3]], ["SP", 2, 0, 153600, [12], 1], ["AN", 2, 0, 5], ["AN", 2, 1, 6], ["PR", 2, 0, "auto_unroll_max_step$64"]]]], "r": [[0.0067932, 0.000961296, 0.00106597], 0, 8.18907, 1630556717], "v": "v0.6"}
{"i": [["[\"f09f3f33f76116d85452966717e745d5\", 1, 32, 160, 120, 1, 32, 80, 60]", "opencl -keys=opencl,gpu -max_num_threads=256 -thread_warp_size=1", [2, 16, 64, 4096, 409600, 512, 2, 2], "llvm -keys=cpu -link-params=0 -mtriple=aarch64-linux-gnu", 0, []], [[], [["CI", 1], ["FU", 2, [0, 1, 2, 3]], ["SP", 2, 0, 153600, [50], 1], ["AN", 2, 0, 5], ["AN", 2, 1, 6], ["PR", 2, 0, "auto_unroll_max_step$16"]]]], "r": [[0.0067334, 0.00675891, 0.00680742], 0, 7.91659, 1630556725], "v": "v0.6"}
{"i": [["[\"f09f3f33f76116d85452966717e745d5\", 1, 32, 160, 120, 1, 32, 80, 60]", "opencl -keys=opencl,gpu -max_num_threads=256 -thread_warp_size=1", [2, 16, 64, 4096, 409600, 512, 2, 2], "llvm -keys=cpu -link-params=0 -mtriple=aarch64-linux-gnu", 0, []], [[], [["CI", 1], ["FU", 2, [0, 1, 2, 3]], ["SP", 2, 0, 153600, [40], 1], ["AN", 2, 0, 5], ["AN", 2, 1, 6], ["PR", 2, 0, "auto_unroll_max_step$0"]]]], "r": [[0.00666711, 0.00670407, 0.00669187], 0, 7.85814, 1630556733], "v": "v0.6"}
{"i": [["[\"f09f3f33f76116d85452966717e745d5\", 1, 32, 160, 120, 1, 32, 80, 60]", "opencl -keys=opencl,gpu -max_num_threads=256 -thread_warp_size=1", [2, 16, 64, 4096, 409600, 512, 2, 2], "llvm -keys=cpu -link-params=0 -mtriple=aarch64-linux-gnu", 0, []], [[], [["CI", 1], ["FU", 2, [0, 1, 2, 3]], ["SP", 2, 0, 153600, [30], 1], ["AN", 2, 0, 5], ["AN", 2, 1, 6], ["PR", 2, 0, "auto_unroll_max_step$64"]]]], "r": [[0.00669262, 0.00678847, 0.00676793], 0, 7.72712, 1630556740], "v": "v0.6"}
{"i": [["[\"f09f3f33f76116d85452966717e745d5\", 1, 32, 160, 120, 1, 32, 80, 60]", "opencl -keys=opencl,gpu -max_num_threads=256 -thread_warp_size=1", [2, 16, 64, 4096, 409600, 512, 2, 2], "llvm -keys=cpu -link-params=0 -mtriple=aarch64-linux-gnu", 0, []], [[], [["FU", 2, [4, 5]], ["SP", 2, 4, 4, [2], 1], ["AN", 2, 5, 6], ["CI", 1], ["FU", 2, [0, 1, 2, 3]], ["AN", 2, 0, 5], ["PR", 2, 0, "auto_unroll_max_step$0"]]]], "r": [[0.00315997, 0.00309878, 0.00417182], 0, 8.31283, 1630556749], "v": "v0.6"}
{"i": [["[\"f09f3f33f76116d85452966717e745d5\", 1, 32, 160, 120, 1, 32, 80, 60]", "opencl -keys=opencl,gpu -max_num_threads=256 -thread_warp_size=1", [2, 16, 64, 4096, 409600, 512, 2, 2], "llvm -keys=cpu -link-params=0 -mtriple=aarch64-linux-gnu", 0, []], [[], [["CI", 1], ["FU", 2, [0, 1, 2, 3]], ["SP", 2, 0, 153600, [24], 1], ["AN", 2, 0, 5], ["AN", 2, 1, 6], ["PR", 2, 0, "auto_unroll_max_step$0"]]]], "r": [[0.00678751, 0.000921993, 0.000966894], 0, 7.9969, 1630556757], "v": "v0.6"}
{"i": [["[\"f09f3f33f76116d85452966717e745d5\", 1, 32, 160, 120, 1, 32, 80, 60]", "opencl -keys=opencl,gpu -max_num_threads=256 -thread_warp_size=1", [2, 16, 64, 4096, 409600, 512, 2, 2], "llvm -keys=cpu -link-params=0 -mtriple=aarch64-linux-gnu", 0, []], [[], [["CI", 1], ["FU", 2, [0, 1, 2, 3]], ["SP", 2, 0, 153600, [16], 1], ["AN", 2, 0, 5], ["AN", 2, 1, 6], ["PR", 2, 0, "auto_unroll_max_step$0"]]]], "r": [[0.00684771, 0.00683398, 0.00686949], 0, 7.97993, 1630556765], "v": "v0.6"}
{"i": [["[\"f09f3f33f76116d85452966717e745d5\", 1, 32, 160, 120, 1, 32, 80, 60]", "opencl -keys=opencl,gpu -max_num_threads=256 -thread_warp_size=1", [2, 16, 64, 4096, 409600, 512, 2, 2], "llvm -keys=cpu -link-params=0 -mtriple=aarch64-linux-gnu", 0, []], [[], [["CI", 1], ["FU", 2, [0, 1, 2, 3]], ["SP", 2, 0, 153600, [12], 1], ["AN", 2, 0, 5], ["AN", 2, 1, 6], ["PR", 2, 0, "auto_unroll_max_step$16"]]]], "r": [[0.00681462, 0.00682804, 0.00697696], 0, 7.80092, 1630556772], "v": "v0.6"}
{"i": [["[\"f09f3f33f76116d85452966717e745d5\", 1, 32, 160, 120, 1, 32, 80, 60]", "opencl -keys=opencl,gpu -max_num_threads=256 -thread_warp_size=1", [2, 16, 64, 4096, 409600, 512, 2, 2], "llvm -keys=cpu -link-params=0 -mtriple=aarch64-linux-gnu", 0, []], [[], [["FU", 2, [4, 5]], ["SP", 2, 4, 4, [4], 1], ["AN", 2, 5, 6], ["CI", 1], ["FU", 2, [0, 1, 2, 3]], ["AN", 2, 0, 5], ["PR", 2, 0, "auto_unroll_max_step$512"]]]], "r": [[0.00296604, 0.00301314, 0.00307702], 0, 8.10363, 1630556781], "v": "v0.6"}
{"i": [["[\"f09f3f33f76116d85452966717e745d5\", 1, 32, 160, 120, 1, 32, 80, 60]", "opencl -keys=opencl,gpu -max_num_threads=256 -thread_warp_size=1", [2, 16, 64, 4096, 409600, 512, 2, 2], "llvm -keys=cpu -link-params=0 -mtriple=aarch64-linux-gnu", 0, []], [[], [["FU", 2, [4, 5]], ["SP", 2, 4, 4, [2], 1], ["AN", 2, 5, 6], ["CI", 1], ["FU", 2, [0, 1, 2, 3]], ["AN", 2, 0, 5], ["PR", 2, 0, "auto_unroll_max_step$1024"]]]], "r": [[0.00308698, 0.00313676, 0.00303818], 0, 8.36288, 1630556789], "v": "v0.6"}
{"i": [["[\"f09f3f33f76116d85452966717e745d5\", 1, 32, 160, 120, 1, 32, 80, 60]", "opencl -keys=opencl,gpu -max_num_threads=256 -thread_warp_size=1", [2, 16, 64, 4096, 409600, 512, 2, 2], "llvm -keys=cpu -link-params=0 -mtriple=aarch64-linux-gnu", 0, []], [[], [["FU", 2, [4, 5]], ["SP", 2, 4, 4, [1], 1], ["AN", 2, 5, 6], ["CI", 1], ["FU", 2, [0, 1, 2, 3]], ["AN", 2, 0, 5], ["PR", 2, 0, "auto_unroll_max_step$64"]]]], "r": [[0.00284661, 0.00295998, 0.00306436], 0, 8.01615, 1630556797], "v": "v0.6"}
{"i": [["[\"f09f3f33f76116d85452966717e745d5\", 1, 32, 160, 120, 1, 32, 80, 60]", "opencl -keys=opencl,gpu -max_num_threads=256 -thread_warp_size=1", [2, 16, 64, 4096, 409600, 512, 2, 2], "llvm -keys=cpu -link-params=0 -mtriple=aarch64-linux-gnu", 0, []], [[], [["CI", 1], ["FU", 2, [0, 1, 2, 3]], ["SP", 2, 0, 153600, [25], 1], ["AN", 2, 0, 5], ["AN", 2, 1, 6], ["PR", 2, 0, "auto_unroll_max_step$0"]]]], "r": [[0.00679127, 0.00675133, 0.00111885], 0, 8.23001, 1630556805], "v": "v0.6"}
{"i": [["[\"f09f3f33f76116d85452966717e745d5\", 1, 32, 160, 120, 1, 32, 80, 60]", "opencl -keys=opencl,gpu -max_num_threads=256 -thread_warp_size=1", [2, 16, 64, 4096, 409600, 512, 2, 2], "llvm -keys=cpu -link-params=0 -mtriple=aarch64-linux-gnu", 0, []], [[], [["CI", 1], ["FU", 2, [0, 1, 2, 3]], ["SP", 2, 0, 153600, [30], 1], ["AN", 2, 0, 5], ["AN", 2, 1, 6], ["PR", 2, 0, "auto_unroll_max_step$16"]]]], "r": [[0.00676798, 0.000965857, 0.00100308], 0, 8.23053, 1630556813], "v": "v0.6"}
{"i": [["[\"f09f3f33f76116d85452966717e745d5\", 1, 32, 160, 120, 1, 32, 80, 60]", "opencl -keys=opencl,gpu -max_num_threads=256 -thread_warp_size=1", [2, 16, 64, 4096, 409600, 512, 2, 2], "llvm -keys=cpu -link-params=0 -mtriple=aarch64-linux-gnu", 0, []], [[], [["CI", 1], ["FU", 2, [0, 1, 2, 3]], ["SP", 2, 0, 153600, [64], 1], ["AN", 2, 0, 5], ["AN", 2, 1, 6], ["PR", 2, 0, "auto_unroll_max_step$64"]]]], "r": [[0.00682629, 0.00685524, 0.00686309], 0, 8.07854, 1630556821], "v": "v0.6"}
{"i": [["[\"f09f3f33f76116d85452966717e745d5\", 1, 32, 160, 120, 1, 32, 80, 60]", "opencl -keys=opencl,gpu -max_num_threads=256 -thread_warp_size=1", [2, 16, 64, 4096, 409600, 512, 2, 2], "llvm -keys=cpu -link-params=0 -mtriple=aarch64-linux-gnu", 0, []], [[], [["CI", 1], ["FU", 2, [0, 1, 2, 3]], ["SP", 2, 0, 153600, [48], 1], ["AN", 2, 0, 5], ["AN", 2, 1, 6], ["PR", 2, 0, "auto_unroll_max_step$0"]]]], "r": [[0.00690864, 0.00689669, 0.000996578], 0, 8.24261, 1630556830], "v": "v0.6"}
{"i": [["[\"f09f3f33f76116d85452966717e745d5\", 1, 32, 160, 120, 1, 32, 80, 60]", "opencl -keys=opencl,gpu -max_num_threads=256 -thread_warp_size=1", [2, 16, 64, 4096, 409600, 512, 2, 2], "llvm -keys=cpu -link-params=0 -mtriple=aarch64-linux-gnu", 0, []], [[], [["CI", 1], ["FU", 2, [0, 1, 2, 3]], ["SP", 2, 0, 153600, [64], 1], ["AN", 2, 0, 5], ["AN", 2, 1, 6], ["PR", 2, 0, "auto_unroll_max_step$1024"]]]], "r": [[0.00711129, 0.000950416, 0.0010131], 0, 9.6337, 1630556839], "v": "v0.6"}
{"i": [["[\"f09f3f33f76116d85452966717e745d5\", 1, 32, 160, 120, 1, 32, 80, 60]", "opencl -keys=opencl,gpu -max_num_threads=256 -thread_warp_size=1", [2, 16, 64, 4096, 409600, 512, 2, 2], "llvm -keys=cpu -link-params=0 -mtriple=aarch64-linux-gnu", 0, []], [[], [["CI", 1], ["FU", 2, [0, 1, 2, 3]], ["SP", 2, 0, 153600, [60], 1], ["AN", 2, 0, 5], ["AN", 2, 1, 6], ["PR", 2, 0, "auto_unroll_max_step$16"]]]], "r": [[0.000951014, 0.000996395, 0.00107362], 0, 8.25157, 1630556847], "v": "v0.6"}
{"i": [["[\"f09f3f33f76116d85452966717e745d5\", 1, 32, 160, 120, 1, 32, 80, 60]", "opencl -keys=opencl,gpu -max_num_threads=256 -thread_warp_size=1", [2, 16, 64, 4096, 409600, 512, 2, 2], "llvm -keys=cpu -link-params=0 -mtriple=aarch64-linux-gnu", 0, []], [[], [["CI", 1], ["FU", 2, [0, 1, 2, 3]], ["SP", 2, 0, 153600, [2], 1], ["AN", 2, 0, 5], ["AN", 2, 1, 6], ["PR", 2, 0, "auto_unroll_max_step$16"]]]], "r": [[0.0108864, 0.00152314, 0.00160958], 0, 16.3365, 1630556864], "v": "v0.6"}
{"i": [["[\"f09f3f33f76116d85452966717e745d5\", 1, 32, 160, 120, 1, 32, 80, 60]", "opencl -keys=opencl,gpu -max_num_threads=256 -thread_warp_size=1", [2, 16, 64, 4096, 409600, 512, 2, 2], "llvm -keys=cpu -link-params=0 -mtriple=aarch64-linux-gnu", 0, []], [[], [["FU", 2, [4, 5]], ["SP", 2, 4, 4, [2], 1], ["AN", 2, 5, 6], ["CI", 1], ["FU", 2, [0, 1, 2, 3]], ["AN", 2, 0, 5], ["PR", 2, 0, "auto_unroll_max_step$16"]]]], "r": [[0.0212839, 0.00293691, 0.00297219], 0, 16.1972, 1630556880], "v": "v0.6"}
{"i": [["[\"f09f3f33f76116d85452966717e745d5\", 1, 32, 160, 120, 1, 32, 80, 60]", "opencl -keys=opencl,gpu -max_num_threads=256 -thread_warp_size=1", [2, 16, 64, 4096, 409600, 512, 2, 2], "llvm -keys=cpu -link-params=0 -mtriple=aarch64-linux-gnu", 0, []], [[], [["CI", 1], ["FU", 2, [0, 1, 2, 3]], ["SP", 2, 0, 153600, [2], 1], ["AN", 2, 0, 5], ["AN", 2, 1, 6], ["PR", 2, 0, "auto_unroll_max_step$0"]]]], "r": [[0.0109095, 0.00154999, 0.00162536], 0, 15.7508, 1630556896], "v": "v0.6"}
{"i": [["[\"cf7c7a3bf9871fe4aa3fe21c1222fdb0\", 1, 2, 640, 480, 1, 2, 640, 480]", "opencl -keys=opencl,gpu -max_num_threads=256 -thread_warp_size=1", [2, 16, 64, 4096, 409600, 512, 2, 2], "llvm -keys=cpu -link-params=0 -mtriple=aarch64-linux-gnu", 0, []], [[], [["CI", 2], ["FU", 4, [0, 1, 2, 3]], ["SP", 4, 0, 614400, [2], 1], ["AN", 4, 0, 5], ["AN", 4, 1, 6], ["FU", 3, [0, 1, 2]], ["SP", 3, 0, 307200, [4], 1], ["AN", 3, 0, 5], ["AN", 3, 1, 6], ["FU", 1, [0, 1, 2]], ["SP", 1, 0, 307200, [2], 1], ["AN", 1, 0, 5], ["AN", 1, 1, 6], ["PR", 1, 0, "auto_unroll_max_step$0"], ["PR", 3, 0, "auto_unroll_max_step$64"]]]], "r": [[0.085122, 0.0122201, 0.0124201], 0, 16.8517, 1630556921], "v": "v0.6"}
{"i": [["[\"cf7c7a3bf9871fe4aa3fe21c1222fdb0\", 1, 2, 640, 480, 1, 2, 640, 480]", "opencl -keys=opencl,gpu -max_num_threads=256 -thread_warp_size=1", [2, 16, 64, 4096, 409600, 512, 2, 2], "llvm -keys=cpu -link-params=0 -mtriple=aarch64-linux-gnu", 0, []], [[], [["CI", 2], ["FU", 4, [0, 1, 2, 3]], ["SP", 4, 0, 614400, [2], 1], ["AN", 4, 0, 5], ["AN", 4, 1, 6], ["FU", 3, [0, 1, 2]], ["SP", 3, 0, 307200, [2], 1], ["AN", 3, 0, 5], ["AN", 3, 1, 6], ["FU", 1, [0, 1, 2]], ["SP", 1, 0, 307200, [30], 1], ["AN", 1, 0, 5], ["AN", 1, 1, 6], ["PR", 1, 0, "auto_unroll_max_step$0"], ["PR", 3, 0, "auto_unroll_max_step$64"]]]], "r": [[0.0774698, 0.0775817, 0.0785427], 0, 16.9188, 1630556938], "v": "v0.6"}
{"i": [["[\"cf7c7a3bf9871fe4aa3fe21c1222fdb0\", 1, 2, 640, 480, 1, 2, 640, 480]", "opencl -keys=opencl,gpu -max_num_threads=256 -thread_warp_size=1", [2, 16, 64, 4096, 409600, 512, 2, 2], "llvm -keys=cpu -link-params=0 -mtriple=aarch64-linux-gnu", 0, []], [[], [["CI", 2], ["FU", 4, [0, 1, 2, 3]], ["SP", 4, 0, 614400, [2], 1], ["AN", 4, 0, 5], ["AN", 4, 1, 6], ["FU", 3, [0, 1, 2]], ["SP", 3, 0, 307200, [2], 1], ["AN", 3, 0, 5], ["AN", 3, 1, 6], ["FU", 1, [0, 1, 2]], ["SP", 1, 0, 307200, [1], 1], ["AN", 1, 0, 5], ["AN", 1, 1, 6], ["PR", 1, 0, "auto_unroll_max_step$512"], ["PR", 3, 0, "auto_unroll_max_step$64"]]]], "r": [[0.0150072, 0.0158035, 0.0142818], 0, 16.1112, 1630556954], "v": "v0.6"}
{"i": [["[\"cf7c7a3bf9871fe4aa3fe21c1222fdb0\", 1, 2, 640, 480, 1, 2, 640, 480]", "opencl -keys=opencl,gpu -max_num_threads=256 -thread_warp_size=1", [2, 16, 64, 4096, 409600, 512, 2, 2], "llvm -keys=cpu -link-params=0 -mtriple=aarch64-linux-gnu", 0, []], [[], [["CI", 2], ["FU", 4, [0, 1, 2, 3]], ["SP", 4, 0, 614400, [2], 1], ["AN", 4, 0, 5], ["AN", 4, 1, 6], ["FU", 3, [0, 1, 2]], ["SP", 3, 0, 307200, [48], 1], ["AN", 3, 0, 5], ["AN", 3, 1, 6], ["FU", 1, [0, 1, 2]], ["SP", 1, 0, 307200, [20], 1], ["AN", 1, 0, 5], ["AN", 1, 1, 6], ["PR", 1, 0, "auto_unroll_max_step$16"], ["PR", 3, 0, "auto_unroll_max_step$1024"]]]], "r": [[0.076999, 0.0777141, 0.0775906], 0, 16.9523, 1630556971], "v": "v0.6"}
{"i": [["[\"cf7c7a3bf9871fe4aa3fe21c1222fdb0\", 1, 2, 640, 480, 1, 2, 640, 480]", "opencl -keys=opencl,gpu -max_num_threads=256 -thread_warp_size=1", [2, 16, 64, 4096, 409600, 512, 2, 2], "llvm -keys=cpu -link-params=0 -mtriple=aarch64-linux-gnu", 0, []], [[], [["CI", 2], ["FU", 4, [0, 1, 2, 3]], ["SP", 4, 0, 614400, [24], 1], ["AN", 4, 0, 5], ["AN", 4, 1, 6], ["FU", 3, [0, 1, 2]], ["SP", 3, 0, 307200, [2], 1], ["AN", 3, 0, 5], ["AN", 3, 1, 6], ["FU", 1, [0, 1, 2]], ["SP", 1, 0, 307200, [1], 1], ["AN", 1, 0, 5], ["AN", 1, 1, 6], ["PR", 1, 0, "auto_unroll_max_step$0"], ["PR", 3, 0, "auto_unroll_max_step$512"]]]], "r": [[0.0439644, 0.0138844, 0.0140276], 0, 16.4817, 1630556987], "v": "v0.6"}
{"i": [["[\"cf7c7a3bf9871fe4aa3fe21c1222fdb0\", 1, 2, 640, 480, 1, 2, 640, 480]", "opencl -keys=opencl,gpu -max_num_threads=256 -thread_warp_size=1", [2, 16, 64, 4096, 409600, 512, 2, 2], "llvm -keys=cpu -link-params=0 -mtriple=aarch64-linux-gnu", 0, []], [[], [["CI", 2], ["FU", 4, [0, 1, 2, 3]], ["SP", 4, 0, 614400, [2], 1], ["AN", 4, 0, 5], ["AN", 4, 1, 6], ["FU", 3, [0, 1, 2]], ["SP", 3, 0, 307200, [2], 1], ["AN", 3, 0, 5], ["AN", 3, 1, 6], ["FU", 1, [0, 1, 2]], ["SP", 1, 0, 307200, [2], 1], ["AN", 1, 0, 5], ["AN", 1, 1, 6], ["PR", 1, 0, "auto_unroll_max_step$64"], ["PR", 3, 0, "auto_unroll_max_step$1024"]]]], "r": [[0.011499, 0.0116838, 0.0118285], 0, 16.6477, 1630557004], "v": "v0.6"}
{"i": [["[\"cf7c7a3bf9871fe4aa3fe21c1222fdb0\", 1, 2, 640, 480, 1, 2, 640, 480]", "opencl -keys=opencl,gpu -max_num_threads=256 -thread_warp_size=1", [2, 16, 64, 4096, 409600, 512, 2, 2], "llvm -keys=cpu -link-params=0 -mtriple=aarch64-linux-gnu", 0, []], [[], [["CI", 2], ["FU", 4, [0, 1, 2, 3]], ["SP", 4, 0, 614400, [2], 1], ["AN", 4, 0, 5], ["AN", 4, 1, 6], ["FU", 3, [0, 1, 2]], ["SP", 3, 0, 307200, [20], 1], ["AN", 3, 0, 5], ["AN", 3, 1, 6], ["FU", 1, [0, 1, 2]], ["SP", 1, 0, 307200, [2], 1], ["AN", 1, 0, 5], ["AN", 1, 1, 6], ["PR", 1, 0, "auto_unroll_max_step$0"], ["PR", 3, 0, "auto_unroll_max_step$0"]]]], "r": [[0.084065, 0.0843348, 0.0848877], 0, 16.464, 1630557020], "v": "v0.6"}
{"i": [["[\"cf7c7a3bf9871fe4aa3fe21c1222fdb0\", 1, 2, 640, 480, 1, 2, 640, 480]", "opencl -keys=opencl,gpu -max_num_threads=256 -thread_warp_size=1", [2, 16, 64, 4096, 409600, 512, 2, 2], "llvm -keys=cpu -link-params=0 -mtriple=aarch64-linux-gnu", 0, []], [[], [["CI", 2], ["FU", 4, [0, 1, 2, 3]], ["SP", 4, 0, 614400, [30], 1], ["AN", 4, 0, 5], ["AN", 4, 1, 6], ["FU", 3, [0, 1, 2]], ["SP", 3, 0, 307200, [2], 1], ["AN", 3, 0, 5], ["AN", 3, 1, 6], ["FU", 1, [0, 1, 2]], ["SP", 1, 0, 307200, [2], 1], ["AN", 1, 0, 5], ["AN", 1, 1, 6], ["PR", 1, 0, "auto_unroll_max_step$1024"], ["PR", 3, 0, "auto_unroll_max_step$64"]]]], "r": [[0.0822133, 0.0797157, 0.012222], 0, 16.7174, 1630557037], "v": "v0.6"}
{"i": [["[\"cf7c7a3bf9871fe4aa3fe21c1222fdb0\", 1, 2, 640, 480, 1, 2, 640, 480]", "opencl -keys=opencl,gpu -max_num_threads=256 -thread_warp_size=1", [2, 16, 64, 4096, 409600, 512, 2, 2], "llvm -keys=cpu -link-params=0 -mtriple=aarch64-linux-gnu", 0, []], [[], [["CI", 2], ["FU", 4, [0, 1, 2, 3]], ["SP", 4, 0, 614400, [2], 1], ["AN", 4, 0, 5], ["AN", 4, 1, 6], ["FU", 3, [0, 1, 2]], ["SP", 3, 0, 307200, [24], 1], ["AN", 3, 0, 5], ["AN", 3, 1, 6], ["FU", 1, [0, 1, 2]], ["SP", 1, 0, 307200, [2], 1], ["AN", 1, 0, 5], ["AN", 1, 1, 6], ["PR", 1, 0, "auto_unroll_max_step$64"], ["PR", 3, 0, "auto_unroll_max_step$512"]]]], "r": [[0.0852188, 0.0878348, 0.0854264], 0, 16.7605, 1630557054], "v": "v0.6"}
{"i": [["[\"cf7c7a3bf9871fe4aa3fe21c1222fdb0\", 1, 2, 640, 480, 1, 2, 640, 480]", "opencl -keys=opencl,gpu -max_num_threads=256 -thread_warp_size=1", [2, 16, 64, 4096, 409600, 512, 2, 2], "llvm -keys=cpu -link-params=0 -mtriple=aarch64-linux-gnu", 0, []], [[], [["CI", 2], ["FU", 4, [0, 1, 2, 3]], ["SP", 4, 0, 614400, [12], 1], ["AN", 4, 0, 5], ["AN", 4, 1, 6], ["FU", 3, [0, 1, 2]], ["SP", 3, 0, 307200, [2], 1], ["AN", 3, 0, 5], ["AN", 3, 1, 6], ["FU", 1, [0, 1, 2]], ["SP", 1, 0, 307200, [2], 1], ["AN", 1, 0, 5], ["AN", 1, 1, 6], ["PR", 1, 0, "auto_unroll_max_step$512"], ["PR", 3, 0, "auto_unroll_max_step$1024"]]]], "r": [[0.0819183, 0.083873, 0.0852573], 0, 16.4514, 1630557070], "v": "v0.6"}
{"i": [["[\"cf7c7a3bf9871fe4aa3fe21c1222fdb0\", 1, 2, 640, 480, 1, 2, 640, 480]", "opencl -keys=opencl,gpu -max_num_threads=256 -thread_warp_size=1", [2, 16, 64, 4096, 409600, 512, 2, 2], "llvm -keys=cpu -link-params=0 -mtriple=aarch64-linux-gnu", 0, []], [[], [["CI", 2], ["FU", 4, [0, 1, 2, 3]], ["SP", 4, 0, 614400, [12], 1], ["AN", 4, 0, 5], ["AN", 4, 1, 6], ["FU", 3, [0, 1, 2]], ["SP", 3, 0, 307200, [30], 1], ["AN", 3, 0, 5], ["AN", 3, 1, 6], ["FU", 1, [0, 1, 2]], ["SP", 1, 0, 307200, [2], 1], ["AN", 1, 0, 5], ["AN", 1, 1, 6], ["PR", 1, 0, "auto_unroll_max_step$16"], ["PR", 3, 0, "auto_unroll_max_step$512"]]]], "r": [[0.0121433, 0.0121464, 0.0110628], 0, 16.7337, 1630557087], "v": "v0.6"}
{"i": [["[\"cf7c7a3bf9871fe4aa3fe21c1222fdb0\", 1, 2, 640, 480, 1, 2, 640, 480]", "opencl -keys=opencl,gpu -max_num_threads=256 -thread_warp_size=1", [2, 16, 64, 4096, 409600, 512, 2, 2], "llvm -keys=cpu -link-params=0 -mtriple=aarch64-linux-gnu", 0, []], [[], [["CI", 2], ["FU", 4, [0, 1, 2, 3]], ["SP", 4, 0, 614400, [60], 1], ["AN", 4, 0, 5], ["AN", 4, 1, 6], ["FU", 3, [0, 1, 2]], ["SP", 3, 0, 307200, [1], 1], ["AN", 3, 0, 5], ["AN", 3, 1, 6], ["FU", 1, [0, 1, 2]], ["SP", 1, 0, 307200, [2], 1], ["AN", 1, 0, 5], ["AN", 1, 1, 6], ["PR", 1, 0, "auto_unroll_max_step$0"], ["PR", 3, 0, "auto_unroll_max_step$16"]]]], "r": [[0.0137672, 0.0136831, 0.0138003], 0, 16.5725, 1630557103], "v": "v0.6"}
{"i": [["[\"cf7c7a3bf9871fe4aa3fe21c1222fdb0\", 1, 2, 640, 480, 1, 2, 640, 480]", "opencl -keys=opencl,gpu -max_num_threads=256 -thread_warp_size=1", [2, 16, 64, 4096, 409600, 512, 2, 2], "llvm -keys=cpu -link-params=0 -mtriple=aarch64-linux-gnu", 0, []], [[], [["CI", 2], ["FU", 4, [0, 1, 2, 3]], ["SP", 4, 0, 614400, [2], 1], ["AN", 4, 0, 5], ["AN", 4, 1, 6], ["FU", 3, [0, 1, 2]], ["SP", 3, 0, 307200, [2], 1], ["AN", 3, 0, 5], ["AN", 3, 1, 6], ["FU", 1, [0, 1, 2]], ["SP", 1, 0, 307200, [40], 1], ["AN", 1, 0, 5], ["AN", 1, 1, 6], ["PR", 1, 0, "auto_unroll_max_step$16"], ["PR", 3, 0, "auto_unroll_max_step$16"]]]], "r": [[0.0774962, 0.0771551, 0.0775336], 0, 16.5774, 1630557120], "v": "v0.6"}
{"i": [["[\"cf7c7a3bf9871fe4aa3fe21c1222fdb0\", 1, 2, 640, 480, 1, 2, 640, 480]", "opencl -keys=opencl,gpu -max_num_threads=256 -thread_warp_size=1", [2, 16, 64, 4096, 409600, 512, 2, 2], "llvm -keys=cpu -link-params=0 -mtriple=aarch64-linux-gnu", 0, []], [[], [["CI", 2], ["FU", 4, [0, 1, 2, 3]], ["SP", 4, 0, 614400, [4], 1], ["AN", 4, 0, 5], ["AN", 4, 1, 6], ["FU", 3, [0, 1, 2]], ["SP", 3, 0, 307200, [2], 1], ["AN", 3, 0, 5], ["AN", 3, 1, 6], ["FU", 1, [0, 1, 2]], ["SP", 1, 0, 307200, [1], 1], ["AN", 1, 0, 5], ["AN", 1, 1, 6], ["PR", 1, 0, "auto_unroll_max_step$0"], ["PR", 3, 0, "auto_unroll_max_step$64"]]]], "r": [[0.101546, 0.10304, 0.103297], 0, 16.7601, 1630557137], "v": "v0.6"}
{"i": [["[\"cf7c7a3bf9871fe4aa3fe21c1222fdb0\", 1, 2, 640, 480, 1, 2, 640, 480]", "opencl -keys=opencl,gpu -max_num_threads=256 -thread_warp_size=1", [2, 16, 64, 4096, 409600, 512, 2, 2], "llvm -keys=cpu -link-params=0 -mtriple=aarch64-linux-gnu", 0, []], [[], [["CI", 2], ["FU", 4, [0, 1, 2, 3]], ["SP", 4, 0, 614400, [2], 1], ["AN", 4, 0, 5], ["AN", 4, 1, 6], ["FU", 3, [0, 1, 2]], ["SP", 3, 0, 307200, [32], 1], ["AN", 3, 0, 5], ["AN", 3, 1, 6], ["FU", 1, [0, 1, 2]], ["SP", 1, 0, 307200, [1], 1], ["AN", 1, 0, 5], ["AN", 1, 1, 6], ["PR", 1, 0, "auto_unroll_max_step$1024"], ["PR", 3, 0, "auto_unroll_max_step$16"]]]], "r": [[0.0146715, 0.0144755, 0.0146548], 0, 17.0202, 1630557154], "v": "v0.6"}
{"i": [["[\"cf7c7a3bf9871fe4aa3fe21c1222fdb0\", 1, 2, 640, 480, 1, 2, 640, 480]", "opencl -keys=opencl,gpu -max_num_threads=256 -thread_warp_size=1", [2, 16, 64, 4096, 409600, 512, 2, 2], "llvm -keys=cpu -link-params=0 -mtriple=aarch64-linux-gnu", 0, []], [[], [["CI", 2], ["FU", 4, [0, 1, 2, 3]], ["SP", 4, 0, 614400, [1], 1], ["AN", 4, 0, 5], ["AN", 4, 1, 6], ["FU", 3, [0, 1, 2]], ["SP", 3, 0, 307200, [1], 1], ["AN", 3, 0, 5], ["AN", 3, 1, 6], ["FU", 1, [0, 1, 2]], ["SP", 1, 0, 307200, [2], 1], ["AN", 1, 0, 5], ["AN", 1, 1, 6], ["PR", 1, 0, "auto_unroll_max_step$1024"], ["PR", 3, 0, "auto_unroll_max_step$512"]]]], "r": [[0.0377886, 0.0194567, 0.0213052], 0, 16.7027, 1630557170], "v": "v0.6"}
{"i": [["[\"cf7c7a3bf9871fe4aa3fe21c1222fdb0\", 1, 2, 640, 480, 1, 2, 640, 480]", "opencl -keys=opencl,gpu -max_num_threads=256 -thread_warp_size=1", [2, 16, 64, 4096, 409600, 512, 2, 2], "llvm -keys=cpu -link-params=0 -mtriple=aarch64-linux-gnu", 0, []], [[], [["CI", 2], ["FU", 4, [0, 1, 2, 3]], ["SP", 4, 0, 614400, [2], 1], ["AN", 4, 0, 5], ["AN", 4, 1, 6], ["FU", 3, [0, 1, 2]], ["SP", 3, 0, 307200, [2], 1], ["AN", 3, 0, 5], ["AN", 3, 1, 6], ["FU", 1, [0, 1, 2]], ["SP", 1, 0, 307200, [64], 1], ["AN", 1, 0, 5], ["AN", 1, 1, 6], ["PR", 1, 0, "auto_unroll_max_step$0"], ["PR", 3, 0, "auto_unroll_max_step$64"]]]], "r": [[0.010486, 0.0108085, 0.0108048], 0, 16.2018, 1630557187], "v": "v0.6"}
{"i": [["[\"cf7c7a3bf9871fe4aa3fe21c1222fdb0\", 1, 2, 640, 480, 1, 2, 640, 480]", "opencl -keys=opencl,gpu -max_num_threads=256 -thread_warp_size=1", [2, 16, 64, 4096, 409600, 512, 2, 2], "llvm -keys=cpu -link-params=0 -mtriple=aarch64-linux-gnu", 0, []], [[], [["CI", 2], ["FU", 4, [0, 1, 2, 3]], ["SP", 4, 0, 614400, [12], 1], ["AN", 4, 0, 5], ["AN", 4, 1, 6], ["FU", 3, [0, 1, 2]], ["SP", 3, 0, 307200, [1], 1], ["AN", 3, 0, 5], ["AN", 3, 1, 6], ["FU", 1, [0, 1, 2]], ["SP", 1, 0, 307200, [2], 1], ["AN", 1, 0, 5], ["AN", 1, 1, 6], ["PR", 1, 0, "auto_unroll_max_step$64"], ["PR", 3, 0, "auto_unroll_max_step$0"]]]], "r": [[0.013941, 0.0138706, 0.0139367], 0, 16.396, 1630557203], "v": "v0.6"}
{"i": [["[\"cf7c7a3bf9871fe4aa3fe21c1222fdb0\", 1, 2, 640, 480, 1, 2, 640, 480]", "opencl -keys=opencl,gpu -max_num_threads=256 -thread_warp_size=1", [2, 16, 64, 4096, 409600, 512, 2, 2], "llvm -keys=cpu -link-params=0 -mtriple=aarch64-linux-gnu", 0, []], [[], [["CI", 2], ["FU", 4, [0, 1, 2, 3]], ["SP", 4, 0, 614400, [2], 1], ["AN", 4, 0, 5], ["AN", 4, 1, 6], ["FU", 3, [0, 1, 2]], ["SP", 3, 0, 307200, [2], 1], ["AN", 3, 0, 5], ["AN", 3, 1, 6], ["FU", 1, [0, 1, 2]], ["SP", 1, 0, 307200, [30], 1], ["AN", 1, 0, 5], ["AN", 1, 1, 6], ["PR", 1, 0, "auto_unroll_max_step$16"], ["PR", 3, 0, "auto_unroll_max_step$16"]]]], "r": [[0.0777317, 0.0784544, 0.0783096], 0, 16.9009, 1630557220], "v": "v0.6"}
{"i": [["[\"cf7c7a3bf9871fe4aa3fe21c1222fdb0\", 1, 2, 640, 480, 1, 2, 640, 480]", "opencl -keys=opencl,gpu -max_num_threads=256 -thread_warp_size=1", [2, 16, 64, 4096, 409600, 512, 2, 2], "llvm -keys=cpu -link-params=0 -mtriple=aarch64-linux-gnu", 0, []], [[], [["CI", 2], ["FU", 4, [0, 1, 2, 3]], ["SP", 4, 0, 614400, [2], 1], ["AN", 4, 0, 5], ["AN", 4, 1, 6], ["FU", 3, [0, 1, 2]], ["SP", 3, 0, 307200, [2], 1], ["AN", 3, 0, 5], ["AN", 3, 1, 6], ["FU", 1, [0, 1, 2]], ["SP", 1, 0, 307200, [1], 1], ["AN", 1, 0, 5], ["AN", 1, 1, 6], ["PR", 1, 0, "auto_unroll_max_step$1024"], ["PR", 3, 0, "auto_unroll_max_step$1024"]]]], "r": [[0.106444, 0.108184, 0.106473], 0, 16.6832, 1630557236], "v": "v0.6"}
{"i": [["[\"cf7c7a3bf9871fe4aa3fe21c1222fdb0\", 1, 2, 640, 480, 1, 2, 640, 480]", "opencl -keys=opencl,gpu -max_num_threads=256 -thread_warp_size=1", [2, 16, 64, 4096, 409600, 512, 2, 2], "llvm -keys=cpu -link-params=0 -mtriple=aarch64-linux-gnu", 0, []], [[], [["CI", 2], ["FU", 4, [0, 1, 2, 3]], ["SP", 4, 0, 614400, [2], 1], ["AN", 4, 0, 5], ["AN", 4, 1, 6], ["FU", 3, [0, 1, 2]], ["SP", 3, 0, 307200, [2], 1], ["AN", 3, 0, 5], ["AN", 3, 1, 6], ["FU", 1, [0, 1, 2]], ["SP", 1, 0, 307200, [4], 1], ["AN", 1, 0, 5], ["AN", 1, 1, 6], ["PR", 1, 0, "auto_unroll_max_step$16"], ["PR", 3, 0, "auto_unroll_max_step$1024"]]]], "r": [[0.0106394, 0.0105156, 0.0105135], 0, 8.2244, 1630557245], "v": "v0.6"}
{"i": [["[\"cf7c7a3bf9871fe4aa3fe21c1222fdb0\", 1, 2, 640, 480, 1, 2, 640, 480]", "opencl -keys=opencl,gpu -max_num_threads=256 -thread_warp_size=1", [2, 16, 64, 4096, 409600, 512, 2, 2], "llvm -keys=cpu -link-params=0 -mtriple=aarch64-linux-gnu", 0, []], [[], [["CI", 2], ["FU", 4, [0, 1, 2, 3]], ["SP", 4, 0, 614400, [4], 1], ["AN", 4, 0, 5], ["AN", 4, 1, 6], ["FU", 3, [0, 1, 2]], ["SP", 3, 0, 307200, [2], 1], ["AN", 3, 0, 5], ["AN", 3, 1, 6], ["FU", 1, [0, 1, 2]], ["SP", 1, 0, 307200, [24], 1], ["AN", 1, 0, 5], ["AN", 1, 1, 6], ["PR", 1, 0, "auto_unroll_max_step$0"], ["PR", 3, 0, "auto_unroll_max_step$512"]]]], "r": [[0.0737509, 0.0101277, 0.0103453], 0, 8.56484, 1630557253], "v": "v0.6"}
{"i": [["[\"cf7c7a3bf9871fe4aa3fe21c1222fdb0\", 1, 2, 640, 480, 1, 2, 640, 480]", "opencl -keys=opencl,gpu -max_num_threads=256 -thread_warp_size=1", [2, 16, 64, 4096, 409600, 512, 2, 2], "llvm -keys=cpu -link-params=0 -mtriple=aarch64-linux-gnu", 0, []], [[], [["CI", 2], ["FU", 4, [0, 1, 2, 3]], ["SP", 4, 0, 614400, [24], 1], ["AN", 4, 0, 5], ["AN", 4, 1, 6], ["FU", 3, [0, 1, 2]], ["SP", 3, 0, 307200, [2], 1], ["AN", 3, 0, 5], ["AN", 3, 1, 6], ["FU", 1, [0, 1, 2]], ["SP", 1, 0, 307200, [10], 1], ["AN", 1, 0, 5], ["AN", 1, 1, 6], ["PR", 1, 0, "auto_unroll_max_step$1024"], ["PR", 3, 0, "auto_unroll_max_step$512"]]]], "r": [[0.0746468, 0.0759767, 0.0761359], 0, 8.85936, 1630557262], "v": "v0.6"}
{"i": [["[\"cf7c7a3bf9871fe4aa3fe21c1222fdb0\", 1, 2, 640, 480, 1, 2, 640, 480]", "opencl -keys=opencl,gpu -max_num_threads=256 -thread_warp_size=1", [2, 16, 64, 4096, 409600, 512, 2, 2], "llvm -keys=cpu -link-params=0 -mtriple=aarch64-linux-gnu", 0, []], [[], [["CI", 2], ["FU", 4, [0, 1, 2, 3]], ["SP", 4, 0, 614400, [1], 1], ["AN", 4, 0, 5], ["AN", 4, 1, 6], ["FU", 3, [0, 1, 2]], ["SP", 3, 0, 307200, [1], 1], ["AN", 3, 0, 5], ["AN", 3, 1, 6], ["FU", 1, [0, 1, 2]], ["SP", 1, 0, 307200, [12], 1], ["AN", 1, 0, 5], ["AN", 1, 1, 6], ["PR", 1, 0, "auto_unroll_max_step$16"], ["PR", 3, 0, "auto_unroll_max_step$1024"]]]], "r": [[0.0254739, 0.0253247, 0.0187906], 0, 8.71628, 1630557271], "v": "v0.6"}
{"i": [["[\"cf7c7a3bf9871fe4aa3fe21c1222fdb0\", 1, 2, 640, 480, 1, 2, 640, 480]", "opencl -keys=opencl,gpu -max_num_threads=256 -thread_warp_size=1", [2, 16, 64, 4096, 409600, 512, 2, 2], "llvm -keys=cpu -link-params=0 -mtriple=aarch64-linux-gnu", 0, []], [[], [["CI", 2], ["FU", 4, [0, 1, 2, 3]], ["SP", 4, 0, 614400, [64], 1], ["AN", 4, 0, 5], ["AN", 4, 1, 6], ["FU", 3, [0, 1, 2]], ["SP", 3, 0, 307200, [2], 1], ["AN", 3, 0, 5], ["AN", 3, 1, 6], ["FU", 1, [0, 1, 2]], ["SP", 1, 0, 307200, [2], 1], ["AN", 1, 0, 5], ["AN", 1, 1, 6], ["PR", 1, 0, "auto_unroll_max_step$16"], ["PR", 3, 0, "auto_unroll_max_step$0"]]]], "r": [[0.081389, 0.0114818, 0.0114738], 0, 8.49592, 1630557279], "v": "v0.6"}
{"i": [["[\"cf7c7a3bf9871fe4aa3fe21c1222fdb0\", 1, 2, 640, 480, 1, 2, 640, 480]", "opencl -keys=opencl,gpu -max_num_threads=256 -thread_warp_size=1", [2, 16, 64, 4096, 409600, 512, 2, 2], "llvm -keys=cpu -link-params=0 -mtriple=aarch64-linux-gnu", 0, []], [[], [["CI", 2], ["FU", 4, [0, 1, 2, 3]], ["SP", 4, 0, 614400, [1], 1], ["AN", 4, 0, 5], ["AN", 4, 1, 6], ["FU", 3, [0, 1, 2]], ["SP", 3, 0, 307200, [2], 1], ["AN", 3, 0, 5], ["AN", 3, 1, 6], ["FU", 1, [0, 1, 2]], ["SP", 1, 0, 307200, [50], 1], ["AN", 1, 0, 5], ["AN", 1, 1, 6], ["PR", 1, 0, "auto_unroll_max_step$0"], ["PR", 3, 0, "auto_unroll_max_step$64"]]]], "r": [[0.0158593, 0.0160957, 0.016227], 0, 8.43873, 1630557288], "v": "v0.6"}
{"i": [["[\"cf7c7a3bf9871fe4aa3fe21c1222fdb0\", 1, 2, 640, 480, 1, 2, 640, 480]", "opencl -keys=opencl,gpu -max_num_threads=256 -thread_warp_size=1", [2, 16, 64, 4096, 409600, 512, 2, 2], "llvm -keys=cpu -link-params=0 -mtriple=aarch64-linux-gnu", 0, []], [[], [["CI", 2], ["FU", 4, [0, 1, 2, 3]], ["SP", 4, 0, 614400, [48], 1], ["AN", 4, 0, 5], ["AN", 4, 1, 6], ["FU", 3, [0, 1, 2]], ["SP", 3, 0, 307200, [2], 1], ["AN", 3, 0, 5], ["AN", 3, 1, 6], ["FU", 1, [0, 1, 2]], ["SP", 1, 0, 307200, [60], 1], ["AN", 1, 0, 5], ["AN", 1, 1, 6], ["PR", 1, 0, "auto_unroll_max_step$512"], ["PR", 3, 0, "auto_unroll_max_step$1024"]]]], "r": [[0.0738553, 0.0741231, 0.0738423], 0, 8.61959, 1630557296], "v": "v0.6"}
{"i": [["[\"cf7c7a3bf9871fe4aa3fe21c1222fdb0\", 1, 2, 640, 480, 1, 2, 640, 480]", "opencl -keys=opencl,gpu -max_num_threads=256 -thread_warp_size=1", [2, 16, 64, 4096, 409600, 512, 2, 2], "llvm -keys=cpu -link-params=0 -mtriple=aarch64-linux-gnu", 0, []], [[], [["CI", 2], ["FU", 4, [0, 1, 2, 3]], ["SP", 4, 0, 614400, [6], 1], ["AN", 4, 0, 5], ["AN", 4, 1, 6], ["FU", 3, [0, 1, 2]], ["SP", 3, 0, 307200, [16], 1], ["AN", 3, 0, 5], ["AN", 3, 1, 6], ["FU", 1, [0, 1, 2]], ["SP", 1, 0, 307200, [2], 1], ["AN", 1, 0, 5], ["AN", 1, 1, 6], ["PR", 1, 0, "auto_unroll_max_step$0"], ["PR", 3, 0, "auto_unroll_max_step$64"]]]], "r": [[0.0811507, 0.0112574, 0.0119524], 0, 8.78743, 1630557305], "v": "v0.6"}
{"i": [["[\"cf7c7a3bf9871fe4aa3fe21c1222fdb0\", 1, 2, 640, 480, 1, 2, 640, 480]", "opencl -keys=opencl,gpu -max_num_threads=256 -thread_warp_size=1", [2, 16, 64, 4096, 409600, 512, 2, 2], "llvm -keys=cpu -link-params=0 -mtriple=aarch64-linux-gnu", 0, []], [[], [["CI", 2], ["FU", 4, [0, 1, 2, 3]], ["SP", 4, 0, 614400, [16], 1], ["AN", 4, 0, 5], ["AN", 4, 1, 6], ["FU", 3, [0, 1, 2]], ["SP", 3, 0, 307200, [1], 1], ["AN", 3, 0, 5], ["AN", 3, 1, 6], ["FU", 1, [0, 1, 2]], ["SP", 1, 0, 307200, [2], 1], ["AN", 1, 0, 5], ["AN", 1, 1, 6], ["PR", 1, 0, "auto_unroll_max_step$16"], ["PR", 3, 0, "auto_unroll_max_step$1024"]]]], "r": [[0.0664611, 0.0156033, 0.0156413], 0, 8.73468, 1630557314], "v": "v0.6"}
{"i": [["[\"cf7c7a3bf9871fe4aa3fe21c1222fdb0\", 1, 2, 640, 480, 1, 2, 640, 480]", "opencl -keys=opencl,gpu -max_num_threads=256 -thread_warp_size=1", [2, 16, 64, 4096, 409600, 512, 2, 2], "llvm -keys=cpu -link-params=0 -mtriple=aarch64-linux-gnu", 0, []], [[], [["CI", 2], ["FU", 4, [0, 1, 2, 3]], ["SP", 4, 0, 614400, [1], 1], ["AN", 4, 0, 5], ["AN", 4, 1, 6], ["FU", 3, [0, 1, 2]], ["SP", 3, 0, 307200, [1], 1], ["AN", 3, 0, 5], ["AN", 3, 1, 6], ["FU", 1, [0, 1, 2]], ["SP", 1, 0, 307200, [2], 1], ["AN", 1, 0, 5], ["AN", 1, 1, 6], ["PR", 1, 0, "auto_unroll_max_step$512"], ["PR", 3, 0, "auto_unroll_max_step$64"]]]], "r": [[0.0196644, 0.0197308, 0.0196364], 0, 8.18373, 1630557322], "v": "v0.6"}
{"i": [["[\"cf7c7a3bf9871fe4aa3fe21c1222fdb0\", 1, 2, 640, 480, 1, 2, 640, 480]", "opencl -keys=opencl,gpu -max_num_threads=256 -thread_warp_size=1", [2, 16, 64, 4096, 409600, 512, 2, 2], "llvm -keys=cpu -link-params=0 -mtriple=aarch64-linux-gnu", 0, []], [[], [["CI", 2], ["FU", 4, [0, 1, 2, 3]], ["SP", 4, 0, 614400, [2], 1], ["AN", 4, 0, 5], ["AN", 4, 1, 6], ["FU", 3, [0, 1, 2]], ["SP", 3, 0, 307200, [50], 1], ["AN", 3, 0, 5], ["AN", 3, 1, 6], ["FU", 1, [0, 1, 2]], ["SP", 1, 0, 307200, [1], 1], ["AN", 1, 0, 5], ["AN", 1, 1, 6], ["PR", 1, 0, "auto_unroll_max_step$1024"], ["PR", 3, 0, "auto_unroll_max_step$16"]]]], "r": [[0.0505786, 0.014739, 0.0150876], 0, 8.88553, 1630557331], "v": "v0.6"}
{"i": [["[\"cf7c7a3bf9871fe4aa3fe21c1222fdb0\", 1, 2, 640, 480, 1, 2, 640, 480]", "opencl -keys=opencl,gpu -max_num_threads=256 -thread_warp_size=1", [2, 16, 64, 4096, 409600, 512, 2, 2], "llvm -keys=cpu -link-params=0 -mtriple=aarch64-linux-gnu", 0, []], [[], [["CI", 2], ["FU", 4, [0, 1, 2, 3]], ["SP", 4, 0, 614400, [12], 1], ["AN", 4, 0, 5], ["AN", 4, 1, 6], ["FU", 3, [0, 1, 2]], ["SP", 3, 0, 307200, [6], 1], ["AN", 3, 0, 5], ["AN", 3, 1, 6], ["FU", 1, [0, 1, 2]], ["SP", 1, 0, 307200, [2], 1], ["AN", 1, 0, 5], ["AN", 1, 1, 6], ["PR", 1, 0, "auto_unroll_max_step$64"], ["PR", 3, 0, "auto_unroll_max_step$0"]]]], "r": [[0.0111672, 0.0120728, 0.01456], 0, 8.95706, 1630557340], "v": "v0.6"}
{"i": [["[\"cf7c7a3bf9871fe4aa3fe21c1222fdb0\", 1, 2, 640, 480, 1, 2, 640, 480]", "opencl -keys=opencl,gpu -max_num_threads=256 -thread_warp_size=1", [2, 16, 64, 4096, 409600, 512, 2, 2], "llvm -keys=cpu -link-params=0 -mtriple=aarch64-linux-gnu", 0, []], [[], [["CI", 2], ["FU", 4, [0, 1, 2, 3]], ["SP", 4, 0, 614400, [2], 1], ["AN", 4, 0, 5], ["AN", 4, 1, 6], ["FU", 3, [0, 1, 2]], ["SP", 3, 0, 307200, [1], 1], ["AN", 3, 0, 5], ["AN", 3, 1, 6], ["FU", 1, [0, 1, 2]], ["SP", 1, 0, 307200, [8], 1], ["AN", 1, 0, 5], ["AN", 1, 1, 6], ["PR", 1, 0, "auto_unroll_max_step$0"], ["PR", 3, 0, "auto_unroll_max_step$64"]]]], "r": [[0.0980354, 0.0982402, 0.013284], 0, 8.32573, 1630557349], "v": "v0.6"}
{"i": [["[\"cf7c7a3bf9871fe4aa3fe21c1222fdb0\", 1, 2, 640, 480, 1, 2, 640, 480]", "opencl -keys=opencl,gpu -max_num_threads=256 -thread_warp_size=1", [2, 16, 64, 4096, 409600, 512, 2, 2], "llvm -keys=cpu -link-params=0 -mtriple=aarch64-linux-gnu", 0, []], [[], [["CI", 2], ["FU", 4, [0, 1, 2, 3]], ["SP", 4, 0, 614400, [1], 1], ["AN", 4, 0, 5], ["AN", 4, 1, 6], ["FU", 3, [0, 1, 2]], ["SP", 3, 0, 307200, [2], 1], ["AN", 3, 0, 5], ["AN", 3, 1, 6], ["FU", 1, [0, 1, 2]], ["SP", 1, 0, 307200, [30], 1], ["AN", 1, 0, 5], ["AN", 1, 1, 6], ["PR", 1, 0, "auto_unroll_max_step$0"], ["PR", 3, 0, "auto_unroll_max_step$64"]]]], "r": [[0.0161031, 0.0170781, 0.0200822], 0, 9.06144, 1630557358], "v": "v0.6"}
{"i": [["[\"cf7c7a3bf9871fe4aa3fe21c1222fdb0\", 1, 2, 640, 480, 1, 2, 640, 480]", "opencl -keys=opencl,gpu -max_num_threads=256 -thread_warp_size=1", [2, 16, 64, 4096, 409600, 512, 2, 2], "llvm -keys=cpu -link-params=0 -mtriple=aarch64-linux-gnu", 0, []], [[], [["CI", 2], ["FU", 4, [0, 1, 2, 3]], ["SP", 4, 0, 614400, [1], 1], ["AN", 4, 0, 5], ["AN", 4, 1, 6], ["FU", 3, [0, 1, 2]], ["SP", 3, 0, 307200, [2], 1], ["AN", 3, 0, 5], ["AN", 3, 1, 6], ["FU", 1, [0, 1, 2]], ["SP", 1, 0, 307200, [1], 1], ["AN", 1, 0, 5], ["AN", 1, 1, 6], ["PR", 1, 0, "auto_unroll_max_step$0"], ["PR", 3, 0, "auto_unroll_max_step$64"]]]], "r": [[0.0196444, 0.0198309, 0.0213244], 0, 8.05049, 1630557366], "v": "v0.6"}
{"i": [["[\"cf7c7a3bf9871fe4aa3fe21c1222fdb0\", 1, 2, 640, 480, 1, 2, 640, 480]", "opencl -keys=opencl,gpu -max_num_threads=256 -thread_warp_size=1", [2, 16, 64, 4096, 409600, 512, 2, 2], "llvm -keys=cpu -link-params=0 -mtriple=aarch64-linux-gnu", 0, []], [[], [["CI", 2], ["FU", 4, [0, 1, 2, 3]], ["SP", 4, 0, 614400, [2], 1], ["AN", 4, 0, 5], ["AN", 4, 1, 6], ["FU", 3, [0, 1, 2]], ["SP", 3, 0, 307200, [1], 1], ["AN", 3, 0, 5], ["AN", 3, 1, 6], ["FU", 1, [0, 1, 2]], ["SP", 1, 0, 307200, [2], 1], ["AN", 1, 0, 5], ["AN", 1, 1, 6], ["PR", 1, 0, "auto_unroll_max_step$16"], ["PR", 3, 0, "auto_unroll_max_step$1024"]]]], "r": [[0.106412, 0.0148834, 0.0149448], 0, 9.17984, 1630557375], "v": "v0.6"}
{"i": [["[\"cf7c7a3bf9871fe4aa3fe21c1222fdb0\", 1, 2, 640, 480, 1, 2, 640, 480]", "opencl -keys=opencl,gpu -max_num_threads=256 -thread_warp_size=1", [2, 16, 64, 4096, 409600, 512, 2, 2], "llvm -keys=cpu -link-params=0 -mtriple=aarch64-linux-gnu", 0, []], [[], [["CI", 2], ["FU", 4, [0, 1, 2, 3]], ["SP", 4, 0, 614400, [6], 1], ["AN", 4, 0, 5], ["AN", 4, 1, 6], ["FU", 3, [0, 1, 2]], ["SP", 3, 0, 307200, [2], 1], ["AN", 3, 0, 5], ["AN", 3, 1, 6], ["FU", 1, [0, 1, 2]], ["SP", 1, 0, 307200, [2], 1], ["AN", 1, 0, 5], ["AN", 1, 1, 6], ["PR", 1, 0, "auto_unroll_max_step$0"], ["PR", 3, 0, "auto_unroll_max_step$64"]]]], "r": [[0.0112655, 0.0111603, 0.0114737], 0, 8.58264, 1630557383], "v": "v0.6"}
{"i": [["[\"cf7c7a3bf9871fe4aa3fe21c1222fdb0\", 1, 2, 640, 480, 1, 2, 640, 480]", "opencl -keys=opencl,gpu -max_num_threads=256 -thread_warp_size=1", [2, 16, 64, 4096, 409600, 512, 2, 2], "llvm -keys=cpu -link-params=0 -mtriple=aarch64-linux-gnu", 0, []], [[], [["CI", 2], ["FU", 4, [0, 1, 2, 3]], ["SP", 4, 0, 614400, [40], 1], ["AN", 4, 0, 5], ["AN", 4, 1, 6], ["FU", 3, [0, 1, 2]], ["SP", 3, 0, 307200, [1], 1], ["AN", 3, 0, 5], ["AN", 3, 1, 6], ["FU", 1, [0, 1, 2]], ["SP", 1, 0, 307200, [1], 1], ["AN", 1, 0, 5], ["AN", 1, 1, 6], ["PR", 1, 0, "auto_unroll_max_step$512"], ["PR", 3, 0, "auto_unroll_max_step$64"]]]], "r": [[0.0162111, 0.0162934, 0.0167467], 0, 8.46441, 1630557392], "v": "v0.6"}
{"i": [["[\"cf7c7a3bf9871fe4aa3fe21c1222fdb0\", 1, 2, 640, 480, 1, 2, 640, 480]", "opencl -keys=opencl,gpu -max_num_threads=256 -thread_warp_size=1", [2, 16, 64, 4096, 409600, 512, 2, 2], "llvm -keys=cpu -link-params=0 -mtriple=aarch64-linux-gnu", 0, []], [[], [["CI", 2], ["FU", 4, [0, 1, 2, 3]], ["SP", 4, 0, 614400, [2], 1], ["AN", 4, 0, 5], ["AN", 4, 1, 6], ["FU", 3, [0, 1, 2]], ["SP", 3, 0, 307200, [2], 1], ["AN", 3, 0, 5], ["AN", 3, 1, 6], ["FU", 1, [0, 1, 2]], ["SP", 1, 0, 307200, [2], 1], ["AN", 1, 0, 5], ["AN", 1, 1, 6], ["PR", 1, 0, "auto_unroll_max_step$16"], ["PR", 3, 0, "auto_unroll_max_step$16"]]]], "r": [[0.0616407, 0.0129082, 0.0131888], 0, 8.4014, 1630557400], "v": "v0.6"}
{"i": [["[\"cf7c7a3bf9871fe4aa3fe21c1222fdb0\", 1, 2, 640, 480, 1, 2, 640, 480]", "opencl -keys=opencl,gpu -max_num_threads=256 -thread_warp_size=1", [2, 16, 64, 4096, 409600, 512, 2, 2], "llvm -keys=cpu -link-params=0 -mtriple=aarch64-linux-gnu", 0, []], [[], [["CI", 2], ["FU", 4, [0, 1, 2, 3]], ["SP", 4, 0, 614400, [12], 1], ["AN", 4, 0, 5], ["AN", 4, 1, 6], ["FU", 3, [0, 1, 2]], ["SP", 3, 0, 307200, [2], 1], ["AN", 3, 0, 5], ["AN", 3, 1, 6], ["FU", 1, [0, 1, 2]], ["SP", 1, 0, 307200, [2], 1], ["AN", 1, 0, 5], ["AN", 1, 1, 6], ["PR", 1, 0, "auto_unroll_max_step$64"], ["PR", 3, 0, "auto_unroll_max_step$512"]]]], "r": [[0.0112039, 0.0112792, 0.0111393], 0, 7.95732, 1630557408], "v": "v0.6"}
{"i": [["[\"cf7c7a3bf9871fe4aa3fe21c1222fdb0\", 1, 2, 640, 480, 1, 2, 640, 480]", "opencl -keys=opencl,gpu -max_num_threads=256 -thread_warp_size=1", [2, 16, 64, 4096, 409600, 512, 2, 2], "llvm -keys=cpu -link-params=0 -mtriple=aarch64-linux-gnu", 0, []], [[], [["CI", 2], ["FU", 4, [0, 1, 2, 3]], ["SP", 4, 0, 614400, [30], 1], ["AN", 4, 0, 5], ["AN", 4, 1, 6], ["FU", 3, [0, 1, 2]], ["SP", 3, 0, 307200, [4], 1], ["AN", 3, 0, 5], ["AN", 3, 1, 6], ["FU", 1, [0, 1, 2]], ["SP", 1, 0, 307200, [32], 1], ["AN", 1, 0, 5], ["AN", 1, 1, 6], ["PR", 1, 0, "auto_unroll_max_step$1024"], ["PR", 3, 0, "auto_unroll_max_step$16"]]]], "r": [[0.00992281, 0.0103781, 0.0174475], 0, 8.89031, 1630557417], "v": "v0.6"}
{"i": [["[\"cf7c7a3bf9871fe4aa3fe21c1222fdb0\", 1, 2, 640, 480, 1, 2, 640, 480]", "opencl -keys=opencl,gpu -max_num_threads=256 -thread_warp_size=1", [2, 16, 64, 4096, 409600, 512, 2, 2], "llvm -keys=cpu -link-params=0 -mtriple=aarch64-linux-gnu", 0, []], [[], [["CI", 2], ["FU", 4, [0, 1, 2, 3]], ["SP", 4, 0, 614400, [2], 1], ["AN", 4, 0, 5], ["AN", 4, 1, 6], ["FU", 3, [0, 1, 2]], ["SP", 3, 0, 307200, [60], 1], ["AN", 3, 0, 5], ["AN", 3, 1, 6], ["FU", 1, [0, 1, 2]], ["SP", 1, 0, 307200, [2], 1], ["AN", 1, 0, 5], ["AN", 1, 1, 6], ["PR", 1, 0, "auto_unroll_max_step$512"], ["PR", 3, 0, "auto_unroll_max_step$1024"]]]], "r": [[0.0848856, 0.0407631, 0.0122268], 0, 8.7644, 1630557426], "v": "v0.6"}
{"i": [["[\"cf7c7a3bf9871fe4aa3fe21c1222fdb0\", 1, 2, 640, 480, 1, 2, 640, 480]", "opencl -keys=opencl,gpu -max_num_threads=256 -thread_warp_size=1", [2, 16, 64, 4096, 409600, 512, 2, 2], "llvm -keys=cpu -link-params=0 -mtriple=aarch64-linux-gnu", 0, []], [[], [["CI", 2], ["FU", 4, [0, 1, 2, 3]], ["SP", 4, 0, 614400, [2], 1], ["AN", 4, 0, 5], ["AN", 4, 1, 6], ["FU", 3, [0, 1, 2]], ["SP", 3, 0, 307200, [2], 1], ["AN", 3, 0, 5], ["AN", 3, 1, 6], ["FU", 1, [0, 1, 2]], ["SP", 1, 0, 307200, [2], 1], ["AN", 1, 0, 5], ["AN", 1, 1, 6], ["PR", 1, 0, "auto_unroll_max_step$0"], ["PR", 3, 0, "auto_unroll_max_step$0"]]]], "r": [[0.0116555, 0.0117531, 0.0126865], 0, 8.31186, 1630557434], "v": "v0.6"}
{"i": [["[\"cf7c7a3bf9871fe4aa3fe21c1222fdb0\", 1, 2, 640, 480, 1, 2, 640, 480]", "opencl -keys=opencl,gpu -max_num_threads=256 -thread_warp_size=1", [2, 16, 64, 4096, 409600, 512, 2, 2], "llvm -keys=cpu -link-params=0 -mtriple=aarch64-linux-gnu", 0, []], [[], [["CI", 2], ["FU", 4, [0, 1, 2, 3]], ["SP", 4, 0, 614400, [48], 1], ["AN", 4, 0, 5], ["AN", 4, 1, 6], ["FU", 3, [0, 1, 2]], ["SP", 3, 0, 307200, [2], 1], ["AN", 3, 0, 5], ["AN", 3, 1, 6], ["FU", 1, [0, 1, 2]], ["SP", 1, 0, 307200, [60], 1], ["AN", 1, 0, 5], ["AN", 1, 1, 6], ["PR", 1, 0, "auto_unroll_max_step$1024"], ["PR", 3, 0, "auto_unroll_max_step$1024"]]]], "r": [[0.0100279, 0.0100755, 0.010861], 0, 8.67966, 1630557443], "v": "v0.6"}
{"i": [["[\"cf7c7a3bf9871fe4aa3fe21c1222fdb0\", 1, 2, 640, 480, 1, 2, 640, 480]", "opencl -keys=opencl,gpu -max_num_threads=256 -thread_warp_size=1", [2, 16, 64, 4096, 409600, 512, 2, 2], "llvm -keys=cpu -link-params=0 -mtriple=aarch64-linux-gnu", 0, []], [[], [["CI", 2], ["FU", 4, [0, 1, 2, 3]], ["SP", 4, 0, 614400, [40], 1], ["AN", 4, 0, 5], ["AN", 4, 1, 6], ["FU", 3, [0, 1, 2]], ["SP", 3, 0, 307200, [2], 1], ["AN", 3, 0, 5], ["AN", 3, 1, 6], ["FU", 1, [0, 1, 2]], ["SP", 1, 0, 307200, [2], 1], ["AN", 1, 0, 5], ["AN", 1, 1, 6], ["PR", 1, 0, "auto_unroll_max_step$64"], ["PR", 3, 0, "auto_unroll_max_step$1024"]]]], "r": [[0.011017, 0.0112493, 0.011604], 0, 8.34603, 1630557451], "v": "v0.6"}
{"i": [["[\"cf7c7a3bf9871fe4aa3fe21c1222fdb0\", 1, 2, 640, 480, 1, 2, 640, 480]", "opencl -keys=opencl,gpu -max_num_threads=256 -thread_warp_size=1", [2, 16, 64, 4096, 409600, 512, 2, 2], "llvm -keys=cpu -link-params=0 -mtriple=aarch64-linux-gnu", 0, []], [[], [["CI", 2], ["FU", 4, [0, 1, 2, 3]], ["SP", 4, 0, 614400, [1], 1], ["AN", 4, 0, 5], ["AN", 4, 1, 6], ["FU", 3, [0, 1, 2]], ["SP", 3, 0, 307200, [40], 1], ["AN", 3, 0, 5], ["AN", 3, 1, 6], ["FU", 1, [0, 1, 2]], ["SP", 1, 0, 307200, [4], 1], ["AN", 1, 0, 5], ["AN", 1, 1, 6], ["PR", 1, 0, "auto_unroll_max_step$0"], ["PR", 3, 0, "auto_unroll_max_step$64"]]]], "r": [[0.16895, 0.126685, 0.0495729], 0, 9.42146, 1630557460], "v": "v0.6"}
