example_03/model-01-NCHW-B1-opencl-C2000-T21-08-29-21-56.json
{"i": [["[\"3de659bda0b18c5fe8c5c8f8ce54ea9d\", 1, 15, 106, 84, 15, 15, 4, 4, 1, 15, 1, 1, 1, 15, 212, 168, 1, 15, 212, 168]", "opencl -keys=mali,opencl,gpu -device=mali -max_num_threads=256 -thread_warp_size=1", [2, 16, 64, 4096, 40960, 512, 2, 2], "llvm -keys=cpu -link-params=0 -mtriple=aarch64-linux-gnu", 2, []], [[], [["CI", 5], ["SP", 3, 0, 1, [1, 1, 1, 1], 1], ["SP", 3, 5, 15, [1, 1, 1, 5], 1], ["SP", 3, 10, 212, [1, 1, 1, 1], 1], ["SP", 3, 15, 168, [1, 3, 1, 2], 1], ["SP", 3, 20, 15, [15, 1], 1], ["SP", 3, 23, 4, [1, 4], 1], ["SP", 3, 26, 4, [4, 1], 1], ["RE", 3, [0, 5, 10, 15, 1, 6, 11, 16, 2, 7, 12, 17, 20, 23, 26, 21, 24, 27, 3, 8, 13, 18, 22, 25, 28, 4, 9, 14, 19]], ["FSP", 7, 0, 1, 3], ["FSP", 7, 4, 2, 3], ["FSP", 7, 8, 3, 3], ["FSP", 7, 12, 4, 3], ["RE", 7, [0, 4, 8, 12, 1, 5, 9, 13, 2, 6, 10, 14, 3, 7, 11, 15]], ["CA", 3, 7, 11], ["CI", 1], ["FU", 7, [0, 1, 2, 3]], ["AN", 7, 0, 5], ["FU", 7, [1, 2, 3, 4]], ["AN", 7, 1, 4], ["FU", 7, [2, 3, 4, 5]], ["AN", 7, 2, 6], ["PR", 3, 0, "auto_unroll_max_step$16"], ["AN", 3, 28, 2], ["AN", 7, 6, 2]]]], "r": [[0.256569, 0.258232, 0.258118], 0, 6.33401, 1630245411], "v": "v0.6"}
{"i": [["[\"3de659bda0b18c5fe8c5c8f8ce54ea9d\", 1, 15, 106, 84, 15, 15, 4, 4, 1, 15, 1, 1, 1, 15, 212, 168, 1, 15, 212, 168]", "opencl -keys=mali,opencl,gpu -device=mali -max_num_threads=256 -thread_warp_size=1", [2, 16, 64, 4096, 40960, 512, 2, 2], "llvm -keys=cpu -link-params=0 -mtriple=aarch64-linux-gnu", 2, []], [[], [["CI", 5], ["SP", 3, 0, 1, [1, 1, 1, 1], 1], ["SP", 3, 5, 15, [1, 3, 5, 1], 1], ["SP", 3, 10, 212, [1, 53, 4, 1], 1], ["SP", 3, 15, 168, [1, 1, 4, 42], 1], ["SP", 3, 20, 15, [3, 1], 1], ["SP", 3, 23, 4, [1, 1], 1], ["SP", 3, 26, 4, [1, 2], 1], ["RE", 3, [0, 5, 10, 15, 1, 6, 11, 16, 2, 7, 12, 17, 20, 23, 26, 21, 24, 27, 3, 8, 13, 18, 22, 25, 28, 4, 9, 14, 19]], ["FSP", 7, 0, 1, 3], ["FSP", 7, 4, 2, 3], ["FSP", 7, 8, 3, 3], ["FSP", 7, 12, 4, 3], ["RE", 7, [0, 4, 8, 12, 1, 5, 9, 13, 2, 6, 10, 14, 3, 7, 11, 15]], ["CA", 3, 7, 11], ["CI", 1], ["FU", 7, [0, 1, 2, 3]], ["AN", 7, 0, 5], ["FU", 7, [1, 2, 3, 4]], ["AN", 7, 1, 4], ["FU", 7, [2, 3, 4, 5]], ["AN", 7, 2, 6], ["PR", 3, 0, "auto_unroll_max_step$0"]]]], "r": [[0.751045, 0.780617, 0.753576], 0, 19.0168, 1630245430], "v": "v0.6"}
{"i": [["[\"3de659bda0b18c5fe8c5c8f8ce54ea9d\", 1, 15, 106, 84, 15, 15, 4, 4, 1, 15, 1, 1, 1, 15, 212, 168, 1, 15, 212, 168]", "opencl -keys=mali,opencl,gpu -device=mali -max_num_threads=256 -thread_warp_size=1", [2, 16, 64, 4096, 40960, 512, 2, 2], "llvm -keys=cpu -link-params=0 -mtriple=aarch64-linux-gnu", 2, []], [[], [["CI", 5], ["SP", 3, 0, 1, [1, 1, 1, 1], 1], ["SP", 3, 5, 15, [1, 3, 1, 1], 1], ["SP", 3, 10, 212, [1, 1, 2, 1], 1], ["SP", 3, 15, 168, [2, 1, 2, 1], 1], ["SP", 3, 20, 15, [1, 15], 1], ["SP", 3, 23, 4, [1, 2], 1], ["SP", 3, 26, 4, [2, 2], 1], ["RE", 3, [0, 5, 10, 15, 1, 6, 11, 16, 2, 7, 12, 17, 20, 23, 26, 21, 24, 27, 3, 8, 13, 18, 22, 25, 28, 4, 9, 14, 19]], ["FSP", 7, 0, 1, 3], ["FSP", 7, 4, 2, 3], ["FSP", 7, 8, 3, 3], ["FSP", 7, 12, 4, 3], ["RE", 7, [0, 4, 8, 12, 1, 5, 9, 13, 2, 6, 10, 14, 3, 7, 11, 15]], ["CA", 3, 7, 11], ["CI", 1], ["FU", 7, [0, 1, 2, 3]], ["AN", 7, 0, 5], ["FU", 7, [1, 2, 3, 4]], ["AN", 7, 1, 4], ["FU", 7, [2, 3, 4, 5]], ["AN", 7, 2, 6], ["PR", 3, 0, "auto_unroll_max_step$64"], ["AN", 3, 28, 2], ["AN", 7, 6, 2]]]], "r": [[0.255869, 0.259934, 0.257152], 0, 8.33051, 1630245488], "v": "v0.6"}
{"i": [["[\"3de659bda0b18c5fe8c5c8f8ce54ea9d\", 1, 15, 106, 84, 15, 15, 4, 4, 1, 15, 1, 1, 1, 15, 212, 168, 1, 15, 212, 168]", "opencl -keys=mali,opencl,gpu -device=mali -max_num_threads=256 -thread_warp_size=1", [2, 16, 64, 4096, 40960, 512, 2, 2], "llvm -keys=cpu -link-params=0 -mtriple=aarch64-linux-gnu", 2, []], [[], [["CI", 5], ["SP", 3, 0, 1, [1, 1, 1, 1], 1], ["SP", 3, 5, 15, [1, 3, 1, 1], 1], ["SP", 3, 10, 212, [2, 53, 2, 1], 1], ["SP", 3, 15, 168, [1, 1, 3, 28], 1], ["SP", 3, 20, 15, [3, 1], 1], ["SP", 3, 23, 4, [2, 1], 1], ["SP", 3, 26, 4, [1, 1], 1], ["RE", 3, [0, 5, 10, 15, 1, 6, 11, 16, 2, 7, 12, 17, 20, 23, 26, 21, 24, 27, 3, 8, 13, 18, 22, 25, 28, 4, 9, 14, 19]], ["FSP", 7, 0, 1, 3], ["FSP", 7, 4, 2, 3], ["FSP", 7, 8, 3, 3], ["FSP", 7, 12, 4, 3], ["RE", 7, [0, 4, 8, 12, 1, 5, 9, 13, 2, 6, 10, 14, 3, 7, 11, 15]], ["CA", 3, 7, 11], ["CI", 1], ["FU", 7, [0, 1, 2, 3]], ["AN", 7, 0, 5], ["FU", 7, [1, 2, 3, 4]], ["AN", 7, 1, 4], ["FU", 7, [2, 3, 4, 5]], ["AN", 7, 2, 6], ["PR", 3, 0, "auto_unroll_max_step$0"]]]], "r": [[0.494739, 0.493084, 0.493033], 0, 14.4831, 1630245503], "v": "v0.6"}
{"i": [["[\"3de659bda0b18c5fe8c5c8f8ce54ea9d\", 1, 15, 106, 84, 15, 15, 4, 4, 1, 15, 1, 1, 1, 15, 212, 168, 1, 15, 212, 168]", "opencl -keys=mali,opencl,gpu -device=mali -max_num_threads=256 -thread_warp_size=1", [2, 16, 64, 4096, 40960, 512, 2, 2], "llvm -keys=cpu -link-params=0 -mtriple=aarch64-linux-gnu", 2, []], [[], [["CI", 5], ["SP", 3, 0, 1, [1, 1, 1, 1], 1], ["SP", 3, 5, 15, [1, 3, 5, 1], 1], ["SP", 3, 10, 212, [1, 53, 4, 1], 1], ["SP", 3, 15, 168, [2, 1, 4, 1], 1], ["SP", 3, 20, 15, [1, 1], 1], ["SP", 3, 23, 4, [4, 1], 1], ["SP", 3, 26, 4, [1, 1], 1], ["RE", 3, [0, 5, 10, 15, 1, 6, 11, 16, 2, 7, 12, 17, 20, 23, 26, 21, 24, 27, 3, 8, 13, 18, 22, 25, 28, 4, 9, 14, 19]], ["FSP", 7, 0, 1, 3], ["FSP", 7, 4, 2, 3], ["FSP", 7, 8, 3, 3], ["FSP", 7, 12, 4, 3], ["RE", 7, [0, 4, 8, 12, 1, 5, 9, 13, 2, 6, 10, 14, 3, 7, 11, 15]], ["CA", 3, 7, 11], ["CI", 1], ["FU", 7, [0, 1, 2, 3]], ["AN", 7, 0, 5], ["FU", 7, [1, 2, 3, 4]], ["AN", 7, 1, 4], ["FU", 7, [2, 3, 4, 5]], ["AN", 7, 2, 6], ["PR", 3, 0, "auto_unroll_max_step$64"], ["AN", 3, 28, 2], ["AN", 7, 6, 2]]]], "r": [[0.609944, 0.604435, 0.617671], 0, 19.5113, 1630245522], "v": "v0.6"}
{"i": [["[\"3de659bda0b18c5fe8c5c8f8ce54ea9d\", 1, 15, 106, 84, 15, 15, 4, 4, 1, 15, 1, 1, 1, 15, 212, 168, 1, 15, 212, 168]", "opencl -keys=mali,opencl,gpu -device=mali -max_num_threads=256 -thread_warp_size=1", [2, 16, 64, 4096, 40960, 512, 2, 2], "llvm -keys=cpu -link-params=0 -mtriple=aarch64-linux-gnu", 2, []], [[], [["CI", 5], ["SP", 3, 0, 1, [1, 1, 1, 1], 1], ["SP", 3, 5, 15, [1, 1, 5, 3], 1], ["SP", 3, 10, 212, [1, 53, 1, 4], 1], ["SP", 3, 15, 168, [2, 7, 1, 1], 1], ["SP", 3, 20, 15, [3, 1], 1], ["SP", 3, 23, 4, [2, 1], 1], ["SP", 3, 26, 4, [1, 2], 1], ["RE", 3, [0, 5, 10, 15, 1, 6, 11, 16, 2, 7, 12, 17, 20, 23, 26, 21, 24, 27, 3, 8, 13, 18, 22, 25, 28, 4, 9, 14, 19]], ["FSP", 7, 0, 1, 3], ["FSP", 7, 4, 2, 3], ["FSP", 7, 8, 3, 3], ["FSP", 7, 12, 4, 3], ["RE", 7, [0, 4, 8, 12, 1, 5, 9, 13, 2, 6, 10, 14, 3, 7, 11, 15]], ["CA", 3, 7, 11], ["CI", 1], ["FU", 7, [0, 1, 2, 3]], ["AN", 7, 0, 5], ["FU", 7, [1, 2, 3, 4]], ["AN", 7, 1, 4], ["FU", 7, [2, 3, 4, 5]], ["AN", 7, 2, 6], ["PR", 3, 0, "auto_unroll_max_step$64"], ["AN", 3, 28, 2], ["AN", 7, 6, 2]]]], "r": [[0.132263, 0.1328, 0.131678], 0, 11.367, 1630245533], "v": "v0.6"}
{"i": [["[\"3de659bda0b18c5fe8c5c8f8ce54ea9d\", 1, 15, 106, 84, 15, 15, 4, 4, 1, 15, 1, 1, 1, 15, 212, 168, 1, 15, 212, 168]", "opencl -keys=mali,opencl,gpu -device=mali -max_num_threads=256 -thread_warp_size=1", [2, 16, 64, 4096, 40960, 512, 2, 2], "llvm -keys=cpu -link-params=0 -mtriple=aarch64-linux-gnu", 2, []], [[], [["CI", 5], ["SP", 3, 0, 1, [1, 1, 1, 1], 1], ["SP", 3, 5, 15, [1, 1, 1, 5], 1], ["SP", 3, 10, 212, [1, 1, 106, 1], 1], ["SP", 3, 15, 168, [1, 14, 1, 2], 1], ["SP", 3, 20, 15, [3, 5], 1], ["SP", 3, 23, 4, [2, 2], 1], ["SP", 3, 26, 4, [4, 1], 1], ["RE", 3, [0, 5, 10, 15, 1, 6, 11, 16, 2, 7, 12, 17, 20, 23, 26, 21, 24, 27, 3, 8, 13, 18, 22, 25, 28, 4, 9, 14, 19]], ["FSP", 7, 0, 1, 3], ["FSP", 7, 4, 2, 3], ["FSP", 7, 8, 3, 3], ["FSP", 7, 12, 4, 3], ["RE", 7, [0, 4, 8, 12, 1, 5, 9, 13, 2, 6, 10, 14, 3, 7, 11, 15]], ["CA", 3, 7, 11], ["CI", 1], ["FU", 7, [0, 1, 2, 3]], ["AN", 7, 0, 5], ["FU", 7, [1, 2, 3, 4]], ["AN", 7, 1, 4], ["FU", 7, [2, 3, 4, 5]], ["AN", 7, 2, 6], ["PR", 3, 0, "auto_unroll_max_step$512"], ["AN", 3, 28, 2], ["AN", 7, 6, 2]]]], "r": [[1.01244, 1.01167, 1.00788], 0, 29.6133, 1630245563], "v": "v0.6"}
{"i": [["[\"3de659bda0b18c5fe8c5c8f8ce54ea9d\", 1, 15, 106, 84, 15, 15, 4, 4, 1, 15, 1, 1, 1, 15, 212, 168, 1, 15, 212, 168]", "opencl -keys=mali,opencl,gpu -device=mali -max_num_threads=256 -thread_warp_size=1", [2, 16, 64, 4096, 40960, 512, 2, 2], "llvm -keys=cpu -link-params=0 -mtriple=aarch64-linux-gnu", 2, []], [[], [["CI", 5], ["SP", 3, 0, 1, [1, 1, 1, 1], 1], ["SP", 3, 5, 15, [1, 5, 1, 3], 1], ["SP", 3, 10, 212, [2, 2, 1, 1], 1], ["SP", 3, 15, 168, [1, 4, 21, 1], 1], ["SP", 3, 20, 15, [1, 1], 1], ["SP", 3, 23, 4, [2, 2], 1], ["SP", 3, 26, 4, [1, 1], 1], ["RE", 3, [0, 5, 10, 15, 1, 6, 11, 16, 2, 7, 12, 17, 20, 23, 26, 21, 24, 27, 3, 8, 13, 18, 22, 25, 28, 4, 9, 14, 19]], ["FSP", 7, 0, 1, 3], ["FSP", 7, 4, 2, 3], ["FSP", 7, 8, 3, 3], ["FSP", 7, 12, 4, 3], ["RE", 7, [0, 4, 8, 12, 1, 5, 9, 13, 2, 6, 10, 14, 3, 7, 11, 15]], ["CA", 3, 7, 11], ["CI", 1], ["FU", 7, [0, 1, 2, 3]], ["AN", 7, 0, 5], ["FU", 7, [1, 2, 3, 4]], ["AN", 7, 1, 4], ["FU", 7, [2, 3, 4, 5]], ["AN", 7, 2, 6], ["PR", 3, 0, "auto_unroll_max_step$16"], ["AN", 3, 28, 2]]]], "r": [[0.31133, 0.313868, 0.303546], 0, 11.9027, 1630245624], "v": "v0.6"}
{"i": [["[\"3de659bda0b18c5fe8c5c8f8ce54ea9d\", 1, 15, 106, 84, 15, 15, 4, 4, 1, 15, 1, 1, 1, 15, 212, 168, 1, 15, 212, 168]", "opencl -keys=mali,opencl,gpu -device=mali -max_num_threads=256 -thread_warp_size=1", [2, 16, 64, 4096, 40960, 512, 2, 2], "llvm -keys=cpu -link-params=0 -mtriple=aarch64-linux-gnu", 2, []], [[], [["CI", 5], ["SP", 3, 0, 1, [1, 1, 1, 1], 1], ["SP", 3, 5, 15, [1, 3, 1, 5], 1], ["SP", 3, 10, 212, [1, 1, 53, 1], 1], ["SP", 3, 15, 168, [2, 6, 2, 1], 1], ["SP", 3, 20, 15, [3, 5], 1], ["SP", 3, 23, 4, [2, 1], 1], ["SP", 3, 26, 4, [1, 1], 1], ["RE", 3, [0, 5, 10, 15, 1, 6, 11, 16, 2, 7, 12, 17, 20, 23, 26, 21, 24, 27, 3, 8, 13, 18, 22, 25, 28, 4, 9, 14, 19]], ["FSP", 7, 0, 1, 3], ["FSP", 7, 4, 2, 3], ["FSP", 7, 8, 3, 3], ["FSP", 7, 12, 4, 3], ["RE", 7, [0, 4, 8, 12, 1, 5, 9, 13, 2, 6, 10, 14, 3, 7, 11, 15]], ["CA", 3, 7, 11], ["CI", 1], ["FU", 7, [0, 1, 2, 3]], ["AN", 7, 0, 5], ["FU", 7, [1, 2, 3, 4]], ["AN", 7, 1, 4], ["FU", 7, [2, 3, 4, 5]], ["AN", 7, 2, 6], ["PR", 3, 0, "auto_unroll_max_step$64"], ["AN", 3, 28, 2], ["AN", 7, 6, 2]]]], "r": [[0.549028, 0.376443, 0.381632], 0, 15.1058, 1630245639], "v": "v0.6"}
{"i": [["[\"3de659bda0b18c5fe8c5c8f8ce54ea9d\", 1, 15, 106, 84, 15, 15, 4, 4, 1, 15, 1, 1, 1, 15, 212, 168, 1, 15, 212, 168]", "opencl -keys=mali,opencl,gpu -device=mali -max_num_threads=256 -thread_warp_size=1", [2, 16, 64, 4096, 40960, 512, 2, 2], "llvm -keys=cpu -link-params=0 -mtriple=aarch64-linux-gnu", 2, []], [[], [["CI", 5], ["SP", 3, 0, 1, [1, 1, 1, 1], 1], ["SP", 3, 5, 15, [5, 3, 1, 1], 1], ["SP", 3, 10, 212, [1, 1, 212, 1], 1], ["SP", 3, 15, 168, [1, 14, 3, 1], 1], ["SP", 3, 20, 15, [15, 1], 1], ["SP", 3, 23, 4, [2, 1], 1], ["SP", 3, 26, 4, [1, 4], 1], ["RE", 3, [0, 5, 10, 15, 1, 6, 11, 16, 2, 7, 12, 17, 20, 23, 26, 21, 24, 27, 3, 8, 13, 18, 22, 25, 28, 4, 9, 14, 19]], ["FSP", 7, 0, 1, 3], ["FSP", 7, 4, 2, 3], ["FSP", 7, 8, 3, 3], ["FSP", 7, 12, 4, 3], ["RE", 7, [0, 4, 8, 12, 1, 5, 9, 13, 2, 6, 10, 14, 3, 7, 11, 15]], ["CA", 3, 7, 11], ["CI", 1], ["FU", 7, [0, 1, 2, 3]], ["AN", 7, 0, 5], ["FU", 7, [1, 2, 3, 4]], ["AN", 7, 1, 4], ["FU", 7, [2, 3, 4, 5]], ["AN", 7, 2, 6], ["PR", 3, 0, "auto_unroll_max_step$64"], ["AN", 3, 28, 2], ["AN", 7, 6, 2]]]], "r": [[0.618295, 0.769199, 0.823149], 0, 19.1634, 1630245658], "v": "v0.6"}
{"i": [["[\"3de659bda0b18c5fe8c5c8f8ce54ea9d\", 1, 15, 106, 84, 15, 15, 4, 4, 1, 15, 1, 1, 1, 15, 212, 168, 1, 15, 212, 168]", "opencl -keys=mali,opencl,gpu -device=mali -max_num_threads=256 -thread_warp_size=1", [2, 16, 64, 4096, 40960, 512, 2, 2], "llvm -keys=cpu -link-params=0 -mtriple=aarch64-linux-gnu", 2, []], [[], [["CI", 5], ["SP", 3, 0, 1, [1, 1, 1, 1], 1], ["SP", 3, 5, 15, [1, 1, 5, 1], 1], ["SP", 3, 10, 212, [2, 53, 1, 2], 1], ["SP", 3, 15, 168, [1, 1, 8, 3], 1], ["SP", 3, 20, 15, [3, 5], 1], ["SP", 3, 23, 4, [1, 4], 1], ["SP", 3, 26, 4, [2, 1], 1], ["RE", 3, [0, 5, 10, 15, 1, 6, 11, 16, 2, 7, 12, 17, 20, 23, 26, 21, 24, 27, 3, 8, 13, 18, 22, 25, 28, 4, 9, 14, 19]], ["FSP", 7, 0, 1, 3], ["FSP", 7, 4, 2, 3], ["FSP", 7, 8, 3, 3], ["FSP", 7, 12, 4, 3], ["RE", 7, [0, 4, 8, 12, 1, 5, 9, 13, 2, 6, 10, 14, 3, 7, 11, 15]], ["CA", 3, 7, 11], ["CI", 1], ["FU", 7, [0, 1, 2, 3]], ["AN", 7, 0, 5], ["FU", 7, [1, 2, 3, 4]], ["AN", 7, 1, 4], ["FU", 7, [2, 3, 4, 5]], ["AN", 7, 2, 6], ["PR", 3, 0, "auto_unroll_max_step$64"], ["AN", 3, 28, 2]]]], "r": [[0.152648, 0.155216, 0.158319], 0, 11.1324, 1630245669], "v": "v0.6"}
{"i": [["[\"3de659bda0b18c5fe8c5c8f8ce54ea9d\", 1, 15, 106, 84, 15, 15, 4, 4, 1, 15, 1, 1, 1, 15, 212, 168, 1, 15, 212, 168]", "opencl -keys=mali,opencl,gpu -device=mali -max_num_threads=256 -thread_warp_size=1", [2, 16, 64, 4096, 40960, 512, 2, 2], "llvm -keys=cpu -link-params=0 -mtriple=aarch64-linux-gnu", 2, []], [[], [["CI", 5], ["SP", 3, 0, 1, [1, 1, 1, 1], 1], ["SP", 3, 5, 15, [1, 1, 1, 15], 1], ["SP", 3, 10, 212, [2, 2, 1, 1], 1], ["SP", 3, 15, 168, [1, 2, 1, 4], 1], ["SP", 3, 20, 15, [5, 3], 1], ["SP", 3, 23, 4, [1, 1], 1], ["SP", 3, 26, 4, [1, 2], 1], ["RE", 3, [0, 5, 10, 15, 1, 6, 11, 16, 2, 7, 12, 17, 20, 23, 26, 21, 24, 27, 3, 8, 13, 18, 22, 25, 28, 4, 9, 14, 19]], ["FSP", 7, 0, 1, 3], ["FSP", 7, 4, 2, 3], ["FSP", 7, 8, 3, 3], ["FSP", 7, 12, 4, 3], ["RE", 7, [0, 4, 8, 12, 1, 5, 9, 13, 2, 6, 10, 14, 3, 7, 11, 15]], ["CA", 3, 7, 11], ["CI", 1], ["FU", 7, [0, 1, 2, 3]], ["AN", 7, 0, 5], ["FU", 7, [1, 2, 3, 4]], ["AN", 7, 1, 4], ["FU", 7, [2, 3, 4, 5]], ["AN", 7, 2, 6], ["PR", 3, 0, "auto_unroll_max_step$64"], ["AN", 3, 28, 2], ["AN", 7, 6, 2]]]], "r": [[0.131643, 0.130512, 0.131837], 0, 9.83836, 1630245679], "v": "v0.6"}
{"i": [["[\"3de659bda0b18c5fe8c5c8f8ce54ea9d\", 1, 15, 106, 84, 15, 15, 4, 4, 1, 15, 1, 1, 1, 15, 212, 168, 1, 15, 212, 168]", "opencl -keys=mali,opencl,gpu -device=mali -max_num_threads=256 -thread_warp_size=1", [2, 16, 64, 4096, 40960, 512, 2, 2], "llvm -keys=cpu -link-params=0 -mtriple=aarch64-linux-gnu", 2, []], [[], [["CI", 5], ["SP", 3, 0, 1, [1, 1, 1, 1], 1], ["SP", 3, 5, 15, [1, 1, 3, 1], 1], ["SP", 3, 10, 212, [1, 1, 2, 2], 1], ["SP", 3, 15, 168, [1, 3, 14, 4], 1], ["SP", 3, 20, 15, [1, 5], 1], ["SP", 3, 23, 4, [1, 2], 1], ["SP", 3, 26, 4, [2, 1], 1], ["RE", 3, [0, 5, 10, 15, 1, 6, 11, 16, 2, 7, 12, 17, 20, 23, 26, 21, 24, 27, 3, 8, 13, 18, 22, 25, 28, 4, 9, 14, 19]], ["FSP", 7, 0, 1, 3], ["FSP", 7, 4, 2, 3], ["FSP", 7, 8, 3, 3], ["FSP", 7, 12, 4, 3], ["RE", 7, [0, 4, 8, 12, 1, 5, 9, 13, 2, 6, 10, 14, 3, 7, 11, 15]], ["CA", 3, 7, 11], ["CI", 1], ["FU", 7, [0, 1, 2, 3]], ["AN", 7, 0, 5], ["FU", 7, [1, 2, 3, 4]], ["AN", 7, 1, 4], ["FU", 7, [2, 3, 4, 5]], ["AN", 7, 2, 6], ["PR", 3, 0, "auto_unroll_max_step$64"], ["AN", 3, 28, 2]]]], "r": [[0.182292, 0.190146, 0.191161], 0, 11.8132, 1630245741], "v": "v0.6"}
{"i": [["[\"3de659bda0b18c5fe8c5c8f8ce54ea9d\", 1, 15, 106, 84, 15, 15, 4, 4, 1, 15, 1, 1, 1, 15, 212, 168, 1, 15, 212, 168]", "opencl -keys=mali,opencl,gpu -device=mali -max_num_threads=256 -thread_warp_size=1", [2, 16, 64, 4096, 40960, 512, 2, 2], "llvm -keys=cpu -link-params=0 -mtriple=aarch64-linux-gnu", 2, []], [[], [["CI", 5], ["SP", 3, 0, 1, [1, 1, 1, 1], 1], ["SP", 3, 5, 15, [1, 1, 5, 3], 1], ["SP", 3, 10, 212, [1, 2, 1, 2], 1], ["SP", 3, 15, 168, [2, 1, 7, 3], 1], ["SP", 3, 20, 15, [3, 5], 1], ["SP", 3, 23, 4, [2, 1], 1], ["SP", 3, 26, 4, [2, 2], 1], ["RE", 3, [0, 5, 10, 15, 1, 6, 11, 16, 2, 7, 12, 17, 20, 23, 26, 21, 24, 27, 3, 8, 13, 18, 22, 25, 28, 4, 9, 14, 19]], ["FSP", 7, 0, 1, 3], ["FSP", 7, 4, 2, 3], ["FSP", 7, 8, 3, 3], ["FSP", 7, 12, 4, 3], ["RE", 7, [0, 4, 8, 12, 1, 5, 9, 13, 2, 6, 10, 14, 3, 7, 11, 15]], ["CA", 3, 7, 11], ["CI", 1], ["FU", 7, [0, 1, 2, 3]], ["AN", 7, 0, 5], ["FU", 7, [1, 2, 3, 4]], ["AN", 7, 1, 4], ["FU", 7, [2, 3, 4, 5]], ["AN", 7, 2, 6], ["PR", 3, 0, "auto_unroll_max_step$0"], ["AN", 3, 28, 2]]]], "r": [[0.542442, 0.567993, 0.566422], 0, 14.6177, 1630245755], "v": "v0.6"}
{"i": [["[\"3de659bda0b18c5fe8c5c8f8ce54ea9d\", 1, 15, 106, 84, 15, 15, 4, 4, 1, 15, 1, 1, 1, 15, 212, 168, 1, 15, 212, 168]", "opencl -keys=mali,opencl,gpu -device=mali -max_num_threads=256 -thread_warp_size=1", [2, 16, 64, 4096, 40960, 512, 2, 2], "llvm -keys=cpu -link-params=0 -mtriple=aarch64-linux-gnu", 2, []], [[], [["CI", 5], ["SP", 3, 0, 1, [1, 1, 1, 1], 1], ["SP", 3, 5, 15, [1, 3, 1, 5], 1], ["SP", 3, 10, 212, [1, 1, 1, 1], 1], ["SP", 3, 15, 168, [2, 7, 1, 3], 1], ["SP", 3, 20, 15, [1, 15], 1], ["SP", 3, 23, 4, [1, 2], 1], ["SP", 3, 26, 4, [2, 1], 1], ["RE", 3, [0, 5, 10, 15, 1, 6, 11, 16, 2, 7, 12, 17, 20, 23, 26, 21, 24, 27, 3, 8, 13, 18, 22, 25, 28, 4, 9, 14, 19]], ["FSP", 7, 0, 1, 3], ["FSP", 7, 4, 2, 3], ["FSP", 7, 8, 3, 3], ["FSP", 7, 12, 4, 3], ["RE", 7, [0, 4, 8, 12, 1, 5, 9, 13, 2, 6, 10, 14, 3, 7, 11, 15]], ["CA", 3, 7, 11], ["CI", 1], ["FU", 7, [0, 1, 2, 3]], ["AN", 7, 0, 5], ["FU", 7, [1, 2, 3, 4]], ["AN", 7, 1, 4], ["FU", 7, [2, 3, 4, 5]], ["AN", 7, 2, 6], ["PR", 3, 0, "auto_unroll_max_step$0"], ["AN", 3, 28, 2], ["AN", 7, 6, 2]]]], "r": [[0.148292, 0.149107, 0.170319], 0, 10.3226, 1630245765], "v": "v0.6"}
{"i": [["[\"3de659bda0b18c5fe8c5c8f8ce54ea9d\", 1, 15, 106, 84, 15, 15, 4, 4, 1, 15, 1, 1, 1, 15, 212, 168, 1, 15, 212, 168]", "opencl -keys=mali,opencl,gpu -device=mali -max_num_threads=256 -thread_warp_size=1", [2, 16, 64, 4096, 40960, 512, 2, 2], "llvm -keys=cpu -link-params=0 -mtriple=aarch64-linux-gnu", 2, []], [[], [["CI", 5], ["SP", 3, 0, 1, [1, 1, 1, 1], 1], ["SP", 3, 5, 15, [1, 5, 1, 1], 1], ["SP", 3, 10, 212, [1, 2, 53, 1], 1], ["SP", 3, 15, 168, [1, 2, 14, 3], 1], ["SP", 3, 20, 15, [5, 1], 1], ["SP", 3, 23, 4, [4, 1], 1], ["SP", 3, 26, 4, [1, 4], 1], ["RE", 3, [0, 5, 10, 15, 1, 6, 11, 16, 2, 7, 12, 17, 20, 23, 26, 21, 24, 27, 3, 8, 13, 18, 22, 25, 28, 4, 9, 14, 19]], ["FSP", 7, 0, 1, 3], ["FSP", 7, 4, 2, 3], ["FSP", 7, 8, 3, 3], ["FSP", 7, 12, 4, 3], ["RE", 7, [0, 4, 8, 12, 1, 5, 9, 13, 2, 6, 10, 14, 3, 7, 11, 15]], ["CA", 3, 7, 11], ["CI", 1], ["FU", 7, [0, 1, 2, 3]], ["AN", 7, 0, 5], ["FU", 7, [1, 2, 3, 4]], ["AN", 7, 1, 4], ["FU", 7, [2, 3, 4, 5]], ["AN", 7, 2, 6], ["PR", 3, 0, "auto_unroll_max_step$0"], ["AN", 3, 28, 2]]]], "r": [[0.555727, 0.552826, 0.585827], 0, 14.3107, 1630245780], "v": "v0.6"}
{"i": [["[\"3de659bda0b18c5fe8c5c8f8ce54ea9d\", 1, 15, 106, 84, 15, 15, 4, 4, 1, 15, 1, 1, 1, 15, 212, 168, 1, 15, 212, 168]", "opencl -keys=mali,opencl,gpu -device=mali -max_num_threads=256 -thread_warp_size=1", [2, 16, 64, 4096, 40960, 512, 2, 2], "llvm -keys=cpu -link-params=0 -mtriple=aarch64-linux-gnu", 2, []], [[], [["CI", 5], ["SP", 3, 0, 1, [1, 1, 1, 1], 1], ["SP", 3, 5, 15, [1, 1, 1, 5], 1], ["SP", 3, 10, 212, [1, 1, 212, 1], 1], ["SP", 3, 15, 168, [1, 14, 1, 2], 1], ["SP", 3, 20, 15, [3, 5], 1], ["SP", 3, 23, 4, [1, 1], 1], ["SP", 3, 26, 4, [2, 2], 1], ["RE", 3, [0, 5, 10, 15, 1, 6, 11, 16, 2, 7, 12, 17, 20, 23, 26, 21, 24, 27, 3, 8, 13, 18, 22, 25, 28, 4, 9, 14, 19]], ["FSP", 7, 0, 1, 3], ["FSP", 7, 4, 2, 3], ["FSP", 7, 8, 3, 3], ["FSP", 7, 12, 4, 3], ["RE", 7, [0, 4, 8, 12, 1, 5, 9, 13, 2, 6, 10, 14, 3, 7, 11, 15]], ["CA", 3, 7, 11], ["CI", 1], ["FU", 7, [0, 1, 2, 3]], ["AN", 7, 0, 5], ["FU", 7, [1, 2, 3, 4]], ["AN", 7, 1, 4], ["FU", 7, [2, 3, 4, 5]], ["AN", 7, 2, 6], ["PR", 3, 0, "auto_unroll_max_step$512"], ["AN", 3, 28, 2], ["AN", 7, 6, 2]]]], "r": [[0.217133, 0.222053, 0.231343], 0, 13.2216, 1630245793], "v": "v0.6"}
{"i": [["[\"3de659bda0b18c5fe8c5c8f8ce54ea9d\", 1, 15, 106, 84, 15, 15, 4, 4, 1, 15, 1, 1, 1, 15, 212, 168, 1, 15, 212, 168]", "opencl -keys=mali,opencl,gpu -device=mali -max_num_threads=256 -thread_warp_size=1", [2, 16, 64, 4096, 40960, 512, 2, 2], "llvm -keys=cpu -link-params=0 -mtriple=aarch64-linux-gnu", 2, []], [[], [["CI", 5], ["SP", 3, 0, 1, [1, 1, 1, 1], 1], ["SP", 3, 5, 15, [1, 1, 5, 3], 1], ["SP", 3, 10, 212, [1, 2, 1, 1], 1], ["SP", 3, 15, 168, [1, 12, 1, 1], 1], ["SP", 3, 20, 15, [3, 1], 1], ["SP", 3, 23, 4, [1, 1], 1], ["SP", 3, 26, 4, [1, 4], 1], ["RE", 3, [0, 5, 10, 15, 1, 6, 11, 16, 2, 7, 12, 17, 20, 23, 26, 21, 24, 27, 3, 8, 13, 18, 22, 25, 28, 4, 9, 14, 19]], ["FSP", 7, 0, 1, 3], ["FSP", 7, 4, 2, 3], ["FSP", 7, 8, 3, 3], ["FSP", 7, 12, 4, 3], ["RE", 7, [0, 4, 8, 12, 1, 5, 9, 13, 2, 6, 10, 14, 3, 7, 11, 15]], ["CA", 3, 7, 11], ["CI", 1], ["FU", 7, [0, 1, 2, 3]], ["AN", 7, 0, 5], ["FU", 7, [1, 2, 3, 4]], ["AN", 7, 1, 4], ["FU", 7, [2, 3, 4, 5]], ["AN", 7, 2, 6], ["PR", 3, 0, "auto_unroll_max_step$512"], ["AN", 3, 28, 2], ["AN", 7, 6, 2]]]], "r": [[0.685767, 0.702592, 0.691122], 0, 31.5373, 1630245824], "v": "v0.6"}
{"i": [["[\"3de659bda0b18c5fe8c5c8f8ce54ea9d\", 1, 15, 106, 84, 15, 15, 4, 4, 1, 15, 1, 1, 1, 15, 212, 168, 1, 15, 212, 168]", "opencl -keys=mali,opencl,gpu -device=mali -max_num_threads=256 -thread_warp_size=1", [2, 16, 64, 4096, 40960, 512, 2, 2], "llvm -keys=cpu -link-params=0 -mtriple=aarch64-linux-gnu", 2, []], [[], [["CI", 5], ["SP", 3, 0, 1, [1, 1, 1, 1], 1], ["SP", 3, 5, 15, [1, 1, 5, 1], 1], ["SP", 3, 10, 212, [1, 53, 4, 1], 1], ["SP", 3, 15, 168, [2, 1, 1, 28], 1], ["SP", 3, 20, 15, [3, 5], 1], ["SP", 3, 23, 4, [2, 2], 1], ["SP", 3, 26, 4, [1, 2], 1], ["RE", 3, [0, 5, 10, 15, 1, 6, 11, 16, 2, 7, 12, 17, 20, 23, 26, 21, 24, 27, 3, 8, 13, 18, 22, 25, 28, 4, 9, 14, 19]], ["FSP", 7, 0, 1, 3], ["FSP", 7, 4, 2, 3], ["FSP", 7, 8, 3, 3], ["FSP", 7, 12, 4, 3], ["RE", 7, [0, 4, 8, 12, 1, 5, 9, 13, 2, 6, 10, 14, 3, 7, 11, 15]], ["CA", 3, 7, 11], ["CI", 1], ["FU", 7, [0, 1, 2, 3]], ["AN", 7, 0, 5], ["FU", 7, [1, 2, 3, 4]], ["AN", 7, 1, 4], ["FU", 7, [2, 3, 4, 5]], ["AN", 7, 2, 6], ["PR", 3, 0, "auto_unroll_max_step$0"]]]], "r": [[0.505395, 0.513935, 0.518827], 0, 14.5575, 1630245846], "v": "v0.6"}
{"i": [["[\"3de659bda0b18c5fe8c5c8f8ce54ea9d\", 1, 15, 106, 84, 15, 15, 4, 4, 1, 15, 1, 1, 1, 15, 212, 168, 1, 15, 212, 168]", "opencl -keys=mali,opencl,gpu -device=mali -max_num_threads=256 -thread_warp_size=1", [2, 16, 64, 4096, 40960, 512, 2, 2], "llvm -keys=cpu -link-params=0 -mtriple=aarch64-linux-gnu", 2, []], [[], [["CI", 5], ["SP", 3, 0, 1, [1, 1, 1, 1], 1], ["SP", 3, 5, 15, [1, 5, 1, 1], 1], ["SP", 3, 10, 212, [1, 1, 53, 2], 1], ["SP", 3, 15, 168, [1, 6, 2, 2], 1], ["SP", 3, 20, 15, [3, 1], 1], ["SP", 3, 23, 4, [1, 2], 1], ["SP", 3, 26, 4, [2, 1], 1], ["RE", 3, [0, 5, 10, 15, 1, 6, 11, 16, 2, 7, 12, 17, 20, 23, 26, 21, 24, 27, 3, 8, 13, 18, 22, 25, 28, 4, 9, 14, 19]], ["FSP", 7, 0, 1, 3], ["FSP", 7, 4, 2, 3], ["FSP", 7, 8, 3, 3], ["FSP", 7, 12, 4, 3], ["RE", 7, [0, 4, 8, 12, 1, 5, 9, 13, 2, 6, 10, 14, 3, 7, 11, 15]], ["CA", 3, 7, 11], ["CI", 1], ["FU", 7, [0, 1, 2, 3]], ["AN", 7, 0, 5], ["FU", 7, [1, 2, 3, 4]], ["AN", 7, 1, 4], ["FU", 7, [2, 3, 4, 5]], ["AN", 7, 2, 6], ["PR", 3, 0, "auto_unroll_max_step$512"], ["AN", 3, 28, 2], ["AN", 7, 6, 2]]]], "r": [[0.285894, 0.285174, 0.283302], 0, 12.2553, 1630245858], "v": "v0.6"}
{"i": [["[\"3de659bda0b18c5fe8c5c8f8ce54ea9d\", 1, 15, 106, 84, 15, 15, 4, 4, 1, 15, 1, 1, 1, 15, 212, 168, 1, 15, 212, 168]", "opencl -keys=mali,opencl,gpu -device=mali -max_num_threads=256 -thread_warp_size=1", [2, 16, 64, 4096, 40960, 512, 2, 2], "llvm -keys=cpu -link-params=0 -mtriple=aarch64-linux-gnu", 2, []], [[], [["CI", 5], ["SP", 3, 0, 1, [1, 1, 1, 1], 1], ["SP", 3, 5, 15, [1, 15, 1, 1], 1], ["SP", 3, 10, 212, [4, 1, 53, 1], 1], ["SP", 3, 15, 168, [1, 14, 2, 1], 1], ["SP", 3, 20, 15, [5, 3], 1], ["SP", 3, 23, 4, [2, 2], 1], ["SP", 3, 26, 4, [2, 2], 1], ["RE", 3, [0, 5, 10, 15, 1, 6, 11, 16, 2, 7, 12, 17, 20, 23, 26, 21, 24, 27, 3, 8, 13, 18, 22, 25, 28, 4, 9, 14, 19]], ["FSP", 7, 0, 1, 3], ["FSP", 7, 4, 2, 3], ["FSP", 7, 8, 3, 3], ["FSP", 7, 12, 4, 3], ["RE", 7, [0, 4, 8, 12, 1, 5, 9, 13, 2, 6, 10, 14, 3, 7, 11, 15]], ["CA", 3, 7, 11], ["CI", 1], ["FU", 7, [0, 1, 2, 3]], ["AN", 7, 0, 5], ["FU", 7, [1, 2, 3, 4]], ["AN", 7, 1, 4], ["FU", 7, [2, 3, 4, 5]], ["AN", 7, 2, 6], ["PR", 3, 0, "auto_unroll_max_step$0"], ["AN", 3, 28, 2], ["AN", 7, 6, 2]]]], "r": [[0.207031, 0.216384, 0.210723], 0, 10.501, 1630245868], "v": "v0.6"}
{"i": [["[\"3de659bda0b18c5fe8c5c8f8ce54ea9d\", 1, 15, 106, 84, 15, 15, 4, 4, 1, 15, 1, 1, 1, 15, 212, 168, 1, 15, 212, 168]", "opencl -keys=mali,opencl,gpu -device=mali -max_num_threads=256 -thread_warp_size=1", [2, 16, 64, 4096, 40960, 512, 2, 2], "llvm -keys=cpu -link-params=0 -mtriple=aarch64-linux-gnu", 2, []], [[], [["CI", 5], ["SP", 3, 0, 1, [1, 1, 1, 1], 1], ["SP", 3, 5, 15, [1, 1, 3, 5], 1], ["SP", 3, 10, 212, [1, 2, 1, 1], 1], ["SP", 3, 15, 168, [1, 1, 7, 4], 1], ["SP", 3, 20, 15, [1, 5], 1], ["SP", 3, 23, 4, [2, 2], 1], ["SP", 3, 26, 4, [1, 4], 1], ["RE", 3, [0, 5, 10, 15, 1, 6, 11, 16, 2, 7, 12, 17, 20, 23, 26, 21, 24, 27, 3, 8, 13, 18, 22, 25, 28, 4, 9, 14, 19]], ["FSP", 7, 0, 1, 3], ["FSP", 7, 4, 2, 3], ["FSP", 7, 8, 3, 3], ["FSP", 7, 12, 4, 3], ["RE", 7, [0, 4, 8, 12, 1, 5, 9, 13, 2, 6, 10, 14, 3, 7, 11, 15]], ["CA", 3, 7, 11], ["CI", 1], ["FU", 7, [0, 1, 2, 3]], ["AN", 7, 0, 5], ["FU", 7, [1, 2, 3, 4]], ["AN", 7, 1, 4], ["FU", 7, [2, 3, 4, 5]], ["AN", 7, 2, 6], ["PR", 3, 0, "auto_unroll_max_step$64"], ["AN", 3, 28, 2]]]], "r": [[0.198005, 0.200531, 0.205795], 0, 12.4533, 1630245881], "v": "v0.6"}
{"i": [["[\"3de659bda0b18c5fe8c5c8f8ce54ea9d\", 1, 15, 106, 84, 15, 15, 4, 4, 1, 15, 1, 1, 1, 15, 212, 168, 1, 15, 212, 168]", "opencl -keys=mali,opencl,gpu -device=mali -max_num_threads=256 -thread_warp_size=1", [2, 16, 64, 4096, 40960, 512, 2, 2], "llvm -keys=cpu -link-params=0 -mtriple=aarch64-linux-gnu", 2, []], [[], [["CI", 5], ["SP", 3, 0, 1, [1, 1, 1, 1], 1], ["SP", 3, 5, 15, [1, 1, 5, 3], 1], ["SP", 3, 10, 212, [1, 1, 2, 53], 1], ["SP", 3, 15, 168, [2, 84, 1, 1], 1], ["SP", 3, 20, 15, [3, 1], 1], ["SP", 3, 23, 4, [2, 2], 1], ["SP", 3, 26, 4, [1, 2], 1], ["RE", 3, [0, 5, 10, 15, 1, 6, 11, 16, 2, 7, 12, 17, 20, 23, 26, 21, 24, 27, 3, 8, 13, 18, 22, 25, 28, 4, 9, 14, 19]], ["FSP", 7, 0, 1, 3], ["FSP", 7, 4, 2, 3], ["FSP", 7, 8, 3, 3], ["FSP", 7, 12, 4, 3], ["RE", 7, [0, 4, 8, 12, 1, 5, 9, 13, 2, 6, 10, 14, 3, 7, 11, 15]], ["CA", 3, 7, 11], ["CI", 1], ["FU", 7, [0, 1, 2, 3]], ["AN", 7, 0, 5], ["FU", 7, [1, 2, 3, 4]], ["AN", 7, 1, 4], ["FU", 7, [2, 3, 4, 5]], ["AN", 7, 2, 6], ["PR", 3, 0, "auto_unroll_max_step$0"], ["AN", 3, 28, 2], ["AN", 7, 6, 2]]]], "r": [[0.942005, 0.938172, 0.926507], 0, 20.0995, 1630245901], "v": "v0.6"}
{"i": [["[\"3de659bda0b18c5fe8c5c8f8ce54ea9d\", 1, 15, 106, 84, 15, 15, 4, 4, 1, 15, 1, 1, 1, 15, 212, 168, 1, 15, 212, 168]", "opencl -keys=mali,opencl,gpu -device=mali -max_num_threads=256 -thread_warp_size=1", [2, 16, 64, 4096, 40960, 512, 2, 2], "llvm -keys=cpu -link-params=0 -mtriple=aarch64-linux-gnu", 2, []], [[], [["CI", 5], ["SP", 3, 0, 1, [1, 1, 1, 1], 1], ["SP", 3, 5, 15, [1, 1, 1, 1], 1], ["SP", 3, 10, 212, [2, 1, 1, 1], 1], ["SP", 3, 15, 168, [1, 4, 1, 2], 1], ["SP", 3, 20, 15, [15, 1], 1], ["SP", 3, 23, 4, [1, 2], 1], ["SP", 3, 26, 4, [1, 1], 1], ["RE", 3, [0, 5, 10, 15, 1, 6, 11, 16, 2, 7, 12, 17, 20, 23, 26, 21, 24, 27, 3, 8, 13, 18, 22, 25, 28, 4, 9, 14, 19]], ["FSP", 7, 0, 1, 3], ["FSP", 7, 4, 2, 3], ["FSP", 7, 8, 3, 3], ["FSP", 7, 12, 4, 3], ["RE", 7, [0, 4, 8, 12, 1, 5, 9, 13, 2, 6, 10, 14, 3, 7, 11, 15]], ["CA", 3, 7, 11], ["CI", 1], ["FU", 7, [0, 1, 2, 3]], ["AN", 7, 0, 5], ["FU", 7, [1, 2, 3, 4]], ["AN", 7, 1, 4], ["FU", 7, [2, 3, 4, 5]], ["AN", 7, 2, 6], ["PR", 3, 0, "auto_unroll_max_step$512"], ["AN", 3, 28, 2], ["AN", 7, 6, 2]]]], "r": [[0.174036, 0.172197, 0.172862], 0, 12.4393, 1630245913], "v": "v0.6"}
{"i": [["[\"3de659bda0b18c5fe8c5c8f8ce54ea9d\", 1, 15, 106, 84, 15, 15, 4, 4, 1, 15, 1, 1, 1, 15, 212, 168, 1, 15, 212, 168]", "opencl -keys=mali,opencl,gpu -device=mali -max_num_threads=256 -thread_warp_size=1", [2, 16, 64, 4096, 40960, 512, 2, 2], "llvm -keys=cpu -link-params=0 -mtriple=aarch64-linux-gnu", 2, []], [[], [["CI", 5], ["SP", 3, 0, 1, [1, 1, 1, 1], 1], ["SP", 3, 5, 15, [1, 1, 1, 15], 1], ["SP", 3, 10, 212, [2, 1, 2, 1], 1], ["SP", 3, 15, 168, [1, 8, 7, 3], 1], ["SP", 3, 20, 15, [1, 3], 1], ["SP", 3, 23, 4, [4, 1], 1], ["SP", 3, 26, 4, [2, 1], 1], ["RE", 3, [0, 5, 10, 15, 1, 6, 11, 16, 2, 7, 12, 17, 20, 23, 26, 21, 24, 27, 3, 8, 13, 18, 22, 25, 28, 4, 9, 14, 19]], ["FSP", 7, 0, 1, 3], ["FSP", 7, 4, 2, 3], ["FSP", 7, 8, 3, 3], ["FSP", 7, 12, 4, 3], ["RE", 7, [0, 4, 8, 12, 1, 5, 9, 13, 2, 6, 10, 14, 3, 7, 11, 15]], ["CA", 3, 7, 11], ["CI", 1], ["FU", 7, [0, 1, 2, 3]], ["AN", 7, 0, 5], ["FU", 7, [1, 2, 3, 4]], ["AN", 7, 1, 4], ["FU", 7, [2, 3, 4, 5]], ["AN", 7, 2, 6], ["PR", 3, 0, "auto_unroll_max_step$0"], ["AN", 3, 28, 2]]]], "r": [[0.614316, 0.618735, 0.607261], 0, 16.099, 1630245929], "v": "v0.6"}
{"i": [["[\"3de659bda0b18c5fe8c5c8f8ce54ea9d\", 1, 15, 106, 84, 15, 15, 4, 4, 1, 15, 1, 1, 1, 15, 212, 168, 1, 15, 212, 168]", "opencl -keys=mali,opencl,gpu -device=mali -max_num_threads=256 -thread_warp_size=1", [2, 16, 64, 4096, 40960, 512, 2, 2], "llvm -keys=cpu -link-params=0 -mtriple=aarch64-linux-gnu", 2, []], [[], [["CI", 5], ["SP", 3, 0, 1, [1, 1, 1, 1], 1], ["SP", 3, 5, 15, [1, 1, 5, 1], 1], ["SP", 3, 10, 212, [1, 53, 1, 1], 1], ["SP", 3, 15, 168, [1, 1, 84, 1], 1], ["SP", 3, 20, 15, [1, 3], 1], ["SP", 3, 23, 4, [1, 4], 1], ["SP", 3, 26, 4, [4, 1], 1], ["RE", 3, [0, 5, 10, 15, 1, 6, 11, 16, 2, 7, 12, 17, 20, 23, 26, 21, 24, 27, 3, 8, 13, 18, 22, 25, 28, 4, 9, 14, 19]], ["FSP", 7, 0, 1, 3], ["FSP", 7, 4, 2, 3], ["FSP", 7, 8, 3, 3], ["FSP", 7, 12, 4, 3], ["RE", 7, [0, 4, 8, 12, 1, 5, 9, 13, 2, 6, 10, 14, 3, 7, 11, 15]], ["CA", 3, 7, 11], ["CI", 1], ["FU", 7, [0, 1, 2, 3]], ["AN", 7, 0, 5], ["FU", 7, [1, 2, 3, 4]], ["AN", 7, 1, 4], ["FU", 7, [2, 3, 4, 5]], ["AN", 7, 2, 6], ["PR", 3, 0, "auto_unroll_max_step$512"], ["AN", 3, 28, 2]]]], "r": [[0.311721, 0.31115, 0.314314], 0, 12.5966, 1630245941], "v": "v0.6"}
{"i": [["[\"3de659bda0b18c5fe8c5c8f8ce54ea9d\", 1, 15, 106, 84, 15, 15, 4, 4, 1, 15, 1, 1, 1, 15, 212, 168, 1, 15, 212, 168]", "opencl -keys=mali,opencl,gpu -device=mali -max_num_threads=256 -thread_warp_size=1", [2, 16, 64, 4096, 40960, 512, 2, 2], "llvm -keys=cpu -link-params=0 -mtriple=aarch64-linux-gnu", 2, []], [[], [["CI", 5], ["SP", 3, 0, 1, [1, 1, 1, 1], 1], ["SP", 3, 5, 15, [1, 3, 1, 5], 1], ["SP", 3, 10, 212, [1, 1, 1, 1], 1], ["SP", 3, 15, 168, [14, 1, 1, 3], 1], ["SP", 3, 20, 15, [1, 1], 1], ["SP", 3, 23, 4, [1, 2], 1], ["SP", 3, 26, 4, [4, 1], 1], ["RE", 3, [0, 5, 10, 15, 1, 6, 11, 16, 2, 7, 12, 17, 20, 23, 26, 21, 24, 27, 3, 8, 13, 18, 22, 25, 28, 4, 9, 14, 19]], ["FSP", 7, 0, 1, 3], ["FSP", 7, 4, 2, 3], ["FSP", 7, 8, 3, 3], ["FSP", 7, 12, 4, 3], ["RE", 7, [0, 4, 8, 12, 1, 5, 9, 13, 2, 6, 10, 14, 3, 7, 11, 15]], ["CA", 3, 7, 11], ["CI", 1], ["FU", 7, [0, 1, 2, 3]], ["AN", 7, 0, 5], ["FU", 7, [1, 2, 3, 4]], ["AN", 7, 1, 4], ["FU", 7, [2, 3, 4, 5]], ["AN", 7, 2, 6], ["PR", 3, 0, "auto_unroll_max_step$0"], ["AN", 3, 28, 2], ["AN", 7, 6, 2]]]], "r": [[0.798081, 0.787742, 0.789629], 0, 23.6197, 1630245965], "v": "v0.6"}
{"i": [["[\"3de659bda0b18c5fe8c5c8f8ce54ea9d\", 1, 15, 106, 84, 15, 15, 4, 4, 1, 15, 1, 1, 1, 15, 212, 168, 1, 15, 212, 168]", "opencl -keys=mali,opencl,gpu -device=mali -max_num_threads=256 -thread_warp_size=1", [2, 16, 64, 4096, 40960, 512, 2, 2], "llvm -keys=cpu -link-params=0 -mtriple=aarch64-linux-gnu", 2, []], [[], [["CI", 5], ["SP", 3, 0, 1, [1, 1, 1, 1], 1], ["SP", 3, 5, 15, [1, 5, 1, 3], 1], ["SP", 3, 10, 212, [1, 2, 53, 2], 1], ["SP", 3, 15, 168, [1, 7, 1, 4], 1], ["SP", 3, 20, 15, [15, 1], 1], ["SP", 3, 23, 4, [1, 1], 1], ["SP", 3, 26, 4, [1, 4], 1], ["RE", 3, [0, 5, 10, 15, 1, 6, 11, 16, 2, 7, 12, 17, 20, 23, 26, 21, 24, 27, 3, 8, 13, 18, 22, 25, 28, 4, 9, 14, 19]], ["FSP", 7, 0, 1, 3], ["FSP", 7, 4, 2, 3], ["FSP", 7, 8, 3, 3], ["FSP", 7, 12, 4, 3], ["RE", 7, [0, 4, 8, 12, 1, 5, 9, 13, 2, 6, 10, 14, 3, 7, 11, 15]], ["CA", 3, 7, 11], ["CI", 1], ["FU", 7, [0, 1, 2, 3]], ["AN", 7, 0, 5], ["FU", 7, [1, 2, 3, 4]], ["AN", 7, 1, 4], ["FU", 7, [2, 3, 4, 5]], ["AN", 7, 2, 6], ["PR", 3, 0, "auto_unroll_max_step$16"], ["AN", 3, 28, 2], ["AN", 7, 6, 2]]]], "r": [[0.163317, 0.166028, 0.179668], 0, 10.1036, 1630245975], "v": "v0.6"}
{"i": [["[\"3de659bda0b18c5fe8c5c8f8ce54ea9d\", 1, 15, 106, 84, 15, 15, 4, 4, 1, 15, 1, 1, 1, 15, 212, 168, 1, 15, 212, 168]", "opencl -keys=mali,opencl,gpu -device=mali -max_num_threads=256 -thread_warp_size=1", [2, 16, 64, 4096, 40960, 512, 2, 2], "llvm -keys=cpu -link-params=0 -mtriple=aarch64-linux-gnu", 2, []], [[], [["CI", 5], ["SP", 3, 0, 1, [1, 1, 1, 1], 1], ["SP", 3, 5, 15, [1, 3, 1, 1], 1], ["SP", 3, 10, 212, [1, 2, 106, 1], 1], ["SP", 3, 15, 168, [1, 1, 56, 1], 1], ["SP", 3, 20, 15, [5, 1], 1], ["SP", 3, 23, 4, [4, 1], 1], ["SP", 3, 26, 4, [1, 1], 1], ["RE", 3, [0, 5, 10, 15, 1, 6, 11, 16, 2, 7, 12, 17, 20, 23, 26, 21, 24, 27, 3, 8, 13, 18, 22, 25, 28, 4, 9, 14, 19]], ["FSP", 7, 0, 1, 3], ["FSP", 7, 4, 2, 3], ["FSP", 7, 8, 3, 3], ["FSP", 7, 12, 4, 3], ["RE", 7, [0, 4, 8, 12, 1, 5, 9, 13, 2, 6, 10, 14, 3, 7, 11, 15]], ["CA", 3, 7, 11], ["CI", 1], ["FU", 7, [0, 1, 2, 3]], ["AN", 7, 0, 5], ["FU", 7, [1, 2, 3, 4]], ["AN", 7, 1, 4], ["FU", 7, [2, 3, 4, 5]], ["AN", 7, 2, 6], ["PR", 3, 0, "auto_unroll_max_step$64"], ["AN", 3, 28, 2]]]], "r": [[1.41428, 1.48122, 1.44344], 0, 27.95, 1630246003], "v": "v0.6"}
{"i": [["[\"3de659bda0b18c5fe8c5c8f8ce54ea9d\", 1, 15, 106, 84, 15, 15, 4, 4, 1, 15, 1, 1, 1, 15, 212, 168, 1, 15, 212, 168]", "opencl -keys=mali,opencl,gpu -device=mali -max_num_threads=256 -thread_warp_size=1", [2, 16, 64, 4096, 40960, 512, 2, 2], "llvm -keys=cpu -link-params=0 -mtriple=aarch64-linux-gnu", 2, []], [[], [["CI", 5], ["SP", 3, 0, 1, [1, 1, 1, 1], 1], ["SP", 3, 5, 15, [1, 3, 5, 1], 1], ["SP", 3, 10, 212, [1, 1, 1, 1], 1], ["SP", 3, 15, 168, [2, 1, 4, 1], 1], ["SP", 3, 20, 15, [15, 1], 1], ["SP", 3, 23, 4, [2, 1], 1], ["SP", 3, 26, 4, [2, 2], 1], ["RE", 3, [0, 5, 10, 15, 1, 6, 11, 16, 2, 7, 12, 17, 20, 23, 26, 21, 24, 27, 3, 8, 13, 18, 22, 25, 28, 4, 9, 14, 19]], ["FSP", 7, 0, 1, 3], ["FSP", 7, 4, 2, 3], ["FSP", 7, 8, 3, 3], ["FSP", 7, 12, 4, 3], ["RE", 7, [0, 4, 8, 12, 1, 5, 9, 13, 2, 6, 10, 14, 3, 7, 11, 15]], ["CA", 3, 7, 11], ["CI", 1], ["FU", 7, [0, 1, 2, 3]], ["AN", 7, 0, 5], ["FU", 7, [1, 2, 3, 4]], ["AN", 7, 1, 4], ["FU", 7, [2, 3, 4, 5]], ["AN", 7, 2, 6], ["PR", 3, 0, "auto_unroll_max_step$0"], ["AN", 3, 28, 2], ["AN", 7, 6, 2]]]], "r": [[0.128675, 0.131472, 0.13136], 0, 8.28904, 1630246063], "v": "v0.6"}
{"i": [["[\"3de659bda0b18c5fe8c5c8f8ce54ea9d\", 1, 15, 106, 84, 15, 15, 4, 4, 1, 15, 1, 1, 1, 15, 212, 168, 1, 15, 212, 168]", "opencl -keys=mali,opencl,gpu -device=mali -max_num_threads=256 -thread_warp_size=1", [2, 16, 64, 4096, 40960, 512, 2, 2], "llvm -keys=cpu -link-params=0 -mtriple=aarch64-linux-gnu", 2, []], [[], [["CI", 5], ["SP", 3, 0, 1, [1, 1, 1, 1], 1], ["SP", 3, 5, 15, [1, 1, 5, 3], 1], ["SP", 3, 10, 212, [1, 53, 1, 4], 1], ["SP", 3, 15, 168, [2, 7, 1, 1], 1], ["SP", 3, 20, 15, [3, 1], 1], ["SP", 3, 23, 4, [1, 1], 1], ["SP", 3, 26, 4, [1, 1], 1], ["RE", 3, [0, 5, 10, 15, 1, 6, 11, 16, 2, 7, 12, 17, 20, 23, 26, 21, 24, 27, 3, 8, 13, 18, 22, 25, 28, 4, 9, 14, 19]], ["FSP", 7, 0, 1, 3], ["FSP", 7, 4, 2, 3], ["FSP", 7, 8, 3, 3], ["FSP", 7, 12, 4, 3], ["RE", 7, [0, 4, 8, 12, 1, 5, 9, 13, 2, 6, 10, 14, 3, 7, 11, 15]], ["CA", 3, 7, 11], ["CI", 1], ["FU", 7, [0, 1, 2, 3]], ["AN", 7, 0, 5], ["FU", 7, [1, 2, 3, 4]], ["AN", 7, 1, 4], ["FU", 7, [2, 3, 4, 5]], ["AN", 7, 2, 6], ["PR", 3, 0, "auto_unroll_max_step$64"], ["AN", 3, 28, 2], ["AN", 7, 6, 2]]]], "r": [[0.135197, 0.132472, 0.132818], 0, 10.1436, 1630246073], "v": "v0.6"}
{"i": [["[\"3de659bda0b18c5fe8c5c8f8ce54ea9d\", 1, 15, 106, 84, 15, 15, 4, 4, 1, 15, 1, 1, 1, 15, 212, 168, 1, 15, 212, 168]", "opencl -keys=mali,opencl,gpu -device=mali -max_num_threads=256 -thread_warp_size=1", [2, 16, 64, 4096, 40960, 512, 2, 2], "llvm -keys=cpu -link-params=0 -mtriple=aarch64-linux-gnu", 2, []], [[], [["CI", 5], ["SP", 3, 0, 1, [1, 1, 1, 1], 1], ["SP", 3, 5, 15, [1, 3, 1, 5], 1], ["SP", 3, 10, 212, [1, 1, 2, 2], 1], ["SP", 3, 15, 168, [1, 14, 3, 1], 1], ["SP", 3, 20, 15, [1, 5], 1], ["SP", 3, 23, 4, [4, 1], 1], ["SP", 3, 26, 4, [1, 4], 1], ["RE", 3, [0, 5, 10, 15, 1, 6, 11, 16, 2, 7, 12, 17, 20, 23, 26, 21, 24, 27, 3, 8, 13, 18, 22, 25, 28, 4, 9, 14, 19]], ["FSP", 7, 0, 1, 3], ["FSP", 7, 4, 2, 3], ["FSP", 7, 8, 3, 3], ["FSP", 7, 12, 4, 3], ["RE", 7, [0, 4, 8, 12, 1, 5, 9, 13, 2, 6, 10, 14, 3, 7, 11, 15]], ["CA", 3, 7, 11], ["CI", 1], ["FU", 7, [0, 1, 2, 3]], ["AN", 7, 0, 5], ["FU", 7, [1, 2, 3, 4]], ["AN", 7, 1, 4], ["FU", 7, [2, 3, 4, 5]], ["AN", 7, 2, 6], ["PR", 3, 0, "auto_unroll_max_step$0"], ["AN", 3, 28, 2], ["AN", 7, 6, 2]]]], "r": [[0.261755, 0.261372, 0.259089], 0, 12.3143, 1630246085], "v": "v0.6"}
{"i": [["[\"3de659bda0b18c5fe8c5c8f8ce54ea9d\", 1, 15, 106, 84, 15, 15, 4, 4, 1, 15, 1, 1, 1, 15, 212, 168, 1, 15, 212, 168]", "opencl -keys=mali,opencl,gpu -device=mali -max_num_threads=256 -thread_warp_size=1", [2, 16, 64, 4096, 40960, 512, 2, 2], "llvm -keys=cpu -link-params=0 -mtriple=aarch64-linux-gnu", 2, []], [[], [["CI", 5], ["SP", 3, 0, 1, [1, 1, 1, 1], 1], ["SP", 3, 5, 15, [1, 1, 1, 5], 1], ["SP", 3, 10, 212, [2, 2, 1, 53], 1], ["SP", 3, 15, 168, [1, 2, 1, 4], 1], ["SP", 3, 20, 15, [5, 3], 1], ["SP", 3, 23, 4, [1, 1], 1], ["SP", 3, 26, 4, [2, 1], 1], ["RE", 3, [0, 5, 10, 15, 1, 6, 11, 16, 2, 7, 12, 17, 20, 23, 26, 21, 24, 27, 3, 8, 13, 18, 22, 25, 28, 4, 9, 14, 19]], ["FSP", 7, 0, 1, 3], ["FSP", 7, 4, 2, 3], ["FSP", 7, 8, 3, 3], ["FSP", 7, 12, 4, 3], ["RE", 7, [0, 4, 8, 12, 1, 5, 9, 13, 2, 6, 10, 14, 3, 7, 11, 15]], ["CA", 3, 7, 11], ["CI", 1], ["FU", 7, [0, 1, 2, 3]], ["AN", 7, 0, 5], ["FU", 7, [1, 2, 3, 4]], ["AN", 7, 1, 4], ["FU", 7, [2, 3, 4, 5]], ["AN", 7, 2, 6], ["PR", 3, 0, "auto_unroll_max_step$64"], ["AN", 3, 28, 2], ["AN", 7, 6, 2]]]], "r": [[0.616411, 0.732687, 0.655722], 0, 15.3439, 1630246100], "v": "v0.6"}
{"i": [["[\"3de659bda0b18c5fe8c5c8f8ce54ea9d\", 1, 15, 106, 84, 15, 15, 4, 4, 1, 15, 1, 1, 1, 15, 212, 168, 1, 15, 212, 168]", "opencl -keys=mali,opencl,gpu -device=mali -max_num_threads=256 -thread_warp_size=1", [2, 16, 64, 4096, 40960, 512, 2, 2], "llvm -keys=cpu -link-params=0 -mtriple=aarch64-linux-gnu", 2, []], [[], [["CI", 5], ["SP", 3, 0, 1, [1, 1, 1, 1], 1], ["SP", 3, 5, 15, [1, 3, 1, 5], 1], ["SP", 3, 10, 212, [1, 2, 1, 1], 1], ["SP", 3, 15, 168, [2, 7, 1, 3], 1], ["SP", 3, 20, 15, [1, 15], 1], ["SP", 3, 23, 4, [1, 1], 1], ["SP", 3, 26, 4, [4, 1], 1], ["RE", 3, [0, 5, 10, 15, 1, 6, 11, 16, 2, 7, 12, 17, 20, 23, 26, 21, 24, 27, 3, 8, 13, 18, 22, 25, 28, 4, 9, 14, 19]], ["FSP", 7, 0, 1, 3], ["FSP", 7, 4, 2, 3], ["FSP", 7, 8, 3, 3], ["FSP", 7, 12, 4, 3], ["RE", 7, [0, 4, 8, 12, 1, 5, 9, 13, 2, 6, 10, 14, 3, 7, 11, 15]], ["CA", 3, 7, 11], ["CI", 1], ["FU", 7, [0, 1, 2, 3]], ["AN", 7, 0, 5], ["FU", 7, [1, 2, 3, 4]], ["AN", 7, 1, 4], ["FU", 7, [2, 3, 4, 5]], ["AN", 7, 2, 6], ["PR", 3, 0, "auto_unroll_max_step$0"], ["AN", 3, 28, 2], ["AN", 7, 6, 2]]]], "r": [[0.142689, 0.144326, 0.146432], 0, 10.6656, 1630246161], "v": "v0.6"}
{"i": [["[\"3de659bda0b18c5fe8c5c8f8ce54ea9d\", 1, 15, 106, 84, 15, 15, 4, 4, 1, 15, 1, 1, 1, 15, 212, 168, 1, 15, 212, 168]", "opencl -keys=mali,opencl,gpu -device=mali -max_num_threads=256 -thread_warp_size=1", [2, 16, 64, 4096, 40960, 512, 2, 2], "llvm -keys=cpu -link-params=0 -mtriple=aarch64-linux-gnu", 2, []], [[], [["CI", 5], ["SP", 3, 0, 1, [1, 1, 1, 1], 1], ["SP", 3, 5, 15, [1, 3, 5, 1], 1], ["SP", 3, 10, 212, [2, 53, 1, 2], 1], ["SP", 3, 15, 168, [1, 1, 42, 4], 1], ["SP", 3, 20, 15, [5, 1], 1], ["SP", 3, 23, 4, [2, 1], 1], ["SP", 3, 26, 4, [1, 1], 1], ["RE", 3, [0, 5, 10, 15, 1, 6, 11, 16, 2, 7, 12, 17, 20, 23, 26, 21, 24, 27, 3, 8, 13, 18, 22, 25, 28, 4, 9, 14, 19]], ["FSP", 7, 0, 1, 3], ["FSP", 7, 4, 2, 3], ["FSP", 7, 8, 3, 3], ["FSP", 7, 12, 4, 3], ["RE", 7, [0, 4, 8, 12, 1, 5, 9, 13, 2, 6, 10, 14, 3, 7, 11, 15]], ["CA", 3, 7, 11], ["CI", 1], ["FU", 7, [0, 1, 2, 3]], ["AN", 7, 0, 5], ["FU", 7, [1, 2, 3, 4]], ["AN", 7, 1, 4], ["FU", 7, [2, 3, 4, 5]], ["AN", 7, 2, 6], ["PR", 3, 0, "auto_unroll_max_step$512"], ["AN", 3, 28, 2]]]], "r": [[0.679618, 0.693201, 0.704958], 0, 22.2252, 1630246183], "v": "v0.6"}
{"i": [["[\"3de659bda0b18c5fe8c5c8f8ce54ea9d\", 1, 15, 106, 84, 15, 15, 4, 4, 1, 15, 1, 1, 1, 15, 212, 168, 1, 15, 212, 168]", "opencl -keys=mali,opencl,gpu -device=mali -max_num_threads=256 -thread_warp_size=1", [2, 16, 64, 4096, 40960, 512, 2, 2], "llvm -keys=cpu -link-params=0 -mtriple=aarch64-linux-gnu", 2, []], [[], [["CI", 5], ["SP", 3, 0, 1, [1, 1, 1, 1], 1], ["SP", 3, 5, 15, [1, 1, 5, 3], 1], ["SP", 3, 10, 212, [1, 1, 1, 2], 1], ["SP", 3, 15, 168, [1, 12, 1, 1], 1], ["SP", 3, 20, 15, [3, 1], 1], ["SP", 3, 23, 4, [1, 4], 1], ["SP", 3, 26, 4, [2, 2], 1], ["RE", 3, [0, 5, 10, 15, 1, 6, 11, 16, 2, 7, 12, 17, 20, 23, 26, 21, 24, 27, 3, 8, 13, 18, 22, 25, 28, 4, 9, 14, 19]], ["FSP", 7, 0, 1, 3], ["FSP", 7, 4, 2, 3], ["FSP", 7, 8, 3, 3], ["FSP", 7, 12, 4, 3], ["RE", 7, [0, 4, 8, 12, 1, 5, 9, 13, 2, 6, 10, 14, 3, 7, 11, 15]], ["CA", 3, 7, 11], ["CI", 1], ["FU", 7, [0, 1, 2, 3]], ["AN", 7, 0, 5], ["FU", 7, [1, 2, 3, 4]], ["AN", 7, 1, 4], ["FU", 7, [2, 3, 4, 5]], ["AN", 7, 2, 6], ["PR", 3, 0, "auto_unroll_max_step$512"], ["AN", 3, 28, 2], ["AN", 7, 6, 2]]]], "r": [[0.257979, 0.256857, 0.256857], 0, 16.885, 1630246199], "v": "v0.6"}
{"i": [["[\"3de659bda0b18c5fe8c5c8f8ce54ea9d\", 1, 15, 106, 84, 15, 15, 4, 4, 1, 15, 1, 1, 1, 15, 212, 168, 1, 15, 212, 168]", "opencl -keys=mali,opencl,gpu -device=mali -max_num_threads=256 -thread_warp_size=1", [2, 16, 64, 4096, 40960, 512, 2, 2], "llvm -keys=cpu -link-params=0 -mtriple=aarch64-linux-gnu", 2, []], [[], [["CI", 5], ["SP", 3, 0, 1, [1, 1, 1, 1], 1], ["SP", 3, 5, 15, [1, 1, 1, 15], 1], ["SP", 3, 10, 212, [1, 1, 2, 2], 1], ["SP", 3, 15, 168, [1, 56, 1, 1], 1], ["SP", 3, 20, 15, [1, 15], 1], ["SP", 3, 23, 4, [2, 2], 1], ["SP", 3, 26, 4, [2, 1], 1], ["RE", 3, [0, 5, 10, 15, 1, 6, 11, 16, 2, 7, 12, 17, 20, 23, 26, 21, 24, 27, 3, 8, 13, 18, 22, 25, 28, 4, 9, 14, 19]], ["FSP", 7, 0, 1, 3], ["FSP", 7, 4, 2, 3], ["FSP", 7, 8, 3, 3], ["FSP", 7, 12, 4, 3], ["RE", 7, [0, 4, 8, 12, 1, 5, 9, 13, 2, 6, 10, 14, 3, 7, 11, 15]], ["CA", 3, 7, 11], ["CI", 1], ["FU", 7, [0, 1, 2, 3]], ["AN", 7, 0, 5], ["FU", 7, [1, 2, 3, 4]], ["AN", 7, 1, 4], ["FU", 7, [2, 3, 4, 5]], ["AN", 7, 2, 6], ["PR", 3, 0, "auto_unroll_max_step$64"], ["AN", 3, 28, 2], ["AN", 7, 6, 2]]]], "r": [[0.258645, 0.259644, 0.258145], 0, 12.8989, 1630246265], "v": "v0.6"}
{"i": [["[\"3de659bda0b18c5fe8c5c8f8ce54ea9d\", 1, 15, 106, 84, 15, 15, 4, 4, 1, 15, 1, 1, 1, 15, 212, 168, 1, 15, 212, 168]", "opencl -keys=mali,opencl,gpu -device=mali -max_num_threads=256 -thread_warp_size=1", [2, 16, 64, 4096, 40960, 512, 2, 2], "llvm -keys=cpu -link-params=0 -mtriple=aarch64-linux-gnu", 2, []], [[], [["CI", 5], ["SP", 3, 0, 1, [1, 1, 1, 1], 1], ["SP", 3, 5, 15, [1, 1, 1, 3], 1], ["SP", 3, 10, 212, [2, 2, 1, 53], 1], ["SP", 3, 15, 168, [1, 8, 3, 1], 1], ["SP", 3, 20, 15, [1, 5], 1], ["SP", 3, 23, 4, [1, 2], 1], ["SP", 3, 26, 4, [1, 1], 1], ["RE", 3, [0, 5, 10, 15, 1, 6, 11, 16, 2, 7, 12, 17, 20, 23, 26, 21, 24, 27, 3, 8, 13, 18, 22, 25, 28, 4, 9, 14, 19]], ["FSP", 7, 0, 1, 3], ["FSP", 7, 4, 2, 3], ["FSP", 7, 8, 3, 3], ["FSP", 7, 12, 4, 3], ["RE", 7, [0, 4, 8, 12, 1, 5, 9, 13, 2, 6, 10, 14, 3, 7, 11, 15]], ["CA", 3, 7, 11], ["CI", 1], ["FU", 7, [0, 1, 2, 3]], ["AN", 7, 0, 5], ["FU", 7, [1, 2, 3, 4]], ["AN", 7, 1, 4], ["FU", 7, [2, 3, 4, 5]], ["AN", 7, 2, 6], ["PR", 3, 0, "auto_unroll_max_step$16"], ["AN", 3, 28, 2], ["AN", 7, 6, 2]]]], "r": [[0.509597, 0.524706, 0.523493], 0, 15.0288, 1630246330], "v": "v0.6"}
{"i": [["[\"3de659bda0b18c5fe8c5c8f8ce54ea9d\", 1, 15, 106, 84, 15, 15, 4, 4, 1, 15, 1, 1, 1, 15, 212, 168, 1, 15, 212, 168]", "opencl -keys=mali,opencl,gpu -device=mali -max_num_threads=256 -thread_warp_size=1", [2, 16, 64, 4096, 40960, 512, 2, 2], "llvm -keys=cpu -link-params=0 -mtriple=aarch64-linux-gnu", 2, []], [[], [["CI", 5], ["SP", 3, 0, 1, [1, 1, 1, 1], 1], ["SP", 3, 5, 15, [1, 3, 5, 1], 1], ["SP", 3, 10, 212, [1, 1, 53, 2], 1], ["SP", 3, 15, 168, [1, 21, 2, 2], 1], ["SP", 3, 20, 15, [5, 3], 1], ["SP", 3, 23, 4, [1, 2], 1], ["SP", 3, 26, 4, [2, 2], 1], ["RE", 3, [0, 5, 10, 15, 1, 6, 11, 16, 2, 7, 12, 17, 20, 23, 26, 21, 24, 27, 3, 8, 13, 18, 22, 25, 28, 4, 9, 14, 19]], ["FSP", 7, 0, 1, 3], ["FSP", 7, 4, 2, 3], ["FSP", 7, 8, 3, 3], ["FSP", 7, 12, 4, 3], ["RE", 7, [0, 4, 8, 12, 1, 5, 9, 13, 2, 6, 10, 14, 3, 7, 11, 15]], ["CA", 3, 7, 11], ["CI", 1], ["FU", 7, [0, 1, 2, 3]], ["AN", 7, 0, 5], ["FU", 7, [1, 2, 3, 4]], ["AN", 7, 1, 4], ["FU", 7, [2, 3, 4, 5]], ["AN", 7, 2, 6], ["PR", 3, 0, "auto_unroll_max_step$512"], ["AN", 3, 28, 2], ["AN", 7, 6, 2]]]], "r": [[0.148417, 0.151768, 0.140568], 0, 13.6666, 1630246344], "v": "v0.6"}
{"i": [["[\"39e4bafedfe85ad162fcb6a68723e5cd\", 1, 15, 212, 168, 15, 15, 4, 4, 1, 15, 1, 1, 1, 15, 424, 336]", "opencl -keys=mali,opencl,gpu -device=mali -max_num_threads=256 -thread_warp_size=1", [2, 16, 64, 4096, 40960, 512, 2, 2], "llvm -keys=cpu -link-params=0 -mtriple=aarch64-linux-gnu", 2, []], [[], [["SP", 3, 0, 1, [1, 1, 1, 1], 1], ["SP", 3, 5, 15, [1, 1, 3, 1], 1], ["SP", 3, 10, 424, [1, 53, 2, 1], 1], ["SP", 3, 15, 336, [1, 4, 21, 2], 1], ["SP", 3, 20, 15, [5, 3], 1], ["SP", 3, 23, 4, [1, 4], 1], ["SP", 3, 26, 4, [1, 4], 1], ["RE", 3, [0, 5, 10, 15, 1, 6, 11, 16, 2, 7, 12, 17, 20, 23, 26, 21, 24, 27, 3, 8, 13, 18, 22, 25, 28, 4, 9, 14, 19]], ["FSP", 5, 0, 0, 3], ["FSP", 5, 4, 1, 3], ["FSP", 5, 8, 2, 3], ["FSP", 5, 12, 3, 3], ["RE", 5, [0, 4, 8, 12, 1, 5, 9, 13, 2, 6, 10, 14, 3, 7, 11, 15]], ["CA", 3, 5, 11], ["CI", 1], ["FU", 5, [0, 1, 2, 3]], ["AN", 5, 0, 5], ["FU", 5, [1, 2, 3, 4]], ["AN", 5, 1, 4], ["FU", 5, [2, 3, 4, 5]], ["AN", 5, 2, 6], ["PR", 3, 0, "auto_unroll_max_step$0"], ["AN", 3, 28, 2]]]], "r": [[1.10909, 1.11342, 1.11649], 0, 15.6031, 1630246374], "v": "v0.6"}
{"i": [["[\"39e4bafedfe85ad162fcb6a68723e5cd\", 1, 15, 212, 168, 15, 15, 4, 4, 1, 15, 1, 1, 1, 15, 424, 336]", "opencl -keys=mali,opencl,gpu -device=mali -max_num_threads=256 -thread_warp_size=1", [2, 16, 64, 4096, 40960, 512, 2, 2], "llvm -keys=cpu -link-params=0 -mtriple=aarch64-linux-gnu", 2, []], [[], [["SP", 3, 0, 1, [1, 1, 1, 1], 1], ["SP", 3, 5, 15, [1, 1, 1, 1], 1], ["SP", 3, 10, 424, [1, 2, 2, 2], 1], ["SP", 3, 15, 336, [1, 4, 1, 28], 1], ["SP", 3, 20, 15, [3, 5], 1], ["SP", 3, 23, 4, [1, 2], 1], ["SP", 3, 26, 4, [1, 4], 1], ["RE", 3, [0, 5, 10, 15, 1, 6, 11, 16, 2, 7, 12, 17, 20, 23, 26, 21, 24, 27, 3, 8, 13, 18, 22, 25, 28, 4, 9, 14, 19]], ["FSP", 5, 0, 0, 3], ["FSP", 5, 4, 1, 3], ["FSP", 5, 8, 2, 3], ["FSP", 5, 12, 3, 3], ["RE", 5, [0, 4, 8, 12, 1, 5, 9, 13, 2, 6, 10, 14, 3, 7, 11, 15]], ["CA", 3, 5, 11], ["CI", 1], ["FU", 5, [0, 1, 2, 3]], ["AN", 5, 0, 5], ["FU", 5, [1, 2, 3, 4]], ["AN", 5, 1, 4], ["FU", 5, [2, 3, 4, 5]], ["AN", 5, 2, 6], ["PR", 3, 0, "auto_unroll_max_step$16"]]]], "r": [[0.869776, 0.850855, 0.858885], 0, 18.5898, 1630246493], "v": "v0.6"}
{"i": [["[\"39e4bafedfe85ad162fcb6a68723e5cd\", 1, 15, 212, 168, 15, 15, 4, 4, 1, 15, 1, 1, 1, 15, 424, 336]", "opencl -keys=mali,opencl,gpu -device=mali -max_num_threads=256 -thread_warp_size=1", [2, 16, 64, 4096, 40960, 512, 2, 2], "llvm -keys=cpu -link-params=0 -mtriple=aarch64-linux-gnu", 2, []], [[], [["SP", 3, 0, 1, [1, 1, 1, 1], 1], ["SP", 3, 5, 15, [1, 3, 5, 1], 1], ["SP", 3, 10, 424, [1, 53, 1, 8], 1], ["SP", 3, 15, 336, [2, 2, 21, 2], 1], ["SP", 3, 20, 15, [1, 5], 1], ["SP", 3, 23, 4, [4, 1], 1], ["SP", 3, 26, 4, [2, 2], 1], ["RE", 3, [0, 5, 10, 15, 1, 6, 11, 16, 2, 7, 12, 17, 20, 23, 26, 21, 24, 27, 3, 8, 13, 18, 22, 25, 28, 4, 9, 14, 19]], ["FSP", 5, 0, 0, 3], ["FSP", 5, 4, 1, 3], ["FSP", 5, 8, 2, 3], ["FSP", 5, 12, 3, 3], ["RE", 5, [0, 4, 8, 12, 1, 5, 9, 13, 2, 6, 10, 14, 3, 7, 11, 15]], ["CA", 3, 5, 11], ["CI", 1], ["FU", 5, [0, 1, 2, 3]], ["AN", 5, 0, 5], ["FU", 5, [1, 2, 3, 4]], ["AN", 5, 1, 4], ["FU", 5, [2, 3, 4, 5]], ["AN", 5, 2, 6], ["PR", 3, 0, "auto_unroll_max_step$64"], ["AN", 3, 28, 2]]]], "r": [[1.12292, 1.2673, 1.20732], 0, 23.5753, 1630246567], "v": "v0.6"}
{"i": [["[\"39e4bafedfe85ad162fcb6a68723e5cd\", 1, 15, 212, 168, 15, 15, 4, 4, 1, 15, 1, 1, 1, 15, 424, 336]", "opencl -keys=mali,opencl,gpu -device=mali -max_num_threads=256 -thread_warp_size=1", [2, 16, 64, 4096, 40960, 512, 2, 2], "llvm -keys=cpu -link-params=0 -mtriple=aarch64-linux-gnu", 2, []], [[], [["SP", 3, 0, 1, [1, 1, 1, 1], 1], ["SP", 3, 5, 15, [1, 1, 5, 1], 1], ["SP", 3, 10, 424, [2, 53, 1, 2], 1], ["SP", 3, 15, 336, [2, 4, 1, 1], 1], ["SP", 3, 20, 15, [3, 1], 1], ["SP", 3, 23, 4, [2, 2], 1], ["SP", 3, 26, 4, [1, 4], 1], ["RE", 3, [0, 5, 10, 15, 1, 6, 11, 16, 2, 7, 12, 17, 20, 23, 26, 21, 24, 27, 3, 8, 13, 18, 22, 25, 28, 4, 9, 14, 19]], ["FSP", 5, 0, 0, 3], ["FSP", 5, 4, 1, 3], ["FSP", 5, 8, 2, 3], ["FSP", 5, 12, 3, 3], ["RE", 5, [0, 4, 8, 12, 1, 5, 9, 13, 2, 6, 10, 14, 3, 7, 11, 15]], ["CA", 3, 5, 11], ["CI", 1], ["FU", 5, [0, 1, 2, 3]], ["AN", 5, 0, 5], ["FU", 5, [1, 2, 3, 4]], ["AN", 5, 1, 4], ["FU", 5, [2, 3, 4, 5]], ["AN", 5, 2, 6], ["PR", 3, 0, "auto_unroll_max_step$64"], ["AN", 3, 28, 2], ["AN", 5, 6, 2]]]], "r": [[0.513693, 0.51444, 0.514358], 0, 15.7799, 1630246582], "v": "v0.6"}
{"i": [["[\"39e4bafedfe85ad162fcb6a68723e5cd\", 1, 15, 212, 168, 15, 15, 4, 4, 1, 15, 1, 1, 1, 15, 424, 336]", "opencl -keys=mali,opencl,gpu -device=mali -max_num_threads=256 -thread_warp_size=1", [2, 16, 64, 4096, 40960, 512, 2, 2], "llvm -keys=cpu -link-params=0 -mtriple=aarch64-linux-gnu", 2, []], [[], [["SP", 3, 0, 1, [1, 1, 1, 1], 1], ["SP", 3, 5, 15, [1, 1, 15, 1], 1], ["SP", 3, 10, 424, [1, 1, 1, 1], 1], ["SP", 3, 15, 336, [1, 1, 3, 1], 1], ["SP", 3, 20, 15, [1, 15], 1], ["SP", 3, 23, 4, [2, 2], 1], ["SP", 3, 26, 4, [1, 2], 1], ["RE", 3, [0, 5, 10, 15, 1, 6, 11, 16, 2, 7, 12, 17, 20, 23, 26, 21, 24, 27, 3, 8, 13, 18, 22, 25, 28, 4, 9, 14, 19]], ["FSP", 5, 0, 0, 3], ["FSP", 5, 4, 1, 3], ["FSP", 5, 8, 2, 3], ["FSP", 5, 12, 3, 3], ["RE", 5, [0, 4, 8, 12, 1, 5, 9, 13, 2, 6, 10, 14, 3, 7, 11, 15]], ["CA", 3, 5, 11], ["CI", 1], ["FU", 5, [0, 1, 2, 3]], ["AN", 5, 0, 5], ["FU", 5, [1, 2, 3, 4]], ["AN", 5, 1, 4], ["FU", 5, [2, 3, 4, 5]], ["AN", 5, 2, 6], ["PR", 3, 0, "auto_unroll_max_step$16"], ["AN", 3, 28, 2]]]], "r": [[1.70504, 1.7053, 1.70523], 0, 27.639, 1630246610], "v": "v0.6"}
{"i": [["[\"39e4bafedfe85ad162fcb6a68723e5cd\", 1, 15, 212, 168, 15, 15, 4, 4, 1, 15, 1, 1, 1, 15, 424, 336]", "opencl -keys=mali,opencl,gpu -device=mali -max_num_threads=256 -thread_warp_size=1", [2, 16, 64, 4096, 40960, 512, 2, 2], "llvm -keys=cpu -link-params=0 -mtriple=aarch64-linux-gnu", 2, []], [[], [["SP", 3, 0, 1, [1, 1, 1, 1], 1], ["SP", 3, 5, 15, [1, 3, 1, 1], 1], ["SP", 3, 10, 424, [4, 1, 53, 2], 1], ["SP", 3, 15, 336, [1, 4, 7, 3], 1], ["SP", 3, 20, 15, [1, 3], 1], ["SP", 3, 23, 4, [1, 2], 1], ["SP", 3, 26, 4, [2, 1], 1], ["RE", 3, [0, 5, 10, 15, 1, 6, 11, 16, 2, 7, 12, 17, 20, 23, 26, 21, 24, 27, 3, 8, 13, 18, 22, 25, 28, 4, 9, 14, 19]], ["FSP", 5, 0, 0, 3], ["FSP", 5, 4, 1, 3], ["FSP", 5, 8, 2, 3], ["FSP", 5, 12, 3, 3], ["RE", 5, [0, 4, 8, 12, 1, 5, 9, 13, 2, 6, 10, 14, 3, 7, 11, 15]], ["CA", 3, 5, 11], ["CI", 1], ["FU", 5, [0, 1, 2, 3]], ["AN", 5, 0, 5], ["FU", 5, [1, 2, 3, 4]], ["AN", 5, 1, 4], ["FU", 5, [2, 3, 4, 5]], ["AN", 5, 2, 6], ["PR", 3, 0, "auto_unroll_max_step$0"], ["AN", 3, 28, 2]]]], "r": [[2.2236, 2.2553, 2.18821], 0, 34.5046, 1630246694], "v": "v0.6"}
{"i": [["[\"39e4bafedfe85ad162fcb6a68723e5cd\", 1, 15, 212, 168, 15, 15, 4, 4, 1, 15, 1, 1, 1, 15, 424, 336]", "opencl -keys=mali,opencl,gpu -device=mali -max_num_threads=256 -thread_warp_size=1", [2, 16, 64, 4096, 40960, 512, 2, 2], "llvm -keys=cpu -link-params=0 -mtriple=aarch64-linux-gnu", 2, []], [[], [["SP", 3, 0, 1, [1, 1, 1, 1], 1], ["SP", 3, 5, 15, [1, 5, 1, 1], 1], ["SP", 3, 10, 424, [1, 1, 8, 1], 1], ["SP", 3, 15, 336, [1, 7, 2, 2], 1], ["SP", 3, 20, 15, [1, 1], 1], ["SP", 3, 23, 4, [2, 1], 1], ["SP", 3, 26, 4, [2, 2], 1], ["RE", 3, [0, 5, 10, 15, 1, 6, 11, 16, 2, 7, 12, 17, 20, 23, 26, 21, 24, 27, 3, 8, 13, 18, 22, 25, 28, 4, 9, 14, 19]], ["FSP", 5, 0, 0, 3], ["FSP", 5, 4, 1, 3], ["FSP", 5, 8, 2, 3], ["FSP", 5, 12, 3, 3], ["RE", 5, [0, 4, 8, 12, 1, 5, 9, 13, 2, 6, 10, 14, 3, 7, 11, 15]], ["CA", 3, 5, 11], ["CI", 1], ["FU", 5, [0, 1, 2, 3]], ["AN", 5, 0, 5], ["FU", 5, [1, 2, 3, 4]], ["AN", 5, 1, 4], ["FU", 5, [2, 3, 4, 5]], ["AN", 5, 2, 6], ["PR", 3, 0, "auto_unroll_max_step$512"], ["AN", 3, 28, 2], ["AN", 5, 6, 2]]]], "r": [[0.149971, 0.149109, 0.149964], 0, 10.4767, 1630246705], "v": "v0.6"}
{"i": [["[\"39e4bafedfe85ad162fcb6a68723e5cd\", 1, 15, 212, 168, 15, 15, 4, 4, 1, 15, 1, 1, 1, 15, 424, 336]", "opencl -keys=mali,opencl,gpu -device=mali -max_num_threads=256 -thread_warp_size=1", [2, 16, 64, 4096, 40960, 512, 2, 2], "llvm -keys=cpu -link-params=0 -mtriple=aarch64-linux-gnu", 2, []], [[], [["SP", 3, 0, 1, [1, 1, 1, 1], 1], ["SP", 3, 5, 15, [1, 1, 5, 3], 1], ["SP", 3, 10, 424, [1, 8, 1, 1], 1], ["SP", 3, 15, 336, [1, 2, 4, 42], 1], ["SP", 3, 20, 15, [1, 5], 1], ["SP", 3, 23, 4, [4, 1], 1], ["SP", 3, 26, 4, [4, 1], 1], ["RE", 3, [0, 5, 10, 15, 1, 6, 11, 16, 2, 7, 12, 17, 20, 23, 26, 21, 24, 27, 3, 8, 13, 18, 22, 25, 28, 4, 9, 14, 19]], ["FSP", 5, 0, 0, 3], ["FSP", 5, 4, 1, 3], ["FSP", 5, 8, 2, 3], ["FSP", 5, 12, 3, 3], ["RE", 5, [0, 4, 8, 12, 1, 5, 9, 13, 2, 6, 10, 14, 3, 7, 11, 15]], ["CA", 3, 5, 11], ["CI", 1], ["FU", 5, [0, 1, 2, 3]], ["AN", 5, 0, 5], ["FU", 5, [1, 2, 3, 4]], ["AN", 5, 1, 4], ["FU", 5, [2, 3, 4, 5]], ["AN", 5, 2, 6], ["PR", 3, 0, "auto_unroll_max_step$16"]]]], "r": [[2.34681, 2.36896, 2.07704], 0, 34.0323, 1630246789], "v": "v0.6"}
{"i": [["[\"39e4bafedfe85ad162fcb6a68723e5cd\", 1, 15, 212, 168, 15, 15, 4, 4, 1, 15, 1, 1, 1, 15, 424, 336]", "opencl -keys=mali,opencl,gpu -device=mali -max_num_threads=256 -thread_warp_size=1", [2, 16, 64, 4096, 40960, 512, 2, 2], "llvm -keys=cpu -link-params=0 -mtriple=aarch64-linux-gnu", 2, []], [[], [["SP", 3, 0, 1, [1, 1, 1, 1], 1], ["SP", 3, 5, 15, [1, 15, 1, 1], 1], ["SP", 3, 10, 424, [1, 4, 2, 1], 1], ["SP", 3, 15, 336, [1, 3, 1, 4], 1], ["SP", 3, 20, 15, [15, 1], 1], ["SP", 3, 23, 4, [2, 1], 1], ["SP", 3, 26, 4, [1, 4], 1], ["RE", 3, [0, 5, 10, 15, 1, 6, 11, 16, 2, 7, 12, 17, 20, 23, 26, 21, 24, 27, 3, 8, 13, 18, 22, 25, 28, 4, 9, 14, 19]], ["FSP", 5, 0, 0, 3], ["FSP", 5, 4, 1, 3], ["FSP", 5, 8, 2, 3], ["FSP", 5, 12, 3, 3], ["RE", 5, [0, 4, 8, 12, 1, 5, 9, 13, 2, 6, 10, 14, 3, 7, 11, 15]], ["CA", 3, 5, 11], ["CI", 1], ["FU", 5, [0, 1, 2, 3]], ["AN", 5, 0, 5], ["FU", 5, [1, 2, 3, 4]], ["AN", 5, 1, 4], ["FU", 5, [2, 3, 4, 5]], ["AN", 5, 2, 6], ["PR", 3, 0, "auto_unroll_max_step$1024"]]]], "r": [[0.502043, 0.50224, 0.501069], 0, 17.1463, 1630246855], "v": "v0.6"}
{"i": [["[\"39e4bafedfe85ad162fcb6a68723e5cd\", 1, 15, 212, 168, 15, 15, 4, 4, 1, 15, 1, 1, 1, 15, 424, 336]", "opencl -keys=mali,opencl,gpu -device=mali -max_num_threads=256 -thread_warp_size=1", [2, 16, 64, 4096, 40960, 512, 2, 2], "llvm -keys=cpu -link-params=0 -mtriple=aarch64-linux-gnu", 2, []], [[], [["SP", 3, 0, 1, [1, 1, 1, 1], 1], ["SP", 3, 5, 15, [1, 1, 5, 1], 1], ["SP", 3, 10, 424, [1, 1, 8, 1], 1], ["SP", 3, 15, 336, [1, 8, 1, 21], 1], ["SP", 3, 20, 15, [1, 3], 1], ["SP", 3, 23, 4, [2, 1], 1], ["SP", 3, 26, 4, [1, 4], 1], ["RE", 3, [0, 5, 10, 15, 1, 6, 11, 16, 2, 7, 12, 17, 20, 23, 26, 21, 24, 27, 3, 8, 13, 18, 22, 25, 28, 4, 9, 14, 19]], ["FSP", 5, 0, 0, 3], ["FSP", 5, 4, 1, 3], ["FSP", 5, 8, 2, 3], ["FSP", 5, 12, 3, 3], ["RE", 5, [0, 4, 8, 12, 1, 5, 9, 13, 2, 6, 10, 14, 3, 7, 11, 15]], ["CA", 3, 5, 11], ["CI", 1], ["FU", 5, [0, 1, 2, 3]], ["AN", 5, 0, 5], ["FU", 5, [1, 2, 3, 4]], ["AN", 5, 1, 4], ["FU", 5, [2, 3, 4, 5]], ["AN", 5, 2, 6], ["PR", 3, 0, "auto_unroll_max_step$512"]]]], "r": [[1.46239, 1.49973, 1.49992], 0, 38.6713, 1630246993], "v": "v0.6"}
{"i": [["[\"39e4bafedfe85ad162fcb6a68723e5cd\", 1, 15, 212, 168, 15, 15, 4, 4, 1, 15, 1, 1, 1, 15, 424, 336]", "opencl -keys=mali,opencl,gpu -device=mali -max_num_threads=256 -thread_warp_size=1", [2, 16, 64, 4096, 40960, 512, 2, 2], "llvm -keys=cpu -link-params=0 -mtriple=aarch64-linux-gnu", 2, []], [[], [["SP", 3, 0, 1, [1, 1, 1, 1], 1], ["SP", 3, 5, 15, [1, 1, 5, 1], 1], ["SP", 3, 10, 424, [2, 53, 2, 1], 1], ["SP", 3, 15, 336, [1, 1, 42, 1], 1], ["SP", 3, 20, 15, [3, 1], 1], ["SP", 3, 23, 4, [2, 2], 1], ["SP", 3, 26, 4, [1, 4], 1], ["RE", 3, [0, 5, 10, 15, 1, 6, 11, 16, 2, 7, 12, 17, 20, 23, 26, 21, 24, 27, 3, 8, 13, 18, 22, 25, 28, 4, 9, 14, 19]], ["FSP", 5, 0, 0, 3], ["FSP", 5, 4, 1, 3], ["FSP", 5, 8, 2, 3], ["FSP", 5, 12, 3, 3], ["RE", 5, [0, 4, 8, 12, 1, 5, 9, 13, 2, 6, 10, 14, 3, 7, 11, 15]], ["CA", 3, 5, 11], ["CI", 1], ["FU", 5, [0, 1, 2, 3]], ["AN", 5, 0, 5], ["FU", 5, [1, 2, 3, 4]], ["AN", 5, 1, 4], ["FU", 5, [2, 3, 4, 5]], ["AN", 5, 2, 6], ["PR", 3, 0, "auto_unroll_max_step$64"], ["AN", 3, 28, 2]]]], "r": [[1.1932, 1.21177, 1.20748], 0, 23.0716, 1630247016], "v": "v0.6"}
{"i": [["[\"39e4bafedfe85ad162fcb6a68723e5cd\", 1, 15, 212, 168, 15, 15, 4, 4, 1, 15, 1, 1, 1, 15, 424, 336]", "opencl -keys=mali,opencl,gpu -device=mali -max_num_threads=256 -thread_warp_size=1", [2, 16, 64, 4096, 40960, 512, 2, 2], "llvm -keys=cpu -link-params=0 -mtriple=aarch64-linux-gnu", 2, []], [[], [["SP", 3, 0, 1, [1, 1, 1, 1], 1], ["SP", 3, 5, 15, [1, 15, 1, 1], 1], ["SP", 3, 10, 424, [1, 1, 106, 2], 1], ["SP", 3, 15, 336, [2, 6, 4, 1], 1], ["SP", 3, 20, 15, [3, 5], 1], ["SP", 3, 23, 4, [2, 2], 1], ["SP", 3, 26, 4, [2, 2], 1], ["RE", 3, [0, 5, 10, 15, 1, 6, 11, 16, 2, 7, 12, 17, 20, 23, 26, 21, 24, 27, 3, 8, 13, 18, 22, 25, 28, 4, 9, 14, 19]], ["FSP", 5, 0, 0, 3], ["FSP", 5, 4, 1, 3], ["FSP", 5, 8, 2, 3], ["FSP", 5, 12, 3, 3], ["RE", 5, [0, 4, 8, 12, 1, 5, 9, 13, 2, 6, 10, 14, 3, 7, 11, 15]], ["CA", 3, 5, 11], ["CI", 1], ["FU", 5, [0, 1, 2, 3]], ["AN", 5, 0, 5], ["FU", 5, [1, 2, 3, 4]], ["AN", 5, 1, 4], ["FU", 5, [2, 3, 4, 5]], ["AN", 5, 2, 6], ["PR", 3, 0, "auto_unroll_max_step$1024"], ["AN", 3, 28, 2]]]], "r": [[0.498528, 0.493114, 0.512141], 0, 15.3976, 1630247031], "v": "v0.6"}
{"i": [["[\"39e4bafedfe85ad162fcb6a68723e5cd\", 1, 15, 212, 168, 15, 15, 4, 4, 1, 15, 1, 1, 1, 15, 424, 336]", "opencl -keys=mali,opencl,gpu -device=mali -max_num_threads=256 -thread_warp_size=1", [2, 16, 64, 4096, 40960, 512, 2, 2], "llvm -keys=cpu -link-params=0 -mtriple=aarch64-linux-gnu", 2, []], [[], [["SP", 3, 0, 1, [1, 1, 1, 1], 1], ["SP", 3, 5, 15, [1, 15, 1, 1], 1], ["SP", 3, 10, 424, [1, 1, 1, 8], 1], ["SP", 3, 15, 336, [2, 8, 1, 1], 1], ["SP", 3, 20, 15, [3, 1], 1], ["SP", 3, 23, 4, [2, 2], 1], ["SP", 3, 26, 4, [4, 1], 1], ["RE", 3, [0, 5, 10, 15, 1, 6, 11, 16, 2, 7, 12, 17, 20, 23, 26, 21, 24, 27, 3, 8, 13, 18, 22, 25, 28, 4, 9, 14, 19]], ["FSP", 5, 0, 0, 3], ["FSP", 5, 4, 1, 3], ["FSP", 5, 8, 2, 3], ["FSP", 5, 12, 3, 3], ["RE", 5, [0, 4, 8, 12, 1, 5, 9, 13, 2, 6, 10, 14, 3, 7, 11, 15]], ["CA", 3, 5, 11], ["CI", 1], ["FU", 5, [0, 1, 2, 3]], ["AN", 5, 0, 5], ["FU", 5, [1, 2, 3, 4]], ["AN", 5, 1, 4], ["FU", 5, [2, 3, 4, 5]], ["AN", 5, 2, 6], ["PR", 3, 0, "auto_unroll_max_step$512"], ["AN", 3, 28, 2], ["AN", 5, 6, 2]]]], "r": [[0.427667, 0.427299, 0.427983], 0, 14.4898, 1630247045], "v": "v0.6"}
{"i": [["[\"39e4bafedfe85ad162fcb6a68723e5cd\", 1, 15, 212, 168, 15, 15, 4, 4, 1, 15, 1, 1, 1, 15, 424, 336]", "opencl -keys=mali,opencl,gpu -device=mali -max_num_threads=256 -thread_warp_size=1", [2, 16, 64, 4096, 40960, 512, 2, 2], "llvm -keys=cpu -link-params=0 -mtriple=aarch64-linux-gnu", 2, []], [[], [["SP", 3, 0, 1, [1, 1, 1, 1], 1], ["SP", 3, 5, 15, [1, 1, 1, 3], 1], ["SP", 3, 10, 424, [1, 2, 4, 1], 1], ["SP", 3, 15, 336, [1, 28, 1, 1], 1], ["SP", 3, 20, 15, [1, 5], 1], ["SP", 3, 23, 4, [1, 4], 1], ["SP", 3, 26, 4, [2, 2], 1], ["RE", 3, [0, 5, 10, 15, 1, 6, 11, 16, 2, 7, 12, 17, 20, 23, 26, 21, 24, 27, 3, 8, 13, 18, 22, 25, 28, 4, 9, 14, 19]], ["FSP", 5, 0, 0, 3], ["FSP", 5, 4, 1, 3], ["FSP", 5, 8, 2, 3], ["FSP", 5, 12, 3, 3], ["RE", 5, [0, 4, 8, 12, 1, 5, 9, 13, 2, 6, 10, 14, 3, 7, 11, 15]], ["CA", 3, 5, 11], ["CI", 1], ["FU", 5, [0, 1, 2, 3]], ["AN", 5, 0, 5], ["FU", 5, [1, 2, 3, 4]], ["AN", 5, 1, 4], ["FU", 5, [2, 3, 4, 5]], ["AN", 5, 2, 6], ["PR", 3, 0, "auto_unroll_max_step$1024"], ["AN", 3, 28, 2], ["AN", 5, 6, 2]]]], "r": [[0.692774, 0.690486, 0.691045], 0, 30.6779, 1630247075], "v": "v0.6"}
{"i": [["[\"39e4bafedfe85ad162fcb6a68723e5cd\", 1, 15, 212, 168, 15, 15, 4, 4, 1, 15, 1, 1, 1, 15, 424, 336]", "opencl -keys=mali,opencl,gpu -device=mali -max_num_threads=256 -thread_warp_size=1", [2, 16, 64, 4096, 40960, 512, 2, 2], "llvm -keys=cpu -link-params=0 -mtriple=aarch64-linux-gnu", 2, []], [[], [["SP", 3, 0, 1, [1, 1, 1, 1], 1], ["SP", 3, 5, 15, [1, 3, 1, 5], 1], ["SP", 3, 10, 424, [1, 1, 2, 4], 1], ["SP", 3, 15, 336, [1, 6, 2, 1], 1], ["SP", 3, 20, 15, [5, 3], 1], ["SP", 3, 23, 4, [2, 1], 1], ["SP", 3, 26, 4, [2, 1], 1], ["RE", 3, [0, 5, 10, 15, 1, 6, 11, 16, 2, 7, 12, 17, 20, 23, 26, 21, 24, 27, 3, 8, 13, 18, 22, 25, 28, 4, 9, 14, 19]], ["FSP", 5, 0, 0, 3], ["FSP", 5, 4, 1, 3], ["FSP", 5, 8, 2, 3], ["FSP", 5, 12, 3, 3], ["RE", 5, [0, 4, 8, 12, 1, 5, 9, 13, 2, 6, 10, 14, 3, 7, 11, 15]], ["CA", 3, 5, 11], ["CI", 1], ["FU", 5, [0, 1, 2, 3]], ["AN", 5, 0, 5], ["FU", 5, [1, 2, 3, 4]], ["AN", 5, 1, 4], ["FU", 5, [2, 3, 4, 5]], ["AN", 5, 2, 6], ["PR", 3, 0, "auto_unroll_max_step$1024"], ["AN", 3, 28, 2], ["AN", 5, 6, 2]]]], "r": [[0.441164, 0.439083, 0.438527], 0, 20.2574, 1630247100], "v": "v0.6"}
{"i": [["[\"39e4bafedfe85ad162fcb6a68723e5cd\", 1, 15, 212, 168, 15, 15, 4, 4, 1, 15, 1, 1, 1, 15, 424, 336]", "opencl -keys=mali,opencl,gpu -device=mali -max_num_threads=256 -thread_warp_size=1", [2, 16, 64, 4096, 40960, 512, 2, 2], "llvm -keys=cpu -link-params=0 -mtriple=aarch64-linux-gnu", 2, []], [[], [["SP", 3, 0, 1, [1, 1, 1, 1], 1], ["SP", 3, 5, 15, [1, 5, 3, 1], 1], ["SP", 3, 10, 424, [1, 2, 1, 4], 1], ["SP", 3, 15, 336, [1, 6, 1, 4], 1], ["SP", 3, 20, 15, [1, 3], 1], ["SP", 3, 23, 4, [4, 1], 1], ["SP", 3, 26, 4, [4, 1], 1], ["RE", 3, [0, 5, 10, 15, 1, 6, 11, 16, 2, 7, 12, 17, 20, 23, 26, 21, 24, 27, 3, 8, 13, 18, 22, 25, 28, 4, 9, 14, 19]], ["FSP", 5, 0, 0, 3], ["FSP", 5, 4, 1, 3], ["FSP", 5, 8, 2, 3], ["FSP", 5, 12, 3, 3], ["RE", 5, [0, 4, 8, 12, 1, 5, 9, 13, 2, 6, 10, 14, 3, 7, 11, 15]], ["CA", 3, 5, 11], ["CI", 1], ["FU", 5, [0, 1, 2, 3]], ["AN", 5, 0, 5], ["FU", 5, [1, 2, 3, 4]], ["AN", 5, 1, 4], ["FU", 5, [2, 3, 4, 5]], ["AN", 5, 2, 6], ["PR", 3, 0, "auto_unroll_max_step$512"], ["AN", 3, 28, 2], ["AN", 5, 6, 2]]]], "r": [[0.798272, 0.796673, 0.802788], 0, 24.0332, 1630247125], "v": "v0.6"}
{"i": [["[\"39e4bafedfe85ad162fcb6a68723e5cd\", 1, 15, 212, 168, 15, 15, 4, 4, 1, 15, 1, 1, 1, 15, 424, 336]", "opencl -keys=mali,opencl,gpu -device=mali -max_num_threads=256 -thread_warp_size=1", [2, 16, 64, 4096, 40960, 512, 2, 2], "llvm -keys=cpu -link-params=0 -mtriple=aarch64-linux-gnu", 2, []], [[], [["SP", 3, 0, 1, [1, 1, 1, 1], 1], ["SP", 3, 5, 15, [1, 1, 1, 1], 1], ["SP", 3, 10, 424, [1, 2, 2, 2], 1], ["SP", 3, 15, 336, [1, 12, 1, 28], 1], ["SP", 3, 20, 15, [3, 5], 1], ["SP", 3, 23, 4, [1, 2], 1], ["SP", 3, 26, 4, [1, 4], 1], ["RE", 3, [0, 5, 10, 15, 1, 6, 11, 16, 2, 7, 12, 17, 20, 23, 26, 21, 24, 27, 3, 8, 13, 18, 22, 25, 28, 4, 9, 14, 19]], ["FSP", 5, 0, 0, 3], ["FSP", 5, 4, 1, 3], ["FSP", 5, 8, 2, 3], ["FSP", 5, 12, 3, 3], ["RE", 5, [0, 4, 8, 12, 1, 5, 9, 13, 2, 6, 10, 14, 3, 7, 11, 15]], ["CA", 3, 5, 11], ["CI", 1], ["FU", 5, [0, 1, 2, 3]], ["AN", 5, 0, 5], ["FU", 5, [1, 2, 3, 4]], ["AN", 5, 1, 4], ["FU", 5, [2, 3, 4, 5]], ["AN", 5, 2, 6], ["PR", 3, 0, "auto_unroll_max_step$16"]]]], "r": [[0.980011, 0.97083, 0.977587], 0, 19.1098, 1630247144], "v": "v0.6"}
