example_03/model-01-NCHW-B1-opencl-C2000-T21-08-30-08-13.json
{"i": [["[\"492385e7f3538c59581ed6a93e6ef11f\", 1, 16, 212, 168, 32, 16, 3, 3, 1, 32, 1, 1, 1, 32, 212, 168]", "opencl -keys=mali,opencl,gpu -device=mali -max_num_threads=256 -thread_warp_size=1", [2, 16, 64, 4096, 40960, 512, 2, 2], "llvm -keys=cpu -link-params=0 -mtriple=aarch64-linux-gnu", 2, []], [[], [["CI", 8], ["CI", 6], ["CHW", 5, "local"], ["SP", 5, 0, 1, [1, 1, 1, 1], 1], ["SP", 5, 5, 8, [1, 4, 1, 1], 1], ["SP", 5, 10, 212, [1, 1, 2, 1], 1], ["SP", 5, 15, 42, [1, 7, 3, 2], 1], ["SP", 5, 20, 1, [1, 1, 1, 1], 1], ["SP", 5, 25, 4, [1, 4, 1, 1], 1], ["SP", 5, 30, 4, [2, 1, 1, 2], 1], ["SP", 5, 35, 16, [1, 1], 1], ["SP", 5, 38, 3, [1, 1], 1], ["SP", 5, 41, 3, [1, 1], 1], ["RE", 5, [0, 5, 10, 15, 20, 25, 30, 1, 6, 11, 16, 21, 26, 31, 2, 7, 12, 17, 22, 27, 32, 35, 38, 41, 36, 39, 42, 3, 8, 13, 18, 23, 28, 33, 37, 40, 43, 4, 9, 14, 19, 24, 29, 34]], ["FSP", 6, 0, 3, 3], ["FSP", 6, 4, 4, 3], ["FSP", 6, 8, 5, 3], ["FSP", 6, 12, 6, 3], ["FSP", 6, 16, 7, 3], ["FSP", 6, 20, 8, 3], ["FSP", 6, 24, 9, 3], ["RE", 6, [0, 4, 8, 12, 16, 20, 24, 1, 5, 9, 13, 17, 21, 25, 2, 6, 10, 14, 18, 22, 26, 3, 7, 11, 15, 19, 23, 27]], ["CA", 5, 6, 20], ["CI", 4], ["CI", 2], ["CI", 1], ["FU", 10, [0, 1, 2, 3]], ["SP", 10, 0, 1139712, [48], 1], ["AN", 10, 0, 5], ["AN", 10, 1, 6], ["FU", 6, [0, 1, 2, 3, 4, 5, 6]], ["AN", 6, 0, 5], ["FU", 6, [1, 2, 3, 4, 5, 6, 7]], ["AN", 6, 1, 4], ["FU", 6, [2, 3, 4, 5, 6, 7, 8]], ["AN", 6, 2, 6], ["PR", 5, 0, "auto_unroll_max_step$1024"], ["AN", 5, 43, 2], ["AN", 6, 9, 2]]]], "r": [[0.217509, 0.216207, 0.216609], 0, 7.79993, 1630282439], "v": "v0.6"}
{"i": [["[\"492385e7f3538c59581ed6a93e6ef11f\", 1, 16, 212, 168, 32, 16, 3, 3, 1, 32, 1, 1, 1, 32, 212, 168]", "opencl -keys=mali,opencl,gpu -device=mali -max_num_threads=256 -thread_warp_size=1", [2, 16, 64, 4096, 40960, 512, 2, 2], "llvm -keys=cpu -link-params=0 -mtriple=aarch64-linux-gnu", 2, []], [[], [["CI", 8], ["CI", 6], ["CHW", 5, "local"], ["SP", 5, 0, 1, [1, 1, 1, 1], 1], ["SP", 5, 5, 8, [1, 4, 1, 1], 1], ["SP", 5, 10, 212, [1, 1, 2, 1], 1], ["SP", 5, 15, 42, [1, 7, 3, 2], 1], ["SP", 5, 20, 1, [1, 1, 1, 1], 1], ["SP", 5, 25, 4, [1, 4, 1, 1], 1], ["SP", 5, 30, 4, [2, 1, 1, 2], 1], ["SP", 5, 35, 16, [1, 1], 1], ["SP", 5, 38, 3, [1, 1], 1], ["SP", 5, 41, 3, [1, 1], 1], ["RE", 5, [0, 5, 10, 15, 20, 25, 30, 1, 6, 11, 16, 21, 26, 31, 2, 7, 12, 17, 22, 27, 32, 35, 38, 41, 36, 39, 42, 3, 8, 13, 18, 23, 28, 33, 37, 40, 43, 4, 9, 14, 19, 24, 29, 34]], ["FSP", 6, 0, 3, 3], ["FSP", 6, 4, 4, 3], ["FSP", 6, 8, 5, 3], ["FSP", 6, 12, 6, 3], ["FSP", 6, 16, 7, 3], ["FSP", 6, 20, 8, 3], ["FSP", 6, 24, 9, 3], ["RE", 6, [0, 4, 8, 12, 16, 20, 24, 1, 5, 9, 13, 17, 21, 25, 2, 6, 10, 14, 18, 22, 26, 3, 7, 11, 15, 19, 23, 27]], ["CA", 5, 6, 20], ["CI", 4], ["CI", 2], ["CI", 1], ["FU", 10, [0, 1, 2, 3]], ["SP", 10, 0, 1139712, [8], 1], ["AN", 10, 0, 5], ["AN", 10, 1, 6], ["FU", 6, [0, 1, 2, 3, 4, 5, 6]], ["AN", 6, 0, 5], ["FU", 6, [1, 2, 3, 4, 5, 6, 7]], ["AN", 6, 1, 4], ["FU", 6, [2, 3, 4, 5, 6, 7, 8]], ["AN", 6, 2, 6], ["PR", 5, 0, "auto_unroll_max_step$1024"], ["AN", 5, 43, 2], ["AN", 6, 9, 2]]]], "r": [[0.217308, 0.217545, 0.21663], 0, 13.1334, 1630282453], "v": "v0.6"}
{"i": [["[\"492385e7f3538c59581ed6a93e6ef11f\", 1, 16, 212, 168, 32, 16, 3, 3, 1, 32, 1, 1, 1, 32, 212, 168]", "opencl -keys=mali,opencl,gpu -device=mali -max_num_threads=256 -thread_warp_size=1", [2, 16, 64, 4096, 40960, 512, 2, 2], "llvm -keys=cpu -link-params=0 -mtriple=aarch64-linux-gnu", 2, []], [[], [["CI", 8], ["CI", 6], ["CHW", 5, "local"], ["SP", 5, 0, 1, [1, 1, 1, 1], 1], ["SP", 5, 5, 8, [2, 4, 1, 1], 1], ["SP", 5, 10, 212, [1, 1, 1, 4], 1], ["SP", 5, 15, 42, [1, 1, 3, 2], 1], ["SP", 5, 20, 1, [1, 1, 1, 1], 1], ["SP", 5, 25, 4, [1, 2, 1, 1], 1], ["SP", 5, 30, 4, [1, 2, 2, 1], 1], ["SP", 5, 35, 16, [16, 1], 1], ["SP", 5, 38, 3, [3, 1], 1], ["SP", 5, 41, 3, [3, 1], 1], ["RE", 5, [0, 5, 10, 15, 20, 25, 30, 1, 6, 11, 16, 21, 26, 31, 2, 7, 12, 17, 22, 27, 32, 35, 38, 41, 36, 39, 42, 3, 8, 13, 18, 23, 28, 33, 37, 40, 43, 4, 9, 14, 19, 24, 29, 34]], ["FSP", 6, 0, 3, 3], ["FSP", 6, 4, 4, 3], ["FSP", 6, 8, 5, 3], ["FSP", 6, 12, 6, 3], ["FSP", 6, 16, 7, 3], ["FSP", 6, 20, 8, 3], ["FSP", 6, 24, 9, 3], ["RE", 6, [0, 4, 8, 12, 16, 20, 24, 1, 5, 9, 13, 17, 21, 25, 2, 6, 10, 14, 18, 22, 26, 3, 7, 11, 15, 19, 23, 27]], ["CA", 5, 6, 20], ["CI", 4], ["CI", 2], ["CI", 1], ["FU", 10, [0, 1, 2, 3]], ["SP", 10, 0, 1139712, [64], 1], ["AN", 10, 0, 5], ["AN", 10, 1, 6], ["FU", 6, [0, 1, 2, 3, 4, 5, 6]], ["AN", 6, 0, 5], ["FU", 6, [1, 2, 3, 4, 5, 6, 7]], ["AN", 6, 1, 4], ["FU", 6, [2, 3, 4, 5, 6, 7, 8]], ["AN", 6, 2, 6], ["PR", 5, 0, "auto_unroll_max_step$512"], ["AN", 5, 43, 2], ["AN", 6, 9, 2]]]], "r": [[0.308244, 0.307616, 0.308056], 0, 15.2207, 1630282468], "v": "v0.6"}
{"i": [["[\"492385e7f3538c59581ed6a93e6ef11f\", 1, 16, 212, 168, 32, 16, 3, 3, 1, 32, 1, 1, 1, 32, 212, 168]", "opencl -keys=mali,opencl,gpu -device=mali -max_num_threads=256 -thread_warp_size=1", [2, 16, 64, 4096, 40960, 512, 2, 2], "llvm -keys=cpu -link-params=0 -mtriple=aarch64-linux-gnu", 2, []], [[], [["CI", 8], ["CI", 6], ["CHW", 5, "local"], ["SP", 5, 0, 1, [1, 1, 1, 1], 1], ["SP", 5, 5, 8, [1, 4, 1, 1], 1], ["SP", 5, 10, 212, [1, 1, 2, 1], 1], ["SP", 5, 15, 42, [1, 7, 6, 1], 1], ["SP", 5, 20, 1, [1, 1, 1, 1], 1], ["SP", 5, 25, 4, [1, 4, 1, 1], 1], ["SP", 5, 30, 4, [2, 1, 1, 2], 1], ["SP", 5, 35, 16, [1, 1], 1], ["SP", 5, 38, 3, [1, 1], 1], ["SP", 5, 41, 3, [3, 1], 1], ["RE", 5, [0, 5, 10, 15, 20, 25, 30, 1, 6, 11, 16, 21, 26, 31, 2, 7, 12, 17, 22, 27, 32, 35, 38, 41, 36, 39, 42, 3, 8, 13, 18, 23, 28, 33, 37, 40, 43, 4, 9, 14, 19, 24, 29, 34]], ["FSP", 6, 0, 3, 3], ["FSP", 6, 4, 4, 3], ["FSP", 6, 8, 5, 3], ["FSP", 6, 12, 6, 3], ["FSP", 6, 16, 7, 3], ["FSP", 6, 20, 8, 3], ["FSP", 6, 24, 9, 3], ["RE", 6, [0, 4, 8, 12, 16, 20, 24, 1, 5, 9, 13, 17, 21, 25, 2, 6, 10, 14, 18, 22, 26, 3, 7, 11, 15, 19, 23, 27]], ["CA", 5, 6, 20], ["CI", 4], ["CI", 2], ["CI", 1], ["FU", 10, [0, 1, 2, 3]], ["SP", 10, 0, 1139712, [4], 1], ["AN", 10, 0, 5], ["AN", 10, 1, 6], ["FU", 6, [0, 1, 2, 3, 4, 5, 6]], ["AN", 6, 0, 5], ["FU", 6, [1, 2, 3, 4, 5, 6, 7]], ["AN", 6, 1, 4], ["FU", 6, [2, 3, 4, 5, 6, 7, 8]], ["AN", 6, 2, 6], ["PR", 5, 0, "auto_unroll_max_step$1024"], ["AN", 5, 43, 2], ["AN", 6, 9, 2]]]], "r": [[0.2165, 0.219356, 0.216548], 0, 13.3479, 1630282481], "v": "v0.6"}
{"i": [["[\"492385e7f3538c59581ed6a93e6ef11f\", 1, 16, 212, 168, 32, 16, 3, 3, 1, 32, 1, 1, 1, 32, 212, 168]", "opencl -keys=mali,opencl,gpu -device=mali -max_num_threads=256 -thread_warp_size=1", [2, 16, 64, 4096, 40960, 512, 2, 2], "llvm -keys=cpu -link-params=0 -mtriple=aarch64-linux-gnu", 2, []], [[], [["CI", 8], ["CI", 6], ["CHW", 5, "local"], ["SP", 5, 0, 1, [1, 1, 1, 1], 1], ["SP", 5, 5, 8, [2, 4, 1, 1], 1], ["SP", 5, 10, 212, [1, 1, 1, 4], 1], ["SP", 5, 15, 42, [1, 1, 3, 2], 1], ["SP", 5, 20, 1, [1, 1, 1, 1], 1], ["SP", 5, 25, 4, [1, 2, 1, 1], 1], ["SP", 5, 30, 4, [1, 2, 2, 1], 1], ["SP", 5, 35, 16, [16, 1], 1], ["SP", 5, 38, 3, [3, 1], 1], ["SP", 5, 41, 3, [1, 1], 1], ["RE", 5, [0, 5, 10, 15, 20, 25, 30, 1, 6, 11, 16, 21, 26, 31, 2, 7, 12, 17, 22, 27, 32, 35, 38, 41, 36, 39, 42, 3, 8, 13, 18, 23, 28, 33, 37, 40, 43, 4, 9, 14, 19, 24, 29, 34]], ["FSP", 6, 0, 3, 3], ["FSP", 6, 4, 4, 3], ["FSP", 6, 8, 5, 3], ["FSP", 6, 12, 6, 3], ["FSP", 6, 16, 7, 3], ["FSP", 6, 20, 8, 3], ["FSP", 6, 24, 9, 3], ["RE", 6, [0, 4, 8, 12, 16, 20, 24, 1, 5, 9, 13, 17, 21, 25, 2, 6, 10, 14, 18, 22, 26, 3, 7, 11, 15, 19, 23, 27]], ["CA", 5, 6, 20], ["CI", 4], ["CI", 2], ["CI", 1], ["FU", 10, [0, 1, 2, 3]], ["SP", 10, 0, 1139712, [24], 1], ["AN", 10, 0, 5], ["AN", 10, 1, 6], ["FU", 6, [0, 1, 2, 3, 4, 5, 6]], ["AN", 6, 0, 5], ["FU", 6, [1, 2, 3, 4, 5, 6, 7]], ["AN", 6, 1, 4], ["FU", 6, [2, 3, 4, 5, 6, 7, 8]], ["AN", 6, 2, 6], ["PR", 5, 0, "auto_unroll_max_step$1024"], ["AN", 5, 43, 2], ["AN", 6, 9, 2]]]], "r": [[0.223579, 0.222997, 0.223432], 0, 14.2083, 1630282496], "v": "v0.6"}
{"i": [["[\"492385e7f3538c59581ed6a93e6ef11f\", 1, 16, 212, 168, 32, 16, 3, 3, 1, 32, 1, 1, 1, 32, 212, 168]", "opencl -keys=mali,opencl,gpu -device=mali -max_num_threads=256 -thread_warp_size=1", [2, 16, 64, 4096, 40960, 512, 2, 2], "llvm -keys=cpu -link-params=0 -mtriple=aarch64-linux-gnu", 2, []], [[], [["CI", 8], ["CI", 6], ["CHW", 5, "local"], ["SP", 5, 0, 1, [1, 1, 1, 1], 1], ["SP", 5, 5, 8, [1, 4, 1, 1], 1], ["SP", 5, 10, 212, [1, 1, 2, 1], 1], ["SP", 5, 15, 42, [1, 7, 3, 2], 1], ["SP", 5, 20, 1, [1, 1, 1, 1], 1], ["SP", 5, 25, 4, [1, 4, 1, 1], 1], ["SP", 5, 30, 4, [2, 1, 1, 2], 1], ["SP", 5, 35, 16, [1, 1], 1], ["SP", 5, 38, 3, [1, 1], 1], ["SP", 5, 41, 3, [3, 1], 1], ["RE", 5, [0, 5, 10, 15, 20, 25, 30, 1, 6, 11, 16, 21, 26, 31, 2, 7, 12, 17, 22, 27, 32, 35, 38, 41, 36, 39, 42, 3, 8, 13, 18, 23, 28, 33, 37, 40, 43, 4, 9, 14, 19, 24, 29, 34]], ["FSP", 6, 0, 3, 3], ["FSP", 6, 4, 4, 3], ["FSP", 6, 8, 5, 3], ["FSP", 6, 12, 6, 3], ["FSP", 6, 16, 7, 3], ["FSP", 6, 20, 8, 3], ["FSP", 6, 24, 9, 3], ["RE", 6, [0, 4, 8, 12, 16, 20, 24, 1, 5, 9, 13, 17, 21, 25, 2, 6, 10, 14, 18, 22, 26, 3, 7, 11, 15, 19, 23, 27]], ["CA", 5, 6, 20], ["CI", 4], ["CI", 2], ["CI", 1], ["FU", 10, [0, 1, 2, 3]], ["SP", 10, 0, 1139712, [1], 1], ["AN", 10, 0, 5], ["AN", 10, 1, 6], ["FU", 6, [0, 1, 2, 3, 4, 5, 6]], ["AN", 6, 0, 5], ["FU", 6, [1, 2, 3, 4, 5, 6, 7]], ["AN", 6, 1, 4], ["FU", 6, [2, 3, 4, 5, 6, 7, 8]], ["AN", 6, 2, 6], ["PR", 5, 0, "auto_unroll_max_step$1024"], ["AN", 5, 43, 2], ["AN", 6, 9, 2]]]], "r": [[0.23057, 0.23068, 0.230255], 0, 14.5012, 1630282511], "v": "v0.6"}
{"i": [["[\"492385e7f3538c59581ed6a93e6ef11f\", 1, 16, 212, 168, 32, 16, 3, 3, 1, 32, 1, 1, 1, 32, 212, 168]", "opencl -keys=mali,opencl,gpu -device=mali -max_num_threads=256 -thread_warp_size=1", [2, 16, 64, 4096, 40960, 512, 2, 2], "llvm -keys=cpu -link-params=0 -mtriple=aarch64-linux-gnu", 2, []], [[], [["CI", 8], ["CI", 6], ["CHW", 5, "local"], ["SP", 5, 0, 1, [1, 1, 1, 1], 1], ["SP", 5, 5, 8, [2, 4, 1, 1], 1], ["SP", 5, 10, 212, [1, 1, 1, 4], 1], ["SP", 5, 15, 42, [1, 1, 3, 2], 1], ["SP", 5, 20, 1, [1, 1, 1, 1], 1], ["SP", 5, 25, 4, [1, 2, 1, 1], 1], ["SP", 5, 30, 4, [1, 2, 2, 1], 1], ["SP", 5, 35, 16, [16, 1], 1], ["SP", 5, 38, 3, [3, 1], 1], ["SP", 5, 41, 3, [3, 1], 1], ["RE", 5, [0, 5, 10, 15, 20, 25, 30, 1, 6, 11, 16, 21, 26, 31, 2, 7, 12, 17, 22, 27, 32, 35, 38, 41, 36, 39, 42, 3, 8, 13, 18, 23, 28, 33, 37, 40, 43, 4, 9, 14, 19, 24, 29, 34]], ["FSP", 6, 0, 3, 3], ["FSP", 6, 4, 4, 3], ["FSP", 6, 8, 5, 3], ["FSP", 6, 12, 6, 3], ["FSP", 6, 16, 7, 3], ["FSP", 6, 20, 8, 3], ["FSP", 6, 24, 9, 3], ["RE", 6, [0, 4, 8, 12, 16, 20, 24, 1, 5, 9, 13, 17, 21, 25, 2, 6, 10, 14, 18, 22, 26, 3, 7, 11, 15, 19, 23, 27]], ["CA", 5, 6, 20], ["CI", 4], ["CI", 2], ["CI", 1], ["FU", 10, [0, 1, 2, 3]], ["SP", 10, 0, 1139712, [24], 1], ["AN", 10, 0, 5], ["AN", 10, 1, 6], ["FU", 6, [0, 1, 2, 3, 4, 5, 6]], ["AN", 6, 0, 5], ["FU", 6, [1, 2, 3, 4, 5, 6, 7]], ["AN", 6, 1, 4], ["FU", 6, [2, 3, 4, 5, 6, 7, 8]], ["AN", 6, 2, 6], ["PR", 5, 0, "auto_unroll_max_step$512"], ["AN", 5, 43, 2], ["AN", 6, 9, 2]]]], "r": [[0.310243, 0.309217, 0.312101], 0, 15.5777, 1630282526], "v": "v0.6"}
{"i": [["[\"492385e7f3538c59581ed6a93e6ef11f\", 1, 16, 212, 168, 32, 16, 3, 3, 1, 32, 1, 1, 1, 32, 212, 168]", "opencl -keys=mali,opencl,gpu -device=mali -max_num_threads=256 -thread_warp_size=1", [2, 16, 64, 4096, 40960, 512, 2, 2], "llvm -keys=cpu -link-params=0 -mtriple=aarch64-linux-gnu", 2, []], [[], [["CI", 8], ["CI", 6], ["CHW", 5, "local"], ["SP", 5, 0, 1, [1, 1, 1, 1], 1], ["SP", 5, 5, 8, [2, 4, 1, 1], 1], ["SP", 5, 10, 212, [1, 1, 1, 4], 1], ["SP", 5, 15, 42, [1, 1, 3, 2], 1], ["SP", 5, 20, 1, [1, 1, 1, 1], 1], ["SP", 5, 25, 4, [1, 2, 1, 1], 1], ["SP", 5, 30, 4, [1, 2, 2, 1], 1], ["SP", 5, 35, 16, [16, 1], 1], ["SP", 5, 38, 3, [3, 1], 1], ["SP", 5, 41, 3, [1, 1], 1], ["RE", 5, [0, 5, 10, 15, 20, 25, 30, 1, 6, 11, 16, 21, 26, 31, 2, 7, 12, 17, 22, 27, 32, 35, 38, 41, 36, 39, 42, 3, 8, 13, 18, 23, 28, 33, 37, 40, 43, 4, 9, 14, 19, 24, 29, 34]], ["FSP", 6, 0, 3, 3], ["FSP", 6, 4, 4, 3], ["FSP", 6, 8, 5, 3], ["FSP", 6, 12, 6, 3], ["FSP", 6, 16, 7, 3], ["FSP", 6, 20, 8, 3], ["FSP", 6, 24, 9, 3], ["RE", 6, [0, 4, 8, 12, 16, 20, 24, 1, 5, 9, 13, 17, 21, 25, 2, 6, 10, 14, 18, 22, 26, 3, 7, 11, 15, 19, 23, 27]], ["CA", 5, 6, 20], ["CI", 4], ["CI", 2], ["CI", 1], ["FU", 10, [0, 1, 2, 3]], ["SP", 10, 0, 1139712, [2], 1], ["AN", 10, 0, 5], ["AN", 10, 1, 6], ["FU", 6, [0, 1, 2, 3, 4, 5, 6]], ["AN", 6, 0, 5], ["FU", 6, [1, 2, 3, 4, 5, 6, 7]], ["AN", 6, 1, 4], ["FU", 6, [2, 3, 4, 5, 6, 7, 8]], ["AN", 6, 2, 6], ["PR", 5, 0, "auto_unroll_max_step$1024"], ["AN", 5, 43, 2], ["AN", 6, 9, 2]]]], "r": [[0.224403, 0.224308, 0.223938], 0, 14.1958, 1630282541], "v": "v0.6"}
{"i": [["[\"492385e7f3538c59581ed6a93e6ef11f\", 1, 16, 212, 168, 32, 16, 3, 3, 1, 32, 1, 1, 1, 32, 212, 168]", "opencl -keys=mali,opencl,gpu -device=mali -max_num_threads=256 -thread_warp_size=1", [2, 16, 64, 4096, 40960, 512, 2, 2], "llvm -keys=cpu -link-params=0 -mtriple=aarch64-linux-gnu", 2, []], [[], [["CI", 8], ["CI", 6], ["CHW", 5, "local"], ["SP", 5, 0, 1, [1, 1, 1, 1], 1], ["SP", 5, 5, 8, [2, 4, 1, 1], 1], ["SP", 5, 10, 212, [1, 1, 4, 1], 1], ["SP", 5, 15, 42, [1, 1, 3, 2], 1], ["SP", 5, 20, 1, [1, 1, 1, 1], 1], ["SP", 5, 25, 4, [1, 2, 1, 1], 1], ["SP", 5, 30, 4, [1, 2, 2, 1], 1], ["SP", 5, 35, 16, [2, 1], 1], ["SP", 5, 38, 3, [3, 1], 1], ["SP", 5, 41, 3, [1, 1], 1], ["RE", 5, [0, 5, 10, 15, 20, 25, 30, 1, 6, 11, 16, 21, 26, 31, 2, 7, 12, 17, 22, 27, 32, 35, 38, 41, 36, 39, 42, 3, 8, 13, 18, 23, 28, 33, 37, 40, 43, 4, 9, 14, 19, 24, 29, 34]], ["FSP", 6, 0, 3, 3], ["FSP", 6, 4, 4, 3], ["FSP", 6, 8, 5, 3], ["FSP", 6, 12, 6, 3], ["FSP", 6, 16, 7, 3], ["FSP", 6, 20, 8, 3], ["FSP", 6, 24, 9, 3], ["RE", 6, [0, 4, 8, 12, 16, 20, 24, 1, 5, 9, 13, 17, 21, 25, 2, 6, 10, 14, 18, 22, 26, 3, 7, 11, 15, 19, 23, 27]], ["CA", 5, 6, 20], ["CI", 4], ["CI", 2], ["CI", 1], ["FU", 10, [0, 1, 2, 3]], ["SP", 10, 0, 1139712, [4], 1], ["AN", 10, 0, 5], ["AN", 10, 1, 6], ["FU", 6, [0, 1, 2, 3, 4, 5, 6]], ["AN", 6, 0, 5], ["FU", 6, [1, 2, 3, 4, 5, 6, 7]], ["AN", 6, 1, 4], ["FU", 6, [2, 3, 4, 5, 6, 7, 8]], ["AN", 6, 2, 6], ["PR", 5, 0, "auto_unroll_max_step$512"], ["AN", 5, 43, 2], ["AN", 6, 9, 2]]]], "r": [[0.237181, 0.237814, 0.238644], 0, 15.8749, 1630282557], "v": "v0.6"}
{"i": [["[\"492385e7f3538c59581ed6a93e6ef11f\", 1, 16, 212, 168, 32, 16, 3, 3, 1, 32, 1, 1, 1, 32, 212, 168]", "opencl -keys=mali,opencl,gpu -device=mali -max_num_threads=256 -thread_warp_size=1", [2, 16, 64, 4096, 40960, 512, 2, 2], "llvm -keys=cpu -link-params=0 -mtriple=aarch64-linux-gnu", 2, []], [[], [["CI", 8], ["CI", 6], ["CHW", 5, "local"], ["SP", 5, 0, 1, [1, 1, 1, 1], 1], ["SP", 5, 5, 8, [2, 4, 1, 1], 1], ["SP", 5, 10, 212, [1, 1, 1, 4], 1], ["SP", 5, 15, 42, [1, 1, 3, 2], 1], ["SP", 5, 20, 1, [1, 1, 1, 1], 1], ["SP", 5, 25, 4, [1, 2, 1, 1], 1], ["SP", 5, 30, 4, [1, 2, 2, 1], 1], ["SP", 5, 35, 16, [16, 1], 1], ["SP", 5, 38, 3, [3, 1], 1], ["SP", 5, 41, 3, [1, 1], 1], ["RE", 5, [0, 5, 10, 15, 20, 25, 30, 1, 6, 11, 16, 21, 26, 31, 2, 7, 12, 17, 22, 27, 32, 35, 38, 41, 36, 39, 42, 3, 8, 13, 18, 23, 28, 33, 37, 40, 43, 4, 9, 14, 19, 24, 29, 34]], ["FSP", 6, 0, 3, 3], ["FSP", 6, 4, 4, 3], ["FSP", 6, 8, 5, 3], ["FSP", 6, 12, 6, 3], ["FSP", 6, 16, 7, 3], ["FSP", 6, 20, 8, 3], ["FSP", 6, 24, 9, 3], ["RE", 6, [0, 4, 8, 12, 16, 20, 24, 1, 5, 9, 13, 17, 21, 25, 2, 6, 10, 14, 18, 22, 26, 3, 7, 11, 15, 19, 23, 27]], ["CA", 5, 6, 20], ["CI", 4], ["CI", 2], ["CI", 1], ["FU", 10, [0, 1, 2, 3]], ["SP", 10, 0, 1139712, [64], 1], ["AN", 10, 0, 5], ["AN", 10, 1, 6], ["FU", 6, [0, 1, 2, 3, 4, 5, 6]], ["AN", 6, 0, 5], ["FU", 6, [1, 2, 3, 4, 5, 6, 7]], ["AN", 6, 1, 4], ["FU", 6, [2, 3, 4, 5, 6, 7, 8]], ["AN", 6, 2, 6], ["PR", 5, 0, "auto_unroll_max_step$512"], ["AN", 5, 43, 2], ["AN", 6, 9, 2]]]], "r": [[0.222881, 0.221926, 0.222295], 0, 13.7164, 1630282574], "v": "v0.6"}
{"i": [["[\"492385e7f3538c59581ed6a93e6ef11f\", 1, 16, 212, 168, 32, 16, 3, 3, 1, 32, 1, 1, 1, 32, 212, 168]", "opencl -keys=mali,opencl,gpu -device=mali -max_num_threads=256 -thread_warp_size=1", [2, 16, 64, 4096, 40960, 512, 2, 2], "llvm -keys=cpu -link-params=0 -mtriple=aarch64-linux-gnu", 2, []], [[], [["CI", 8], ["CI", 6], ["CHW", 5, "local"], ["SP", 5, 0, 1, [1, 1, 1, 1], 1], ["SP", 5, 5, 8, [2, 4, 1, 1], 1], ["SP", 5, 10, 212, [1, 1, 1, 4], 1], ["SP", 5, 15, 42, [1, 1, 3, 2], 1], ["SP", 5, 20, 1, [1, 1, 1, 1], 1], ["SP", 5, 25, 4, [1, 2, 1, 1], 1], ["SP", 5, 30, 4, [1, 2, 2, 1], 1], ["SP", 5, 35, 16, [1, 1], 1], ["SP", 5, 38, 3, [3, 1], 1], ["SP", 5, 41, 3, [1, 1], 1], ["RE", 5, [0, 5, 10, 15, 20, 25, 30, 1, 6, 11, 16, 21, 26, 31, 2, 7, 12, 17, 22, 27, 32, 35, 38, 41, 36, 39, 42, 3, 8, 13, 18, 23, 28, 33, 37, 40, 43, 4, 9, 14, 19, 24, 29, 34]], ["FSP", 6, 0, 3, 3], ["FSP", 6, 4, 4, 3], ["FSP", 6, 8, 5, 3], ["FSP", 6, 12, 6, 3], ["FSP", 6, 16, 7, 3], ["FSP", 6, 20, 8, 3], ["FSP", 6, 24, 9, 3], ["RE", 6, [0, 4, 8, 12, 16, 20, 24, 1, 5, 9, 13, 17, 21, 25, 2, 6, 10, 14, 18, 22, 26, 3, 7, 11, 15, 19, 23, 27]], ["CA", 5, 6, 20], ["CI", 4], ["CI", 2], ["CI", 1], ["FU", 10, [0, 1, 2, 3]], ["SP", 10, 0, 1139712, [2], 1], ["AN", 10, 0, 5], ["AN", 10, 1, 6], ["FU", 6, [0, 1, 2, 3, 4, 5, 6]], ["AN", 6, 0, 5], ["FU", 6, [1, 2, 3, 4, 5, 6, 7]], ["AN", 6, 1, 4], ["FU", 6, [2, 3, 4, 5, 6, 7, 8]], ["AN", 6, 2, 6], ["PR", 5, 0, "auto_unroll_max_step$512"], ["AN", 5, 43, 2], ["AN", 6, 9, 2]]]], "r": [[0.223641, 0.223061, 0.223555], 0, 14.0177, 1630282588], "v": "v0.6"}
{"i": [["[\"492385e7f3538c59581ed6a93e6ef11f\", 1, 16, 212, 168, 32, 16, 3, 3, 1, 32, 1, 1, 1, 32, 212, 168]", "opencl -keys=mali,opencl,gpu -device=mali -max_num_threads=256 -thread_warp_size=1", [2, 16, 64, 4096, 40960, 512, 2, 2], "llvm -keys=cpu -link-params=0 -mtriple=aarch64-linux-gnu", 2, []], [[], [["CI", 8], ["CI", 6], ["CHW", 5, "local"], ["SP", 5, 0, 1, [1, 1, 1, 1], 1], ["SP", 5, 5, 8, [2, 4, 1, 1], 1], ["SP", 5, 10, 212, [1, 1, 1, 4], 1], ["SP", 5, 15, 42, [1, 1, 3, 2], 1], ["SP", 5, 20, 1, [1, 1, 1, 1], 1], ["SP", 5, 25, 4, [1, 2, 1, 1], 1], ["SP", 5, 30, 4, [1, 2, 2, 1], 1], ["SP", 5, 35, 16, [2, 1], 1], ["SP", 5, 38, 3, [3, 1], 1], ["SP", 5, 41, 3, [1, 1], 1], ["RE", 5, [0, 5, 10, 15, 20, 25, 30, 1, 6, 11, 16, 21, 26, 31, 2, 7, 12, 17, 22, 27, 32, 35, 38, 41, 36, 39, 42, 3, 8, 13, 18, 23, 28, 33, 37, 40, 43, 4, 9, 14, 19, 24, 29, 34]], ["FSP", 6, 0, 3, 3], ["FSP", 6, 4, 4, 3], ["FSP", 6, 8, 5, 3], ["FSP", 6, 12, 6, 3], ["FSP", 6, 16, 7, 3], ["FSP", 6, 20, 8, 3], ["FSP", 6, 24, 9, 3], ["RE", 6, [0, 4, 8, 12, 16, 20, 24, 1, 5, 9, 13, 17, 21, 25, 2, 6, 10, 14, 18, 22, 26, 3, 7, 11, 15, 19, 23, 27]], ["CA", 5, 6, 20], ["CI", 4], ["CI", 2], ["CI", 1], ["FU", 10, [0, 1, 2, 3]], ["SP", 10, 0, 1139712, [48], 1], ["AN", 10, 0, 5], ["AN", 10, 1, 6], ["FU", 6, [0, 1, 2, 3, 4, 5, 6]], ["AN", 6, 0, 5], ["FU", 6, [1, 2, 3, 4, 5, 6, 7]], ["AN", 6, 1, 4], ["FU", 6, [2, 3, 4, 5, 6, 7, 8]], ["AN", 6, 2, 6], ["PR", 5, 0, "auto_unroll_max_step$512"], ["AN", 5, 43, 2], ["AN", 6, 9, 2]]]], "r": [[0.220305, 0.224437, 0.220816], 0, 15.2613, 1630282604], "v": "v0.6"}
{"i": [["[\"492385e7f3538c59581ed6a93e6ef11f\", 1, 16, 212, 168, 32, 16, 3, 3, 1, 32, 1, 1, 1, 32, 212, 168]", "opencl -keys=mali,opencl,gpu -device=mali -max_num_threads=256 -thread_warp_size=1", [2, 16, 64, 4096, 40960, 512, 2, 2], "llvm -keys=cpu -link-params=0 -mtriple=aarch64-linux-gnu", 2, []], [[], [["CI", 8], ["CI", 6], ["CHW", 5, "local"], ["SP", 5, 0, 1, [1, 1, 1, 1], 1], ["SP", 5, 5, 8, [2, 4, 1, 1], 1], ["SP", 5, 10, 212, [1, 1, 1, 4], 1], ["SP", 5, 15, 42, [1, 1, 3, 2], 1], ["SP", 5, 20, 1, [1, 1, 1, 1], 1], ["SP", 5, 25, 4, [1, 2, 1, 1], 1], ["SP", 5, 30, 4, [1, 2, 2, 1], 1], ["SP", 5, 35, 16, [16, 1], 1], ["SP", 5, 38, 3, [3, 1], 1], ["SP", 5, 41, 3, [1, 1], 1], ["RE", 5, [0, 5, 10, 15, 20, 25, 30, 1, 6, 11, 16, 21, 26, 31, 2, 7, 12, 17, 22, 27, 32, 35, 38, 41, 36, 39, 42, 3, 8, 13, 18, 23, 28, 33, 37, 40, 43, 4, 9, 14, 19, 24, 29, 34]], ["FSP", 6, 0, 3, 3], ["FSP", 6, 4, 4, 3], ["FSP", 6, 8, 5, 3], ["FSP", 6, 12, 6, 3], ["FSP", 6, 16, 7, 3], ["FSP", 6, 20, 8, 3], ["FSP", 6, 24, 9, 3], ["RE", 6, [0, 4, 8, 12, 16, 20, 24, 1, 5, 9, 13, 17, 21, 25, 2, 6, 10, 14, 18, 22, 26, 3, 7, 11, 15, 19, 23, 27]], ["CA", 5, 6, 20], ["CI", 4], ["CI", 2], ["CI", 1], ["FU", 10, [0, 1, 2, 3]], ["SP", 10, 0, 1139712, [4], 1], ["AN", 10, 0, 5], ["AN", 10, 1, 6], ["FU", 6, [0, 1, 2, 3, 4, 5, 6]], ["AN", 6, 0, 5], ["FU", 6, [1, 2, 3, 4, 5, 6, 7]], ["AN", 6, 1, 4], ["FU", 6, [2, 3, 4, 5, 6, 7, 8]], ["AN", 6, 2, 6], ["PR", 5, 0, "auto_unroll_max_step$512"], ["AN", 5, 43, 2], ["AN", 6, 9, 2]]]], "r": [[0.221638, 0.223774, 0.222516], 0, 14.7834, 1630282621], "v": "v0.6"}
{"i": [["[\"492385e7f3538c59581ed6a93e6ef11f\", 1, 16, 212, 168, 32, 16, 3, 3, 1, 32, 1, 1, 1, 32, 212, 168]", "opencl -keys=mali,opencl,gpu -device=mali -max_num_threads=256 -thread_warp_size=1", [2, 16, 64, 4096, 40960, 512, 2, 2], "llvm -keys=cpu -link-params=0 -mtriple=aarch64-linux-gnu", 2, []], [[], [["CI", 8], ["CI", 6], ["CHW", 5, "local"], ["SP", 5, 0, 1, [1, 1, 1, 1], 1], ["SP", 5, 5, 8, [2, 4, 1, 1], 1], ["SP", 5, 10, 212, [1, 1, 4, 1], 1], ["SP", 5, 15, 42, [1, 1, 3, 2], 1], ["SP", 5, 20, 1, [1, 1, 1, 1], 1], ["SP", 5, 25, 4, [1, 2, 1, 1], 1], ["SP", 5, 30, 4, [1, 2, 2, 1], 1], ["SP", 5, 35, 16, [1, 1], 1], ["SP", 5, 38, 3, [3, 1], 1], ["SP", 5, 41, 3, [1, 1], 1], ["RE", 5, [0, 5, 10, 15, 20, 25, 30, 1, 6, 11, 16, 21, 26, 31, 2, 7, 12, 17, 22, 27, 32, 35, 38, 41, 36, 39, 42, 3, 8, 13, 18, 23, 28, 33, 37, 40, 43, 4, 9, 14, 19, 24, 29, 34]], ["FSP", 6, 0, 3, 3], ["FSP", 6, 4, 4, 3], ["FSP", 6, 8, 5, 3], ["FSP", 6, 12, 6, 3], ["FSP", 6, 16, 7, 3], ["FSP", 6, 20, 8, 3], ["FSP", 6, 24, 9, 3], ["RE", 6, [0, 4, 8, 12, 16, 20, 24, 1, 5, 9, 13, 17, 21, 25, 2, 6, 10, 14, 18, 22, 26, 3, 7, 11, 15, 19, 23, 27]], ["CA", 5, 6, 20], ["CI", 4], ["CI", 2], ["CI", 1], ["FU", 10, [0, 1, 2, 3]], ["SP", 10, 0, 1139712, [4], 1], ["AN", 10, 0, 5], ["AN", 10, 1, 6], ["FU", 6, [0, 1, 2, 3, 4, 5, 6]], ["AN", 6, 0, 5], ["FU", 6, [1, 2, 3, 4, 5, 6, 7]], ["AN", 6, 1, 4], ["FU", 6, [2, 3, 4, 5, 6, 7, 8]], ["AN", 6, 2, 6], ["PR", 5, 0, "auto_unroll_max_step$512"], ["AN", 5, 43, 2], ["AN", 6, 9, 2]]]], "r": [[0.237189, 0.238109, 0.237304], 0, 15.6549, 1630282637], "v": "v0.6"}
{"i": [["[\"492385e7f3538c59581ed6a93e6ef11f\", 1, 16, 212, 168, 32, 16, 3, 3, 1, 32, 1, 1, 1, 32, 212, 168]", "opencl -keys=mali,opencl,gpu -device=mali -max_num_threads=256 -thread_warp_size=1", [2, 16, 64, 4096, 40960, 512, 2, 2], "llvm -keys=cpu -link-params=0 -mtriple=aarch64-linux-gnu", 2, []], [[], [["CI", 8], ["CI", 6], ["CHW", 5, "local"], ["SP", 5, 0, 1, [1, 1, 1, 1], 1], ["SP", 5, 5, 8, [2, 4, 1, 1], 1], ["SP", 5, 10, 212, [1, 1, 1, 4], 1], ["SP", 5, 15, 42, [1, 1, 3, 2], 1], ["SP", 5, 20, 1, [1, 1, 1, 1], 1], ["SP", 5, 25, 4, [1, 2, 1, 1], 1], ["SP", 5, 30, 4, [1, 2, 2, 1], 1], ["SP", 5, 35, 16, [16, 1], 1], ["SP", 5, 38, 3, [3, 1], 1], ["SP", 5, 41, 3, [1, 1], 1], ["RE", 5, [0, 5, 10, 15, 20, 25, 30, 1, 6, 11, 16, 21, 26, 31, 2, 7, 12, 17, 22, 27, 32, 35, 38, 41, 36, 39, 42, 3, 8, 13, 18, 23, 28, 33, 37, 40, 43, 4, 9, 14, 19, 24, 29, 34]], ["FSP", 6, 0, 3, 3], ["FSP", 6, 4, 4, 3], ["FSP", 6, 8, 5, 3], ["FSP", 6, 12, 6, 3], ["FSP", 6, 16, 7, 3], ["FSP", 6, 20, 8, 3], ["FSP", 6, 24, 9, 3], ["RE", 6, [0, 4, 8, 12, 16, 20, 24, 1, 5, 9, 13, 17, 21, 25, 2, 6, 10, 14, 18, 22, 26, 3, 7, 11, 15, 19, 23, 27]], ["CA", 5, 6, 20], ["CI", 4], ["CI", 2], ["CI", 1], ["FU", 10, [0, 1, 2, 3]], ["SP", 10, 0, 1139712, [24], 1], ["AN", 10, 0, 5], ["AN", 10, 1, 6], ["FU", 6, [0, 1, 2, 3, 4, 5, 6]], ["AN", 6, 0, 5], ["FU", 6, [1, 2, 3, 4, 5, 6, 7]], ["AN", 6, 1, 4], ["FU", 6, [2, 3, 4, 5, 6, 7, 8]], ["AN", 6, 2, 6], ["PR", 5, 0, "auto_unroll_max_step$512"], ["AN", 5, 43, 2], ["AN", 6, 9, 2]]]], "r": [[0.223597, 0.223703, 0.223433], 0, 14.0081, 1630282652], "v": "v0.6"}
{"i": [["[\"492385e7f3538c59581ed6a93e6ef11f\", 1, 16, 212, 168, 32, 16, 3, 3, 1, 32, 1, 1, 1, 32, 212, 168]", "opencl -keys=mali,opencl,gpu -device=mali -max_num_threads=256 -thread_warp_size=1", [2, 16, 64, 4096, 40960, 512, 2, 2], "llvm -keys=cpu -link-params=0 -mtriple=aarch64-linux-gnu", 2, []], [[], [["CI", 8], ["CI", 6], ["CHW", 5, "local"], ["SP", 5, 0, 1, [1, 1, 1, 1], 1], ["SP", 5, 5, 8, [2, 4, 1, 1], 1], ["SP", 5, 10, 212, [1, 1, 1, 4], 1], ["SP", 5, 15, 42, [1, 1, 3, 2], 1], ["SP", 5, 20, 1, [1, 1, 1, 1], 1], ["SP", 5, 25, 4, [1, 2, 1, 1], 1], ["SP", 5, 30, 4, [1, 2, 2, 1], 1], ["SP", 5, 35, 16, [16, 1], 1], ["SP", 5, 38, 3, [3, 1], 1], ["SP", 5, 41, 3, [1, 1], 1], ["RE", 5, [0, 5, 10, 15, 20, 25, 30, 1, 6, 11, 16, 21, 26, 31, 2, 7, 12, 17, 22, 27, 32, 35, 38, 41, 36, 39, 42, 3, 8, 13, 18, 23, 28, 33, 37, 40, 43, 4, 9, 14, 19, 24, 29, 34]], ["FSP", 6, 0, 3, 3], ["FSP", 6, 4, 4, 3], ["FSP", 6, 8, 5, 3], ["FSP", 6, 12, 6, 3], ["FSP", 6, 16, 7, 3], ["FSP", 6, 20, 8, 3], ["FSP", 6, 24, 9, 3], ["RE", 6, [0, 4, 8, 12, 16, 20, 24, 1, 5, 9, 13, 17, 21, 25, 2, 6, 10, 14, 18, 22, 26, 3, 7, 11, 15, 19, 23, 27]], ["CA", 5, 6, 20], ["CI", 4], ["CI", 2], ["CI", 1], ["FU", 10, [0, 1, 2, 3]], ["SP", 10, 0, 1139712, [28], 1], ["AN", 10, 0, 5], ["AN", 10, 1, 6], ["FU", 6, [0, 1, 2, 3, 4, 5, 6]], ["AN", 6, 0, 5], ["FU", 6, [1, 2, 3, 4, 5, 6, 7]], ["AN", 6, 1, 4], ["FU", 6, [2, 3, 4, 5, 6, 7, 8]], ["AN", 6, 2, 6], ["PR", 5, 0, "auto_unroll_max_step$512"], ["AN", 5, 43, 2], ["AN", 6, 9, 2]]]], "r": [[0.223233, 0.225092, 0.222918], 0, 16.2301, 1630282669], "v": "v0.6"}
{"i": [["[\"492385e7f3538c59581ed6a93e6ef11f\", 1, 16, 212, 168, 32, 16, 3, 3, 1, 32, 1, 1, 1, 32, 212, 168]", "opencl -keys=mali,opencl,gpu -device=mali -max_num_threads=256 -thread_warp_size=1", [2, 16, 64, 4096, 40960, 512, 2, 2], "llvm -keys=cpu -link-params=0 -mtriple=aarch64-linux-gnu", 2, []], [[], [["CI", 8], ["CI", 6], ["CHW", 5, "local"], ["SP", 5, 0, 1, [1, 1, 1, 1], 1], ["SP", 5, 5, 8, [2, 4, 1, 1], 1], ["SP", 5, 10, 212, [1, 1, 4, 1], 1], ["SP", 5, 15, 42, [1, 1, 3, 2], 1], ["SP", 5, 20, 1, [1, 1, 1, 1], 1], ["SP", 5, 25, 4, [1, 2, 1, 1], 1], ["SP", 5, 30, 4, [1, 2, 2, 1], 1], ["SP", 5, 35, 16, [16, 1], 1], ["SP", 5, 38, 3, [3, 1], 1], ["SP", 5, 41, 3, [1, 1], 1], ["RE", 5, [0, 5, 10, 15, 20, 25, 30, 1, 6, 11, 16, 21, 26, 31, 2, 7, 12, 17, 22, 27, 32, 35, 38, 41, 36, 39, 42, 3, 8, 13, 18, 23, 28, 33, 37, 40, 43, 4, 9, 14, 19, 24, 29, 34]], ["FSP", 6, 0, 3, 3], ["FSP", 6, 4, 4, 3], ["FSP", 6, 8, 5, 3], ["FSP", 6, 12, 6, 3], ["FSP", 6, 16, 7, 3], ["FSP", 6, 20, 8, 3], ["FSP", 6, 24, 9, 3], ["RE", 6, [0, 4, 8, 12, 16, 20, 24, 1, 5, 9, 13, 17, 21, 25, 2, 6, 10, 14, 18, 22, 26, 3, 7, 11, 15, 19, 23, 27]], ["CA", 5, 6, 20], ["CI", 4], ["CI", 2], ["CI", 1], ["FU", 10, [0, 1, 2, 3]], ["SP", 10, 0, 1139712, [32], 1], ["AN", 10, 0, 5], ["AN", 10, 1, 6], ["FU", 6, [0, 1, 2, 3, 4, 5, 6]], ["AN", 6, 0, 5], ["FU", 6, [1, 2, 3, 4, 5, 6, 7]], ["AN", 6, 1, 4], ["FU", 6, [2, 3, 4, 5, 6, 7, 8]], ["AN", 6, 2, 6], ["PR", 5, 0, "auto_unroll_max_step$512"], ["AN", 5, 43, 2], ["AN", 6, 9, 2]]]], "r": [[0.239792, 0.238119, 0.23863], 0, 16.1422, 1630282685], "v": "v0.6"}
{"i": [["[\"492385e7f3538c59581ed6a93e6ef11f\", 1, 16, 212, 168, 32, 16, 3, 3, 1, 32, 1, 1, 1, 32, 212, 168]", "opencl -keys=mali,opencl,gpu -device=mali -max_num_threads=256 -thread_warp_size=1", [2, 16, 64, 4096, 40960, 512, 2, 2], "llvm -keys=cpu -link-params=0 -mtriple=aarch64-linux-gnu", 2, []], [[], [["CI", 8], ["CI", 6], ["CHW", 5, "local"], ["SP", 5, 0, 1, [1, 1, 1, 1], 1], ["SP", 5, 5, 8, [2, 4, 1, 1], 1], ["SP", 5, 10, 212, [1, 1, 1, 4], 1], ["SP", 5, 15, 42, [1, 1, 3, 2], 1], ["SP", 5, 20, 1, [1, 1, 1, 1], 1], ["SP", 5, 25, 4, [1, 2, 1, 1], 1], ["SP", 5, 30, 4, [1, 2, 2, 1], 1], ["SP", 5, 35, 16, [16, 1], 1], ["SP", 5, 38, 3, [3, 1], 1], ["SP", 5, 41, 3, [1, 1], 1], ["RE", 5, [0, 5, 10, 15, 20, 25, 30, 1, 6, 11, 16, 21, 26, 31, 2, 7, 12, 17, 22, 27, 32, 35, 38, 41, 36, 39, 42, 3, 8, 13, 18, 23, 28, 33, 37, 40, 43, 4, 9, 14, 19, 24, 29, 34]], ["FSP", 6, 0, 3, 3], ["FSP", 6, 4, 4, 3], ["FSP", 6, 8, 5, 3], ["FSP", 6, 12, 6, 3], ["FSP", 6, 16, 7, 3], ["FSP", 6, 20, 8, 3], ["FSP", 6, 24, 9, 3], ["RE", 6, [0, 4, 8, 12, 16, 20, 24, 1, 5, 9, 13, 17, 21, 25, 2, 6, 10, 14, 18, 22, 26, 3, 7, 11, 15, 19, 23, 27]], ["CA", 5, 6, 20], ["CI", 4], ["CI", 2], ["CI", 1], ["FU", 10, [0, 1, 2, 3]], ["SP", 10, 0, 1139712, [32], 1], ["AN", 10, 0, 5], ["AN", 10, 1, 6], ["FU", 6, [0, 1, 2, 3, 4, 5, 6]], ["AN", 6, 0, 5], ["FU", 6, [1, 2, 3, 4, 5, 6, 7]], ["AN", 6, 1, 4], ["FU", 6, [2, 3, 4, 5, 6, 7, 8]], ["AN", 6, 2, 6], ["PR", 5, 0, "auto_unroll_max_step$512"], ["AN", 5, 43, 2], ["AN", 6, 9, 2]]]], "r": [[0.225192, 0.222475, 0.222472], 0, 14.2375, 1630282700], "v": "v0.6"}
{"i": [["[\"492385e7f3538c59581ed6a93e6ef11f\", 1, 16, 212, 168, 32, 16, 3, 3, 1, 32, 1, 1, 1, 32, 212, 168]", "opencl -keys=mali,opencl,gpu -device=mali -max_num_threads=256 -thread_warp_size=1", [2, 16, 64, 4096, 40960, 512, 2, 2], "llvm -keys=cpu -link-params=0 -mtriple=aarch64-linux-gnu", 2, []], [[], [["CI", 8], ["CI", 6], ["CHW", 5, "local"], ["SP", 5, 0, 1, [1, 1, 1, 1], 1], ["SP", 5, 5, 8, [2, 4, 1, 1], 1], ["SP", 5, 10, 212, [1, 1, 4, 1], 1], ["SP", 5, 15, 42, [1, 1, 3, 2], 1], ["SP", 5, 20, 1, [1, 1, 1, 1], 1], ["SP", 5, 25, 4, [1, 2, 1, 1], 1], ["SP", 5, 30, 4, [1, 2, 2, 1], 1], ["SP", 5, 35, 16, [4, 1], 1], ["SP", 5, 38, 3, [3, 1], 1], ["SP", 5, 41, 3, [1, 1], 1], ["RE", 5, [0, 5, 10, 15, 20, 25, 30, 1, 6, 11, 16, 21, 26, 31, 2, 7, 12, 17, 22, 27, 32, 35, 38, 41, 36, 39, 42, 3, 8, 13, 18, 23, 28, 33, 37, 40, 43, 4, 9, 14, 19, 24, 29, 34]], ["FSP", 6, 0, 3, 3], ["FSP", 6, 4, 4, 3], ["FSP", 6, 8, 5, 3], ["FSP", 6, 12, 6, 3], ["FSP", 6, 16, 7, 3], ["FSP", 6, 20, 8, 3], ["FSP", 6, 24, 9, 3], ["RE", 6, [0, 4, 8, 12, 16, 20, 24, 1, 5, 9, 13, 17, 21, 25, 2, 6, 10, 14, 18, 22, 26, 3, 7, 11, 15, 19, 23, 27]], ["CA", 5, 6, 20], ["CI", 4], ["CI", 2], ["CI", 1], ["FU", 10, [0, 1, 2, 3]], ["SP", 10, 0, 1139712, [32], 1], ["AN", 10, 0, 5], ["AN", 10, 1, 6], ["FU", 6, [0, 1, 2, 3, 4, 5, 6]], ["AN", 6, 0, 5], ["FU", 6, [1, 2, 3, 4, 5, 6, 7]], ["AN", 6, 1, 4], ["FU", 6, [2, 3, 4, 5, 6, 7, 8]], ["AN", 6, 2, 6], ["PR", 5, 0, "auto_unroll_max_step$512"], ["AN", 5, 43, 2], ["AN", 6, 9, 2]]]], "r": [[0.239658, 0.238058, 0.237786], 0, 15.9155, 1630282717], "v": "v0.6"}
{"i": [["[\"492385e7f3538c59581ed6a93e6ef11f\", 1, 16, 212, 168, 32, 16, 3, 3, 1, 32, 1, 1, 1, 32, 212, 168]", "opencl -keys=mali,opencl,gpu -device=mali -max_num_threads=256 -thread_warp_size=1", [2, 16, 64, 4096, 40960, 512, 2, 2], "llvm -keys=cpu -link-params=0 -mtriple=aarch64-linux-gnu", 2, []], [[], [["CI", 8], ["CI", 6], ["CHW", 5, "local"], ["SP", 5, 0, 1, [1, 1, 1, 1], 1], ["SP", 5, 5, 8, [2, 4, 1, 1], 1], ["SP", 5, 10, 212, [1, 1, 1, 4], 1], ["SP", 5, 15, 42, [1, 1, 3, 2], 1], ["SP", 5, 20, 1, [1, 1, 1, 1], 1], ["SP", 5, 25, 4, [1, 2, 1, 1], 1], ["SP", 5, 30, 4, [1, 2, 2, 1], 1], ["SP", 5, 35, 16, [16, 1], 1], ["SP", 5, 38, 3, [3, 1], 1], ["SP", 5, 41, 3, [1, 1], 1], ["RE", 5, [0, 5, 10, 15, 20, 25, 30, 1, 6, 11, 16, 21, 26, 31, 2, 7, 12, 17, 22, 27, 32, 35, 38, 41, 36, 39, 42, 3, 8, 13, 18, 23, 28, 33, 37, 40, 43, 4, 9, 14, 19, 24, 29, 34]], ["FSP", 6, 0, 3, 3], ["FSP", 6, 4, 4, 3], ["FSP", 6, 8, 5, 3], ["FSP", 6, 12, 6, 3], ["FSP", 6, 16, 7, 3], ["FSP", 6, 20, 8, 3], ["FSP", 6, 24, 9, 3], ["RE", 6, [0, 4, 8, 12, 16, 20, 24, 1, 5, 9, 13, 17, 21, 25, 2, 6, 10, 14, 18, 22, 26, 3, 7, 11, 15, 19, 23, 27]], ["CA", 5, 6, 20], ["CI", 4], ["CI", 2], ["CI", 1], ["FU", 10, [0, 1, 2, 3]], ["SP", 10, 0, 1139712, [12], 1], ["AN", 10, 0, 5], ["AN", 10, 1, 6], ["FU", 6, [0, 1, 2, 3, 4, 5, 6]], ["AN", 6, 0, 5], ["FU", 6, [1, 2, 3, 4, 5, 6, 7]], ["AN", 6, 1, 4], ["FU", 6, [2, 3, 4, 5, 6, 7, 8]], ["AN", 6, 2, 6], ["PR", 5, 0, "auto_unroll_max_step$512"], ["AN", 5, 43, 2], ["AN", 6, 9, 2]]]], "r": [[0.223555, 0.224259, 0.223655], 0, 16.212, 1630282736], "v": "v0.6"}
{"i": [["[\"492385e7f3538c59581ed6a93e6ef11f\", 1, 16, 212, 168, 32, 16, 3, 3, 1, 32, 1, 1, 1, 32, 212, 168]", "opencl -keys=mali,opencl,gpu -device=mali -max_num_threads=256 -thread_warp_size=1", [2, 16, 64, 4096, 40960, 512, 2, 2], "llvm -keys=cpu -link-params=0 -mtriple=aarch64-linux-gnu", 2, []], [[], [["CI", 8], ["CI", 6], ["CHW", 5, "local"], ["SP", 5, 0, 1, [1, 1, 1, 1], 1], ["SP", 5, 5, 8, [2, 4, 1, 1], 1], ["SP", 5, 10, 212, [1, 1, 4, 1], 1], ["SP", 5, 15, 42, [1, 1, 3, 2], 1], ["SP", 5, 20, 1, [1, 1, 1, 1], 1], ["SP", 5, 25, 4, [1, 2, 1, 1], 1], ["SP", 5, 30, 4, [1, 2, 2, 1], 1], ["SP", 5, 35, 16, [16, 1], 1], ["SP", 5, 38, 3, [3, 1], 1], ["SP", 5, 41, 3, [1, 1], 1], ["RE", 5, [0, 5, 10, 15, 20, 25, 30, 1, 6, 11, 16, 21, 26, 31, 2, 7, 12, 17, 22, 27, 32, 35, 38, 41, 36, 39, 42, 3, 8, 13, 18, 23, 28, 33, 37, 40, 43, 4, 9, 14, 19, 24, 29, 34]], ["FSP", 6, 0, 3, 3], ["FSP", 6, 4, 4, 3], ["FSP", 6, 8, 5, 3], ["FSP", 6, 12, 6, 3], ["FSP", 6, 16, 7, 3], ["FSP", 6, 20, 8, 3], ["FSP", 6, 24, 9, 3], ["RE", 6, [0, 4, 8, 12, 16, 20, 24, 1, 5, 9, 13, 17, 21, 25, 2, 6, 10, 14, 18, 22, 26, 3, 7, 11, 15, 19, 23, 27]], ["CA", 5, 6, 20], ["CI", 4], ["CI", 2], ["CI", 1], ["FU", 10, [0, 1, 2, 3]], ["SP", 10, 0, 1139712, [4], 1], ["AN", 10, 0, 5], ["AN", 10, 1, 6], ["FU", 6, [0, 1, 2, 3, 4, 5, 6]], ["AN", 6, 0, 5], ["FU", 6, [1, 2, 3, 4, 5, 6, 7]], ["AN", 6, 1, 4], ["FU", 6, [2, 3, 4, 5, 6, 7, 8]], ["AN", 6, 2, 6], ["PR", 5, 0, "auto_unroll_max_step$512"], ["AN", 5, 43, 2], ["AN", 6, 9, 2]]]], "r": [[0.237342, 0.239055, 0.238415], 0, 15.3521, 1630282751], "v": "v0.6"}
{"i": [["[\"492385e7f3538c59581ed6a93e6ef11f\", 1, 16, 212, 168, 32, 16, 3, 3, 1, 32, 1, 1, 1, 32, 212, 168]", "opencl -keys=mali,opencl,gpu -device=mali -max_num_threads=256 -thread_warp_size=1", [2, 16, 64, 4096, 40960, 512, 2, 2], "llvm -keys=cpu -link-params=0 -mtriple=aarch64-linux-gnu", 2, []], [[], [["CI", 8], ["CI", 6], ["CHW", 5, "local"], ["SP", 5, 0, 1, [1, 1, 1, 1], 1], ["SP", 5, 5, 8, [1, 4, 1, 1], 1], ["SP", 5, 10, 212, [1, 1, 2, 1], 1], ["SP", 5, 15, 42, [1, 7, 3, 2], 1], ["SP", 5, 20, 1, [1, 1, 1, 1], 1], ["SP", 5, 25, 4, [1, 4, 1, 1], 1], ["SP", 5, 30, 4, [2, 1, 1, 2], 1], ["SP", 5, 35, 16, [1, 1], 1], ["SP", 5, 38, 3, [3, 1], 1], ["SP", 5, 41, 3, [3, 1], 1], ["RE", 5, [0, 5, 10, 15, 20, 25, 30, 1, 6, 11, 16, 21, 26, 31, 2, 7, 12, 17, 22, 27, 32, 35, 38, 41, 36, 39, 42, 3, 8, 13, 18, 23, 28, 33, 37, 40, 43, 4, 9, 14, 19, 24, 29, 34]], ["FSP", 6, 0, 3, 3], ["FSP", 6, 4, 4, 3], ["FSP", 6, 8, 5, 3], ["FSP", 6, 12, 6, 3], ["FSP", 6, 16, 7, 3], ["FSP", 6, 20, 8, 3], ["FSP", 6, 24, 9, 3], ["RE", 6, [0, 4, 8, 12, 16, 20, 24, 1, 5, 9, 13, 17, 21, 25, 2, 6, 10, 14, 18, 22, 26, 3, 7, 11, 15, 19, 23, 27]], ["CA", 5, 6, 20], ["CI", 4], ["CI", 2], ["CI", 1], ["FU", 10, [0, 1, 2, 3]], ["SP", 10, 0, 1139712, [2], 1], ["AN", 10, 0, 5], ["AN", 10, 1, 6], ["FU", 6, [0, 1, 2, 3, 4, 5, 6]], ["AN", 6, 0, 5], ["FU", 6, [1, 2, 3, 4, 5, 6, 7]], ["AN", 6, 1, 4], ["FU", 6, [2, 3, 4, 5, 6, 7, 8]], ["AN", 6, 2, 6], ["PR", 5, 0, "auto_unroll_max_step$1024"], ["AN", 5, 43, 2], ["AN", 6, 9, 2]]]], "r": [[0.218643, 0.218343, 0.218565], 0, 13.668, 1630282765], "v": "v0.6"}
{"i": [["[\"492385e7f3538c59581ed6a93e6ef11f\", 1, 16, 212, 168, 32, 16, 3, 3, 1, 32, 1, 1, 1, 32, 212, 168]", "opencl -keys=mali,opencl,gpu -device=mali -max_num_threads=256 -thread_warp_size=1", [2, 16, 64, 4096, 40960, 512, 2, 2], "llvm -keys=cpu -link-params=0 -mtriple=aarch64-linux-gnu", 2, []], [[], [["CI", 8], ["CI", 6], ["CHW", 5, "local"], ["SP", 5, 0, 1, [1, 1, 1, 1], 1], ["SP", 5, 5, 8, [1, 4, 1, 1], 1], ["SP", 5, 10, 212, [1, 1, 2, 1], 1], ["SP", 5, 15, 42, [1, 7, 3, 2], 1], ["SP", 5, 20, 1, [1, 1, 1, 1], 1], ["SP", 5, 25, 4, [1, 4, 1, 1], 1], ["SP", 5, 30, 4, [2, 1, 1, 2], 1], ["SP", 5, 35, 16, [1, 1], 1], ["SP", 5, 38, 3, [1, 1], 1], ["SP", 5, 41, 3, [3, 1], 1], ["RE", 5, [0, 5, 10, 15, 20, 25, 30, 1, 6, 11, 16, 21, 26, 31, 2, 7, 12, 17, 22, 27, 32, 35, 38, 41, 36, 39, 42, 3, 8, 13, 18, 23, 28, 33, 37, 40, 43, 4, 9, 14, 19, 24, 29, 34]], ["FSP", 6, 0, 3, 3], ["FSP", 6, 4, 4, 3], ["FSP", 6, 8, 5, 3], ["FSP", 6, 12, 6, 3], ["FSP", 6, 16, 7, 3], ["FSP", 6, 20, 8, 3], ["FSP", 6, 24, 9, 3], ["RE", 6, [0, 4, 8, 12, 16, 20, 24, 1, 5, 9, 13, 17, 21, 25, 2, 6, 10, 14, 18, 22, 26, 3, 7, 11, 15, 19, 23, 27]], ["CA", 5, 6, 20], ["CI", 4], ["CI", 2], ["CI", 1], ["FU", 10, [0, 1, 2, 3]], ["SP", 10, 0, 1139712, [2], 1], ["AN", 10, 0, 5], ["AN", 10, 1, 6], ["FU", 6, [0, 1, 2, 3, 4, 5, 6]], ["AN", 6, 0, 5], ["FU", 6, [1, 2, 3, 4, 5, 6, 7]], ["AN", 6, 1, 4], ["FU", 6, [2, 3, 4, 5, 6, 7, 8]], ["AN", 6, 2, 6], ["PR", 5, 0, "auto_unroll_max_step$1024"], ["AN", 5, 43, 2], ["AN", 6, 9, 2]]]], "r": [[0.218946, 0.218252, 0.218318], 0, 13.5562, 1630282778], "v": "v0.6"}
{"i": [["[\"492385e7f3538c59581ed6a93e6ef11f\", 1, 16, 212, 168, 32, 16, 3, 3, 1, 32, 1, 1, 1, 32, 212, 168]", "opencl -keys=mali,opencl,gpu -device=mali -max_num_threads=256 -thread_warp_size=1", [2, 16, 64, 4096, 40960, 512, 2, 2], "llvm -keys=cpu -link-params=0 -mtriple=aarch64-linux-gnu", 2, []], [[], [["CI", 8], ["CI", 6], ["CHW", 5, "local"], ["SP", 5, 0, 1, [1, 1, 1, 1], 1], ["SP", 5, 5, 8, [2, 4, 1, 1], 1], ["SP", 5, 10, 212, [1, 1, 1, 4], 1], ["SP", 5, 15, 42, [1, 1, 3, 2], 1], ["SP", 5, 20, 1, [1, 1, 1, 1], 1], ["SP", 5, 25, 4, [1, 2, 1, 1], 1], ["SP", 5, 30, 4, [1, 2, 2, 1], 1], ["SP", 5, 35, 16, [16, 1], 1], ["SP", 5, 38, 3, [1, 1], 1], ["SP", 5, 41, 3, [1, 1], 1], ["RE", 5, [0, 5, 10, 15, 20, 25, 30, 1, 6, 11, 16, 21, 26, 31, 2, 7, 12, 17, 22, 27, 32, 35, 38, 41, 36, 39, 42, 3, 8, 13, 18, 23, 28, 33, 37, 40, 43, 4, 9, 14, 19, 24, 29, 34]], ["FSP", 6, 0, 3, 3], ["FSP", 6, 4, 4, 3], ["FSP", 6, 8, 5, 3], ["FSP", 6, 12, 6, 3], ["FSP", 6, 16, 7, 3], ["FSP", 6, 20, 8, 3], ["FSP", 6, 24, 9, 3], ["RE", 6, [0, 4, 8, 12, 16, 20, 24, 1, 5, 9, 13, 17, 21, 25, 2, 6, 10, 14, 18, 22, 26, 3, 7, 11, 15, 19, 23, 27]], ["CA", 5, 6, 20], ["CI", 4], ["CI", 2], ["CI", 1], ["FU", 10, [0, 1, 2, 3]], ["SP", 10, 0, 1139712, [2], 1], ["AN", 10, 0, 5], ["AN", 10, 1, 6], ["FU", 6, [0, 1, 2, 3, 4, 5, 6]], ["AN", 6, 0, 5], ["FU", 6, [1, 2, 3, 4, 5, 6, 7]], ["AN", 6, 1, 4], ["FU", 6, [2, 3, 4, 5, 6, 7, 8]], ["AN", 6, 2, 6], ["PR", 5, 0, "auto_unroll_max_step$512"], ["AN", 5, 43, 2], ["AN", 6, 9, 2]]]], "r": [[0.323522, 0.322456, 0.322787], 0, 14.6571, 1630282793], "v": "v0.6"}
{"i": [["[\"492385e7f3538c59581ed6a93e6ef11f\", 1, 16, 212, 168, 32, 16, 3, 3, 1, 32, 1, 1, 1, 32, 212, 168]", "opencl -keys=mali,opencl,gpu -device=mali -max_num_threads=256 -thread_warp_size=1", [2, 16, 64, 4096, 40960, 512, 2, 2], "llvm -keys=cpu -link-params=0 -mtriple=aarch64-linux-gnu", 2, []], [[], [["CI", 8], ["CI", 6], ["CHW", 5, "local"], ["SP", 5, 0, 1, [1, 1, 1, 1], 1], ["SP", 5, 5, 8, [2, 4, 1, 1], 1], ["SP", 5, 10, 212, [1, 1, 4, 1], 1], ["SP", 5, 15, 42, [1, 1, 3, 2], 1], ["SP", 5, 20, 1, [1, 1, 1, 1], 1], ["SP", 5, 25, 4, [1, 2, 1, 1], 1], ["SP", 5, 30, 4, [1, 2, 2, 1], 1], ["SP", 5, 35, 16, [16, 1], 1], ["SP", 5, 38, 3, [1, 1], 1], ["SP", 5, 41, 3, [1, 1], 1], ["RE", 5, [0, 5, 10, 15, 20, 25, 30, 1, 6, 11, 16, 21, 26, 31, 2, 7, 12, 17, 22, 27, 32, 35, 38, 41, 36, 39, 42, 3, 8, 13, 18, 23, 28, 33, 37, 40, 43, 4, 9, 14, 19, 24, 29, 34]], ["FSP", 6, 0, 3, 3], ["FSP", 6, 4, 4, 3], ["FSP", 6, 8, 5, 3], ["FSP", 6, 12, 6, 3], ["FSP", 6, 16, 7, 3], ["FSP", 6, 20, 8, 3], ["FSP", 6, 24, 9, 3], ["RE", 6, [0, 4, 8, 12, 16, 20, 24, 1, 5, 9, 13, 17, 21, 25, 2, 6, 10, 14, 18, 22, 26, 3, 7, 11, 15, 19, 23, 27]], ["CA", 5, 6, 20], ["CI", 4], ["CI", 2], ["CI", 1], ["FU", 10, [0, 1, 2, 3]], ["SP", 10, 0, 1139712, [32], 1], ["AN", 10, 0, 5], ["AN", 10, 1, 6], ["FU", 6, [0, 1, 2, 3, 4, 5, 6]], ["AN", 6, 0, 5], ["FU", 6, [1, 2, 3, 4, 5, 6, 7]], ["AN", 6, 1, 4], ["FU", 6, [2, 3, 4, 5, 6, 7, 8]], ["AN", 6, 2, 6], ["PR", 5, 0, "auto_unroll_max_step$512"], ["AN", 5, 43, 2], ["AN", 6, 9, 2]]]], "r": [[0.348354, 0.342789, 0.342935], 0, 15.7823, 1630282808], "v": "v0.6"}
{"i": [["[\"492385e7f3538c59581ed6a93e6ef11f\", 1, 16, 212, 168, 32, 16, 3, 3, 1, 32, 1, 1, 1, 32, 212, 168]", "opencl -keys=mali,opencl,gpu -device=mali -max_num_threads=256 -thread_warp_size=1", [2, 16, 64, 4096, 40960, 512, 2, 2], "llvm -keys=cpu -link-params=0 -mtriple=aarch64-linux-gnu", 2, []], [[], [["CI", 8], ["CI", 6], ["CHW", 5, "local"], ["SP", 5, 0, 1, [1, 1, 1, 1], 1], ["SP", 5, 5, 8, [2, 4, 1, 1], 1], ["SP", 5, 10, 212, [1, 1, 2, 2], 1], ["SP", 5, 15, 42, [1, 1, 3, 2], 1], ["SP", 5, 20, 1, [1, 1, 1, 1], 1], ["SP", 5, 25, 4, [1, 2, 1, 1], 1], ["SP", 5, 30, 4, [1, 2, 2, 1], 1], ["SP", 5, 35, 16, [16, 1], 1], ["SP", 5, 38, 3, [3, 1], 1], ["SP", 5, 41, 3, [1, 1], 1], ["RE", 5, [0, 5, 10, 15, 20, 25, 30, 1, 6, 11, 16, 21, 26, 31, 2, 7, 12, 17, 22, 27, 32, 35, 38, 41, 36, 39, 42, 3, 8, 13, 18, 23, 28, 33, 37, 40, 43, 4, 9, 14, 19, 24, 29, 34]], ["FSP", 6, 0, 3, 3], ["FSP", 6, 4, 4, 3], ["FSP", 6, 8, 5, 3], ["FSP", 6, 12, 6, 3], ["FSP", 6, 16, 7, 3], ["FSP", 6, 20, 8, 3], ["FSP", 6, 24, 9, 3], ["RE", 6, [0, 4, 8, 12, 16, 20, 24, 1, 5, 9, 13, 17, 21, 25, 2, 6, 10, 14, 18, 22, 26, 3, 7, 11, 15, 19, 23, 27]], ["CA", 5, 6, 20], ["CI", 4], ["CI", 2], ["CI", 1], ["FU", 10, [0, 1, 2, 3]], ["SP", 10, 0, 1139712, [4], 1], ["AN", 10, 0, 5], ["AN", 10, 1, 6], ["FU", 6, [0, 1, 2, 3, 4, 5, 6]], ["AN", 6, 0, 5], ["FU", 6, [1, 2, 3, 4, 5, 6, 7]], ["AN", 6, 1, 4], ["FU", 6, [2, 3, 4, 5, 6, 7, 8]], ["AN", 6, 2, 6], ["PR", 5, 0, "auto_unroll_max_step$512"], ["AN", 5, 43, 2], ["AN", 6, 9, 2]]]], "r": [[0.234333, 0.233222, 0.234129], 0, 15.1775, 1630282823], "v": "v0.6"}
{"i": [["[\"492385e7f3538c59581ed6a93e6ef11f\", 1, 16, 212, 168, 32, 16, 3, 3, 1, 32, 1, 1, 1, 32, 212, 168]", "opencl -keys=mali,opencl,gpu -device=mali -max_num_threads=256 -thread_warp_size=1", [2, 16, 64, 4096, 40960, 512, 2, 2], "llvm -keys=cpu -link-params=0 -mtriple=aarch64-linux-gnu", 2, []], [[], [["CI", 8], ["CI", 6], ["CHW", 5, "local"], ["SP", 5, 0, 1, [1, 1, 1, 1], 1], ["SP", 5, 5, 8, [1, 1, 2, 4], 1], ["SP", 5, 10, 212, [1, 53, 2, 1], 1], ["SP", 5, 15, 42, [2, 1, 1, 3], 1], ["SP", 5, 20, 1, [1, 1, 1, 1], 1], ["SP", 5, 25, 4, [1, 1, 1, 1], 1], ["SP", 5, 30, 4, [1, 2, 1, 1], 1], ["SP", 5, 35, 16, [1, 1], 1], ["SP", 5, 38, 3, [1, 1], 1], ["SP", 5, 41, 3, [1, 1], 1], ["RE", 5, [0, 5, 10, 15, 20, 25, 30, 1, 6, 11, 16, 21, 26, 31, 2, 7, 12, 17, 22, 27, 32, 35, 38, 41, 36, 39, 42, 3, 8, 13, 18, 23, 28, 33, 37, 40, 43, 4, 9, 14, 19, 24, 29, 34]], ["FSP", 6, 0, 3, 3], ["FSP", 6, 4, 4, 3], ["FSP", 6, 8, 5, 3], ["FSP", 6, 12, 6, 3], ["FSP", 6, 16, 7, 3], ["FSP", 6, 20, 8, 3], ["FSP", 6, 24, 9, 3], ["RE", 6, [0, 4, 8, 12, 16, 20, 24, 1, 5, 9, 13, 17, 21, 25, 2, 6, 10, 14, 18, 22, 26, 3, 7, 11, 15, 19, 23, 27]], ["CA", 5, 6, 20], ["CI", 4], ["CI", 2], ["CI", 1], ["FU", 10, [0, 1, 2, 3]], ["SP", 10, 0, 1139712, [14], 1], ["AN", 10, 0, 5], ["AN", 10, 1, 6], ["FU", 6, [0, 1, 2, 3, 4, 5, 6]], ["AN", 6, 0, 5], ["FU", 6, [1, 2, 3, 4, 5, 6, 7]], ["AN", 6, 1, 4], ["FU", 6, [2, 3, 4, 5, 6, 7, 8]], ["AN", 6, 2, 6], ["PR", 5, 0, "auto_unroll_max_step$1024"], ["AN", 5, 43, 2], ["AN", 6, 9, 2]]]], "r": [[0.277531, 0.276612, 0.275903], 0, 19.7212, 1630282843], "v": "v0.6"}
{"i": [["[\"492385e7f3538c59581ed6a93e6ef11f\", 1, 16, 212, 168, 32, 16, 3, 3, 1, 32, 1, 1, 1, 32, 212, 168]", "opencl -keys=mali,opencl,gpu -device=mali -max_num_threads=256 -thread_warp_size=1", [2, 16, 64, 4096, 40960, 512, 2, 2], "llvm -keys=cpu -link-params=0 -mtriple=aarch64-linux-gnu", 2, []], [[], [["CI", 8], ["CI", 6], ["CHW", 5, "local"], ["SP", 5, 0, 1, [1, 1, 1, 1], 1], ["SP", 5, 5, 8, [2, 4, 1, 1], 1], ["SP", 5, 10, 212, [1, 1, 1, 4], 1], ["SP", 5, 15, 42, [1, 1, 1, 6], 1], ["SP", 5, 20, 1, [1, 1, 1, 1], 1], ["SP", 5, 25, 4, [1, 2, 1, 1], 1], ["SP", 5, 30, 4, [1, 2, 2, 1], 1], ["SP", 5, 35, 16, [2, 1], 1], ["SP", 5, 38, 3, [3, 1], 1], ["SP", 5, 41, 3, [1, 1], 1], ["RE", 5, [0, 5, 10, 15, 20, 25, 30, 1, 6, 11, 16, 21, 26, 31, 2, 7, 12, 17, 22, 27, 32, 35, 38, 41, 36, 39, 42, 3, 8, 13, 18, 23, 28, 33, 37, 40, 43, 4, 9, 14, 19, 24, 29, 34]], ["FSP", 6, 0, 3, 3], ["FSP", 6, 4, 4, 3], ["FSP", 6, 8, 5, 3], ["FSP", 6, 12, 6, 3], ["FSP", 6, 16, 7, 3], ["FSP", 6, 20, 8, 3], ["FSP", 6, 24, 9, 3], ["RE", 6, [0, 4, 8, 12, 16, 20, 24, 1, 5, 9, 13, 17, 21, 25, 2, 6, 10, 14, 18, 22, 26, 3, 7, 11, 15, 19, 23, 27]], ["CA", 5, 6, 20], ["CI", 4], ["CI", 2], ["CI", 1], ["FU", 10, [0, 1, 2, 3]], ["SP", 10, 0, 1139712, [48], 1], ["AN", 10, 0, 5], ["AN", 10, 1, 6], ["FU", 6, [0, 1, 2, 3, 4, 5, 6]], ["AN", 6, 0, 5], ["FU", 6, [1, 2, 3, 4, 5, 6, 7]], ["AN", 6, 1, 4], ["FU", 6, [2, 3, 4, 5, 6, 7, 8]], ["AN", 6, 2, 6], ["PR", 5, 0, "auto_unroll_max_step$512"], ["AN", 5, 43, 2], ["AN", 6, 9, 2]]]], "r": [[0.235364, 0.236995, 0.242757], 0, 17.272, 1630282865], "v": "v0.6"}
{"i": [["[\"492385e7f3538c59581ed6a93e6ef11f\", 1, 16, 212, 168, 32, 16, 3, 3, 1, 32, 1, 1, 1, 32, 212, 168]", "opencl -keys=mali,opencl,gpu -device=mali -max_num_threads=256 -thread_warp_size=1", [2, 16, 64, 4096, 40960, 512, 2, 2], "llvm -keys=cpu -link-params=0 -mtriple=aarch64-linux-gnu", 2, []], [[], [["CI", 8], ["CI", 6], ["CHW", 5, "local"], ["SP", 5, 0, 1, [1, 1, 1, 1], 1], ["SP", 5, 5, 8, [1, 4, 1, 1], 1], ["SP", 5, 10, 212, [1, 1, 2, 1], 1], ["SP", 5, 15, 42, [1, 7, 3, 2], 1], ["SP", 5, 20, 1, [1, 1, 1, 1], 1], ["SP", 5, 25, 4, [1, 4, 1, 1], 1], ["SP", 5, 30, 4, [2, 1, 1, 2], 1], ["SP", 5, 35, 16, [1, 1], 1], ["SP", 5, 38, 3, [1, 1], 1], ["SP", 5, 41, 3, [1, 1], 1], ["RE", 5, [0, 5, 10, 15, 20, 25, 30, 1, 6, 11, 16, 21, 26, 31, 2, 7, 12, 17, 22, 27, 32, 35, 38, 41, 36, 39, 42, 3, 8, 13, 18, 23, 28, 33, 37, 40, 43, 4, 9, 14, 19, 24, 29, 34]], ["FSP", 6, 0, 3, 3], ["FSP", 6, 4, 4, 3], ["FSP", 6, 8, 5, 3], ["FSP", 6, 12, 6, 3], ["FSP", 6, 16, 7, 3], ["FSP", 6, 20, 8, 3], ["FSP", 6, 24, 9, 3], ["RE", 6, [0, 4, 8, 12, 16, 20, 24, 1, 5, 9, 13, 17, 21, 25, 2, 6, 10, 14, 18, 22, 26, 3, 7, 11, 15, 19, 23, 27]], ["CA", 5, 6, 20], ["CI", 4], ["CI", 2], ["CI", 1], ["FU", 10, [0, 1, 2, 3]], ["SP", 10, 0, 1139712, [1], 1], ["AN", 10, 0, 5], ["AN", 10, 1, 6], ["FU", 6, [0, 1, 2, 3, 4, 5, 6]], ["AN", 6, 0, 5], ["FU", 6, [1, 2, 3, 4, 5, 6, 7]], ["AN", 6, 1, 4], ["FU", 6, [2, 3, 4, 5, 6, 7, 8]], ["AN", 6, 2, 6], ["PR", 5, 0, "auto_unroll_max_step$1024"], ["AN", 5, 43, 2], ["AN", 6, 9, 2]]]], "r": [[0.230836, 0.230709, 0.230303], 0, 13.2872, 1630282878], "v": "v0.6"}
{"i": [["[\"492385e7f3538c59581ed6a93e6ef11f\", 1, 16, 212, 168, 32, 16, 3, 3, 1, 32, 1, 1, 1, 32, 212, 168]", "opencl -keys=mali,opencl,gpu -device=mali -max_num_threads=256 -thread_warp_size=1", [2, 16, 64, 4096, 40960, 512, 2, 2], "llvm -keys=cpu -link-params=0 -mtriple=aarch64-linux-gnu", 2, []], [[], [["CI", 8], ["CI", 6], ["CHW", 5, "local"], ["SP", 5, 0, 1, [1, 1, 1, 1], 1], ["SP", 5, 5, 8, [2, 4, 1, 1], 1], ["SP", 5, 10, 212, [1, 1, 1, 4], 1], ["SP", 5, 15, 42, [1, 1, 1, 6], 1], ["SP", 5, 20, 1, [1, 1, 1, 1], 1], ["SP", 5, 25, 4, [1, 2, 1, 1], 1], ["SP", 5, 30, 4, [1, 2, 2, 1], 1], ["SP", 5, 35, 16, [2, 1], 1], ["SP", 5, 38, 3, [3, 1], 1], ["SP", 5, 41, 3, [1, 1], 1], ["RE", 5, [0, 5, 10, 15, 20, 25, 30, 1, 6, 11, 16, 21, 26, 31, 2, 7, 12, 17, 22, 27, 32, 35, 38, 41, 36, 39, 42, 3, 8, 13, 18, 23, 28, 33, 37, 40, 43, 4, 9, 14, 19, 24, 29, 34]], ["FSP", 6, 0, 3, 3], ["FSP", 6, 4, 4, 3], ["FSP", 6, 8, 5, 3], ["FSP", 6, 12, 6, 3], ["FSP", 6, 16, 7, 3], ["FSP", 6, 20, 8, 3], ["FSP", 6, 24, 9, 3], ["RE", 6, [0, 4, 8, 12, 16, 20, 24, 1, 5, 9, 13, 17, 21, 25, 2, 6, 10, 14, 18, 22, 26, 3, 7, 11, 15, 19, 23, 27]], ["CA", 5, 6, 20], ["CI", 4], ["CI", 2], ["CI", 1], ["FU", 10, [0, 1, 2, 3]], ["SP", 10, 0, 1139712, [2], 1], ["AN", 10, 0, 5], ["AN", 10, 1, 6], ["FU", 6, [0, 1, 2, 3, 4, 5, 6]], ["AN", 6, 0, 5], ["FU", 6, [1, 2, 3, 4, 5, 6, 7]], ["AN", 6, 1, 4], ["FU", 6, [2, 3, 4, 5, 6, 7, 8]], ["AN", 6, 2, 6], ["PR", 5, 0, "auto_unroll_max_step$512"], ["AN", 5, 43, 2], ["AN", 6, 9, 2]]]], "r": [[0.238078, 0.237217, 0.238483], 0, 16.4604, 1630282894], "v": "v0.6"}
{"i": [["[\"492385e7f3538c59581ed6a93e6ef11f\", 1, 16, 212, 168, 32, 16, 3, 3, 1, 32, 1, 1, 1, 32, 212, 168]", "opencl -keys=mali,opencl,gpu -device=mali -max_num_threads=256 -thread_warp_size=1", [2, 16, 64, 4096, 40960, 512, 2, 2], "llvm -keys=cpu -link-params=0 -mtriple=aarch64-linux-gnu", 2, []], [[], [["CI", 8], ["CI", 6], ["CHW", 5, "local"], ["SP", 5, 0, 1, [1, 1, 1, 1], 1], ["SP", 5, 5, 8, [2, 4, 1, 1], 1], ["SP", 5, 10, 212, [1, 1, 1, 4], 1], ["SP", 5, 15, 42, [1, 1, 3, 2], 1], ["SP", 5, 20, 1, [1, 1, 1, 1], 1], ["SP", 5, 25, 4, [1, 2, 1, 1], 1], ["SP", 5, 30, 4, [1, 2, 2, 1], 1], ["SP", 5, 35, 16, [16, 1], 1], ["SP", 5, 38, 3, [1, 1], 1], ["SP", 5, 41, 3, [1, 1], 1], ["RE", 5, [0, 5, 10, 15, 20, 25, 30, 1, 6, 11, 16, 21, 26, 31, 2, 7, 12, 17, 22, 27, 32, 35, 38, 41, 36, 39, 42, 3, 8, 13, 18, 23, 28, 33, 37, 40, 43, 4, 9, 14, 19, 24, 29, 34]], ["FSP", 6, 0, 3, 3], ["FSP", 6, 4, 4, 3], ["FSP", 6, 8, 5, 3], ["FSP", 6, 12, 6, 3], ["FSP", 6, 16, 7, 3], ["FSP", 6, 20, 8, 3], ["FSP", 6, 24, 9, 3], ["RE", 6, [0, 4, 8, 12, 16, 20, 24, 1, 5, 9, 13, 17, 21, 25, 2, 6, 10, 14, 18, 22, 26, 3, 7, 11, 15, 19, 23, 27]], ["CA", 5, 6, 20], ["CI", 4], ["CI", 2], ["CI", 1], ["FU", 10, [0, 1, 2, 3]], ["SP", 10, 0, 1139712, [2], 1], ["AN", 10, 0, 5], ["AN", 10, 1, 6], ["FU", 6, [0, 1, 2, 3, 4, 5, 6]], ["AN", 6, 0, 5], ["FU", 6, [1, 2, 3, 4, 5, 6, 7]], ["AN", 6, 1, 4], ["FU", 6, [2, 3, 4, 5, 6, 7, 8]], ["AN", 6, 2, 6], ["PR", 5, 0, "auto_unroll_max_step$1024"], ["AN", 5, 43, 2], ["AN", 6, 9, 2]]]], "r": [[0.324693, 0.322703, 0.326955], 0, 14.7585, 1630282911], "v": "v0.6"}
{"i": [["[\"492385e7f3538c59581ed6a93e6ef11f\", 1, 16, 212, 168, 32, 16, 3, 3, 1, 32, 1, 1, 1, 32, 212, 168]", "opencl -keys=mali,opencl,gpu -device=mali -max_num_threads=256 -thread_warp_size=1", [2, 16, 64, 4096, 40960, 512, 2, 2], "llvm -keys=cpu -link-params=0 -mtriple=aarch64-linux-gnu", 2, []], [[], [["CI", 8], ["CI", 6], ["CHW", 5, "local"], ["SP", 5, 0, 1, [1, 1, 1, 1], 1], ["SP", 5, 5, 8, [1, 8, 1, 1], 1], ["SP", 5, 10, 212, [1, 1, 1, 4], 1], ["SP", 5, 15, 42, [2, 7, 1, 1], 1], ["SP", 5, 20, 1, [1, 1, 1, 1], 1], ["SP", 5, 25, 4, [1, 1, 1, 2], 1], ["SP", 5, 30, 4, [1, 1, 2, 1], 1], ["SP", 5, 35, 16, [1, 1], 1], ["SP", 5, 38, 3, [1, 3], 1], ["SP", 5, 41, 3, [3, 1], 1], ["RE", 5, [0, 5, 10, 15, 20, 25, 30, 1, 6, 11, 16, 21, 26, 31, 2, 7, 12, 17, 22, 27, 32, 35, 38, 41, 36, 39, 42, 3, 8, 13, 18, 23, 28, 33, 37, 40, 43, 4, 9, 14, 19, 24, 29, 34]], ["FSP", 6, 0, 3, 3], ["FSP", 6, 4, 4, 3], ["FSP", 6, 8, 5, 3], ["FSP", 6, 12, 6, 3], ["FSP", 6, 16, 7, 3], ["FSP", 6, 20, 8, 3], ["FSP", 6, 24, 9, 3], ["RE", 6, [0, 4, 8, 12, 16, 20, 24, 1, 5, 9, 13, 17, 21, 25, 2, 6, 10, 14, 18, 22, 26, 3, 7, 11, 15, 19, 23, 27]], ["CA", 5, 6, 20], ["CI", 4], ["CI", 2], ["CI", 1], ["FU", 10, [0, 1, 2, 3]], ["SP", 10, 0, 1139712, [2], 1], ["AN", 10, 0, 5], ["AN", 10, 1, 6], ["FU", 6, [0, 1, 2, 3, 4, 5, 6]], ["AN", 6, 0, 5], ["FU", 6, [1, 2, 3, 4, 5, 6, 7]], ["AN", 6, 1, 4], ["FU", 6, [2, 3, 4, 5, 6, 7, 8]], ["AN", 6, 2, 6], ["PR", 5, 0, "auto_unroll_max_step$512"], ["AN", 5, 43, 2], ["AN", 6, 9, 2]]]], "r": [[0.19128, 0.191391, 0.192325], 0, 12.4526, 1630282923], "v": "v0.6"}
{"i": [["[\"492385e7f3538c59581ed6a93e6ef11f\", 1, 16, 212, 168, 32, 16, 3, 3, 1, 32, 1, 1, 1, 32, 212, 168]", "opencl -keys=mali,opencl,gpu -device=mali -max_num_threads=256 -thread_warp_size=1", [2, 16, 64, 4096, 40960, 512, 2, 2], "llvm -keys=cpu -link-params=0 -mtriple=aarch64-linux-gnu", 2, []], [[], [["CI", 8], ["CI", 6], ["CHW", 5, "local"], ["SP", 5, 0, 1, [1, 1, 1, 1], 1], ["SP", 5, 5, 8, [1, 1, 4, 2], 1], ["SP", 5, 10, 212, [1, 53, 2, 1], 1], ["SP", 5, 15, 42, [2, 1, 1, 3], 1], ["SP", 5, 20, 1, [1, 1, 1, 1], 1], ["SP", 5, 25, 4, [1, 1, 1, 1], 1], ["SP", 5, 30, 4, [1, 2, 1, 1], 1], ["SP", 5, 35, 16, [1, 1], 1], ["SP", 5, 38, 3, [1, 1], 1], ["SP", 5, 41, 3, [1, 1], 1], ["RE", 5, [0, 5, 10, 15, 20, 25, 30, 1, 6, 11, 16, 21, 26, 31, 2, 7, 12, 17, 22, 27, 32, 35, 38, 41, 36, 39, 42, 3, 8, 13, 18, 23, 28, 33, 37, 40, 43, 4, 9, 14, 19, 24, 29, 34]], ["FSP", 6, 0, 3, 3], ["FSP", 6, 4, 4, 3], ["FSP", 6, 8, 5, 3], ["FSP", 6, 12, 6, 3], ["FSP", 6, 16, 7, 3], ["FSP", 6, 20, 8, 3], ["FSP", 6, 24, 9, 3], ["RE", 6, [0, 4, 8, 12, 16, 20, 24, 1, 5, 9, 13, 17, 21, 25, 2, 6, 10, 14, 18, 22, 26, 3, 7, 11, 15, 19, 23, 27]], ["CA", 5, 6, 20], ["CI", 4], ["CI", 2], ["CI", 1], ["FU", 10, [0, 1, 2, 3]], ["SP", 10, 0, 1139712, [53], 1], ["AN", 10, 0, 5], ["AN", 10, 1, 6], ["FU", 6, [0, 1, 2, 3, 4, 5, 6]], ["AN", 6, 0, 5], ["FU", 6, [1, 2, 3, 4, 5, 6, 7]], ["AN", 6, 1, 4], ["FU", 6, [2, 3, 4, 5, 6, 7, 8]], ["AN", 6, 2, 6], ["PR", 5, 0, "auto_unroll_max_step$1024"], ["AN", 5, 43, 2], ["AN", 6, 9, 2]]]], "r": [[0.256905, 0.255815, 0.255635], 0, 19.0831, 1630282942], "v": "v0.6"}
{"i": [["[\"492385e7f3538c59581ed6a93e6ef11f\", 1, 16, 212, 168, 32, 16, 3, 3, 1, 32, 1, 1, 1, 32, 212, 168]", "opencl -keys=mali,opencl,gpu -device=mali -max_num_threads=256 -thread_warp_size=1", [2, 16, 64, 4096, 40960, 512, 2, 2], "llvm -keys=cpu -link-params=0 -mtriple=aarch64-linux-gnu", 2, []], [[], [["CI", 8], ["CI", 6], ["CHW", 5, "local"], ["SP", 5, 0, 1, [1, 1, 1, 1], 1], ["SP", 5, 5, 8, [1, 4, 1, 1], 1], ["SP", 5, 10, 212, [1, 1, 1, 2], 1], ["SP", 5, 15, 42, [1, 7, 3, 2], 1], ["SP", 5, 20, 1, [1, 1, 1, 1], 1], ["SP", 5, 25, 4, [1, 4, 1, 1], 1], ["SP", 5, 30, 4, [2, 1, 1, 2], 1], ["SP", 5, 35, 16, [1, 1], 1], ["SP", 5, 38, 3, [1, 1], 1], ["SP", 5, 41, 3, [1, 3], 1], ["RE", 5, [0, 5, 10, 15, 20, 25, 30, 1, 6, 11, 16, 21, 26, 31, 2, 7, 12, 17, 22, 27, 32, 35, 38, 41, 36, 39, 42, 3, 8, 13, 18, 23, 28, 33, 37, 40, 43, 4, 9, 14, 19, 24, 29, 34]], ["FSP", 6, 0, 3, 3], ["FSP", 6, 4, 4, 3], ["FSP", 6, 8, 5, 3], ["FSP", 6, 12, 6, 3], ["FSP", 6, 16, 7, 3], ["FSP", 6, 20, 8, 3], ["FSP", 6, 24, 9, 3], ["RE", 6, [0, 4, 8, 12, 16, 20, 24, 1, 5, 9, 13, 17, 21, 25, 2, 6, 10, 14, 18, 22, 26, 3, 7, 11, 15, 19, 23, 27]], ["CA", 5, 6, 20], ["CI", 4], ["CI", 2], ["CI", 1], ["FU", 10, [0, 1, 2, 3]], ["SP", 10, 0, 1139712, [8], 1], ["AN", 10, 0, 5], ["AN", 10, 1, 6], ["FU", 6, [0, 1, 2, 3, 4, 5, 6]], ["AN", 6, 0, 5], ["FU", 6, [1, 2, 3, 4, 5, 6, 7]], ["AN", 6, 1, 4], ["FU", 6, [2, 3, 4, 5, 6, 7, 8]], ["AN", 6, 2, 6], ["PR", 5, 0, "auto_unroll_max_step$1024"], ["AN", 5, 43, 2], ["AN", 6, 9, 2]]]], "r": [[0.213862, 0.212892, 0.212956], 0, 13.3436, 1630282960], "v": "v0.6"}
{"i": [["[\"492385e7f3538c59581ed6a93e6ef11f\", 1, 16, 212, 168, 32, 16, 3, 3, 1, 32, 1, 1, 1, 32, 212, 168]", "opencl -keys=mali,opencl,gpu -device=mali -max_num_threads=256 -thread_warp_size=1", [2, 16, 64, 4096, 40960, 512, 2, 2], "llvm -keys=cpu -link-params=0 -mtriple=aarch64-linux-gnu", 2, []], [[], [["CI", 8], ["CI", 6], ["CHW", 5, "local"], ["SP", 5, 0, 1, [1, 1, 1, 1], 1], ["SP", 5, 5, 8, [2, 4, 1, 1], 1], ["SP", 5, 10, 212, [1, 1, 1, 4], 1], ["SP", 5, 15, 42, [1, 1, 3, 2], 1], ["SP", 5, 20, 1, [1, 1, 1, 1], 1], ["SP", 5, 25, 4, [1, 2, 1, 1], 1], ["SP", 5, 30, 4, [1, 2, 2, 1], 1], ["SP", 5, 35, 16, [16, 1], 1], ["SP", 5, 38, 3, [3, 1], 1], ["SP", 5, 41, 3, [1, 1], 1], ["RE", 5, [0, 5, 10, 15, 20, 25, 30, 1, 6, 11, 16, 21, 26, 31, 2, 7, 12, 17, 22, 27, 32, 35, 38, 41, 36, 39, 42, 3, 8, 13, 18, 23, 28, 33, 37, 40, 43, 4, 9, 14, 19, 24, 29, 34]], ["FSP", 6, 0, 3, 3], ["FSP", 6, 4, 4, 3], ["FSP", 6, 8, 5, 3], ["FSP", 6, 12, 6, 3], ["FSP", 6, 16, 7, 3], ["FSP", 6, 20, 8, 3], ["FSP", 6, 24, 9, 3], ["RE", 6, [0, 4, 8, 12, 16, 20, 24, 1, 5, 9, 13, 17, 21, 25, 2, 6, 10, 14, 18, 22, 26, 3, 7, 11, 15, 19, 23, 27]], ["CA", 5, 6, 20], ["CI", 4], ["CI", 2], ["CI", 1], ["FU", 10, [0, 1, 2, 3]], ["SP", 10, 0, 1139712, [64], 1], ["AN", 10, 0, 5], ["AN", 10, 1, 6], ["FU", 6, [0, 1, 2, 3, 4, 5, 6]], ["AN", 6, 0, 5], ["FU", 6, [1, 2, 3, 4, 5, 6, 7]], ["AN", 6, 1, 4], ["FU", 6, [2, 3, 4, 5, 6, 7, 8]], ["AN", 6, 2, 6], ["PR", 5, 0, "auto_unroll_max_step$16"], ["AN", 5, 43, 2], ["AN", 6, 9, 2]]]], "r": [[0.467658, 0.465716, 0.465623], 0, 14.0072, 1630282975], "v": "v0.6"}
{"i": [["[\"492385e7f3538c59581ed6a93e6ef11f\", 1, 16, 212, 168, 32, 16, 3, 3, 1, 32, 1, 1, 1, 32, 212, 168]", "opencl -keys=mali,opencl,gpu -device=mali -max_num_threads=256 -thread_warp_size=1", [2, 16, 64, 4096, 40960, 512, 2, 2], "llvm -keys=cpu -link-params=0 -mtriple=aarch64-linux-gnu", 2, []], [[], [["CI", 8], ["CI", 6], ["CHW", 5, "local"], ["SP", 5, 0, 1, [1, 1, 1, 1], 1], ["SP", 5, 5, 8, [1, 4, 1, 1], 1], ["SP", 5, 10, 212, [1, 1, 2, 1], 1], ["SP", 5, 15, 42, [1, 7, 3, 2], 1], ["SP", 5, 20, 1, [1, 1, 1, 1], 1], ["SP", 5, 25, 4, [1, 4, 1, 1], 1], ["SP", 5, 30, 4, [2, 1, 1, 2], 1], ["SP", 5, 35, 16, [1, 1], 1], ["SP", 5, 38, 3, [1, 1], 1], ["SP", 5, 41, 3, [1, 3], 1], ["RE", 5, [0, 5, 10, 15, 20, 25, 30, 1, 6, 11, 16, 21, 26, 31, 2, 7, 12, 17, 22, 27, 32, 35, 38, 41, 36, 39, 42, 3, 8, 13, 18, 23, 28, 33, 37, 40, 43, 4, 9, 14, 19, 24, 29, 34]], ["FSP", 6, 0, 3, 3], ["FSP", 6, 4, 4, 3], ["FSP", 6, 8, 5, 3], ["FSP", 6, 12, 6, 3], ["FSP", 6, 16, 7, 3], ["FSP", 6, 20, 8, 3], ["FSP", 6, 24, 9, 3], ["RE", 6, [0, 4, 8, 12, 16, 20, 24, 1, 5, 9, 13, 17, 21, 25, 2, 6, 10, 14, 18, 22, 26, 3, 7, 11, 15, 19, 23, 27]], ["CA", 5, 6, 20], ["CI", 4], ["CI", 2], ["CI", 1], ["FU", 10, [0, 1, 2, 3]], ["SP", 10, 0, 1139712, [8], 1], ["AN", 10, 0, 5], ["AN", 10, 1, 6], ["FU", 6, [0, 1, 2, 3, 4, 5, 6]], ["AN", 6, 0, 5], ["FU", 6, [1, 2, 3, 4, 5, 6, 7]], ["AN", 6, 1, 4], ["FU", 6, [2, 3, 4, 5, 6, 7, 8]], ["AN", 6, 2, 6], ["PR", 5, 0, "auto_unroll_max_step$1024"], ["AN", 5, 43, 2], ["AN", 6, 9, 2]]]], "r": [[0.177456, 0.178971, 0.177281], 0, 13.2976, 1630282988], "v": "v0.6"}
{"i": [["[\"492385e7f3538c59581ed6a93e6ef11f\", 1, 16, 212, 168, 32, 16, 3, 3, 1, 32, 1, 1, 1, 32, 212, 168]", "opencl -keys=mali,opencl,gpu -device=mali -max_num_threads=256 -thread_warp_size=1", [2, 16, 64, 4096, 40960, 512, 2, 2], "llvm -keys=cpu -link-params=0 -mtriple=aarch64-linux-gnu", 2, []], [[], [["CI", 8], ["CI", 6], ["CHW", 5, "local"], ["SP", 5, 0, 1, [1, 1, 1, 1], 1], ["SP", 5, 5, 8, [1, 4, 1, 1], 1], ["SP", 5, 10, 212, [1, 1, 2, 1], 1], ["SP", 5, 15, 42, [1, 7, 3, 2], 1], ["SP", 5, 20, 1, [1, 1, 1, 1], 1], ["SP", 5, 25, 4, [1, 4, 1, 1], 1], ["SP", 5, 30, 4, [2, 1, 1, 2], 1], ["SP", 5, 35, 16, [1, 1], 1], ["SP", 5, 38, 3, [1, 1], 1], ["SP", 5, 41, 3, [1, 3], 1], ["RE", 5, [0, 5, 10, 15, 20, 25, 30, 1, 6, 11, 16, 21, 26, 31, 2, 7, 12, 17, 22, 27, 32, 35, 38, 41, 36, 39, 42, 3, 8, 13, 18, 23, 28, 33, 37, 40, 43, 4, 9, 14, 19, 24, 29, 34]], ["FSP", 6, 0, 3, 3], ["FSP", 6, 4, 4, 3], ["FSP", 6, 8, 5, 3], ["FSP", 6, 12, 6, 3], ["FSP", 6, 16, 7, 3], ["FSP", 6, 20, 8, 3], ["FSP", 6, 24, 9, 3], ["RE", 6, [0, 4, 8, 12, 16, 20, 24, 1, 5, 9, 13, 17, 21, 25, 2, 6, 10, 14, 18, 22, 26, 3, 7, 11, 15, 19, 23, 27]], ["CA", 5, 6, 20], ["CI", 4], ["CI", 2], ["CI", 1], ["FU", 10, [0, 1, 2, 3]], ["SP", 10, 0, 1139712, [56], 1], ["AN", 10, 0, 5], ["AN", 10, 1, 6], ["FU", 6, [0, 1, 2, 3, 4, 5, 6]], ["AN", 6, 0, 5], ["FU", 6, [1, 2, 3, 4, 5, 6, 7]], ["AN", 6, 1, 4], ["FU", 6, [2, 3, 4, 5, 6, 7, 8]], ["AN", 6, 2, 6], ["PR", 5, 0, "auto_unroll_max_step$1024"], ["AN", 5, 43, 2], ["AN", 6, 9, 2]]]], "r": [[0.177975, 0.178963, 0.177125], 0, 13.2979, 1630283001], "v": "v0.6"}
{"i": [["[\"492385e7f3538c59581ed6a93e6ef11f\", 1, 16, 212, 168, 32, 16, 3, 3, 1, 32, 1, 1, 1, 32, 212, 168]", "opencl -keys=mali,opencl,gpu -device=mali -max_num_threads=256 -thread_warp_size=1", [2, 16, 64, 4096, 40960, 512, 2, 2], "llvm -keys=cpu -link-params=0 -mtriple=aarch64-linux-gnu", 2, []], [[], [["CI", 8], ["CI", 6], ["CHW", 5, "local"], ["SP", 5, 0, 1, [1, 1, 1, 1], 1], ["SP", 5, 5, 8, [2, 4, 1, 1], 1], ["SP", 5, 10, 212, [1, 1, 1, 4], 1], ["SP", 5, 15, 42, [1, 1, 3, 2], 1], ["SP", 5, 20, 1, [1, 1, 1, 1], 1], ["SP", 5, 25, 4, [1, 2, 1, 1], 1], ["SP", 5, 30, 4, [1, 2, 2, 1], 1], ["SP", 5, 35, 16, [2, 1], 1], ["SP", 5, 38, 3, [1, 1], 1], ["SP", 5, 41, 3, [1, 1], 1], ["RE", 5, [0, 5, 10, 15, 20, 25, 30, 1, 6, 11, 16, 21, 26, 31, 2, 7, 12, 17, 22, 27, 32, 35, 38, 41, 36, 39, 42, 3, 8, 13, 18, 23, 28, 33, 37, 40, 43, 4, 9, 14, 19, 24, 29, 34]], ["FSP", 6, 0, 3, 3], ["FSP", 6, 4, 4, 3], ["FSP", 6, 8, 5, 3], ["FSP", 6, 12, 6, 3], ["FSP", 6, 16, 7, 3], ["FSP", 6, 20, 8, 3], ["FSP", 6, 24, 9, 3], ["RE", 6, [0, 4, 8, 12, 16, 20, 24, 1, 5, 9, 13, 17, 21, 25, 2, 6, 10, 14, 18, 22, 26, 3, 7, 11, 15, 19, 23, 27]], ["CA", 5, 6, 20], ["CI", 4], ["CI", 2], ["CI", 1], ["FU", 10, [0, 1, 2, 3]], ["SP", 10, 0, 1139712, [2], 1], ["AN", 10, 0, 5], ["AN", 10, 1, 6], ["FU", 6, [0, 1, 2, 3, 4, 5, 6]], ["AN", 6, 0, 5], ["FU", 6, [1, 2, 3, 4, 5, 6, 7]], ["AN", 6, 1, 4], ["FU", 6, [2, 3, 4, 5, 6, 7, 8]], ["AN", 6, 2, 6], ["PR", 5, 0, "auto_unroll_max_step$1024"], ["AN", 5, 43, 2], ["AN", 6, 9, 2]]]], "r": [[0.324068, 0.323244, 0.323024], 0, 20.9176, 1630283023], "v": "v0.6"}
{"i": [["[\"492385e7f3538c59581ed6a93e6ef11f\", 1, 16, 212, 168, 32, 16, 3, 3, 1, 32, 1, 1, 1, 32, 212, 168]", "opencl -keys=mali,opencl,gpu -device=mali -max_num_threads=256 -thread_warp_size=1", [2, 16, 64, 4096, 40960, 512, 2, 2], "llvm -keys=cpu -link-params=0 -mtriple=aarch64-linux-gnu", 2, []], [[], [["CI", 8], ["CI", 6], ["CHW", 5, "local"], ["SP", 5, 0, 1, [1, 1, 1, 1], 1], ["SP", 5, 5, 8, [2, 4, 1, 1], 1], ["SP", 5, 10, 212, [1, 1, 1, 4], 1], ["SP", 5, 15, 42, [1, 1, 3, 2], 1], ["SP", 5, 20, 1, [1, 1, 1, 1], 1], ["SP", 5, 25, 4, [1, 2, 1, 1], 1], ["SP", 5, 30, 4, [1, 2, 2, 1], 1], ["SP", 5, 35, 16, [16, 1], 1], ["SP", 5, 38, 3, [3, 1], 1], ["SP", 5, 41, 3, [1, 1], 1], ["RE", 5, [0, 5, 10, 15, 20, 25, 30, 1, 6, 11, 16, 21, 26, 31, 2, 7, 12, 17, 22, 27, 32, 35, 38, 41, 36, 39, 42, 3, 8, 13, 18, 23, 28, 33, 37, 40, 43, 4, 9, 14, 19, 24, 29, 34]], ["FSP", 6, 0, 3, 3], ["FSP", 6, 4, 4, 3], ["FSP", 6, 8, 5, 3], ["FSP", 6, 12, 6, 3], ["FSP", 6, 16, 7, 3], ["FSP", 6, 20, 8, 3], ["FSP", 6, 24, 9, 3], ["RE", 6, [0, 4, 8, 12, 16, 20, 24, 1, 5, 9, 13, 17, 21, 25, 2, 6, 10, 14, 18, 22, 26, 3, 7, 11, 15, 19, 23, 27]], ["CA", 5, 6, 20], ["CI", 4], ["CI", 2], ["CI", 1], ["FU", 10, [0, 1, 2, 3]], ["SP", 10, 0, 1139712, [64], 1], ["AN", 10, 0, 5], ["AN", 10, 1, 6], ["FU", 6, [0, 1, 2, 3, 4, 5, 6]], ["AN", 6, 0, 5], ["FU", 6, [1, 2, 3, 4, 5, 6, 7]], ["AN", 6, 1, 4], ["FU", 6, [2, 3, 4, 5, 6, 7, 8]], ["AN", 6, 2, 6], ["PR", 5, 0, "auto_unroll_max_step$64"], ["AN", 5, 43, 2], ["AN", 6, 9, 2]]]], "r": [[0.468776, 0.470477, 0.467409], 0, 14.6511, 1630283040], "v": "v0.6"}
{"i": [["[\"492385e7f3538c59581ed6a93e6ef11f\", 1, 16, 212, 168, 32, 16, 3, 3, 1, 32, 1, 1, 1, 32, 212, 168]", "opencl -keys=mali,opencl,gpu -device=mali -max_num_threads=256 -thread_warp_size=1", [2, 16, 64, 4096, 40960, 512, 2, 2], "llvm -keys=cpu -link-params=0 -mtriple=aarch64-linux-gnu", 2, []], [[], [["CI", 8], ["CI", 6], ["CHW", 5, "local"], ["SP", 5, 0, 1, [1, 1, 1, 1], 1], ["SP", 5, 5, 8, [1, 4, 1, 1], 1], ["SP", 5, 10, 212, [1, 1, 2, 1], 1], ["SP", 5, 15, 42, [1, 7, 3, 2], 1], ["SP", 5, 20, 1, [1, 1, 1, 1], 1], ["SP", 5, 25, 4, [1, 4, 1, 1], 1], ["SP", 5, 30, 4, [2, 1, 1, 2], 1], ["SP", 5, 35, 16, [1, 1], 1], ["SP", 5, 38, 3, [1, 1], 1], ["SP", 5, 41, 3, [1, 3], 1], ["RE", 5, [0, 5, 10, 15, 20, 25, 30, 1, 6, 11, 16, 21, 26, 31, 2, 7, 12, 17, 22, 27, 32, 35, 38, 41, 36, 39, 42, 3, 8, 13, 18, 23, 28, 33, 37, 40, 43, 4, 9, 14, 19, 24, 29, 34]], ["FSP", 6, 0, 3, 3], ["FSP", 6, 4, 4, 3], ["FSP", 6, 8, 5, 3], ["FSP", 6, 12, 6, 3], ["FSP", 6, 16, 7, 3], ["FSP", 6, 20, 8, 3], ["FSP", 6, 24, 9, 3], ["RE", 6, [0, 4, 8, 12, 16, 20, 24, 1, 5, 9, 13, 17, 21, 25, 2, 6, 10, 14, 18, 22, 26, 3, 7, 11, 15, 19, 23, 27]], ["CA", 5, 6, 20], ["CI", 4], ["CI", 2], ["CI", 1], ["FU", 10, [0, 1, 2, 3]], ["SP", 10, 0, 1139712, [28], 1], ["AN", 10, 0, 5], ["AN", 10, 1, 6], ["FU", 6, [0, 1, 2, 3, 4, 5, 6]], ["AN", 6, 0, 5], ["FU", 6, [1, 2, 3, 4, 5, 6, 7]], ["AN", 6, 1, 4], ["FU", 6, [2, 3, 4, 5, 6, 7, 8]], ["AN", 6, 2, 6], ["PR", 5, 0, "auto_unroll_max_step$1024"], ["AN", 5, 43, 2], ["AN", 6, 9, 2]]]], "r": [[0.1825, 0.17758, 0.177368], 0, 13.1611, 1630283053], "v": "v0.6"}
