example_04/auto_tvm_log/v9h-model-01-NCHW-opencl-C1000-T21-08-31-08-33.log.tmp
{"input": ["opencl -keys=mali,opencl,gpu -device=mali -max_num_threads=256 -thread_warp_size=1", "conv2d_nchw_spatial_pack.mali", [["TENSOR", [1, 16, 212, 168], "float32"], ["TENSOR", [15, 16, 1, 1], "float32"], [1, 1], [0, 0, 0, 0], [1, 1], "float32"], {}], "config": {"index": 979663, "code_hash": null, "entity": [["tile_co", "sp", [-1, 1, 3]], ["tile_oh", "sp", [-1, 212, 1]], ["tile_ow", "sp", [-1, 2, 2]], ["reorder_0", "re", [0, 1, 2, 3, 4, 5, 6, 9, 7, 8]], ["ann_reduce", "an", ["none", "unroll"]], ["ann_spatial", "an", ["unroll", "none", "none"]]]}, "result": [[0.0345293334], 0, 9.136543273925781, 1630370019.35422], "version": 0.2, "tvm_version": "0.8.dev0"}
{"input": ["opencl -keys=mali,opencl,gpu -device=mali -max_num_threads=256 -thread_warp_size=1", "conv2d_nchw_spatial_pack.mali", [["TENSOR", [1, 16, 212, 168], "float32"], ["TENSOR", [15, 16, 1, 1], "float32"], [1, 1], [0, 0, 0, 0], [1, 1], "float32"], {}], "config": {"index": 14071, "code_hash": null, "entity": [["tile_co", "sp", [-1, 1, 3]], ["tile_oh", "sp", [-1, 1, 106]], ["tile_ow", "sp", [-1, 3, 56]], ["reorder_0", "re", [0, 1, 2, 3, 4, 5, 6, 7, 8, 9]], ["ann_reduce", "an", ["none", "none"]], ["ann_spatial", "an", ["none", "none", "none"]]]}, "result": [[0.0684722666], 0, 18.758829355239868, 1630370028.9883795], "version": 0.2, "tvm_version": "0.8.dev0"}
{"input": ["opencl -keys=mali,opencl,gpu -device=mali -max_num_threads=256 -thread_warp_size=1", "conv2d_nchw_spatial_pack.mali", [["TENSOR", [1, 16, 212, 168], "float32"], ["TENSOR", [15, 16, 1, 1], "float32"], [1, 1], [0, 0, 0, 0], [1, 1], "float32"], {}], "config": {"index": 1440112, "code_hash": null, "entity": [["tile_co", "sp", [-1, 1, 3]], ["tile_oh", "sp", [-1, 1, 4]], ["tile_ow", "sp", [-1, 4, 14]], ["reorder_0", "re", [0, 1, 2, 3, 4, 5, 6, 7, 8, 9]], ["ann_reduce", "an", ["none", "unroll"]], ["ann_spatial", "an", ["unroll", "unroll", "unroll"]]]}, "result": [[0.052192066599999996], 0, 30.248358964920044, 1630370040.4755156], "version": 0.2, "tvm_version": "0.8.dev0"}
{"input": ["opencl -keys=mali,opencl,gpu -device=mali -max_num_threads=256 -thread_warp_size=1", "conv2d_nchw_spatial_pack.mali", [["TENSOR", [1, 16, 212, 168], "float32"], ["TENSOR", [15, 16, 1, 1], "float32"], [1, 1], [0, 0, 0, 0], [1, 1], "float32"], {}], "config": {"index": 1153769, "code_hash": null, "entity": [["tile_co", "sp", [-1, 5, 3]], ["tile_oh", "sp", [-1, 1, 1]], ["tile_ow", "sp", [-1, 42, 1]], ["reorder_0", "re", [0, 1, 2, 3, 4, 5, 6, 9, 7, 8]], ["ann_reduce", "an", ["unroll", "unroll"]], ["ann_spatial", "an", ["unroll", "none", "unroll"]]]}, "result": [[0.0316390668], 0, 37.37375450134277, 1630370047.6612651], "version": 0.2, "tvm_version": "0.8.dev0"}
{"input": ["opencl -keys=mali,opencl,gpu -device=mali -max_num_threads=256 -thread_warp_size=1", "conv2d_nchw_spatial_pack.mali", [["TENSOR", [1, 16, 212, 168], "float32"], ["TENSOR", [15, 16, 1, 1], "float32"], [1, 1], [0, 0, 0, 0], [1, 1], "float32"], {}], "config": {"index": 1360825, "code_hash": null, "entity": [["tile_co", "sp", [-1, 3, 5]], ["tile_oh", "sp", [-1, 4, 1]], ["tile_ow", "sp", [-1, 4, 3]], ["reorder_0", "re", [0, 1, 2, 3, 4, 5, 6, 9, 7, 8]], ["ann_reduce", "an", ["unroll", "none"]], ["ann_spatial", "an", ["unroll", "unroll", "none"]]]}, "result": [[0.026299875], 0, 9.387064933776855, 1630370057.310927], "version": 0.2, "tvm_version": "0.8.dev0"}
{"input": ["opencl -keys=mali,opencl,gpu -device=mali -max_num_threads=256 -thread_warp_size=1", "conv2d_nchw_spatial_pack.mali", [["TENSOR", [1, 16, 212, 168], "float32"], ["TENSOR", [15, 16, 1, 1], "float32"], [1, 1], [0, 0, 0, 0], [1, 1], "float32"], {}], "config": {"index": 1875053, "code_hash": null, "entity": [["tile_co", "sp", [-1, 5, 1]], ["tile_oh", "sp", [-1, 2, 2]], ["tile_ow", "sp", [-1, 6, 7]], ["reorder_0", "re", [0, 1, 2, 3, 4, 5, 6, 7, 8, 9]], ["ann_reduce", "an", ["none", "none"]], ["ann_spatial", "an", ["vec", "none", "none"]]]}, "result": [[0.026229125], 0, 18.51675033569336, 1630370066.4516413], "version": 0.2, "tvm_version": "0.8.dev0"}
{"input": ["opencl -keys=mali,opencl,gpu -device=mali -max_num_threads=256 -thread_warp_size=1", "conv2d_nchw_spatial_pack.mali", [["TENSOR", [1, 16, 212, 168], "float32"], ["TENSOR", [15, 16, 1, 1], "float32"], [1, 1], [0, 0, 0, 0], [1, 1], "float32"], {}], "config": {"index": 1469233, "code_hash": null, "entity": [["tile_co", "sp", [-1, 3, 1]], ["tile_oh", "sp", [-1, 1, 2]], ["tile_ow", "sp", [-1, 4, 14]], ["reorder_0", "re", [0, 1, 2, 3, 4, 5, 6, 7, 8, 9]], ["ann_reduce", "an", ["unroll", "none"]], ["ann_spatial", "an", ["unroll", "unroll", "unroll"]]]}, "result": [[0.010171511066666666], 0, 27.055770874023438, 1630370074.985527], "version": 0.2, "tvm_version": "0.8.dev0"}
{"input": ["opencl -keys=mali,opencl,gpu -device=mali -max_num_threads=256 -thread_warp_size=1", "conv2d_nchw_spatial_pack.mali", [["TENSOR", [1, 16, 212, 168], "float32"], ["TENSOR", [15, 16, 1, 1], "float32"], [1, 1], [0, 0, 0, 0], [1, 1], "float32"], {}], "config": {"index": 1082863, "code_hash": null, "entity": [["tile_co", "sp", [-1, 3, 1]], ["tile_oh", "sp", [-1, 1, 2]], ["tile_ow", "sp", [-1, 21, 2]], ["reorder_0", "re", [0, 1, 2, 3, 4, 5, 6, 7, 8, 9]], ["ann_reduce", "an", ["none", "unroll"]], ["ann_spatial", "an", ["unroll", "none", "unroll"]]]}, "result": [[0.023637125000000002], 0, 35.98476314544678, 1630370083.9291582], "version": 0.2, "tvm_version": "0.8.dev0"}
{"input": ["opencl -keys=mali,opencl,gpu -device=mali -max_num_threads=256 -thread_warp_size=1", "conv2d_nchw_spatial_pack.mali", [["TENSOR", [1, 16, 212, 168], "float32"], ["TENSOR", [15, 16, 1, 1], "float32"], [1, 1], [0, 0, 0, 0], [1, 1], "float32"], {}], "config": {"index": 1081515, "code_hash": null, "entity": [["tile_co", "sp", [-1, 15, 1]], ["tile_oh", "sp", [-1, 1, 1]], ["tile_ow", "sp", [-1, 1, 2]], ["reorder_0", "re", [0, 1, 2, 3, 4, 5, 6, 7, 8, 9]], ["ann_reduce", "an", ["none", "unroll"]], ["ann_spatial", "an", ["unroll", "none", "unroll"]]]}, "result": [[0.0419536668], 0, 45.01749300956726, 1630370092.9700859], "version": 0.2, "tvm_version": "0.8.dev0"}
{"input": ["opencl -keys=mali,opencl,gpu -device=mali -max_num_threads=256 -thread_warp_size=1", "conv2d_nchw_spatial_pack.mali", [["TENSOR", [1, 16, 212, 168], "float32"], ["TENSOR", [15, 16, 1, 1], "float32"], [1, 1], [0, 0, 0, 0], [1, 1], "float32"], {}], "config": {"index": 455169, "code_hash": null, "entity": [["tile_co", "sp", [-1, 15, 1]], ["tile_oh", "sp", [-1, 1, 53]], ["tile_ow", "sp", [-1, 4, 2]], ["reorder_0", "re", [0, 1, 2, 3, 4, 5, 6, 9, 7, 8]], ["ann_reduce", "an", ["unroll", "unroll"]], ["ann_spatial", "an", ["none", "unroll", "none"]]]}, "result": [[0.0620869334], 0, 54.180800676345825, 1630370102.1874359], "version": 0.2, "tvm_version": "0.8.dev0"}
{"input": ["opencl -keys=mali,opencl,gpu -device=mali -max_num_threads=256 -thread_warp_size=1", "conv2d_nchw_spatial_pack.mali", [["TENSOR", [1, 16, 212, 168], "float32"], ["TENSOR", [15, 16, 1, 1], "float32"], [1, 1], [0, 0, 0, 0], [1, 1], "float32"], {}], "config": {"index": 1390014, "code_hash": null, "entity": [["tile_co", "sp", [-1, 1, 1]], ["tile_oh", "sp", [-1, 1, 2]], ["tile_ow", "sp", [-1, 4, 3]], ["reorder_0", "re", [0, 1, 2, 3, 4, 5, 6, 9, 7, 8]], ["ann_reduce", "an", ["unroll", "unroll"]], ["ann_spatial", "an", ["unroll", "unroll", "none"]]]}, "result": [[0.0300398666], 0, 8.946440935134888, 1630370111.4129071], "version": 0.2, "tvm_version": "0.8.dev0"}
{"input": ["opencl -keys=mali,opencl,gpu -device=mali -max_num_threads=256 -thread_warp_size=1", "conv2d_nchw_spatial_pack.mali", [["TENSOR", [1, 16, 212, 168], "float32"], ["TENSOR", [15, 16, 1, 1], "float32"], [1, 1], [0, 0, 0, 0], [1, 1], "float32"], {}], "config": {"index": 1504503, "code_hash": null, "entity": [["tile_co", "sp", [-1, 1, 1]], ["tile_oh", "sp", [-1, 2, 1]], ["tile_ow", "sp", [-1, 2, 2]], ["reorder_0", "re", [0, 1, 2, 3, 4, 5, 6, 9, 7, 8]], ["ann_reduce", "an", ["unroll", "unroll"]], ["ann_spatial", "an", ["unroll", "unroll", "unroll"]]]}, "result": [[0.01834297216666667], 0, 18.069812297821045, 1630370120.543987], "version": 0.2, "tvm_version": "0.8.dev0"}
{"input": ["opencl -keys=mali,opencl,gpu -device=mali -max_num_threads=256 -thread_warp_size=1", "conv2d_nchw_spatial_pack.mali", [["TENSOR", [1, 16, 212, 168], "float32"], ["TENSOR", [15, 16, 1, 1], "float32"], [1, 1], [0, 0, 0, 0], [1, 1], "float32"], {}], "config": {"index": 1242794, "code_hash": null, "entity": [["tile_co", "sp", [-1, 5, 1]], ["tile_oh", "sp", [-1, 1, 4]], ["tile_ow", "sp", [-1, 7, 2]], ["reorder_0", "re", [0, 1, 2, 3, 4, 5, 6, 9, 7, 8]], ["ann_reduce", "an", ["unroll", "none"]], ["ann_spatial", "an", ["unroll", "none", "vec"]]]}, "result": [[0.019456166625], 0, 27.417603254318237, 1630370129.9025602], "version": 0.2, "tvm_version": "0.8.dev0"}
{"input": ["opencl -keys=mali,opencl,gpu -device=mali -max_num_threads=256 -thread_warp_size=1", "conv2d_nchw_spatial_pack.mali", [["TENSOR", [1, 16, 212, 168], "float32"], ["TENSOR", [15, 16, 1, 1], "float32"], [1, 1], [0, 0, 0, 0], [1, 1], "float32"], {}], "config": {"index": 1477602, "code_hash": null, "entity": [["tile_co", "sp", [-1, 1, 1]], ["tile_oh", "sp", [-1, 1, 1]], ["tile_ow", "sp", [-1, 7, 3]], ["reorder_0", "re", [0, 1, 2, 3, 4, 5, 6, 9, 7, 8]], ["ann_reduce", "an", ["unroll", "none"]], ["ann_spatial", "an", ["unroll", "unroll", "unroll"]]]}, "result": [[0.029986083375], 0, 36.981083393096924, 1630370139.4996274], "version": 0.2, "tvm_version": "0.8.dev0"}
{"input": ["opencl -keys=mali,opencl,gpu -device=mali -max_num_threads=256 -thread_warp_size=1", "conv2d_nchw_spatial_pack.mali", [["TENSOR", [1, 16, 212, 168], "float32"], ["TENSOR", [15, 16, 1, 1], "float32"], [1, 1], [0, 0, 0, 0], [1, 1], "float32"], {}], "config": {"index": 31384, "code_hash": null, "entity": [["tile_co", "sp", [-1, 3, 1]], ["tile_oh", "sp", [-1, 2, 53]], ["tile_ow", "sp", [-1, 56, 1]], ["reorder_0", "re", [0, 1, 2, 3, 4, 5, 6, 7, 8, 9]], ["ann_reduce", "an", ["none", "unroll"]], ["ann_spatial", "an", ["none", "none", "none"]]]}, "result": [[0.10479793340000002], 0, 46.931522369384766, 1630370149.4715016], "version": 0.2, "tvm_version": "0.8.dev0"}
{"input": ["opencl -keys=mali,opencl,gpu -device=mali -max_num_threads=256 -thread_warp_size=1", "conv2d_nchw_spatial_pack.mali", [["TENSOR", [1, 16, 212, 168], "float32"], ["TENSOR", [15, 16, 1, 1], "float32"], [1, 1], [0, 0, 0, 0], [1, 1], "float32"], {}], "config": {"index": 60999, "code_hash": null, "entity": [["tile_co", "sp", [-1, 1, 5]], ["tile_oh", "sp", [-1, 106, 2]], ["tile_ow", "sp", [-1, 1, 2]], ["reorder_0", "re", [0, 1, 2, 3, 4, 5, 6, 7, 8, 9]], ["ann_reduce", "an", ["unroll", "none"]], ["ann_spatial", "an", ["none", "none", "none"]]]}, "result": [[0.030896583249999998], 0, 8.66775918006897, 1630370158.4250603], "version": 0.2, "tvm_version": "0.8.dev0"}
{"input": ["opencl -keys=mali,opencl,gpu -device=mali -max_num_threads=256 -thread_warp_size=1", "conv2d_nchw_spatial_pack.mali", [["TENSOR", [1, 16, 212, 168], "float32"], ["TENSOR", [15, 16, 1, 1], "float32"], [1, 1], [0, 0, 0, 0], [1, 1], "float32"], {}], "config": {"index": 266627, "code_hash": null, "entity": [["tile_co", "sp", [-1, 5, 1]], ["tile_oh", "sp", [-1, 1, 106]], ["tile_ow", "sp", [-1, 28, 2]], ["reorder_0", "re", [0, 1, 2, 3, 4, 5, 6, 7, 8, 9]], ["ann_reduce", "an", ["none", "unroll"]], ["ann_spatial", "an", ["none", "none", "vec"]]]}, "result": [[0.0652396666], 0, 18.04653811454773, 1630370167.8160627], "version": 0.2, "tvm_version": "0.8.dev0"}
{"input": ["opencl -keys=mali,opencl,gpu -device=mali -max_num_threads=256 -thread_warp_size=1", "conv2d_nchw_spatial_pack.mali", [["TENSOR", [1, 16, 212, 168], "float32"], ["TENSOR", [15, 16, 1, 1], "float32"], [1, 1], [0, 0, 0, 0], [1, 1], "float32"], {}], "config": {"index": 834157, "code_hash": null, "entity": [["tile_co", "sp", [-1, 3, 1]], ["tile_oh", "sp", [-1, 4, 1]], ["tile_ow", "sp", [-1, 4, 2]], ["reorder_0", "re", [0, 1, 2, 3, 4, 5, 6, 9, 7, 8]], ["ann_reduce", "an", ["none", "none"]], ["ann_spatial", "an", ["none", "vec", "unroll"]]]}, "result": [[0.0316574], 0, 26.697810173034668, 1630370176.4767647], "version": 0.2, "tvm_version": "0.8.dev0"}
{"input": ["opencl -keys=mali,opencl,gpu -device=mali -max_num_threads=256 -thread_warp_size=1", "conv2d_nchw_spatial_pack.mali", [["TENSOR", [1, 16, 212, 168], "float32"], ["TENSOR", [15, 16, 1, 1], "float32"], [1, 1], [0, 0, 0, 0], [1, 1], "float32"], {}], "config": {"index": 114549, "code_hash": null, "entity": [["tile_co", "sp", [-1, 1, 5]], ["tile_oh", "sp", [-1, 2, 1]], ["tile_ow", "sp", [-1, 7, 24]], ["reorder_0", "re", [0, 1, 2, 3, 4, 5, 6, 9, 7, 8]], ["ann_reduce", "an", ["unroll", "unroll"]], ["ann_spatial", "an", ["none", "none", "none"]]]}, "result": [[0.2660751334], 0, 39.26648473739624, 1630370189.0490832], "version": 0.2, "tvm_version": "0.8.dev0"}
{"input": ["opencl -keys=mali,opencl,gpu -device=mali -max_num_threads=256 -thread_warp_size=1", "conv2d_nchw_spatial_pack.mali", [["TENSOR", [1, 16, 212, 168], "float32"], ["TENSOR", [15, 16, 1, 1], "float32"], [1, 1], [0, 0, 0, 0], [1, 1], "float32"], {}], "config": {"index": 116122, "code_hash": null, "entity": [["tile_co", "sp", [-1, 1, 3]], ["tile_oh", "sp", [-1, 4, 53]], ["tile_ow", "sp", [-1, 3, 56]], ["reorder_0", "re", [0, 1, 2, 3, 4, 5, 6, 9, 7, 8]], ["ann_reduce", "an", ["unroll", "unroll"]], ["ann_spatial", "an", ["none", "none", "none"]]]}, "result": [[0.1109194668], 0, 47.26540684700012, 1630370197.061233], "version": 0.2, "tvm_version": "0.8.dev0"}
{"input": ["opencl -keys=mali,opencl,gpu -device=mali -max_num_threads=256 -thread_warp_size=1", "conv2d_nchw_spatial_pack.mali", [["TENSOR", [1, 16, 212, 168], "float32"], ["TENSOR", [15, 16, 1, 1], "float32"], [1, 1], [0, 0, 0, 0], [1, 1], "float32"], {}], "config": {"index": 1041825, "code_hash": null, "entity": [["tile_co", "sp", [-1, 15, 1]], ["tile_oh", "sp", [-1, 1, 1]], ["tile_ow", "sp", [-1, 14, 4]], ["reorder_0", "re", [0, 1, 2, 3, 4, 5, 6, 9, 7, 8]], ["ann_reduce", "an", ["unroll", "unroll"]], ["ann_spatial", "an", ["unroll", "none", "none"]]]}, "result": [[0.023289583375], 0, 56.83150839805603, 1630370206.6285694], "version": 0.2, "tvm_version": "0.8.dev0"}
{"input": ["opencl -keys=mali,opencl,gpu -device=mali -max_num_threads=256 -thread_warp_size=1", "conv2d_nchw_spatial_pack.mali", [["TENSOR", [1, 16, 212, 168], "float32"], ["TENSOR", [15, 16, 1, 1], "float32"], [1, 1], [0, 0, 0, 0], [1, 1], "float32"], {}], "config": {"index": 2016090, "code_hash": null, "entity": [["tile_co", "sp", [-1, 1, 1]], ["tile_oh", "sp", [-1, 1, 1]], ["tile_ow", "sp", [-1, 28, 2]], ["reorder_0", "re", [0, 1, 2, 3, 4, 5, 6, 7, 8, 9]], ["ann_reduce", "an", ["none", "unroll"]], ["ann_spatial", "an", ["vec", "none", "unroll"]]]}, "result": [[0.0497894668], 0, 65.83823132514954, 1630370215.6764946], "version": 0.2, "tvm_version": "0.8.dev0"}
{"input": ["opencl -keys=mali,opencl,gpu -device=mali -max_num_threads=256 -thread_warp_size=1", "conv2d_nchw_spatial_pack.mali", [["TENSOR", [1, 16, 212, 168], "float32"], ["TENSOR", [15, 16, 1, 1], "float32"], [1, 1], [0, 0, 0, 0], [1, 1], "float32"], {}], "config": {"index": 2279727, "code_hash": null, "entity": [["tile_co", "sp", [-1, 1, 1]], ["tile_oh", "sp", [-1, 2, 2]], ["tile_ow", "sp", [-1, 8, 3]], ["reorder_0", "re", [0, 1, 2, 3, 4, 5, 6, 7, 8, 9]], ["ann_reduce", "an", ["unroll", "none"]], ["ann_spatial", "an", ["vec", "unroll", "unroll"]]]}, "result": [[0.12860213339999998], 0, 76.0298080444336, 1630370225.8731635], "version": 0.2, "tvm_version": "0.8.dev0"}
{"input": ["opencl -keys=mali,opencl,gpu -device=mali -max_num_threads=256 -thread_warp_size=1", "conv2d_nchw_spatial_pack.mali", [["TENSOR", [1, 16, 212, 168], "float32"], ["TENSOR", [15, 16, 1, 1], "float32"], [1, 1], [0, 0, 0, 0], [1, 1], "float32"], {}], "config": {"index": 46873, "code_hash": null, "entity": [["tile_co", "sp", [-1, 3, 1]], ["tile_oh", "sp", [-1, 1, 2]], ["tile_ow", "sp", [-1, 4, 2]], ["reorder_0", "re", [0, 1, 2, 3, 4, 5, 6, 9, 7, 8]], ["ann_reduce", "an", ["none", "unroll"]], ["ann_spatial", "an", ["none", "none", "none"]]]}, "result": [[0.023586125], 0, 3.282156467437744, 1630370298.2781396], "version": 0.2, "tvm_version": "0.8.dev0"}
{"input": ["opencl -keys=mali,opencl,gpu -device=mali -max_num_threads=256 -thread_warp_size=1", "conv2d_nchw_spatial_pack.mali", [["TENSOR", [1, 16, 212, 168], "float32"], ["TENSOR", [15, 16, 1, 1], "float32"], [1, 1], [0, 0, 0, 0], [1, 1], "float32"], {}], "config": {"index": 47035, "code_hash": null, "entity": [["tile_co", "sp", [-1, 3, 1]], ["tile_oh", "sp", [-1, 1, 2]], ["tile_ow", "sp", [-1, 6, 2]], ["reorder_0", "re", [0, 1, 2, 3, 4, 5, 6, 9, 7, 8]], ["ann_reduce", "an", ["none", "unroll"]], ["ann_spatial", "an", ["none", "none", "none"]]]}, "result": [[0.024752375], 0, 12.040521621704102, 1630370307.0602703], "version": 0.2, "tvm_version": "0.8.dev0"}
{"input": ["opencl -keys=mali,opencl,gpu -device=mali -max_num_threads=256 -thread_warp_size=1", "conv2d_nchw_spatial_pack.mali", [["TENSOR", [1, 16, 212, 168], "float32"], ["TENSOR", [15, 16, 1, 1], "float32"], [1, 1], [0, 0, 0, 0], [1, 1], "float32"], {}], "config": {"index": 17713, "code_hash": null, "entity": [["tile_co", "sp", [-1, 3, 1]], ["tile_oh", "sp", [-1, 1, 2]], ["tile_ow", "sp", [-1, 4, 2]], ["reorder_0", "re", [0, 1, 2, 3, 4, 5, 6, 9, 7, 8]], ["ann_reduce", "an", ["none", "none"]], ["ann_spatial", "an", ["none", "none", "none"]]]}, "result": [[0.022229041625], 0, 20.894132614135742, 1630370315.9316266], "version": 0.2, "tvm_version": "0.8.dev0"}
{"input": ["opencl -keys=mali,opencl,gpu -device=mali -max_num_threads=256 -thread_warp_size=1", "conv2d_nchw_spatial_pack.mali", [["TENSOR", [1, 16, 212, 168], "float32"], ["TENSOR", [15, 16, 1, 1], "float32"], [1, 1], [0, 0, 0, 0], [1, 1], "float32"], {}], "config": {"index": 1913113, "code_hash": null, "entity": [["tile_co", "sp", [-1, 3, 1]], ["tile_oh", "sp", [-1, 1, 2]], ["tile_ow", "sp", [-1, 4, 2]], ["reorder_0", "re", [0, 1, 2, 3, 4, 5, 6, 9, 7, 8]], ["ann_reduce", "an", ["none", "unroll"]], ["ann_spatial", "an", ["vec", "none", "none"]]]}, "result": [[0.022388875], 0, 29.354435205459595, 1630370324.4138732], "version": 0.2, "tvm_version": "0.8.dev0"}
{"input": ["opencl -keys=mali,opencl,gpu -device=mali -max_num_threads=256 -thread_warp_size=1", "conv2d_nchw_spatial_pack.mali", [["TENSOR", [1, 16, 212, 168], "float32"], ["TENSOR", [15, 16, 1, 1], "float32"], [1, 1], [0, 0, 0, 0], [1, 1], "float32"], {}], "config": {"index": 979993, "code_hash": null, "entity": [["tile_co", "sp", [-1, 3, 1]], ["tile_oh", "sp", [-1, 1, 2]], ["tile_ow", "sp", [-1, 4, 2]], ["reorder_0", "re", [0, 1, 2, 3, 4, 5, 6, 9, 7, 8]], ["ann_reduce", "an", ["none", "unroll"]], ["ann_spatial", "an", ["unroll", "none", "none"]]]}, "result": [[0.02283195825], 0, 38.099440574645996, 1630370333.1664994], "version": 0.2, "tvm_version": "0.8.dev0"}
{"input": ["opencl -keys=mali,opencl,gpu -device=mali -max_num_threads=256 -thread_warp_size=1", "conv2d_nchw_spatial_pack.mali", [["TENSOR", [1, 16, 212, 168], "float32"], ["TENSOR", [15, 16, 1, 1], "float32"], [1, 1], [0, 0, 0, 0], [1, 1], "float32"], {}], "config": {"index": 17875, "code_hash": null, "entity": [["tile_co", "sp", [-1, 3, 1]], ["tile_oh", "sp", [-1, 1, 2]], ["tile_ow", "sp", [-1, 6, 2]], ["reorder_0", "re", [0, 1, 2, 3, 4, 5, 6, 9, 7, 8]], ["ann_reduce", "an", ["none", "none"]], ["ann_spatial", "an", ["none", "none", "none"]]]}, "result": [[0.02270945825], 0, 47.32537269592285, 1630370342.4145913], "version": 0.2, "tvm_version": "0.8.dev0"}
{"input": ["opencl -keys=mali,opencl,gpu -device=mali -max_num_threads=256 -thread_warp_size=1", "conv2d_nchw_spatial_pack.mali", [["TENSOR", [1, 16, 212, 168], "float32"], ["TENSOR", [15, 16, 1, 1], "float32"], [1, 1], [0, 0, 0, 0], [1, 1], "float32"], {}], "config": {"index": 37963, "code_hash": null, "entity": [["tile_co", "sp", [-1, 3, 1]], ["tile_oh", "sp", [-1, 1, 2]], ["tile_ow", "sp", [-1, 6, 7]], ["reorder_0", "re", [0, 1, 2, 3, 4, 5, 6, 7, 8, 9]], ["ann_reduce", "an", ["none", "unroll"]], ["ann_spatial", "an", ["none", "none", "none"]]]}, "result": [[0.024744375000000002], 0, 56.637035608291626, 1630370351.713153], "version": 0.2, "tvm_version": "0.8.dev0"}
{"input": ["opencl -keys=mali,opencl,gpu -device=mali -max_num_threads=256 -thread_warp_size=1", "conv2d_nchw_spatial_pack.mali", [["TENSOR", [1, 16, 212, 168], "float32"], ["TENSOR", [15, 16, 1, 1], "float32"], [1, 1], [0, 0, 0, 0], [1, 1], "float32"], {}], "config": {"index": 46711, "code_hash": null, "entity": [["tile_co", "sp", [-1, 3, 1]], ["tile_oh", "sp", [-1, 1, 2]], ["tile_ow", "sp", [-1, 3, 2]], ["reorder_0", "re", [0, 1, 2, 3, 4, 5, 6, 9, 7, 8]], ["ann_reduce", "an", ["none", "unroll"]], ["ann_spatial", "an", ["none", "none", "none"]]]}, "result": [[0.02263175], 0, 66.15488696098328, 1630370361.2475486], "version": 0.2, "tvm_version": "0.8.dev0"}
{"input": ["opencl -keys=mali,opencl,gpu -device=mali -max_num_threads=256 -thread_warp_size=1", "conv2d_nchw_spatial_pack.mali", [["TENSOR", [1, 16, 212, 168], "float32"], ["TENSOR", [15, 16, 1, 1], "float32"], [1, 1], [0, 0, 0, 0], [1, 1], "float32"], {}], "config": {"index": 105193, "code_hash": null, "entity": [["tile_co", "sp", [-1, 3, 1]], ["tile_oh", "sp", [-1, 1, 2]], ["tile_ow", "sp", [-1, 4, 2]], ["reorder_0", "re", [0, 1, 2, 3, 4, 5, 6, 9, 7, 8]], ["ann_reduce", "an", ["unroll", "unroll"]], ["ann_spatial", "an", ["none", "none", "none"]]]}, "result": [[0.025108166624999997], 0, 75.68511390686035, 1630370370.8146248], "version": 0.2, "tvm_version": "0.8.dev0"}
{"input": ["opencl -keys=mali,opencl,gpu -device=mali -max_num_threads=256 -thread_warp_size=1", "conv2d_nchw_spatial_pack.mali", [["TENSOR", [1, 16, 212, 168], "float32"], ["TENSOR", [15, 16, 1, 1], "float32"], [1, 1], [0, 0, 0, 0], [1, 1], "float32"], {}], "config": {"index": 37801, "code_hash": null, "entity": [["tile_co", "sp", [-1, 3, 1]], ["tile_oh", "sp", [-1, 1, 2]], ["tile_ow", "sp", [-1, 4, 7]], ["reorder_0", "re", [0, 1, 2, 3, 4, 5, 6, 7, 8, 9]], ["ann_reduce", "an", ["none", "unroll"]], ["ann_spatial", "an", ["none", "none", "none"]]]}, "result": [[0.17834646680000002], 0, 85.86315417289734, 1630370381.0111215], "version": 0.2, "tvm_version": "0.8.dev0"}
{"input": ["opencl -keys=mali,opencl,gpu -device=mali -max_num_threads=256 -thread_warp_size=1", "conv2d_nchw_spatial_pack.mali", [["TENSOR", [1, 16, 212, 168], "float32"], ["TENSOR", [15, 16, 1, 1], "float32"], [1, 1], [0, 0, 0, 0], [1, 1], "float32"], {}], "config": {"index": 396793, "code_hash": null, "entity": [["tile_co", "sp", [-1, 3, 1]], ["tile_oh", "sp", [-1, 1, 2]], ["tile_ow", "sp", [-1, 4, 2]], ["reorder_0", "re", [0, 1, 2, 3, 4, 5, 6, 9, 7, 8]], ["ann_reduce", "an", ["none", "unroll"]], ["ann_spatial", "an", ["none", "unroll", "none"]]]}, "result": [[0.023102750000000002], 0, 94.84921312332153, 1630370390.0281966], "version": 0.2, "tvm_version": "0.8.dev0"}
{"input": ["opencl -keys=mali,opencl,gpu -device=mali -max_num_threads=256 -thread_warp_size=1", "conv2d_nchw_spatial_pack.mali", [["TENSOR", [1, 16, 212, 168], "float32"], ["TENSOR", [15, 16, 1, 1], "float32"], [1, 1], [0, 0, 0, 0], [1, 1], "float32"], {}], "config": {"index": 746713, "code_hash": null, "entity": [["tile_co", "sp", [-1, 3, 1]], ["tile_oh", "sp", [-1, 1, 2]], ["tile_ow", "sp", [-1, 4, 2]], ["reorder_0", "re", [0, 1, 2, 3, 4, 5, 6, 9, 7, 8]], ["ann_reduce", "an", ["none", "unroll"]], ["ann_spatial", "an", ["none", "vec", "none"]]]}, "result": [[0.16350506680000002], 0, 104.68129754066467, 1630370399.8658717], "version": 0.2, "tvm_version": "0.8.dev0"}
{"input": ["opencl -keys=mali,opencl,gpu -device=mali -max_num_threads=256 -thread_warp_size=1", "conv2d_nchw_spatial_pack.mali", [["TENSOR", [1, 16, 212, 168], "float32"], ["TENSOR", [15, 16, 1, 1], "float32"], [1, 1], [0, 0, 0, 0], [1, 1], "float32"], {}], "config": {"index": 1883953, "code_hash": null, "entity": [["tile_co", "sp", [-1, 3, 1]], ["tile_oh", "sp", [-1, 1, 2]], ["tile_ow", "sp", [-1, 4, 2]], ["reorder_0", "re", [0, 1, 2, 3, 4, 5, 6, 9, 7, 8]], ["ann_reduce", "an", ["none", "none"]], ["ann_spatial", "an", ["vec", "none", "none"]]]}, "result": [[0.022378041625], 0, 113.3204300403595, 1630370408.5292563], "version": 0.2, "tvm_version": "0.8.dev0"}
{"input": ["opencl -keys=mali,opencl,gpu -device=mali -max_num_threads=256 -thread_warp_size=1", "conv2d_nchw_spatial_pack.mali", [["TENSOR", [1, 16, 212, 168], "float32"], ["TENSOR", [15, 16, 1, 1], "float32"], [1, 1], [0, 0, 0, 0], [1, 1], "float32"], {}], "config": {"index": 950833, "code_hash": null, "entity": [["tile_co", "sp", [-1, 3, 1]], ["tile_oh", "sp", [-1, 1, 2]], ["tile_ow", "sp", [-1, 4, 2]], ["reorder_0", "re", [0, 1, 2, 3, 4, 5, 6, 9, 7, 8]], ["ann_reduce", "an", ["none", "none"]], ["ann_spatial", "an", ["unroll", "none", "none"]]]}, "result": [[0.022164041625], 0, 121.69589567184448, 1630370416.9241543], "version": 0.2, "tvm_version": "0.8.dev0"}
{"input": ["opencl -keys=mali,opencl,gpu -device=mali -max_num_threads=256 -thread_warp_size=1", "conv2d_nchw_spatial_pack.mali", [["TENSOR", [1, 16, 212, 168], "float32"], ["TENSOR", [15, 16, 1, 1], "float32"], [1, 1], [0, 0, 0, 0], [1, 1], "float32"], {}], "config": {"index": 37964, "code_hash": null, "entity": [["tile_co", "sp", [-1, 5, 1]], ["tile_oh", "sp", [-1, 1, 2]], ["tile_ow", "sp", [-1, 6, 7]], ["reorder_0", "re", [0, 1, 2, 3, 4, 5, 6, 7, 8, 9]], ["ann_reduce", "an", ["none", "unroll"]], ["ann_spatial", "an", ["none", "none", "none"]]]}, "result": [[0.025612125], 0, 131.1207675933838, 1630370426.3562112], "version": 0.2, "tvm_version": "0.8.dev0"}
{"input": ["opencl -keys=mali,opencl,gpu -device=mali -max_num_threads=256 -thread_warp_size=1", "conv2d_nchw_spatial_pack.mali", [["TENSOR", [1, 16, 212, 168], "float32"], ["TENSOR", [15, 16, 1, 1], "float32"], [1, 1], [0, 0, 0, 0], [1, 1], "float32"], {}], "config": {"index": 47197, "code_hash": null, "entity": [["tile_co", "sp", [-1, 3, 1]], ["tile_oh", "sp", [-1, 1, 2]], ["tile_ow", "sp", [-1, 7, 2]], ["reorder_0", "re", [0, 1, 2, 3, 4, 5, 6, 9, 7, 8]], ["ann_reduce", "an", ["none", "unroll"]], ["ann_spatial", "an", ["none", "none", "none"]]]}, "result": [[0.1627363334], 0, 141.9211642742157, 1630370437.1774988], "version": 0.2, "tvm_version": "0.8.dev0"}
{"input": ["opencl -keys=mali,opencl,gpu -device=mali -max_num_threads=256 -thread_warp_size=1", "conv2d_nchw_spatial_pack.mali", [["TENSOR", [1, 16, 212, 168], "float32"], ["TENSOR", [15, 16, 1, 1], "float32"], [1, 1], [0, 0, 0, 0], [1, 1], "float32"], {}], "config": {"index": 746875, "code_hash": null, "entity": [["tile_co", "sp", [-1, 3, 1]], ["tile_oh", "sp", [-1, 1, 2]], ["tile_ow", "sp", [-1, 6, 2]], ["reorder_0", "re", [0, 1, 2, 3, 4, 5, 6, 9, 7, 8]], ["ann_reduce", "an", ["none", "unroll"]], ["ann_spatial", "an", ["none", "vec", "none"]]]}, "result": [[0.044761066599999996], 0, 8.23769760131836, 1630370445.9250245], "version": 0.2, "tvm_version": "0.8.dev0"}
{"input": ["opencl -keys=mali,opencl,gpu -device=mali -max_num_threads=256 -thread_warp_size=1", "conv2d_nchw_spatial_pack.mali", [["TENSOR", [1, 16, 212, 168], "float32"], ["TENSOR", [15, 16, 1, 1], "float32"], [1, 1], [0, 0, 0, 0], [1, 1], "float32"], {}], "config": {"index": 396955, "code_hash": null, "entity": [["tile_co", "sp", [-1, 3, 1]], ["tile_oh", "sp", [-1, 1, 2]], ["tile_ow", "sp", [-1, 6, 2]], ["reorder_0", "re", [0, 1, 2, 3, 4, 5, 6, 9, 7, 8]], ["ann_reduce", "an", ["none", "unroll"]], ["ann_spatial", "an", ["none", "unroll", "none"]]]}, "result": [[0.02245925], 0, 16.977266550064087, 1630370454.6890259], "version": 0.2, "tvm_version": "0.8.dev0"}
{"input": ["opencl -keys=mali,opencl,gpu -device=mali -max_num_threads=256 -thread_warp_size=1", "conv2d_nchw_spatial_pack.mali", [["TENSOR", [1, 16, 212, 168], "float32"], ["TENSOR", [15, 16, 1, 1], "float32"], [1, 1], [0, 0, 0, 0], [1, 1], "float32"], {}], "config": {"index": 17551, "code_hash": null, "entity": [["tile_co", "sp", [-1, 3, 1]], ["tile_oh", "sp", [-1, 1, 2]], ["tile_ow", "sp", [-1, 3, 2]], ["reorder_0", "re", [0, 1, 2, 3, 4, 5, 6, 9, 7, 8]], ["ann_reduce", "an", ["none", "none"]], ["ann_spatial", "an", ["none", "none", "none"]]]}, "result": [[0.023717416624999998], 0, 25.945409297943115, 1630370463.674707], "version": 0.2, "tvm_version": "0.8.dev0"}
{"input": ["opencl -keys=mali,opencl,gpu -device=mali -max_num_threads=256 -thread_warp_size=1", "conv2d_nchw_spatial_pack.mali", [["TENSOR", [1, 16, 212, 168], "float32"], ["TENSOR", [15, 16, 1, 1], "float32"], [1, 1], [0, 0, 0, 0], [1, 1], "float32"], {}], "config": {"index": 1912951, "code_hash": null, "entity": [["tile_co", "sp", [-1, 3, 1]], ["tile_oh", "sp", [-1, 1, 2]], ["tile_ow", "sp", [-1, 3, 2]], ["reorder_0", "re", [0, 1, 2, 3, 4, 5, 6, 9, 7, 8]], ["ann_reduce", "an", ["none", "unroll"]], ["ann_spatial", "an", ["vec", "none", "none"]]]}, "result": [[0.023000125], 0, 34.78407168388367, 1630370472.52485], "version": 0.2, "tvm_version": "0.8.dev0"}
{"input": ["opencl -keys=mali,opencl,gpu -device=mali -max_num_threads=256 -thread_warp_size=1", "conv2d_nchw_spatial_pack.mali", [["TENSOR", [1, 16, 212, 168], "float32"], ["TENSOR", [15, 16, 1, 1], "float32"], [1, 1], [0, 0, 0, 0], [1, 1], "float32"], {}], "config": {"index": 979831, "code_hash": null, "entity": [["tile_co", "sp", [-1, 3, 1]], ["tile_oh", "sp", [-1, 1, 2]], ["tile_ow", "sp", [-1, 3, 2]], ["reorder_0", "re", [0, 1, 2, 3, 4, 5, 6, 9, 7, 8]], ["ann_reduce", "an", ["none", "unroll"]], ["ann_spatial", "an", ["unroll", "none", "none"]]]}, "result": [[0.02230991675], 0, 43.5682168006897, 1630370481.326339], "version": 0.2, "tvm_version": "0.8.dev0"}
{"input": ["opencl -keys=mali,opencl,gpu -device=mali -max_num_threads=256 -thread_warp_size=1", "conv2d_nchw_spatial_pack.mali", [["TENSOR", [1, 16, 212, 168], "float32"], ["TENSOR", [15, 16, 1, 1], "float32"], [1, 1], [0, 0, 0, 0], [1, 1], "float32"], {}], "config": {"index": 76033, "code_hash": null, "entity": [["tile_co", "sp", [-1, 3, 1]], ["tile_oh", "sp", [-1, 1, 2]], ["tile_ow", "sp", [-1, 4, 2]], ["reorder_0", "re", [0, 1, 2, 3, 4, 5, 6, 9, 7, 8]], ["ann_reduce", "an", ["unroll", "none"]], ["ann_spatial", "an", ["none", "none", "none"]]]}, "result": [[0.02308025], 0, 52.348973989486694, 1630370490.1269653], "version": 0.2, "tvm_version": "0.8.dev0"}
{"input": ["opencl -keys=mali,opencl,gpu -device=mali -max_num_threads=256 -thread_warp_size=1", "conv2d_nchw_spatial_pack.mali", [["TENSOR", [1, 16, 212, 168], "float32"], ["TENSOR", [15, 16, 1, 1], "float32"], [1, 1], [0, 0, 0, 0], [1, 1], "float32"], {}], "config": {"index": 1038313, "code_hash": null, "entity": [["tile_co", "sp", [-1, 3, 1]], ["tile_oh", "sp", [-1, 1, 2]], ["tile_ow", "sp", [-1, 4, 2]], ["reorder_0", "re", [0, 1, 2, 3, 4, 5, 6, 9, 7, 8]], ["ann_reduce", "an", ["unroll", "unroll"]], ["ann_spatial", "an", ["unroll", "none", "none"]]]}, "result": [[0.022216541625000003], 0, 61.04471158981323, 1630370498.8311853], "version": 0.2, "tvm_version": "0.8.dev0"}
{"input": ["opencl -keys=mali,opencl,gpu -device=mali -max_num_threads=256 -thread_warp_size=1", "conv2d_nchw_spatial_pack.mali", [["TENSOR", [1, 16, 212, 168], "float32"], ["TENSOR", [15, 16, 1, 1], "float32"], [1, 1], [0, 0, 0, 0], [1, 1], "float32"], {}], "config": {"index": 1971433, "code_hash": null, "entity": [["tile_co", "sp", [-1, 3, 1]], ["tile_oh", "sp", [-1, 1, 2]], ["tile_ow", "sp", [-1, 4, 2]], ["reorder_0", "re", [0, 1, 2, 3, 4, 5, 6, 9, 7, 8]], ["ann_reduce", "an", ["unroll", "unroll"]], ["ann_spatial", "an", ["vec", "none", "none"]]]}, "result": [[0.023149], 0, 70.10952496528625, 1630370507.9214303], "version": 0.2, "tvm_version": "0.8.dev0"}
{"input": ["opencl -keys=mali,opencl,gpu -device=mali -max_num_threads=256 -thread_warp_size=1", "conv2d_nchw_spatial_pack.mali", [["TENSOR", [1, 16, 212, 168], "float32"], ["TENSOR", [15, 16, 1, 1], "float32"], [1, 1], [0, 0, 0, 0], [1, 1], "float32"], {}], "config": {"index": 8641, "code_hash": null, "entity": [["tile_co", "sp", [-1, 3, 1]], ["tile_oh", "sp", [-1, 1, 2]], ["tile_ow", "sp", [-1, 4, 7]], ["reorder_0", "re", [0, 1, 2, 3, 4, 5, 6, 7, 8, 9]], ["ann_reduce", "an", ["none", "none"]], ["ann_spatial", "an", ["none", "none", "none"]]]}, "result": [[0.025134583375], 0, 79.21979355812073, 1630370517.0513499], "version": 0.2, "tvm_version": "0.8.dev0"}
{"input": ["opencl -keys=mali,opencl,gpu -device=mali -max_num_threads=256 -thread_warp_size=1", "conv2d_nchw_spatial_pack.mali", [["TENSOR", [1, 16, 212, 168], "float32"], ["TENSOR", [15, 16, 1, 1], "float32"], [1, 1], [0, 0, 0, 0], [1, 1], "float32"], {}], "config": {"index": 717553, "code_hash": null, "entity": [["tile_co", "sp", [-1, 3, 1]], ["tile_oh", "sp", [-1, 1, 2]], ["tile_ow", "sp", [-1, 4, 2]], ["reorder_0", "re", [0, 1, 2, 3, 4, 5, 6, 9, 7, 8]], ["ann_reduce", "an", ["none", "none"]], ["ann_spatial", "an", ["none", "vec", "none"]]]}, "result": [[0.024704666625000003], 0, 88.12867188453674, 1630370525.9706202], "version": 0.2, "tvm_version": "0.8.dev0"}
{"input": ["opencl -keys=mali,opencl,gpu -device=mali -max_num_threads=256 -thread_warp_size=1", "conv2d_nchw_spatial_pack.mali", [["TENSOR", [1, 16, 212, 168], "float32"], ["TENSOR", [15, 16, 1, 1], "float32"], [1, 1], [0, 0, 0, 0], [1, 1], "float32"], {}], "config": {"index": 367633, "code_hash": null, "entity": [["tile_co", "sp", [-1, 3, 1]], ["tile_oh", "sp", [-1, 1, 2]], ["tile_ow", "sp", [-1, 4, 2]], ["reorder_0", "re", [0, 1, 2, 3, 4, 5, 6, 9, 7, 8]], ["ann_reduce", "an", ["none", "none"]], ["ann_spatial", "an", ["none", "unroll", "none"]]]}, "result": [[0.023058541625], 0, 96.98660564422607, 1630370534.854719], "version": 0.2, "tvm_version": "0.8.dev0"}
{"input": ["opencl -keys=mali,opencl,gpu -device=mali -max_num_threads=256 -thread_warp_size=1", "conv2d_nchw_spatial_pack.mali", [["TENSOR", [1, 16, 212, 168], "float32"], ["TENSOR", [15, 16, 1, 1], "float32"], [1, 1], [0, 0, 0, 0], [1, 1], "float32"], {}], "config": {"index": 980155, "code_hash": null, "entity": [["tile_co", "sp", [-1, 3, 1]], ["tile_oh", "sp", [-1, 1, 2]], ["tile_ow", "sp", [-1, 6, 2]], ["reorder_0", "re", [0, 1, 2, 3, 4, 5, 6, 9, 7, 8]], ["ann_reduce", "an", ["none", "unroll"]], ["ann_spatial", "an", ["unroll", "none", "none"]]]}, "result": [[0.02208270825], 0, 105.83762121200562, 1630370543.6925778], "version": 0.2, "tvm_version": "0.8.dev0"}
{"input": ["opencl -keys=mali,opencl,gpu -device=mali -max_num_threads=256 -thread_warp_size=1", "conv2d_nchw_spatial_pack.mali", [["TENSOR", [1, 16, 212, 168], "float32"], ["TENSOR", [15, 16, 1, 1], "float32"], [1, 1], [0, 0, 0, 0], [1, 1], "float32"], {}], "config": {"index": 1913275, "code_hash": null, "entity": [["tile_co", "sp", [-1, 3, 1]], ["tile_oh", "sp", [-1, 1, 2]], ["tile_ow", "sp", [-1, 6, 2]], ["reorder_0", "re", [0, 1, 2, 3, 4, 5, 6, 9, 7, 8]], ["ann_reduce", "an", ["none", "unroll"]], ["ann_spatial", "an", ["vec", "none", "none"]]]}, "result": [[0.02376025], 0, 114.64891862869263, 1630370552.5343297], "version": 0.2, "tvm_version": "0.8.dev0"}
{"input": ["opencl -keys=mali,opencl,gpu -device=mali -max_num_threads=256 -thread_warp_size=1", "conv2d_nchw_spatial_pack.mali", [["TENSOR", [1, 16, 212, 168], "float32"], ["TENSOR", [15, 16, 1, 1], "float32"], [1, 1], [0, 0, 0, 0], [1, 1], "float32"], {}], "config": {"index": 105031, "code_hash": null, "entity": [["tile_co", "sp", [-1, 3, 1]], ["tile_oh", "sp", [-1, 1, 2]], ["tile_ow", "sp", [-1, 3, 2]], ["reorder_0", "re", [0, 1, 2, 3, 4, 5, 6, 9, 7, 8]], ["ann_reduce", "an", ["unroll", "unroll"]], ["ann_spatial", "an", ["none", "none", "none"]]]}, "result": [[0.02219354175], 0, 123.36501145362854, 1630370561.2831957], "version": 0.2, "tvm_version": "0.8.dev0"}
{"input": ["opencl -keys=mali,opencl,gpu -device=mali -max_num_threads=256 -thread_warp_size=1", "conv2d_nchw_spatial_pack.mali", [["TENSOR", [1, 16, 212, 168], "float32"], ["TENSOR", [15, 16, 1, 1], "float32"], [1, 1], [0, 0, 0, 0], [1, 1], "float32"], {}], "config": {"index": 96283, "code_hash": null, "entity": [["tile_co", "sp", [-1, 3, 1]], ["tile_oh", "sp", [-1, 1, 2]], ["tile_ow", "sp", [-1, 6, 7]], ["reorder_0", "re", [0, 1, 2, 3, 4, 5, 6, 7, 8, 9]], ["ann_reduce", "an", ["unroll", "unroll"]], ["ann_spatial", "an", ["none", "none", "none"]]]}, "result": [[0.026358458375], 0, 132.80439162254333, 1630370570.7454286], "version": 0.2, "tvm_version": "0.8.dev0"}
{"input": ["opencl -keys=mali,opencl,gpu -device=mali -max_num_threads=256 -thread_warp_size=1", "conv2d_nchw_spatial_pack.mali", [["TENSOR", [1, 16, 212, 168], "float32"], ["TENSOR", [15, 16, 1, 1], "float32"], [1, 1], [0, 0, 0, 0], [1, 1], "float32"], {}], "config": {"index": 1679833, "code_hash": null, "entity": [["tile_co", "sp", [-1, 3, 1]], ["tile_oh", "sp", [-1, 1, 2]], ["tile_ow", "sp", [-1, 4, 2]], ["reorder_0", "re", [0, 1, 2, 3, 4, 5, 6, 9, 7, 8]], ["ann_reduce", "an", ["none", "unroll"]], ["ann_spatial", "an", ["unroll", "vec", "none"]]]}, "result": [[0.0436924], 0, 142.0534689426422, 1630370580.0078547], "version": 0.2, "tvm_version": "0.8.dev0"}
