example_04/auto_tvm_log/v9h-model-01-NCHW-opencl-C1000-T21-09-01-08-02.log.tmp
{"input": ["opencl -keys=mali,opencl,gpu -device=mali -max_num_threads=512 -thread_warp_size=2", "conv2d_nchw_spatial_pack.mali", [["TENSOR", [1, 128, 7, 6], "float32"], ["TENSOR", [15, 128, 1, 1], "float32"], [1, 1], [0, 0, 0, 0], [1, 1], "float32"], {}], "config": {"index": 25136, "code_hash": null, "entity": [["tile_co", "sp", [-1, 1, 15]], ["tile_oh", "sp", [-1, 1, 7]], ["tile_ow", "sp", [-1, 6, 1]], ["reorder_0", "re", [0, 1, 2, 3, 4, 5, 6, 9, 7, 8]], ["ann_reduce", "an", ["unroll", "unroll"]], ["ann_spatial", "an", ["unroll", "unroll", "unroll"]]]}, "result": [[0.0008057718342245991], 0, 9.484029054641724, 1630454616.9332745], "version": 0.2, "tvm_version": "0.8.dev0"}
{"input": ["opencl -keys=mali,opencl,gpu -device=mali -max_num_threads=512 -thread_warp_size=2", "conv2d_nchw_spatial_pack.mali", [["TENSOR", [1, 128, 7, 6], "float32"], ["TENSOR", [15, 128, 1, 1], "float32"], [1, 1], [0, 0, 0, 0], [1, 1], "float32"], {}], "config": {"index": 9584, "code_hash": null, "entity": [["tile_co", "sp", [-1, 1, 15]], ["tile_oh", "sp", [-1, 1, 7]], ["tile_ow", "sp", [-1, 6, 1]], ["reorder_0", "re", [0, 1, 2, 3, 4, 5, 6, 9, 7, 8]], ["ann_reduce", "an", ["unroll", "unroll"]], ["ann_spatial", "an", ["none", "unroll", "unroll"]]]}, "result": [[0.0006927133333333333], 0, 18.847434997558594, 1630454626.3232346], "version": 0.2, "tvm_version": "0.8.dev0"}
{"input": ["opencl -keys=mali,opencl,gpu -device=mali -max_num_threads=512 -thread_warp_size=2", "conv2d_nchw_spatial_pack.mali", [["TENSOR", [1, 128, 7, 6], "float32"], ["TENSOR", [15, 128, 1, 1], "float32"], [1, 1], [0, 0, 0, 0], [1, 1], "float32"], {}], "config": {"index": 24164, "code_hash": null, "entity": [["tile_co", "sp", [-1, 1, 15]], ["tile_oh", "sp", [-1, 1, 7]], ["tile_ow", "sp", [-1, 6, 1]], ["reorder_0", "re", [0, 1, 2, 3, 4, 5, 6, 9, 7, 8]], ["ann_reduce", "an", ["none", "unroll"]], ["ann_spatial", "an", ["unroll", "unroll", "unroll"]]]}, "result": [[0.0009840534759358289], 0, 28.056961059570312, 1630454635.5359974], "version": 0.2, "tvm_version": "0.8.dev0"}
{"input": ["opencl -keys=mali,opencl,gpu -device=mali -max_num_threads=512 -thread_warp_size=2", "conv2d_nchw_spatial_pack.mali", [["TENSOR", [1, 128, 7, 6], "float32"], ["TENSOR", [15, 128, 1, 1], "float32"], [1, 1], [0, 0, 0, 0], [1, 1], "float32"], {}], "config": {"index": 23678, "code_hash": null, "entity": [["tile_co", "sp", [-1, 1, 15]], ["tile_oh", "sp", [-1, 1, 7]], ["tile_ow", "sp", [-1, 6, 1]], ["reorder_0", "re", [0, 1, 2, 3, 4, 5, 6, 9, 7, 8]], ["ann_reduce", "an", ["none", "none"]], ["ann_spatial", "an", ["unroll", "unroll", "unroll"]]]}, "result": [[0.0009508523364485981], 0, 37.687705278396606, 1630454645.1639545], "version": 0.2, "tvm_version": "0.8.dev0"}
{"input": ["opencl -keys=mali,opencl,gpu -device=mali -max_num_threads=512 -thread_warp_size=2", "conv2d_nchw_spatial_pack.mali", [["TENSOR", [1, 128, 7, 6], "float32"], ["TENSOR", [15, 128, 1, 1], "float32"], [1, 1], [0, 0, 0, 0], [1, 1], "float32"], {}], "config": {"index": 24650, "code_hash": null, "entity": [["tile_co", "sp", [-1, 1, 15]], ["tile_oh", "sp", [-1, 1, 7]], ["tile_ow", "sp", [-1, 6, 1]], ["reorder_0", "re", [0, 1, 2, 3, 4, 5, 6, 9, 7, 8]], ["ann_reduce", "an", ["unroll", "none"]], ["ann_spatial", "an", ["unroll", "unroll", "unroll"]]]}, "result": [[0.0011827192118226602], 0, 47.29773569107056, 1630454654.8044279], "version": 0.2, "tvm_version": "0.8.dev0"}
{"input": ["opencl -keys=mali,opencl,gpu -device=mali -max_num_threads=512 -thread_warp_size=2", "conv2d_nchw_spatial_pack.mali", [["TENSOR", [1, 128, 7, 6], "float32"], ["TENSOR", [15, 128, 1, 1], "float32"], [1, 1], [0, 0, 0, 0], [1, 1], "float32"], {}], "config": {"index": 9098, "code_hash": null, "entity": [["tile_co", "sp", [-1, 1, 15]], ["tile_oh", "sp", [-1, 1, 7]], ["tile_ow", "sp", [-1, 6, 1]], ["reorder_0", "re", [0, 1, 2, 3, 4, 5, 6, 9, 7, 8]], ["ann_reduce", "an", ["unroll", "none"]], ["ann_spatial", "an", ["none", "unroll", "unroll"]]]}, "result": [[0.0008480755635593221], 0, 56.63276767730713, 1630454664.1652834], "version": 0.2, "tvm_version": "0.8.dev0"}
{"input": ["opencl -keys=mali,opencl,gpu -device=mali -max_num_threads=512 -thread_warp_size=2", "conv2d_nchw_spatial_pack.mali", [["TENSOR", [1, 128, 7, 6], "float32"], ["TENSOR", [15, 128, 1, 1], "float32"], [1, 1], [0, 0, 0, 0], [1, 1], "float32"], {}], "config": {"index": 19187, "code_hash": null, "entity": [["tile_co", "sp", [-1, 1, 15]], ["tile_oh", "sp", [-1, 7, 1]], ["tile_ow", "sp", [-1, 1, 6]], ["reorder_0", "re", [0, 1, 2, 3, 4, 5, 6, 7, 8, 9]], ["ann_reduce", "an", ["unroll", "unroll"]], ["ann_spatial", "an", ["unroll", "none", "unroll"]]]}, "result": [[0.003355166666666667], 0, 65.03121519088745, 1630454672.5644858], "version": 0.2, "tvm_version": "0.8.dev0"}
{"input": ["opencl -keys=mali,opencl,gpu -device=mali -max_num_threads=512 -thread_warp_size=2", "conv2d_nchw_spatial_pack.mali", [["TENSOR", [1, 128, 7, 6], "float32"], ["TENSOR", [15, 128, 1, 1], "float32"], [1, 1], [0, 0, 0, 0], [1, 1], "float32"], {}], "config": {"index": 8612, "code_hash": null, "entity": [["tile_co", "sp", [-1, 1, 15]], ["tile_oh", "sp", [-1, 1, 7]], ["tile_ow", "sp", [-1, 6, 1]], ["reorder_0", "re", [0, 1, 2, 3, 4, 5, 6, 9, 7, 8]], ["ann_reduce", "an", ["none", "unroll"]], ["ann_spatial", "an", ["none", "unroll", "unroll"]]]}, "result": [[0.0011900833369565217], 0, 74.89173579216003, 1630454682.4511738], "version": 0.2, "tvm_version": "0.8.dev0"}
{"input": ["opencl -keys=mali,opencl,gpu -device=mali -max_num_threads=512 -thread_warp_size=2", "conv2d_nchw_spatial_pack.mali", [["TENSOR", [1, 128, 7, 6], "float32"], ["TENSOR", [15, 128, 1, 1], "float32"], [1, 1], [0, 0, 0, 0], [1, 1], "float32"], {}], "config": {"index": 8126, "code_hash": null, "entity": [["tile_co", "sp", [-1, 1, 15]], ["tile_oh", "sp", [-1, 1, 7]], ["tile_ow", "sp", [-1, 6, 1]], ["reorder_0", "re", [0, 1, 2, 3, 4, 5, 6, 9, 7, 8]], ["ann_reduce", "an", ["none", "none"]], ["ann_spatial", "an", ["none", "unroll", "unroll"]]]}, "result": [[0.0008530871911468812], 0, 84.51549410820007, 1630454692.0749195], "version": 0.2, "tvm_version": "0.8.dev0"}
{"input": ["opencl -keys=mali,opencl,gpu -device=mali -max_num_threads=512 -thread_warp_size=2", "conv2d_nchw_spatial_pack.mali", [["TENSOR", [1, 128, 7, 6], "float32"], ["TENSOR", [15, 128, 1, 1], "float32"], [1, 1], [0, 0, 0, 0], [1, 1], "float32"], {}], "config": {"index": 25135, "code_hash": null, "entity": [["tile_co", "sp", [-1, 3, 5]], ["tile_oh", "sp", [-1, 1, 7]], ["tile_ow", "sp", [-1, 6, 1]], ["reorder_0", "re", [0, 1, 2, 3, 4, 5, 6, 9, 7, 8]], ["ann_reduce", "an", ["unroll", "unroll"]], ["ann_spatial", "an", ["unroll", "unroll", "unroll"]]]}, "result": [[0.0007011782218798151], 0, 93.4331567287445, 1630454701.001548], "version": 0.2, "tvm_version": "0.8.dev0"}
{"input": ["opencl -keys=mali,opencl,gpu -device=mali -max_num_threads=512 -thread_warp_size=2", "conv2d_nchw_spatial_pack.mali", [["TENSOR", [1, 128, 7, 6], "float32"], ["TENSOR", [15, 128, 1, 1], "float32"], [1, 1], [0, 0, 0, 0], [1, 1], "float32"], {}], "config": {"index": 18701, "code_hash": null, "entity": [["tile_co", "sp", [-1, 1, 15]], ["tile_oh", "sp", [-1, 7, 1]], ["tile_ow", "sp", [-1, 1, 6]], ["reorder_0", "re", [0, 1, 2, 3, 4, 5, 6, 7, 8, 9]], ["ann_reduce", "an", ["unroll", "none"]], ["ann_spatial", "an", ["unroll", "none", "unroll"]]]}, "result": [[0.0008887575757575757], 0, 102.32155132293701, 1630454709.8969429], "version": 0.2, "tvm_version": "0.8.dev0"}
{"input": ["opencl -keys=mali,opencl,gpu -device=mali -max_num_threads=512 -thread_warp_size=2", "conv2d_nchw_spatial_pack.mali", [["TENSOR", [1, 128, 7, 6], "float32"], ["TENSOR", [15, 128, 1, 1], "float32"], [1, 1], [0, 0, 0, 0], [1, 1], "float32"], {}], "config": {"index": 19061, "code_hash": null, "entity": [["tile_co", "sp", [-1, 1, 15]], ["tile_oh", "sp", [-1, 1, 7]], ["tile_ow", "sp", [-1, 6, 1]], ["reorder_0", "re", [0, 1, 2, 3, 4, 5, 6, 7, 8, 9]], ["ann_reduce", "an", ["unroll", "unroll"]], ["ann_spatial", "an", ["unroll", "none", "unroll"]]]}, "result": [[0.0008703545706371191], 0, 111.81612515449524, 1630454719.4017923], "version": 0.2, "tvm_version": "0.8.dev0"}
{"input": ["opencl -keys=mali,opencl,gpu -device=mali -max_num_threads=512 -thread_warp_size=2", "conv2d_nchw_spatial_pack.mali", [["TENSOR", [1, 128, 7, 6], "float32"], ["TENSOR", [15, 128, 1, 1], "float32"], [1, 1], [0, 0, 0, 0], [1, 1], "float32"], {}], "config": {"index": 9583, "code_hash": null, "entity": [["tile_co", "sp", [-1, 3, 5]], ["tile_oh", "sp", [-1, 1, 7]], ["tile_ow", "sp", [-1, 6, 1]], ["reorder_0", "re", [0, 1, 2, 3, 4, 5, 6, 9, 7, 8]], ["ann_reduce", "an", ["unroll", "unroll"]], ["ann_spatial", "an", ["none", "unroll", "unroll"]]]}, "result": [[0.0022163015904761905], 0, 120.27383470535278, 1630454727.8822298], "version": 0.2, "tvm_version": "0.8.dev0"}
{"input": ["opencl -keys=mali,opencl,gpu -device=mali -max_num_threads=512 -thread_warp_size=2", "conv2d_nchw_spatial_pack.mali", [["TENSOR", [1, 128, 7, 6], "float32"], ["TENSOR", [15, 128, 1, 1], "float32"], [1, 1], [0, 0, 0, 0], [1, 1], "float32"], {}], "config": {"index": 24163, "code_hash": null, "entity": [["tile_co", "sp", [-1, 3, 5]], ["tile_oh", "sp", [-1, 1, 7]], ["tile_ow", "sp", [-1, 6, 1]], ["reorder_0", "re", [0, 1, 2, 3, 4, 5, 6, 9, 7, 8]], ["ann_reduce", "an", ["none", "unroll"]], ["ann_spatial", "an", ["unroll", "unroll", "unroll"]]]}, "result": [[0.0007723060590909091], 0, 128.85150790214539, 1630454736.4917853], "version": 0.2, "tvm_version": "0.8.dev0"}
{"input": ["opencl -keys=mali,opencl,gpu -device=mali -max_num_threads=512 -thread_warp_size=2", "conv2d_nchw_spatial_pack.mali", [["TENSOR", [1, 128, 7, 6], "float32"], ["TENSOR", [15, 128, 1, 1], "float32"], [1, 1], [0, 0, 0, 0], [1, 1], "float32"], {}], "config": {"index": 23677, "code_hash": null, "entity": [["tile_co", "sp", [-1, 3, 5]], ["tile_oh", "sp", [-1, 1, 7]], ["tile_ow", "sp", [-1, 6, 1]], ["reorder_0", "re", [0, 1, 2, 3, 4, 5, 6, 9, 7, 8]], ["ann_reduce", "an", ["none", "none"]], ["ann_spatial", "an", ["unroll", "unroll", "unroll"]]]}, "result": [[0.0007540184364723468], 0, 138.1795744895935, 1630454745.817021], "version": 0.2, "tvm_version": "0.8.dev0"}
{"input": ["opencl -keys=mali,opencl,gpu -device=mali -max_num_threads=512 -thread_warp_size=2", "conv2d_nchw_spatial_pack.mali", [["TENSOR", [1, 128, 7, 6], "float32"], ["TENSOR", [15, 128, 1, 1], "float32"], [1, 1], [0, 0, 0, 0], [1, 1], "float32"], {}], "config": {"index": 19160, "code_hash": null, "entity": [["tile_co", "sp", [-1, 1, 15]], ["tile_oh", "sp", [-1, 7, 1]], ["tile_ow", "sp", [-1, 2, 3]], ["reorder_0", "re", [0, 1, 2, 3, 4, 5, 6, 7, 8, 9]], ["ann_reduce", "an", ["unroll", "unroll"]], ["ann_spatial", "an", ["unroll", "none", "unroll"]]]}, "result": [[0.0008762464985994397], 0, 147.0911877155304, 1630454754.7599127], "version": 0.2, "tvm_version": "0.8.dev0"}
{"input": ["opencl -keys=mali,opencl,gpu -device=mali -max_num_threads=512 -thread_warp_size=2", "conv2d_nchw_spatial_pack.mali", [["TENSOR", [1, 128, 7, 6], "float32"], ["TENSOR", [15, 128, 1, 1], "float32"], [1, 1], [0, 0, 0, 0], [1, 1], "float32"], {}], "config": {"index": 25190, "code_hash": null, "entity": [["tile_co", "sp", [-1, 1, 15]], ["tile_oh", "sp", [-1, 1, 7]], ["tile_ow", "sp", [-1, 3, 2]], ["reorder_0", "re", [0, 1, 2, 3, 4, 5, 6, 9, 7, 8]], ["ann_reduce", "an", ["unroll", "unroll"]], ["ann_spatial", "an", ["unroll", "unroll", "unroll"]]]}, "result": [[0.0014204606060606061], 0, 12.84710168838501, 1630454767.983879], "version": 0.2, "tvm_version": "0.8.dev0"}
{"input": ["opencl -keys=mali,opencl,gpu -device=mali -max_num_threads=512 -thread_warp_size=2", "conv2d_nchw_spatial_pack.mali", [["TENSOR", [1, 128, 7, 6], "float32"], ["TENSOR", [15, 128, 1, 1], "float32"], [1, 1], [0, 0, 0, 0], [1, 1], "float32"], {}], "config": {"index": 18215, "code_hash": null, "entity": [["tile_co", "sp", [-1, 1, 15]], ["tile_oh", "sp", [-1, 7, 1]], ["tile_ow", "sp", [-1, 1, 6]], ["reorder_0", "re", [0, 1, 2, 3, 4, 5, 6, 7, 8, 9]], ["ann_reduce", "an", ["none", "unroll"]], ["ann_spatial", "an", ["unroll", "none", "unroll"]]]}, "result": [[0.0007293638571428571], 0, 18.267136573791504, 1630454773.4419765], "version": 0.2, "tvm_version": "0.8.dev0"}
{"input": ["opencl -keys=mali,opencl,gpu -device=mali -max_num_threads=512 -thread_warp_size=2", "conv2d_nchw_spatial_pack.mali", [["TENSOR", [1, 128, 7, 6], "float32"], ["TENSOR", [15, 128, 1, 1], "float32"], [1, 1], [0, 0, 0, 0], [1, 1], "float32"], {}], "config": {"index": 17729, "code_hash": null, "entity": [["tile_co", "sp", [-1, 1, 15]], ["tile_oh", "sp", [-1, 7, 1]], ["tile_ow", "sp", [-1, 1, 6]], ["reorder_0", "re", [0, 1, 2, 3, 4, 5, 6, 7, 8, 9]], ["ann_reduce", "an", ["none", "none"]], ["ann_spatial", "an", ["unroll", "none", "unroll"]]]}, "result": [[0.0008767646335877862], 0, 26.929325580596924, 1630454782.111353], "version": 0.2, "tvm_version": "0.8.dev0"}
{"input": ["opencl -keys=mali,opencl,gpu -device=mali -max_num_threads=512 -thread_warp_size=2", "conv2d_nchw_spatial_pack.mali", [["TENSOR", [1, 128, 7, 6], "float32"], ["TENSOR", [15, 128, 1, 1], "float32"], [1, 1], [0, 0, 0, 0], [1, 1], "float32"], {}], "config": {"index": 24649, "code_hash": null, "entity": [["tile_co", "sp", [-1, 3, 5]], ["tile_oh", "sp", [-1, 1, 7]], ["tile_ow", "sp", [-1, 6, 1]], ["reorder_0", "re", [0, 1, 2, 3, 4, 5, 6, 9, 7, 8]], ["ann_reduce", "an", ["unroll", "none"]], ["ann_spatial", "an", ["unroll", "unroll", "unroll"]]]}, "result": [[0.0010046651376146788], 0, 35.60102128982544, 1630454790.7906032], "version": 0.2, "tvm_version": "0.8.dev0"}
{"input": ["opencl -keys=mali,opencl,gpu -device=mali -max_num_threads=512 -thread_warp_size=2", "conv2d_nchw_spatial_pack.mali", [["TENSOR", [1, 128, 7, 6], "float32"], ["TENSOR", [15, 128, 1, 1], "float32"], [1, 1], [0, 0, 0, 0], [1, 1], "float32"], {}], "config": {"index": 17846, "code_hash": null, "entity": [["tile_co", "sp", [-1, 1, 15]], ["tile_oh", "sp", [-1, 1, 7]], ["tile_ow", "sp", [-1, 6, 1]], ["reorder_0", "re", [0, 1, 2, 3, 4, 5, 6, 9, 7, 8]], ["ann_reduce", "an", ["none", "none"]], ["ann_spatial", "an", ["unroll", "none", "unroll"]]]}, "result": [[0.0006638638794212218], 0, 45.72162199020386, 1630454800.9230492], "version": 0.2, "tvm_version": "0.8.dev0"}
{"input": ["opencl -keys=mali,opencl,gpu -device=mali -max_num_threads=512 -thread_warp_size=2", "conv2d_nchw_spatial_pack.mali", [["TENSOR", [1, 128, 7, 6], "float32"], ["TENSOR", [15, 128, 1, 1], "float32"], [1, 1], [0, 0, 0, 0], [1, 1], "float32"], {}], "config": {"index": 9638, "code_hash": null, "entity": [["tile_co", "sp", [-1, 1, 15]], ["tile_oh", "sp", [-1, 1, 7]], ["tile_ow", "sp", [-1, 3, 2]], ["reorder_0", "re", [0, 1, 2, 3, 4, 5, 6, 9, 7, 8]], ["ann_reduce", "an", ["unroll", "unroll"]], ["ann_spatial", "an", ["none", "unroll", "unroll"]]]}, "result": [[0.0010052272727272727], 0, 57.75669050216675, 1630454812.9755323], "version": 0.2, "tvm_version": "0.8.dev0"}
{"input": ["opencl -keys=mali,opencl,gpu -device=mali -max_num_threads=512 -thread_warp_size=2", "conv2d_nchw_spatial_pack.mali", [["TENSOR", [1, 128, 7, 6], "float32"], ["TENSOR", [15, 128, 1, 1], "float32"], [1, 1], [0, 0, 0, 0], [1, 1], "float32"], {}], "config": {"index": 17845, "code_hash": null, "entity": [["tile_co", "sp", [-1, 3, 5]], ["tile_oh", "sp", [-1, 1, 7]], ["tile_ow", "sp", [-1, 6, 1]], ["reorder_0", "re", [0, 1, 2, 3, 4, 5, 6, 9, 7, 8]], ["ann_reduce", "an", ["none", "none"]], ["ann_spatial", "an", ["unroll", "none", "unroll"]]]}, "result": [[0.0008654074074074075], 0, 64.55915570259094, 1630454819.791621], "version": 0.2, "tvm_version": "0.8.dev0"}
{"input": ["opencl -keys=mali,opencl,gpu -device=mali -max_num_threads=512 -thread_warp_size=2", "conv2d_nchw_spatial_pack.mali", [["TENSOR", [1, 128, 7, 6], "float32"], ["TENSOR", [15, 128, 1, 1], "float32"], [1, 1], [0, 0, 0, 0], [1, 1], "float32"], {}], "config": {"index": 19106, "code_hash": null, "entity": [["tile_co", "sp", [-1, 1, 15]], ["tile_oh", "sp", [-1, 7, 1]], ["tile_ow", "sp", [-1, 3, 2]], ["reorder_0", "re", [0, 1, 2, 3, 4, 5, 6, 7, 8, 9]], ["ann_reduce", "an", ["unroll", "unroll"]], ["ann_spatial", "an", ["unroll", "none", "unroll"]]]}, "result": [[0.0005506416656249999], 0, 73.18991923332214, 1630454828.4055212], "version": 0.2, "tvm_version": "0.8.dev0"}
{"input": ["opencl -keys=mali,opencl,gpu -device=mali -max_num_threads=512 -thread_warp_size=2", "conv2d_nchw_spatial_pack.mali", [["TENSOR", [1, 128, 7, 6], "float32"], ["TENSOR", [15, 128, 1, 1], "float32"], [1, 1], [0, 0, 0, 0], [1, 1], "float32"], {}], "config": {"index": 24218, "code_hash": null, "entity": [["tile_co", "sp", [-1, 1, 15]], ["tile_oh", "sp", [-1, 1, 7]], ["tile_ow", "sp", [-1, 3, 2]], ["reorder_0", "re", [0, 1, 2, 3, 4, 5, 6, 9, 7, 8]], ["ann_reduce", "an", ["none", "unroll"]], ["ann_spatial", "an", ["unroll", "unroll", "unroll"]]]}, "result": [[0.0014908185986394556], 0, 86.3412253856659, 1630454841.5742831], "version": 0.2, "tvm_version": "0.8.dev0"}
{"input": ["opencl -keys=mali,opencl,gpu -device=mali -max_num_threads=512 -thread_warp_size=2", "conv2d_nchw_spatial_pack.mali", [["TENSOR", [1, 128, 7, 6], "float32"], ["TENSOR", [15, 128, 1, 1], "float32"], [1, 1], [0, 0, 0, 0], [1, 1], "float32"], {}], "config": {"index": 9582, "code_hash": null, "entity": [["tile_co", "sp", [-1, 1, 5]], ["tile_oh", "sp", [-1, 1, 7]], ["tile_ow", "sp", [-1, 6, 1]], ["reorder_0", "re", [0, 1, 2, 3, 4, 5, 6, 9, 7, 8]], ["ann_reduce", "an", ["unroll", "unroll"]], ["ann_spatial", "an", ["none", "unroll", "unroll"]]]}, "result": [[0.0008262141176470589], 0, 92.12285852432251, 1630454847.3804808], "version": 0.2, "tvm_version": "0.8.dev0"}
{"input": ["opencl -keys=mali,opencl,gpu -device=mali -max_num_threads=512 -thread_warp_size=2", "conv2d_nchw_spatial_pack.mali", [["TENSOR", [1, 128, 7, 6], "float32"], ["TENSOR", [15, 128, 1, 1], "float32"], [1, 1], [0, 0, 0, 0], [1, 1], "float32"], {}], "config": {"index": 18575, "code_hash": null, "entity": [["tile_co", "sp", [-1, 1, 15]], ["tile_oh", "sp", [-1, 1, 7]], ["tile_ow", "sp", [-1, 6, 1]], ["reorder_0", "re", [0, 1, 2, 3, 4, 5, 6, 7, 8, 9]], ["ann_reduce", "an", ["unroll", "none"]], ["ann_spatial", "an", ["unroll", "none", "unroll"]]]}, "result": [[0.001063805705882353], 0, 101.37563872337341, 1630454856.650862], "version": 0.2, "tvm_version": "0.8.dev0"}
{"input": ["opencl -keys=mali,opencl,gpu -device=mali -max_num_threads=512 -thread_warp_size=2", "conv2d_nchw_spatial_pack.mali", [["TENSOR", [1, 128, 7, 6], "float32"], ["TENSOR", [15, 128, 1, 1], "float32"], [1, 1], [0, 0, 0, 0], [1, 1], "float32"], {}], "config": {"index": 9097, "code_hash": null, "entity": [["tile_co", "sp", [-1, 3, 5]], ["tile_oh", "sp", [-1, 1, 7]], ["tile_ow", "sp", [-1, 6, 1]], ["reorder_0", "re", [0, 1, 2, 3, 4, 5, 6, 9, 7, 8]], ["ann_reduce", "an", ["unroll", "none"]], ["ann_spatial", "an", ["none", "unroll", "unroll"]]]}, "result": [[0.0007859457142857144], 0, 110.2107286453247, 1630454865.4988697], "version": 0.2, "tvm_version": "0.8.dev0"}
{"input": ["opencl -keys=mali,opencl,gpu -device=mali -max_num_threads=512 -thread_warp_size=2", "conv2d_nchw_spatial_pack.mali", [["TENSOR", [1, 128, 7, 6], "float32"], ["TENSOR", [15, 128, 1, 1], "float32"], [1, 1], [0, 0, 0, 0], [1, 1], "float32"], {}], "config": {"index": 24893, "code_hash": null, "entity": [["tile_co", "sp", [-1, 1, 15]], ["tile_oh", "sp", [-1, 1, 7]], ["tile_ow", "sp", [-1, 6, 1]], ["reorder_0", "re", [0, 1, 2, 3, 4, 5, 6, 7, 8, 9]], ["ann_reduce", "an", ["unroll", "unroll"]], ["ann_spatial", "an", ["unroll", "unroll", "unroll"]]]}, "result": [[0.0009636737967914439], 0, 119.83533382415771, 1630454875.1376464], "version": 0.2, "tvm_version": "0.8.dev0"}
{"input": ["opencl -keys=mali,opencl,gpu -device=mali -max_num_threads=512 -thread_warp_size=2", "conv2d_nchw_spatial_pack.mali", [["TENSOR", [1, 128, 7, 6], "float32"], ["TENSOR", [15, 128, 1, 1], "float32"], [1, 1], [0, 0, 0, 0], [1, 1], "float32"], {}], "config": {"index": 19304, "code_hash": null, "entity": [["tile_co", "sp", [-1, 1, 15]], ["tile_oh", "sp", [-1, 1, 7]], ["tile_ow", "sp", [-1, 6, 1]], ["reorder_0", "re", [0, 1, 2, 3, 4, 5, 6, 9, 7, 8]], ["ann_reduce", "an", ["unroll", "unroll"]], ["ann_spatial", "an", ["unroll", "none", "unroll"]]]}, "result": [[0.0008938584558823529], 0, 129.25882840156555, 1630454884.582848], "version": 0.2, "tvm_version": "0.8.dev0"}
{"input": ["opencl -keys=mali,opencl,gpu -device=mali -max_num_threads=512 -thread_warp_size=2", "conv2d_nchw_spatial_pack.mali", [["TENSOR", [1, 128, 7, 6], "float32"], ["TENSOR", [15, 128, 1, 1], "float32"], [1, 1], [0, 0, 0, 0], [1, 1], "float32"], {}], "config": {"index": 25019, "code_hash": null, "entity": [["tile_co", "sp", [-1, 1, 15]], ["tile_oh", "sp", [-1, 7, 1]], ["tile_ow", "sp", [-1, 1, 6]], ["reorder_0", "re", [0, 1, 2, 3, 4, 5, 6, 7, 8, 9]], ["ann_reduce", "an", ["unroll", "unroll"]], ["ann_spatial", "an", ["unroll", "unroll", "unroll"]]]}, "result": [[0.0011317922437673131], 0, 138.37588834762573, 1630454893.7063396], "version": 0.2, "tvm_version": "0.8.dev0"}
{"input": ["opencl -keys=mali,opencl,gpu -device=mali -max_num_threads=512 -thread_warp_size=2", "conv2d_nchw_spatial_pack.mali", [["TENSOR", [1, 128, 7, 6], "float32"], ["TENSOR", [15, 128, 1, 1], "float32"], [1, 1], [0, 0, 0, 0], [1, 1], "float32"], {}], "config": {"index": 19303, "code_hash": null, "entity": [["tile_co", "sp", [-1, 3, 5]], ["tile_oh", "sp", [-1, 1, 7]], ["tile_ow", "sp", [-1, 6, 1]], ["reorder_0", "re", [0, 1, 2, 3, 4, 5, 6, 9, 7, 8]], ["ann_reduce", "an", ["unroll", "unroll"]], ["ann_spatial", "an", ["unroll", "none", "unroll"]]]}, "result": [[0.0007963240740740741], 0, 147.37146186828613, 1630454902.7258277], "version": 0.2, "tvm_version": "0.8.dev0"}
{"input": ["opencl -keys=mali,opencl,gpu -device=mali -max_num_threads=512 -thread_warp_size=2", "conv2d_nchw_spatial_pack.mali", [["TENSOR", [1, 128, 7, 6], "float32"], ["TENSOR", [15, 128, 1, 1], "float32"], [1, 1], [0, 0, 0, 0], [1, 1], "float32"], {}], "config": {"index": 18635, "code_hash": null, "entity": [["tile_co", "sp", [-1, 5, 3]], ["tile_oh", "sp", [-1, 1, 1]], ["tile_ow", "sp", [-1, 1, 3]], ["reorder_0", "re", [0, 1, 2, 3, 4, 5, 6, 7, 8, 9]], ["ann_reduce", "an", ["unroll", "none"]], ["ann_spatial", "an", ["unroll", "none", "unroll"]]]}, "result": [[0.0009488031319910515], 0, 8.447742462158203, 1630454911.5905201], "version": 0.2, "tvm_version": "0.8.dev0"}
{"input": ["opencl -keys=mali,opencl,gpu -device=mali -max_num_threads=512 -thread_warp_size=2", "conv2d_nchw_spatial_pack.mali", [["TENSOR", [1, 128, 7, 6], "float32"], ["TENSOR", [15, 128, 1, 1], "float32"], [1, 1], [0, 0, 0, 0], [1, 1], "float32"], {}], "config": {"index": 18674, "code_hash": null, "entity": [["tile_co", "sp", [-1, 1, 15]], ["tile_oh", "sp", [-1, 7, 1]], ["tile_ow", "sp", [-1, 2, 3]], ["reorder_0", "re", [0, 1, 2, 3, 4, 5, 6, 7, 8, 9]], ["ann_reduce", "an", ["unroll", "none"]], ["ann_spatial", "an", ["unroll", "none", "unroll"]]]}, "result": [[0.0012248113682170542], 0, 17.336711883544922, 1630454920.4919], "version": 0.2, "tvm_version": "0.8.dev0"}
{"input": ["opencl -keys=mali,opencl,gpu -device=mali -max_num_threads=512 -thread_warp_size=2", "conv2d_nchw_spatial_pack.mali", [["TENSOR", [1, 128, 7, 6], "float32"], ["TENSOR", [15, 128, 1, 1], "float32"], [1, 1], [0, 0, 0, 0], [1, 1], "float32"], {}], "config": {"index": 23921, "code_hash": null, "entity": [["tile_co", "sp", [-1, 1, 15]], ["tile_oh", "sp", [-1, 1, 7]], ["tile_ow", "sp", [-1, 6, 1]], ["reorder_0", "re", [0, 1, 2, 3, 4, 5, 6, 7, 8, 9]], ["ann_reduce", "an", ["none", "unroll"]], ["ann_spatial", "an", ["unroll", "unroll", "unroll"]]]}, "result": [[0.0009529918220858896], 0, 26.88258385658264, 1630454930.0428634], "version": 0.2, "tvm_version": "0.8.dev0"}
{"input": ["opencl -keys=mali,opencl,gpu -device=mali -max_num_threads=512 -thread_warp_size=2", "conv2d_nchw_spatial_pack.mali", [["TENSOR", [1, 128, 7, 6], "float32"], ["TENSOR", [15, 128, 1, 1], "float32"], [1, 1], [0, 0, 0, 0], [1, 1], "float32"], {}], "config": {"index": 18818, "code_hash": null, "entity": [["tile_co", "sp", [-1, 1, 15]], ["tile_oh", "sp", [-1, 1, 7]], ["tile_ow", "sp", [-1, 6, 1]], ["reorder_0", "re", [0, 1, 2, 3, 4, 5, 6, 9, 7, 8]], ["ann_reduce", "an", ["unroll", "none"]], ["ann_spatial", "an", ["unroll", "none", "unroll"]]]}, "result": [[0.00112719], 0, 36.11768579483032, 1630454939.293749], "version": 0.2, "tvm_version": "0.8.dev0"}
{"input": ["opencl -keys=mali,opencl,gpu -device=mali -max_num_threads=512 -thread_warp_size=2", "conv2d_nchw_spatial_pack.mali", [["TENSOR", [1, 128, 7, 6], "float32"], ["TENSOR", [15, 128, 1, 1], "float32"], [1, 1], [0, 0, 0, 0], [1, 1], "float32"], {}], "config": {"index": 18817, "code_hash": null, "entity": [["tile_co", "sp", [-1, 3, 5]], ["tile_oh", "sp", [-1, 1, 7]], ["tile_ow", "sp", [-1, 6, 1]], ["reorder_0", "re", [0, 1, 2, 3, 4, 5, 6, 9, 7, 8]], ["ann_reduce", "an", ["unroll", "none"]], ["ann_spatial", "an", ["unroll", "none", "unroll"]]]}, "result": [[0.0008329939393939393], 0, 44.75956463813782, 1630454947.9339387], "version": 0.2, "tvm_version": "0.8.dev0"}
{"input": ["opencl -keys=mali,opencl,gpu -device=mali -max_num_threads=512 -thread_warp_size=2", "conv2d_nchw_spatial_pack.mali", [["TENSOR", [1, 128, 7, 6], "float32"], ["TENSOR", [15, 128, 1, 1], "float32"], [1, 1], [0, 0, 0, 0], [1, 1], "float32"], {}], "config": {"index": 23435, "code_hash": null, "entity": [["tile_co", "sp", [-1, 1, 15]], ["tile_oh", "sp", [-1, 1, 7]], ["tile_ow", "sp", [-1, 6, 1]], ["reorder_0", "re", [0, 1, 2, 3, 4, 5, 6, 7, 8, 9]], ["ann_reduce", "an", ["none", "none"]], ["ann_spatial", "an", ["unroll", "unroll", "unroll"]]]}, "result": [[0.001263023554347826], 0, 54.1188862323761, 1630454957.312389], "version": 0.2, "tvm_version": "0.8.dev0"}
{"input": ["opencl -keys=mali,opencl,gpu -device=mali -max_num_threads=512 -thread_warp_size=2", "conv2d_nchw_spatial_pack.mali", [["TENSOR", [1, 128, 7, 6], "float32"], ["TENSOR", [15, 128, 1, 1], "float32"], [1, 1], [0, 0, 0, 0], [1, 1], "float32"], {}], "config": {"index": 18332, "code_hash": null, "entity": [["tile_co", "sp", [-1, 1, 15]], ["tile_oh", "sp", [-1, 1, 7]], ["tile_ow", "sp", [-1, 6, 1]], ["reorder_0", "re", [0, 1, 2, 3, 4, 5, 6, 9, 7, 8]], ["ann_reduce", "an", ["none", "unroll"]], ["ann_spatial", "an", ["unroll", "none", "unroll"]]]}, "result": [[0.0010536989247311827], 0, 63.303441286087036, 1630454966.4786882], "version": 0.2, "tvm_version": "0.8.dev0"}
{"input": ["opencl -keys=mali,opencl,gpu -device=mali -max_num_threads=512 -thread_warp_size=2", "conv2d_nchw_spatial_pack.mali", [["TENSOR", [1, 128, 7, 6], "float32"], ["TENSOR", [15, 128, 1, 1], "float32"], [1, 1], [0, 0, 0, 0], [1, 1], "float32"], {}], "config": {"index": 24047, "code_hash": null, "entity": [["tile_co", "sp", [-1, 1, 15]], ["tile_oh", "sp", [-1, 7, 1]], ["tile_ow", "sp", [-1, 1, 6]], ["reorder_0", "re", [0, 1, 2, 3, 4, 5, 6, 7, 8, 9]], ["ann_reduce", "an", ["none", "unroll"]], ["ann_spatial", "an", ["unroll", "unroll", "unroll"]]]}, "result": [[0.0008273995983935743], 0, 72.69126868247986, 1630454975.913689], "version": 0.2, "tvm_version": "0.8.dev0"}
{"input": ["opencl -keys=mali,opencl,gpu -device=mali -max_num_threads=512 -thread_warp_size=2", "conv2d_nchw_spatial_pack.mali", [["TENSOR", [1, 128, 7, 6], "float32"], ["TENSOR", [15, 128, 1, 1], "float32"], [1, 1], [0, 0, 0, 0], [1, 1], "float32"], {}], "config": {"index": 17663, "code_hash": null, "entity": [["tile_co", "sp", [-1, 5, 3]], ["tile_oh", "sp", [-1, 1, 1]], ["tile_ow", "sp", [-1, 1, 3]], ["reorder_0", "re", [0, 1, 2, 3, 4, 5, 6, 7, 8, 9]], ["ann_reduce", "an", ["none", "none"]], ["ann_spatial", "an", ["unroll", "none", "unroll"]]]}, "result": [[0.0009613209504643963], 0, 81.12961435317993, 1630454984.3726535], "version": 0.2, "tvm_version": "0.8.dev0"}
{"input": ["opencl -keys=mali,opencl,gpu -device=mali -max_num_threads=512 -thread_warp_size=2", "conv2d_nchw_spatial_pack.mali", [["TENSOR", [1, 128, 7, 6], "float32"], ["TENSOR", [15, 128, 1, 1], "float32"], [1, 1], [0, 0, 0, 0], [1, 1], "float32"], {}], "config": {"index": 18331, "code_hash": null, "entity": [["tile_co", "sp", [-1, 3, 5]], ["tile_oh", "sp", [-1, 1, 7]], ["tile_ow", "sp", [-1, 6, 1]], ["reorder_0", "re", [0, 1, 2, 3, 4, 5, 6, 9, 7, 8]], ["ann_reduce", "an", ["none", "unroll"]], ["ann_spatial", "an", ["unroll", "none", "unroll"]]]}, "result": [[0.0011054074074074074], 0, 89.80795311927795, 1630454993.0386064], "version": 0.2, "tvm_version": "0.8.dev0"}
{"input": ["opencl -keys=mali,opencl,gpu -device=mali -max_num_threads=512 -thread_warp_size=2", "conv2d_nchw_spatial_pack.mali", [["TENSOR", [1, 128, 7, 6], "float32"], ["TENSOR", [15, 128, 1, 1], "float32"], [1, 1], [0, 0, 0, 0], [1, 1], "float32"], {}], "config": {"index": 23561, "code_hash": null, "entity": [["tile_co", "sp", [-1, 1, 15]], ["tile_oh", "sp", [-1, 7, 1]], ["tile_ow", "sp", [-1, 1, 6]], ["reorder_0", "re", [0, 1, 2, 3, 4, 5, 6, 7, 8, 9]], ["ann_reduce", "an", ["none", "none"]], ["ann_spatial", "an", ["unroll", "unroll", "unroll"]]]}, "result": [[0.0007572133928035982], 0, 99.11960673332214, 1630455002.3777332], "version": 0.2, "tvm_version": "0.8.dev0"}
{"input": ["opencl -keys=mali,opencl,gpu -device=mali -max_num_threads=512 -thread_warp_size=2", "conv2d_nchw_spatial_pack.mali", [["TENSOR", [1, 128, 7, 6], "float32"], ["TENSOR", [15, 128, 1, 1], "float32"], [1, 1], [0, 0, 0, 0], [1, 1], "float32"], {}], "config": {"index": 9096, "code_hash": null, "entity": [["tile_co", "sp", [-1, 1, 5]], ["tile_oh", "sp", [-1, 1, 7]], ["tile_ow", "sp", [-1, 6, 1]], ["reorder_0", "re", [0, 1, 2, 3, 4, 5, 6, 9, 7, 8]], ["ann_reduce", "an", ["unroll", "none"]], ["ann_spatial", "an", ["none", "unroll", "unroll"]]]}, "result": [[0.0007596838114285715], 0, 108.00319385528564, 1630455011.2768023], "version": 0.2, "tvm_version": "0.8.dev0"}
{"input": ["opencl -keys=mali,opencl,gpu -device=mali -max_num_threads=512 -thread_warp_size=2", "conv2d_nchw_spatial_pack.mali", [["TENSOR", [1, 128, 7, 6], "float32"], ["TENSOR", [15, 128, 1, 1], "float32"], [1, 1], [0, 0, 0, 0], [1, 1], "float32"], {}], "config": {"index": 9094, "code_hash": null, "entity": [["tile_co", "sp", [-1, 1, 3]], ["tile_oh", "sp", [-1, 1, 7]], ["tile_ow", "sp", [-1, 6, 1]], ["reorder_0", "re", [0, 1, 2, 3, 4, 5, 6, 9, 7, 8]], ["ann_reduce", "an", ["unroll", "none"]], ["ann_spatial", "an", ["none", "unroll", "unroll"]]]}, "result": [[0.0008352254915966386], 0, 116.54352974891663, 1630455019.8307722], "version": 0.2, "tvm_version": "0.8.dev0"}
{"input": ["opencl -keys=mali,opencl,gpu -device=mali -max_num_threads=512 -thread_warp_size=2", "conv2d_nchw_spatial_pack.mali", [["TENSOR", [1, 128, 7, 6], "float32"], ["TENSOR", [15, 128, 1, 1], "float32"], [1, 1], [0, 0, 0, 0], [1, 1], "float32"], {}], "config": {"index": 23732, "code_hash": null, "entity": [["tile_co", "sp", [-1, 1, 15]], ["tile_oh", "sp", [-1, 1, 7]], ["tile_ow", "sp", [-1, 3, 2]], ["reorder_0", "re", [0, 1, 2, 3, 4, 5, 6, 9, 7, 8]], ["ann_reduce", "an", ["none", "none"]], ["ann_spatial", "an", ["unroll", "unroll", "unroll"]]]}, "result": [[0.0015014301824324324], 0, 129.59669709205627, 1630455032.8842983], "version": 0.2, "tvm_version": "0.8.dev0"}
{"input": ["opencl -keys=mali,opencl,gpu -device=mali -max_num_threads=512 -thread_warp_size=2", "conv2d_nchw_spatial_pack.mali", [["TENSOR", [1, 128, 7, 6], "float32"], ["TENSOR", [15, 128, 1, 1], "float32"], [1, 1], [0, 0, 0, 0], [1, 1], "float32"], {}], "config": {"index": 18089, "code_hash": null, "entity": [["tile_co", "sp", [-1, 1, 15]], ["tile_oh", "sp", [-1, 1, 7]], ["tile_ow", "sp", [-1, 6, 1]], ["reorder_0", "re", [0, 1, 2, 3, 4, 5, 6, 7, 8, 9]], ["ann_reduce", "an", ["none", "unroll"]], ["ann_spatial", "an", ["unroll", "none", "unroll"]]]}, "result": [[0.0012244408602150537], 0, 135.68518471717834, 1630455039.0022755], "version": 0.2, "tvm_version": "0.8.dev0"}
{"input": ["opencl -keys=mali,opencl,gpu -device=mali -max_num_threads=512 -thread_warp_size=2", "conv2d_nchw_spatial_pack.mali", [["TENSOR", [1, 128, 7, 6], "float32"], ["TENSOR", [15, 128, 1, 1], "float32"], [1, 1], [0, 0, 0, 0], [1, 1], "float32"], {}], "config": {"index": 8611, "code_hash": null, "entity": [["tile_co", "sp", [-1, 3, 5]], ["tile_oh", "sp", [-1, 1, 7]], ["tile_ow", "sp", [-1, 6, 1]], ["reorder_0", "re", [0, 1, 2, 3, 4, 5, 6, 9, 7, 8]], ["ann_reduce", "an", ["none", "unroll"]], ["ann_spatial", "an", ["none", "unroll", "unroll"]]]}, "result": [[0.0007318435897435897], 0, 144.1670114994049, 1630455047.5085104], "version": 0.2, "tvm_version": "0.8.dev0"}
{"input": ["opencl -keys=mali,opencl,gpu -device=mali -max_num_threads=512 -thread_warp_size=2", "conv2d_nchw_spatial_pack.mali", [["TENSOR", [1, 128, 7, 6], "float32"], ["TENSOR", [15, 128, 1, 1], "float32"], [1, 1], [0, 0, 0, 0], [1, 1], "float32"], {}], "config": {"index": 24467, "code_hash": null, "entity": [["tile_co", "sp", [-1, 5, 3]], ["tile_oh", "sp", [-1, 1, 1]], ["tile_ow", "sp", [-1, 1, 3]], ["reorder_0", "re", [0, 1, 2, 3, 4, 5, 6, 7, 8, 9]], ["ann_reduce", "an", ["unroll", "none"]], ["ann_spatial", "an", ["unroll", "unroll", "unroll"]]]}, "result": [[0.0007576227306590258], 0, 8.324547529220581, 1630455056.2063463], "version": 0.2, "tvm_version": "0.8.dev0"}
{"input": ["opencl -keys=mali,opencl,gpu -device=mali -max_num_threads=512 -thread_warp_size=2", "conv2d_nchw_spatial_pack.mali", [["TENSOR", [1, 128, 7, 6], "float32"], ["TENSOR", [15, 128, 1, 1], "float32"], [1, 1], [0, 0, 0, 0], [1, 1], "float32"], {}], "config": {"index": 17603, "code_hash": null, "entity": [["tile_co", "sp", [-1, 1, 15]], ["tile_oh", "sp", [-1, 1, 7]], ["tile_ow", "sp", [-1, 6, 1]], ["reorder_0", "re", [0, 1, 2, 3, 4, 5, 6, 7, 8, 9]], ["ann_reduce", "an", ["none", "none"]], ["ann_spatial", "an", ["unroll", "none", "unroll"]]]}, "result": [[0.0008835923622291022], 0, 17.718541860580444, 1630455065.6022432], "version": 0.2, "tvm_version": "0.8.dev0"}
{"input": ["opencl -keys=mali,opencl,gpu -device=mali -max_num_threads=512 -thread_warp_size=2", "conv2d_nchw_spatial_pack.mali", [["TENSOR", [1, 128, 7, 6], "float32"], ["TENSOR", [15, 128, 1, 1], "float32"], [1, 1], [0, 0, 0, 0], [1, 1], "float32"], {}], "config": {"index": 8125, "code_hash": null, "entity": [["tile_co", "sp", [-1, 3, 5]], ["tile_oh", "sp", [-1, 1, 7]], ["tile_ow", "sp", [-1, 6, 1]], ["reorder_0", "re", [0, 1, 2, 3, 4, 5, 6, 9, 7, 8]], ["ann_reduce", "an", ["none", "none"]], ["ann_spatial", "an", ["none", "unroll", "unroll"]]]}, "result": [[0.0006651813874643874], 0, 26.28545594215393, 1630455074.1941118], "version": 0.2, "tvm_version": "0.8.dev0"}
{"input": ["opencl -keys=mali,opencl,gpu -device=mali -max_num_threads=512 -thread_warp_size=2", "conv2d_nchw_spatial_pack.mali", [["TENSOR", [1, 128, 7, 6], "float32"], ["TENSOR", [15, 128, 1, 1], "float32"], [1, 1], [0, 0, 0, 0], [1, 1], "float32"], {}], "config": {"index": 19121, "code_hash": null, "entity": [["tile_co", "sp", [-1, 5, 3]], ["tile_oh", "sp", [-1, 1, 1]], ["tile_ow", "sp", [-1, 1, 3]], ["reorder_0", "re", [0, 1, 2, 3, 4, 5, 6, 7, 8, 9]], ["ann_reduce", "an", ["unroll", "unroll"]], ["ann_spatial", "an", ["unroll", "none", "unroll"]]]}, "result": [[0.001100416667266187], 0, 36.39840912818909, 1630455084.3199198], "version": 0.2, "tvm_version": "0.8.dev0"}
{"input": ["opencl -keys=mali,opencl,gpu -device=mali -max_num_threads=512 -thread_warp_size=2", "conv2d_nchw_spatial_pack.mali", [["TENSOR", [1, 128, 7, 6], "float32"], ["TENSOR", [15, 128, 1, 1], "float32"], [1, 1], [0, 0, 0, 0], [1, 1], "float32"], {}], "config": {"index": 25134, "code_hash": null, "entity": [["tile_co", "sp", [-1, 1, 5]], ["tile_oh", "sp", [-1, 1, 7]], ["tile_ow", "sp", [-1, 6, 1]], ["reorder_0", "re", [0, 1, 2, 3, 4, 5, 6, 9, 7, 8]], ["ann_reduce", "an", ["unroll", "unroll"]], ["ann_spatial", "an", ["unroll", "unroll", "unroll"]]]}, "result": [[0.0010470257545454546], 0, 45.59203219413757, 1630455093.5121264], "version": 0.2, "tvm_version": "0.8.dev0"}
{"input": ["opencl -keys=mali,opencl,gpu -device=mali -max_num_threads=512 -thread_warp_size=2", "conv2d_nchw_spatial_pack.mali", [["TENSOR", [1, 128, 7, 6], "float32"], ["TENSOR", [15, 128, 1, 1], "float32"], [1, 1], [0, 0, 0, 0], [1, 1], "float32"], {}], "config": {"index": 8122, "code_hash": null, "entity": [["tile_co", "sp", [-1, 1, 3]], ["tile_oh", "sp", [-1, 1, 7]], ["tile_ow", "sp", [-1, 6, 1]], ["reorder_0", "re", [0, 1, 2, 3, 4, 5, 6, 9, 7, 8]], ["ann_reduce", "an", ["none", "none"]], ["ann_spatial", "an", ["none", "unroll", "unroll"]]]}, "result": [[0.0020975121272727272], 0, 54.107407093048096, 1630455102.055615], "version": 0.2, "tvm_version": "0.8.dev0"}
{"input": ["opencl -keys=mali,opencl,gpu -device=mali -max_num_threads=512 -thread_warp_size=2", "conv2d_nchw_spatial_pack.mali", [["TENSOR", [1, 128, 7, 6], "float32"], ["TENSOR", [15, 128, 1, 1], "float32"], [1, 1], [0, 0, 0, 0], [1, 1], "float32"], {}], "config": {"index": 9553, "code_hash": null, "entity": [["tile_co", "sp", [-1, 1, 3]], ["tile_oh", "sp", [-1, 1, 7]], ["tile_ow", "sp", [-1, 3, 1]], ["reorder_0", "re", [0, 1, 2, 3, 4, 5, 6, 9, 7, 8]], ["ann_reduce", "an", ["unroll", "unroll"]], ["ann_spatial", "an", ["none", "unroll", "unroll"]]]}, "result": [[0.0007093762116182573], 0, 62.77275347709656, 1630455110.7183888], "version": 0.2, "tvm_version": "0.8.dev0"}
{"input": ["opencl -keys=mali,opencl,gpu -device=mali -max_num_threads=512 -thread_warp_size=2", "conv2d_nchw_spatial_pack.mali", [["TENSOR", [1, 128, 7, 6], "float32"], ["TENSOR", [15, 128, 1, 1], "float32"], [1, 1], [0, 0, 0, 0], [1, 1], "float32"], {}], "config": {"index": 23676, "code_hash": null, "entity": [["tile_co", "sp", [-1, 1, 5]], ["tile_oh", "sp", [-1, 1, 7]], ["tile_ow", "sp", [-1, 6, 1]], ["reorder_0", "re", [0, 1, 2, 3, 4, 5, 6, 9, 7, 8]], ["ann_reduce", "an", ["none", "none"]], ["ann_spatial", "an", ["unroll", "unroll", "unroll"]]]}, "result": [[0.001143239330792683], 0, 72.07623219490051, 1630455120.0300422], "version": 0.2, "tvm_version": "0.8.dev0"}
{"input": ["opencl -keys=mali,opencl,gpu -device=mali -max_num_threads=512 -thread_warp_size=2", "conv2d_nchw_spatial_pack.mali", [["TENSOR", [1, 128, 7, 6], "float32"], ["TENSOR", [15, 128, 1, 1], "float32"], [1, 1], [0, 0, 0, 0], [1, 1], "float32"], {}], "config": {"index": 9580, "code_hash": null, "entity": [["tile_co", "sp", [-1, 1, 3]], ["tile_oh", "sp", [-1, 1, 7]], ["tile_ow", "sp", [-1, 6, 1]], ["reorder_0", "re", [0, 1, 2, 3, 4, 5, 6, 9, 7, 8]], ["ann_reduce", "an", ["unroll", "unroll"]], ["ann_spatial", "an", ["none", "unroll", "unroll"]]]}, "result": [[0.0012539470290697673], 0, 81.06504893302917, 1630455129.0482452], "version": 0.2, "tvm_version": "0.8.dev0"}
{"input": ["opencl -keys=mali,opencl,gpu -device=mali -max_num_threads=512 -thread_warp_size=2", "conv2d_nchw_spatial_pack.mali", [["TENSOR", [1, 128, 7, 6], "float32"], ["TENSOR", [15, 128, 1, 1], "float32"], [1, 1], [0, 0, 0, 0], [1, 1], "float32"], {}], "config": {"index": 23495, "code_hash": null, "entity": [["tile_co", "sp", [-1, 5, 3]], ["tile_oh", "sp", [-1, 1, 1]], ["tile_ow", "sp", [-1, 1, 3]], ["reorder_0", "re", [0, 1, 2, 3, 4, 5, 6, 7, 8, 9]], ["ann_reduce", "an", ["none", "none"]], ["ann_spatial", "an", ["unroll", "unroll", "unroll"]]]}, "result": [[0.0009281607260787993], 0, 90.2198531627655, 1630455138.2063024], "version": 0.2, "tvm_version": "0.8.dev0"}
{"input": ["opencl -keys=mali,opencl,gpu -device=mali -max_num_threads=512 -thread_warp_size=2", "conv2d_nchw_spatial_pack.mali", [["TENSOR", [1, 128, 7, 6], "float32"], ["TENSOR", [15, 128, 1, 1], "float32"], [1, 1], [0, 0, 0, 0], [1, 1], "float32"], {}], "config": {"index": 9091, "code_hash": null, "entity": [["tile_co", "sp", [-1, 3, 1]], ["tile_oh", "sp", [-1, 1, 7]], ["tile_ow", "sp", [-1, 6, 1]], ["reorder_0", "re", [0, 1, 2, 3, 4, 5, 6, 9, 7, 8]], ["ann_reduce", "an", ["unroll", "none"]], ["ann_spatial", "an", ["none", "unroll", "unroll"]]]}, "result": [[0.0006513640552995391], 0, 99.0411684513092, 1630455147.0465317], "version": 0.2, "tvm_version": "0.8.dev0"}
{"input": ["opencl -keys=mali,opencl,gpu -device=mali -max_num_threads=512 -thread_warp_size=2", "conv2d_nchw_spatial_pack.mali", [["TENSOR", [1, 128, 7, 6], "float32"], ["TENSOR", [15, 128, 1, 1], "float32"], [1, 1], [0, 0, 0, 0], [1, 1], "float32"], {}], "config": {"index": 18188, "code_hash": null, "entity": [["tile_co", "sp", [-1, 1, 15]], ["tile_oh", "sp", [-1, 7, 1]], ["tile_ow", "sp", [-1, 2, 3]], ["reorder_0", "re", [0, 1, 2, 3, 4, 5, 6, 7, 8, 9]], ["ann_reduce", "an", ["none", "unroll"]], ["ann_spatial", "an", ["unroll", "none", "unroll"]]]}, "result": [[0.000618122129476584], 0, 107.73004412651062, 1630455155.73882], "version": 0.2, "tvm_version": "0.8.dev0"}
{"input": ["opencl -keys=mali,opencl,gpu -device=mali -max_num_threads=512 -thread_warp_size=2", "conv2d_nchw_spatial_pack.mali", [["TENSOR", [1, 128, 7, 6], "float32"], ["TENSOR", [15, 128, 1, 1], "float32"], [1, 1], [0, 0, 0, 0], [1, 1], "float32"], {}], "config": {"index": 16691, "code_hash": null, "entity": [["tile_co", "sp", [-1, 5, 3]], ["tile_oh", "sp", [-1, 1, 1]], ["tile_ow", "sp", [-1, 1, 3]], ["reorder_0", "re", [0, 1, 2, 3, 4, 5, 6, 7, 8, 9]], ["ann_reduce", "an", ["unroll", "none"]], ["ann_spatial", "an", ["unroll", "none", "none"]]]}, "result": [[0.0010556140845070423], 0, 116.32654094696045, 1630455164.3612907], "version": 0.2, "tvm_version": "0.8.dev0"}
{"input": ["opencl -keys=mali,opencl,gpu -device=mali -max_num_threads=512 -thread_warp_size=2", "conv2d_nchw_spatial_pack.mali", [["TENSOR", [1, 128, 7, 6], "float32"], ["TENSOR", [15, 128, 1, 1], "float32"], [1, 1], [0, 0, 0, 0], [1, 1], "float32"], {}], "config": {"index": 24952, "code_hash": null, "entity": [["tile_co", "sp", [-1, 1, 3]], ["tile_oh", "sp", [-1, 1, 1]], ["tile_ow", "sp", [-1, 1, 3]], ["reorder_0", "re", [0, 1, 2, 3, 4, 5, 6, 7, 8, 9]], ["ann_reduce", "an", ["unroll", "unroll"]], ["ann_spatial", "an", ["unroll", "unroll", "unroll"]]]}, "result": [[0.0012286858990384615], 0, 124.79369020462036, 1630455172.8382144], "version": 0.2, "tvm_version": "0.8.dev0"}
{"input": ["opencl -keys=mali,opencl,gpu -device=mali -max_num_threads=512 -thread_warp_size=2", "conv2d_nchw_spatial_pack.mali", [["TENSOR", [1, 128, 7, 6], "float32"], ["TENSOR", [15, 128, 1, 1], "float32"], [1, 1], [0, 0, 0, 0], [1, 1], "float32"], {}], "config": {"index": 23169, "code_hash": null, "entity": [["tile_co", "sp", [-1, 15, 1]], ["tile_oh", "sp", [-1, 1, 1]], ["tile_ow", "sp", [-1, 6, 1]], ["reorder_0", "re", [0, 1, 2, 3, 4, 5, 6, 9, 7, 8]], ["ann_reduce", "an", ["unroll", "unroll"]], ["ann_spatial", "an", ["unroll", "unroll", "none"]]]}, "result": [[0.0008469345613496931], 0, 133.5215356349945, 1630455181.5947995], "version": 0.2, "tvm_version": "0.8.dev0"}
{"input": ["opencl -keys=mali,opencl,gpu -device=mali -max_num_threads=512 -thread_warp_size=2", "conv2d_nchw_spatial_pack.mali", [["TENSOR", [1, 128, 7, 6], "float32"], ["TENSOR", [15, 128, 1, 1], "float32"], [1, 1], [0, 0, 0, 0], [1, 1], "float32"], {}], "config": {"index": 18134, "code_hash": null, "entity": [["tile_co", "sp", [-1, 1, 15]], ["tile_oh", "sp", [-1, 7, 1]], ["tile_ow", "sp", [-1, 3, 2]], ["reorder_0", "re", [0, 1, 2, 3, 4, 5, 6, 7, 8, 9]], ["ann_reduce", "an", ["none", "unroll"]], ["ann_spatial", "an", ["unroll", "none", "unroll"]]]}, "result": [[0.0010397861271676302], 0, 4.327355623245239, 1630455191.4424794], "version": 0.2, "tvm_version": "0.8.dev0"}
{"input": ["opencl -keys=mali,opencl,gpu -device=mali -max_num_threads=512 -thread_warp_size=2", "conv2d_nchw_spatial_pack.mali", [["TENSOR", [1, 128, 7, 6], "float32"], ["TENSOR", [15, 128, 1, 1], "float32"], [1, 1], [0, 0, 0, 0], [1, 1], "float32"], {}], "config": {"index": 33686, "code_hash": null, "entity": [["tile_co", "sp", [-1, 1, 15]], ["tile_oh", "sp", [-1, 7, 1]], ["tile_ow", "sp", [-1, 3, 2]], ["reorder_0", "re", [0, 1, 2, 3, 4, 5, 6, 7, 8, 9]], ["ann_reduce", "an", ["none", "unroll"]], ["ann_spatial", "an", ["vec", "none", "unroll"]]]}, "result": [[0.0007159902514619883], 0, 13.084151029586792, 1630455200.2162237], "version": 0.2, "tvm_version": "0.8.dev0"}
{"input": ["opencl -keys=mali,opencl,gpu -device=mali -max_num_threads=512 -thread_warp_size=2", "conv2d_nchw_spatial_pack.mali", [["TENSOR", [1, 128, 7, 6], "float32"], ["TENSOR", [15, 128, 1, 1], "float32"], [1, 1], [0, 0, 0, 0], [1, 1], "float32"], {}], "config": {"index": 29798, "code_hash": null, "entity": [["tile_co", "sp", [-1, 1, 15]], ["tile_oh", "sp", [-1, 7, 1]], ["tile_ow", "sp", [-1, 3, 2]], ["reorder_0", "re", [0, 1, 2, 3, 4, 5, 6, 7, 8, 9]], ["ann_reduce", "an", ["none", "unroll"]], ["ann_spatial", "an", ["unroll", "vec", "unroll"]]]}, "result": [[0.000782706124489796], 0, 21.893892526626587, 1630455209.039565], "version": 0.2, "tvm_version": "0.8.dev0"}
{"input": ["opencl -keys=mali,opencl,gpu -device=mali -max_num_threads=512 -thread_warp_size=2", "conv2d_nchw_spatial_pack.mali", [["TENSOR", [1, 128, 7, 6], "float32"], ["TENSOR", [15, 128, 1, 1], "float32"], [1, 1], [0, 0, 0, 0], [1, 1], "float32"], {}], "config": {"index": 2582, "code_hash": null, "entity": [["tile_co", "sp", [-1, 1, 15]], ["tile_oh", "sp", [-1, 7, 1]], ["tile_ow", "sp", [-1, 3, 2]], ["reorder_0", "re", [0, 1, 2, 3, 4, 5, 6, 7, 8, 9]], ["ann_reduce", "an", ["none", "unroll"]], ["ann_spatial", "an", ["none", "none", "unroll"]]]}, "result": [[0.0007131867088607595], 0, 30.51814556121826, 1630455217.6689684], "version": 0.2, "tvm_version": "0.8.dev0"}
{"input": ["opencl -keys=mali,opencl,gpu -device=mali -max_num_threads=512 -thread_warp_size=2", "conv2d_nchw_spatial_pack.mali", [["TENSOR", [1, 128, 7, 6], "float32"], ["TENSOR", [15, 128, 1, 1], "float32"], [1, 1], [0, 0, 0, 0], [1, 1], "float32"], {}], "config": {"index": 14246, "code_hash": null, "entity": [["tile_co", "sp", [-1, 1, 15]], ["tile_oh", "sp", [-1, 7, 1]], ["tile_ow", "sp", [-1, 3, 2]], ["reorder_0", "re", [0, 1, 2, 3, 4, 5, 6, 7, 8, 9]], ["ann_reduce", "an", ["none", "unroll"]], ["ann_spatial", "an", ["none", "vec", "unroll"]]]}, "result": [[0.0011244832366863904], 0, 39.11968398094177, 1630455226.2877278], "version": 0.2, "tvm_version": "0.8.dev0"}
{"input": ["opencl -keys=mali,opencl,gpu -device=mali -max_num_threads=512 -thread_warp_size=2", "conv2d_nchw_spatial_pack.mali", [["TENSOR", [1, 128, 7, 6], "float32"], ["TENSOR", [15, 128, 1, 1], "float32"], [1, 1], [0, 0, 0, 0], [1, 1], "float32"], {}], "config": {"index": 17648, "code_hash": null, "entity": [["tile_co", "sp", [-1, 1, 15]], ["tile_oh", "sp", [-1, 7, 1]], ["tile_ow", "sp", [-1, 3, 2]], ["reorder_0", "re", [0, 1, 2, 3, 4, 5, 6, 7, 8, 9]], ["ann_reduce", "an", ["none", "none"]], ["ann_spatial", "an", ["unroll", "none", "unroll"]]]}, "result": [[0.002693663043478261], 0, 47.854454040527344, 1630455235.035646], "version": 0.2, "tvm_version": "0.8.dev0"}
{"input": ["opencl -keys=mali,opencl,gpu -device=mali -max_num_threads=512 -thread_warp_size=2", "conv2d_nchw_spatial_pack.mali", [["TENSOR", [1, 128, 7, 6], "float32"], ["TENSOR", [15, 128, 1, 1], "float32"], [1, 1], [0, 0, 0, 0], [1, 1], "float32"], {}], "config": {"index": 23966, "code_hash": null, "entity": [["tile_co", "sp", [-1, 1, 15]], ["tile_oh", "sp", [-1, 7, 1]], ["tile_ow", "sp", [-1, 3, 2]], ["reorder_0", "re", [0, 1, 2, 3, 4, 5, 6, 7, 8, 9]], ["ann_reduce", "an", ["none", "unroll"]], ["ann_spatial", "an", ["unroll", "unroll", "unroll"]]]}, "result": [[0.0009438382066276804], 0, 56.83404898643494, 1630455244.025246], "version": 0.2, "tvm_version": "0.8.dev0"}
{"input": ["opencl -keys=mali,opencl,gpu -device=mali -max_num_threads=512 -thread_warp_size=2", "conv2d_nchw_spatial_pack.mali", [["TENSOR", [1, 128, 7, 6], "float32"], ["TENSOR", [15, 128, 1, 1], "float32"], [1, 1], [0, 0, 0, 0], [1, 1], "float32"], {}], "config": {"index": 33200, "code_hash": null, "entity": [["tile_co", "sp", [-1, 1, 15]], ["tile_oh", "sp", [-1, 7, 1]], ["tile_ow", "sp", [-1, 3, 2]], ["reorder_0", "re", [0, 1, 2, 3, 4, 5, 6, 7, 8, 9]], ["ann_reduce", "an", ["none", "none"]], ["ann_spatial", "an", ["vec", "none", "unroll"]]]}, "result": [[0.0006845597165775401], 0, 65.76425957679749, 1630455252.955305], "version": 0.2, "tvm_version": "0.8.dev0"}
{"input": ["opencl -keys=mali,opencl,gpu -device=mali -max_num_threads=512 -thread_warp_size=2", "conv2d_nchw_spatial_pack.mali", [["TENSOR", [1, 128, 7, 6], "float32"], ["TENSOR", [15, 128, 1, 1], "float32"], [1, 1], [0, 0, 0, 0], [1, 1], "float32"], {}], "config": {"index": 29312, "code_hash": null, "entity": [["tile_co", "sp", [-1, 1, 15]], ["tile_oh", "sp", [-1, 7, 1]], ["tile_ow", "sp", [-1, 3, 2]], ["reorder_0", "re", [0, 1, 2, 3, 4, 5, 6, 7, 8, 9]], ["ann_reduce", "an", ["none", "none"]], ["ann_spatial", "an", ["unroll", "vec", "unroll"]]]}, "result": [[0.0007079705204081633], 0, 74.5082049369812, 1630455261.7236197], "version": 0.2, "tvm_version": "0.8.dev0"}
{"input": ["opencl -keys=mali,opencl,gpu -device=mali -max_num_threads=512 -thread_warp_size=2", "conv2d_nchw_spatial_pack.mali", [["TENSOR", [1, 128, 7, 6], "float32"], ["TENSOR", [15, 128, 1, 1], "float32"], [1, 1], [0, 0, 0, 0], [1, 1], "float32"], {}], "config": {"index": 37574, "code_hash": null, "entity": [["tile_co", "sp", [-1, 1, 15]], ["tile_oh", "sp", [-1, 7, 1]], ["tile_ow", "sp", [-1, 3, 2]], ["reorder_0", "re", [0, 1, 2, 3, 4, 5, 6, 7, 8, 9]], ["ann_reduce", "an", ["none", "unroll"]], ["ann_spatial", "an", ["vec", "unroll", "unroll"]]]}, "result": [[0.0007832404115044249], 0, 83.45383358001709, 1630455270.683609], "version": 0.2, "tvm_version": "0.8.dev0"}
{"input": ["opencl -keys=mali,opencl,gpu -device=mali -max_num_threads=512 -thread_warp_size=2", "conv2d_nchw_spatial_pack.mali", [["TENSOR", [1, 128, 7, 6], "float32"], ["TENSOR", [15, 128, 1, 1], "float32"], [1, 1], [0, 0, 0, 0], [1, 1], "float32"], {}], "config": {"index": 16190, "code_hash": null, "entity": [["tile_co", "sp", [-1, 1, 15]], ["tile_oh", "sp", [-1, 7, 1]], ["tile_ow", "sp", [-1, 3, 2]], ["reorder_0", "re", [0, 1, 2, 3, 4, 5, 6, 7, 8, 9]], ["ann_reduce", "an", ["none", "unroll"]], ["ann_spatial", "an", ["unroll", "none", "none"]]]}, "result": [[0.0011823257731958764], 0, 92.97474360466003, 1630455280.224594], "version": 0.2, "tvm_version": "0.8.dev0"}
{"input": ["opencl -keys=mali,opencl,gpu -device=mali -max_num_threads=512 -thread_warp_size=2", "conv2d_nchw_spatial_pack.mali", [["TENSOR", [1, 128, 7, 6], "float32"], ["TENSOR", [15, 128, 1, 1], "float32"], [1, 1], [0, 0, 0, 0], [1, 1], "float32"], {}], "config": {"index": 2096, "code_hash": null, "entity": [["tile_co", "sp", [-1, 1, 15]], ["tile_oh", "sp", [-1, 7, 1]], ["tile_ow", "sp", [-1, 3, 2]], ["reorder_0", "re", [0, 1, 2, 3, 4, 5, 6, 7, 8, 9]], ["ann_reduce", "an", ["none", "none"]], ["ann_spatial", "an", ["none", "none", "unroll"]]]}, "result": [[0.0008481292307692307], 0, 101.71045565605164, 1630455288.969217], "version": 0.2, "tvm_version": "0.8.dev0"}
{"input": ["opencl -keys=mali,opencl,gpu -device=mali -max_num_threads=512 -thread_warp_size=2", "conv2d_nchw_spatial_pack.mali", [["TENSOR", [1, 128, 7, 6], "float32"], ["TENSOR", [15, 128, 1, 1], "float32"], [1, 1], [0, 0, 0, 0], [1, 1], "float32"], {}], "config": {"index": 31742, "code_hash": null, "entity": [["tile_co", "sp", [-1, 1, 15]], ["tile_oh", "sp", [-1, 7, 1]], ["tile_ow", "sp", [-1, 3, 2]], ["reorder_0", "re", [0, 1, 2, 3, 4, 5, 6, 7, 8, 9]], ["ann_reduce", "an", ["none", "unroll"]], ["ann_spatial", "an", ["vec", "none", "none"]]]}, "result": [[0.001139732044198895], 0, 110.69867730140686, 1630455297.9802206], "version": 0.2, "tvm_version": "0.8.dev0"}
{"input": ["opencl -keys=mali,opencl,gpu -device=mali -max_num_threads=512 -thread_warp_size=2", "conv2d_nchw_spatial_pack.mali", [["TENSOR", [1, 128, 7, 6], "float32"], ["TENSOR", [15, 128, 1, 1], "float32"], [1, 1], [0, 0, 0, 0], [1, 1], "float32"], {}], "config": {"index": 8414, "code_hash": null, "entity": [["tile_co", "sp", [-1, 1, 15]], ["tile_oh", "sp", [-1, 7, 1]], ["tile_ow", "sp", [-1, 3, 2]], ["reorder_0", "re", [0, 1, 2, 3, 4, 5, 6, 7, 8, 9]], ["ann_reduce", "an", ["none", "unroll"]], ["ann_spatial", "an", ["none", "unroll", "unroll"]]]}, "result": [[0.0007333139866071429], 0, 119.33240079879761, 1630455306.619627], "version": 0.2, "tvm_version": "0.8.dev0"}
{"input": ["opencl -keys=mali,opencl,gpu -device=mali -max_num_threads=512 -thread_warp_size=2", "conv2d_nchw_spatial_pack.mali", [["TENSOR", [1, 128, 7, 6], "float32"], ["TENSOR", [15, 128, 1, 1], "float32"], [1, 1], [0, 0, 0, 0], [1, 1], "float32"], {}], "config": {"index": 638, "code_hash": null, "entity": [["tile_co", "sp", [-1, 1, 15]], ["tile_oh", "sp", [-1, 7, 1]], ["tile_ow", "sp", [-1, 3, 2]], ["reorder_0", "re", [0, 1, 2, 3, 4, 5, 6, 7, 8, 9]], ["ann_reduce", "an", ["none", "unroll"]], ["ann_spatial", "an", ["none", "none", "none"]]]}, "result": [[0.0008418185803278688], 0, 127.73613834381104, 1630455315.04981], "version": 0.2, "tvm_version": "0.8.dev0"}
{"input": ["opencl -keys=mali,opencl,gpu -device=mali -max_num_threads=512 -thread_warp_size=2", "conv2d_nchw_spatial_pack.mali", [["TENSOR", [1, 128, 7, 6], "float32"], ["TENSOR", [15, 128, 1, 1], "float32"], [1, 1], [0, 0, 0, 0], [1, 1], "float32"], {}], "config": {"index": 27854, "code_hash": null, "entity": [["tile_co", "sp", [-1, 1, 15]], ["tile_oh", "sp", [-1, 7, 1]], ["tile_ow", "sp", [-1, 3, 2]], ["reorder_0", "re", [0, 1, 2, 3, 4, 5, 6, 7, 8, 9]], ["ann_reduce", "an", ["none", "unroll"]], ["ann_spatial", "an", ["unroll", "vec", "none"]]]}, "result": [[0.002383860540816327], 0, 136.40478587150574, 1630455323.7218294], "version": 0.2, "tvm_version": "0.8.dev0"}
{"input": ["opencl -keys=mali,opencl,gpu -device=mali -max_num_threads=512 -thread_warp_size=2", "conv2d_nchw_spatial_pack.mali", [["TENSOR", [1, 128, 7, 6], "float32"], ["TENSOR", [15, 128, 1, 1], "float32"], [1, 1], [0, 0, 0, 0], [1, 1], "float32"], {}], "config": {"index": 13760, "code_hash": null, "entity": [["tile_co", "sp", [-1, 1, 15]], ["tile_oh", "sp", [-1, 7, 1]], ["tile_ow", "sp", [-1, 3, 2]], ["reorder_0", "re", [0, 1, 2, 3, 4, 5, 6, 7, 8, 9]], ["ann_reduce", "an", ["none", "none"]], ["ann_spatial", "an", ["none", "vec", "unroll"]]]}, "result": [[0.0008499306752136753], 0, 8.213025093078613, 1630455332.3306634], "version": 0.2, "tvm_version": "0.8.dev0"}
{"input": ["opencl -keys=mali,opencl,gpu -device=mali -max_num_threads=512 -thread_warp_size=2", "conv2d_nchw_spatial_pack.mali", [["TENSOR", [1, 128, 7, 6], "float32"], ["TENSOR", [15, 128, 1, 1], "float32"], [1, 1], [0, 0, 0, 0], [1, 1], "float32"], {}], "config": {"index": 15704, "code_hash": null, "entity": [["tile_co", "sp", [-1, 1, 15]], ["tile_oh", "sp", [-1, 7, 1]], ["tile_ow", "sp", [-1, 3, 2]], ["reorder_0", "re", [0, 1, 2, 3, 4, 5, 6, 7, 8, 9]], ["ann_reduce", "an", ["none", "none"]], ["ann_spatial", "an", ["unroll", "none", "none"]]]}, "result": [[0.000945479674796748], 0, 16.87830877304077, 1630455341.0196226], "version": 0.2, "tvm_version": "0.8.dev0"}
{"input": ["opencl -keys=mali,opencl,gpu -device=mali -max_num_threads=512 -thread_warp_size=2", "conv2d_nchw_spatial_pack.mali", [["TENSOR", [1, 128, 7, 6], "float32"], ["TENSOR", [15, 128, 1, 1], "float32"], [1, 1], [0, 0, 0, 0], [1, 1], "float32"], {}], "config": {"index": 31256, "code_hash": null, "entity": [["tile_co", "sp", [-1, 1, 15]], ["tile_oh", "sp", [-1, 7, 1]], ["tile_ow", "sp", [-1, 3, 2]], ["reorder_0", "re", [0, 1, 2, 3, 4, 5, 6, 7, 8, 9]], ["ann_reduce", "an", ["none", "none"]], ["ann_spatial", "an", ["vec", "none", "none"]]]}, "result": [[0.0006413295964125561], 0, 25.565667867660522, 1630455349.721818], "version": 0.2, "tvm_version": "0.8.dev0"}
{"input": ["opencl -keys=mali,opencl,gpu -device=mali -max_num_threads=512 -thread_warp_size=2", "conv2d_nchw_spatial_pack.mali", [["TENSOR", [1, 128, 7, 6], "float32"], ["TENSOR", [15, 128, 1, 1], "float32"], [1, 1], [0, 0, 0, 0], [1, 1], "float32"], {}], "config": {"index": 29797, "code_hash": null, "entity": [["tile_co", "sp", [-1, 3, 5]], ["tile_oh", "sp", [-1, 7, 1]], ["tile_ow", "sp", [-1, 3, 2]], ["reorder_0", "re", [0, 1, 2, 3, 4, 5, 6, 7, 8, 9]], ["ann_reduce", "an", ["none", "unroll"]], ["ann_spatial", "an", ["unroll", "vec", "unroll"]]]}, "result": [[0.0008051081688741722], 0, 34.370410680770874, 1630455358.5394394], "version": 0.2, "tvm_version": "0.8.dev0"}
{"input": ["opencl -keys=mali,opencl,gpu -device=mali -max_num_threads=512 -thread_warp_size=2", "conv2d_nchw_spatial_pack.mali", [["TENSOR", [1, 128, 7, 6], "float32"], ["TENSOR", [15, 128, 1, 1], "float32"], [1, 1], [0, 0, 0, 0], [1, 1], "float32"], {}], "config": {"index": 18133, "code_hash": null, "entity": [["tile_co", "sp", [-1, 3, 5]], ["tile_oh", "sp", [-1, 7, 1]], ["tile_ow", "sp", [-1, 3, 2]], ["reorder_0", "re", [0, 1, 2, 3, 4, 5, 6, 7, 8, 9]], ["ann_reduce", "an", ["none", "unroll"]], ["ann_spatial", "an", ["unroll", "none", "unroll"]]]}, "result": [[0.001981219298245614], 0, 42.815290212631226, 1630455366.9920213], "version": 0.2, "tvm_version": "0.8.dev0"}
{"input": ["opencl -keys=mali,opencl,gpu -device=mali -max_num_threads=512 -thread_warp_size=2", "conv2d_nchw_spatial_pack.mali", [["TENSOR", [1, 128, 7, 6], "float32"], ["TENSOR", [15, 128, 1, 1], "float32"], [1, 1], [0, 0, 0, 0], [1, 1], "float32"], {}], "config": {"index": 33685, "code_hash": null, "entity": [["tile_co", "sp", [-1, 3, 5]], ["tile_oh", "sp", [-1, 7, 1]], ["tile_ow", "sp", [-1, 3, 2]], ["reorder_0", "re", [0, 1, 2, 3, 4, 5, 6, 7, 8, 9]], ["ann_reduce", "an", ["none", "unroll"]], ["ann_spatial", "an", ["vec", "none", "unroll"]]]}, "result": [[0.0010377193819951338], 0, 52.361690521240234, 1630455376.5518332], "version": 0.2, "tvm_version": "0.8.dev0"}
{"input": ["opencl -keys=mali,opencl,gpu -device=mali -max_num_threads=512 -thread_warp_size=2", "conv2d_nchw_spatial_pack.mali", [["TENSOR", [1, 128, 7, 6], "float32"], ["TENSOR", [15, 128, 1, 1], "float32"], [1, 1], [0, 0, 0, 0], [1, 1], "float32"], {}], "config": {"index": 12302, "code_hash": null, "entity": [["tile_co", "sp", [-1, 1, 15]], ["tile_oh", "sp", [-1, 7, 1]], ["tile_ow", "sp", [-1, 3, 2]], ["reorder_0", "re", [0, 1, 2, 3, 4, 5, 6, 7, 8, 9]], ["ann_reduce", "an", ["none", "unroll"]], ["ann_spatial", "an", ["none", "vec", "none"]]]}, "result": [[0.0007465566750629723], 0, 61.14180374145508, 1630455385.34614], "version": 0.2, "tvm_version": "0.8.dev0"}
{"input": ["opencl -keys=mali,opencl,gpu -device=mali -max_num_threads=512 -thread_warp_size=2", "conv2d_nchw_spatial_pack.mali", [["TENSOR", [1, 128, 7, 6], "float32"], ["TENSOR", [15, 128, 1, 1], "float32"], [1, 1], [0, 0, 0, 0], [1, 1], "float32"], {}], "config": {"index": 152, "code_hash": null, "entity": [["tile_co", "sp", [-1, 1, 15]], ["tile_oh", "sp", [-1, 7, 1]], ["tile_ow", "sp", [-1, 3, 2]], ["reorder_0", "re", [0, 1, 2, 3, 4, 5, 6, 7, 8, 9]], ["ann_reduce", "an", ["none", "none"]], ["ann_spatial", "an", ["none", "none", "none"]]]}, "result": [[0.0008153451686390531], 0, 70.20729637145996, 1630455394.434485], "version": 0.2, "tvm_version": "0.8.dev0"}
{"input": ["opencl -keys=mali,opencl,gpu -device=mali -max_num_threads=512 -thread_warp_size=2", "conv2d_nchw_spatial_pack.mali", [["TENSOR", [1, 128, 7, 6], "float32"], ["TENSOR", [15, 128, 1, 1], "float32"], [1, 1], [0, 0, 0, 0], [1, 1], "float32"], {}], "config": {"index": 34658, "code_hash": null, "entity": [["tile_co", "sp", [-1, 1, 15]], ["tile_oh", "sp", [-1, 7, 1]], ["tile_ow", "sp", [-1, 3, 2]], ["reorder_0", "re", [0, 1, 2, 3, 4, 5, 6, 7, 8, 9]], ["ann_reduce", "an", ["unroll", "unroll"]], ["ann_spatial", "an", ["vec", "none", "unroll"]]]}, "result": [[0.0007897803604651162], 0, 79.08627796173096, 1630455403.3153832], "version": 0.2, "tvm_version": "0.8.dev0"}
{"input": ["opencl -keys=mali,opencl,gpu -device=mali -max_num_threads=512 -thread_warp_size=2", "conv2d_nchw_spatial_pack.mali", [["TENSOR", [1, 128, 7, 6], "float32"], ["TENSOR", [15, 128, 1, 1], "float32"], [1, 1], [0, 0, 0, 0], [1, 1], "float32"], {}], "config": {"index": 14245, "code_hash": null, "entity": [["tile_co", "sp", [-1, 3, 5]], ["tile_oh", "sp", [-1, 7, 1]], ["tile_ow", "sp", [-1, 3, 2]], ["reorder_0", "re", [0, 1, 2, 3, 4, 5, 6, 7, 8, 9]], ["ann_reduce", "an", ["none", "unroll"]], ["ann_spatial", "an", ["none", "vec", "unroll"]]]}, "result": [[0.000981765625], 0, 87.46681904792786, 1630455411.73437], "version": 0.2, "tvm_version": "0.8.dev0"}
{"input": ["opencl -keys=mali,opencl,gpu -device=mali -max_num_threads=512 -thread_warp_size=2", "conv2d_nchw_spatial_pack.mali", [["TENSOR", [1, 128, 7, 6], "float32"], ["TENSOR", [15, 128, 1, 1], "float32"], [1, 1], [0, 0, 0, 0], [1, 1], "float32"], {}], "config": {"index": 23480, "code_hash": null, "entity": [["tile_co", "sp", [-1, 1, 15]], ["tile_oh", "sp", [-1, 7, 1]], ["tile_ow", "sp", [-1, 3, 2]], ["reorder_0", "re", [0, 1, 2, 3, 4, 5, 6, 7, 8, 9]], ["ann_reduce", "an", ["none", "none"]], ["ann_spatial", "an", ["unroll", "unroll", "unroll"]]]}, "result": [[0.0006401972111553786], 0, 96.02308106422424, 1630455420.2769332], "version": 0.2, "tvm_version": "0.8.dev0"}
{"input": ["opencl -keys=mali,opencl,gpu -device=mali -max_num_threads=512 -thread_warp_size=2", "conv2d_nchw_spatial_pack.mali", [["TENSOR", [1, 128, 7, 6], "float32"], ["TENSOR", [15, 128, 1, 1], "float32"], [1, 1], [0, 0, 0, 0], [1, 1], "float32"], {}], "config": {"index": 27368, "code_hash": null, "entity": [["tile_co", "sp", [-1, 1, 15]], ["tile_oh", "sp", [-1, 7, 1]], ["tile_ow", "sp", [-1, 3, 2]], ["reorder_0", "re", [0, 1, 2, 3, 4, 5, 6, 7, 8, 9]], ["ann_reduce", "an", ["none", "none"]], ["ann_spatial", "an", ["unroll", "vec", "none"]]]}, "result": [[0.0008246979156249999], 0, 104.733895778656, 1630455429.023084], "version": 0.2, "tvm_version": "0.8.dev0"}
{"input": ["opencl -keys=mali,opencl,gpu -device=mali -max_num_threads=512 -thread_warp_size=2", "conv2d_nchw_spatial_pack.mali", [["TENSOR", [1, 128, 7, 6], "float32"], ["TENSOR", [15, 128, 1, 1], "float32"], [1, 1], [0, 0, 0, 0], [1, 1], "float32"], {}], "config": {"index": 2581, "code_hash": null, "entity": [["tile_co", "sp", [-1, 3, 5]], ["tile_oh", "sp", [-1, 7, 1]], ["tile_ow", "sp", [-1, 3, 2]], ["reorder_0", "re", [0, 1, 2, 3, 4, 5, 6, 7, 8, 9]], ["ann_reduce", "an", ["none", "unroll"]], ["ann_spatial", "an", ["none", "none", "unroll"]]]}, "result": [[0.0009603529901719902], 0, 113.70224857330322, 1630455437.9913306], "version": 0.2, "tvm_version": "0.8.dev0"}
{"input": ["opencl -keys=mali,opencl,gpu -device=mali -max_num_threads=512 -thread_warp_size=2", "conv2d_nchw_spatial_pack.mali", [["TENSOR", [1, 128, 7, 6], "float32"], ["TENSOR", [15, 128, 1, 1], "float32"], [1, 1], [0, 0, 0, 0], [1, 1], "float32"], {}], "config": {"index": 30770, "code_hash": null, "entity": [["tile_co", "sp", [-1, 1, 15]], ["tile_oh", "sp", [-1, 7, 1]], ["tile_ow", "sp", [-1, 3, 2]], ["reorder_0", "re", [0, 1, 2, 3, 4, 5, 6, 7, 8, 9]], ["ann_reduce", "an", ["unroll", "unroll"]], ["ann_spatial", "an", ["unroll", "vec", "unroll"]]]}, "result": [[0.0015080512166246853], 0, 122.90049314498901, 1630455447.2194781], "version": 0.2, "tvm_version": "0.8.dev0"}
{"input": ["opencl -keys=mali,opencl,gpu -device=mali -max_num_threads=512 -thread_warp_size=2", "conv2d_nchw_spatial_pack.mali", [["TENSOR", [1, 128, 7, 6], "float32"], ["TENSOR", [15, 128, 1, 1], "float32"], [1, 1], [0, 0, 0, 0], [1, 1], "float32"], {}], "config": {"index": 3554, "code_hash": null, "entity": [["tile_co", "sp", [-1, 1, 15]], ["tile_oh", "sp", [-1, 7, 1]], ["tile_ow", "sp", [-1, 3, 2]], ["reorder_0", "re", [0, 1, 2, 3, 4, 5, 6, 7, 8, 9]], ["ann_reduce", "an", ["unroll", "unroll"]], ["ann_spatial", "an", ["none", "none", "unroll"]]]}, "result": [[0.0008477512910216718], 0, 131.80852270126343, 1630455456.1482475], "version": 0.2, "tvm_version": "0.8.dev0"}
