example_04/auto_tvm_log/v9h-model-01-NCHW-opencl-C1000-T21-08-30-23-05.log.tmp
{"input": ["opencl -keys=opencl,gpu -max_num_threads=256 -thread_warp_size=1", "conv2d_nchw.cuda", [["TENSOR", [1, 16, 212, 168], "float32"], ["TENSOR", [15, 16, 1, 1], "float32"], [1, 1], [0, 0, 0, 0], [1, 1], "float32"], {}], "config": {"index": 3930897, "code_hash": null, "entity": [["tile_f", "sp", [-1, 3, 1, 1]], ["tile_y", "sp", [-1, 2, 1, 1]], ["tile_x", "sp", [-1, 1, 12, 1]], ["tile_rc", "sp", [-1, 16]], ["tile_ry", "sp", [-1, 1]], ["tile_rx", "sp", [-1, 1]], ["auto_unroll_max_step", "ot", 0], ["unroll_explicit", "ot", 1]]}, "result": [[0.0763360668], 0, 8.612251043319702, 1630335931.4811869], "version": 0.2, "tvm_version": "0.8.dev0"}
{"input": ["opencl -keys=opencl,gpu -max_num_threads=256 -thread_warp_size=1", "conv2d_nchw.cuda", [["TENSOR", [1, 16, 212, 168], "float32"], ["TENSOR", [15, 16, 1, 1], "float32"], [1, 1], [0, 0, 0, 0], [1, 1], "float32"], {}], "config": {"index": 1608354, "code_hash": null, "entity": [["tile_f", "sp", [-1, 5, 1, 1]], ["tile_y", "sp", [-1, 4, 1, 1]], ["tile_x", "sp", [-1, 1, 2, 14]], ["tile_rc", "sp", [-1, 4]], ["tile_ry", "sp", [-1, 1]], ["tile_rx", "sp", [-1, 1]], ["auto_unroll_max_step", "ot", 512], ["unroll_explicit", "ot", 0]]}, "result": [[0.15490266660000002], 0, 20.854472398757935, 1630335943.7232597], "version": 0.2, "tvm_version": "0.8.dev0"}
{"input": ["opencl -keys=opencl,gpu -max_num_threads=256 -thread_warp_size=1", "conv2d_nchw.cuda", [["TENSOR", [1, 16, 212, 168], "float32"], ["TENSOR", [15, 16, 1, 1], "float32"], [1, 1], [0, 0, 0, 0], [1, 1], "float32"], {}], "config": {"index": 1226337, "code_hash": null, "entity": [["tile_f", "sp", [-1, 3, 1, 1]], ["tile_y", "sp", [-1, 1, 2, 1]], ["tile_x", "sp", [-1, 1, 1, 84]], ["tile_rc", "sp", [-1, 1]], ["tile_ry", "sp", [-1, 1]], ["tile_rx", "sp", [-1, 1]], ["auto_unroll_max_step", "ot", 512], ["unroll_explicit", "ot", 0]]}, "result": [[0.0883424], 0, 48.222917795181274, 1630335971.1467328], "version": 0.2, "tvm_version": "0.8.dev0"}
{"input": ["opencl -keys=opencl,gpu -max_num_threads=256 -thread_warp_size=1", "conv2d_nchw.cuda", [["TENSOR", [1, 16, 212, 168], "float32"], ["TENSOR", [15, 16, 1, 1], "float32"], [1, 1], [0, 0, 0, 0], [1, 1], "float32"], {}], "config": {"index": 5143089, "code_hash": null, "entity": [["tile_f", "sp", [-1, 3, 1, 1]], ["tile_y", "sp", [-1, 53, 1, 1]], ["tile_x", "sp", [-1, 1, 4, 1]], ["tile_rc", "sp", [-1, 1]], ["tile_ry", "sp", [-1, 1]], ["tile_rx", "sp", [-1, 1]], ["auto_unroll_max_step", "ot", 1500], ["unroll_explicit", "ot", 1]]}, "result": [[0.0491736], 0, 59.00601243972778, 1630335981.9196136], "version": 0.2, "tvm_version": "0.8.dev0"}
{"input": ["opencl -keys=opencl,gpu -max_num_threads=256 -thread_warp_size=1", "conv2d_nchw.cuda", [["TENSOR", [1, 16, 212, 168], "float32"], ["TENSOR", [15, 16, 1, 1], "float32"], [1, 1], [0, 0, 0, 0], [1, 1], "float32"], {}], "config": {"index": 3463137, "code_hash": null, "entity": [["tile_f", "sp", [-1, 3, 1, 1]], ["tile_y", "sp", [-1, 1, 2, 1]], ["tile_x", "sp", [-1, 4, 2, 21]], ["tile_rc", "sp", [-1, 2]], ["tile_ry", "sp", [-1, 1]], ["tile_rx", "sp", [-1, 1]], ["auto_unroll_max_step", "ot", 0], ["unroll_explicit", "ot", 1]]}, "result": [[0.1598034666], 0, 69.10455799102783, 1630335992.0384347], "version": 0.2, "tvm_version": "0.8.dev0"}
