example_04/auto_tvm_log/v9h-model-01-NCHW-opencl-C500-T21-09-01-18-30.log.tmp
{"input": ["opencl -keys=mali,opencl,gpu -device=mali -max_num_threads=512 -thread_warp_size=2", "conv2d_nchw_spatial_pack.mali", [["TENSOR", [1, 64, 27, 21], "float32"], ["TENSOR", [4, 64, 1, 1], "float32"], [1, 1], [0, 0, 0, 0], [1, 1], "float32"], {}], "config": {"index": 53801, "code_hash": null, "entity": [["tile_co", "sp", [-1, 1, 4]], ["tile_oh", "sp", [-1, 9, 3]], ["tile_ow", "sp", [-1, 7, 3]], ["reorder_0", "re", [0, 1, 2, 3, 4, 5, 6, 9, 7, 8]], ["ann_reduce", "an", ["none", "unroll"]], ["ann_spatial", "an", ["unroll", "unroll", "unroll"]]]}, "result": [[0.0008766595150214592], 0, 24.003981828689575, 1630492312.1290612], "version": 0.2, "tvm_version": "0.8.dev0"}
{"input": ["opencl -keys=mali,opencl,gpu -device=mali -max_num_threads=512 -thread_warp_size=2", "conv2d_nchw_spatial_pack.mali", [["TENSOR", [1, 64, 27, 21], "float32"], ["TENSOR", [4, 64, 1, 1], "float32"], [1, 1], [0, 0, 0, 0], [1, 1], "float32"], {}], "config": {"index": 52721, "code_hash": null, "entity": [["tile_co", "sp", [-1, 1, 4]], ["tile_oh", "sp", [-1, 9, 3]], ["tile_ow", "sp", [-1, 7, 3]], ["reorder_0", "re", [0, 1, 2, 3, 4, 5, 6, 9, 7, 8]], ["ann_reduce", "an", ["none", "none"]], ["ann_spatial", "an", ["unroll", "unroll", "unroll"]]]}, "result": [[0.000759104577342048], 0, 33.092618227005005, 1630492321.232999], "version": 0.2, "tvm_version": "0.8.dev0"}
{"input": ["opencl -keys=mali,opencl,gpu -device=mali -max_num_threads=512 -thread_warp_size=2", "conv2d_nchw_spatial_pack.mali", [["TENSOR", [1, 64, 27, 21], "float32"], ["TENSOR", [4, 64, 1, 1], "float32"], [1, 1], [0, 0, 0, 0], [1, 1], "float32"], {}], "config": {"index": 55961, "code_hash": null, "entity": [["tile_co", "sp", [-1, 1, 4]], ["tile_oh", "sp", [-1, 9, 3]], ["tile_ow", "sp", [-1, 7, 3]], ["reorder_0", "re", [0, 1, 2, 3, 4, 5, 6, 9, 7, 8]], ["ann_reduce", "an", ["unroll", "unroll"]], ["ann_spatial", "an", ["unroll", "unroll", "unroll"]]]}, "result": [[0.0009785], 0, 42.82220697402954, 1630492330.976256], "version": 0.2, "tvm_version": "0.8.dev0"}
{"input": ["opencl -keys=mali,opencl,gpu -device=mali -max_num_threads=512 -thread_warp_size=2", "conv2d_nchw_spatial_pack.mali", [["TENSOR", [1, 64, 27, 21], "float32"], ["TENSOR", [4, 64, 1, 1], "float32"], [1, 1], [0, 0, 0, 0], [1, 1], "float32"], {}], "config": {"index": 54881, "code_hash": null, "entity": [["tile_co", "sp", [-1, 1, 4]], ["tile_oh", "sp", [-1, 9, 3]], ["tile_ow", "sp", [-1, 7, 3]], ["reorder_0", "re", [0, 1, 2, 3, 4, 5, 6, 9, 7, 8]], ["ann_reduce", "an", ["unroll", "none"]], ["ann_spatial", "an", ["unroll", "unroll", "unroll"]]]}, "result": [[0.0012666532586206897], 0, 51.348607540130615, 1630492339.5236247], "version": 0.2, "tvm_version": "0.8.dev0"}
{"input": ["opencl -keys=mali,opencl,gpu -device=mali -max_num_threads=512 -thread_warp_size=2", "conv2d_nchw_spatial_pack.mali", [["TENSOR", [1, 64, 27, 21], "float32"], ["TENSOR", [4, 64, 1, 1], "float32"], [1, 1], [0, 0, 0, 0], [1, 1], "float32"], {}], "config": {"index": 53794, "code_hash": null, "entity": [["tile_co", "sp", [-1, 2, 2]], ["tile_oh", "sp", [-1, 3, 3]], ["tile_ow", "sp", [-1, 7, 3]], ["reorder_0", "re", [0, 1, 2, 3, 4, 5, 6, 9, 7, 8]], ["ann_reduce", "an", ["none", "unroll"]], ["ann_spatial", "an", ["unroll", "unroll", "unroll"]]]}, "result": [[0.0012431691492537313], 0, 59.93376421928406, 1630492348.1283317], "version": 0.2, "tvm_version": "0.8.dev0"}
{"input": ["opencl -keys=mali,opencl,gpu -device=mali -max_num_threads=512 -thread_warp_size=2", "conv2d_nchw_spatial_pack.mali", [["TENSOR", [1, 64, 27, 21], "float32"], ["TENSOR", [4, 64, 1, 1], "float32"], [1, 1], [0, 0, 0, 0], [1, 1], "float32"], {}], "config": {"index": 52714, "code_hash": null, "entity": [["tile_co", "sp", [-1, 2, 2]], ["tile_oh", "sp", [-1, 3, 3]], ["tile_ow", "sp", [-1, 7, 3]], ["reorder_0", "re", [0, 1, 2, 3, 4, 5, 6, 9, 7, 8]], ["ann_reduce", "an", ["none", "none"]], ["ann_spatial", "an", ["unroll", "unroll", "unroll"]]]}, "result": [[0.0018308594457831326], 0, 68.24262976646423, 1630492356.44885], "version": 0.2, "tvm_version": "0.8.dev0"}
{"input": ["opencl -keys=mali,opencl,gpu -device=mali -max_num_threads=512 -thread_warp_size=2", "conv2d_nchw_spatial_pack.mali", [["TENSOR", [1, 64, 27, 21], "float32"], ["TENSOR", [4, 64, 1, 1], "float32"], [1, 1], [0, 0, 0, 0], [1, 1], "float32"], {}], "config": {"index": 86297, "code_hash": null, "entity": [["tile_co", "sp", [-1, 1, 4]], ["tile_oh", "sp", [-1, 9, 1]], ["tile_ow", "sp", [-1, 3, 7]], ["reorder_0", "re", [0, 1, 2, 3, 4, 5, 6, 9, 7, 8]], ["ann_reduce", "an", ["unroll", "unroll"]], ["ann_spatial", "an", ["vec", "unroll", "unroll"]]]}, "result": [[0.0005798448730769231], 0, 77.05299973487854, 1630492365.2873545], "version": 0.2, "tvm_version": "0.8.dev0"}
{"input": ["opencl -keys=mali,opencl,gpu -device=mali -max_num_threads=512 -thread_warp_size=2", "conv2d_nchw_spatial_pack.mali", [["TENSOR", [1, 64, 27, 21], "float32"], ["TENSOR", [4, 64, 1, 1], "float32"], [1, 1], [0, 0, 0, 0], [1, 1], "float32"], {}], "config": {"index": 84137, "code_hash": null, "entity": [["tile_co", "sp", [-1, 1, 4]], ["tile_oh", "sp", [-1, 9, 1]], ["tile_ow", "sp", [-1, 3, 7]], ["reorder_0", "re", [0, 1, 2, 3, 4, 5, 6, 9, 7, 8]], ["ann_reduce", "an", ["none", "unroll"]], ["ann_spatial", "an", ["vec", "unroll", "unroll"]]]}, "result": [[0.0011006687116564416], 0, 85.49489736557007, 1630492373.737708], "version": 0.2, "tvm_version": "0.8.dev0"}
{"input": ["opencl -keys=mali,opencl,gpu -device=mali -max_num_threads=512 -thread_warp_size=2", "conv2d_nchw_spatial_pack.mali", [["TENSOR", [1, 64, 27, 21], "float32"], ["TENSOR", [4, 64, 1, 1], "float32"], [1, 1], [0, 0, 0, 0], [1, 1], "float32"], {}], "config": {"index": 85217, "code_hash": null, "entity": [["tile_co", "sp", [-1, 1, 4]], ["tile_oh", "sp", [-1, 9, 1]], ["tile_ow", "sp", [-1, 3, 7]], ["reorder_0", "re", [0, 1, 2, 3, 4, 5, 6, 9, 7, 8]], ["ann_reduce", "an", ["unroll", "none"]], ["ann_spatial", "an", ["vec", "unroll", "unroll"]]]}, "result": [[0.0007828373023809524], 0, 94.98259115219116, 1630492383.2405071], "version": 0.2, "tvm_version": "0.8.dev0"}
{"input": ["opencl -keys=mali,opencl,gpu -device=mali -max_num_threads=512 -thread_warp_size=2", "conv2d_nchw_spatial_pack.mali", [["TENSOR", [1, 64, 27, 21], "float32"], ["TENSOR", [4, 64, 1, 1], "float32"], [1, 1], [0, 0, 0, 0], [1, 1], "float32"], {}], "config": {"index": 83057, "code_hash": null, "entity": [["tile_co", "sp", [-1, 1, 4]], ["tile_oh", "sp", [-1, 9, 1]], ["tile_ow", "sp", [-1, 3, 7]], ["reorder_0", "re", [0, 1, 2, 3, 4, 5, 6, 9, 7, 8]], ["ann_reduce", "an", ["none", "none"]], ["ann_spatial", "an", ["vec", "unroll", "unroll"]]]}, "result": [[0.0009090047619047618], 0, 104.05774807929993, 1630492392.3316677], "version": 0.2, "tvm_version": "0.8.dev0"}
{"input": ["opencl -keys=mali,opencl,gpu -device=mali -max_num_threads=512 -thread_warp_size=2", "conv2d_nchw_spatial_pack.mali", [["TENSOR", [1, 64, 27, 21], "float32"], ["TENSOR", [4, 64, 1, 1], "float32"], [1, 1], [0, 0, 0, 0], [1, 1], "float32"], {}], "config": {"index": 40192, "code_hash": null, "entity": [["tile_co", "sp", [-1, 2, 2]], ["tile_oh", "sp", [-1, 3, 9]], ["tile_ow", "sp", [-1, 21, 1]], ["reorder_0", "re", [0, 1, 2, 3, 4, 5, 6, 7, 8, 9]], ["ann_reduce", "an", ["none", "unroll"]], ["ann_spatial", "an", ["unroll", "none", "unroll"]]]}, "result": [[0.000919734362030905], 0, 113.00662207603455, 1630492401.2978587], "version": 0.2, "tvm_version": "0.8.dev0"}
{"input": ["opencl -keys=mali,opencl,gpu -device=mali -max_num_threads=512 -thread_warp_size=2", "conv2d_nchw_spatial_pack.mali", [["TENSOR", [1, 64, 27, 21], "float32"], ["TENSOR", [4, 64, 1, 1], "float32"], [1, 1], [0, 0, 0, 0], [1, 1], "float32"], {}], "config": {"index": 56057, "code_hash": null, "entity": [["tile_co", "sp", [-1, 1, 4]], ["tile_oh", "sp", [-1, 9, 1]], ["tile_ow", "sp", [-1, 3, 7]], ["reorder_0", "re", [0, 1, 2, 3, 4, 5, 6, 9, 7, 8]], ["ann_reduce", "an", ["unroll", "unroll"]], ["ann_spatial", "an", ["unroll", "unroll", "unroll"]]]}, "result": [[0.0008260300371024735], 0, 122.05291366577148, 1630492410.3601656], "version": 0.2, "tvm_version": "0.8.dev0"}
{"input": ["opencl -keys=mali,opencl,gpu -device=mali -max_num_threads=512 -thread_warp_size=2", "conv2d_nchw_spatial_pack.mali", [["TENSOR", [1, 64, 27, 21], "float32"], ["TENSOR", [4, 64, 1, 1], "float32"], [1, 1], [0, 0, 0, 0], [1, 1], "float32"], {}], "config": {"index": 53897, "code_hash": null, "entity": [["tile_co", "sp", [-1, 1, 4]], ["tile_oh", "sp", [-1, 9, 1]], ["tile_ow", "sp", [-1, 3, 7]], ["reorder_0", "re", [0, 1, 2, 3, 4, 5, 6, 9, 7, 8]], ["ann_reduce", "an", ["none", "unroll"]], ["ann_spatial", "an", ["unroll", "unroll", "unroll"]]]}, "result": [[0.0007989294523809524], 0, 130.64193558692932, 1630492418.9595046], "version": 0.2, "tvm_version": "0.8.dev0"}
{"input": ["opencl -keys=mali,opencl,gpu -device=mali -max_num_threads=512 -thread_warp_size=2", "conv2d_nchw_spatial_pack.mali", [["TENSOR", [1, 64, 27, 21], "float32"], ["TENSOR", [4, 64, 1, 1], "float32"], [1, 1], [0, 0, 0, 0], [1, 1], "float32"], {}], "config": {"index": 54977, "code_hash": null, "entity": [["tile_co", "sp", [-1, 1, 4]], ["tile_oh", "sp", [-1, 9, 1]], ["tile_ow", "sp", [-1, 3, 7]], ["reorder_0", "re", [0, 1, 2, 3, 4, 5, 6, 9, 7, 8]], ["ann_reduce", "an", ["unroll", "none"]], ["ann_spatial", "an", ["unroll", "unroll", "unroll"]]]}, "result": [[0.000609544776119403], 0, 8.516331434249878, 1630492427.896692], "version": 0.2, "tvm_version": "0.8.dev0"}
{"input": ["opencl -keys=mali,opencl,gpu -device=mali -max_num_threads=512 -thread_warp_size=2", "conv2d_nchw_spatial_pack.mali", [["TENSOR", [1, 64, 27, 21], "float32"], ["TENSOR", [4, 64, 1, 1], "float32"], [1, 1], [0, 0, 0, 0], [1, 1], "float32"], {}], "config": {"index": 52817, "code_hash": null, "entity": [["tile_co", "sp", [-1, 1, 4]], ["tile_oh", "sp", [-1, 9, 1]], ["tile_ow", "sp", [-1, 3, 7]], ["reorder_0", "re", [0, 1, 2, 3, 4, 5, 6, 9, 7, 8]], ["ann_reduce", "an", ["none", "none"]], ["ann_spatial", "an", ["unroll", "unroll", "unroll"]]]}, "result": [[0.0009511380572207083], 0, 18.948105812072754, 1630492438.3383646], "version": 0.2, "tvm_version": "0.8.dev0"}
{"input": ["opencl -keys=mali,opencl,gpu -device=mali -max_num_threads=512 -thread_warp_size=2", "conv2d_nchw_spatial_pack.mali", [["TENSOR", [1, 64, 27, 21], "float32"], ["TENSOR", [4, 64, 1, 1], "float32"], [1, 1], [0, 0, 0, 0], [1, 1], "float32"], {}], "config": {"index": 55954, "code_hash": null, "entity": [["tile_co", "sp", [-1, 2, 2]], ["tile_oh", "sp", [-1, 3, 3]], ["tile_ow", "sp", [-1, 7, 3]], ["reorder_0", "re", [0, 1, 2, 3, 4, 5, 6, 9, 7, 8]], ["ann_reduce", "an", ["unroll", "unroll"]], ["ann_spatial", "an", ["unroll", "unroll", "unroll"]]]}, "result": [[0.0007757083341836734], 0, 27.192410945892334, 1630492446.597615], "version": 0.2, "tvm_version": "0.8.dev0"}
{"input": ["opencl -keys=mali,opencl,gpu -device=mali -max_num_threads=512 -thread_warp_size=2", "conv2d_nchw_spatial_pack.mali", [["TENSOR", [1, 64, 27, 21], "float32"], ["TENSOR", [4, 64, 1, 1], "float32"], [1, 1], [0, 0, 0, 0], [1, 1], "float32"], {}], "config": {"index": 54874, "code_hash": null, "entity": [["tile_co", "sp", [-1, 2, 2]], ["tile_oh", "sp", [-1, 3, 3]], ["tile_ow", "sp", [-1, 7, 3]], ["reorder_0", "re", [0, 1, 2, 3, 4, 5, 6, 9, 7, 8]], ["ann_reduce", "an", ["unroll", "none"]], ["ann_spatial", "an", ["unroll", "unroll", "unroll"]]]}, "result": [[0.0014549253731343283], 0, 35.82001447677612, 1630492455.226208], "version": 0.2, "tvm_version": "0.8.dev0"}
{"input": ["opencl -keys=mali,opencl,gpu -device=mali -max_num_threads=512 -thread_warp_size=2", "conv2d_nchw_spatial_pack.mali", [["TENSOR", [1, 64, 27, 21], "float32"], ["TENSOR", [4, 64, 1, 1], "float32"], [1, 1], [0, 0, 0, 0], [1, 1], "float32"], {}], "config": {"index": 53799, "code_hash": null, "entity": [["tile_co", "sp", [-1, 1, 2]], ["tile_oh", "sp", [-1, 9, 3]], ["tile_ow", "sp", [-1, 7, 3]], ["reorder_0", "re", [0, 1, 2, 3, 4, 5, 6, 9, 7, 8]], ["ann_reduce", "an", ["none", "unroll"]], ["ann_spatial", "an", ["unroll", "unroll", "unroll"]]]}, "result": [[0.0005354966292134831], 0, 44.401206254959106, 1630492463.835728], "version": 0.2, "tvm_version": "0.8.dev0"}
{"input": ["opencl -keys=mali,opencl,gpu -device=mali -max_num_threads=512 -thread_warp_size=2", "conv2d_nchw_spatial_pack.mali", [["TENSOR", [1, 64, 27, 21], "float32"], ["TENSOR", [4, 64, 1, 1], "float32"], [1, 1], [0, 0, 0, 0], [1, 1], "float32"], {}], "config": {"index": 52719, "code_hash": null, "entity": [["tile_co", "sp", [-1, 1, 2]], ["tile_oh", "sp", [-1, 9, 3]], ["tile_ow", "sp", [-1, 7, 3]], ["reorder_0", "re", [0, 1, 2, 3, 4, 5, 6, 9, 7, 8]], ["ann_reduce", "an", ["none", "none"]], ["ann_spatial", "an", ["unroll", "unroll", "unroll"]]]}, "result": [[0.000592010853488372], 0, 52.65826392173767, 1630492472.096936], "version": 0.2, "tvm_version": "0.8.dev0"}
{"input": ["opencl -keys=mali,opencl,gpu -device=mali -max_num_threads=512 -thread_warp_size=2", "conv2d_nchw_spatial_pack.mali", [["TENSOR", [1, 64, 27, 21], "float32"], ["TENSOR", [4, 64, 1, 1], "float32"], [1, 1], [0, 0, 0, 0], [1, 1], "float32"], {}], "config": {"index": 53139, "code_hash": null, "entity": [["tile_co", "sp", [-1, 1, 2]], ["tile_oh", "sp", [-1, 9, 3]], ["tile_ow", "sp", [-1, 21, 1]], ["reorder_0", "re", [0, 1, 2, 3, 4, 5, 6, 7, 8, 9]], ["ann_reduce", "an", ["none", "unroll"]], ["ann_spatial", "an", ["unroll", "unroll", "unroll"]]]}, "result": [[0.0006448322580645161], 0, 60.88295912742615, 1630492480.349059], "version": 0.2, "tvm_version": "0.8.dev0"}
{"input": ["opencl -keys=mali,opencl,gpu -device=mali -max_num_threads=512 -thread_warp_size=2", "conv2d_nchw_spatial_pack.mali", [["TENSOR", [1, 64, 27, 21], "float32"], ["TENSOR", [4, 64, 1, 1], "float32"], [1, 1], [0, 0, 0, 0], [1, 1], "float32"], {}], "config": {"index": 39112, "code_hash": null, "entity": [["tile_co", "sp", [-1, 2, 2]], ["tile_oh", "sp", [-1, 3, 9]], ["tile_ow", "sp", [-1, 21, 1]], ["reorder_0", "re", [0, 1, 2, 3, 4, 5, 6, 7, 8, 9]], ["ann_reduce", "an", ["none", "none"]], ["ann_spatial", "an", ["unroll", "none", "unroll"]]]}, "result": [[0.0009953541651785713], 0, 69.89742970466614, 1630492489.3668642], "version": 0.2, "tvm_version": "0.8.dev0"}
{"input": ["opencl -keys=mali,opencl,gpu -device=mali -max_num_threads=512 -thread_warp_size=2", "conv2d_nchw_spatial_pack.mali", [["TENSOR", [1, 64, 27, 21], "float32"], ["TENSOR", [4, 64, 1, 1], "float32"], [1, 1], [0, 0, 0, 0], [1, 1], "float32"], {}], "config": {"index": 40191, "code_hash": null, "entity": [["tile_co", "sp", [-1, 1, 2]], ["tile_oh", "sp", [-1, 3, 9]], ["tile_ow", "sp", [-1, 21, 1]], ["reorder_0", "re", [0, 1, 2, 3, 4, 5, 6, 7, 8, 9]], ["ann_reduce", "an", ["none", "unroll"]], ["ann_spatial", "an", ["unroll", "none", "unroll"]]]}, "result": [[0.000542753870415648], 0, 78.70260715484619, 1630492498.191314], "version": 0.2, "tvm_version": "0.8.dev0"}
{"input": ["opencl -keys=mali,opencl,gpu -device=mali -max_num_threads=512 -thread_warp_size=2", "conv2d_nchw_spatial_pack.mali", [["TENSOR", [1, 64, 27, 21], "float32"], ["TENSOR", [4, 64, 1, 1], "float32"], [1, 1], [0, 0, 0, 0], [1, 1], "float32"], {}], "config": {"index": 53254, "code_hash": null, "entity": [["tile_co", "sp", [-1, 2, 2]], ["tile_oh", "sp", [-1, 3, 3]], ["tile_ow", "sp", [-1, 7, 3]], ["reorder_0", "re", [0, 1, 2, 3, 4, 5, 6, 7, 8, 9]], ["ann_reduce", "an", ["none", "unroll"]], ["ann_spatial", "an", ["unroll", "unroll", "unroll"]]]}, "result": [[0.0008400269445727484], 0, 87.6278007030487, 1630492507.1006718], "version": 0.2, "tvm_version": "0.8.dev0"}
{"input": ["opencl -keys=mali,opencl,gpu -device=mali -max_num_threads=512 -thread_warp_size=2", "conv2d_nchw_spatial_pack.mali", [["TENSOR", [1, 64, 27, 21], "float32"], ["TENSOR", [4, 64, 1, 1], "float32"], [1, 1], [0, 0, 0, 0], [1, 1], "float32"], {}], "config": {"index": 52059, "code_hash": null, "entity": [["tile_co", "sp", [-1, 1, 2]], ["tile_oh", "sp", [-1, 9, 3]], ["tile_ow", "sp", [-1, 21, 1]], ["reorder_0", "re", [0, 1, 2, 3, 4, 5, 6, 7, 8, 9]], ["ann_reduce", "an", ["none", "none"]], ["ann_spatial", "an", ["unroll", "unroll", "unroll"]]]}, "result": [[0.0006495496830188678], 0, 96.05915331840515, 1630492515.5581145], "version": 0.2, "tvm_version": "0.8.dev0"}
{"input": ["opencl -keys=mali,opencl,gpu -device=mali -max_num_threads=512 -thread_warp_size=2", "conv2d_nchw_spatial_pack.mali", [["TENSOR", [1, 64, 27, 21], "float32"], ["TENSOR", [4, 64, 1, 1], "float32"], [1, 1], [0, 0, 0, 0], [1, 1], "float32"], {}], "config": {"index": 53152, "code_hash": null, "entity": [["tile_co", "sp", [-1, 2, 2]], ["tile_oh", "sp", [-1, 3, 9]], ["tile_ow", "sp", [-1, 21, 1]], ["reorder_0", "re", [0, 1, 2, 3, 4, 5, 6, 7, 8, 9]], ["ann_reduce", "an", ["none", "unroll"]], ["ann_spatial", "an", ["unroll", "unroll", "unroll"]]]}, "result": [[0.0011306622815789472], 0, 105.07161593437195, 1630492524.6018078], "version": 0.2, "tvm_version": "0.8.dev0"}
{"input": ["opencl -keys=mali,opencl,gpu -device=mali -max_num_threads=512 -thread_warp_size=2", "conv2d_nchw_spatial_pack.mali", [["TENSOR", [1, 64, 27, 21], "float32"], ["TENSOR", [4, 64, 1, 1], "float32"], [1, 1], [0, 0, 0, 0], [1, 1], "float32"], {}], "config": {"index": 52174, "code_hash": null, "entity": [["tile_co", "sp", [-1, 2, 2]], ["tile_oh", "sp", [-1, 3, 3]], ["tile_ow", "sp", [-1, 7, 3]], ["reorder_0", "re", [0, 1, 2, 3, 4, 5, 6, 7, 8, 9]], ["ann_reduce", "an", ["none", "none"]], ["ann_spatial", "an", ["unroll", "unroll", "unroll"]]]}, "result": [[0.000763355], 0, 114.15580725669861, 1630492533.707964], "version": 0.2, "tvm_version": "0.8.dev0"}
{"input": ["opencl -keys=mali,opencl,gpu -device=mali -max_num_threads=512 -thread_warp_size=2", "conv2d_nchw_spatial_pack.mali", [["TENSOR", [1, 64, 27, 21], "float32"], ["TENSOR", [4, 64, 1, 1], "float32"], [1, 1], [0, 0, 0, 0], [1, 1], "float32"], {}], "config": {"index": 42352, "code_hash": null, "entity": [["tile_co", "sp", [-1, 2, 2]], ["tile_oh", "sp", [-1, 3, 9]], ["tile_ow", "sp", [-1, 21, 1]], ["reorder_0", "re", [0, 1, 2, 3, 4, 5, 6, 7, 8, 9]], ["ann_reduce", "an", ["unroll", "unroll"]], ["ann_spatial", "an", ["unroll", "none", "unroll"]]]}, "result": [[0.000859016981233244], 0, 123.4384593963623, 1630492543.0082254], "version": 0.2, "tvm_version": "0.8.dev0"}
{"input": ["opencl -keys=mali,opencl,gpu -device=mali -max_num_threads=512 -thread_warp_size=2", "conv2d_nchw_spatial_pack.mali", [["TENSOR", [1, 64, 27, 21], "float32"], ["TENSOR", [4, 64, 1, 1], "float32"], [1, 1], [0, 0, 0, 0], [1, 1], "float32"], {}], "config": {"index": 19132, "code_hash": null, "entity": [["tile_co", "sp", [-1, 2, 2]], ["tile_oh", "sp", [-1, 3, 9]], ["tile_ow", "sp", [-1, 21, 1]], ["reorder_0", "re", [0, 1, 2, 3, 4, 5, 6, 9, 7, 8]], ["ann_reduce", "an", ["none", "unroll"]], ["ann_spatial", "an", ["none", "unroll", "unroll"]]]}, "result": [[0.0006614717923076923], 0, 131.9754776954651, 1630492551.5619736], "version": 0.2, "tvm_version": "0.8.dev0"}
{"input": ["opencl -keys=mali,opencl,gpu -device=mali -max_num_threads=512 -thread_warp_size=2", "conv2d_nchw_spatial_pack.mali", [["TENSOR", [1, 64, 27, 21], "float32"], ["TENSOR", [4, 64, 1, 1], "float32"], [1, 1], [0, 0, 0, 0], [1, 1], "float32"], {}], "config": {"index": 39111, "code_hash": null, "entity": [["tile_co", "sp", [-1, 1, 2]], ["tile_oh", "sp", [-1, 3, 9]], ["tile_ow", "sp", [-1, 21, 1]], ["reorder_0", "re", [0, 1, 2, 3, 4, 5, 6, 7, 8, 9]], ["ann_reduce", "an", ["none", "none"]], ["ann_spatial", "an", ["unroll", "none", "unroll"]]]}, "result": [[0.001132292817679558], 0, 17.184569835662842, 1630492569.1606257], "version": 0.2, "tvm_version": "0.8.dev0"}
{"input": ["opencl -keys=mali,opencl,gpu -device=mali -max_num_threads=512 -thread_warp_size=2", "conv2d_nchw_spatial_pack.mali", [["TENSOR", [1, 64, 27, 21], "float32"], ["TENSOR", [4, 64, 1, 1], "float32"], [1, 1], [0, 0, 0, 0], [1, 1], "float32"], {}], "config": {"index": 66099, "code_hash": null, "entity": [["tile_co", "sp", [-1, 1, 2]], ["tile_oh", "sp", [-1, 9, 3]], ["tile_ow", "sp", [-1, 21, 1]], ["reorder_0", "re", [0, 1, 2, 3, 4, 5, 6, 7, 8, 9]], ["ann_reduce", "an", ["none", "unroll"]], ["ann_spatial", "an", ["unroll", "vec", "unroll"]]]}, "result": [[0.001547324924369748], 0, 25.73527956008911, 1630492577.7417507], "version": 0.2, "tvm_version": "0.8.dev0"}
{"input": ["opencl -keys=mali,opencl,gpu -device=mali -max_num_threads=512 -thread_warp_size=2", "conv2d_nchw_spatial_pack.mali", [["TENSOR", [1, 64, 27, 21], "float32"], ["TENSOR", [4, 64, 1, 1], "float32"], [1, 1], [0, 0, 0, 0], [1, 1], "float32"], {}], "config": {"index": 42346, "code_hash": null, "entity": [["tile_co", "sp", [-1, 2, 2]], ["tile_oh", "sp", [-1, 1, 9]], ["tile_ow", "sp", [-1, 21, 1]], ["reorder_0", "re", [0, 1, 2, 3, 4, 5, 6, 7, 8, 9]], ["ann_reduce", "an", ["unroll", "unroll"]], ["ann_spatial", "an", ["unroll", "none", "unroll"]]]}, "result": [[0.0006651242544802868], 0, 34.321513652801514, 1630492586.3304923], "version": 0.2, "tvm_version": "0.8.dev0"}
{"input": ["opencl -keys=mali,opencl,gpu -device=mali -max_num_threads=512 -thread_warp_size=2", "conv2d_nchw_spatial_pack.mali", [["TENSOR", [1, 64, 27, 21], "float32"], ["TENSOR", [4, 64, 1, 1], "float32"], [1, 1], [0, 0, 0, 0], [1, 1], "float32"], {}], "config": {"index": 40186, "code_hash": null, "entity": [["tile_co", "sp", [-1, 2, 2]], ["tile_oh", "sp", [-1, 1, 9]], ["tile_ow", "sp", [-1, 21, 1]], ["reorder_0", "re", [0, 1, 2, 3, 4, 5, 6, 7, 8, 9]], ["ann_reduce", "an", ["none", "unroll"]], ["ann_spatial", "an", ["unroll", "none", "unroll"]]]}, "result": [[0.0009161545177570094], 0, 43.81523847579956, 1630492595.8439329], "version": 0.2, "tvm_version": "0.8.dev0"}
{"input": ["opencl -keys=mali,opencl,gpu -device=mali -max_num_threads=512 -thread_warp_size=2", "conv2d_nchw_spatial_pack.mali", [["TENSOR", [1, 64, 27, 21], "float32"], ["TENSOR", [4, 64, 1, 1], "float32"], [1, 1], [0, 0, 0, 0], [1, 1], "float32"], {}], "config": {"index": 55959, "code_hash": null, "entity": [["tile_co", "sp", [-1, 1, 2]], ["tile_oh", "sp", [-1, 9, 3]], ["tile_ow", "sp", [-1, 7, 3]], ["reorder_0", "re", [0, 1, 2, 3, 4, 5, 6, 9, 7, 8]], ["ann_reduce", "an", ["unroll", "unroll"]], ["ann_spatial", "an", ["unroll", "unroll", "unroll"]]]}, "result": [[0.0011277787886363637], 0, 53.093708992004395, 1630492605.1401467], "version": 0.2, "tvm_version": "0.8.dev0"}
{"input": ["opencl -keys=mali,opencl,gpu -device=mali -max_num_threads=512 -thread_warp_size=2", "conv2d_nchw_spatial_pack.mali", [["TENSOR", [1, 64, 27, 21], "float32"], ["TENSOR", [4, 64, 1, 1], "float32"], [1, 1], [0, 0, 0, 0], [1, 1], "float32"], {}], "config": {"index": 54879, "code_hash": null, "entity": [["tile_co", "sp", [-1, 1, 2]], ["tile_oh", "sp", [-1, 9, 3]], ["tile_ow", "sp", [-1, 7, 3]], ["reorder_0", "re", [0, 1, 2, 3, 4, 5, 6, 9, 7, 8]], ["ann_reduce", "an", ["unroll", "none"]], ["ann_spatial", "an", ["unroll", "unroll", "unroll"]]]}, "result": [[0.0009350651654135339], 0, 62.14055895805359, 1630492614.1825778], "version": 0.2, "tvm_version": "0.8.dev0"}
{"input": ["opencl -keys=mali,opencl,gpu -device=mali -max_num_threads=512 -thread_warp_size=2", "conv2d_nchw_spatial_pack.mali", [["TENSOR", [1, 64, 27, 21], "float32"], ["TENSOR", [4, 64, 1, 1], "float32"], [1, 1], [0, 0, 0, 0], [1, 1], "float32"], {}], "config": {"index": 55299, "code_hash": null, "entity": [["tile_co", "sp", [-1, 1, 2]], ["tile_oh", "sp", [-1, 9, 3]], ["tile_ow", "sp", [-1, 21, 1]], ["reorder_0", "re", [0, 1, 2, 3, 4, 5, 6, 7, 8, 9]], ["ann_reduce", "an", ["unroll", "unroll"]], ["ann_spatial", "an", ["unroll", "unroll", "unroll"]]]}, "result": [[0.0007118210268456377], 0, 70.42659163475037, 1630492622.4964612], "version": 0.2, "tvm_version": "0.8.dev0"}
{"input": ["opencl -keys=mali,opencl,gpu -device=mali -max_num_threads=512 -thread_warp_size=2", "conv2d_nchw_spatial_pack.mali", [["TENSOR", [1, 64, 27, 21], "float32"], ["TENSOR", [4, 64, 1, 1], "float32"], [1, 1], [0, 0, 0, 0], [1, 1], "float32"], {}], "config": {"index": 53019, "code_hash": null, "entity": [["tile_co", "sp", [-1, 1, 2]], ["tile_oh", "sp", [-1, 9, 3]], ["tile_ow", "sp", [-1, 3, 1]], ["reorder_0", "re", [0, 1, 2, 3, 4, 5, 6, 7, 8, 9]], ["ann_reduce", "an", ["none", "unroll"]], ["ann_spatial", "an", ["unroll", "unroll", "unroll"]]]}, "result": [[0.0007836779849056604], 0, 78.96428847312927, 1630492631.0266883], "version": 0.2, "tvm_version": "0.8.dev0"}
{"input": ["opencl -keys=mali,opencl,gpu -device=mali -max_num_threads=512 -thread_warp_size=2", "conv2d_nchw_spatial_pack.mali", [["TENSOR", [1, 64, 27, 21], "float32"], ["TENSOR", [4, 64, 1, 1], "float32"], [1, 1], [0, 0, 0, 0], [1, 1], "float32"], {}], "config": {"index": 53074, "code_hash": null, "entity": [["tile_co", "sp", [-1, 2, 2]], ["tile_oh", "sp", [-1, 3, 3]], ["tile_ow", "sp", [-1, 7, 1]], ["reorder_0", "re", [0, 1, 2, 3, 4, 5, 6, 7, 8, 9]], ["ann_reduce", "an", ["none", "unroll"]], ["ann_spatial", "an", ["unroll", "unroll", "unroll"]]]}, "result": [[0.0007173498349834983], 0, 87.1806411743164, 1630492639.2853158], "version": 0.2, "tvm_version": "0.8.dev0"}
{"input": ["opencl -keys=mali,opencl,gpu -device=mali -max_num_threads=512 -thread_warp_size=2", "conv2d_nchw_spatial_pack.mali", [["TENSOR", [1, 64, 27, 21], "float32"], ["TENSOR", [4, 64, 1, 1], "float32"], [1, 1], [0, 0, 0, 0], [1, 1], "float32"], {}], "config": {"index": 51939, "code_hash": null, "entity": [["tile_co", "sp", [-1, 1, 2]], ["tile_oh", "sp", [-1, 9, 3]], ["tile_ow", "sp", [-1, 3, 1]], ["reorder_0", "re", [0, 1, 2, 3, 4, 5, 6, 7, 8, 9]], ["ann_reduce", "an", ["none", "none"]], ["ann_spatial", "an", ["unroll", "unroll", "unroll"]]]}, "result": [[0.0009123079543147208], 0, 96.07654094696045, 1630492648.1986518], "version": 0.2, "tvm_version": "0.8.dev0"}
{"input": ["opencl -keys=mali,opencl,gpu -device=mali -max_num_threads=512 -thread_warp_size=2", "conv2d_nchw_spatial_pack.mali", [["TENSOR", [1, 64, 27, 21], "float32"], ["TENSOR", [4, 64, 1, 1], "float32"], [1, 1], [0, 0, 0, 0], [1, 1], "float32"], {}], "config": {"index": 53795, "code_hash": null, "entity": [["tile_co", "sp", [-1, 1, 4]], ["tile_oh", "sp", [-1, 3, 3]], ["tile_ow", "sp", [-1, 7, 3]], ["reorder_0", "re", [0, 1, 2, 3, 4, 5, 6, 9, 7, 8]], ["ann_reduce", "an", ["none", "unroll"]], ["ann_spatial", "an", ["unroll", "unroll", "unroll"]]]}, "result": [[0.00081962893081761], 0, 105.16891431808472, 1630492657.2902098], "version": 0.2, "tvm_version": "0.8.dev0"}
{"input": ["opencl -keys=mali,opencl,gpu -device=mali -max_num_threads=512 -thread_warp_size=2", "conv2d_nchw_spatial_pack.mali", [["TENSOR", [1, 64, 27, 21], "float32"], ["TENSOR", [4, 64, 1, 1], "float32"], [1, 1], [0, 0, 0, 0], [1, 1], "float32"], {}], "config": {"index": 85151, "code_hash": null, "entity": [["tile_co", "sp", [-1, 1, 4]], ["tile_oh", "sp", [-1, 3, 1]], ["tile_ow", "sp", [-1, 1, 7]], ["reorder_0", "re", [0, 1, 2, 3, 4, 5, 6, 9, 7, 8]], ["ann_reduce", "an", ["unroll", "none"]], ["ann_spatial", "an", ["vec", "unroll", "unroll"]]]}, "result": [[0.0009048464990366089], 0, 114.14513850212097, 1630492666.2831488], "version": 0.2, "tvm_version": "0.8.dev0"}
{"input": ["opencl -keys=mali,opencl,gpu -device=mali -max_num_threads=512 -thread_warp_size=2", "conv2d_nchw_spatial_pack.mali", [["TENSOR", [1, 64, 27, 21], "float32"], ["TENSOR", [4, 64, 1, 1], "float32"], [1, 1], [0, 0, 0, 0], [1, 1], "float32"], {}], "config": {"index": 66034, "code_hash": null, "entity": [["tile_co", "sp", [-1, 2, 2]], ["tile_oh", "sp", [-1, 3, 3]], ["tile_ow", "sp", [-1, 7, 1]], ["reorder_0", "re", [0, 1, 2, 3, 4, 5, 6, 7, 8, 9]], ["ann_reduce", "an", ["none", "unroll"]], ["ann_spatial", "an", ["unroll", "vec", "unroll"]]]}, "result": [[0.0031476754342105264], 0, 122.88097429275513, 1630492675.047075], "version": 0.2, "tvm_version": "0.8.dev0"}
{"input": ["opencl -keys=mali,opencl,gpu -device=mali -max_num_threads=512 -thread_warp_size=2", "conv2d_nchw_spatial_pack.mali", [["TENSOR", [1, 64, 27, 21], "float32"], ["TENSOR", [4, 64, 1, 1], "float32"], [1, 1], [0, 0, 0, 0], [1, 1], "float32"], {}], "config": {"index": 51994, "code_hash": null, "entity": [["tile_co", "sp", [-1, 2, 2]], ["tile_oh", "sp", [-1, 3, 3]], ["tile_ow", "sp", [-1, 7, 1]], ["reorder_0", "re", [0, 1, 2, 3, 4, 5, 6, 7, 8, 9]], ["ann_reduce", "an", ["none", "none"]], ["ann_spatial", "an", ["unroll", "unroll", "unroll"]]]}, "result": [[0.0010189800970149252], 0, 131.64158463478088, 1630492683.8169541], "version": 0.2, "tvm_version": "0.8.dev0"}
{"input": ["opencl -keys=mali,opencl,gpu -device=mali -max_num_threads=512 -thread_warp_size=2", "conv2d_nchw_spatial_pack.mali", [["TENSOR", [1, 64, 27, 21], "float32"], ["TENSOR", [4, 64, 1, 1], "float32"], [1, 1], [0, 0, 0, 0], [1, 1], "float32"], {}], "config": {"index": 66112, "code_hash": null, "entity": [["tile_co", "sp", [-1, 2, 2]], ["tile_oh", "sp", [-1, 3, 9]], ["tile_ow", "sp", [-1, 21, 1]], ["reorder_0", "re", [0, 1, 2, 3, 4, 5, 6, 7, 8, 9]], ["ann_reduce", "an", ["none", "unroll"]], ["ann_spatial", "an", ["unroll", "vec", "unroll"]]]}, "result": [[0.0010590273406940064], 0, 17.644888401031494, 1630492701.8745372], "version": 0.2, "tvm_version": "0.8.dev0"}
{"input": ["opencl -keys=mali,opencl,gpu -device=mali -max_num_threads=512 -thread_warp_size=2", "conv2d_nchw_spatial_pack.mali", [["TENSOR", [1, 64, 27, 21], "float32"], ["TENSOR", [4, 64, 1, 1], "float32"], [1, 1], [0, 0, 0, 0], [1, 1], "float32"], {}], "config": {"index": 41266, "code_hash": null, "entity": [["tile_co", "sp", [-1, 2, 2]], ["tile_oh", "sp", [-1, 1, 9]], ["tile_ow", "sp", [-1, 21, 1]], ["reorder_0", "re", [0, 1, 2, 3, 4, 5, 6, 7, 8, 9]], ["ann_reduce", "an", ["unroll", "none"]], ["ann_spatial", "an", ["unroll", "none", "unroll"]]]}, "result": [[0.0007468419618528611], 0, 26.321823835372925, 1630492710.5675075], "version": 0.2, "tvm_version": "0.8.dev0"}
{"input": ["opencl -keys=mali,opencl,gpu -device=mali -max_num_threads=512 -thread_warp_size=2", "conv2d_nchw_spatial_pack.mali", [["TENSOR", [1, 64, 27, 21], "float32"], ["TENSOR", [4, 64, 1, 1], "float32"], [1, 1], [0, 0, 0, 0], [1, 1], "float32"], {}], "config": {"index": 53692, "code_hash": null, "entity": [["tile_co", "sp", [-1, 2, 2]], ["tile_oh", "sp", [-1, 3, 9]], ["tile_ow", "sp", [-1, 21, 1]], ["reorder_0", "re", [0, 1, 2, 3, 4, 5, 6, 9, 7, 8]], ["ann_reduce", "an", ["none", "unroll"]], ["ann_spatial", "an", ["unroll", "unroll", "unroll"]]]}, "result": [[0.0007770524781341108], 0, 35.35994791984558, 1630492719.6177015], "version": 0.2, "tvm_version": "0.8.dev0"}
{"input": ["opencl -keys=mali,opencl,gpu -device=mali -max_num_threads=512 -thread_warp_size=2", "conv2d_nchw_spatial_pack.mali", [["TENSOR", [1, 64, 27, 21], "float32"], ["TENSOR", [4, 64, 1, 1], "float32"], [1, 1], [0, 0, 0, 0], [1, 1], "float32"], {}], "config": {"index": 39106, "code_hash": null, "entity": [["tile_co", "sp", [-1, 2, 2]], ["tile_oh", "sp", [-1, 1, 9]], ["tile_ow", "sp", [-1, 21, 1]], ["reorder_0", "re", [0, 1, 2, 3, 4, 5, 6, 7, 8, 9]], ["ann_reduce", "an", ["none", "none"]], ["ann_spatial", "an", ["unroll", "none", "unroll"]]]}, "result": [[0.0006864529914529915], 0, 43.95199370384216, 1630492728.2202132], "version": 0.2, "tvm_version": "0.8.dev0"}
{"input": ["opencl -keys=mali,opencl,gpu -device=mali -max_num_threads=512 -thread_warp_size=2", "conv2d_nchw_spatial_pack.mali", [["TENSOR", [1, 64, 27, 21], "float32"], ["TENSOR", [4, 64, 1, 1], "float32"], [1, 1], [0, 0, 0, 0], [1, 1], "float32"], {}], "config": {"index": 55414, "code_hash": null, "entity": [["tile_co", "sp", [-1, 2, 2]], ["tile_oh", "sp", [-1, 3, 3]], ["tile_ow", "sp", [-1, 7, 3]], ["reorder_0", "re", [0, 1, 2, 3, 4, 5, 6, 7, 8, 9]], ["ann_reduce", "an", ["unroll", "unroll"]], ["ann_spatial", "an", ["unroll", "unroll", "unroll"]]]}, "result": [[0.001261920395522388], 0, 52.40710711479187, 1630492736.68754], "version": 0.2, "tvm_version": "0.8.dev0"}
{"input": ["opencl -keys=mali,opencl,gpu -device=mali -max_num_threads=512 -thread_warp_size=2", "conv2d_nchw_spatial_pack.mali", [["TENSOR", [1, 64, 27, 21], "float32"], ["TENSOR", [4, 64, 1, 1], "float32"], [1, 1], [0, 0, 0, 0], [1, 1], "float32"], {}], "config": {"index": 86285, "code_hash": null, "entity": [["tile_co", "sp", [-1, 1, 4]], ["tile_oh", "sp", [-1, 1, 1]], ["tile_ow", "sp", [-1, 3, 7]], ["reorder_0", "re", [0, 1, 2, 3, 4, 5, 6, 9, 7, 8]], ["ann_reduce", "an", ["unroll", "unroll"]], ["ann_spatial", "an", ["vec", "unroll", "unroll"]]]}, "result": [[0.0008588039820895524], 0, 61.19722056388855, 1630492745.497156], "version": 0.2, "tvm_version": "0.8.dev0"}
{"input": ["opencl -keys=mali,opencl,gpu -device=mali -max_num_threads=512 -thread_warp_size=2", "conv2d_nchw_spatial_pack.mali", [["TENSOR", [1, 64, 27, 21], "float32"], ["TENSOR", [4, 64, 1, 1], "float32"], [1, 1], [0, 0, 0, 0], [1, 1], "float32"], {}], "config": {"index": 52072, "code_hash": null, "entity": [["tile_co", "sp", [-1, 2, 2]], ["tile_oh", "sp", [-1, 3, 9]], ["tile_ow", "sp", [-1, 21, 1]], ["reorder_0", "re", [0, 1, 2, 3, 4, 5, 6, 7, 8, 9]], ["ann_reduce", "an", ["none", "none"]], ["ann_spatial", "an", ["unroll", "unroll", "unroll"]]]}, "result": [[0.001270862433862434], 0, 70.11356568336487, 1630492754.4040985], "version": 0.2, "tvm_version": "0.8.dev0"}
{"input": ["opencl -keys=mali,opencl,gpu -device=mali -max_num_threads=512 -thread_warp_size=2", "conv2d_nchw_spatial_pack.mali", [["TENSOR", [1, 64, 27, 21], "float32"], ["TENSOR", [4, 64, 1, 1], "float32"], [1, 1], [0, 0, 0, 0], [1, 1], "float32"], {}], "config": {"index": 52715, "code_hash": null, "entity": [["tile_co", "sp", [-1, 1, 4]], ["tile_oh", "sp", [-1, 3, 3]], ["tile_ow", "sp", [-1, 7, 3]], ["reorder_0", "re", [0, 1, 2, 3, 4, 5, 6, 9, 7, 8]], ["ann_reduce", "an", ["none", "none"]], ["ann_spatial", "an", ["unroll", "unroll", "unroll"]]]}, "result": [[0.000696844930417495], 0, 78.77255058288574, 1630492763.0887618], "version": 0.2, "tvm_version": "0.8.dev0"}
{"input": ["opencl -keys=mali,opencl,gpu -device=mali -max_num_threads=512 -thread_warp_size=2", "conv2d_nchw_spatial_pack.mali", [["TENSOR", [1, 64, 27, 21], "float32"], ["TENSOR", [4, 64, 1, 1], "float32"], [1, 1], [0, 0, 0, 0], [1, 1], "float32"], {}], "config": {"index": 41272, "code_hash": null, "entity": [["tile_co", "sp", [-1, 2, 2]], ["tile_oh", "sp", [-1, 3, 9]], ["tile_ow", "sp", [-1, 21, 1]], ["reorder_0", "re", [0, 1, 2, 3, 4, 5, 6, 7, 8, 9]], ["ann_reduce", "an", ["unroll", "none"]], ["ann_spatial", "an", ["unroll", "none", "unroll"]]]}, "result": [[0.0007528787868338558], 0, 88.11377620697021, 1630492772.4281275], "version": 0.2, "tvm_version": "0.8.dev0"}
{"input": ["opencl -keys=mali,opencl,gpu -device=mali -max_num_threads=512 -thread_warp_size=2", "conv2d_nchw_spatial_pack.mali", [["TENSOR", [1, 64, 27, 21], "float32"], ["TENSOR", [4, 64, 1, 1], "float32"], [1, 1], [0, 0, 0, 0], [1, 1], "float32"], {}], "config": {"index": 64954, "code_hash": null, "entity": [["tile_co", "sp", [-1, 2, 2]], ["tile_oh", "sp", [-1, 3, 3]], ["tile_ow", "sp", [-1, 7, 1]], ["reorder_0", "re", [0, 1, 2, 3, 4, 5, 6, 7, 8, 9]], ["ann_reduce", "an", ["none", "none"]], ["ann_spatial", "an", ["unroll", "vec", "unroll"]]]}, "result": [[0.0009359812350993377], 0, 96.676096200943, 1630492781.0230632], "version": 0.2, "tvm_version": "0.8.dev0"}
{"input": ["opencl -keys=mali,opencl,gpu -device=mali -max_num_threads=512 -thread_warp_size=2", "conv2d_nchw_spatial_pack.mali", [["TENSOR", [1, 64, 27, 21], "float32"], ["TENSOR", [4, 64, 1, 1], "float32"], [1, 1], [0, 0, 0, 0], [1, 1], "float32"], {}], "config": {"index": 54334, "code_hash": null, "entity": [["tile_co", "sp", [-1, 2, 2]], ["tile_oh", "sp", [-1, 3, 3]], ["tile_ow", "sp", [-1, 7, 3]], ["reorder_0", "re", [0, 1, 2, 3, 4, 5, 6, 7, 8, 9]], ["ann_reduce", "an", ["unroll", "none"]], ["ann_spatial", "an", ["unroll", "unroll", "unroll"]]]}, "result": [[0.0010758187919463087], 0, 105.31305503845215, 1630492789.677816], "version": 0.2, "tvm_version": "0.8.dev0"}
{"input": ["opencl -keys=mali,opencl,gpu -device=mali -max_num_threads=512 -thread_warp_size=2", "conv2d_nchw_spatial_pack.mali", [["TENSOR", [1, 64, 27, 21], "float32"], ["TENSOR", [4, 64, 1, 1], "float32"], [1, 1], [0, 0, 0, 0], [1, 1], "float32"], {}], "config": {"index": 18052, "code_hash": null, "entity": [["tile_co", "sp", [-1, 2, 2]], ["tile_oh", "sp", [-1, 3, 9]], ["tile_ow", "sp", [-1, 21, 1]], ["reorder_0", "re", [0, 1, 2, 3, 4, 5, 6, 9, 7, 8]], ["ann_reduce", "an", ["none", "none"]], ["ann_spatial", "an", ["none", "unroll", "unroll"]]]}, "result": [[0.000986253164556962], 0, 114.19833540916443, 1630492798.5857682], "version": 0.2, "tvm_version": "0.8.dev0"}
{"input": ["opencl -keys=mali,opencl,gpu -device=mali -max_num_threads=512 -thread_warp_size=2", "conv2d_nchw_spatial_pack.mali", [["TENSOR", [1, 64, 27, 21], "float32"], ["TENSOR", [4, 64, 1, 1], "float32"], [1, 1], [0, 0, 0, 0], [1, 1], "float32"], {}], "config": {"index": 85205, "code_hash": null, "entity": [["tile_co", "sp", [-1, 1, 4]], ["tile_oh", "sp", [-1, 1, 1]], ["tile_ow", "sp", [-1, 3, 7]], ["reorder_0", "re", [0, 1, 2, 3, 4, 5, 6, 9, 7, 8]], ["ann_reduce", "an", ["unroll", "none"]], ["ann_spatial", "an", ["vec", "unroll", "unroll"]]]}, "result": [[0.0011448568397435896], 0, 122.71555542945862, 1630492807.1031635], "version": 0.2, "tvm_version": "0.8.dev0"}
{"input": ["opencl -keys=mali,opencl,gpu -device=mali -max_num_threads=512 -thread_warp_size=2", "conv2d_nchw_spatial_pack.mali", [["TENSOR", [1, 64, 27, 21], "float32"], ["TENSOR", [4, 64, 1, 1], "float32"], [1, 1], [0, 0, 0, 0], [1, 1], "float32"], {}], "config": {"index": 40583, "code_hash": null, "entity": [["tile_co", "sp", [-1, 1, 4]], ["tile_oh", "sp", [-1, 27, 1]], ["tile_ow", "sp", [-1, 3, 1]], ["reorder_0", "re", [0, 1, 2, 3, 4, 5, 6, 9, 7, 8]], ["ann_reduce", "an", ["none", "unroll"]], ["ann_spatial", "an", ["unroll", "none", "unroll"]]]}, "result": [[0.0013502057265625], 0, 131.00206518173218, 1630492815.4151478], "version": 0.2, "tvm_version": "0.8.dev0"}
{"input": ["opencl -keys=mali,opencl,gpu -device=mali -max_num_threads=512 -thread_warp_size=2", "conv2d_nchw_spatial_pack.mali", [["TENSOR", [1, 64, 27, 21], "float32"], ["TENSOR", [4, 64, 1, 1], "float32"], [1, 1], [0, 0, 0, 0], [1, 1], "float32"], {}], "config": {"index": 23229, "code_hash": null, "entity": [["tile_co", "sp", [-1, 1, 2]], ["tile_oh", "sp", [-1, 3, 1]], ["tile_ow", "sp", [-1, 1, 1]], ["reorder_0", "re", [0, 1, 2, 3, 4, 5, 6, 9, 7, 8]], ["ann_reduce", "an", ["none", "unroll"]], ["ann_spatial", "an", ["none", "unroll", "vec"]]]}, "result": [[0.0012739805583333332], 0, 139.27122163772583, 1630492823.710791], "version": 0.2, "tvm_version": "0.8.dev0"}
{"input": ["opencl -keys=mali,opencl,gpu -device=mali -max_num_threads=512 -thread_warp_size=2", "conv2d_nchw_spatial_pack.mali", [["TENSOR", [1, 64, 27, 21], "float32"], ["TENSOR", [4, 64, 1, 1], "float32"], [1, 1], [0, 0, 0, 0], [1, 1], "float32"], {}], "config": {"index": 42350, "code_hash": null, "entity": [["tile_co", "sp", [-1, 4, 1]], ["tile_oh", "sp", [-1, 3, 9]], ["tile_ow", "sp", [-1, 21, 1]], ["reorder_0", "re", [0, 1, 2, 3, 4, 5, 6, 7, 8, 9]], ["ann_reduce", "an", ["unroll", "unroll"]], ["ann_spatial", "an", ["unroll", "none", "unroll"]]]}, "result": [[0.0015214458717948717], 0, 14.194669723510742, 1630492849.7050817], "version": 0.2, "tvm_version": "0.8.dev0"}
{"input": ["opencl -keys=mali,opencl,gpu -device=mali -max_num_threads=512 -thread_warp_size=2", "conv2d_nchw_spatial_pack.mali", [["TENSOR", [1, 64, 27, 21], "float32"], ["TENSOR", [4, 64, 1, 1], "float32"], [1, 1], [0, 0, 0, 0], [1, 1], "float32"], {}], "config": {"index": 52179, "code_hash": null, "entity": [["tile_co", "sp", [-1, 1, 2]], ["tile_oh", "sp", [-1, 9, 3]], ["tile_ow", "sp", [-1, 7, 3]], ["reorder_0", "re", [0, 1, 2, 3, 4, 5, 6, 7, 8, 9]], ["ann_reduce", "an", ["none", "none"]], ["ann_spatial", "an", ["unroll", "unroll", "unroll"]]]}, "result": [[0.0011202388059701493], 0, 23.314554452896118, 1630492858.8356414], "version": 0.2, "tvm_version": "0.8.dev0"}
{"input": ["opencl -keys=mali,opencl,gpu -device=mali -max_num_threads=512 -thread_warp_size=2", "conv2d_nchw_spatial_pack.mali", [["TENSOR", [1, 64, 27, 21], "float32"], ["TENSOR", [4, 64, 1, 1], "float32"], [1, 1], [0, 0, 0, 0], [1, 1], "float32"], {}], "config": {"index": 7790, "code_hash": null, "entity": [["tile_co", "sp", [-1, 4, 1]], ["tile_oh", "sp", [-1, 3, 9]], ["tile_ow", "sp", [-1, 21, 1]], ["reorder_0", "re", [0, 1, 2, 3, 4, 5, 6, 7, 8, 9]], ["ann_reduce", "an", ["unroll", "unroll"]], ["ann_spatial", "an", ["none", "none", "unroll"]]]}, "result": [[0.001541159018348624], 0, 31.968207359313965, 1630492867.5153594], "version": 0.2, "tvm_version": "0.8.dev0"}
{"input": ["opencl -keys=mali,opencl,gpu -device=mali -max_num_threads=512 -thread_warp_size=2", "conv2d_nchw_spatial_pack.mali", [["TENSOR", [1, 64, 27, 21], "float32"], ["TENSOR", [4, 64, 1, 1], "float32"], [1, 1], [0, 0, 0, 0], [1, 1], "float32"], {}], "config": {"index": 53679, "code_hash": null, "entity": [["tile_co", "sp", [-1, 1, 2]], ["tile_oh", "sp", [-1, 9, 3]], ["tile_ow", "sp", [-1, 21, 1]], ["reorder_0", "re", [0, 1, 2, 3, 4, 5, 6, 9, 7, 8]], ["ann_reduce", "an", ["none", "unroll"]], ["ann_spatial", "an", ["unroll", "unroll", "unroll"]]]}, "result": [[0.0031341622763157895], 0, 40.612804889678955, 1630492876.1707103], "version": 0.2, "tvm_version": "0.8.dev0"}
{"input": ["opencl -keys=mali,opencl,gpu -device=mali -max_num_threads=512 -thread_warp_size=2", "conv2d_nchw_spatial_pack.mali", [["TENSOR", [1, 64, 27, 21], "float32"], ["TENSOR", [4, 64, 1, 1], "float32"], [1, 1], [0, 0, 0, 0], [1, 1], "float32"], {}], "config": {"index": 49359, "code_hash": null, "entity": [["tile_co", "sp", [-1, 1, 2]], ["tile_oh", "sp", [-1, 9, 3]], ["tile_ow", "sp", [-1, 21, 1]], ["reorder_0", "re", [0, 1, 2, 3, 4, 5, 6, 9, 7, 8]], ["ann_reduce", "an", ["none", "unroll"]], ["ann_spatial", "an", ["unroll", "unroll", "none"]]]}, "result": [[0.0007829107992957747], 0, 49.57812857627869, 1630492885.1580026], "version": 0.2, "tvm_version": "0.8.dev0"}
{"input": ["opencl -keys=mali,opencl,gpu -device=mali -max_num_threads=512 -thread_warp_size=2", "conv2d_nchw_spatial_pack.mali", [["TENSOR", [1, 64, 27, 21], "float32"], ["TENSOR", [4, 64, 1, 1], "float32"], [1, 1], [0, 0, 0, 0], [1, 1], "float32"], {}], "config": {"index": 3470, "code_hash": null, "entity": [["tile_co", "sp", [-1, 4, 1]], ["tile_oh", "sp", [-1, 3, 9]], ["tile_ow", "sp", [-1, 21, 1]], ["reorder_0", "re", [0, 1, 2, 3, 4, 5, 6, 7, 8, 9]], ["ann_reduce", "an", ["unroll", "unroll"]], ["ann_spatial", "an", ["none", "none", "none"]]]}, "result": [[0.0011532533345454546], 0, 58.82256293296814, 1630492894.4117022], "version": 0.2, "tvm_version": "0.8.dev0"}
{"input": ["opencl -keys=mali,opencl,gpu -device=mali -max_num_threads=512 -thread_warp_size=2", "conv2d_nchw_spatial_pack.mali", [["TENSOR", [1, 64, 27, 21], "float32"], ["TENSOR", [4, 64, 1, 1], "float32"], [1, 1], [0, 0, 0, 0], [1, 1], "float32"], {}], "config": {"index": 17619, "code_hash": null, "entity": [["tile_co", "sp", [-1, 1, 2]], ["tile_oh", "sp", [-1, 9, 3]], ["tile_ow", "sp", [-1, 7, 3]], ["reorder_0", "re", [0, 1, 2, 3, 4, 5, 6, 7, 8, 9]], ["ann_reduce", "an", ["none", "none"]], ["ann_spatial", "an", ["none", "unroll", "unroll"]]]}, "result": [[0.0014173580235690235], 0, 68.24419498443604, 1630492903.8557317], "version": 0.2, "tvm_version": "0.8.dev0"}
{"input": ["opencl -keys=mali,opencl,gpu -device=mali -max_num_threads=512 -thread_warp_size=2", "conv2d_nchw_spatial_pack.mali", [["TENSOR", [1, 64, 27, 21], "float32"], ["TENSOR", [4, 64, 1, 1], "float32"], [1, 1], [0, 0, 0, 0], [1, 1], "float32"], {}], "config": {"index": 36399, "code_hash": null, "entity": [["tile_co", "sp", [-1, 1, 2]], ["tile_oh", "sp", [-1, 9, 3]], ["tile_ow", "sp", [-1, 21, 1]], ["reorder_0", "re", [0, 1, 2, 3, 4, 5, 6, 9, 7, 8]], ["ann_reduce", "an", ["none", "unroll"]], ["ann_spatial", "an", ["unroll", "none", "none"]]]}, "result": [[0.0007329300580357143], 0, 76.7642068862915, 1630492912.3729758], "version": 0.2, "tvm_version": "0.8.dev0"}
{"input": ["opencl -keys=mali,opencl,gpu -device=mali -max_num_threads=512 -thread_warp_size=2", "conv2d_nchw_spatial_pack.mali", [["TENSOR", [1, 64, 27, 21], "float32"], ["TENSOR", [4, 64, 1, 1], "float32"], [1, 1], [0, 0, 0, 0], [1, 1], "float32"], {}], "config": {"index": 38030, "code_hash": null, "entity": [["tile_co", "sp", [-1, 4, 1]], ["tile_oh", "sp", [-1, 3, 9]], ["tile_ow", "sp", [-1, 21, 1]], ["reorder_0", "re", [0, 1, 2, 3, 4, 5, 6, 7, 8, 9]], ["ann_reduce", "an", ["unroll", "unroll"]], ["ann_spatial", "an", ["unroll", "none", "none"]]]}, "result": [[0.001303106109324759], 0, 86.13896536827087, 1630492921.7655082], "version": 0.2, "tvm_version": "0.8.dev0"}
{"input": ["opencl -keys=mali,opencl,gpu -device=mali -max_num_threads=512 -thread_warp_size=2", "conv2d_nchw_spatial_pack.mali", [["TENSOR", [1, 64, 27, 21], "float32"], ["TENSOR", [4, 64, 1, 1], "float32"], [1, 1], [0, 0, 0, 0], [1, 1], "float32"], {}], "config": {"index": 18579, "code_hash": null, "entity": [["tile_co", "sp", [-1, 1, 2]], ["tile_oh", "sp", [-1, 9, 3]], ["tile_ow", "sp", [-1, 21, 1]], ["reorder_0", "re", [0, 1, 2, 3, 4, 5, 6, 7, 8, 9]], ["ann_reduce", "an", ["none", "unroll"]], ["ann_spatial", "an", ["none", "unroll", "unroll"]]]}, "result": [[0.0012415844794520547], 0, 94.67679905891418, 1630492930.3313696], "version": 0.2, "tvm_version": "0.8.dev0"}
{"input": ["opencl -keys=mali,opencl,gpu -device=mali -max_num_threads=512 -thread_warp_size=2", "conv2d_nchw_spatial_pack.mali", [["TENSOR", [1, 64, 27, 21], "float32"], ["TENSOR", [4, 64, 1, 1], "float32"], [1, 1], [0, 0, 0, 0], [1, 1], "float32"], {}], "config": {"index": 42344, "code_hash": null, "entity": [["tile_co", "sp", [-1, 4, 1]], ["tile_oh", "sp", [-1, 1, 9]], ["tile_ow", "sp", [-1, 21, 1]], ["reorder_0", "re", [0, 1, 2, 3, 4, 5, 6, 7, 8, 9]], ["ann_reduce", "an", ["unroll", "unroll"]], ["ann_spatial", "an", ["unroll", "none", "unroll"]]]}, "result": [[0.0011636717171717172], 0, 103.61721301078796, 1630492939.2806952], "version": 0.2, "tvm_version": "0.8.dev0"}
{"input": ["opencl -keys=mali,opencl,gpu -device=mali -max_num_threads=512 -thread_warp_size=2", "conv2d_nchw_spatial_pack.mali", [["TENSOR", [1, 64, 27, 21], "float32"], ["TENSOR", [4, 64, 1, 1], "float32"], [1, 1], [0, 0, 0, 0], [1, 1], "float32"], {}], "config": {"index": 48819, "code_hash": null, "entity": [["tile_co", "sp", [-1, 1, 2]], ["tile_oh", "sp", [-1, 9, 3]], ["tile_ow", "sp", [-1, 21, 1]], ["reorder_0", "re", [0, 1, 2, 3, 4, 5, 6, 7, 8, 9]], ["ann_reduce", "an", ["none", "unroll"]], ["ann_spatial", "an", ["unroll", "unroll", "none"]]]}, "result": [[0.0008008290155440415], 0, 111.8387439250946, 1630492947.5304563], "version": 0.2, "tvm_version": "0.8.dev0"}
{"input": ["opencl -keys=mali,opencl,gpu -device=mali -max_num_threads=512 -thread_warp_size=2", "conv2d_nchw_spatial_pack.mali", [["TENSOR", [1, 64, 27, 21], "float32"], ["TENSOR", [4, 64, 1, 1], "float32"], [1, 1], [0, 0, 0, 0], [1, 1], "float32"], {}], "config": {"index": 40719, "code_hash": null, "entity": [["tile_co", "sp", [-1, 1, 2]], ["tile_oh", "sp", [-1, 9, 3]], ["tile_ow", "sp", [-1, 21, 1]], ["reorder_0", "re", [0, 1, 2, 3, 4, 5, 6, 9, 7, 8]], ["ann_reduce", "an", ["none", "unroll"]], ["ann_spatial", "an", ["unroll", "none", "unroll"]]]}, "result": [[0.0010269941820448877], 0, 121.01999068260193, 1630492956.7317579], "version": 0.2, "tvm_version": "0.8.dev0"}
{"input": ["opencl -keys=mali,opencl,gpu -device=mali -max_num_threads=512 -thread_warp_size=2", "conv2d_nchw_spatial_pack.mali", [["TENSOR", [1, 64, 27, 21], "float32"], ["TENSOR", [4, 64, 1, 1], "float32"], [1, 1], [0, 0, 0, 0], [1, 1], "float32"], {}], "config": {"index": 53259, "code_hash": null, "entity": [["tile_co", "sp", [-1, 1, 2]], ["tile_oh", "sp", [-1, 9, 3]], ["tile_ow", "sp", [-1, 7, 3]], ["reorder_0", "re", [0, 1, 2, 3, 4, 5, 6, 7, 8, 9]], ["ann_reduce", "an", ["none", "unroll"]], ["ann_spatial", "an", ["unroll", "unroll", "unroll"]]]}, "result": [[0.0010393129110671938], 0, 130.14179182052612, 1630492965.8683245], "version": 0.2, "tvm_version": "0.8.dev0"}
{"input": ["opencl -keys=mali,opencl,gpu -device=mali -max_num_threads=512 -thread_warp_size=2", "conv2d_nchw_spatial_pack.mali", [["TENSOR", [1, 64, 27, 21], "float32"], ["TENSOR", [4, 64, 1, 1], "float32"], [1, 1], [0, 0, 0, 0], [1, 1], "float32"], {}], "config": {"index": 14259, "code_hash": null, "entity": [["tile_co", "sp", [-1, 1, 2]], ["tile_oh", "sp", [-1, 9, 3]], ["tile_ow", "sp", [-1, 21, 1]], ["reorder_0", "re", [0, 1, 2, 3, 4, 5, 6, 7, 8, 9]], ["ann_reduce", "an", ["none", "unroll"]], ["ann_spatial", "an", ["none", "unroll", "none"]]]}, "result": [[0.0012900784313725493], 0, 139.04418349266052, 1630492974.7942777], "version": 0.2, "tvm_version": "0.8.dev0"}
{"input": ["opencl -keys=mali,opencl,gpu -device=mali -max_num_threads=512 -thread_warp_size=2", "conv2d_nchw_spatial_pack.mali", [["TENSOR", [1, 64, 27, 21], "float32"], ["TENSOR", [4, 64, 1, 1], "float32"], [1, 1], [0, 0, 0, 0], [1, 1], "float32"], {}], "config": {"index": 47859, "code_hash": null, "entity": [["tile_co", "sp", [-1, 1, 2]], ["tile_oh", "sp", [-1, 9, 3]], ["tile_ow", "sp", [-1, 7, 3]], ["reorder_0", "re", [0, 1, 2, 3, 4, 5, 6, 7, 8, 9]], ["ann_reduce", "an", ["none", "none"]], ["ann_spatial", "an", ["unroll", "unroll", "none"]]]}, "result": [[0.0006724231590909091], 0, 147.725928068161, 1630492983.4861095], "version": 0.2, "tvm_version": "0.8.dev0"}
{"input": ["opencl -keys=mali,opencl,gpu -device=mali -max_num_threads=512 -thread_warp_size=2", "conv2d_nchw_spatial_pack.mali", [["TENSOR", [1, 64, 27, 21], "float32"], ["TENSOR", [4, 64, 1, 1], "float32"], [1, 1], [0, 0, 0, 0], [1, 1], "float32"], {}], "config": {"index": 7784, "code_hash": null, "entity": [["tile_co", "sp", [-1, 4, 1]], ["tile_oh", "sp", [-1, 1, 9]], ["tile_ow", "sp", [-1, 21, 1]], ["reorder_0", "re", [0, 1, 2, 3, 4, 5, 6, 7, 8, 9]], ["ann_reduce", "an", ["unroll", "unroll"]], ["ann_spatial", "an", ["none", "none", "unroll"]]]}, "result": [[0.0010567816837060704], 0, 16.652167797088623, 1630493000.592473], "version": 0.2, "tvm_version": "0.8.dev0"}
{"input": ["opencl -keys=mali,opencl,gpu -device=mali -max_num_threads=512 -thread_warp_size=2", "conv2d_nchw_spatial_pack.mali", [["TENSOR", [1, 64, 27, 21], "float32"], ["TENSOR", [4, 64, 1, 1], "float32"], [1, 1], [0, 0, 0, 0], [1, 1], "float32"], {}], "config": {"index": 3464, "code_hash": null, "entity": [["tile_co", "sp", [-1, 4, 1]], ["tile_oh", "sp", [-1, 1, 9]], ["tile_ow", "sp", [-1, 21, 1]], ["reorder_0", "re", [0, 1, 2, 3, 4, 5, 6, 7, 8, 9]], ["ann_reduce", "an", ["unroll", "unroll"]], ["ann_spatial", "an", ["none", "none", "none"]]]}, "result": [[0.0008238644859813084], 0, 25.138960361480713, 1630493009.1003397], "version": 0.2, "tvm_version": "0.8.dev0"}
{"input": ["opencl -keys=mali,opencl,gpu -device=mali -max_num_threads=512 -thread_warp_size=2", "conv2d_nchw_spatial_pack.mali", [["TENSOR", [1, 64, 27, 21], "float32"], ["TENSOR", [4, 64, 1, 1], "float32"], [1, 1], [0, 0, 0, 0], [1, 1], "float32"], {}], "config": {"index": 52599, "code_hash": null, "entity": [["tile_co", "sp", [-1, 1, 2]], ["tile_oh", "sp", [-1, 9, 3]], ["tile_ow", "sp", [-1, 21, 1]], ["reorder_0", "re", [0, 1, 2, 3, 4, 5, 6, 9, 7, 8]], ["ann_reduce", "an", ["none", "none"]], ["ann_spatial", "an", ["unroll", "unroll", "unroll"]]]}, "result": [[0.0030709444444444443], 0, 34.06655168533325, 1630493018.0396628], "version": 0.2, "tvm_version": "0.8.dev0"}
{"input": ["opencl -keys=mali,opencl,gpu -device=mali -max_num_threads=512 -thread_warp_size=2", "conv2d_nchw_spatial_pack.mali", [["TENSOR", [1, 64, 27, 21], "float32"], ["TENSOR", [4, 64, 1, 1], "float32"], [1, 1], [0, 0, 0, 0], [1, 1], "float32"], {}], "config": {"index": 52595, "code_hash": null, "entity": [["tile_co", "sp", [-1, 1, 4]], ["tile_oh", "sp", [-1, 3, 3]], ["tile_ow", "sp", [-1, 21, 1]], ["reorder_0", "re", [0, 1, 2, 3, 4, 5, 6, 9, 7, 8]], ["ann_reduce", "an", ["none", "none"]], ["ann_spatial", "an", ["unroll", "unroll", "unroll"]]]}, "result": [[0.0008537465753424657], 0, 43.432809591293335, 1630493027.4053211], "version": 0.2, "tvm_version": "0.8.dev0"}
{"input": ["opencl -keys=mali,opencl,gpu -device=mali -max_num_threads=512 -thread_warp_size=2", "conv2d_nchw_spatial_pack.mali", [["TENSOR", [1, 64, 27, 21], "float32"], ["TENSOR", [4, 64, 1, 1], "float32"], [1, 1], [0, 0, 0, 0], [1, 1], "float32"], {}], "config": {"index": 13299, "code_hash": null, "entity": [["tile_co", "sp", [-1, 1, 2]], ["tile_oh", "sp", [-1, 9, 3]], ["tile_ow", "sp", [-1, 7, 3]], ["reorder_0", "re", [0, 1, 2, 3, 4, 5, 6, 7, 8, 9]], ["ann_reduce", "an", ["none", "none"]], ["ann_spatial", "an", ["none", "unroll", "none"]]]}, "result": [[0.0010877560975609756], 0, 52.89813542366028, 1630493036.9057217], "version": 0.2, "tvm_version": "0.8.dev0"}
{"input": ["opencl -keys=mali,opencl,gpu -device=mali -max_num_threads=512 -thread_warp_size=2", "conv2d_nchw_spatial_pack.mali", [["TENSOR", [1, 64, 27, 21], "float32"], ["TENSOR", [4, 64, 1, 1], "float32"], [1, 1], [0, 0, 0, 0], [1, 1], "float32"], {}], "config": {"index": 35319, "code_hash": null, "entity": [["tile_co", "sp", [-1, 1, 2]], ["tile_oh", "sp", [-1, 9, 3]], ["tile_ow", "sp", [-1, 21, 1]], ["reorder_0", "re", [0, 1, 2, 3, 4, 5, 6, 9, 7, 8]], ["ann_reduce", "an", ["none", "none"]], ["ann_spatial", "an", ["unroll", "none", "none"]]]}, "result": [[0.0012382105263157894], 0, 61.66668677330017, 1630493045.6896722], "version": 0.2, "tvm_version": "0.8.dev0"}
{"input": ["opencl -keys=mali,opencl,gpu -device=mali -max_num_threads=512 -thread_warp_size=2", "conv2d_nchw_spatial_pack.mali", [["TENSOR", [1, 64, 27, 21], "float32"], ["TENSOR", [4, 64, 1, 1], "float32"], [1, 1], [0, 0, 0, 0], [1, 1], "float32"], {}], "config": {"index": 48279, "code_hash": null, "entity": [["tile_co", "sp", [-1, 1, 2]], ["tile_oh", "sp", [-1, 9, 3]], ["tile_ow", "sp", [-1, 21, 1]], ["reorder_0", "re", [0, 1, 2, 3, 4, 5, 6, 9, 7, 8]], ["ann_reduce", "an", ["none", "none"]], ["ann_spatial", "an", ["unroll", "unroll", "none"]]]}, "result": [[0.0009337289377289376], 0, 70.14558911323547, 1630493054.194937], "version": 0.2, "tvm_version": "0.8.dev0"}
{"input": ["opencl -keys=mali,opencl,gpu -device=mali -max_num_threads=512 -thread_warp_size=2", "conv2d_nchw_spatial_pack.mali", [["TENSOR", [1, 64, 27, 21], "float32"], ["TENSOR", [4, 64, 1, 1], "float32"], [1, 1], [0, 0, 0, 0], [1, 1], "float32"], {}], "config": {"index": 38024, "code_hash": null, "entity": [["tile_co", "sp", [-1, 4, 1]], ["tile_oh", "sp", [-1, 1, 9]], ["tile_ow", "sp", [-1, 21, 1]], ["reorder_0", "re", [0, 1, 2, 3, 4, 5, 6, 7, 8, 9]], ["ann_reduce", "an", ["unroll", "unroll"]], ["ann_spatial", "an", ["unroll", "none", "none"]]]}, "result": [[0.000792869790625], 0, 79.19611525535583, 1630493063.2303908], "version": 0.2, "tvm_version": "0.8.dev0"}
{"input": ["opencl -keys=mali,opencl,gpu -device=mali -max_num_threads=512 -thread_warp_size=2", "conv2d_nchw_spatial_pack.mali", [["TENSOR", [1, 64, 27, 21], "float32"], ["TENSOR", [4, 64, 1, 1], "float32"], [1, 1], [0, 0, 0, 0], [1, 1], "float32"], {}], "config": {"index": 42345, "code_hash": null, "entity": [["tile_co", "sp", [-1, 1, 2]], ["tile_oh", "sp", [-1, 1, 9]], ["tile_ow", "sp", [-1, 21, 1]], ["reorder_0", "re", [0, 1, 2, 3, 4, 5, 6, 7, 8, 9]], ["ann_reduce", "an", ["unroll", "unroll"]], ["ann_spatial", "an", ["unroll", "none", "unroll"]]]}, "result": [[0.001988804603448276], 0, 87.7446722984314, 1630493071.8276172], "version": 0.2, "tvm_version": "0.8.dev0"}
{"input": ["opencl -keys=mali,opencl,gpu -device=mali -max_num_threads=512 -thread_warp_size=2", "conv2d_nchw_spatial_pack.mali", [["TENSOR", [1, 64, 27, 21], "float32"], ["TENSOR", [4, 64, 1, 1], "float32"], [1, 1], [0, 0, 0, 0], [1, 1], "float32"], {}], "config": {"index": 49479, "code_hash": null, "entity": [["tile_co", "sp", [-1, 1, 2]], ["tile_oh", "sp", [-1, 9, 3]], ["tile_ow", "sp", [-1, 7, 3]], ["reorder_0", "re", [0, 1, 2, 3, 4, 5, 6, 9, 7, 8]], ["ann_reduce", "an", ["none", "unroll"]], ["ann_spatial", "an", ["unroll", "unroll", "none"]]]}, "result": [[0.000766492422077922], 0, 96.45062565803528, 1630493080.5528574], "version": 0.2, "tvm_version": "0.8.dev0"}
{"input": ["opencl -keys=mali,opencl,gpu -device=mali -max_num_threads=512 -thread_warp_size=2", "conv2d_nchw_spatial_pack.mali", [["TENSOR", [1, 64, 27, 21], "float32"], ["TENSOR", [4, 64, 1, 1], "float32"], [1, 1], [0, 0, 0, 0], [1, 1], "float32"], {}], "config": {"index": 39639, "code_hash": null, "entity": [["tile_co", "sp", [-1, 1, 2]], ["tile_oh", "sp", [-1, 9, 3]], ["tile_ow", "sp", [-1, 21, 1]], ["reorder_0", "re", [0, 1, 2, 3, 4, 5, 6, 9, 7, 8]], ["ann_reduce", "an", ["none", "none"]], ["ann_spatial", "an", ["unroll", "none", "unroll"]]]}, "result": [[0.0009834276094276093], 0, 105.37971806526184, 1630493089.4993017], "version": 0.2, "tvm_version": "0.8.dev0"}
{"input": ["opencl -keys=mali,opencl,gpu -device=mali -max_num_threads=512 -thread_warp_size=2", "conv2d_nchw_spatial_pack.mali", [["TENSOR", [1, 64, 27, 21], "float32"], ["TENSOR", [4, 64, 1, 1], "float32"], [1, 1], [0, 0, 0, 0], [1, 1], "float32"], {}], "config": {"index": 21292, "code_hash": null, "entity": [["tile_co", "sp", [-1, 2, 2]], ["tile_oh", "sp", [-1, 3, 9]], ["tile_ow", "sp", [-1, 21, 1]], ["reorder_0", "re", [0, 1, 2, 3, 4, 5, 6, 9, 7, 8]], ["ann_reduce", "an", ["unroll", "unroll"]], ["ann_spatial", "an", ["none", "unroll", "unroll"]]]}, "result": [[0.0006808481481481482], 0, 114.17474269866943, 1630493098.3087933], "version": 0.2, "tvm_version": "0.8.dev0"}
{"input": ["opencl -keys=mali,opencl,gpu -device=mali -max_num_threads=512 -thread_warp_size=2", "conv2d_nchw_spatial_pack.mali", [["TENSOR", [1, 64, 27, 21], "float32"], ["TENSOR", [4, 64, 1, 1], "float32"], [1, 1], [0, 0, 0, 0], [1, 1], "float32"], {}], "config": {"index": 39635, "code_hash": null, "entity": [["tile_co", "sp", [-1, 1, 4]], ["tile_oh", "sp", [-1, 3, 3]], ["tile_ow", "sp", [-1, 21, 1]], ["reorder_0", "re", [0, 1, 2, 3, 4, 5, 6, 9, 7, 8]], ["ann_reduce", "an", ["none", "none"]], ["ann_spatial", "an", ["unroll", "none", "unroll"]]]}, "result": [[0.0028594740777777776], 0, 123.01936793327332, 1630493107.1677294], "version": 0.2, "tvm_version": "0.8.dev0"}
{"input": ["opencl -keys=mali,opencl,gpu -device=mali -max_num_threads=512 -thread_warp_size=2", "conv2d_nchw_spatial_pack.mali", [["TENSOR", [1, 64, 27, 21], "float32"], ["TENSOR", [4, 64, 1, 1], "float32"], [1, 1], [0, 0, 0, 0], [1, 1], "float32"], {}], "config": {"index": 42351, "code_hash": null, "entity": [["tile_co", "sp", [-1, 1, 2]], ["tile_oh", "sp", [-1, 3, 9]], ["tile_ow", "sp", [-1, 21, 1]], ["reorder_0", "re", [0, 1, 2, 3, 4, 5, 6, 7, 8, 9]], ["ann_reduce", "an", ["unroll", "unroll"]], ["ann_spatial", "an", ["unroll", "none", "unroll"]]]}, "result": [[0.0006907741597633136], 0, 131.92196607589722, 1630493116.0978074], "version": 0.2, "tvm_version": "0.8.dev0"}
{"input": ["opencl -keys=mali,opencl,gpu -device=mali -max_num_threads=512 -thread_warp_size=2", "conv2d_nchw_spatial_pack.mali", [["TENSOR", [1, 64, 27, 21], "float32"], ["TENSOR", [4, 64, 1, 1], "float32"], [1, 1], [0, 0, 0, 0], [1, 1], "float32"], {}], "config": {"index": 53675, "code_hash": null, "entity": [["tile_co", "sp", [-1, 1, 4]], ["tile_oh", "sp", [-1, 3, 3]], ["tile_ow", "sp", [-1, 21, 1]], ["reorder_0", "re", [0, 1, 2, 3, 4, 5, 6, 9, 7, 8]], ["ann_reduce", "an", ["none", "unroll"]], ["ann_spatial", "an", ["unroll", "unroll", "unroll"]]]}, "result": [[0.0010157292103092784], 0, 141.24638724327087, 1630493125.4344752], "version": 0.2, "tvm_version": "0.8.dev0"}
{"input": ["opencl -keys=mali,opencl,gpu -device=mali -max_num_threads=512 -thread_warp_size=2", "conv2d_nchw_spatial_pack.mali", [["TENSOR", [1, 64, 27, 21], "float32"], ["TENSOR", [4, 64, 1, 1], "float32"], [1, 1], [0, 0, 0, 0], [1, 1], "float32"], {}], "config": {"index": 35315, "code_hash": null, "entity": [["tile_co", "sp", [-1, 1, 4]], ["tile_oh", "sp", [-1, 3, 3]], ["tile_ow", "sp", [-1, 21, 1]], ["reorder_0", "re", [0, 1, 2, 3, 4, 5, 6, 9, 7, 8]], ["ann_reduce", "an", ["none", "none"]], ["ann_spatial", "an", ["unroll", "none", "none"]]]}, "result": [[0.000726389923255814], 0, 16.610371589660645, 1630493142.4794652], "version": 0.2, "tvm_version": "0.8.dev0"}
{"input": ["opencl -keys=mali,opencl,gpu -device=mali -max_num_threads=512 -thread_warp_size=2", "conv2d_nchw_spatial_pack.mali", [["TENSOR", [1, 64, 27, 21], "float32"], ["TENSOR", [4, 64, 1, 1], "float32"], [1, 1], [0, 0, 0, 0], [1, 1], "float32"], {}], "config": {"index": 48275, "code_hash": null, "entity": [["tile_co", "sp", [-1, 1, 4]], ["tile_oh", "sp", [-1, 3, 3]], ["tile_ow", "sp", [-1, 21, 1]], ["reorder_0", "re", [0, 1, 2, 3, 4, 5, 6, 9, 7, 8]], ["ann_reduce", "an", ["none", "none"]], ["ann_spatial", "an", ["unroll", "unroll", "none"]]]}, "result": [[0.0008546317217741936], 0, 25.0302255153656, 1630493150.9180923], "version": 0.2, "tvm_version": "0.8.dev0"}
{"input": ["opencl -keys=mali,opencl,gpu -device=mali -max_num_threads=512 -thread_warp_size=2", "conv2d_nchw_spatial_pack.mali", [["TENSOR", [1, 64, 27, 21], "float32"], ["TENSOR", [4, 64, 1, 1], "float32"], [1, 1], [0, 0, 0, 0], [1, 1], "float32"], {}], "config": {"index": 18699, "code_hash": null, "entity": [["tile_co", "sp", [-1, 1, 2]], ["tile_oh", "sp", [-1, 9, 3]], ["tile_ow", "sp", [-1, 7, 3]], ["reorder_0", "re", [0, 1, 2, 3, 4, 5, 6, 7, 8, 9]], ["ann_reduce", "an", ["none", "unroll"]], ["ann_spatial", "an", ["none", "unroll", "unroll"]]]}, "result": [[0.0005480381274509804], 0, 33.69873309135437, 1630493159.6029472], "version": 0.2, "tvm_version": "0.8.dev0"}
{"input": ["opencl -keys=mali,opencl,gpu -device=mali -max_num_threads=512 -thread_warp_size=2", "conv2d_nchw_spatial_pack.mali", [["TENSOR", [1, 64, 27, 21], "float32"], ["TENSOR", [4, 64, 1, 1], "float32"], [1, 1], [0, 0, 0, 0], [1, 1], "float32"], {}], "config": {"index": 47739, "code_hash": null, "entity": [["tile_co", "sp", [-1, 1, 2]], ["tile_oh", "sp", [-1, 9, 3]], ["tile_ow", "sp", [-1, 21, 1]], ["reorder_0", "re", [0, 1, 2, 3, 4, 5, 6, 7, 8, 9]], ["ann_reduce", "an", ["none", "none"]], ["ann_spatial", "an", ["unroll", "unroll", "none"]]]}, "result": [[0.001302679015873016], 0, 42.186970233917236, 1630493168.1089473], "version": 0.2, "tvm_version": "0.8.dev0"}
{"input": ["opencl -keys=mali,opencl,gpu -device=mali -max_num_threads=512 -thread_warp_size=2", "conv2d_nchw_spatial_pack.mali", [["TENSOR", [1, 64, 27, 21], "float32"], ["TENSOR", [4, 64, 1, 1], "float32"], [1, 1], [0, 0, 0, 0], [1, 1], "float32"], {}], "config": {"index": 13179, "code_hash": null, "entity": [["tile_co", "sp", [-1, 1, 2]], ["tile_oh", "sp", [-1, 9, 3]], ["tile_ow", "sp", [-1, 21, 1]], ["reorder_0", "re", [0, 1, 2, 3, 4, 5, 6, 7, 8, 9]], ["ann_reduce", "an", ["none", "none"]], ["ann_spatial", "an", ["none", "unroll", "none"]]]}, "result": [[0.0010244781341107873], 0, 51.54467248916626, 1630493177.4918213], "version": 0.2, "tvm_version": "0.8.dev0"}
{"input": ["opencl -keys=mali,opencl,gpu -device=mali -max_num_threads=512 -thread_warp_size=2", "conv2d_nchw_spatial_pack.mali", [["TENSOR", [1, 64, 27, 21], "float32"], ["TENSOR", [4, 64, 1, 1], "float32"], [1, 1], [0, 0, 0, 0], [1, 1], "float32"], {}], "config": {"index": 17499, "code_hash": null, "entity": [["tile_co", "sp", [-1, 1, 2]], ["tile_oh", "sp", [-1, 9, 3]], ["tile_ow", "sp", [-1, 21, 1]], ["reorder_0", "re", [0, 1, 2, 3, 4, 5, 6, 7, 8, 9]], ["ann_reduce", "an", ["none", "none"]], ["ann_spatial", "an", ["none", "unroll", "unroll"]]]}, "result": [[0.0009122282787878788], 0, 60.17840385437012, 1630493186.1401765], "version": 0.2, "tvm_version": "0.8.dev0"}
