example_04/auto_tvm_log/v9h-model-01-NCHW-opencl-C1000-T21-09-01-10-09.log.tmp
{"input": ["opencl -keys=mali,opencl,gpu -device=mali -max_num_threads=512 -thread_warp_size=2", "conv2d_nchw_spatial_pack.mali", [["TENSOR", [1, 128, 7, 6], "float32"], ["TENSOR", [15, 128, 1, 1], "float32"], [1, 1], [0, 0, 0, 0], [1, 1], "float32"], {}], "config": {"index": 24452, "code_hash": null, "entity": [["tile_co", "sp", [-1, 1, 15]], ["tile_oh", "sp", [-1, 7, 1]], ["tile_ow", "sp", [-1, 3, 2]], ["reorder_0", "re", [0, 1, 2, 3, 4, 5, 6, 7, 8, 9]], ["ann_reduce", "an", ["unroll", "none"]], ["ann_spatial", "an", ["unroll", "unroll", "unroll"]]]}, "result": [[0.0014364477337278107], 0, 16.257783889770508, 1630462265.1514046], "version": 0.2, "tvm_version": "0.8.dev0"}
{"input": ["opencl -keys=mali,opencl,gpu -device=mali -max_num_threads=512 -thread_warp_size=2", "conv2d_nchw_spatial_pack.mali", [["TENSOR", [1, 128, 7, 6], "float32"], ["TENSOR", [15, 128, 1, 1], "float32"], [1, 1], [0, 0, 0, 0], [1, 1], "float32"], {}], "config": {"index": 23480, "code_hash": null, "entity": [["tile_co", "sp", [-1, 1, 15]], ["tile_oh", "sp", [-1, 7, 1]], ["tile_ow", "sp", [-1, 3, 2]], ["reorder_0", "re", [0, 1, 2, 3, 4, 5, 6, 7, 8, 9]], ["ann_reduce", "an", ["none", "none"]], ["ann_spatial", "an", ["unroll", "unroll", "unroll"]]]}, "result": [[0.0013275798816568046], 0, 24.800585985183716, 1630462273.7070298], "version": 0.2, "tvm_version": "0.8.dev0"}
{"input": ["opencl -keys=mali,opencl,gpu -device=mali -max_num_threads=512 -thread_warp_size=2", "conv2d_nchw_spatial_pack.mali", [["TENSOR", [1, 128, 7, 6], "float32"], ["TENSOR", [15, 128, 1, 1], "float32"], [1, 1], [0, 0, 0, 0], [1, 1], "float32"], {}], "config": {"index": 18620, "code_hash": null, "entity": [["tile_co", "sp", [-1, 1, 15]], ["tile_oh", "sp", [-1, 7, 1]], ["tile_ow", "sp", [-1, 3, 2]], ["reorder_0", "re", [0, 1, 2, 3, 4, 5, 6, 7, 8, 9]], ["ann_reduce", "an", ["unroll", "none"]], ["ann_spatial", "an", ["unroll", "none", "unroll"]]]}, "result": [[0.000837037134715026], 0, 34.30815625190735, 1630462283.224225], "version": 0.2, "tvm_version": "0.8.dev0"}
{"input": ["opencl -keys=mali,opencl,gpu -device=mali -max_num_threads=512 -thread_warp_size=2", "conv2d_nchw_spatial_pack.mali", [["TENSOR", [1, 128, 7, 6], "float32"], ["TENSOR", [15, 128, 1, 1], "float32"], [1, 1], [0, 0, 0, 0], [1, 1], "float32"], {}], "config": {"index": 17648, "code_hash": null, "entity": [["tile_co", "sp", [-1, 1, 15]], ["tile_oh", "sp", [-1, 7, 1]], ["tile_ow", "sp", [-1, 3, 2]], ["reorder_0", "re", [0, 1, 2, 3, 4, 5, 6, 7, 8, 9]], ["ann_reduce", "an", ["none", "none"]], ["ann_spatial", "an", ["unroll", "none", "unroll"]]]}, "result": [[0.0013412566844919786], 0, 43.047887086868286, 1630462291.9716864], "version": 0.2, "tvm_version": "0.8.dev0"}
{"input": ["opencl -keys=mali,opencl,gpu -device=mali -max_num_threads=512 -thread_warp_size=2", "conv2d_nchw_spatial_pack.mali", [["TENSOR", [1, 128, 7, 6], "float32"], ["TENSOR", [15, 128, 1, 1], "float32"], [1, 1], [0, 0, 0, 0], [1, 1], "float32"], {}], "config": {"index": 23723, "code_hash": null, "entity": [["tile_co", "sp", [-1, 1, 15]], ["tile_oh", "sp", [-1, 7, 1]], ["tile_ow", "sp", [-1, 3, 2]], ["reorder_0", "re", [0, 1, 2, 3, 4, 5, 6, 9, 7, 8]], ["ann_reduce", "an", ["none", "none"]], ["ann_spatial", "an", ["unroll", "unroll", "unroll"]]]}, "result": [[0.0007264299424778761], 0, 51.53570318222046, 1630462300.4629455], "version": 0.2, "tvm_version": "0.8.dev0"}
{"input": ["opencl -keys=mali,opencl,gpu -device=mali -max_num_threads=512 -thread_warp_size=2", "conv2d_nchw_spatial_pack.mali", [["TENSOR", [1, 128, 7, 6], "float32"], ["TENSOR", [15, 128, 1, 1], "float32"], [1, 1], [0, 0, 0, 0], [1, 1], "float32"], {}], "config": {"index": 24938, "code_hash": null, "entity": [["tile_co", "sp", [-1, 1, 15]], ["tile_oh", "sp", [-1, 7, 1]], ["tile_ow", "sp", [-1, 3, 2]], ["reorder_0", "re", [0, 1, 2, 3, 4, 5, 6, 7, 8, 9]], ["ann_reduce", "an", ["unroll", "unroll"]], ["ann_spatial", "an", ["unroll", "unroll", "unroll"]]]}, "result": [[0.0010271617337278107], 0, 60.00960373878479, 1630462308.9509556], "version": 0.2, "tvm_version": "0.8.dev0"}
{"input": ["opencl -keys=mali,opencl,gpu -device=mali -max_num_threads=512 -thread_warp_size=2", "conv2d_nchw_spatial_pack.mali", [["TENSOR", [1, 128, 7, 6], "float32"], ["TENSOR", [15, 128, 1, 1], "float32"], [1, 1], [0, 0, 0, 0], [1, 1], "float32"], {}], "config": {"index": 23966, "code_hash": null, "entity": [["tile_co", "sp", [-1, 1, 15]], ["tile_oh", "sp", [-1, 7, 1]], ["tile_ow", "sp", [-1, 3, 2]], ["reorder_0", "re", [0, 1, 2, 3, 4, 5, 6, 7, 8, 9]], ["ann_reduce", "an", ["none", "unroll"]], ["ann_spatial", "an", ["unroll", "unroll", "unroll"]]]}, "result": [[0.0007653933941441443], 0, 68.81155180931091, 1630462317.7620666], "version": 0.2, "tvm_version": "0.8.dev0"}
{"input": ["opencl -keys=mali,opencl,gpu -device=mali -max_num_threads=512 -thread_warp_size=2", "conv2d_nchw_spatial_pack.mali", [["TENSOR", [1, 128, 7, 6], "float32"], ["TENSOR", [15, 128, 1, 1], "float32"], [1, 1], [0, 0, 0, 0], [1, 1], "float32"], {}], "config": {"index": 19106, "code_hash": null, "entity": [["tile_co", "sp", [-1, 1, 15]], ["tile_oh", "sp", [-1, 7, 1]], ["tile_ow", "sp", [-1, 3, 2]], ["reorder_0", "re", [0, 1, 2, 3, 4, 5, 6, 7, 8, 9]], ["ann_reduce", "an", ["unroll", "unroll"]], ["ann_spatial", "an", ["unroll", "none", "unroll"]]]}, "result": [[0.001013867936440678], 0, 77.89752697944641, 1630462326.832781], "version": 0.2, "tvm_version": "0.8.dev0"}
{"input": ["opencl -keys=mali,opencl,gpu -device=mali -max_num_threads=512 -thread_warp_size=2", "conv2d_nchw_spatial_pack.mali", [["TENSOR", [1, 128, 7, 6], "float32"], ["TENSOR", [15, 128, 1, 1], "float32"], [1, 1], [0, 0, 0, 0], [1, 1], "float32"], {}], "config": {"index": 18134, "code_hash": null, "entity": [["tile_co", "sp", [-1, 1, 15]], ["tile_oh", "sp", [-1, 7, 1]], ["tile_ow", "sp", [-1, 3, 2]], ["reorder_0", "re", [0, 1, 2, 3, 4, 5, 6, 7, 8, 9]], ["ann_reduce", "an", ["none", "unroll"]], ["ann_spatial", "an", ["unroll", "none", "unroll"]]]}, "result": [[0.00105458989212828], 0, 86.52564930915833, 1630462335.473026], "version": 0.2, "tvm_version": "0.8.dev0"}
{"input": ["opencl -keys=mali,opencl,gpu -device=mali -max_num_threads=512 -thread_warp_size=2", "conv2d_nchw_spatial_pack.mali", [["TENSOR", [1, 128, 7, 6], "float32"], ["TENSOR", [15, 128, 1, 1], "float32"], [1, 1], [0, 0, 0, 0], [1, 1], "float32"], {}], "config": {"index": 37331, "code_hash": null, "entity": [["tile_co", "sp", [-1, 1, 15]], ["tile_oh", "sp", [-1, 7, 1]], ["tile_ow", "sp", [-1, 3, 2]], ["reorder_0", "re", [0, 1, 2, 3, 4, 5, 6, 9, 7, 8]], ["ann_reduce", "an", ["none", "none"]], ["ann_spatial", "an", ["vec", "unroll", "unroll"]]]}, "result": [[0.0007866697459584295], 0, 95.61296391487122, 1630462344.5944717], "version": 0.2, "tvm_version": "0.8.dev0"}
{"input": ["opencl -keys=mali,opencl,gpu -device=mali -max_num_threads=512 -thread_warp_size=2", "conv2d_nchw_spatial_pack.mali", [["TENSOR", [1, 128, 7, 6], "float32"], ["TENSOR", [15, 128, 1, 1], "float32"], [1, 1], [0, 0, 0, 0], [1, 1], "float32"], {}], "config": {"index": 18674, "code_hash": null, "entity": [["tile_co", "sp", [-1, 1, 15]], ["tile_oh", "sp", [-1, 7, 1]], ["tile_ow", "sp", [-1, 2, 3]], ["reorder_0", "re", [0, 1, 2, 3, 4, 5, 6, 7, 8, 9]], ["ann_reduce", "an", ["unroll", "none"]], ["ann_spatial", "an", ["unroll", "none", "unroll"]]]}, "result": [[0.0008151755378151261], 0, 104.50073552131653, 1630462353.4927003], "version": 0.2, "tvm_version": "0.8.dev0"}
{"input": ["opencl -keys=mali,opencl,gpu -device=mali -max_num_threads=512 -thread_warp_size=2", "conv2d_nchw_spatial_pack.mali", [["TENSOR", [1, 128, 7, 6], "float32"], ["TENSOR", [15, 128, 1, 1], "float32"], [1, 1], [0, 0, 0, 0], [1, 1], "float32"], {}], "config": {"index": 23804, "code_hash": null, "entity": [["tile_co", "sp", [-1, 1, 15]], ["tile_oh", "sp", [-1, 7, 1]], ["tile_ow", "sp", [-1, 1, 6]], ["reorder_0", "re", [0, 1, 2, 3, 4, 5, 6, 9, 7, 8]], ["ann_reduce", "an", ["none", "none"]], ["ann_spatial", "an", ["unroll", "unroll", "unroll"]]]}, "result": [[0.0008145468750000001], 0, 113.84093642234802, 1630462362.8431], "version": 0.2, "tvm_version": "0.8.dev0"}
{"input": ["opencl -keys=mali,opencl,gpu -device=mali -max_num_threads=512 -thread_warp_size=2", "conv2d_nchw_spatial_pack.mali", [["TENSOR", [1, 128, 7, 6], "float32"], ["TENSOR", [15, 128, 1, 1], "float32"], [1, 1], [0, 0, 0, 0], [1, 1], "float32"], {}], "config": {"index": 8171, "code_hash": null, "entity": [["tile_co", "sp", [-1, 1, 15]], ["tile_oh", "sp", [-1, 7, 1]], ["tile_ow", "sp", [-1, 3, 2]], ["reorder_0", "re", [0, 1, 2, 3, 4, 5, 6, 9, 7, 8]], ["ann_reduce", "an", ["none", "none"]], ["ann_spatial", "an", ["none", "unroll", "unroll"]]]}, "result": [[0.0007688630222672065], 0, 122.63977408409119, 1630462371.6431046], "version": 0.2, "tvm_version": "0.8.dev0"}
{"input": ["opencl -keys=mali,opencl,gpu -device=mali -max_num_threads=512 -thread_warp_size=2", "conv2d_nchw_spatial_pack.mali", [["TENSOR", [1, 128, 7, 6], "float32"], ["TENSOR", [15, 128, 1, 1], "float32"], [1, 1], [0, 0, 0, 0], [1, 1], "float32"], {}], "config": {"index": 30284, "code_hash": null, "entity": [["tile_co", "sp", [-1, 1, 15]], ["tile_oh", "sp", [-1, 7, 1]], ["tile_ow", "sp", [-1, 3, 2]], ["reorder_0", "re", [0, 1, 2, 3, 4, 5, 6, 7, 8, 9]], ["ann_reduce", "an", ["unroll", "none"]], ["ann_spatial", "an", ["unroll", "vec", "unroll"]]]}, "result": [[0.0005463823931451613], 0, 131.43935465812683, 1630462380.4768474], "version": 0.2, "tvm_version": "0.8.dev0"}
{"input": ["opencl -keys=mali,opencl,gpu -device=mali -max_num_threads=512 -thread_warp_size=2", "conv2d_nchw_spatial_pack.mali", [["TENSOR", [1, 128, 7, 6], "float32"], ["TENSOR", [15, 128, 1, 1], "float32"], [1, 1], [0, 0, 0, 0], [1, 1], "float32"], {}], "config": {"index": 29312, "code_hash": null, "entity": [["tile_co", "sp", [-1, 1, 15]], ["tile_oh", "sp", [-1, 7, 1]], ["tile_ow", "sp", [-1, 3, 2]], ["reorder_0", "re", [0, 1, 2, 3, 4, 5, 6, 7, 8, 9]], ["ann_reduce", "an", ["none", "none"]], ["ann_spatial", "an", ["unroll", "vec", "unroll"]]]}, "result": [[0.0007750218756476684], 0, 140.9297525882721, 1630462389.963633], "version": 0.2, "tvm_version": "0.8.dev0"}
{"input": ["opencl -keys=mali,opencl,gpu -device=mali -max_num_threads=512 -thread_warp_size=2", "conv2d_nchw_spatial_pack.mali", [["TENSOR", [1, 128, 7, 6], "float32"], ["TENSOR", [15, 128, 1, 1], "float32"], [1, 1], [0, 0, 0, 0], [1, 1], "float32"], {}], "config": {"index": 24506, "code_hash": null, "entity": [["tile_co", "sp", [-1, 1, 15]], ["tile_oh", "sp", [-1, 7, 1]], ["tile_ow", "sp", [-1, 2, 3]], ["reorder_0", "re", [0, 1, 2, 3, 4, 5, 6, 7, 8, 9]], ["ann_reduce", "an", ["unroll", "none"]], ["ann_spatial", "an", ["unroll", "unroll", "unroll"]]]}, "result": [[0.001184911112820513], 0, 149.57000303268433, 1630462398.6241472], "version": 0.2, "tvm_version": "0.8.dev0"}
{"input": ["opencl -keys=mali,opencl,gpu -device=mali -max_num_threads=512 -thread_warp_size=2", "conv2d_nchw_spatial_pack.mali", [["TENSOR", [1, 128, 7, 6], "float32"], ["TENSOR", [15, 128, 1, 1], "float32"], [1, 1], [0, 0, 0, 0], [1, 1], "float32"], {}], "config": {"index": 24695, "code_hash": null, "entity": [["tile_co", "sp", [-1, 1, 15]], ["tile_oh", "sp", [-1, 7, 1]], ["tile_ow", "sp", [-1, 3, 2]], ["reorder_0", "re", [0, 1, 2, 3, 4, 5, 6, 9, 7, 8]], ["ann_reduce", "an", ["unroll", "none"]], ["ann_spatial", "an", ["unroll", "unroll", "unroll"]]]}, "result": [[0.0005306316767955801], 0, 16.405320167541504, 1630462415.391176], "version": 0.2, "tvm_version": "0.8.dev0"}
{"input": ["opencl -keys=mali,opencl,gpu -device=mali -max_num_threads=512 -thread_warp_size=2", "conv2d_nchw_spatial_pack.mali", [["TENSOR", [1, 128, 7, 6], "float32"], ["TENSOR", [15, 128, 1, 1], "float32"], [1, 1], [0, 0, 0, 0], [1, 1], "float32"], {}], "config": {"index": 23678, "code_hash": null, "entity": [["tile_co", "sp", [-1, 1, 15]], ["tile_oh", "sp", [-1, 1, 7]], ["tile_ow", "sp", [-1, 6, 1]], ["reorder_0", "re", [0, 1, 2, 3, 4, 5, 6, 9, 7, 8]], ["ann_reduce", "an", ["none", "none"]], ["ann_spatial", "an", ["unroll", "unroll", "unroll"]]]}, "result": [[0.0009733412073490814], 0, 25.95137310028076, 1630462424.937964], "version": 0.2, "tvm_version": "0.8.dev0"}
{"input": ["opencl -keys=mali,opencl,gpu -device=mali -max_num_threads=512 -thread_warp_size=2", "conv2d_nchw_spatial_pack.mali", [["TENSOR", [1, 128, 7, 6], "float32"], ["TENSOR", [15, 128, 1, 1], "float32"], [1, 1], [0, 0, 0, 0], [1, 1], "float32"], {}], "config": {"index": 24209, "code_hash": null, "entity": [["tile_co", "sp", [-1, 1, 15]], ["tile_oh", "sp", [-1, 7, 1]], ["tile_ow", "sp", [-1, 3, 2]], ["reorder_0", "re", [0, 1, 2, 3, 4, 5, 6, 9, 7, 8]], ["ann_reduce", "an", ["none", "unroll"]], ["ann_spatial", "an", ["unroll", "unroll", "unroll"]]]}, "result": [[0.0010054814795321637], 0, 35.13668870925903, 1630462434.1442819], "version": 0.2, "tvm_version": "0.8.dev0"}
{"input": ["opencl -keys=mali,opencl,gpu -device=mali -max_num_threads=512 -thread_warp_size=2", "conv2d_nchw_spatial_pack.mali", [["TENSOR", [1, 128, 7, 6], "float32"], ["TENSOR", [15, 128, 1, 1], "float32"], [1, 1], [0, 0, 0, 0], [1, 1], "float32"], {}], "config": {"index": 23777, "code_hash": null, "entity": [["tile_co", "sp", [-1, 1, 15]], ["tile_oh", "sp", [-1, 7, 1]], ["tile_ow", "sp", [-1, 2, 3]], ["reorder_0", "re", [0, 1, 2, 3, 4, 5, 6, 9, 7, 8]], ["ann_reduce", "an", ["none", "none"]], ["ann_spatial", "an", ["unroll", "unroll", "unroll"]]]}, "result": [[0.0011173434822335027], 0, 43.732595920562744, 1630462442.7468917], "version": 0.2, "tvm_version": "0.8.dev0"}
{"input": ["opencl -keys=mali,opencl,gpu -device=mali -max_num_threads=512 -thread_warp_size=2", "conv2d_nchw_spatial_pack.mali", [["TENSOR", [1, 128, 7, 6], "float32"], ["TENSOR", [15, 128, 1, 1], "float32"], [1, 1], [0, 0, 0, 0], [1, 1], "float32"], {}], "config": {"index": 24650, "code_hash": null, "entity": [["tile_co", "sp", [-1, 1, 15]], ["tile_oh", "sp", [-1, 1, 7]], ["tile_ow", "sp", [-1, 6, 1]], ["reorder_0", "re", [0, 1, 2, 3, 4, 5, 6, 9, 7, 8]], ["ann_reduce", "an", ["unroll", "none"]], ["ann_spatial", "an", ["unroll", "unroll", "unroll"]]]}, "result": [[0.0008956394970178926], 0, 53.38286232948303, 1630462452.3986955], "version": 0.2, "tvm_version": "0.8.dev0"}
{"input": ["opencl -keys=mali,opencl,gpu -device=mali -max_num_threads=512 -thread_warp_size=2", "conv2d_nchw_spatial_pack.mali", [["TENSOR", [1, 128, 7, 6], "float32"], ["TENSOR", [15, 128, 1, 1], "float32"], [1, 1], [0, 0, 0, 0], [1, 1], "float32"], {}], "config": {"index": 17702, "code_hash": null, "entity": [["tile_co", "sp", [-1, 1, 15]], ["tile_oh", "sp", [-1, 7, 1]], ["tile_ow", "sp", [-1, 2, 3]], ["reorder_0", "re", [0, 1, 2, 3, 4, 5, 6, 7, 8, 9]], ["ann_reduce", "an", ["none", "none"]], ["ann_spatial", "an", ["unroll", "none", "unroll"]]]}, "result": [[0.0007687249478527607], 0, 62.18549394607544, 1630462461.2254097], "version": 0.2, "tvm_version": "0.8.dev0"}
{"input": ["opencl -keys=mali,opencl,gpu -device=mali -max_num_threads=512 -thread_warp_size=2", "conv2d_nchw_spatial_pack.mali", [["TENSOR", [1, 128, 7, 6], "float32"], ["TENSOR", [15, 128, 1, 1], "float32"], [1, 1], [0, 0, 0, 0], [1, 1], "float32"], {}], "config": {"index": 8252, "code_hash": null, "entity": [["tile_co", "sp", [-1, 1, 15]], ["tile_oh", "sp", [-1, 7, 1]], ["tile_ow", "sp", [-1, 1, 6]], ["reorder_0", "re", [0, 1, 2, 3, 4, 5, 6, 9, 7, 8]], ["ann_reduce", "an", ["none", "none"]], ["ann_spatial", "an", ["none", "unroll", "unroll"]]]}, "result": [[0.0009246858290468987], 0, 71.77335023880005, 1630462470.810333], "version": 0.2, "tvm_version": "0.8.dev0"}
{"input": ["opencl -keys=mali,opencl,gpu -device=mali -max_num_threads=512 -thread_warp_size=2", "conv2d_nchw_spatial_pack.mali", [["TENSOR", [1, 128, 7, 6], "float32"], ["TENSOR", [15, 128, 1, 1], "float32"], [1, 1], [0, 0, 0, 0], [1, 1], "float32"], {}], "config": {"index": 23534, "code_hash": null, "entity": [["tile_co", "sp", [-1, 1, 15]], ["tile_oh", "sp", [-1, 7, 1]], ["tile_ow", "sp", [-1, 2, 3]], ["reorder_0", "re", [0, 1, 2, 3, 4, 5, 6, 7, 8, 9]], ["ann_reduce", "an", ["none", "none"]], ["ann_spatial", "an", ["unroll", "unroll", "unroll"]]]}, "result": [[0.0007915499137055839], 0, 80.33061504364014, 1630462479.3545804], "version": 0.2, "tvm_version": "0.8.dev0"}
{"input": ["opencl -keys=mali,opencl,gpu -device=mali -max_num_threads=512 -thread_warp_size=2", "conv2d_nchw_spatial_pack.mali", [["TENSOR", [1, 128, 7, 6], "float32"], ["TENSOR", [15, 128, 1, 1], "float32"], [1, 1], [0, 0, 0, 0], [1, 1], "float32"], {}], "config": {"index": 37412, "code_hash": null, "entity": [["tile_co", "sp", [-1, 1, 15]], ["tile_oh", "sp", [-1, 7, 1]], ["tile_ow", "sp", [-1, 1, 6]], ["reorder_0", "re", [0, 1, 2, 3, 4, 5, 6, 9, 7, 8]], ["ann_reduce", "an", ["none", "none"]], ["ann_spatial", "an", ["vec", "unroll", "unroll"]]]}, "result": [[0.0007774683349999999], 0, 89.39529061317444, 1630462488.4354103], "version": 0.2, "tvm_version": "0.8.dev0"}
{"input": ["opencl -keys=mali,opencl,gpu -device=mali -max_num_threads=512 -thread_warp_size=2", "conv2d_nchw_spatial_pack.mali", [["TENSOR", [1, 128, 7, 6], "float32"], ["TENSOR", [15, 128, 1, 1], "float32"], [1, 1], [0, 0, 0, 0], [1, 1], "float32"], {}], "config": {"index": 30770, "code_hash": null, "entity": [["tile_co", "sp", [-1, 1, 15]], ["tile_oh", "sp", [-1, 7, 1]], ["tile_ow", "sp", [-1, 3, 2]], ["reorder_0", "re", [0, 1, 2, 3, 4, 5, 6, 7, 8, 9]], ["ann_reduce", "an", ["unroll", "unroll"]], ["ann_spatial", "an", ["unroll", "vec", "unroll"]]]}, "result": [[0.0005371016473594548], 0, 98.44126963615417, 1630462497.500329], "version": 0.2, "tvm_version": "0.8.dev0"}
{"input": ["opencl -keys=mali,opencl,gpu -device=mali -max_num_threads=512 -thread_warp_size=2", "conv2d_nchw_spatial_pack.mali", [["TENSOR", [1, 128, 7, 6], "float32"], ["TENSOR", [15, 128, 1, 1], "float32"], [1, 1], [0, 0, 0, 0], [1, 1], "float32"], {}], "config": {"index": 29798, "code_hash": null, "entity": [["tile_co", "sp", [-1, 1, 15]], ["tile_oh", "sp", [-1, 7, 1]], ["tile_ow", "sp", [-1, 3, 2]], ["reorder_0", "re", [0, 1, 2, 3, 4, 5, 6, 7, 8, 9]], ["ann_reduce", "an", ["none", "unroll"]], ["ann_spatial", "an", ["unroll", "vec", "unroll"]]]}, "result": [[0.0007881715947826087], 0, 107.90812349319458, 1630462507.0021234], "version": 0.2, "tvm_version": "0.8.dev0"}
{"input": ["opencl -keys=mali,opencl,gpu -device=mali -max_num_threads=512 -thread_warp_size=2", "conv2d_nchw_spatial_pack.mali", [["TENSOR", [1, 128, 7, 6], "float32"], ["TENSOR", [15, 128, 1, 1], "float32"], [1, 1], [0, 0, 0, 0], [1, 1], "float32"], {}], "config": {"index": 38303, "code_hash": null, "entity": [["tile_co", "sp", [-1, 1, 15]], ["tile_oh", "sp", [-1, 7, 1]], ["tile_ow", "sp", [-1, 3, 2]], ["reorder_0", "re", [0, 1, 2, 3, 4, 5, 6, 9, 7, 8]], ["ann_reduce", "an", ["unroll", "none"]], ["ann_spatial", "an", ["vec", "unroll", "unroll"]]]}, "result": [[0.0012666471695906433], 0, 116.54278707504272, 1630462515.6485302], "version": 0.2, "tvm_version": "0.8.dev0"}
{"input": ["opencl -keys=mali,opencl,gpu -device=mali -max_num_threads=512 -thread_warp_size=2", "conv2d_nchw_spatial_pack.mali", [["TENSOR", [1, 128, 7, 6], "float32"], ["TENSOR", [15, 128, 1, 1], "float32"], [1, 1], [0, 0, 0, 0], [1, 1], "float32"], {}], "config": {"index": 8225, "code_hash": null, "entity": [["tile_co", "sp", [-1, 1, 15]], ["tile_oh", "sp", [-1, 7, 1]], ["tile_ow", "sp", [-1, 2, 3]], ["reorder_0", "re", [0, 1, 2, 3, 4, 5, 6, 9, 7, 8]], ["ann_reduce", "an", ["none", "none"]], ["ann_spatial", "an", ["none", "unroll", "unroll"]]]}, "result": [[0.0009437589743589742], 0, 125.22387409210205, 1630462524.3387966], "version": 0.2, "tvm_version": "0.8.dev0"}
{"input": ["opencl -keys=mali,opencl,gpu -device=mali -max_num_threads=512 -thread_warp_size=2", "conv2d_nchw_spatial_pack.mali", [["TENSOR", [1, 128, 7, 6], "float32"], ["TENSOR", [15, 128, 1, 1], "float32"], [1, 1], [0, 0, 0, 0], [1, 1], "float32"], {}], "config": {"index": 23732, "code_hash": null, "entity": [["tile_co", "sp", [-1, 1, 15]], ["tile_oh", "sp", [-1, 1, 7]], ["tile_ow", "sp", [-1, 3, 2]], ["reorder_0", "re", [0, 1, 2, 3, 4, 5, 6, 9, 7, 8]], ["ann_reduce", "an", ["none", "none"]], ["ann_spatial", "an", ["unroll", "unroll", "unroll"]]]}, "result": [[0.0014770282848484849], 0, 138.14759945869446, 1630462537.2600222], "version": 0.2, "tvm_version": "0.8.dev0"}
{"input": ["opencl -keys=mali,opencl,gpu -device=mali -max_num_threads=512 -thread_warp_size=2", "conv2d_nchw_spatial_pack.mali", [["TENSOR", [1, 128, 7, 6], "float32"], ["TENSOR", [15, 128, 1, 1], "float32"], [1, 1], [0, 0, 0, 0], [1, 1], "float32"], {}], "config": {"index": 18647, "code_hash": null, "entity": [["tile_co", "sp", [-1, 1, 15]], ["tile_oh", "sp", [-1, 7, 1]], ["tile_ow", "sp", [-1, 1, 3]], ["reorder_0", "re", [0, 1, 2, 3, 4, 5, 6, 7, 8, 9]], ["ann_reduce", "an", ["unroll", "none"]], ["ann_spatial", "an", ["unroll", "none", "unroll"]]]}, "result": [[0.0025273333333333333], 0, 143.79977226257324, 1630462542.937125], "version": 0.2, "tvm_version": "0.8.dev0"}
{"input": ["opencl -keys=mali,opencl,gpu -device=mali -max_num_threads=512 -thread_warp_size=2", "conv2d_nchw_spatial_pack.mali", [["TENSOR", [1, 128, 7, 6], "float32"], ["TENSOR", [15, 128, 1, 1], "float32"], [1, 1], [0, 0, 0, 0], [1, 1], "float32"], {}], "config": {"index": 23750, "code_hash": null, "entity": [["tile_co", "sp", [-1, 1, 15]], ["tile_oh", "sp", [-1, 7, 1]], ["tile_ow", "sp", [-1, 1, 3]], ["reorder_0", "re", [0, 1, 2, 3, 4, 5, 6, 9, 7, 8]], ["ann_reduce", "an", ["none", "none"]], ["ann_spatial", "an", ["unroll", "unroll", "unroll"]]]}, "result": [[0.0006709560229445507], 0, 152.62434601783752, 1630462551.7722442], "version": 0.2, "tvm_version": "0.8.dev0"}
{"input": ["opencl -keys=mali,opencl,gpu -device=mali -max_num_threads=512 -thread_warp_size=2", "conv2d_nchw_spatial_pack.mali", [["TENSOR", [1, 128, 7, 6], "float32"], ["TENSOR", [15, 128, 1, 1], "float32"], [1, 1], [0, 0, 0, 0], [1, 1], "float32"], {}], "config": {"index": 24479, "code_hash": null, "entity": [["tile_co", "sp", [-1, 1, 15]], ["tile_oh", "sp", [-1, 7, 1]], ["tile_ow", "sp", [-1, 1, 3]], ["reorder_0", "re", [0, 1, 2, 3, 4, 5, 6, 7, 8, 9]], ["ann_reduce", "an", ["unroll", "none"]], ["ann_spatial", "an", ["unroll", "unroll", "unroll"]]]}, "result": [[0.0007345233393739703], 0, 8.942489385604858, 1630462561.062804], "version": 0.2, "tvm_version": "0.8.dev0"}
{"input": ["opencl -keys=mali,opencl,gpu -device=mali -max_num_threads=512 -thread_warp_size=2", "conv2d_nchw_spatial_pack.mali", [["TENSOR", [1, 128, 7, 6], "float32"], ["TENSOR", [15, 128, 1, 1], "float32"], [1, 1], [0, 0, 0, 0], [1, 1], "float32"], {}], "config": {"index": 37817, "code_hash": null, "entity": [["tile_co", "sp", [-1, 1, 15]], ["tile_oh", "sp", [-1, 7, 1]], ["tile_ow", "sp", [-1, 3, 2]], ["reorder_0", "re", [0, 1, 2, 3, 4, 5, 6, 9, 7, 8]], ["ann_reduce", "an", ["none", "unroll"]], ["ann_spatial", "an", ["vec", "unroll", "unroll"]]]}, "result": [[0.000606894492173913], 0, 18.00723934173584, 1630462570.141889], "version": 0.2, "tvm_version": "0.8.dev0"}
{"input": ["opencl -keys=mali,opencl,gpu -device=mali -max_num_threads=512 -thread_warp_size=2", "conv2d_nchw_spatial_pack.mali", [["TENSOR", [1, 128, 7, 6], "float32"], ["TENSOR", [15, 128, 1, 1], "float32"], [1, 1], [0, 0, 0, 0], [1, 1], "float32"], {}], "config": {"index": 24776, "code_hash": null, "entity": [["tile_co", "sp", [-1, 1, 15]], ["tile_oh", "sp", [-1, 7, 1]], ["tile_ow", "sp", [-1, 1, 6]], ["reorder_0", "re", [0, 1, 2, 3, 4, 5, 6, 9, 7, 8]], ["ann_reduce", "an", ["unroll", "none"]], ["ann_spatial", "an", ["unroll", "unroll", "unroll"]]]}, "result": [[0.0007762183891625615], 0, 27.2312593460083, 1630462579.3684626], "version": 0.2, "tvm_version": "0.8.dev0"}
{"input": ["opencl -keys=mali,opencl,gpu -device=mali -max_num_threads=512 -thread_warp_size=2", "conv2d_nchw_spatial_pack.mali", [["TENSOR", [1, 128, 7, 6], "float32"], ["TENSOR", [15, 128, 1, 1], "float32"], [1, 1], [0, 0, 0, 0], [1, 1], "float32"], {}], "config": {"index": 37385, "code_hash": null, "entity": [["tile_co", "sp", [-1, 1, 15]], ["tile_oh", "sp", [-1, 7, 1]], ["tile_ow", "sp", [-1, 2, 3]], ["reorder_0", "re", [0, 1, 2, 3, 4, 5, 6, 9, 7, 8]], ["ann_reduce", "an", ["none", "none"]], ["ann_spatial", "an", ["vec", "unroll", "unroll"]]]}, "result": [[0.0010250362931323283], 0, 36.45863175392151, 1630462588.6121783], "version": 0.2, "tvm_version": "0.8.dev0"}
{"input": ["opencl -keys=mali,opencl,gpu -device=mali -max_num_threads=512 -thread_warp_size=2", "conv2d_nchw_spatial_pack.mali", [["TENSOR", [1, 128, 7, 6], "float32"], ["TENSOR", [15, 128, 1, 1], "float32"], [1, 1], [0, 0, 0, 0], [1, 1], "float32"], {}], "config": {"index": 9143, "code_hash": null, "entity": [["tile_co", "sp", [-1, 1, 15]], ["tile_oh", "sp", [-1, 7, 1]], ["tile_ow", "sp", [-1, 3, 2]], ["reorder_0", "re", [0, 1, 2, 3, 4, 5, 6, 9, 7, 8]], ["ann_reduce", "an", ["unroll", "none"]], ["ann_spatial", "an", ["none", "unroll", "unroll"]]]}, "result": [[0.0013256417586206895], 0, 45.0509238243103, 1630462597.2174242], "version": 0.2, "tvm_version": "0.8.dev0"}
{"input": ["opencl -keys=mali,opencl,gpu -device=mali -max_num_threads=512 -thread_warp_size=2", "conv2d_nchw_spatial_pack.mali", [["TENSOR", [1, 128, 7, 6], "float32"], ["TENSOR", [15, 128, 1, 1], "float32"], [1, 1], [0, 0, 0, 0], [1, 1], "float32"], {}], "config": {"index": 19160, "code_hash": null, "entity": [["tile_co", "sp", [-1, 1, 15]], ["tile_oh", "sp", [-1, 7, 1]], ["tile_ow", "sp", [-1, 2, 3]], ["reorder_0", "re", [0, 1, 2, 3, 4, 5, 6, 7, 8, 9]], ["ann_reduce", "an", ["unroll", "unroll"]], ["ann_spatial", "an", ["unroll", "none", "unroll"]]]}, "result": [[0.000720074585635359], 0, 53.89124369621277, 1630462606.0492625], "version": 0.2, "tvm_version": "0.8.dev0"}
{"input": ["opencl -keys=mali,opencl,gpu -device=mali -max_num_threads=512 -thread_warp_size=2", "conv2d_nchw_spatial_pack.mali", [["TENSOR", [1, 128, 7, 6], "float32"], ["TENSOR", [15, 128, 1, 1], "float32"], [1, 1], [0, 0, 0, 0], [1, 1], "float32"], {}], "config": {"index": 8657, "code_hash": null, "entity": [["tile_co", "sp", [-1, 1, 15]], ["tile_oh", "sp", [-1, 7, 1]], ["tile_ow", "sp", [-1, 3, 2]], ["reorder_0", "re", [0, 1, 2, 3, 4, 5, 6, 9, 7, 8]], ["ann_reduce", "an", ["none", "unroll"]], ["ann_spatial", "an", ["none", "unroll", "unroll"]]]}, "result": [[0.0005456883542168674], 0, 62.64197278022766, 1630462614.8157444], "version": 0.2, "tvm_version": "0.8.dev0"}
{"input": ["opencl -keys=mali,opencl,gpu -device=mali -max_num_threads=512 -thread_warp_size=2", "conv2d_nchw_spatial_pack.mali", [["TENSOR", [1, 128, 7, 6], "float32"], ["TENSOR", [15, 128, 1, 1], "float32"], [1, 1], [0, 0, 0, 0], [1, 1], "float32"], {}], "config": {"index": 24992, "code_hash": null, "entity": [["tile_co", "sp", [-1, 1, 15]], ["tile_oh", "sp", [-1, 7, 1]], ["tile_ow", "sp", [-1, 2, 3]], ["reorder_0", "re", [0, 1, 2, 3, 4, 5, 6, 7, 8, 9]], ["ann_reduce", "an", ["unroll", "unroll"]], ["ann_spatial", "an", ["unroll", "unroll", "unroll"]]]}, "result": [[0.0005391293945147679], 0, 71.59380769729614, 1630462623.7584407], "version": 0.2, "tvm_version": "0.8.dev0"}
{"input": ["opencl -keys=mali,opencl,gpu -device=mali -max_num_threads=512 -thread_warp_size=2", "conv2d_nchw_spatial_pack.mali", [["TENSOR", [1, 128, 7, 6], "float32"], ["TENSOR", [15, 128, 1, 1], "float32"], [1, 1], [0, 0, 0, 0], [1, 1], "float32"], {}], "config": {"index": 8126, "code_hash": null, "entity": [["tile_co", "sp", [-1, 1, 15]], ["tile_oh", "sp", [-1, 1, 7]], ["tile_ow", "sp", [-1, 6, 1]], ["reorder_0", "re", [0, 1, 2, 3, 4, 5, 6, 9, 7, 8]], ["ann_reduce", "an", ["none", "none"]], ["ann_spatial", "an", ["none", "unroll", "unroll"]]]}, "result": [[0.0006972629701492537], 0, 81.02766370773315, 1630462633.2185075], "version": 0.2, "tvm_version": "0.8.dev0"}
{"input": ["opencl -keys=mali,opencl,gpu -device=mali -max_num_threads=512 -thread_warp_size=2", "conv2d_nchw_spatial_pack.mali", [["TENSOR", [1, 128, 7, 6], "float32"], ["TENSOR", [15, 128, 1, 1], "float32"], [1, 1], [0, 0, 0, 0], [1, 1], "float32"], {}], "config": {"index": 24164, "code_hash": null, "entity": [["tile_co", "sp", [-1, 1, 15]], ["tile_oh", "sp", [-1, 1, 7]], ["tile_ow", "sp", [-1, 6, 1]], ["reorder_0", "re", [0, 1, 2, 3, 4, 5, 6, 9, 7, 8]], ["ann_reduce", "an", ["none", "unroll"]], ["ann_spatial", "an", ["unroll", "unroll", "unroll"]]]}, "result": [[0.0009703501094091904], 0, 90.7696361541748, 1630462642.960929], "version": 0.2, "tvm_version": "0.8.dev0"}
{"input": ["opencl -keys=mali,opencl,gpu -device=mali -max_num_threads=512 -thread_warp_size=2", "conv2d_nchw_spatial_pack.mali", [["TENSOR", [1, 128, 7, 6], "float32"], ["TENSOR", [15, 128, 1, 1], "float32"], [1, 1], [0, 0, 0, 0], [1, 1], "float32"], {}], "config": {"index": 17675, "code_hash": null, "entity": [["tile_co", "sp", [-1, 1, 15]], ["tile_oh", "sp", [-1, 7, 1]], ["tile_ow", "sp", [-1, 1, 3]], ["reorder_0", "re", [0, 1, 2, 3, 4, 5, 6, 7, 8, 9]], ["ann_reduce", "an", ["none", "none"]], ["ann_spatial", "an", ["unroll", "none", "unroll"]]]}, "result": [[0.0007137977957957958], 0, 99.52772688865662, 1630462651.7381718], "version": 0.2, "tvm_version": "0.8.dev0"}
{"input": ["opencl -keys=mali,opencl,gpu -device=mali -max_num_threads=512 -thread_warp_size=2", "conv2d_nchw_spatial_pack.mali", [["TENSOR", [1, 128, 7, 6], "float32"], ["TENSOR", [15, 128, 1, 1], "float32"], [1, 1], [0, 0, 0, 0], [1, 1], "float32"], {}], "config": {"index": 25181, "code_hash": null, "entity": [["tile_co", "sp", [-1, 1, 15]], ["tile_oh", "sp", [-1, 7, 1]], ["tile_ow", "sp", [-1, 3, 2]], ["reorder_0", "re", [0, 1, 2, 3, 4, 5, 6, 9, 7, 8]], ["ann_reduce", "an", ["unroll", "unroll"]], ["ann_spatial", "an", ["unroll", "unroll", "unroll"]]]}, "result": [[0.0010437368421052633], 0, 108.78338193893433, 1630462661.0226116], "version": 0.2, "tvm_version": "0.8.dev0"}
{"input": ["opencl -keys=mali,opencl,gpu -device=mali -max_num_threads=512 -thread_warp_size=2", "conv2d_nchw_spatial_pack.mali", [["TENSOR", [1, 128, 7, 6], "float32"], ["TENSOR", [15, 128, 1, 1], "float32"], [1, 1], [0, 0, 0, 0], [1, 1], "float32"], {}], "config": {"index": 8198, "code_hash": null, "entity": [["tile_co", "sp", [-1, 1, 15]], ["tile_oh", "sp", [-1, 7, 1]], ["tile_ow", "sp", [-1, 1, 3]], ["reorder_0", "re", [0, 1, 2, 3, 4, 5, 6, 9, 7, 8]], ["ann_reduce", "an", ["none", "none"]], ["ann_spatial", "an", ["none", "unroll", "unroll"]]]}, "result": [[0.0006713671410459587], 0, 118.02596545219421, 1630462670.2618976], "version": 0.2, "tvm_version": "0.8.dev0"}
{"input": ["opencl -keys=mali,opencl,gpu -device=mali -max_num_threads=512 -thread_warp_size=2", "conv2d_nchw_spatial_pack.mali", [["TENSOR", [1, 128, 7, 6], "float32"], ["TENSOR", [15, 128, 1, 1], "float32"], [1, 1], [0, 0, 0, 0], [1, 1], "float32"], {}], "config": {"index": 24749, "code_hash": null, "entity": [["tile_co", "sp", [-1, 1, 15]], ["tile_oh", "sp", [-1, 7, 1]], ["tile_ow", "sp", [-1, 2, 3]], ["reorder_0", "re", [0, 1, 2, 3, 4, 5, 6, 9, 7, 8]], ["ann_reduce", "an", ["unroll", "none"]], ["ann_spatial", "an", ["unroll", "unroll", "unroll"]]]}, "result": [[0.0008816255144032922], 0, 126.68133497238159, 1630462678.939526], "version": 0.2, "tvm_version": "0.8.dev0"}
{"input": ["opencl -keys=mali,opencl,gpu -device=mali -max_num_threads=512 -thread_warp_size=2", "conv2d_nchw_spatial_pack.mali", [["TENSOR", [1, 128, 7, 6], "float32"], ["TENSOR", [15, 128, 1, 1], "float32"], [1, 1], [0, 0, 0, 0], [1, 1], "float32"], {}], "config": {"index": 37358, "code_hash": null, "entity": [["tile_co", "sp", [-1, 1, 15]], ["tile_oh", "sp", [-1, 7, 1]], ["tile_ow", "sp", [-1, 1, 3]], ["reorder_0", "re", [0, 1, 2, 3, 4, 5, 6, 9, 7, 8]], ["ann_reduce", "an", ["none", "none"]], ["ann_spatial", "an", ["vec", "unroll", "unroll"]]]}, "result": [[0.0008836066945606694], 0, 135.29356956481934, 1630462687.568913], "version": 0.2, "tvm_version": "0.8.dev0"}
{"input": ["opencl -keys=mali,opencl,gpu -device=mali -max_num_threads=512 -thread_warp_size=2", "conv2d_nchw_spatial_pack.mali", [["TENSOR", [1, 128, 7, 6], "float32"], ["TENSOR", [15, 128, 1, 1], "float32"], [1, 1], [0, 0, 0, 0], [1, 1], "float32"], {}], "config": {"index": 23507, "code_hash": null, "entity": [["tile_co", "sp", [-1, 1, 15]], ["tile_oh", "sp", [-1, 7, 1]], ["tile_ow", "sp", [-1, 1, 3]], ["reorder_0", "re", [0, 1, 2, 3, 4, 5, 6, 7, 8, 9]], ["ann_reduce", "an", ["none", "none"]], ["ann_spatial", "an", ["unroll", "unroll", "unroll"]]]}, "result": [[0.0007195765765765766], 0, 144.09614086151123, 1630462696.377891], "version": 0.2, "tvm_version": "0.8.dev0"}
{"input": ["opencl -keys=mali,opencl,gpu -device=mali -max_num_threads=512 -thread_warp_size=2", "conv2d_nchw_spatial_pack.mali", [["TENSOR", [1, 128, 7, 6], "float32"], ["TENSOR", [15, 128, 1, 1], "float32"], [1, 1], [0, 0, 0, 0], [1, 1], "float32"], {}], "config": {"index": 23651, "code_hash": null, "entity": [["tile_co", "sp", [-1, 1, 15]], ["tile_oh", "sp", [-1, 1, 7]], ["tile_ow", "sp", [-1, 3, 1]], ["reorder_0", "re", [0, 1, 2, 3, 4, 5, 6, 9, 7, 8]], ["ann_reduce", "an", ["none", "none"]], ["ann_spatial", "an", ["unroll", "unroll", "unroll"]]]}, "result": [[0.0008291756236559139], 0, 22.26842999458313, 1630462718.9765093], "version": 0.2, "tvm_version": "0.8.dev0"}
{"input": ["opencl -keys=mali,opencl,gpu -device=mali -max_num_threads=512 -thread_warp_size=2", "conv2d_nchw_spatial_pack.mali", [["TENSOR", [1, 128, 7, 6], "float32"], ["TENSOR", [15, 128, 1, 1], "float32"], [1, 1], [0, 0, 0, 0], [1, 1], "float32"], {}], "config": {"index": 9098, "code_hash": null, "entity": [["tile_co", "sp", [-1, 1, 15]], ["tile_oh", "sp", [-1, 1, 7]], ["tile_ow", "sp", [-1, 6, 1]], ["reorder_0", "re", [0, 1, 2, 3, 4, 5, 6, 9, 7, 8]], ["ann_reduce", "an", ["unroll", "none"]], ["ann_spatial", "an", ["none", "unroll", "unroll"]]]}, "result": [[0.0008750767032258065], 0, 31.75209665298462, 1630462728.4833255], "version": 0.2, "tvm_version": "0.8.dev0"}
{"input": ["opencl -keys=mali,opencl,gpu -device=mali -max_num_threads=512 -thread_warp_size=2", "conv2d_nchw_spatial_pack.mali", [["TENSOR", [1, 128, 7, 6], "float32"], ["TENSOR", [15, 128, 1, 1], "float32"], [1, 1], [0, 0, 0, 0], [1, 1], "float32"], {}], "config": {"index": 25136, "code_hash": null, "entity": [["tile_co", "sp", [-1, 1, 15]], ["tile_oh", "sp", [-1, 1, 7]], ["tile_ow", "sp", [-1, 6, 1]], ["reorder_0", "re", [0, 1, 2, 3, 4, 5, 6, 9, 7, 8]], ["ann_reduce", "an", ["unroll", "unroll"]], ["ann_spatial", "an", ["unroll", "unroll", "unroll"]]]}, "result": [[0.0009048839667721519], 0, 41.32859230041504, 1630462738.0576746], "version": 0.2, "tvm_version": "0.8.dev0"}
{"input": ["opencl -keys=mali,opencl,gpu -device=mali -max_num_threads=512 -thread_warp_size=2", "conv2d_nchw_spatial_pack.mali", [["TENSOR", [1, 128, 7, 6], "float32"], ["TENSOR", [15, 128, 1, 1], "float32"], [1, 1], [0, 0, 0, 0], [1, 1], "float32"], {}], "config": {"index": 9224, "code_hash": null, "entity": [["tile_co", "sp", [-1, 1, 15]], ["tile_oh", "sp", [-1, 7, 1]], ["tile_ow", "sp", [-1, 1, 6]], ["reorder_0", "re", [0, 1, 2, 3, 4, 5, 6, 9, 7, 8]], ["ann_reduce", "an", ["unroll", "none"]], ["ann_spatial", "an", ["none", "unroll", "unroll"]]]}, "result": [[0.0009354126976190476], 0, 50.40547275543213, 1630462747.1475728], "version": 0.2, "tvm_version": "0.8.dev0"}
{"input": ["opencl -keys=mali,opencl,gpu -device=mali -max_num_threads=512 -thread_warp_size=2", "conv2d_nchw_spatial_pack.mali", [["TENSOR", [1, 128, 7, 6], "float32"], ["TENSOR", [15, 128, 1, 1], "float32"], [1, 1], [0, 0, 0, 0], [1, 1], "float32"], {}], "config": {"index": 24704, "code_hash": null, "entity": [["tile_co", "sp", [-1, 1, 15]], ["tile_oh", "sp", [-1, 1, 7]], ["tile_ow", "sp", [-1, 3, 2]], ["reorder_0", "re", [0, 1, 2, 3, 4, 5, 6, 9, 7, 8]], ["ann_reduce", "an", ["unroll", "none"]], ["ann_spatial", "an", ["unroll", "unroll", "unroll"]]]}, "result": [[0.0014450890310559006], 0, 63.54850935935974, 1630462760.2684736], "version": 0.2, "tvm_version": "0.8.dev0"}
{"input": ["opencl -keys=mali,opencl,gpu -device=mali -max_num_threads=512 -thread_warp_size=2", "conv2d_nchw_spatial_pack.mali", [["TENSOR", [1, 128, 7, 6], "float32"], ["TENSOR", [15, 128, 1, 1], "float32"], [1, 1], [0, 0, 0, 0], [1, 1], "float32"], {}], "config": {"index": 23731, "code_hash": null, "entity": [["tile_co", "sp", [-1, 3, 5]], ["tile_oh", "sp", [-1, 1, 7]], ["tile_ow", "sp", [-1, 3, 2]], ["reorder_0", "re", [0, 1, 2, 3, 4, 5, 6, 9, 7, 8]], ["ann_reduce", "an", ["none", "none"]], ["ann_spatial", "an", ["unroll", "unroll", "unroll"]]]}, "result": [[0.000826588513321492], 0, 69.69418454170227, 1630462766.459759], "version": 0.2, "tvm_version": "0.8.dev0"}
{"input": ["opencl -keys=mali,opencl,gpu -device=mali -max_num_threads=512 -thread_warp_size=2", "conv2d_nchw_spatial_pack.mali", [["TENSOR", [1, 128, 7, 6], "float32"], ["TENSOR", [15, 128, 1, 1], "float32"], [1, 1], [0, 0, 0, 0], [1, 1], "float32"], {}], "config": {"index": 18188, "code_hash": null, "entity": [["tile_co", "sp", [-1, 1, 15]], ["tile_oh", "sp", [-1, 7, 1]], ["tile_ow", "sp", [-1, 2, 3]], ["reorder_0", "re", [0, 1, 2, 3, 4, 5, 6, 7, 8, 9]], ["ann_reduce", "an", ["none", "unroll"]], ["ann_spatial", "an", ["unroll", "none", "unroll"]]]}, "result": [[0.0010049112564935066], 0, 78.60475897789001, 1630462775.3849862], "version": 0.2, "tvm_version": "0.8.dev0"}
{"input": ["opencl -keys=mali,opencl,gpu -device=mali -max_num_threads=512 -thread_warp_size=2", "conv2d_nchw_spatial_pack.mali", [["TENSOR", [1, 128, 7, 6], "float32"], ["TENSOR", [15, 128, 1, 1], "float32"], [1, 1], [0, 0, 0, 0], [1, 1], "float32"], {}], "config": {"index": 24623, "code_hash": null, "entity": [["tile_co", "sp", [-1, 1, 15]], ["tile_oh", "sp", [-1, 1, 7]], ["tile_ow", "sp", [-1, 3, 1]], ["reorder_0", "re", [0, 1, 2, 3, 4, 5, 6, 9, 7, 8]], ["ann_reduce", "an", ["unroll", "none"]], ["ann_spatial", "an", ["unroll", "unroll", "unroll"]]]}, "result": [[0.0010997433155080212], 0, 88.1127257347107, 1630462784.8646784], "version": 0.2, "tvm_version": "0.8.dev0"}
{"input": ["opencl -keys=mali,opencl,gpu -device=mali -max_num_threads=512 -thread_warp_size=2", "conv2d_nchw_spatial_pack.mali", [["TENSOR", [1, 128, 7, 6], "float32"], ["TENSOR", [15, 128, 1, 1], "float32"], [1, 1], [0, 0, 0, 0], [1, 1], "float32"], {}], "config": {"index": 24020, "code_hash": null, "entity": [["tile_co", "sp", [-1, 1, 15]], ["tile_oh", "sp", [-1, 7, 1]], ["tile_ow", "sp", [-1, 2, 3]], ["reorder_0", "re", [0, 1, 2, 3, 4, 5, 6, 7, 8, 9]], ["ann_reduce", "an", ["none", "unroll"]], ["ann_spatial", "an", ["unroll", "unroll", "unroll"]]]}, "result": [[0.000697908350305499], 0, 96.73034477233887, 1630462793.5227776], "version": 0.2, "tvm_version": "0.8.dev0"}
{"input": ["opencl -keys=mali,opencl,gpu -device=mali -max_num_threads=512 -thread_warp_size=2", "conv2d_nchw_spatial_pack.mali", [["TENSOR", [1, 128, 7, 6], "float32"], ["TENSOR", [15, 128, 1, 1], "float32"], [1, 1], [0, 0, 0, 0], [1, 1], "float32"], {}], "config": {"index": 38384, "code_hash": null, "entity": [["tile_co", "sp", [-1, 1, 15]], ["tile_oh", "sp", [-1, 7, 1]], ["tile_ow", "sp", [-1, 1, 6]], ["reorder_0", "re", [0, 1, 2, 3, 4, 5, 6, 9, 7, 8]], ["ann_reduce", "an", ["unroll", "none"]], ["ann_spatial", "an", ["vec", "unroll", "unroll"]]]}, "result": [[0.001055722013207547], 0, 106.94807362556458, 1630462803.7326415], "version": 0.2, "tvm_version": "0.8.dev0"}
{"input": ["opencl -keys=mali,opencl,gpu -device=mali -max_num_threads=512 -thread_warp_size=2", "conv2d_nchw_spatial_pack.mali", [["TENSOR", [1, 128, 7, 6], "float32"], ["TENSOR", [15, 128, 1, 1], "float32"], [1, 1], [0, 0, 0, 0], [1, 1], "float32"], {}], "config": {"index": 24569, "code_hash": null, "entity": [["tile_co", "sp", [-1, 1, 15]], ["tile_oh", "sp", [-1, 1, 7]], ["tile_ow", "sp", [-1, 1, 1]], ["reorder_0", "re", [0, 1, 2, 3, 4, 5, 6, 9, 7, 8]], ["ann_reduce", "an", ["unroll", "none"]], ["ann_spatial", "an", ["unroll", "unroll", "unroll"]]]}, "result": [[0.0008871333340206185], 0, 116.3817548751831, 1630462813.1913123], "version": 0.2, "tvm_version": "0.8.dev0"}
{"input": ["opencl -keys=mali,opencl,gpu -device=mali -max_num_threads=512 -thread_warp_size=2", "conv2d_nchw_spatial_pack.mali", [["TENSOR", [1, 128, 7, 6], "float32"], ["TENSOR", [15, 128, 1, 1], "float32"], [1, 1], [0, 0, 0, 0], [1, 1], "float32"], {}], "config": {"index": 17846, "code_hash": null, "entity": [["tile_co", "sp", [-1, 1, 15]], ["tile_oh", "sp", [-1, 1, 7]], ["tile_ow", "sp", [-1, 6, 1]], ["reorder_0", "re", [0, 1, 2, 3, 4, 5, 6, 9, 7, 8]], ["ann_reduce", "an", ["none", "none"]], ["ann_spatial", "an", ["unroll", "none", "unroll"]]]}, "result": [[0.0009348289172185429], 0, 125.71667790412903, 1630462822.5396295], "version": 0.2, "tvm_version": "0.8.dev0"}
{"input": ["opencl -keys=mali,opencl,gpu -device=mali -max_num_threads=512 -thread_warp_size=2", "conv2d_nchw_spatial_pack.mali", [["TENSOR", [1, 128, 7, 6], "float32"], ["TENSOR", [15, 128, 1, 1], "float32"], [1, 1], [0, 0, 0, 0], [1, 1], "float32"], {}], "config": {"index": 9197, "code_hash": null, "entity": [["tile_co", "sp", [-1, 1, 15]], ["tile_oh", "sp", [-1, 7, 1]], ["tile_ow", "sp", [-1, 2, 3]], ["reorder_0", "re", [0, 1, 2, 3, 4, 5, 6, 9, 7, 8]], ["ann_reduce", "an", ["unroll", "none"]], ["ann_spatial", "an", ["none", "unroll", "unroll"]]]}, "result": [[0.0006504079696394686], 0, 134.3139865398407, 1630462831.1583915], "version": 0.2, "tvm_version": "0.8.dev0"}
{"input": ["opencl -keys=mali,opencl,gpu -device=mali -max_num_threads=512 -thread_warp_size=2", "conv2d_nchw_spatial_pack.mali", [["TENSOR", [1, 128, 7, 6], "float32"], ["TENSOR", [15, 128, 1, 1], "float32"], [1, 1], [0, 0, 0, 0], [1, 1], "float32"], {}], "config": {"index": 37129, "code_hash": null, "entity": [["tile_co", "sp", [-1, 1, 3]], ["tile_oh", "sp", [-1, 1, 1]], ["tile_ow", "sp", [-1, 2, 3]], ["reorder_0", "re", [0, 1, 2, 3, 4, 5, 6, 7, 8, 9]], ["ann_reduce", "an", ["none", "none"]], ["ann_spatial", "an", ["vec", "unroll", "unroll"]]]}, "result": [[0.0009578490344202898], 0, 143.34811282157898, 1630462840.217712], "version": 0.2, "tvm_version": "0.8.dev0"}
{"input": ["opencl -keys=mali,opencl,gpu -device=mali -max_num_threads=512 -thread_warp_size=2", "conv2d_nchw_spatial_pack.mali", [["TENSOR", [1, 128, 7, 6], "float32"], ["TENSOR", [15, 128, 1, 1], "float32"], [1, 1], [0, 0, 0, 0], [1, 1], "float32"], {}], "config": {"index": 3599, "code_hash": null, "entity": [["tile_co", "sp", [-1, 1, 15]], ["tile_oh", "sp", [-1, 1, 1]], ["tile_ow", "sp", [-1, 2, 3]], ["reorder_0", "re", [0, 1, 2, 3, 4, 5, 6, 7, 8, 9]], ["ann_reduce", "an", ["unroll", "unroll"]], ["ann_spatial", "an", ["none", "none", "unroll"]]]}, "result": [[0.0006821076769662922], 0, 151.80387949943542, 1630462848.6828022], "version": 0.2, "tvm_version": "0.8.dev0"}
{"input": ["opencl -keys=mali,opencl,gpu -device=mali -max_num_threads=512 -thread_warp_size=2", "conv2d_nchw_spatial_pack.mali", [["TENSOR", [1, 128, 7, 6], "float32"], ["TENSOR", [15, 128, 1, 1], "float32"], [1, 1], [0, 0, 0, 0], [1, 1], "float32"], {}], "config": {"index": 23993, "code_hash": null, "entity": [["tile_co", "sp", [-1, 1, 15]], ["tile_oh", "sp", [-1, 7, 1]], ["tile_ow", "sp", [-1, 1, 3]], ["reorder_0", "re", [0, 1, 2, 3, 4, 5, 6, 7, 8, 9]], ["ann_reduce", "an", ["none", "unroll"]], ["ann_spatial", "an", ["unroll", "unroll", "unroll"]]]}, "result": [[0.001179218274111675], 0, 16.970712184906006, 1630462873.983664], "version": 0.2, "tvm_version": "0.8.dev0"}
{"input": ["opencl -keys=mali,opencl,gpu -device=mali -max_num_threads=512 -thread_warp_size=2", "conv2d_nchw_spatial_pack.mali", [["TENSOR", [1, 128, 7, 6], "float32"], ["TENSOR", [15, 128, 1, 1], "float32"], [1, 1], [0, 0, 0, 0], [1, 1], "float32"], {}], "config": {"index": 8441, "code_hash": null, "entity": [["tile_co", "sp", [-1, 1, 15]], ["tile_oh", "sp", [-1, 7, 1]], ["tile_ow", "sp", [-1, 1, 3]], ["reorder_0", "re", [0, 1, 2, 3, 4, 5, 6, 7, 8, 9]], ["ann_reduce", "an", ["none", "unroll"]], ["ann_spatial", "an", ["none", "unroll", "unroll"]]]}, "result": [[0.0007708650992167102], 0, 25.659545183181763, 1630462882.6858737], "version": 0.2, "tvm_version": "0.8.dev0"}
{"input": ["opencl -keys=mali,opencl,gpu -device=mali -max_num_threads=512 -thread_warp_size=2", "conv2d_nchw_spatial_pack.mali", [["TENSOR", [1, 128, 7, 6], "float32"], ["TENSOR", [15, 128, 1, 1], "float32"], [1, 1], [0, 0, 0, 0], [1, 1], "float32"], {}], "config": {"index": 23696, "code_hash": null, "entity": [["tile_co", "sp", [-1, 1, 15]], ["tile_oh", "sp", [-1, 7, 1]], ["tile_ow", "sp", [-1, 1, 2]], ["reorder_0", "re", [0, 1, 2, 3, 4, 5, 6, 9, 7, 8]], ["ann_reduce", "an", ["none", "none"]], ["ann_spatial", "an", ["unroll", "unroll", "unroll"]]]}, "result": [[0.0006539705022123894], 0, 34.5742928981781, 1630462891.6142075], "version": 0.2, "tvm_version": "0.8.dev0"}
{"input": ["opencl -keys=mali,opencl,gpu -device=mali -max_num_threads=512 -thread_warp_size=2", "conv2d_nchw_spatial_pack.mali", [["TENSOR", [1, 128, 7, 6], "float32"], ["TENSOR", [15, 128, 1, 1], "float32"], [1, 1], [0, 0, 0, 0], [1, 1], "float32"], {}], "config": {"index": 7955, "code_hash": null, "entity": [["tile_co", "sp", [-1, 1, 15]], ["tile_oh", "sp", [-1, 7, 1]], ["tile_ow", "sp", [-1, 1, 3]], ["reorder_0", "re", [0, 1, 2, 3, 4, 5, 6, 7, 8, 9]], ["ann_reduce", "an", ["none", "none"]], ["ann_spatial", "an", ["none", "unroll", "unroll"]]]}, "result": [[0.0011646448894472362], 0, 43.35643815994263, 1630462900.3914173], "version": 0.2, "tvm_version": "0.8.dev0"}
{"input": ["opencl -keys=mali,opencl,gpu -device=mali -max_num_threads=512 -thread_warp_size=2", "conv2d_nchw_spatial_pack.mali", [["TENSOR", [1, 128, 7, 6], "float32"], ["TENSOR", [15, 128, 1, 1], "float32"], [1, 1], [0, 0, 0, 0], [1, 1], "float32"], {}], "config": {"index": 37790, "code_hash": null, "entity": [["tile_co", "sp", [-1, 1, 15]], ["tile_oh", "sp", [-1, 7, 1]], ["tile_ow", "sp", [-1, 1, 2]], ["reorder_0", "re", [0, 1, 2, 3, 4, 5, 6, 9, 7, 8]], ["ann_reduce", "an", ["none", "unroll"]], ["ann_spatial", "an", ["vec", "unroll", "unroll"]]]}, "result": [[0.0008301996557659208], 0, 52.63096308708191, 1630462909.6877635], "version": 0.2, "tvm_version": "0.8.dev0"}
{"input": ["opencl -keys=mali,opencl,gpu -device=mali -max_num_threads=512 -thread_warp_size=2", "conv2d_nchw_spatial_pack.mali", [["TENSOR", [1, 128, 7, 6], "float32"], ["TENSOR", [15, 128, 1, 1], "float32"], [1, 1], [0, 0, 0, 0], [1, 1], "float32"], {}], "config": {"index": 24236, "code_hash": null, "entity": [["tile_co", "sp", [-1, 1, 15]], ["tile_oh", "sp", [-1, 7, 1]], ["tile_ow", "sp", [-1, 1, 3]], ["reorder_0", "re", [0, 1, 2, 3, 4, 5, 6, 9, 7, 8]], ["ann_reduce", "an", ["none", "unroll"]], ["ann_spatial", "an", ["unroll", "unroll", "unroll"]]]}, "result": [[0.0011081494845360826], 0, 61.42281913757324, 1630462918.4946063], "version": 0.2, "tvm_version": "0.8.dev0"}
{"input": ["opencl -keys=mali,opencl,gpu -device=mali -max_num_threads=512 -thread_warp_size=2", "conv2d_nchw_spatial_pack.mali", [["TENSOR", [1, 128, 7, 6], "float32"], ["TENSOR", [15, 128, 1, 1], "float32"], [1, 1], [0, 0, 0, 0], [1, 1], "float32"], {}], "config": {"index": 22049, "code_hash": null, "entity": [["tile_co", "sp", [-1, 1, 15]], ["tile_oh", "sp", [-1, 7, 1]], ["tile_ow", "sp", [-1, 1, 3]], ["reorder_0", "re", [0, 1, 2, 3, 4, 5, 6, 7, 8, 9]], ["ann_reduce", "an", ["none", "unroll"]], ["ann_spatial", "an", ["unroll", "unroll", "none"]]]}, "result": [[0.0027484061379310348], 0, 70.01276755332947, 1630462927.0966318], "version": 0.2, "tvm_version": "0.8.dev0"}
{"input": ["opencl -keys=mali,opencl,gpu -device=mali -max_num_threads=512 -thread_warp_size=2", "conv2d_nchw_spatial_pack.mali", [["TENSOR", [1, 128, 7, 6], "float32"], ["TENSOR", [15, 128, 1, 1], "float32"], [1, 1], [0, 0, 0, 0], [1, 1], "float32"], {}], "config": {"index": 24182, "code_hash": null, "entity": [["tile_co", "sp", [-1, 1, 15]], ["tile_oh", "sp", [-1, 7, 1]], ["tile_ow", "sp", [-1, 1, 2]], ["reorder_0", "re", [0, 1, 2, 3, 4, 5, 6, 9, 7, 8]], ["ann_reduce", "an", ["none", "unroll"]], ["ann_spatial", "an", ["unroll", "unroll", "unroll"]]]}, "result": [[0.0005277047146401985], 0, 78.54383587837219, 1630462935.6243176], "version": 0.2, "tvm_version": "0.8.dev0"}
{"input": ["opencl -keys=mali,opencl,gpu -device=mali -max_num_threads=512 -thread_warp_size=2", "conv2d_nchw_spatial_pack.mali", [["TENSOR", [1, 128, 7, 6], "float32"], ["TENSOR", [15, 128, 1, 1], "float32"], [1, 1], [0, 0, 0, 0], [1, 1], "float32"], {}], "config": {"index": 37601, "code_hash": null, "entity": [["tile_co", "sp", [-1, 1, 15]], ["tile_oh", "sp", [-1, 7, 1]], ["tile_ow", "sp", [-1, 1, 3]], ["reorder_0", "re", [0, 1, 2, 3, 4, 5, 6, 7, 8, 9]], ["ann_reduce", "an", ["none", "unroll"]], ["ann_spatial", "an", ["vec", "unroll", "unroll"]]]}, "result": [[0.0008294879391447369], 0, 87.70481538772583, 1630462944.8058355], "version": 0.2, "tvm_version": "0.8.dev0"}
{"input": ["opencl -keys=mali,opencl,gpu -device=mali -max_num_threads=512 -thread_warp_size=2", "conv2d_nchw_spatial_pack.mali", [["TENSOR", [1, 128, 7, 6], "float32"], ["TENSOR", [15, 128, 1, 1], "float32"], [1, 1], [0, 0, 0, 0], [1, 1], "float32"], {}], "config": {"index": 21806, "code_hash": null, "entity": [["tile_co", "sp", [-1, 1, 15]], ["tile_oh", "sp", [-1, 7, 1]], ["tile_ow", "sp", [-1, 1, 3]], ["reorder_0", "re", [0, 1, 2, 3, 4, 5, 6, 9, 7, 8]], ["ann_reduce", "an", ["none", "none"]], ["ann_spatial", "an", ["unroll", "unroll", "none"]]]}, "result": [[0.0017041227999999998], 0, 96.02915644645691, 1630462953.1544998], "version": 0.2, "tvm_version": "0.8.dev0"}
{"input": ["opencl -keys=mali,opencl,gpu -device=mali -max_num_threads=512 -thread_warp_size=2", "conv2d_nchw_spatial_pack.mali", [["TENSOR", [1, 128, 7, 6], "float32"], ["TENSOR", [15, 128, 1, 1], "float32"], [1, 1], [0, 0, 0, 0], [1, 1], "float32"], {}], "config": {"index": 21563, "code_hash": null, "entity": [["tile_co", "sp", [-1, 1, 15]], ["tile_oh", "sp", [-1, 7, 1]], ["tile_ow", "sp", [-1, 1, 3]], ["reorder_0", "re", [0, 1, 2, 3, 4, 5, 6, 7, 8, 9]], ["ann_reduce", "an", ["none", "none"]], ["ann_spatial", "an", ["unroll", "unroll", "none"]]]}, "result": [[0.0006045481986062718], 0, 104.47857642173767, 1630462961.6195152], "version": 0.2, "tvm_version": "0.8.dev0"}
{"input": ["opencl -keys=mali,opencl,gpu -device=mali -max_num_threads=512 -thread_warp_size=2", "conv2d_nchw_spatial_pack.mali", [["TENSOR", [1, 128, 7, 6], "float32"], ["TENSOR", [15, 128, 1, 1], "float32"], [1, 1], [0, 0, 0, 0], [1, 1], "float32"], {}], "config": {"index": 37115, "code_hash": null, "entity": [["tile_co", "sp", [-1, 1, 15]], ["tile_oh", "sp", [-1, 7, 1]], ["tile_ow", "sp", [-1, 1, 3]], ["reorder_0", "re", [0, 1, 2, 3, 4, 5, 6, 7, 8, 9]], ["ann_reduce", "an", ["none", "none"]], ["ann_spatial", "an", ["vec", "unroll", "unroll"]]]}, "result": [[0.0008435820659898476], 0, 113.3250641822815, 1630462970.466097], "version": 0.2, "tvm_version": "0.8.dev0"}
{"input": ["opencl -keys=mali,opencl,gpu -device=mali -max_num_threads=512 -thread_warp_size=2", "conv2d_nchw_spatial_pack.mali", [["TENSOR", [1, 128, 7, 6], "float32"], ["TENSOR", [15, 128, 1, 1], "float32"], [1, 1], [0, 0, 0, 0], [1, 1], "float32"], {}], "config": {"index": 21752, "code_hash": null, "entity": [["tile_co", "sp", [-1, 1, 15]], ["tile_oh", "sp", [-1, 7, 1]], ["tile_ow", "sp", [-1, 1, 2]], ["reorder_0", "re", [0, 1, 2, 3, 4, 5, 6, 9, 7, 8]], ["ann_reduce", "an", ["none", "none"]], ["ann_spatial", "an", ["unroll", "unroll", "none"]]]}, "result": [[0.0008970237388724036], 0, 121.6567873954773, 1630462978.8296313], "version": 0.2, "tvm_version": "0.8.dev0"}
{"input": ["opencl -keys=mali,opencl,gpu -device=mali -max_num_threads=512 -thread_warp_size=2", "conv2d_nchw_spatial_pack.mali", [["TENSOR", [1, 128, 7, 6], "float32"], ["TENSOR", [15, 128, 1, 1], "float32"], [1, 1], [0, 0, 0, 0], [1, 1], "float32"], {}], "config": {"index": 6497, "code_hash": null, "entity": [["tile_co", "sp", [-1, 1, 15]], ["tile_oh", "sp", [-1, 7, 1]], ["tile_ow", "sp", [-1, 1, 3]], ["reorder_0", "re", [0, 1, 2, 3, 4, 5, 6, 7, 8, 9]], ["ann_reduce", "an", ["none", "unroll"]], ["ann_spatial", "an", ["none", "unroll", "none"]]]}, "result": [[0.0009091033565891473], 0, 130.87398529052734, 1630462988.056861], "version": 0.2, "tvm_version": "0.8.dev0"}
{"input": ["opencl -keys=mali,opencl,gpu -device=mali -max_num_threads=512 -thread_warp_size=2", "conv2d_nchw_spatial_pack.mali", [["TENSOR", [1, 128, 7, 6], "float32"], ["TENSOR", [15, 128, 1, 1], "float32"], [1, 1], [0, 0, 0, 0], [1, 1], "float32"], {}], "config": {"index": 23748, "code_hash": null, "entity": [["tile_co", "sp", [-1, 1, 5]], ["tile_oh", "sp", [-1, 7, 1]], ["tile_ow", "sp", [-1, 1, 3]], ["reorder_0", "re", [0, 1, 2, 3, 4, 5, 6, 9, 7, 8]], ["ann_reduce", "an", ["none", "none"]], ["ann_spatial", "an", ["unroll", "unroll", "unroll"]]]}, "result": [[0.0009197989949748743], 0, 139.46850967407227, 1630462996.659078], "version": 0.2, "tvm_version": "0.8.dev0"}
{"input": ["opencl -keys=mali,opencl,gpu -device=mali -max_num_threads=512 -thread_warp_size=2", "conv2d_nchw_spatial_pack.mali", [["TENSOR", [1, 128, 7, 6], "float32"], ["TENSOR", [15, 128, 1, 1], "float32"], [1, 1], [0, 0, 0, 0], [1, 1], "float32"], {}], "config": {"index": 29717, "code_hash": null, "entity": [["tile_co", "sp", [-1, 1, 15]], ["tile_oh", "sp", [-1, 7, 1]], ["tile_ow", "sp", [-1, 3, 1]], ["reorder_0", "re", [0, 1, 2, 3, 4, 5, 6, 7, 8, 9]], ["ann_reduce", "an", ["none", "unroll"]], ["ann_spatial", "an", ["unroll", "vec", "unroll"]]]}, "result": [[0.0009160323450134772], 0, 148.31170105934143, 1630463005.5213132], "version": 0.2, "tvm_version": "0.8.dev0"}
{"input": ["opencl -keys=mali,opencl,gpu -device=mali -max_num_threads=512 -thread_warp_size=2", "conv2d_nchw_spatial_pack.mali", [["TENSOR", [1, 128, 7, 6], "float32"], ["TENSOR", [15, 128, 1, 1], "float32"], [1, 1], [0, 0, 0, 0], [1, 1], "float32"], {}], "config": {"index": 6011, "code_hash": null, "entity": [["tile_co", "sp", [-1, 1, 15]], ["tile_oh", "sp", [-1, 7, 1]], ["tile_ow", "sp", [-1, 1, 3]], ["reorder_0", "re", [0, 1, 2, 3, 4, 5, 6, 7, 8, 9]], ["ann_reduce", "an", ["none", "none"]], ["ann_spatial", "an", ["none", "unroll", "none"]]]}, "result": [[0.0009100431211498973], 0, 18.771788358688354, 1630463024.653901], "version": 0.2, "tvm_version": "0.8.dev0"}
{"input": ["opencl -keys=mali,opencl,gpu -device=mali -max_num_threads=512 -thread_warp_size=2", "conv2d_nchw_spatial_pack.mali", [["TENSOR", [1, 128, 7, 6], "float32"], ["TENSOR", [15, 128, 1, 1], "float32"], [1, 1], [0, 0, 0, 0], [1, 1], "float32"], {}], "config": {"index": 29771, "code_hash": null, "entity": [["tile_co", "sp", [-1, 1, 15]], ["tile_oh", "sp", [-1, 7, 1]], ["tile_ow", "sp", [-1, 1, 2]], ["reorder_0", "re", [0, 1, 2, 3, 4, 5, 6, 7, 8, 9]], ["ann_reduce", "an", ["none", "unroll"]], ["ann_spatial", "an", ["unroll", "vec", "unroll"]]]}, "result": [[0.0005436887016949152], 0, 27.816479444503784, 1630463033.7094188], "version": 0.2, "tvm_version": "0.8.dev0"}
{"input": ["opencl -keys=mali,opencl,gpu -device=mali -max_num_threads=512 -thread_warp_size=2", "conv2d_nchw_spatial_pack.mali", [["TENSOR", [1, 128, 7, 6], "float32"], ["TENSOR", [15, 128, 1, 1], "float32"], [1, 1], [0, 0, 0, 0], [1, 1], "float32"], {}], "config": {"index": 23642, "code_hash": null, "entity": [["tile_co", "sp", [-1, 1, 15]], ["tile_oh", "sp", [-1, 7, 1]], ["tile_ow", "sp", [-1, 3, 1]], ["reorder_0", "re", [0, 1, 2, 3, 4, 5, 6, 9, 7, 8]], ["ann_reduce", "an", ["none", "none"]], ["ann_spatial", "an", ["unroll", "unroll", "unroll"]]]}, "result": [[0.0010258754593406594], 0, 36.701149463653564, 1630463042.6100962], "version": 0.2, "tvm_version": "0.8.dev0"}
{"input": ["opencl -keys=mali,opencl,gpu -device=mali -max_num_threads=512 -thread_warp_size=2", "conv2d_nchw_spatial_pack.mali", [["TENSOR", [1, 128, 7, 6], "float32"], ["TENSOR", [15, 128, 1, 1], "float32"], [1, 1], [0, 0, 0, 0], [1, 1], "float32"], {}], "config": {"index": 35846, "code_hash": null, "entity": [["tile_co", "sp", [-1, 1, 15]], ["tile_oh", "sp", [-1, 7, 1]], ["tile_ow", "sp", [-1, 1, 2]], ["reorder_0", "re", [0, 1, 2, 3, 4, 5, 6, 9, 7, 8]], ["ann_reduce", "an", ["none", "unroll"]], ["ann_spatial", "an", ["vec", "unroll", "none"]]]}, "result": [[0.0006590639534883721], 0, 45.64427876472473, 1630463051.5657218], "version": 0.2, "tvm_version": "0.8.dev0"}
{"input": ["opencl -keys=mali,opencl,gpu -device=mali -max_num_threads=512 -thread_warp_size=2", "conv2d_nchw_spatial_pack.mali", [["TENSOR", [1, 128, 7, 6], "float32"], ["TENSOR", [15, 128, 1, 1], "float32"], [1, 1], [0, 0, 0, 0], [1, 1], "float32"], {}], "config": {"index": 22292, "code_hash": null, "entity": [["tile_co", "sp", [-1, 1, 15]], ["tile_oh", "sp", [-1, 7, 1]], ["tile_ow", "sp", [-1, 1, 3]], ["reorder_0", "re", [0, 1, 2, 3, 4, 5, 6, 9, 7, 8]], ["ann_reduce", "an", ["none", "unroll"]], ["ann_spatial", "an", ["unroll", "unroll", "none"]]]}, "result": [[0.0016688913043478263], 0, 54.31327676773071, 1630463060.2371922], "version": 0.2, "tvm_version": "0.8.dev0"}
{"input": ["opencl -keys=mali,opencl,gpu -device=mali -max_num_threads=512 -thread_warp_size=2", "conv2d_nchw_spatial_pack.mali", [["TENSOR", [1, 128, 7, 6], "float32"], ["TENSOR", [15, 128, 1, 1], "float32"], [1, 1], [0, 0, 0, 0], [1, 1], "float32"], {}], "config": {"index": 14165, "code_hash": null, "entity": [["tile_co", "sp", [-1, 1, 15]], ["tile_oh", "sp", [-1, 7, 1]], ["tile_ow", "sp", [-1, 3, 1]], ["reorder_0", "re", [0, 1, 2, 3, 4, 5, 6, 7, 8, 9]], ["ann_reduce", "an", ["none", "unroll"]], ["ann_spatial", "an", ["none", "vec", "unroll"]]]}, "result": [[0.0017624542983870968], 0, 63.2979040145874, 1630463069.2367578], "version": 0.2, "tvm_version": "0.8.dev0"}
{"input": ["opencl -keys=mali,opencl,gpu -device=mali -max_num_threads=512 -thread_warp_size=2", "conv2d_nchw_spatial_pack.mali", [["TENSOR", [1, 128, 7, 6], "float32"], ["TENSOR", [15, 128, 1, 1], "float32"], [1, 1], [0, 0, 0, 0], [1, 1], "float32"], {}], "config": {"index": 21802, "code_hash": null, "entity": [["tile_co", "sp", [-1, 1, 3]], ["tile_oh", "sp", [-1, 7, 1]], ["tile_ow", "sp", [-1, 1, 3]], ["reorder_0", "re", [0, 1, 2, 3, 4, 5, 6, 9, 7, 8]], ["ann_reduce", "an", ["none", "none"]], ["ann_spatial", "an", ["unroll", "unroll", "none"]]]}, "result": [[0.0009676115107913667], 0, 72.65773510932922, 1630463078.5898833], "version": 0.2, "tvm_version": "0.8.dev0"}
{"input": ["opencl -keys=mali,opencl,gpu -device=mali -max_num_threads=512 -thread_warp_size=2", "conv2d_nchw_spatial_pack.mali", [["TENSOR", [1, 128, 7, 6], "float32"], ["TENSOR", [15, 128, 1, 1], "float32"], [1, 1], [0, 0, 0, 0], [1, 1], "float32"], {}], "config": {"index": 23984, "code_hash": null, "entity": [["tile_co", "sp", [-1, 1, 15]], ["tile_oh", "sp", [-1, 1, 1]], ["tile_ow", "sp", [-1, 1, 3]], ["reorder_0", "re", [0, 1, 2, 3, 4, 5, 6, 7, 8, 9]], ["ann_reduce", "an", ["none", "unroll"]], ["ann_spatial", "an", ["unroll", "unroll", "unroll"]]]}, "result": [[0.0008741771304347827], 0, 81.20732021331787, 1630463087.1346817], "version": 0.2, "tvm_version": "0.8.dev0"}
{"input": ["opencl -keys=mali,opencl,gpu -device=mali -max_num_threads=512 -thread_warp_size=2", "conv2d_nchw_spatial_pack.mali", [["TENSOR", [1, 128, 7, 6], "float32"], ["TENSOR", [15, 128, 1, 1], "float32"], [1, 1], [0, 0, 0, 0], [1, 1], "float32"], {}], "config": {"index": 22238, "code_hash": null, "entity": [["tile_co", "sp", [-1, 1, 15]], ["tile_oh", "sp", [-1, 7, 1]], ["tile_ow", "sp", [-1, 1, 2]], ["reorder_0", "re", [0, 1, 2, 3, 4, 5, 6, 9, 7, 8]], ["ann_reduce", "an", ["none", "unroll"]], ["ann_spatial", "an", ["unroll", "unroll", "none"]]]}, "result": [[0.0010393933788819874], 0, 89.54805755615234, 1630463095.5310006], "version": 0.2, "tvm_version": "0.8.dev0"}
{"input": ["opencl -keys=mali,opencl,gpu -device=mali -max_num_threads=512 -thread_warp_size=2", "conv2d_nchw_spatial_pack.mali", [["TENSOR", [1, 128, 7, 6], "float32"], ["TENSOR", [15, 128, 1, 1], "float32"], [1, 1], [0, 0, 0, 0], [1, 1], "float32"], {}], "config": {"index": 23746, "code_hash": null, "entity": [["tile_co", "sp", [-1, 1, 3]], ["tile_oh", "sp", [-1, 7, 1]], ["tile_ow", "sp", [-1, 1, 3]], ["reorder_0", "re", [0, 1, 2, 3, 4, 5, 6, 9, 7, 8]], ["ann_reduce", "an", ["none", "none"]], ["ann_spatial", "an", ["unroll", "unroll", "unroll"]]]}, "result": [[0.0008860821034482758], 0, 98.57619667053223, 1630463104.5555813], "version": 0.2, "tvm_version": "0.8.dev0"}
{"input": ["opencl -keys=mali,opencl,gpu -device=mali -max_num_threads=512 -thread_warp_size=2", "conv2d_nchw_spatial_pack.mali", [["TENSOR", [1, 128, 7, 6], "float32"], ["TENSOR", [15, 128, 1, 1], "float32"], [1, 1], [0, 0, 0, 0], [1, 1], "float32"], {}], "config": {"index": 17918, "code_hash": null, "entity": [["tile_co", "sp", [-1, 1, 15]], ["tile_oh", "sp", [-1, 7, 1]], ["tile_ow", "sp", [-1, 1, 3]], ["reorder_0", "re", [0, 1, 2, 3, 4, 5, 6, 9, 7, 8]], ["ann_reduce", "an", ["none", "none"]], ["ann_spatial", "an", ["unroll", "none", "unroll"]]]}, "result": [[0.000816336164305949], 0, 107.45670366287231, 1630463113.4548647], "version": 0.2, "tvm_version": "0.8.dev0"}
{"input": ["opencl -keys=mali,opencl,gpu -device=mali -max_num_threads=512 -thread_warp_size=2", "conv2d_nchw_spatial_pack.mali", [["TENSOR", [1, 128, 7, 6], "float32"], ["TENSOR", [15, 128, 1, 1], "float32"], [1, 1], [0, 0, 0, 0], [1, 1], "float32"], {}], "config": {"index": 21804, "code_hash": null, "entity": [["tile_co", "sp", [-1, 1, 5]], ["tile_oh", "sp", [-1, 7, 1]], ["tile_ow", "sp", [-1, 1, 3]], ["reorder_0", "re", [0, 1, 2, 3, 4, 5, 6, 9, 7, 8]], ["ann_reduce", "an", ["none", "none"]], ["ann_spatial", "an", ["unroll", "unroll", "none"]]]}, "result": [[0.0016433598849557524], 0, 116.02204465866089, 1630463122.0288885], "version": 0.2, "tvm_version": "0.8.dev0"}
{"input": ["opencl -keys=mali,opencl,gpu -device=mali -max_num_threads=512 -thread_warp_size=2", "conv2d_nchw_spatial_pack.mali", [["TENSOR", [1, 128, 7, 6], "float32"], ["TENSOR", [15, 128, 1, 1], "float32"], [1, 1], [0, 0, 0, 0], [1, 1], "float32"], {}], "config": {"index": 35657, "code_hash": null, "entity": [["tile_co", "sp", [-1, 1, 15]], ["tile_oh", "sp", [-1, 7, 1]], ["tile_ow", "sp", [-1, 1, 3]], ["reorder_0", "re", [0, 1, 2, 3, 4, 5, 6, 7, 8, 9]], ["ann_reduce", "an", ["none", "unroll"]], ["ann_spatial", "an", ["vec", "unroll", "none"]]]}, "result": [[0.0007518132028985508], 0, 124.88051891326904, 1630463130.907702], "version": 0.2, "tvm_version": "0.8.dev0"}
{"input": ["opencl -keys=mali,opencl,gpu -device=mali -max_num_threads=512 -thread_warp_size=2", "conv2d_nchw_spatial_pack.mali", [["TENSOR", [1, 128, 7, 6], "float32"], ["TENSOR", [15, 128, 1, 1], "float32"], [1, 1], [0, 0, 0, 0], [1, 1], "float32"], {}], "config": {"index": 23742, "code_hash": null, "entity": [["tile_co", "sp", [-1, 1, 1]], ["tile_oh", "sp", [-1, 7, 1]], ["tile_ow", "sp", [-1, 1, 3]], ["reorder_0", "re", [0, 1, 2, 3, 4, 5, 6, 9, 7, 8]], ["ann_reduce", "an", ["none", "none"]], ["ann_spatial", "an", ["unroll", "unroll", "unroll"]]]}, "result": [[0.000553084087087087], 0, 133.48586344718933, 1630463139.5303922], "version": 0.2, "tvm_version": "0.8.dev0"}
{"input": ["opencl -keys=mali,opencl,gpu -device=mali -max_num_threads=512 -thread_warp_size=2", "conv2d_nchw_spatial_pack.mali", [["TENSOR", [1, 128, 7, 6], "float32"], ["TENSOR", [15, 128, 1, 1], "float32"], [1, 1], [0, 0, 0, 0], [1, 1], "float32"], {}], "config": {"index": 21798, "code_hash": null, "entity": [["tile_co", "sp", [-1, 1, 1]], ["tile_oh", "sp", [-1, 7, 1]], ["tile_ow", "sp", [-1, 1, 3]], ["reorder_0", "re", [0, 1, 2, 3, 4, 5, 6, 9, 7, 8]], ["ann_reduce", "an", ["none", "none"]], ["ann_spatial", "an", ["unroll", "unroll", "none"]]]}, "result": [[0.0015526981653543306], 0, 141.99602437019348, 1630463148.0582504], "version": 0.2, "tvm_version": "0.8.dev0"}
