example_04/auto_tvm_log/v9h-model-01-NCHW-opencl-C1000-T21-08-30-23-07.log.tmp
{"input": ["opencl -keys=mali,opencl,gpu -device=mali -max_num_threads=256 -thread_warp_size=1", "conv2d_nchw_spatial_pack.mali", [["TENSOR", [1, 16, 212, 168], "float32"], ["TENSOR", [15, 16, 1, 1], "float32"], [1, 1], [0, 0, 0, 0], [1, 1], "float32"], {}], "config": {"index": 74680, "code_hash": null, "entity": [["tile_co", "sp", [-1, 3, 5]], ["tile_oh", "sp", [-1, 1, 212]], ["tile_ow", "sp", [-1, 24, 1]], ["reorder_0", "re", [0, 1, 2, 3, 4, 5, 6, 9, 7, 8]], ["ann_reduce", "an", ["unroll", "none"]], ["ann_spatial", "an", ["none", "none", "none"]]]}, "result": [[0.1421612666], 0, 10.955494403839111, 1630336093.5649922], "version": 0.2, "tvm_version": "0.8.dev0"}
{"input": ["opencl -keys=mali,opencl,gpu -device=mali -max_num_threads=256 -thread_warp_size=1", "conv2d_nchw_spatial_pack.mali", [["TENSOR", [1, 16, 212, 168], "float32"], ["TENSOR", [15, 16, 1, 1], "float32"], [1, 1], [0, 0, 0, 0], [1, 1], "float32"], {}], "config": {"index": 1424052, "code_hash": null, "entity": [["tile_co", "sp", [-1, 1, 1]], ["tile_oh", "sp", [-1, 53, 2]], ["tile_ow", "sp", [-1, 7, 8]], ["reorder_0", "re", [0, 1, 2, 3, 4, 5, 6, 9, 7, 8]], ["ann_reduce", "an", ["none", "none"]], ["ann_spatial", "an", ["unroll", "unroll", "unroll"]]]}, "result": [[0.07218913340000001], 0, 19.424919366836548, 1630336102.035874], "version": 0.2, "tvm_version": "0.8.dev0"}
{"input": ["opencl -keys=mali,opencl,gpu -device=mali -max_num_threads=256 -thread_warp_size=1", "conv2d_nchw_spatial_pack.mali", [["TENSOR", [1, 16, 212, 168], "float32"], ["TENSOR", [15, 16, 1, 1], "float32"], [1, 1], [0, 0, 0, 0], [1, 1], "float32"], {}], "config": {"index": 1720503, "code_hash": null, "entity": [["tile_co", "sp", [-1, 1, 1]], ["tile_oh", "sp", [-1, 2, 2]], ["tile_ow", "sp", [-1, 1, 1]], ["reorder_0", "re", [0, 1, 2, 3, 4, 5, 6, 7, 8, 9]], ["ann_reduce", "an", ["unroll", "unroll"]], ["ann_spatial", "an", ["unroll", "vec", "none"]]]}, "result": [[0.030409], 0, 28.955779790878296, 1630336111.5813322], "version": 0.2, "tvm_version": "0.8.dev0"}
{"input": ["opencl -keys=mali,opencl,gpu -device=mali -max_num_threads=256 -thread_warp_size=1", "conv2d_nchw_spatial_pack.mali", [["TENSOR", [1, 16, 212, 168], "float32"], ["TENSOR", [15, 16, 1, 1], "float32"], [1, 1], [0, 0, 0, 0], [1, 1], "float32"], {}], "config": {"index": 1151, "code_hash": null, "entity": [["tile_co", "sp", [-1, 1, 15]], ["tile_oh", "sp", [-1, 2, 1]], ["tile_ow", "sp", [-1, 12, 1]], ["reorder_0", "re", [0, 1, 2, 3, 4, 5, 6, 7, 8, 9]], ["ann_reduce", "an", ["none", "none"]], ["ann_spatial", "an", ["none", "none", "none"]]]}, "result": [[0.0404174], 0, 38.249045610427856, 1630336120.8673294], "version": 0.2, "tvm_version": "0.8.dev0"}
{"input": ["opencl -keys=mali,opencl,gpu -device=mali -max_num_threads=256 -thread_warp_size=1", "conv2d_nchw_spatial_pack.mali", [["TENSOR", [1, 16, 212, 168], "float32"], ["TENSOR", [15, 16, 1, 1], "float32"], [1, 1], [0, 0, 0, 0], [1, 1], "float32"], {}], "config": {"index": 703527, "code_hash": null, "entity": [["tile_co", "sp", [-1, 1, 5]], ["tile_oh", "sp", [-1, 2, 53]], ["tile_ow", "sp", [-1, 12, 2]], ["reorder_0", "re", [0, 1, 2, 3, 4, 5, 6, 7, 8, 9]], ["ann_reduce", "an", ["none", "none"]], ["ann_spatial", "an", ["none", "vec", "none"]]]}, "result": [[0.0415169334], 0, 47.56416988372803, 1630336130.2004395], "version": 0.2, "tvm_version": "0.8.dev0"}
{"input": ["opencl -keys=mali,opencl,gpu -device=mali -max_num_threads=256 -thread_warp_size=1", "conv2d_nchw_spatial_pack.mali", [["TENSOR", [1, 16, 212, 168], "float32"], ["TENSOR", [15, 16, 1, 1], "float32"], [1, 1], [0, 0, 0, 0], [1, 1], "float32"], {}], "config": {"index": 1264583, "code_hash": null, "entity": [["tile_co", "sp", [-1, 5, 1]], ["tile_oh", "sp", [-1, 2, 1]], ["tile_ow", "sp", [-1, 1, 14]], ["reorder_0", "re", [0, 1, 2, 3, 4, 5, 6, 7, 8, 9]], ["ann_reduce", "an", ["unroll", "unroll"]], ["ann_spatial", "an", ["unroll", "none", "vec"]]]}, "result": [[0.025653958249999997], 0, 56.736122131347656, 1630336139.3772962], "version": 0.2, "tvm_version": "0.8.dev0"}
{"input": ["opencl -keys=mali,opencl,gpu -device=mali -max_num_threads=256 -thread_warp_size=1", "conv2d_nchw_spatial_pack.mali", [["TENSOR", [1, 16, 212, 168], "float32"], ["TENSOR", [15, 16, 1, 1], "float32"], [1, 1], [0, 0, 0, 0], [1, 1], "float32"], {}], "config": {"index": 1006856, "code_hash": null, "entity": [["tile_co", "sp", [-1, 1, 15]], ["tile_oh", "sp", [-1, 4, 1]], ["tile_ow", "sp", [-1, 7, 1]], ["reorder_0", "re", [0, 1, 2, 3, 4, 5, 6, 9, 7, 8]], ["ann_reduce", "an", ["unroll", "none"]], ["ann_spatial", "an", ["unroll", "none", "none"]]]}, "result": [[0.041330399999999996], 0, 66.84085965156555, 1630336149.4889717], "version": 0.2, "tvm_version": "0.8.dev0"}
{"input": ["opencl -keys=mali,opencl,gpu -device=mali -max_num_threads=256 -thread_warp_size=1", "conv2d_nchw_spatial_pack.mali", [["TENSOR", [1, 16, 212, 168], "float32"], ["TENSOR", [15, 16, 1, 1], "float32"], [1, 1], [0, 0, 0, 0], [1, 1], "float32"], {}], "config": {"index": 320274, "code_hash": null, "entity": [["tile_co", "sp", [-1, 1, 1]], ["tile_oh", "sp", [-1, 1, 1]], ["tile_ow", "sp", [-1, 1, 84]], ["reorder_0", "re", [0, 1, 2, 3, 4, 5, 6, 9, 7, 8]], ["ann_reduce", "an", ["unroll", "none"]], ["ann_spatial", "an", ["none", "none", "vec"]]]}, "result": [[0.1305691334], 0, 77.34969472885132, 1630336159.9959576], "version": 0.2, "tvm_version": "0.8.dev0"}
{"input": ["opencl -keys=mali,opencl,gpu -device=mali -max_num_threads=256 -thread_warp_size=1", "conv2d_nchw_spatial_pack.mali", [["TENSOR", [1, 16, 212, 168], "float32"], ["TENSOR", [15, 16, 1, 1], "float32"], [1, 1], [0, 0, 0, 0], [1, 1], "float32"], {}], "config": {"index": 773410, "code_hash": null, "entity": [["tile_co", "sp", [-1, 1, 3]], ["tile_oh", "sp", [-1, 4, 1]], ["tile_ow", "sp", [-1, 6, 1]], ["reorder_0", "re", [0, 1, 2, 3, 4, 5, 6, 9, 7, 8]], ["ann_reduce", "an", ["unroll", "none"]], ["ann_spatial", "an", ["none", "vec", "none"]]]}, "result": [[0.0457077332], 0, 87.42782354354858, 1630336170.101509], "version": 0.2, "tvm_version": "0.8.dev0"}
{"input": ["opencl -keys=mali,opencl,gpu -device=mali -max_num_threads=256 -thread_warp_size=1", "conv2d_nchw_spatial_pack.mali", [["TENSOR", [1, 16, 212, 168], "float32"], ["TENSOR", [15, 16, 1, 1], "float32"], [1, 1], [0, 0, 0, 0], [1, 1], "float32"], {}], "config": {"index": 2182042, "code_hash": null, "entity": [["tile_co", "sp", [-1, 3, 1]], ["tile_oh", "sp", [-1, 2, 2]], ["tile_ow", "sp", [-1, 3, 8]], ["reorder_0", "re", [0, 1, 2, 3, 4, 5, 6, 9, 7, 8]], ["ann_reduce", "an", ["unroll", "none"]], ["ann_spatial", "an", ["vec", "unroll", "none"]]]}, "result": [[0.0726004], 0, 8.892395496368408, 1630336179.2583866], "version": 0.2, "tvm_version": "0.8.dev0"}
{"input": ["opencl -keys=mali,opencl,gpu -device=mali -max_num_threads=256 -thread_warp_size=1", "conv2d_nchw_spatial_pack.mali", [["TENSOR", [1, 16, 212, 168], "float32"], ["TENSOR", [15, 16, 1, 1], "float32"], [1, 1], [0, 0, 0, 0], [1, 1], "float32"], {}], "config": {"index": 1356506, "code_hash": null, "entity": [["tile_co", "sp", [-1, 1, 15]], ["tile_oh", "sp", [-1, 53, 2]], ["tile_ow", "sp", [-1, 4, 1]], ["reorder_0", "re", [0, 1, 2, 3, 4, 5, 6, 9, 7, 8]], ["ann_reduce", "an", ["unroll", "none"]], ["ann_spatial", "an", ["unroll", "unroll", "none"]]]}, "result": [[0.0335382666], 0, 18.484933137893677, 1630336188.8652174], "version": 0.2, "tvm_version": "0.8.dev0"}
{"input": ["opencl -keys=mali,opencl,gpu -device=mali -max_num_threads=256 -thread_warp_size=1", "conv2d_nchw_spatial_pack.mali", [["TENSOR", [1, 16, 212, 168], "float32"], ["TENSOR", [15, 16, 1, 1], "float32"], [1, 1], [0, 0, 0, 0], [1, 1], "float32"], {}], "config": {"index": 1869538, "code_hash": null, "entity": [["tile_co", "sp", [-1, 1, 3]], ["tile_oh", "sp", [-1, 1, 2]], ["tile_ow", "sp", [-1, 6, 2]], ["reorder_0", "re", [0, 1, 2, 3, 4, 5, 6, 7, 8, 9]], ["ann_reduce", "an", ["none", "none"]], ["ann_spatial", "an", ["vec", "none", "none"]]]}, "result": [[0.06180593320000001], 0, 28.143829822540283, 1630336198.5329022], "version": 0.2, "tvm_version": "0.8.dev0"}
{"input": ["opencl -keys=mali,opencl,gpu -device=mali -max_num_threads=256 -thread_warp_size=1", "conv2d_nchw_spatial_pack.mali", [["TENSOR", [1, 16, 212, 168], "float32"], ["TENSOR", [15, 16, 1, 1], "float32"], [1, 1], [0, 0, 0, 0], [1, 1], "float32"], {}], "config": {"index": 463607, "code_hash": null, "entity": [["tile_co", "sp", [-1, 1, 15]], ["tile_oh", "sp", [-1, 2, 53]], ["tile_ow", "sp", [-1, 12, 14]], ["reorder_0", "re", [0, 1, 2, 3, 4, 5, 6, 9, 7, 8]], ["ann_reduce", "an", ["unroll", "unroll"]], ["ann_spatial", "an", ["none", "unroll", "none"]]]}, "result": [[0.2869804], 0, 41.38105893135071, 1630336211.7564385], "version": 0.2, "tvm_version": "0.8.dev0"}
{"input": ["opencl -keys=mali,opencl,gpu -device=mali -max_num_threads=256 -thread_warp_size=1", "conv2d_nchw_spatial_pack.mali", [["TENSOR", [1, 16, 212, 168], "float32"], ["TENSOR", [15, 16, 1, 1], "float32"], [1, 1], [0, 0, 0, 0], [1, 1], "float32"], {}], "config": {"index": 261531, "code_hash": null, "entity": [["tile_co", "sp", [-1, 1, 1]], ["tile_oh", "sp", [-1, 2, 2]], ["tile_ow", "sp", [-1, 4, 42]], ["reorder_0", "re", [0, 1, 2, 3, 4, 5, 6, 9, 7, 8]], ["ann_reduce", "an", ["none", "none"]], ["ann_spatial", "an", ["none", "none", "vec"]]]}, "result": [[0.2060473332], 0, 50.128573417663574, 1630336220.5213604], "version": 0.2, "tvm_version": "0.8.dev0"}
{"input": ["opencl -keys=mali,opencl,gpu -device=mali -max_num_threads=256 -thread_warp_size=1", "conv2d_nchw_spatial_pack.mali", [["TENSOR", [1, 16, 212, 168], "float32"], ["TENSOR", [15, 16, 1, 1], "float32"], [1, 1], [0, 0, 0, 0], [1, 1], "float32"], {}], "config": {"index": 1224748, "code_hash": null, "entity": [["tile_co", "sp", [-1, 3, 1]], ["tile_oh", "sp", [-1, 53, 1]], ["tile_ow", "sp", [-1, 1, 1]], ["reorder_0", "re", [0, 1, 2, 3, 4, 5, 6, 7, 8, 9]], ["ann_reduce", "an", ["unroll", "none"]], ["ann_spatial", "an", ["unroll", "none", "vec"]]]}, "result": [[0.025545833375], 0, 57.551389932632446, 1630336227.9481237], "version": 0.2, "tvm_version": "0.8.dev0"}
{"input": ["opencl -keys=mali,opencl,gpu -device=mali -max_num_threads=256 -thread_warp_size=1", "conv2d_nchw_spatial_pack.mali", [["TENSOR", [1, 16, 212, 168], "float32"], ["TENSOR", [15, 16, 1, 1], "float32"], [1, 1], [0, 0, 0, 0], [1, 1], "float32"], {}], "config": {"index": 1433467, "code_hash": null, "entity": [["tile_co", "sp", [-1, 3, 1]], ["tile_oh", "sp", [-1, 1, 4]], ["tile_ow", "sp", [-1, 1, 3]], ["reorder_0", "re", [0, 1, 2, 3, 4, 5, 6, 7, 8, 9]], ["ann_reduce", "an", ["none", "unroll"]], ["ann_spatial", "an", ["unroll", "unroll", "unroll"]]]}, "result": [[0.088302], 0, 67.02558922767639, 1630336237.4325151], "version": 0.2, "tvm_version": "0.8.dev0"}
{"input": ["opencl -keys=mali,opencl,gpu -device=mali -max_num_threads=256 -thread_warp_size=1", "conv2d_nchw_spatial_pack.mali", [["TENSOR", [1, 16, 212, 168], "float32"], ["TENSOR", [15, 16, 1, 1], "float32"], [1, 1], [0, 0, 0, 0], [1, 1], "float32"], {}], "config": {"index": 831618, "code_hash": null, "entity": [["tile_co", "sp", [-1, 1, 1]], ["tile_oh", "sp", [-1, 53, 2]], ["tile_ow", "sp", [-1, 4, 1]], ["reorder_0", "re", [0, 1, 2, 3, 4, 5, 6, 9, 7, 8]], ["ann_reduce", "an", ["none", "none"]], ["ann_spatial", "an", ["none", "vec", "unroll"]]]}, "result": [[0.0489883334], 0, 77.10384154319763, 1630336247.5231912], "version": 0.2, "tvm_version": "0.8.dev0"}
{"input": ["opencl -keys=mali,opencl,gpu -device=mali -max_num_threads=256 -thread_warp_size=1", "conv2d_nchw_spatial_pack.mali", [["TENSOR", [1, 16, 212, 168], "float32"], ["TENSOR", [15, 16, 1, 1], "float32"], [1, 1], [0, 0, 0, 0], [1, 1], "float32"], {}], "config": {"index": 2120926, "code_hash": null, "entity": [["tile_co", "sp", [-1, 1, 3]], ["tile_oh", "sp", [-1, 4, 1]], ["tile_ow", "sp", [-1, 21, 4]], ["reorder_0", "re", [0, 1, 2, 3, 4, 5, 6, 9, 7, 8]], ["ann_reduce", "an", ["none", "none"]], ["ann_spatial", "an", ["vec", "unroll", "none"]]]}, "result": [[0.01959520825], 0, 86.50974869728088, 1630336256.9429338], "version": 0.2, "tvm_version": "0.8.dev0"}
{"input": ["opencl -keys=mali,opencl,gpu -device=mali -max_num_threads=256 -thread_warp_size=1", "conv2d_nchw_spatial_pack.mali", [["TENSOR", [1, 16, 212, 168], "float32"], ["TENSOR", [15, 16, 1, 1], "float32"], [1, 1], [0, 0, 0, 0], [1, 1], "float32"], {}], "config": {"index": 44727, "code_hash": null, "entity": [["tile_co", "sp", [-1, 1, 5]], ["tile_oh", "sp", [-1, 2, 1]], ["tile_ow", "sp", [-1, 8, 1]], ["reorder_0", "re", [0, 1, 2, 3, 4, 5, 6, 9, 7, 8]], ["ann_reduce", "an", ["none", "unroll"]], ["ann_spatial", "an", ["none", "none", "none"]]]}, "result": [[0.0448992], 0, 95.53197193145752, 1630336265.981206], "version": 0.2, "tvm_version": "0.8.dev0"}
{"input": ["opencl -keys=mali,opencl,gpu -device=mali -max_num_threads=256 -thread_warp_size=1", "conv2d_nchw_spatial_pack.mali", [["TENSOR", [1, 16, 212, 168], "float32"], ["TENSOR", [15, 16, 1, 1], "float32"], [1, 1], [0, 0, 0, 0], [1, 1], "float32"], {}], "config": {"index": 1089004, "code_hash": null, "entity": [["tile_co", "sp", [-1, 1, 3]], ["tile_oh", "sp", [-1, 106, 1]], ["tile_ow", "sp", [-1, 1, 12]], ["reorder_0", "re", [0, 1, 2, 3, 4, 5, 6, 7, 8, 9]], ["ann_reduce", "an", ["none", "unroll"]], ["ann_spatial", "an", ["unroll", "none", "unroll"]]]}, "result": [[0.08536486680000001], 0, 105.19939088821411, 1630336275.6459308], "version": 0.2, "tvm_version": "0.8.dev0"}
{"input": ["opencl -keys=mali,opencl,gpu -device=mali -max_num_threads=256 -thread_warp_size=1", "conv2d_nchw_spatial_pack.mali", [["TENSOR", [1, 16, 212, 168], "float32"], ["TENSOR", [15, 16, 1, 1], "float32"], [1, 1], [0, 0, 0, 0], [1, 1], "float32"], {}], "config": {"index": 382112, "code_hash": null, "entity": [["tile_co", "sp", [-1, 1, 15]], ["tile_oh", "sp", [-1, 1, 53]], ["tile_ow", "sp", [-1, 3, 2]], ["reorder_0", "re", [0, 1, 2, 3, 4, 5, 6, 7, 8, 9]], ["ann_reduce", "an", ["none", "unroll"]], ["ann_spatial", "an", ["none", "unroll", "none"]]]}, "result": [[0.0368819334], 0, 9.108216524124146, 1630336284.993784], "version": 0.2, "tvm_version": "0.8.dev0"}
{"input": ["opencl -keys=mali,opencl,gpu -device=mali -max_num_threads=256 -thread_warp_size=1", "conv2d_nchw_spatial_pack.mali", [["TENSOR", [1, 16, 212, 168], "float32"], ["TENSOR", [15, 16, 1, 1], "float32"], [1, 1], [0, 0, 0, 0], [1, 1], "float32"], {}], "config": {"index": 4881, "code_hash": null, "entity": [["tile_co", "sp", [-1, 15, 1]], ["tile_oh", "sp", [-1, 4, 1]], ["tile_ow", "sp", [-1, 4, 3]], ["reorder_0", "re", [0, 1, 2, 3, 4, 5, 6, 7, 8, 9]], ["ann_reduce", "an", ["none", "none"]], ["ann_spatial", "an", ["none", "none", "none"]]]}, "result": [[0.036848399999999996], 0, 18.04543924331665, 1630336293.9677117], "version": 0.2, "tvm_version": "0.8.dev0"}
{"input": ["opencl -keys=mali,opencl,gpu -device=mali -max_num_threads=256 -thread_warp_size=1", "conv2d_nchw_spatial_pack.mali", [["TENSOR", [1, 16, 212, 168], "float32"], ["TENSOR", [15, 16, 1, 1], "float32"], [1, 1], [0, 0, 0, 0], [1, 1], "float32"], {}], "config": {"index": 945176, "code_hash": null, "entity": [["tile_co", "sp", [-1, 5, 3]], ["tile_oh", "sp", [-1, 2, 2]], ["tile_ow", "sp", [-1, 4, 21]], ["reorder_0", "re", [0, 1, 2, 3, 4, 5, 6, 7, 8, 9]], ["ann_reduce", "an", ["none", "none"]], ["ann_spatial", "an", ["unroll", "none", "none"]]]}, "result": [[0.034762666799999994], 0, 27.088254928588867, 1630336303.0587914], "version": 0.2, "tvm_version": "0.8.dev0"}
{"input": ["opencl -keys=mali,opencl,gpu -device=mali -max_num_threads=256 -thread_warp_size=1", "conv2d_nchw_spatial_pack.mali", [["TENSOR", [1, 16, 212, 168], "float32"], ["TENSOR", [15, 16, 1, 1], "float32"], [1, 1], [0, 0, 0, 0], [1, 1], "float32"], {}], "config": {"index": 1272252, "code_hash": null, "entity": [["tile_co", "sp", [-1, 15, 1]], ["tile_oh", "sp", [-1, 2, 2]], ["tile_ow", "sp", [-1, 14, 2]], ["reorder_0", "re", [0, 1, 2, 3, 4, 5, 6, 9, 7, 8]], ["ann_reduce", "an", ["unroll", "unroll"]], ["ann_spatial", "an", ["unroll", "none", "vec"]]]}, "result": [[0.023417625], 0, 35.87918972969055, 1630336311.8601942], "version": 0.2, "tvm_version": "0.8.dev0"}
{"input": ["opencl -keys=mali,opencl,gpu -device=mali -max_num_threads=256 -thread_warp_size=1", "conv2d_nchw_spatial_pack.mali", [["TENSOR", [1, 16, 212, 168], "float32"], ["TENSOR", [15, 16, 1, 1], "float32"], [1, 1], [0, 0, 0, 0], [1, 1], "float32"], {}], "config": {"index": 862975, "code_hash": null, "entity": [["tile_co", "sp", [-1, 3, 1]], ["tile_oh", "sp", [-1, 1, 1]], ["tile_ow", "sp", [-1, 2, 2]], ["reorder_0", "re", [0, 1, 2, 3, 4, 5, 6, 9, 7, 8]], ["ann_reduce", "an", ["none", "unroll"]], ["ann_spatial", "an", ["none", "vec", "unroll"]]]}, "result": [[0.030223], 0, 8.852484941482544, 1630336320.9465837], "version": 0.2, "tvm_version": "0.8.dev0"}
{"input": ["opencl -keys=mali,opencl,gpu -device=mali -max_num_threads=256 -thread_warp_size=1", "conv2d_nchw_spatial_pack.mali", [["TENSOR", [1, 16, 212, 168], "float32"], ["TENSOR", [15, 16, 1, 1], "float32"], [1, 1], [0, 0, 0, 0], [1, 1], "float32"], {}], "config": {"index": 2294500, "code_hash": null, "entity": [["tile_co", "sp", [-1, 1, 3]], ["tile_oh", "sp", [-1, 1, 4]], ["tile_ow", "sp", [-1, 14, 3]], ["reorder_0", "re", [0, 1, 2, 3, 4, 5, 6, 9, 7, 8]], ["ann_reduce", "an", ["unroll", "none"]], ["ann_spatial", "an", ["vec", "unroll", "unroll"]]]}, "result": [[0.0075857833], 0, 17.797112703323364, 1630336329.8908665], "version": 0.2, "tvm_version": "0.8.dev0"}
{"input": ["opencl -keys=mali,opencl,gpu -device=mali -max_num_threads=256 -thread_warp_size=1", "conv2d_nchw_spatial_pack.mali", [["TENSOR", [1, 16, 212, 168], "float32"], ["TENSOR", [15, 16, 1, 1], "float32"], [1, 1], [0, 0, 0, 0], [1, 1], "float32"], {}], "config": {"index": 709812, "code_hash": null, "entity": [["tile_co", "sp", [-1, 1, 1]], ["tile_oh", "sp", [-1, 1, 4]], ["tile_ow", "sp", [-1, 21, 8]], ["reorder_0", "re", [0, 1, 2, 3, 4, 5, 6, 7, 8, 9]], ["ann_reduce", "an", ["none", "none"]], ["ann_spatial", "an", ["none", "vec", "none"]]]}, "result": [[0.020236333250000002], 0, 26.988176584243774, 1630336339.1038938], "version": 0.2, "tvm_version": "0.8.dev0"}
{"input": ["opencl -keys=mali,opencl,gpu -device=mali -max_num_threads=256 -thread_warp_size=1", "conv2d_nchw_spatial_pack.mali", [["TENSOR", [1, 16, 212, 168], "float32"], ["TENSOR", [15, 16, 1, 1], "float32"], [1, 1], [0, 0, 0, 0], [1, 1], "float32"], {}], "config": {"index": 805091, "code_hash": null, "entity": [["tile_co", "sp", [-1, 5, 3]], ["tile_oh", "sp", [-1, 1, 53]], ["tile_ow", "sp", [-1, 4, 2]], ["reorder_0", "re", [0, 1, 2, 3, 4, 5, 6, 9, 7, 8]], ["ann_reduce", "an", ["unroll", "unroll"]], ["ann_spatial", "an", ["none", "vec", "none"]]]}, "result": [[0.12181466680000001], 0, 38.43363809585571, 1630336350.5789561], "version": 0.2, "tvm_version": "0.8.dev0"}
{"input": ["opencl -keys=mali,opencl,gpu -device=mali -max_num_threads=256 -thread_warp_size=1", "conv2d_nchw_spatial_pack.mali", [["TENSOR", [1, 16, 212, 168], "float32"], ["TENSOR", [15, 16, 1, 1], "float32"], [1, 1], [0, 0, 0, 0], [1, 1], "float32"], {}], "config": {"index": 2168063, "code_hash": null, "entity": [["tile_co", "sp", [-1, 1, 15]], ["tile_oh", "sp", [-1, 2, 1]], ["tile_ow", "sp", [-1, 2, 12]], ["reorder_0", "re", [0, 1, 2, 3, 4, 5, 6, 7, 8, 9]], ["ann_reduce", "an", ["unroll", "none"]], ["ann_spatial", "an", ["vec", "unroll", "none"]]]}, "result": [[0.0155045], 0, 47.38790726661682, 1630336359.5406327], "version": 0.2, "tvm_version": "0.8.dev0"}
{"input": ["opencl -keys=mali,opencl,gpu -device=mali -max_num_threads=256 -thread_warp_size=1", "conv2d_nchw_spatial_pack.mali", [["TENSOR", [1, 16, 212, 168], "float32"], ["TENSOR", [15, 16, 1, 1], "float32"], [1, 1], [0, 0, 0, 0], [1, 1], "float32"], {}], "config": {"index": 1124027, "code_hash": null, "entity": [["tile_co", "sp", [-1, 1, 15]], ["tile_oh", "sp", [-1, 2, 2]], ["tile_ow", "sp", [-1, 14, 1]], ["reorder_0", "re", [0, 1, 2, 3, 4, 5, 6, 9, 7, 8]], ["ann_reduce", "an", ["unroll", "none"]], ["ann_spatial", "an", ["unroll", "none", "unroll"]]]}, "result": [[0.016776027833333332], 0, 4.023589372634888, 1630336444.0836513], "version": 0.2, "tvm_version": "0.8.dev0"}
{"input": ["opencl -keys=mali,opencl,gpu -device=mali -max_num_threads=256 -thread_warp_size=1", "conv2d_nchw_spatial_pack.mali", [["TENSOR", [1, 16, 212, 168], "float32"], ["TENSOR", [15, 16, 1, 1], "float32"], [1, 1], [0, 0, 0, 0], [1, 1], "float32"], {}], "config": {"index": 1421158, "code_hash": null, "entity": [["tile_co", "sp", [-1, 1, 3]], ["tile_oh", "sp", [-1, 1, 4]], ["tile_ow", "sp", [-1, 21, 4]], ["reorder_0", "re", [0, 1, 2, 3, 4, 5, 6, 9, 7, 8]], ["ann_reduce", "an", ["none", "none"]], ["ann_spatial", "an", ["unroll", "unroll", "unroll"]]]}, "result": [[0.0442841334], 0, 13.059664249420166, 1630336453.1404526], "version": 0.2, "tvm_version": "0.8.dev0"}
{"input": ["opencl -keys=mali,opencl,gpu -device=mali -max_num_threads=256 -thread_warp_size=1", "conv2d_nchw_spatial_pack.mali", [["TENSOR", [1, 16, 212, 168], "float32"], ["TENSOR", [15, 16, 1, 1], "float32"], [1, 1], [0, 0, 0, 0], [1, 1], "float32"], {}], "config": {"index": 1479478, "code_hash": null, "entity": [["tile_co", "sp", [-1, 1, 3]], ["tile_oh", "sp", [-1, 1, 4]], ["tile_ow", "sp", [-1, 21, 4]], ["reorder_0", "re", [0, 1, 2, 3, 4, 5, 6, 9, 7, 8]], ["ann_reduce", "an", ["unroll", "none"]], ["ann_spatial", "an", ["unroll", "unroll", "unroll"]]]}, "result": [[0.0072921904761904755], 0, 21.967567443847656, 1630336462.0611484], "version": 0.2, "tvm_version": "0.8.dev0"}
{"input": ["opencl -keys=mali,opencl,gpu -device=mali -max_num_threads=256 -thread_warp_size=1", "conv2d_nchw_spatial_pack.mali", [["TENSOR", [1, 16, 212, 168], "float32"], ["TENSOR", [15, 16, 1, 1], "float32"], [1, 1], [0, 0, 0, 0], [1, 1], "float32"], {}], "config": {"index": 1829398, "code_hash": null, "entity": [["tile_co", "sp", [-1, 1, 3]], ["tile_oh", "sp", [-1, 1, 4]], ["tile_ow", "sp", [-1, 21, 4]], ["reorder_0", "re", [0, 1, 2, 3, 4, 5, 6, 9, 7, 8]], ["ann_reduce", "an", ["unroll", "none"]], ["ann_spatial", "an", ["unroll", "vec", "unroll"]]]}, "result": [[0.008569057482758621], 0, 31.5834801197052, 1630336471.6955295], "version": 0.2, "tvm_version": "0.8.dev0"}
{"input": ["opencl -keys=mali,opencl,gpu -device=mali -max_num_threads=256 -thread_warp_size=1", "conv2d_nchw_spatial_pack.mali", [["TENSOR", [1, 16, 212, 168], "float32"], ["TENSOR", [15, 16, 1, 1], "float32"], [1, 1], [0, 0, 0, 0], [1, 1], "float32"], {}], "config": {"index": 1771078, "code_hash": null, "entity": [["tile_co", "sp", [-1, 1, 3]], ["tile_oh", "sp", [-1, 1, 4]], ["tile_ow", "sp", [-1, 21, 4]], ["reorder_0", "re", [0, 1, 2, 3, 4, 5, 6, 9, 7, 8]], ["ann_reduce", "an", ["none", "none"]], ["ann_spatial", "an", ["unroll", "vec", "unroll"]]]}, "result": [[0.007415878787878788], 0, 41.12697148323059, 1630336481.2562888], "version": 0.2, "tvm_version": "0.8.dev0"}
{"input": ["opencl -keys=mali,opencl,gpu -device=mali -max_num_threads=256 -thread_warp_size=1", "conv2d_nchw_spatial_pack.mali", [["TENSOR", [1, 16, 212, 168], "float32"], ["TENSOR", [15, 16, 1, 1], "float32"], [1, 1], [0, 0, 0, 0], [1, 1], "float32"], {}], "config": {"index": 1478182, "code_hash": null, "entity": [["tile_co", "sp", [-1, 1, 3]], ["tile_oh", "sp", [-1, 1, 4]], ["tile_ow", "sp", [-1, 28, 3]], ["reorder_0", "re", [0, 1, 2, 3, 4, 5, 6, 9, 7, 8]], ["ann_reduce", "an", ["unroll", "none"]], ["ann_spatial", "an", ["unroll", "unroll", "unroll"]]]}, "result": [[0.00777676665], 0, 50.03535437583923, 1630336490.1755753], "version": 0.2, "tvm_version": "0.8.dev0"}
{"input": ["opencl -keys=mali,opencl,gpu -device=mali -max_num_threads=256 -thread_warp_size=1", "conv2d_nchw_spatial_pack.mali", [["TENSOR", [1, 16, 212, 168], "float32"], ["TENSOR", [15, 16, 1, 1], "float32"], [1, 1], [0, 0, 0, 0], [1, 1], "float32"], {}], "config": {"index": 1419862, "code_hash": null, "entity": [["tile_co", "sp", [-1, 1, 3]], ["tile_oh", "sp", [-1, 1, 4]], ["tile_ow", "sp", [-1, 28, 3]], ["reorder_0", "re", [0, 1, 2, 3, 4, 5, 6, 9, 7, 8]], ["ann_reduce", "an", ["none", "none"]], ["ann_spatial", "an", ["unroll", "unroll", "unroll"]]]}, "result": [[0.0445444], 0, 59.145293951034546, 1630336499.2940898], "version": 0.2, "tvm_version": "0.8.dev0"}
{"input": ["opencl -keys=mali,opencl,gpu -device=mali -max_num_threads=256 -thread_warp_size=1", "conv2d_nchw_spatial_pack.mali", [["TENSOR", [1, 16, 212, 168], "float32"], ["TENSOR", [15, 16, 1, 1], "float32"], [1, 1], [0, 0, 0, 0], [1, 1], "float32"], {}], "config": {"index": 2057174, "code_hash": null, "entity": [["tile_co", "sp", [-1, 1, 15]], ["tile_oh", "sp", [-1, 1, 4]], ["tile_ow", "sp", [-1, 14, 1]], ["reorder_0", "re", [0, 1, 2, 3, 4, 5, 6, 9, 7, 8]], ["ann_reduce", "an", ["unroll", "none"]], ["ann_spatial", "an", ["vec", "none", "unroll"]]]}, "result": [[0.011285714285714286], 0, 68.20777940750122, 1630336508.3685436], "version": 0.2, "tvm_version": "0.8.dev0"}
{"input": ["opencl -keys=mali,opencl,gpu -device=mali -max_num_threads=256 -thread_warp_size=1", "conv2d_nchw_spatial_pack.mali", [["TENSOR", [1, 16, 212, 168], "float32"], ["TENSOR", [15, 16, 1, 1], "float32"], [1, 1], [0, 0, 0, 0], [1, 1], "float32"], {}], "config": {"index": 1243089, "code_hash": null, "entity": [["tile_co", "sp", [-1, 1, 1]], ["tile_oh", "sp", [-1, 2, 2]], ["tile_ow", "sp", [-1, 14, 2]], ["reorder_0", "re", [0, 1, 2, 3, 4, 5, 6, 9, 7, 8]], ["ann_reduce", "an", ["unroll", "none"]], ["ann_spatial", "an", ["unroll", "none", "vec"]]]}, "result": [[0.030214958375], 0, 77.26177859306335, 1630336517.4848015], "version": 0.2, "tvm_version": "0.8.dev0"}
{"input": ["opencl -keys=mali,opencl,gpu -device=mali -max_num_threads=256 -thread_warp_size=1", "conv2d_nchw_spatial_pack.mali", [["TENSOR", [1, 16, 212, 168], "float32"], ["TENSOR", [15, 16, 1, 1], "float32"], [1, 1], [0, 0, 0, 0], [1, 1], "float32"], {}], "config": {"index": 1126777, "code_hash": null, "entity": [["tile_co", "sp", [-1, 1, 3]], ["tile_oh", "sp", [-1, 2, 2]], ["tile_ow", "sp", [-1, 28, 2]], ["reorder_0", "re", [0, 1, 2, 3, 4, 5, 6, 9, 7, 8]], ["ann_reduce", "an", ["unroll", "none"]], ["ann_spatial", "an", ["unroll", "none", "unroll"]]]}, "result": [[0.020870875], 0, 86.46804976463318, 1630336526.719487], "version": 0.2, "tvm_version": "0.8.dev0"}
{"input": ["opencl -keys=mali,opencl,gpu -device=mali -max_num_threads=256 -thread_warp_size=1", "conv2d_nchw_spatial_pack.mali", [["TENSOR", [1, 16, 212, 168], "float32"], ["TENSOR", [15, 16, 1, 1], "float32"], [1, 1], [0, 0, 0, 0], [1, 1], "float32"], {}], "config": {"index": 190907, "code_hash": null, "entity": [["tile_co", "sp", [-1, 1, 15]], ["tile_oh", "sp", [-1, 2, 2]], ["tile_ow", "sp", [-1, 14, 1]], ["reorder_0", "re", [0, 1, 2, 3, 4, 5, 6, 9, 7, 8]], ["ann_reduce", "an", ["unroll", "none"]], ["ann_spatial", "an", ["none", "none", "unroll"]]]}, "result": [[0.17650760000000001], 0, 9.721517562866211, 1630336536.9256794], "version": 0.2, "tvm_version": "0.8.dev0"}
{"input": ["opencl -keys=mali,opencl,gpu -device=mali -max_num_threads=256 -thread_warp_size=1", "conv2d_nchw_spatial_pack.mali", [["TENSOR", [1, 16, 212, 168], "float32"], ["TENSOR", [15, 16, 1, 1], "float32"], [1, 1], [0, 0, 0, 0], [1, 1], "float32"], {}], "config": {"index": 1124054, "code_hash": null, "entity": [["tile_co", "sp", [-1, 1, 15]], ["tile_oh", "sp", [-1, 1, 4]], ["tile_ow", "sp", [-1, 14, 1]], ["reorder_0", "re", [0, 1, 2, 3, 4, 5, 6, 9, 7, 8]], ["ann_reduce", "an", ["unroll", "none"]], ["ann_spatial", "an", ["unroll", "none", "unroll"]]]}, "result": [[0.0652178668], 0, 19.18050718307495, 1630336546.401185], "version": 0.2, "tvm_version": "0.8.dev0"}
{"input": ["opencl -keys=mali,opencl,gpu -device=mali -max_num_threads=256 -thread_warp_size=1", "conv2d_nchw_spatial_pack.mali", [["TENSOR", [1, 16, 212, 168], "float32"], ["TENSOR", [15, 16, 1, 1], "float32"], [1, 1], [0, 0, 0, 0], [1, 1], "float32"], {}], "config": {"index": 193657, "code_hash": null, "entity": [["tile_co", "sp", [-1, 1, 3]], ["tile_oh", "sp", [-1, 2, 2]], ["tile_ow", "sp", [-1, 28, 2]], ["reorder_0", "re", [0, 1, 2, 3, 4, 5, 6, 9, 7, 8]], ["ann_reduce", "an", ["unroll", "none"]], ["ann_spatial", "an", ["none", "none", "unroll"]]]}, "result": [[0.019513916625], 0, 28.399882316589355, 1630336555.6945877], "version": 0.2, "tvm_version": "0.8.dev0"}
{"input": ["opencl -keys=mali,opencl,gpu -device=mali -max_num_threads=256 -thread_warp_size=1", "conv2d_nchw_spatial_pack.mali", [["TENSOR", [1, 16, 212, 168], "float32"], ["TENSOR", [15, 16, 1, 1], "float32"], [1, 1], [0, 0, 0, 0], [1, 1], "float32"], {}], "config": {"index": 1476562, "code_hash": null, "entity": [["tile_co", "sp", [-1, 1, 3]], ["tile_oh", "sp", [-1, 1, 4]], ["tile_ow", "sp", [-1, 21, 2]], ["reorder_0", "re", [0, 1, 2, 3, 4, 5, 6, 9, 7, 8]], ["ann_reduce", "an", ["unroll", "none"]], ["ann_spatial", "an", ["unroll", "unroll", "unroll"]]]}, "result": [[0.008062210526315788], 0, 37.14094114303589, 1630336564.4427943], "version": 0.2, "tvm_version": "0.8.dev0"}
{"input": ["opencl -keys=mali,opencl,gpu -device=mali -max_num_threads=256 -thread_warp_size=1", "conv2d_nchw_spatial_pack.mali", [["TENSOR", [1, 16, 212, 168], "float32"], ["TENSOR", [15, 16, 1, 1], "float32"], [1, 1], [0, 0, 0, 0], [1, 1], "float32"], {}], "config": {"index": 1826482, "code_hash": null, "entity": [["tile_co", "sp", [-1, 1, 3]], ["tile_oh", "sp", [-1, 1, 4]], ["tile_ow", "sp", [-1, 21, 2]], ["reorder_0", "re", [0, 1, 2, 3, 4, 5, 6, 9, 7, 8]], ["ann_reduce", "an", ["unroll", "none"]], ["ann_spatial", "an", ["unroll", "vec", "unroll"]]]}, "result": [[0.007922578947368421], 0, 46.590128660202026, 1630336573.9016836], "version": 0.2, "tvm_version": "0.8.dev0"}
{"input": ["opencl -keys=mali,opencl,gpu -device=mali -max_num_threads=256 -thread_warp_size=1", "conv2d_nchw_spatial_pack.mali", [["TENSOR", [1, 16, 212, 168], "float32"], ["TENSOR", [15, 16, 1, 1], "float32"], [1, 1], [0, 0, 0, 0], [1, 1], "float32"], {}], "config": {"index": 2161664, "code_hash": null, "entity": [["tile_co", "sp", [-1, 1, 15]], ["tile_oh", "sp", [-1, 1, 4]], ["tile_ow", "sp", [-1, 14, 2]], ["reorder_0", "re", [0, 1, 2, 3, 4, 5, 6, 7, 8, 9]], ["ann_reduce", "an", ["unroll", "none"]], ["ann_spatial", "an", ["vec", "unroll", "none"]]]}, "result": [[0.2016561334], 0, 58.91734337806702, 1630336586.2550333], "version": 0.2, "tvm_version": "0.8.dev0"}
{"input": ["opencl -keys=mali,opencl,gpu -device=mali -max_num_threads=256 -thread_warp_size=1", "conv2d_nchw_spatial_pack.mali", [["TENSOR", [1, 16, 212, 168], "float32"], ["TENSOR", [15, 16, 1, 1], "float32"], [1, 1], [0, 0, 0, 0], [1, 1], "float32"], {}], "config": {"index": 1128262, "code_hash": null, "entity": [["tile_co", "sp", [-1, 1, 3]], ["tile_oh", "sp", [-1, 1, 4]], ["tile_ow", "sp", [-1, 28, 3]], ["reorder_0", "re", [0, 1, 2, 3, 4, 5, 6, 9, 7, 8]], ["ann_reduce", "an", ["unroll", "none"]], ["ann_spatial", "an", ["unroll", "none", "unroll"]]]}, "result": [[0.0831592], 0, 66.37097334861755, 1630336593.7253861], "version": 0.2, "tvm_version": "0.8.dev0"}
{"input": ["opencl -keys=mali,opencl,gpu -device=mali -max_num_threads=256 -thread_warp_size=1", "conv2d_nchw_spatial_pack.mali", [["TENSOR", [1, 16, 212, 168], "float32"], ["TENSOR", [15, 16, 1, 1], "float32"], [1, 1], [0, 0, 0, 0], [1, 1], "float32"], {}], "config": {"index": 1129558, "code_hash": null, "entity": [["tile_co", "sp", [-1, 1, 3]], ["tile_oh", "sp", [-1, 1, 4]], ["tile_ow", "sp", [-1, 21, 4]], ["reorder_0", "re", [0, 1, 2, 3, 4, 5, 6, 9, 7, 8]], ["ann_reduce", "an", ["unroll", "none"]], ["ann_spatial", "an", ["unroll", "none", "unroll"]]]}, "result": [[0.015799222249999998], 0, 75.87420320510864, 1630336603.2267642], "version": 0.2, "tvm_version": "0.8.dev0"}
{"input": ["opencl -keys=mali,opencl,gpu -device=mali -max_num_threads=256 -thread_warp_size=1", "conv2d_nchw_spatial_pack.mali", [["TENSOR", [1, 16, 212, 168], "float32"], ["TENSOR", [15, 16, 1, 1], "float32"], [1, 1], [0, 0, 0, 0], [1, 1], "float32"], {}], "config": {"index": 1129157, "code_hash": null, "entity": [["tile_co", "sp", [-1, 1, 15]], ["tile_oh", "sp", [-1, 2, 1]], ["tile_ow", "sp", [-1, 7, 4]], ["reorder_0", "re", [0, 1, 2, 3, 4, 5, 6, 9, 7, 8]], ["ann_reduce", "an", ["unroll", "none"]], ["ann_spatial", "an", ["unroll", "none", "unroll"]]]}, "result": [[0.08489586660000001], 0, 85.6459596157074, 1630336613.0452666], "version": 0.2, "tvm_version": "0.8.dev0"}
{"input": ["opencl -keys=mali,opencl,gpu -device=mali -max_num_threads=256 -thread_warp_size=1", "conv2d_nchw_spatial_pack.mali", [["TENSOR", [1, 16, 212, 168], "float32"], ["TENSOR", [15, 16, 1, 1], "float32"], [1, 1], [0, 0, 0, 0], [1, 1], "float32"], {}], "config": {"index": 1065707, "code_hash": null, "entity": [["tile_co", "sp", [-1, 1, 15]], ["tile_oh", "sp", [-1, 2, 2]], ["tile_ow", "sp", [-1, 14, 1]], ["reorder_0", "re", [0, 1, 2, 3, 4, 5, 6, 9, 7, 8]], ["ann_reduce", "an", ["none", "none"]], ["ann_spatial", "an", ["unroll", "none", "unroll"]]]}, "result": [[0.0166491666], 0, 8.578274726867676, 1630336622.071809], "version": 0.2, "tvm_version": "0.8.dev0"}
{"input": ["opencl -keys=mali,opencl,gpu -device=mali -max_num_threads=256 -thread_warp_size=1", "conv2d_nchw_spatial_pack.mali", [["TENSOR", [1, 16, 212, 168], "float32"], ["TENSOR", [15, 16, 1, 1], "float32"], [1, 1], [0, 0, 0, 0], [1, 1], "float32"], {}], "config": {"index": 1007387, "code_hash": null, "entity": [["tile_co", "sp", [-1, 1, 15]], ["tile_oh", "sp", [-1, 2, 2]], ["tile_ow", "sp", [-1, 14, 1]], ["reorder_0", "re", [0, 1, 2, 3, 4, 5, 6, 9, 7, 8]], ["ann_reduce", "an", ["unroll", "none"]], ["ann_spatial", "an", ["unroll", "none", "none"]]]}, "result": [[0.17650613340000001], 0, 19.35970163345337, 1630336632.8768444], "version": 0.2, "tvm_version": "0.8.dev0"}
{"input": ["opencl -keys=mali,opencl,gpu -device=mali -max_num_threads=256 -thread_warp_size=1", "conv2d_nchw_spatial_pack.mali", [["TENSOR", [1, 16, 212, 168], "float32"], ["TENSOR", [15, 16, 1, 1], "float32"], [1, 1], [0, 0, 0, 0], [1, 1], "float32"], {}], "config": {"index": 1695104, "code_hash": null, "entity": [["tile_co", "sp", [-1, 1, 15]], ["tile_oh", "sp", [-1, 1, 4]], ["tile_ow", "sp", [-1, 14, 2]], ["reorder_0", "re", [0, 1, 2, 3, 4, 5, 6, 7, 8, 9]], ["ann_reduce", "an", ["unroll", "none"]], ["ann_spatial", "an", ["unroll", "vec", "none"]]]}, "result": [[0.047397733399999996], 0, 28.300358295440674, 1630336641.8241541], "version": 0.2, "tvm_version": "0.8.dev0"}
{"input": ["opencl -keys=mali,opencl,gpu -device=mali -max_num_threads=256 -thread_warp_size=1", "conv2d_nchw_spatial_pack.mali", [["TENSOR", [1, 16, 212, 168], "float32"], ["TENSOR", [15, 16, 1, 1], "float32"], [1, 1], [0, 0, 0, 0], [1, 1], "float32"], {}], "config": {"index": 1347857, "code_hash": null, "entity": [["tile_co", "sp", [-1, 1, 15]], ["tile_oh", "sp", [-1, 2, 1]], ["tile_ow", "sp", [-1, 7, 4]], ["reorder_0", "re", [0, 1, 2, 3, 4, 5, 6, 7, 8, 9]], ["ann_reduce", "an", ["unroll", "none"]], ["ann_spatial", "an", ["unroll", "unroll", "none"]]]}, "result": [[0.1088646666], 0, 38.11215806007385, 1630336651.6693897], "version": 0.2, "tvm_version": "0.8.dev0"}
{"input": ["opencl -keys=mali,opencl,gpu -device=mali -max_num_threads=256 -thread_warp_size=1", "conv2d_nchw_spatial_pack.mali", [["TENSOR", [1, 16, 212, 168], "float32"], ["TENSOR", [15, 16, 1, 1], "float32"], [1, 1], [0, 0, 0, 0], [1, 1], "float32"], {}], "config": {"index": 1940534, "code_hash": null, "entity": [["tile_co", "sp", [-1, 1, 15]], ["tile_oh", "sp", [-1, 1, 4]], ["tile_ow", "sp", [-1, 14, 1]], ["reorder_0", "re", [0, 1, 2, 3, 4, 5, 6, 9, 7, 8]], ["ann_reduce", "an", ["unroll", "none"]], ["ann_spatial", "an", ["vec", "none", "none"]]]}, "result": [[0.2607764], 0, 50.664135217666626, 1630336664.237869], "version": 0.2, "tvm_version": "0.8.dev0"}
{"input": ["opencl -keys=mali,opencl,gpu -device=mali -max_num_threads=256 -thread_warp_size=1", "conv2d_nchw_spatial_pack.mali", [["TENSOR", [1, 16, 212, 168], "float32"], ["TENSOR", [15, 16, 1, 1], "float32"], [1, 1], [0, 0, 0, 0], [1, 1], "float32"], {}], "config": {"index": 196037, "code_hash": null, "entity": [["tile_co", "sp", [-1, 1, 15]], ["tile_oh", "sp", [-1, 2, 1]], ["tile_ow", "sp", [-1, 7, 4]], ["reorder_0", "re", [0, 1, 2, 3, 4, 5, 6, 9, 7, 8]], ["ann_reduce", "an", ["unroll", "none"]], ["ann_spatial", "an", ["none", "none", "unroll"]]]}, "result": [[0.019602777833333335], 0, 57.77359318733215, 1630336671.361101], "version": 0.2, "tvm_version": "0.8.dev0"}
{"input": ["opencl -keys=mali,opencl,gpu -device=mali -max_num_threads=256 -thread_warp_size=1", "conv2d_nchw_spatial_pack.mali", [["TENSOR", [1, 16, 212, 168], "float32"], ["TENSOR", [15, 16, 1, 1], "float32"], [1, 1], [0, 0, 0, 0], [1, 1], "float32"], {}], "config": {"index": 1419700, "code_hash": null, "entity": [["tile_co", "sp", [-1, 1, 3]], ["tile_oh", "sp", [-1, 1, 4]], ["tile_ow", "sp", [-1, 14, 3]], ["reorder_0", "re", [0, 1, 2, 3, 4, 5, 6, 9, 7, 8]], ["ann_reduce", "an", ["none", "none"]], ["ann_spatial", "an", ["unroll", "unroll", "unroll"]]]}, "result": [[0.0448790666], 0, 67.02130174636841, 1630336680.65338], "version": 0.2, "tvm_version": "0.8.dev0"}
{"input": ["opencl -keys=mali,opencl,gpu -device=mali -max_num_threads=256 -thread_warp_size=1", "conv2d_nchw_spatial_pack.mali", [["TENSOR", [1, 16, 212, 168], "float32"], ["TENSOR", [15, 16, 1, 1], "float32"], [1, 1], [0, 0, 0, 0], [1, 1], "float32"], {}], "config": {"index": 1478020, "code_hash": null, "entity": [["tile_co", "sp", [-1, 1, 3]], ["tile_oh", "sp", [-1, 1, 4]], ["tile_ow", "sp", [-1, 14, 3]], ["reorder_0", "re", [0, 1, 2, 3, 4, 5, 6, 9, 7, 8]], ["ann_reduce", "an", ["unroll", "none"]], ["ann_spatial", "an", ["unroll", "unroll", "unroll"]]]}, "result": [[0.044317333400000006], 0, 76.01806330680847, 1630336689.6679833], "version": 0.2, "tvm_version": "0.8.dev0"}
{"input": ["opencl -keys=mali,opencl,gpu -device=mali -max_num_threads=256 -thread_warp_size=1", "conv2d_nchw_spatial_pack.mali", [["TENSOR", [1, 16, 212, 168], "float32"], ["TENSOR", [15, 16, 1, 1], "float32"], [1, 1], [0, 0, 0, 0], [1, 1], "float32"], {}], "config": {"index": 132587, "code_hash": null, "entity": [["tile_co", "sp", [-1, 1, 15]], ["tile_oh", "sp", [-1, 2, 2]], ["tile_ow", "sp", [-1, 14, 1]], ["reorder_0", "re", [0, 1, 2, 3, 4, 5, 6, 9, 7, 8]], ["ann_reduce", "an", ["none", "none"]], ["ann_spatial", "an", ["none", "none", "unroll"]]]}, "result": [[0.0303711334], 0, 85.36813473701477, 1630336699.0524776], "version": 0.2, "tvm_version": "0.8.dev0"}
{"input": ["opencl -keys=mali,opencl,gpu -device=mali -max_num_threads=256 -thread_warp_size=1", "conv2d_nchw_spatial_pack.mali", [["TENSOR", [1, 16, 212, 168], "float32"], ["TENSOR", [15, 16, 1, 1], "float32"], [1, 1], [0, 0, 0, 0], [1, 1], "float32"], {}], "config": {"index": 74267, "code_hash": null, "entity": [["tile_co", "sp", [-1, 1, 15]], ["tile_oh", "sp", [-1, 2, 2]], ["tile_ow", "sp", [-1, 14, 1]], ["reorder_0", "re", [0, 1, 2, 3, 4, 5, 6, 9, 7, 8]], ["ann_reduce", "an", ["unroll", "none"]], ["ann_spatial", "an", ["none", "none", "none"]]]}, "result": [[0.0596848666], 0, 94.71524429321289, 1630336708.4242795], "version": 0.2, "tvm_version": "0.8.dev0"}
{"input": ["opencl -keys=mali,opencl,gpu -device=mali -max_num_threads=256 -thread_warp_size=1", "conv2d_nchw_spatial_pack.mali", [["TENSOR", [1, 16, 212, 168], "float32"], ["TENSOR", [15, 16, 1, 1], "float32"], [1, 1], [0, 0, 0, 0], [1, 1], "float32"], {}], "config": {"index": 1345184, "code_hash": null, "entity": [["tile_co", "sp", [-1, 1, 15]], ["tile_oh", "sp", [-1, 1, 4]], ["tile_ow", "sp", [-1, 14, 2]], ["reorder_0", "re", [0, 1, 2, 3, 4, 5, 6, 7, 8, 9]], ["ann_reduce", "an", ["unroll", "none"]], ["ann_spatial", "an", ["unroll", "unroll", "none"]]]}, "result": [[0.08768619999999999], 0, 104.63517117500305, 1630336718.3602455], "version": 0.2, "tvm_version": "0.8.dev0"}
{"input": ["opencl -keys=mali,opencl,gpu -device=mali -max_num_threads=256 -thread_warp_size=1", "conv2d_nchw_spatial_pack.mali", [["TENSOR", [1, 16, 212, 168], "float32"], ["TENSOR", [15, 16, 1, 1], "float32"], [1, 1], [0, 0, 0, 0], [1, 1], "float32"], {}], "config": {"index": 997937, "code_hash": null, "entity": [["tile_co", "sp", [-1, 1, 15]], ["tile_oh", "sp", [-1, 2, 1]], ["tile_ow", "sp", [-1, 7, 4]], ["reorder_0", "re", [0, 1, 2, 3, 4, 5, 6, 7, 8, 9]], ["ann_reduce", "an", ["unroll", "none"]], ["ann_spatial", "an", ["unroll", "none", "none"]]]}, "result": [[0.038097466600000005], 0, 9.133147954940796, 1630336727.9743698], "version": 0.2, "tvm_version": "0.8.dev0"}
{"input": ["opencl -keys=mali,opencl,gpu -device=mali -max_num_threads=256 -thread_warp_size=1", "conv2d_nchw_spatial_pack.mali", [["TENSOR", [1, 16, 212, 168], "float32"], ["TENSOR", [15, 16, 1, 1], "float32"], [1, 1], [0, 0, 0, 0], [1, 1], "float32"], {}], "config": {"index": 1007414, "code_hash": null, "entity": [["tile_co", "sp", [-1, 1, 15]], ["tile_oh", "sp", [-1, 1, 4]], ["tile_ow", "sp", [-1, 14, 1]], ["reorder_0", "re", [0, 1, 2, 3, 4, 5, 6, 9, 7, 8]], ["ann_reduce", "an", ["unroll", "none"]], ["ann_spatial", "an", ["unroll", "none", "none"]]]}, "result": [[0.22171406659999998], 0, 21.40643882751465, 1630336740.2736132], "version": 0.2, "tvm_version": "0.8.dev0"}
{"input": ["opencl -keys=mali,opencl,gpu -device=mali -max_num_threads=256 -thread_warp_size=1", "conv2d_nchw_spatial_pack.mali", [["TENSOR", [1, 16, 212, 168], "float32"], ["TENSOR", [15, 16, 1, 1], "float32"], [1, 1], [0, 0, 0, 0], [1, 1], "float32"], {}], "config": {"index": 1126642, "code_hash": null, "entity": [["tile_co", "sp", [-1, 1, 3]], ["tile_oh", "sp", [-1, 1, 4]], ["tile_ow", "sp", [-1, 21, 2]], ["reorder_0", "re", [0, 1, 2, 3, 4, 5, 6, 9, 7, 8]], ["ann_reduce", "an", ["unroll", "none"]], ["ann_spatial", "an", ["unroll", "none", "unroll"]]]}, "result": [[0.0152212334], 0, 28.225041151046753, 1630336747.1152048], "version": 0.2, "tvm_version": "0.8.dev0"}
{"input": ["opencl -keys=mali,opencl,gpu -device=mali -max_num_threads=256 -thread_warp_size=1", "conv2d_nchw_spatial_pack.mali", [["TENSOR", [1, 16, 212, 168], "float32"], ["TENSOR", [15, 16, 1, 1], "float32"], [1, 1], [0, 0, 0, 0], [1, 1], "float32"], {}], "config": {"index": 2059604, "code_hash": null, "entity": [["tile_co", "sp", [-1, 1, 15]], ["tile_oh", "sp", [-1, 1, 4]], ["tile_ow", "sp", [-1, 14, 2]], ["reorder_0", "re", [0, 1, 2, 3, 4, 5, 6, 9, 7, 8]], ["ann_reduce", "an", ["unroll", "none"]], ["ann_spatial", "an", ["vec", "none", "unroll"]]]}, "result": [[0.12355920000000001], 0, 39.39127206802368, 1630336758.303016], "version": 0.2, "tvm_version": "0.8.dev0"}
{"input": ["opencl -keys=mali,opencl,gpu -device=mali -max_num_threads=256 -thread_warp_size=1", "conv2d_nchw_spatial_pack.mali", [["TENSOR", [1, 16, 212, 168], "float32"], ["TENSOR", [15, 16, 1, 1], "float32"], [1, 1], [0, 0, 0, 0], [1, 1], "float32"], {}], "config": {"index": 2237638, "code_hash": null, "entity": [["tile_co", "sp", [-1, 1, 3]], ["tile_oh", "sp", [-1, 1, 4]], ["tile_ow", "sp", [-1, 21, 4]], ["reorder_0", "re", [0, 1, 2, 3, 4, 5, 6, 9, 7, 8]], ["ann_reduce", "an", ["none", "none"]], ["ann_spatial", "an", ["vec", "unroll", "unroll"]]]}, "result": [[0.007702380952380953], 0, 47.474562644958496, 1630336766.401644], "version": 0.2, "tvm_version": "0.8.dev0"}
{"input": ["opencl -keys=mali,opencl,gpu -device=mali -max_num_threads=256 -thread_warp_size=1", "conv2d_nchw_spatial_pack.mali", [["TENSOR", [1, 16, 212, 168], "float32"], ["TENSOR", [15, 16, 1, 1], "float32"], [1, 1], [0, 0, 0, 0], [1, 1], "float32"], {}], "config": {"index": 2295958, "code_hash": null, "entity": [["tile_co", "sp", [-1, 1, 3]], ["tile_oh", "sp", [-1, 1, 4]], ["tile_ow", "sp", [-1, 21, 4]], ["reorder_0", "re", [0, 1, 2, 3, 4, 5, 6, 9, 7, 8]], ["ann_reduce", "an", ["unroll", "none"]], ["ann_spatial", "an", ["vec", "unroll", "unroll"]]]}, "result": [[0.0442617334], 0, 56.70315933227539, 1630336775.6435935], "version": 0.2, "tvm_version": "0.8.dev0"}
{"input": ["opencl -keys=mali,opencl,gpu -device=mali -max_num_threads=256 -thread_warp_size=1", "conv2d_nchw_spatial_pack.mali", [["TENSOR", [1, 16, 212, 168], "float32"], ["TENSOR", [15, 16, 1, 1], "float32"], [1, 1], [0, 0, 0, 0], [1, 1], "float32"], {}], "config": {"index": 2236342, "code_hash": null, "entity": [["tile_co", "sp", [-1, 1, 3]], ["tile_oh", "sp", [-1, 1, 4]], ["tile_ow", "sp", [-1, 28, 3]], ["reorder_0", "re", [0, 1, 2, 3, 4, 5, 6, 9, 7, 8]], ["ann_reduce", "an", ["none", "none"]], ["ann_spatial", "an", ["vec", "unroll", "unroll"]]]}, "result": [[0.00771471665], 0, 65.87369632720947, 1630336784.82664], "version": 0.2, "tvm_version": "0.8.dev0"}
{"input": ["opencl -keys=mali,opencl,gpu -device=mali -max_num_threads=256 -thread_warp_size=1", "conv2d_nchw_spatial_pack.mali", [["TENSOR", [1, 16, 212, 168], "float32"], ["TENSOR", [15, 16, 1, 1], "float32"], [1, 1], [0, 0, 0, 0], [1, 1], "float32"], {}], "config": {"index": 2294662, "code_hash": null, "entity": [["tile_co", "sp", [-1, 1, 3]], ["tile_oh", "sp", [-1, 1, 4]], ["tile_ow", "sp", [-1, 28, 3]], ["reorder_0", "re", [0, 1, 2, 3, 4, 5, 6, 9, 7, 8]], ["ann_reduce", "an", ["unroll", "none"]], ["ann_spatial", "an", ["vec", "unroll", "unroll"]]]}, "result": [[0.007694950000000001], 0, 74.74021053314209, 1630336793.7205846], "version": 0.2, "tvm_version": "0.8.dev0"}
{"input": ["opencl -keys=mali,opencl,gpu -device=mali -max_num_threads=256 -thread_warp_size=1", "conv2d_nchw_spatial_pack.mali", [["TENSOR", [1, 16, 212, 168], "float32"], ["TENSOR", [15, 16, 1, 1], "float32"], [1, 1], [0, 0, 0, 0], [1, 1], "float32"], {}], "config": {"index": 1243116, "code_hash": null, "entity": [["tile_co", "sp", [-1, 1, 1]], ["tile_oh", "sp", [-1, 1, 4]], ["tile_ow", "sp", [-1, 14, 2]], ["reorder_0", "re", [0, 1, 2, 3, 4, 5, 6, 9, 7, 8]], ["ann_reduce", "an", ["unroll", "none"]], ["ann_spatial", "an", ["unroll", "none", "vec"]]]}, "result": [[0.02270225], 0, 83.54494857788086, 1630336802.547918], "version": 0.2, "tvm_version": "0.8.dev0"}
{"input": ["opencl -keys=mali,opencl,gpu -device=mali -max_num_threads=256 -thread_warp_size=1", "conv2d_nchw_spatial_pack.mali", [["TENSOR", [1, 16, 212, 168], "float32"], ["TENSOR", [15, 16, 1, 1], "float32"], [1, 1], [0, 0, 0, 0], [1, 1], "float32"], {}], "config": {"index": 1126295, "code_hash": null, "entity": [["tile_co", "sp", [-1, 1, 15]], ["tile_oh", "sp", [-1, 2, 2]], ["tile_ow", "sp", [-1, 12, 2]], ["reorder_0", "re", [0, 1, 2, 3, 4, 5, 6, 9, 7, 8]], ["ann_reduce", "an", ["unroll", "none"]], ["ann_spatial", "an", ["unroll", "none", "unroll"]]]}, "result": [[0.01765977775], 0, 93.28502988815308, 1630336812.29341], "version": 0.2, "tvm_version": "0.8.dev0"}
{"input": ["opencl -keys=mali,opencl,gpu -device=mali -max_num_threads=256 -thread_warp_size=1", "conv2d_nchw_spatial_pack.mali", [["TENSOR", [1, 16, 212, 168], "float32"], ["TENSOR", [15, 16, 1, 1], "float32"], [1, 1], [0, 0, 0, 0], [1, 1], "float32"], {}], "config": {"index": 666873, "code_hash": null, "entity": [["tile_co", "sp", [-1, 1, 1]], ["tile_oh", "sp", [-1, 106, 2]], ["tile_ow", "sp", [-1, 1, 14]], ["reorder_0", "re", [0, 1, 2, 3, 4, 5, 6, 9, 7, 8]], ["ann_reduce", "an", ["unroll", "none"]], ["ann_spatial", "an", ["none", "unroll", "vec"]]]}, "result": [[0.0372435334], 0, 102.23068714141846, 1630336821.2856104], "version": 0.2, "tvm_version": "0.8.dev0"}
{"input": ["opencl -keys=mali,opencl,gpu -device=mali -max_num_threads=256 -thread_warp_size=1", "conv2d_nchw_spatial_pack.mali", [["TENSOR", [1, 16, 212, 168], "float32"], ["TENSOR", [15, 16, 1, 1], "float32"], [1, 1], [0, 0, 0, 0], [1, 1], "float32"], {}], "config": {"index": 51450, "code_hash": null, "entity": [["tile_co", "sp", [-1, 1, 5]], ["tile_oh", "sp", [-1, 1, 4]], ["tile_ow", "sp", [-1, 7, 6]], ["reorder_0", "re", [0, 1, 2, 3, 4, 5, 6, 9, 7, 8]], ["ann_reduce", "an", ["none", "unroll"]], ["ann_spatial", "an", ["none", "none", "none"]]]}, "result": [[0.2677631334], 0, 114.92487835884094, 1630336833.9934778], "version": 0.2, "tvm_version": "0.8.dev0"}
{"input": ["opencl -keys=mali,opencl,gpu -device=mali -max_num_threads=256 -thread_warp_size=1", "conv2d_nchw_spatial_pack.mali", [["TENSOR", [1, 16, 212, 168], "float32"], ["TENSOR", [15, 16, 1, 1], "float32"], [1, 1], [0, 0, 0, 0], [1, 1], "float32"], {}], "config": {"index": 2059407, "code_hash": null, "entity": [["tile_co", "sp", [-1, 1, 1]], ["tile_oh", "sp", [-1, 2, 2]], ["tile_ow", "sp", [-1, 12, 2]], ["reorder_0", "re", [0, 1, 2, 3, 4, 5, 6, 9, 7, 8]], ["ann_reduce", "an", ["unroll", "none"]], ["ann_spatial", "an", ["vec", "none", "unroll"]]]}, "result": [[0.026701166749999998], 0, 3.78474760055542, 1630336910.2605233], "version": 0.2, "tvm_version": "0.8.dev0"}
{"input": ["opencl -keys=mali,opencl,gpu -device=mali -max_num_threads=256 -thread_warp_size=1", "conv2d_nchw_spatial_pack.mali", [["TENSOR", [1, 16, 212, 168], "float32"], ["TENSOR", [15, 16, 1, 1], "float32"], [1, 1], [0, 0, 0, 0], [1, 1], "float32"], {}], "config": {"index": 2001087, "code_hash": null, "entity": [["tile_co", "sp", [-1, 1, 1]], ["tile_oh", "sp", [-1, 2, 2]], ["tile_ow", "sp", [-1, 12, 2]], ["reorder_0", "re", [0, 1, 2, 3, 4, 5, 6, 9, 7, 8]], ["ann_reduce", "an", ["none", "none"]], ["ann_spatial", "an", ["vec", "none", "unroll"]]]}, "result": [[0.027074125124999997], 0, 12.744296550750732, 1630336919.2399697], "version": 0.2, "tvm_version": "0.8.dev0"}
{"input": ["opencl -keys=mali,opencl,gpu -device=mali -max_num_threads=256 -thread_warp_size=1", "conv2d_nchw_spatial_pack.mali", [["TENSOR", [1, 16, 212, 168], "float32"], ["TENSOR", [15, 16, 1, 1], "float32"], [1, 1], [0, 0, 0, 0], [1, 1], "float32"], {}], "config": {"index": 193167, "code_hash": null, "entity": [["tile_co", "sp", [-1, 1, 1]], ["tile_oh", "sp", [-1, 2, 2]], ["tile_ow", "sp", [-1, 12, 2]], ["reorder_0", "re", [0, 1, 2, 3, 4, 5, 6, 9, 7, 8]], ["ann_reduce", "an", ["unroll", "none"]], ["ann_spatial", "an", ["none", "none", "unroll"]]]}, "result": [[0.026693750000000002], 0, 22.517000675201416, 1630336929.0364726], "version": 0.2, "tvm_version": "0.8.dev0"}
{"input": ["opencl -keys=mali,opencl,gpu -device=mali -max_num_threads=256 -thread_warp_size=1", "conv2d_nchw_spatial_pack.mali", [["TENSOR", [1, 16, 212, 168], "float32"], ["TENSOR", [15, 16, 1, 1], "float32"], [1, 1], [0, 0, 0, 0], [1, 1], "float32"], {}], "config": {"index": 2292687, "code_hash": null, "entity": [["tile_co", "sp", [-1, 1, 1]], ["tile_oh", "sp", [-1, 2, 2]], ["tile_ow", "sp", [-1, 12, 2]], ["reorder_0", "re", [0, 1, 2, 3, 4, 5, 6, 9, 7, 8]], ["ann_reduce", "an", ["unroll", "none"]], ["ann_spatial", "an", ["vec", "unroll", "unroll"]]]}, "result": [[0.021566666625], 0, 31.59562873840332, 1630336938.1372874], "version": 0.2, "tvm_version": "0.8.dev0"}
{"input": ["opencl -keys=mali,opencl,gpu -device=mali -max_num_threads=256 -thread_warp_size=1", "conv2d_nchw_spatial_pack.mali", [["TENSOR", [1, 16, 212, 168], "float32"], ["TENSOR", [15, 16, 1, 1], "float32"], [1, 1], [0, 0, 0, 0], [1, 1], "float32"], {}], "config": {"index": 134847, "code_hash": null, "entity": [["tile_co", "sp", [-1, 1, 1]], ["tile_oh", "sp", [-1, 2, 2]], ["tile_ow", "sp", [-1, 12, 2]], ["reorder_0", "re", [0, 1, 2, 3, 4, 5, 6, 9, 7, 8]], ["ann_reduce", "an", ["none", "none"]], ["ann_spatial", "an", ["none", "none", "unroll"]]]}, "result": [[0.027036875], 0, 40.604897022247314, 1630336947.173137], "version": 0.2, "tvm_version": "0.8.dev0"}
{"input": ["opencl -keys=mali,opencl,gpu -device=mali -max_num_threads=256 -thread_warp_size=1", "conv2d_nchw_spatial_pack.mali", [["TENSOR", [1, 16, 212, 168], "float32"], ["TENSOR", [15, 16, 1, 1], "float32"], [1, 1], [0, 0, 0, 0], [1, 1], "float32"], {}], "config": {"index": 2234367, "code_hash": null, "entity": [["tile_co", "sp", [-1, 1, 1]], ["tile_oh", "sp", [-1, 2, 2]], ["tile_ow", "sp", [-1, 12, 2]], ["reorder_0", "re", [0, 1, 2, 3, 4, 5, 6, 9, 7, 8]], ["ann_reduce", "an", ["none", "none"]], ["ann_spatial", "an", ["vec", "unroll", "unroll"]]]}, "result": [[0.023695458250000002], 0, 49.4907329082489, 1630336956.0858133], "version": 0.2, "tvm_version": "0.8.dev0"}
{"input": ["opencl -keys=mali,opencl,gpu -device=mali -max_num_threads=256 -thread_warp_size=1", "conv2d_nchw_spatial_pack.mali", [["TENSOR", [1, 16, 212, 168], "float32"], ["TENSOR", [15, 16, 1, 1], "float32"], [1, 1], [0, 0, 0, 0], [1, 1], "float32"], {}], "config": {"index": 543087, "code_hash": null, "entity": [["tile_co", "sp", [-1, 1, 1]], ["tile_oh", "sp", [-1, 2, 2]], ["tile_ow", "sp", [-1, 12, 2]], ["reorder_0", "re", [0, 1, 2, 3, 4, 5, 6, 9, 7, 8]], ["ann_reduce", "an", ["unroll", "none"]], ["ann_spatial", "an", ["none", "unroll", "unroll"]]]}, "result": [[0.025869583375], 0, 58.48572659492493, 1630336965.1091368], "version": 0.2, "tvm_version": "0.8.dev0"}
{"input": ["opencl -keys=mali,opencl,gpu -device=mali -max_num_threads=256 -thread_warp_size=1", "conv2d_nchw_spatial_pack.mali", [["TENSOR", [1, 16, 212, 168], "float32"], ["TENSOR", [15, 16, 1, 1], "float32"], [1, 1], [0, 0, 0, 0], [1, 1], "float32"], {}], "config": {"index": 1694907, "code_hash": null, "entity": [["tile_co", "sp", [-1, 1, 1]], ["tile_oh", "sp", [-1, 2, 2]], ["tile_ow", "sp", [-1, 12, 2]], ["reorder_0", "re", [0, 1, 2, 3, 4, 5, 6, 7, 8, 9]], ["ann_reduce", "an", ["unroll", "none"]], ["ann_spatial", "an", ["unroll", "vec", "none"]]]}, "result": [[0.1194232], 0, 68.56604528427124, 1630336975.208448], "version": 0.2, "tvm_version": "0.8.dev0"}
{"input": ["opencl -keys=mali,opencl,gpu -device=mali -max_num_threads=256 -thread_warp_size=1", "conv2d_nchw_spatial_pack.mali", [["TENSOR", [1, 16, 212, 168], "float32"], ["TENSOR", [15, 16, 1, 1], "float32"], [1, 1], [0, 0, 0, 0], [1, 1], "float32"], {}], "config": {"index": 484767, "code_hash": null, "entity": [["tile_co", "sp", [-1, 1, 1]], ["tile_oh", "sp", [-1, 2, 2]], ["tile_ow", "sp", [-1, 12, 2]], ["reorder_0", "re", [0, 1, 2, 3, 4, 5, 6, 9, 7, 8]], ["ann_reduce", "an", ["none", "none"]], ["ann_spatial", "an", ["none", "unroll", "unroll"]]]}, "result": [[0.026846625], 0, 77.6378264427185, 1630336984.3066297], "version": 0.2, "tvm_version": "0.8.dev0"}
{"input": ["opencl -keys=mali,opencl,gpu -device=mali -max_num_threads=256 -thread_warp_size=1", "conv2d_nchw_spatial_pack.mali", [["TENSOR", [1, 16, 212, 168], "float32"], ["TENSOR", [15, 16, 1, 1], "float32"], [1, 1], [0, 0, 0, 0], [1, 1], "float32"], {}], "config": {"index": 1636587, "code_hash": null, "entity": [["tile_co", "sp", [-1, 1, 1]], ["tile_oh", "sp", [-1, 2, 2]], ["tile_ow", "sp", [-1, 12, 2]], ["reorder_0", "re", [0, 1, 2, 3, 4, 5, 6, 7, 8, 9]], ["ann_reduce", "an", ["none", "none"]], ["ann_spatial", "an", ["unroll", "vec", "none"]]]}, "result": [[0.0966678], 0, 87.4208972454071, 1630336994.1200628], "version": 0.2, "tvm_version": "0.8.dev0"}
{"input": ["opencl -keys=mali,opencl,gpu -device=mali -max_num_threads=256 -thread_warp_size=1", "conv2d_nchw_spatial_pack.mali", [["TENSOR", [1, 16, 212, 168], "float32"], ["TENSOR", [15, 16, 1, 1], "float32"], [1, 1], [0, 0, 0, 0], [1, 1], "float32"], {}], "config": {"index": 995067, "code_hash": null, "entity": [["tile_co", "sp", [-1, 1, 1]], ["tile_oh", "sp", [-1, 2, 2]], ["tile_ow", "sp", [-1, 12, 2]], ["reorder_0", "re", [0, 1, 2, 3, 4, 5, 6, 7, 8, 9]], ["ann_reduce", "an", ["unroll", "none"]], ["ann_spatial", "an", ["unroll", "none", "none"]]]}, "result": [[0.0341237332], 0, 97.07919812202454, 1630337003.8095226], "version": 0.2, "tvm_version": "0.8.dev0"}
{"input": ["opencl -keys=mali,opencl,gpu -device=mali -max_num_threads=256 -thread_warp_size=1", "conv2d_nchw_spatial_pack.mali", [["TENSOR", [1, 16, 212, 168], "float32"], ["TENSOR", [15, 16, 1, 1], "float32"], [1, 1], [0, 0, 0, 0], [1, 1], "float32"], {}], "config": {"index": 2059245, "code_hash": null, "entity": [["tile_co", "sp", [-1, 1, 1]], ["tile_oh", "sp", [-1, 2, 2]], ["tile_ow", "sp", [-1, 7, 2]], ["reorder_0", "re", [0, 1, 2, 3, 4, 5, 6, 9, 7, 8]], ["ann_reduce", "an", ["unroll", "none"]], ["ann_spatial", "an", ["vec", "none", "unroll"]]]}, "result": [[0.0328392], 0, 106.55742764472961, 1630337013.3143253], "version": 0.2, "tvm_version": "0.8.dev0"}
{"input": ["opencl -keys=mali,opencl,gpu -device=mali -max_num_threads=256 -thread_warp_size=1", "conv2d_nchw_spatial_pack.mali", [["TENSOR", [1, 16, 212, 168], "float32"], ["TENSOR", [15, 16, 1, 1], "float32"], [1, 1], [0, 0, 0, 0], [1, 1], "float32"], {}], "config": {"index": 2088567, "code_hash": null, "entity": [["tile_co", "sp", [-1, 1, 1]], ["tile_oh", "sp", [-1, 2, 2]], ["tile_ow", "sp", [-1, 12, 2]], ["reorder_0", "re", [0, 1, 2, 3, 4, 5, 6, 9, 7, 8]], ["ann_reduce", "an", ["unroll", "unroll"]], ["ann_spatial", "an", ["vec", "none", "unroll"]]]}, "result": [[0.026410875], 0, 115.52691578865051, 1630337022.301798], "version": 0.2, "tvm_version": "0.8.dev0"}
{"input": ["opencl -keys=mali,opencl,gpu -device=mali -max_num_threads=256 -thread_warp_size=1", "conv2d_nchw_spatial_pack.mali", [["TENSOR", [1, 16, 212, 168], "float32"], ["TENSOR", [15, 16, 1, 1], "float32"], [1, 1], [0, 0, 0, 0], [1, 1], "float32"], {}], "config": {"index": 1811547, "code_hash": null, "entity": [["tile_co", "sp", [-1, 1, 1]], ["tile_oh", "sp", [-1, 2, 2]], ["tile_ow", "sp", [-1, 12, 2]], ["reorder_0", "re", [0, 1, 2, 3, 4, 5, 6, 7, 8, 9]], ["ann_reduce", "an", ["unroll", "none"]], ["ann_spatial", "an", ["unroll", "vec", "unroll"]]]}, "result": [[0.11500080000000001], 0, 125.21294713020325, 1630337032.0204268], "version": 0.2, "tvm_version": "0.8.dev0"}
{"input": ["opencl -keys=mali,opencl,gpu -device=mali -max_num_threads=256 -thread_warp_size=1", "conv2d_nchw_spatial_pack.mali", [["TENSOR", [1, 16, 212, 168], "float32"], ["TENSOR", [15, 16, 1, 1], "float32"], [1, 1], [0, 0, 0, 0], [1, 1], "float32"], {}], "config": {"index": 1942767, "code_hash": null, "entity": [["tile_co", "sp", [-1, 1, 1]], ["tile_oh", "sp", [-1, 2, 2]], ["tile_ow", "sp", [-1, 12, 2]], ["reorder_0", "re", [0, 1, 2, 3, 4, 5, 6, 9, 7, 8]], ["ann_reduce", "an", ["unroll", "none"]], ["ann_spatial", "an", ["vec", "none", "none"]]]}, "result": [[0.0332242], 0, 135.07893228530884, 1630337041.9151528], "version": 0.2, "tvm_version": "0.8.dev0"}
{"input": ["opencl -keys=mali,opencl,gpu -device=mali -max_num_threads=256 -thread_warp_size=1", "conv2d_nchw_spatial_pack.mali", [["TENSOR", [1, 16, 212, 168], "float32"], ["TENSOR", [15, 16, 1, 1], "float32"], [1, 1], [0, 0, 0, 0], [1, 1], "float32"], {}], "config": {"index": 2059083, "code_hash": null, "entity": [["tile_co", "sp", [-1, 1, 1]], ["tile_oh", "sp", [-1, 2, 2]], ["tile_ow", "sp", [-1, 6, 2]], ["reorder_0", "re", [0, 1, 2, 3, 4, 5, 6, 9, 7, 8]], ["ann_reduce", "an", ["unroll", "none"]], ["ann_spatial", "an", ["vec", "none", "unroll"]]]}, "result": [[0.0472172], 0, 144.79040431976318, 1630337051.63467], "version": 0.2, "tvm_version": "0.8.dev0"}
{"input": ["opencl -keys=mali,opencl,gpu -device=mali -max_num_threads=256 -thread_warp_size=1", "conv2d_nchw_spatial_pack.mali", [["TENSOR", [1, 16, 212, 168], "float32"], ["TENSOR", [15, 16, 1, 1], "float32"], [1, 1], [0, 0, 0, 0], [1, 1], "float32"], {}], "config": {"index": 936747, "code_hash": null, "entity": [["tile_co", "sp", [-1, 1, 1]], ["tile_oh", "sp", [-1, 2, 2]], ["tile_ow", "sp", [-1, 12, 2]], ["reorder_0", "re", [0, 1, 2, 3, 4, 5, 6, 7, 8, 9]], ["ann_reduce", "an", ["none", "none"]], ["ann_spatial", "an", ["unroll", "none", "none"]]]}, "result": [[0.027518541625], 0, 8.68041181564331, 1630337061.0136993], "version": 0.2, "tvm_version": "0.8.dev0"}
{"input": ["opencl -keys=mali,opencl,gpu -device=mali -max_num_threads=256 -thread_warp_size=1", "conv2d_nchw_spatial_pack.mali", [["TENSOR", [1, 16, 212, 168], "float32"], ["TENSOR", [15, 16, 1, 1], "float32"], [1, 1], [0, 0, 0, 0], [1, 1], "float32"], {}], "config": {"index": 193005, "code_hash": null, "entity": [["tile_co", "sp", [-1, 1, 1]], ["tile_oh", "sp", [-1, 2, 2]], ["tile_ow", "sp", [-1, 7, 2]], ["reorder_0", "re", [0, 1, 2, 3, 4, 5, 6, 9, 7, 8]], ["ann_reduce", "an", ["unroll", "none"]], ["ann_spatial", "an", ["none", "none", "unroll"]]]}, "result": [[0.0303074666], 0, 17.82707715034485, 1630337070.1792786], "version": 0.2, "tvm_version": "0.8.dev0"}
{"input": ["opencl -keys=mali,opencl,gpu -device=mali -max_num_threads=256 -thread_warp_size=1", "conv2d_nchw_spatial_pack.mali", [["TENSOR", [1, 16, 212, 168], "float32"], ["TENSOR", [15, 16, 1, 1], "float32"], [1, 1], [0, 0, 0, 0], [1, 1], "float32"], {}], "config": {"index": 1697616, "code_hash": null, "entity": [["tile_co", "sp", [-1, 1, 1]], ["tile_oh", "sp", [-1, 4, 1]], ["tile_ow", "sp", [-1, 6, 4]], ["reorder_0", "re", [0, 1, 2, 3, 4, 5, 6, 7, 8, 9]], ["ann_reduce", "an", ["unroll", "none"]], ["ann_spatial", "an", ["unroll", "vec", "none"]]]}, "result": [[0.042269799999999996], 0, 27.32424783706665, 1630337079.7026699], "version": 0.2, "tvm_version": "0.8.dev0"}
{"input": ["opencl -keys=mali,opencl,gpu -device=mali -max_num_threads=256 -thread_warp_size=1", "conv2d_nchw_spatial_pack.mali", [["TENSOR", [1, 16, 212, 168], "float32"], ["TENSOR", [15, 16, 1, 1], "float32"], [1, 1], [0, 0, 0, 0], [1, 1], "float32"], {}], "config": {"index": 2030247, "code_hash": null, "entity": [["tile_co", "sp", [-1, 1, 1]], ["tile_oh", "sp", [-1, 2, 2]], ["tile_ow", "sp", [-1, 12, 2]], ["reorder_0", "re", [0, 1, 2, 3, 4, 5, 6, 9, 7, 8]], ["ann_reduce", "an", ["none", "unroll"]], ["ann_spatial", "an", ["vec", "none", "unroll"]]]}, "result": [[0.027412458375], 0, 36.39784836769104, 1630337088.805883], "version": 0.2, "tvm_version": "0.8.dev0"}
{"input": ["opencl -keys=mali,opencl,gpu -device=mali -max_num_threads=256 -thread_warp_size=1", "conv2d_nchw_spatial_pack.mali", [["TENSOR", [1, 16, 212, 168], "float32"], ["TENSOR", [15, 16, 1, 1], "float32"], [1, 1], [0, 0, 0, 0], [1, 1], "float32"], {}], "config": {"index": 2059110, "code_hash": null, "entity": [["tile_co", "sp", [-1, 1, 1]], ["tile_oh", "sp", [-1, 1, 4]], ["tile_ow", "sp", [-1, 6, 2]], ["reorder_0", "re", [0, 1, 2, 3, 4, 5, 6, 9, 7, 8]], ["ann_reduce", "an", ["unroll", "none"]], ["ann_spatial", "an", ["vec", "none", "unroll"]]]}, "result": [[0.021349541625], 0, 45.223841428756714, 1630337097.6492026], "version": 0.2, "tvm_version": "0.8.dev0"}
{"input": ["opencl -keys=mali,opencl,gpu -device=mali -max_num_threads=256 -thread_warp_size=1", "conv2d_nchw_spatial_pack.mali", [["TENSOR", [1, 16, 212, 168], "float32"], ["TENSOR", [15, 16, 1, 1], "float32"], [1, 1], [0, 0, 0, 0], [1, 1], "float32"], {}], "config": {"index": 1753227, "code_hash": null, "entity": [["tile_co", "sp", [-1, 1, 1]], ["tile_oh", "sp", [-1, 2, 2]], ["tile_ow", "sp", [-1, 12, 2]], ["reorder_0", "re", [0, 1, 2, 3, 4, 5, 6, 7, 8, 9]], ["ann_reduce", "an", ["none", "none"]], ["ann_spatial", "an", ["unroll", "vec", "unroll"]]]}, "result": [[0.020955500000000002], 0, 54.34488582611084, 1630337106.8023884], "version": 0.2, "tvm_version": "0.8.dev0"}
{"input": ["opencl -keys=mali,opencl,gpu -device=mali -max_num_threads=256 -thread_warp_size=1", "conv2d_nchw_spatial_pack.mali", [["TENSOR", [1, 16, 212, 168], "float32"], ["TENSOR", [15, 16, 1, 1], "float32"], [1, 1], [0, 0, 0, 0], [1, 1], "float32"], {}], "config": {"index": 1126287, "code_hash": null, "entity": [["tile_co", "sp", [-1, 1, 1]], ["tile_oh", "sp", [-1, 2, 2]], ["tile_ow", "sp", [-1, 12, 2]], ["reorder_0", "re", [0, 1, 2, 3, 4, 5, 6, 9, 7, 8]], ["ann_reduce", "an", ["unroll", "none"]], ["ann_spatial", "an", ["unroll", "none", "unroll"]]]}, "result": [[0.026293541625], 0, 63.4953179359436, 1630337115.9765759], "version": 0.2, "tvm_version": "0.8.dev0"}
