example_04/auto_tvm_log/v9h-model-01-NCHW-opencl-C500-T21-09-01-17-32.log.tmp
{"input": ["opencl -keys=mali,opencl,gpu -device=mali -max_num_threads=512 -thread_warp_size=2", "conv2d_nchw_spatial_pack.mali", [["TENSOR", [1, 32, 53, 42], "float32"], ["TENSOR", [4, 32, 1, 1], "float32"], [1, 1], [0, 0, 0, 0], [1, 1], "float32"], {}], "config": {"index": 48017, "code_hash": null, "entity": [["tile_co", "sp", [-1, 1, 4]], ["tile_oh", "sp", [-1, 53, 1]], ["tile_ow", "sp", [-1, 6, 7]], ["reorder_0", "re", [0, 1, 2, 3, 4, 5, 6, 7, 8, 9]], ["ann_reduce", "an", ["none", "unroll"]], ["ann_spatial", "an", ["unroll", "unroll", "unroll"]]]}, "result": [[0.0006444533811188812], 0, 16.135594129562378, 1630488791.563786], "version": 0.2, "tvm_version": "0.8.dev0"}
{"input": ["opencl -keys=mali,opencl,gpu -device=mali -max_num_threads=512 -thread_warp_size=2", "conv2d_nchw_spatial_pack.mali", [["TENSOR", [1, 32, 53, 42], "float32"], ["TENSOR", [4, 32, 1, 1], "float32"], [1, 1], [0, 0, 0, 0], [1, 1], "float32"], {}], "config": {"index": 49961, "code_hash": null, "entity": [["tile_co", "sp", [-1, 1, 4]], ["tile_oh", "sp", [-1, 53, 1]], ["tile_ow", "sp", [-1, 6, 7]], ["reorder_0", "re", [0, 1, 2, 3, 4, 5, 6, 7, 8, 9]], ["ann_reduce", "an", ["unroll", "unroll"]], ["ann_spatial", "an", ["unroll", "unroll", "unroll"]]]}, "result": [[0.0006800809202898551], 0, 24.940379858016968, 1630488800.3858864], "version": 0.2, "tvm_version": "0.8.dev0"}
{"input": ["opencl -keys=mali,opencl,gpu -device=mali -max_num_threads=512 -thread_warp_size=2", "conv2d_nchw_spatial_pack.mali", [["TENSOR", [1, 32, 53, 42], "float32"], ["TENSOR", [4, 32, 1, 1], "float32"], [1, 1], [0, 0, 0, 0], [1, 1], "float32"], {}], "config": {"index": 48053, "code_hash": null, "entity": [["tile_co", "sp", [-1, 1, 4]], ["tile_oh", "sp", [-1, 53, 1]], ["tile_ow", "sp", [-1, 3, 14]], ["reorder_0", "re", [0, 1, 2, 3, 4, 5, 6, 7, 8, 9]], ["ann_reduce", "an", ["none", "unroll"]], ["ann_spatial", "an", ["unroll", "unroll", "unroll"]]]}, "result": [[0.0007370983472584857], 0, 34.273138999938965, 1630488809.7177458], "version": 0.2, "tvm_version": "0.8.dev0"}
{"input": ["opencl -keys=mali,opencl,gpu -device=mali -max_num_threads=512 -thread_warp_size=2", "conv2d_nchw_spatial_pack.mali", [["TENSOR", [1, 32, 53, 42], "float32"], ["TENSOR", [4, 32, 1, 1], "float32"], [1, 1], [0, 0, 0, 0], [1, 1], "float32"], {}], "config": {"index": 47999, "code_hash": null, "entity": [["tile_co", "sp", [-1, 1, 4]], ["tile_oh", "sp", [-1, 53, 1]], ["tile_ow", "sp", [-1, 3, 7]], ["reorder_0", "re", [0, 1, 2, 3, 4, 5, 6, 7, 8, 9]], ["ann_reduce", "an", ["none", "unroll"]], ["ann_spatial", "an", ["unroll", "unroll", "unroll"]]]}, "result": [[0.0005521204013377927], 0, 42.6032497882843, 1630488818.0616686], "version": 0.2, "tvm_version": "0.8.dev0"}
{"input": ["opencl -keys=mali,opencl,gpu -device=mali -max_num_threads=512 -thread_warp_size=2", "conv2d_nchw_spatial_pack.mali", [["TENSOR", [1, 32, 53, 42], "float32"], ["TENSOR", [4, 32, 1, 1], "float32"], [1, 1], [0, 0, 0, 0], [1, 1], "float32"], {}], "config": {"index": 49997, "code_hash": null, "entity": [["tile_co", "sp", [-1, 1, 4]], ["tile_oh", "sp", [-1, 53, 1]], ["tile_ow", "sp", [-1, 3, 14]], ["reorder_0", "re", [0, 1, 2, 3, 4, 5, 6, 7, 8, 9]], ["ann_reduce", "an", ["unroll", "unroll"]], ["ann_spatial", "an", ["unroll", "unroll", "unroll"]]]}, "result": [[0.0006054598337950139], 0, 51.375617265701294, 1630488826.8505492], "version": 0.2, "tvm_version": "0.8.dev0"}
{"input": ["opencl -keys=mali,opencl,gpu -device=mali -max_num_threads=512 -thread_warp_size=2", "conv2d_nchw_spatial_pack.mali", [["TENSOR", [1, 32, 53, 42], "float32"], ["TENSOR", [4, 32, 1, 1], "float32"], [1, 1], [0, 0, 0, 0], [1, 1], "float32"], {}], "config": {"index": 49943, "code_hash": null, "entity": [["tile_co", "sp", [-1, 1, 4]], ["tile_oh", "sp", [-1, 53, 1]], ["tile_ow", "sp", [-1, 3, 7]], ["reorder_0", "re", [0, 1, 2, 3, 4, 5, 6, 7, 8, 9]], ["ann_reduce", "an", ["unroll", "unroll"]], ["ann_spatial", "an", ["unroll", "unroll", "unroll"]]]}, "result": [[0.0009642974137931034], 0, 60.48501014709473, 1630488835.972518], "version": 0.2, "tvm_version": "0.8.dev0"}
{"input": ["opencl -keys=mali,opencl,gpu -device=mali -max_num_threads=512 -thread_warp_size=2", "conv2d_nchw_spatial_pack.mali", [["TENSOR", [1, 32, 53, 42], "float32"], ["TENSOR", [4, 32, 1, 1], "float32"], [1, 1], [0, 0, 0, 0], [1, 1], "float32"], {}], "config": {"index": 49883, "code_hash": null, "entity": [["tile_co", "sp", [-1, 1, 4]], ["tile_oh", "sp", [-1, 1, 1]], ["tile_ow", "sp", [-1, 7, 6]], ["reorder_0", "re", [0, 1, 2, 3, 4, 5, 6, 7, 8, 9]], ["ann_reduce", "an", ["unroll", "unroll"]], ["ann_spatial", "an", ["unroll", "unroll", "unroll"]]]}, "result": [[0.0008015878594249201], 0, 69.29573774337769, 1630488844.8013783], "version": 0.2, "tvm_version": "0.8.dev0"}
{"input": ["opencl -keys=mali,opencl,gpu -device=mali -max_num_threads=512 -thread_warp_size=2", "conv2d_nchw_spatial_pack.mali", [["TENSOR", [1, 32, 53, 42], "float32"], ["TENSOR", [4, 32, 1, 1], "float32"], [1, 1], [0, 0, 0, 0], [1, 1], "float32"], {}], "config": {"index": 47939, "code_hash": null, "entity": [["tile_co", "sp", [-1, 1, 4]], ["tile_oh", "sp", [-1, 1, 1]], ["tile_ow", "sp", [-1, 7, 6]], ["reorder_0", "re", [0, 1, 2, 3, 4, 5, 6, 7, 8, 9]], ["ann_reduce", "an", ["none", "unroll"]], ["ann_spatial", "an", ["unroll", "unroll", "unroll"]]]}, "result": [[0.0009534972527472527], 0, 78.15956282615662, 1630488853.6678944], "version": 0.2, "tvm_version": "0.8.dev0"}
{"input": ["opencl -keys=mali,opencl,gpu -device=mali -max_num_threads=512 -thread_warp_size=2", "conv2d_nchw_spatial_pack.mali", [["TENSOR", [1, 32, 53, 42], "float32"], ["TENSOR", [4, 32, 1, 1], "float32"], [1, 1], [0, 0, 0, 0], [1, 1], "float32"], {}], "config": {"index": 48052, "code_hash": null, "entity": [["tile_co", "sp", [-1, 2, 2]], ["tile_oh", "sp", [-1, 53, 1]], ["tile_ow", "sp", [-1, 3, 14]], ["reorder_0", "re", [0, 1, 2, 3, 4, 5, 6, 7, 8, 9]], ["ann_reduce", "an", ["none", "unroll"]], ["ann_spatial", "an", ["unroll", "unroll", "unroll"]]]}, "result": [[0.0005533206435986159], 0, 86.53129553794861, 1630488862.044061], "version": 0.2, "tvm_version": "0.8.dev0"}
{"input": ["opencl -keys=mali,opencl,gpu -device=mali -max_num_threads=512 -thread_warp_size=2", "conv2d_nchw_spatial_pack.mali", [["TENSOR", [1, 32, 53, 42], "float32"], ["TENSOR", [4, 32, 1, 1], "float32"], [1, 1], [0, 0, 0, 0], [1, 1], "float32"], {}], "config": {"index": 48051, "code_hash": null, "entity": [["tile_co", "sp", [-1, 1, 2]], ["tile_oh", "sp", [-1, 53, 1]], ["tile_ow", "sp", [-1, 3, 14]], ["reorder_0", "re", [0, 1, 2, 3, 4, 5, 6, 7, 8, 9]], ["ann_reduce", "an", ["none", "unroll"]], ["ann_spatial", "an", ["unroll", "unroll", "unroll"]]]}, "result": [[0.0012711417973273942], 0, 96.14456725120544, 1630488871.6698503], "version": 0.2, "tvm_version": "0.8.dev0"}
{"input": ["opencl -keys=mali,opencl,gpu -device=mali -max_num_threads=512 -thread_warp_size=2", "conv2d_nchw_spatial_pack.mali", [["TENSOR", [1, 32, 53, 42], "float32"], ["TENSOR", [4, 32, 1, 1], "float32"], [1, 1], [0, 0, 0, 0], [1, 1], "float32"], {}], "config": {"index": 49996, "code_hash": null, "entity": [["tile_co", "sp", [-1, 2, 2]], ["tile_oh", "sp", [-1, 53, 1]], ["tile_ow", "sp", [-1, 3, 14]], ["reorder_0", "re", [0, 1, 2, 3, 4, 5, 6, 7, 8, 9]], ["ann_reduce", "an", ["unroll", "unroll"]], ["ann_spatial", "an", ["unroll", "unroll", "unroll"]]]}, "result": [[0.0007194064460966542], 0, 104.73183155059814, 1630488880.27901], "version": 0.2, "tvm_version": "0.8.dev0"}
{"input": ["opencl -keys=mali,opencl,gpu -device=mali -max_num_threads=512 -thread_warp_size=2", "conv2d_nchw_spatial_pack.mali", [["TENSOR", [1, 32, 53, 42], "float32"], ["TENSOR", [4, 32, 1, 1], "float32"], [1, 1], [0, 0, 0, 0], [1, 1], "float32"], {}], "config": {"index": 47490, "code_hash": null, "entity": [["tile_co", "sp", [-1, 1, 1]], ["tile_oh", "sp", [-1, 53, 1]], ["tile_ow", "sp", [-1, 2, 7]], ["reorder_0", "re", [0, 1, 2, 3, 4, 5, 6, 9, 7, 8]], ["ann_reduce", "an", ["none", "none"]], ["ann_spatial", "an", ["unroll", "unroll", "unroll"]]]}, "result": [[0.0008548974340659341], 0, 113.02771162986755, 1630488888.5966754], "version": 0.2, "tvm_version": "0.8.dev0"}
{"input": ["opencl -keys=mali,opencl,gpu -device=mali -max_num_threads=512 -thread_warp_size=2", "conv2d_nchw_spatial_pack.mali", [["TENSOR", [1, 32, 53, 42], "float32"], ["TENSOR", [4, 32, 1, 1], "float32"], [1, 1], [0, 0, 0, 0], [1, 1], "float32"], {}], "config": {"index": 48462, "code_hash": null, "entity": [["tile_co", "sp", [-1, 1, 1]], ["tile_oh", "sp", [-1, 53, 1]], ["tile_ow", "sp", [-1, 2, 7]], ["reorder_0", "re", [0, 1, 2, 3, 4, 5, 6, 9, 7, 8]], ["ann_reduce", "an", ["none", "unroll"]], ["ann_spatial", "an", ["unroll", "unroll", "unroll"]]]}, "result": [[0.0012698976078431372], 0, 121.80570888519287, 1630488897.389672], "version": 0.2, "tvm_version": "0.8.dev0"}
{"input": ["opencl -keys=mali,opencl,gpu -device=mali -max_num_threads=512 -thread_warp_size=2", "conv2d_nchw_spatial_pack.mali", [["TENSOR", [1, 32, 53, 42], "float32"], ["TENSOR", [4, 32, 1, 1], "float32"], [1, 1], [0, 0, 0, 0], [1, 1], "float32"], {}], "config": {"index": 47045, "code_hash": null, "entity": [["tile_co", "sp", [-1, 1, 4]], ["tile_oh", "sp", [-1, 53, 1]], ["tile_ow", "sp", [-1, 6, 7]], ["reorder_0", "re", [0, 1, 2, 3, 4, 5, 6, 7, 8, 9]], ["ann_reduce", "an", ["none", "none"]], ["ann_spatial", "an", ["unroll", "unroll", "unroll"]]]}, "result": [[0.0008893550061919505], 0, 130.63965487480164, 1630488906.23265], "version": 0.2, "tvm_version": "0.8.dev0"}
{"input": ["opencl -keys=mali,opencl,gpu -device=mali -max_num_threads=512 -thread_warp_size=2", "conv2d_nchw_spatial_pack.mali", [["TENSOR", [1, 32, 53, 42], "float32"], ["TENSOR", [4, 32, 1, 1], "float32"], [1, 1], [0, 0, 0, 0], [1, 1], "float32"], {}], "config": {"index": 47491, "code_hash": null, "entity": [["tile_co", "sp", [-1, 2, 1]], ["tile_oh", "sp", [-1, 53, 1]], ["tile_ow", "sp", [-1, 2, 7]], ["reorder_0", "re", [0, 1, 2, 3, 4, 5, 6, 9, 7, 8]], ["ann_reduce", "an", ["none", "none"]], ["ann_spatial", "an", ["unroll", "unroll", "unroll"]]]}, "result": [[0.0009503242240437159], 0, 139.00868153572083, 1630488914.6253223], "version": 0.2, "tvm_version": "0.8.dev0"}
{"input": ["opencl -keys=mali,opencl,gpu -device=mali -max_num_threads=512 -thread_warp_size=2", "conv2d_nchw_spatial_pack.mali", [["TENSOR", [1, 32, 53, 42], "float32"], ["TENSOR", [4, 32, 1, 1], "float32"], [1, 1], [0, 0, 0, 0], [1, 1], "float32"], {}], "config": {"index": 48463, "code_hash": null, "entity": [["tile_co", "sp", [-1, 2, 1]], ["tile_oh", "sp", [-1, 53, 1]], ["tile_ow", "sp", [-1, 2, 7]], ["reorder_0", "re", [0, 1, 2, 3, 4, 5, 6, 9, 7, 8]], ["ann_reduce", "an", ["none", "unroll"]], ["ann_spatial", "an", ["unroll", "unroll", "unroll"]]]}, "result": [[0.0011319292530612246], 0, 147.70778632164001, 1630488923.3360994], "version": 0.2, "tvm_version": "0.8.dev0"}
{"input": ["opencl -keys=mali,opencl,gpu -device=mali -max_num_threads=512 -thread_warp_size=2", "conv2d_nchw_spatial_pack.mali", [["TENSOR", [1, 32, 53, 42], "float32"], ["TENSOR", [4, 32, 1, 1], "float32"], [1, 1], [0, 0, 0, 0], [1, 1], "float32"], {}], "config": {"index": 47921, "code_hash": null, "entity": [["tile_co", "sp", [-1, 1, 4]], ["tile_oh", "sp", [-1, 1, 1]], ["tile_ow", "sp", [-1, 1, 6]], ["reorder_0", "re", [0, 1, 2, 3, 4, 5, 6, 7, 8, 9]], ["ann_reduce", "an", ["none", "unroll"]], ["ann_spatial", "an", ["unroll", "unroll", "unroll"]]]}, "result": [[0.0010578839683544304], 0, 16.698482036590576, 1630488940.460124], "version": 0.2, "tvm_version": "0.8.dev0"}
{"input": ["opencl -keys=mali,opencl,gpu -device=mali -max_num_threads=512 -thread_warp_size=2", "conv2d_nchw_spatial_pack.mali", [["TENSOR", [1, 32, 53, 42], "float32"], ["TENSOR", [4, 32, 1, 1], "float32"], [1, 1], [0, 0, 0, 0], [1, 1], "float32"], {}], "config": {"index": 48989, "code_hash": null, "entity": [["tile_co", "sp", [-1, 1, 4]], ["tile_oh", "sp", [-1, 53, 1]], ["tile_ow", "sp", [-1, 6, 7]], ["reorder_0", "re", [0, 1, 2, 3, 4, 5, 6, 7, 8, 9]], ["ann_reduce", "an", ["unroll", "none"]], ["ann_spatial", "an", ["unroll", "unroll", "unroll"]]]}, "result": [[0.000869574025974026], 0, 25.90513324737549, 1630488949.6785872], "version": 0.2, "tvm_version": "0.8.dev0"}
{"input": ["opencl -keys=mali,opencl,gpu -device=mali -max_num_threads=512 -thread_warp_size=2", "conv2d_nchw_spatial_pack.mali", [["TENSOR", [1, 32, 53, 42], "float32"], ["TENSOR", [4, 32, 1, 1], "float32"], [1, 1], [0, 0, 0, 0], [1, 1], "float32"], {}], "config": {"index": 47043, "code_hash": null, "entity": [["tile_co", "sp", [-1, 1, 2]], ["tile_oh", "sp", [-1, 53, 1]], ["tile_ow", "sp", [-1, 6, 7]], ["reorder_0", "re", [0, 1, 2, 3, 4, 5, 6, 7, 8, 9]], ["ann_reduce", "an", ["none", "none"]], ["ann_spatial", "an", ["unroll", "unroll", "unroll"]]]}, "result": [[0.0006862192470238096], 0, 34.98398947715759, 1630488958.7733123], "version": 0.2, "tvm_version": "0.8.dev0"}
{"input": ["opencl -keys=mali,opencl,gpu -device=mali -max_num_threads=512 -thread_warp_size=2", "conv2d_nchw_spatial_pack.mali", [["TENSOR", [1, 32, 53, 42], "float32"], ["TENSOR", [4, 32, 1, 1], "float32"], [1, 1], [0, 0, 0, 0], [1, 1], "float32"], {}], "config": {"index": 47081, "code_hash": null, "entity": [["tile_co", "sp", [-1, 1, 4]], ["tile_oh", "sp", [-1, 53, 1]], ["tile_ow", "sp", [-1, 3, 14]], ["reorder_0", "re", [0, 1, 2, 3, 4, 5, 6, 7, 8, 9]], ["ann_reduce", "an", ["none", "none"]], ["ann_spatial", "an", ["unroll", "unroll", "unroll"]]]}, "result": [[0.0006552228328767124], 0, 44.11295127868652, 1630488967.9015703], "version": 0.2, "tvm_version": "0.8.dev0"}
{"input": ["opencl -keys=mali,opencl,gpu -device=mali -max_num_threads=512 -thread_warp_size=2", "conv2d_nchw_spatial_pack.mali", [["TENSOR", [1, 32, 53, 42], "float32"], ["TENSOR", [4, 32, 1, 1], "float32"], [1, 1], [0, 0, 0, 0], [1, 1], "float32"], {}], "config": {"index": 47945, "code_hash": null, "entity": [["tile_co", "sp", [-1, 1, 4]], ["tile_oh", "sp", [-1, 53, 1]], ["tile_ow", "sp", [-1, 7, 6]], ["reorder_0", "re", [0, 1, 2, 3, 4, 5, 6, 7, 8, 9]], ["ann_reduce", "an", ["none", "unroll"]], ["ann_spatial", "an", ["unroll", "unroll", "unroll"]]]}, "result": [[0.0012961951743421052], 0, 52.744354009628296, 1630488976.5500624], "version": 0.2, "tvm_version": "0.8.dev0"}
{"input": ["opencl -keys=mali,opencl,gpu -device=mali -max_num_threads=512 -thread_warp_size=2", "conv2d_nchw_spatial_pack.mali", [["TENSOR", [1, 32, 53, 42], "float32"], ["TENSOR", [4, 32, 1, 1], "float32"], [1, 1], [0, 0, 0, 0], [1, 1], "float32"], {}], "config": {"index": 16913, "code_hash": null, "entity": [["tile_co", "sp", [-1, 1, 4]], ["tile_oh", "sp", [-1, 53, 1]], ["tile_ow", "sp", [-1, 6, 7]], ["reorder_0", "re", [0, 1, 2, 3, 4, 5, 6, 7, 8, 9]], ["ann_reduce", "an", ["none", "unroll"]], ["ann_spatial", "an", ["none", "unroll", "unroll"]]]}, "result": [[0.001476214664399093], 0, 62.45020079612732, 1630488986.2531126], "version": 0.2, "tvm_version": "0.8.dev0"}
{"input": ["opencl -keys=mali,opencl,gpu -device=mali -max_num_threads=512 -thread_warp_size=2", "conv2d_nchw_spatial_pack.mali", [["TENSOR", [1, 32, 53, 42], "float32"], ["TENSOR", [4, 32, 1, 1], "float32"], [1, 1], [0, 0, 0, 0], [1, 1], "float32"], {}], "config": {"index": 47027, "code_hash": null, "entity": [["tile_co", "sp", [-1, 1, 4]], ["tile_oh", "sp", [-1, 53, 1]], ["tile_ow", "sp", [-1, 3, 7]], ["reorder_0", "re", [0, 1, 2, 3, 4, 5, 6, 7, 8, 9]], ["ann_reduce", "an", ["none", "none"]], ["ann_spatial", "an", ["unroll", "unroll", "unroll"]]]}, "result": [[0.000932351292929293], 0, 70.91335415840149, 1630488994.7450006], "version": 0.2, "tvm_version": "0.8.dev0"}
{"input": ["opencl -keys=mali,opencl,gpu -device=mali -max_num_threads=512 -thread_warp_size=2", "conv2d_nchw_spatial_pack.mali", [["TENSOR", [1, 32, 53, 42], "float32"], ["TENSOR", [4, 32, 1, 1], "float32"], [1, 1], [0, 0, 0, 0], [1, 1], "float32"], {}], "config": {"index": 36353, "code_hash": null, "entity": [["tile_co", "sp", [-1, 1, 4]], ["tile_oh", "sp", [-1, 53, 1]], ["tile_ow", "sp", [-1, 6, 7]], ["reorder_0", "re", [0, 1, 2, 3, 4, 5, 6, 7, 8, 9]], ["ann_reduce", "an", ["none", "unroll"]], ["ann_spatial", "an", ["unroll", "none", "unroll"]]]}, "result": [[0.0007960553094170403], 0, 79.61842107772827, 1630489003.4393957], "version": 0.2, "tvm_version": "0.8.dev0"}
{"input": ["opencl -keys=mali,opencl,gpu -device=mali -max_num_threads=512 -thread_warp_size=2", "conv2d_nchw_spatial_pack.mali", [["TENSOR", [1, 32, 53, 42], "float32"], ["TENSOR", [4, 32, 1, 1], "float32"], [1, 1], [0, 0, 0, 0], [1, 1], "float32"], {}], "config": {"index": 49025, "code_hash": null, "entity": [["tile_co", "sp", [-1, 1, 4]], ["tile_oh", "sp", [-1, 53, 1]], ["tile_ow", "sp", [-1, 3, 14]], ["reorder_0", "re", [0, 1, 2, 3, 4, 5, 6, 7, 8, 9]], ["ann_reduce", "an", ["unroll", "none"]], ["ann_spatial", "an", ["unroll", "unroll", "unroll"]]]}, "result": [[0.0008832332361516036], 0, 88.6155138015747, 1630489012.4571226], "version": 0.2, "tvm_version": "0.8.dev0"}
{"input": ["opencl -keys=mali,opencl,gpu -device=mali -max_num_threads=512 -thread_warp_size=2", "conv2d_nchw_spatial_pack.mali", [["TENSOR", [1, 32, 53, 42], "float32"], ["TENSOR", [4, 32, 1, 1], "float32"], [1, 1], [0, 0, 0, 0], [1, 1], "float32"], {}], "config": {"index": 16386, "code_hash": null, "entity": [["tile_co", "sp", [-1, 1, 1]], ["tile_oh", "sp", [-1, 53, 1]], ["tile_ow", "sp", [-1, 2, 7]], ["reorder_0", "re", [0, 1, 2, 3, 4, 5, 6, 9, 7, 8]], ["ann_reduce", "an", ["none", "none"]], ["ann_spatial", "an", ["none", "unroll", "unroll"]]]}, "result": [[0.0010392719298245613], 0, 97.47431659698486, 1630489021.345243], "version": 0.2, "tvm_version": "0.8.dev0"}
{"input": ["opencl -keys=mali,opencl,gpu -device=mali -max_num_threads=512 -thread_warp_size=2", "conv2d_nchw_spatial_pack.mali", [["TENSOR", [1, 32, 53, 42], "float32"], ["TENSOR", [4, 32, 1, 1], "float32"], [1, 1], [0, 0, 0, 0], [1, 1], "float32"], {}], "config": {"index": 49865, "code_hash": null, "entity": [["tile_co", "sp", [-1, 1, 4]], ["tile_oh", "sp", [-1, 1, 1]], ["tile_ow", "sp", [-1, 1, 6]], ["reorder_0", "re", [0, 1, 2, 3, 4, 5, 6, 7, 8, 9]], ["ann_reduce", "an", ["unroll", "unroll"]], ["ann_spatial", "an", ["unroll", "unroll", "unroll"]]]}, "result": [[0.001007105209439528], 0, 106.74207901954651, 1630489030.6169574], "version": 0.2, "tvm_version": "0.8.dev0"}
{"input": ["opencl -keys=mali,opencl,gpu -device=mali -max_num_threads=512 -thread_warp_size=2", "conv2d_nchw_spatial_pack.mali", [["TENSOR", [1, 32, 53, 42], "float32"], ["TENSOR", [4, 32, 1, 1], "float32"], [1, 1], [0, 0, 0, 0], [1, 1], "float32"], {}], "config": {"index": 17358, "code_hash": null, "entity": [["tile_co", "sp", [-1, 1, 1]], ["tile_oh", "sp", [-1, 53, 1]], ["tile_ow", "sp", [-1, 2, 7]], ["reorder_0", "re", [0, 1, 2, 3, 4, 5, 6, 9, 7, 8]], ["ann_reduce", "an", ["none", "unroll"]], ["ann_spatial", "an", ["none", "unroll", "unroll"]]]}, "result": [[0.0010003992887700536], 0, 115.46087050437927, 1630489039.3623116], "version": 0.2, "tvm_version": "0.8.dev0"}
{"input": ["opencl -keys=mali,opencl,gpu -device=mali -max_num_threads=512 -thread_warp_size=2", "conv2d_nchw_spatial_pack.mali", [["TENSOR", [1, 32, 53, 42], "float32"], ["TENSOR", [4, 32, 1, 1], "float32"], [1, 1], [0, 0, 0, 0], [1, 1], "float32"], {}], "config": {"index": 18857, "code_hash": null, "entity": [["tile_co", "sp", [-1, 1, 4]], ["tile_oh", "sp", [-1, 53, 1]], ["tile_ow", "sp", [-1, 6, 7]], ["reorder_0", "re", [0, 1, 2, 3, 4, 5, 6, 7, 8, 9]], ["ann_reduce", "an", ["unroll", "unroll"]], ["ann_spatial", "an", ["none", "unroll", "unroll"]]]}, "result": [[0.0007310952360248447], 0, 123.94325971603394, 1630489047.8483443], "version": 0.2, "tvm_version": "0.8.dev0"}
{"input": ["opencl -keys=mali,opencl,gpu -device=mali -max_num_threads=512 -thread_warp_size=2", "conv2d_nchw_spatial_pack.mali", [["TENSOR", [1, 32, 53, 42], "float32"], ["TENSOR", [4, 32, 1, 1], "float32"], [1, 1], [0, 0, 0, 0], [1, 1], "float32"], {}], "config": {"index": 76613, "code_hash": null, "entity": [["tile_co", "sp", [-1, 1, 4]], ["tile_oh", "sp", [-1, 1, 1]], ["tile_ow", "sp", [-1, 7, 6]], ["reorder_0", "re", [0, 1, 2, 3, 4, 5, 6, 9, 7, 8]], ["ann_reduce", "an", ["unroll", "none"]], ["ann_spatial", "an", ["vec", "unroll", "unroll"]]]}, "result": [[0.0009502104086378737], 0, 132.38204336166382, 1630489056.292119], "version": 0.2, "tvm_version": "0.8.dev0"}
{"input": ["opencl -keys=mali,opencl,gpu -device=mali -max_num_threads=512 -thread_warp_size=2", "conv2d_nchw_spatial_pack.mali", [["TENSOR", [1, 32, 53, 42], "float32"], ["TENSOR", [4, 32, 1, 1], "float32"], [1, 1], [0, 0, 0, 0], [1, 1], "float32"], {}], "config": {"index": 74669, "code_hash": null, "entity": [["tile_co", "sp", [-1, 1, 4]], ["tile_oh", "sp", [-1, 1, 1]], ["tile_ow", "sp", [-1, 7, 6]], ["reorder_0", "re", [0, 1, 2, 3, 4, 5, 6, 9, 7, 8]], ["ann_reduce", "an", ["none", "none"]], ["ann_spatial", "an", ["vec", "unroll", "unroll"]]]}, "result": [[0.000615040085443038], 0, 141.12198734283447, 1630489065.059841], "version": 0.2, "tvm_version": "0.8.dev0"}
{"input": ["opencl -keys=mali,opencl,gpu -device=mali -max_num_threads=512 -thread_warp_size=2", "conv2d_nchw_spatial_pack.mali", [["TENSOR", [1, 32, 53, 42], "float32"], ["TENSOR", [4, 32, 1, 1], "float32"], [1, 1], [0, 0, 0, 0], [1, 1], "float32"], {}], "config": {"index": 48971, "code_hash": null, "entity": [["tile_co", "sp", [-1, 1, 4]], ["tile_oh", "sp", [-1, 53, 1]], ["tile_ow", "sp", [-1, 3, 7]], ["reorder_0", "re", [0, 1, 2, 3, 4, 5, 6, 7, 8, 9]], ["ann_reduce", "an", ["unroll", "none"]], ["ann_spatial", "an", ["unroll", "unroll", "unroll"]]]}, "result": [[0.0005270580158227848], 0, 149.7571280002594, 1630489073.690631], "version": 0.2, "tvm_version": "0.8.dev0"}
{"input": ["opencl -keys=mali,opencl,gpu -device=mali -max_num_threads=512 -thread_warp_size=2", "conv2d_nchw_spatial_pack.mali", [["TENSOR", [1, 32, 53, 42], "float32"], ["TENSOR", [4, 32, 1, 1], "float32"], [1, 1], [0, 0, 0, 0], [1, 1], "float32"], {}], "config": {"index": 38297, "code_hash": null, "entity": [["tile_co", "sp", [-1, 1, 4]], ["tile_oh", "sp", [-1, 53, 1]], ["tile_ow", "sp", [-1, 6, 7]], ["reorder_0", "re", [0, 1, 2, 3, 4, 5, 6, 7, 8, 9]], ["ann_reduce", "an", ["unroll", "unroll"]], ["ann_spatial", "an", ["unroll", "none", "unroll"]]]}, "result": [[0.001220568753125], 0, 17.080316066741943, 1630489091.1586478], "version": 0.2, "tvm_version": "0.8.dev0"}
{"input": ["opencl -keys=mali,opencl,gpu -device=mali -max_num_threads=512 -thread_warp_size=2", "conv2d_nchw_spatial_pack.mali", [["TENSOR", [1, 32, 53, 42], "float32"], ["TENSOR", [4, 32, 1, 1], "float32"], [1, 1], [0, 0, 0, 0], [1, 1], "float32"], {}], "config": {"index": 47004, "code_hash": null, "entity": [["tile_co", "sp", [-1, 1, 1]], ["tile_oh", "sp", [-1, 53, 1]], ["tile_ow", "sp", [-1, 2, 7]], ["reorder_0", "re", [0, 1, 2, 3, 4, 5, 6, 7, 8, 9]], ["ann_reduce", "an", ["none", "none"]], ["ann_spatial", "an", ["unroll", "unroll", "unroll"]]]}, "result": [[0.0009825779220779221], 0, 25.882480144500732, 1630489099.9788506], "version": 0.2, "tvm_version": "0.8.dev0"}
{"input": ["opencl -keys=mali,opencl,gpu -device=mali -max_num_threads=512 -thread_warp_size=2", "conv2d_nchw_spatial_pack.mali", [["TENSOR", [1, 32, 53, 42], "float32"], ["TENSOR", [4, 32, 1, 1], "float32"], [1, 1], [0, 0, 0, 0], [1, 1], "float32"], {}], "config": {"index": 16949, "code_hash": null, "entity": [["tile_co", "sp", [-1, 1, 4]], ["tile_oh", "sp", [-1, 53, 1]], ["tile_ow", "sp", [-1, 3, 14]], ["reorder_0", "re", [0, 1, 2, 3, 4, 5, 6, 7, 8, 9]], ["ann_reduce", "an", ["none", "unroll"]], ["ann_spatial", "an", ["none", "unroll", "unroll"]]]}, "result": [[0.0006012045221238939], 0, 34.79890990257263, 1630489108.8977423], "version": 0.2, "tvm_version": "0.8.dev0"}
{"input": ["opencl -keys=mali,opencl,gpu -device=mali -max_num_threads=512 -thread_warp_size=2", "conv2d_nchw_spatial_pack.mali", [["TENSOR", [1, 32, 53, 42], "float32"], ["TENSOR", [4, 32, 1, 1], "float32"], [1, 1], [0, 0, 0, 0], [1, 1], "float32"], {}], "config": {"index": 47976, "code_hash": null, "entity": [["tile_co", "sp", [-1, 1, 1]], ["tile_oh", "sp", [-1, 53, 1]], ["tile_ow", "sp", [-1, 2, 7]], ["reorder_0", "re", [0, 1, 2, 3, 4, 5, 6, 7, 8, 9]], ["ann_reduce", "an", ["none", "unroll"]], ["ann_spatial", "an", ["unroll", "unroll", "unroll"]]]}, "result": [[0.0010727595419847329], 0, 43.391337633132935, 1630489117.509636], "version": 0.2, "tvm_version": "0.8.dev0"}
{"input": ["opencl -keys=mali,opencl,gpu -device=mali -max_num_threads=512 -thread_warp_size=2", "conv2d_nchw_spatial_pack.mali", [["TENSOR", [1, 32, 53, 42], "float32"], ["TENSOR", [4, 32, 1, 1], "float32"], [1, 1], [0, 0, 0, 0], [1, 1], "float32"], {}], "config": {"index": 36389, "code_hash": null, "entity": [["tile_co", "sp", [-1, 1, 4]], ["tile_oh", "sp", [-1, 53, 1]], ["tile_ow", "sp", [-1, 3, 14]], ["reorder_0", "re", [0, 1, 2, 3, 4, 5, 6, 7, 8, 9]], ["ann_reduce", "an", ["none", "unroll"]], ["ann_spatial", "an", ["unroll", "none", "unroll"]]]}, "result": [[0.004400351509090909], 0, 52.33514928817749, 1630489126.4731135], "version": 0.2, "tvm_version": "0.8.dev0"}
{"input": ["opencl -keys=mali,opencl,gpu -device=mali -max_num_threads=512 -thread_warp_size=2", "conv2d_nchw_spatial_pack.mali", [["TENSOR", [1, 32, 53, 42], "float32"], ["TENSOR", [4, 32, 1, 1], "float32"], [1, 1], [0, 0, 0, 0], [1, 1], "float32"], {}], "config": {"index": 49995, "code_hash": null, "entity": [["tile_co", "sp", [-1, 1, 2]], ["tile_oh", "sp", [-1, 53, 1]], ["tile_ow", "sp", [-1, 3, 14]], ["reorder_0", "re", [0, 1, 2, 3, 4, 5, 6, 7, 8, 9]], ["ann_reduce", "an", ["unroll", "unroll"]], ["ann_spatial", "an", ["unroll", "unroll", "unroll"]]]}, "result": [[0.0010109038767441862], 0, 61.49671769142151, 1630489135.6363316], "version": 0.2, "tvm_version": "0.8.dev0"}
{"input": ["opencl -keys=mali,opencl,gpu -device=mali -max_num_threads=512 -thread_warp_size=2", "conv2d_nchw_spatial_pack.mali", [["TENSOR", [1, 32, 53, 42], "float32"], ["TENSOR", [4, 32, 1, 1], "float32"], [1, 1], [0, 0, 0, 0], [1, 1], "float32"], {}], "config": {"index": 16387, "code_hash": null, "entity": [["tile_co", "sp", [-1, 2, 1]], ["tile_oh", "sp", [-1, 53, 1]], ["tile_ow", "sp", [-1, 2, 7]], ["reorder_0", "re", [0, 1, 2, 3, 4, 5, 6, 9, 7, 8]], ["ann_reduce", "an", ["none", "none"]], ["ann_spatial", "an", ["none", "unroll", "unroll"]]]}, "result": [[0.0015267658060344829], 0, 70.93199634552002, 1630489145.0581307], "version": 0.2, "tvm_version": "0.8.dev0"}
{"input": ["opencl -keys=mali,opencl,gpu -device=mali -max_num_threads=512 -thread_warp_size=2", "conv2d_nchw_spatial_pack.mali", [["TENSOR", [1, 32, 53, 42], "float32"], ["TENSOR", [4, 32, 1, 1], "float32"], [1, 1], [0, 0, 0, 0], [1, 1], "float32"], {}], "config": {"index": 15900, "code_hash": null, "entity": [["tile_co", "sp", [-1, 1, 1]], ["tile_oh", "sp", [-1, 53, 1]], ["tile_ow", "sp", [-1, 2, 7]], ["reorder_0", "re", [0, 1, 2, 3, 4, 5, 6, 7, 8, 9]], ["ann_reduce", "an", ["none", "none"]], ["ann_spatial", "an", ["none", "unroll", "unroll"]]]}, "result": [[0.0010247122976190476], 0, 79.76540851593018, 1630489153.9118838], "version": 0.2, "tvm_version": "0.8.dev0"}
{"input": ["opencl -keys=mali,opencl,gpu -device=mali -max_num_threads=512 -thread_warp_size=2", "conv2d_nchw_spatial_pack.mali", [["TENSOR", [1, 32, 53, 42], "float32"], ["TENSOR", [4, 32, 1, 1], "float32"], [1, 1], [0, 0, 0, 0], [1, 1], "float32"], {}], "config": {"index": 77585, "code_hash": null, "entity": [["tile_co", "sp", [-1, 1, 4]], ["tile_oh", "sp", [-1, 1, 1]], ["tile_ow", "sp", [-1, 7, 6]], ["reorder_0", "re", [0, 1, 2, 3, 4, 5, 6, 9, 7, 8]], ["ann_reduce", "an", ["unroll", "unroll"]], ["ann_spatial", "an", ["vec", "unroll", "unroll"]]]}, "result": [[0.0007636046240875913], 0, 88.39928197860718, 1630489162.5755346], "version": 0.2, "tvm_version": "0.8.dev0"}
{"input": ["opencl -keys=mali,opencl,gpu -device=mali -max_num_threads=512 -thread_warp_size=2", "conv2d_nchw_spatial_pack.mali", [["TENSOR", [1, 32, 53, 42], "float32"], ["TENSOR", [4, 32, 1, 1], "float32"], [1, 1], [0, 0, 0, 0], [1, 1], "float32"], {}], "config": {"index": 75641, "code_hash": null, "entity": [["tile_co", "sp", [-1, 1, 4]], ["tile_oh", "sp", [-1, 1, 1]], ["tile_ow", "sp", [-1, 7, 6]], ["reorder_0", "re", [0, 1, 2, 3, 4, 5, 6, 9, 7, 8]], ["ann_reduce", "an", ["none", "unroll"]], ["ann_spatial", "an", ["vec", "unroll", "unroll"]]]}, "result": [[0.00111324016563147], 0, 97.63641166687012, 1630489171.8221102], "version": 0.2, "tvm_version": "0.8.dev0"}
{"input": ["opencl -keys=mali,opencl,gpu -device=mali -max_num_threads=512 -thread_warp_size=2", "conv2d_nchw_spatial_pack.mali", [["TENSOR", [1, 32, 53, 42], "float32"], ["TENSOR", [4, 32, 1, 1], "float32"], [1, 1], [0, 0, 0, 0], [1, 1], "float32"], {}], "config": {"index": 17359, "code_hash": null, "entity": [["tile_co", "sp", [-1, 2, 1]], ["tile_oh", "sp", [-1, 53, 1]], ["tile_ow", "sp", [-1, 2, 7]], ["reorder_0", "re", [0, 1, 2, 3, 4, 5, 6, 9, 7, 8]], ["ann_reduce", "an", ["none", "unroll"]], ["ann_spatial", "an", ["none", "unroll", "unroll"]]]}, "result": [[0.0008590342324324324], 0, 106.12723898887634, 1630489180.3170183], "version": 0.2, "tvm_version": "0.8.dev0"}
{"input": ["opencl -keys=mali,opencl,gpu -device=mali -max_num_threads=512 -thread_warp_size=2", "conv2d_nchw_spatial_pack.mali", [["TENSOR", [1, 32, 53, 42], "float32"], ["TENSOR", [4, 32, 1, 1], "float32"], [1, 1], [0, 0, 0, 0], [1, 1], "float32"], {}], "config": {"index": 16895, "code_hash": null, "entity": [["tile_co", "sp", [-1, 1, 4]], ["tile_oh", "sp", [-1, 53, 1]], ["tile_ow", "sp", [-1, 3, 7]], ["reorder_0", "re", [0, 1, 2, 3, 4, 5, 6, 7, 8, 9]], ["ann_reduce", "an", ["none", "unroll"]], ["ann_spatial", "an", ["none", "unroll", "unroll"]]]}, "result": [[0.0010504277064935065], 0, 115.40385818481445, 1630489189.6112123], "version": 0.2, "tvm_version": "0.8.dev0"}
{"input": ["opencl -keys=mali,opencl,gpu -device=mali -max_num_threads=512 -thread_warp_size=2", "conv2d_nchw_spatial_pack.mali", [["TENSOR", [1, 32, 53, 42], "float32"], ["TENSOR", [4, 32, 1, 1], "float32"], [1, 1], [0, 0, 0, 0], [1, 1], "float32"], {}], "config": {"index": 16872, "code_hash": null, "entity": [["tile_co", "sp", [-1, 1, 1]], ["tile_oh", "sp", [-1, 53, 1]], ["tile_ow", "sp", [-1, 2, 7]], ["reorder_0", "re", [0, 1, 2, 3, 4, 5, 6, 7, 8, 9]], ["ann_reduce", "an", ["none", "unroll"]], ["ann_spatial", "an", ["none", "unroll", "unroll"]]]}, "result": [[0.0009687215021645021], 0, 124.3410894870758, 1630489198.5609527], "version": 0.2, "tvm_version": "0.8.dev0"}
{"input": ["opencl -keys=mali,opencl,gpu -device=mali -max_num_threads=512 -thread_warp_size=2", "conv2d_nchw_spatial_pack.mali", [["TENSOR", [1, 32, 53, 42], "float32"], ["TENSOR", [4, 32, 1, 1], "float32"], [1, 1], [0, 0, 0, 0], [1, 1], "float32"], {}], "config": {"index": 18893, "code_hash": null, "entity": [["tile_co", "sp", [-1, 1, 4]], ["tile_oh", "sp", [-1, 53, 1]], ["tile_ow", "sp", [-1, 3, 14]], ["reorder_0", "re", [0, 1, 2, 3, 4, 5, 6, 7, 8, 9]], ["ann_reduce", "an", ["unroll", "unroll"]], ["ann_spatial", "an", ["none", "unroll", "unroll"]]]}, "result": [[0.0011224447300771207], 0, 133.76802515983582, 1630489208.011007], "version": 0.2, "tvm_version": "0.8.dev0"}
{"input": ["opencl -keys=mali,opencl,gpu -device=mali -max_num_threads=512 -thread_warp_size=2", "conv2d_nchw_spatial_pack.mali", [["TENSOR", [1, 32, 53, 42], "float32"], ["TENSOR", [4, 32, 1, 1], "float32"], [1, 1], [0, 0, 0, 0], [1, 1], "float32"], {}], "config": {"index": 38333, "code_hash": null, "entity": [["tile_co", "sp", [-1, 1, 4]], ["tile_oh", "sp", [-1, 53, 1]], ["tile_ow", "sp", [-1, 3, 14]], ["reorder_0", "re", [0, 1, 2, 3, 4, 5, 6, 7, 8, 9]], ["ann_reduce", "an", ["unroll", "unroll"]], ["ann_spatial", "an", ["unroll", "none", "unroll"]]]}, "result": [[0.0009033987153846155], 0, 142.57864475250244, 1630489216.8375168], "version": 0.2, "tvm_version": "0.8.dev0"}
{"input": ["opencl -keys=mali,opencl,gpu -device=mali -max_num_threads=512 -thread_warp_size=2", "conv2d_nchw_spatial_pack.mali", [["TENSOR", [1, 32, 53, 42], "float32"], ["TENSOR", [4, 32, 1, 1], "float32"], [1, 1], [0, 0, 0, 0], [1, 1], "float32"], {}], "config": {"index": 47005, "code_hash": null, "entity": [["tile_co", "sp", [-1, 2, 1]], ["tile_oh", "sp", [-1, 53, 1]], ["tile_ow", "sp", [-1, 2, 7]], ["reorder_0", "re", [0, 1, 2, 3, 4, 5, 6, 7, 8, 9]], ["ann_reduce", "an", ["none", "none"]], ["ann_spatial", "an", ["unroll", "unroll", "unroll"]]]}, "result": [[0.0011532843476702507], 0, 151.63439226150513, 1630489225.9049804], "version": 0.2, "tvm_version": "0.8.dev0"}
{"input": ["opencl -keys=mali,opencl,gpu -device=mali -max_num_threads=512 -thread_warp_size=2", "conv2d_nchw_spatial_pack.mali", [["TENSOR", [1, 32, 53, 42], "float32"], ["TENSOR", [4, 32, 1, 1], "float32"], [1, 1], [0, 0, 0, 0], [1, 1], "float32"], {}], "config": {"index": 47977, "code_hash": null, "entity": [["tile_co", "sp", [-1, 2, 1]], ["tile_oh", "sp", [-1, 53, 1]], ["tile_ow", "sp", [-1, 2, 7]], ["reorder_0", "re", [0, 1, 2, 3, 4, 5, 6, 7, 8, 9]], ["ann_reduce", "an", ["none", "unroll"]], ["ann_spatial", "an", ["unroll", "unroll", "unroll"]]]}, "result": [[0.0009302100231213873], 0, 9.946406841278076, 1630489236.256077], "version": 0.2, "tvm_version": "0.8.dev0"}
{"input": ["opencl -keys=mali,opencl,gpu -device=mali -max_num_threads=512 -thread_warp_size=2", "conv2d_nchw_spatial_pack.mali", [["TENSOR", [1, 32, 53, 42], "float32"], ["TENSOR", [4, 32, 1, 1], "float32"], [1, 1], [0, 0, 0, 0], [1, 1], "float32"], {}], "config": {"index": 49434, "code_hash": null, "entity": [["tile_co", "sp", [-1, 1, 1]], ["tile_oh", "sp", [-1, 53, 1]], ["tile_ow", "sp", [-1, 2, 7]], ["reorder_0", "re", [0, 1, 2, 3, 4, 5, 6, 9, 7, 8]], ["ann_reduce", "an", ["unroll", "none"]], ["ann_spatial", "an", ["unroll", "unroll", "unroll"]]]}, "result": [[0.0014830632155172414], 0, 18.610406160354614, 1630489244.9048562], "version": 0.2, "tvm_version": "0.8.dev0"}
{"input": ["opencl -keys=mali,opencl,gpu -device=mali -max_num_threads=512 -thread_warp_size=2", "conv2d_nchw_spatial_pack.mali", [["TENSOR", [1, 32, 53, 42], "float32"], ["TENSOR", [4, 32, 1, 1], "float32"], [1, 1], [0, 0, 0, 0], [1, 1], "float32"], {}], "config": {"index": 50406, "code_hash": null, "entity": [["tile_co", "sp", [-1, 1, 1]], ["tile_oh", "sp", [-1, 53, 1]], ["tile_ow", "sp", [-1, 2, 7]], ["reorder_0", "re", [0, 1, 2, 3, 4, 5, 6, 9, 7, 8]], ["ann_reduce", "an", ["unroll", "unroll"]], ["ann_spatial", "an", ["unroll", "unroll", "unroll"]]]}, "result": [[0.0009346962544378697], 0, 26.829063177108765, 1630489253.1638377], "version": 0.2, "tvm_version": "0.8.dev0"}
{"input": ["opencl -keys=mali,opencl,gpu -device=mali -max_num_threads=512 -thread_warp_size=2", "conv2d_nchw_spatial_pack.mali", [["TENSOR", [1, 32, 53, 42], "float32"], ["TENSOR", [4, 32, 1, 1], "float32"], [1, 1], [0, 0, 0, 0], [1, 1], "float32"], {}], "config": {"index": 44129, "code_hash": null, "entity": [["tile_co", "sp", [-1, 1, 4]], ["tile_oh", "sp", [-1, 53, 1]], ["tile_ow", "sp", [-1, 6, 7]], ["reorder_0", "re", [0, 1, 2, 3, 4, 5, 6, 7, 8, 9]], ["ann_reduce", "an", ["none", "unroll"]], ["ann_spatial", "an", ["unroll", "unroll", "none"]]]}, "result": [[0.0008700066649999999], 0, 35.64029359817505, 1630489261.9660156], "version": 0.2, "tvm_version": "0.8.dev0"}
{"input": ["opencl -keys=mali,opencl,gpu -device=mali -max_num_threads=512 -thread_warp_size=2", "conv2d_nchw_spatial_pack.mali", [["TENSOR", [1, 32, 53, 42], "float32"], ["TENSOR", [4, 32, 1, 1], "float32"], [1, 1], [0, 0, 0, 0], [1, 1], "float32"], {}], "config": {"index": 18839, "code_hash": null, "entity": [["tile_co", "sp", [-1, 1, 4]], ["tile_oh", "sp", [-1, 53, 1]], ["tile_ow", "sp", [-1, 3, 7]], ["reorder_0", "re", [0, 1, 2, 3, 4, 5, 6, 7, 8, 9]], ["ann_reduce", "an", ["unroll", "unroll"]], ["ann_spatial", "an", ["none", "unroll", "unroll"]]]}, "result": [[0.0026414061264367814], 0, 44.24247980117798, 1630489270.5951588], "version": 0.2, "tvm_version": "0.8.dev0"}
{"input": ["opencl -keys=mali,opencl,gpu -device=mali -max_num_threads=512 -thread_warp_size=2", "conv2d_nchw_spatial_pack.mali", [["TENSOR", [1, 32, 53, 42], "float32"], ["TENSOR", [4, 32, 1, 1], "float32"], [1, 1], [0, 0, 0, 0], [1, 1], "float32"], {}], "config": {"index": 48015, "code_hash": null, "entity": [["tile_co", "sp", [-1, 1, 2]], ["tile_oh", "sp", [-1, 53, 1]], ["tile_ow", "sp", [-1, 6, 7]], ["reorder_0", "re", [0, 1, 2, 3, 4, 5, 6, 7, 8, 9]], ["ann_reduce", "an", ["none", "unroll"]], ["ann_spatial", "an", ["unroll", "unroll", "unroll"]]]}, "result": [[0.0011788376422413795], 0, 52.685261249542236, 1630489279.0480695], "version": 0.2, "tvm_version": "0.8.dev0"}
{"input": ["opencl -keys=mali,opencl,gpu -device=mali -max_num_threads=512 -thread_warp_size=2", "conv2d_nchw_spatial_pack.mali", [["TENSOR", [1, 32, 53, 42], "float32"], ["TENSOR", [4, 32, 1, 1], "float32"], [1, 1], [0, 0, 0, 0], [1, 1], "float32"], {}], "config": {"index": 74781, "code_hash": null, "entity": [["tile_co", "sp", [-1, 1, 2]], ["tile_oh", "sp", [-1, 53, 1]], ["tile_ow", "sp", [-1, 3, 14]], ["reorder_0", "re", [0, 1, 2, 3, 4, 5, 6, 9, 7, 8]], ["ann_reduce", "an", ["none", "none"]], ["ann_spatial", "an", ["vec", "unroll", "unroll"]]]}, "result": [[0.0008998467966573817], 0, 61.56728720664978, 1630489287.9432805], "version": 0.2, "tvm_version": "0.8.dev0"}
{"input": ["opencl -keys=mali,opencl,gpu -device=mali -max_num_threads=512 -thread_warp_size=2", "conv2d_nchw_spatial_pack.mali", [["TENSOR", [1, 32, 53, 42], "float32"], ["TENSOR", [4, 32, 1, 1], "float32"], [1, 1], [0, 0, 0, 0], [1, 1], "float32"], {}], "config": {"index": 75753, "code_hash": null, "entity": [["tile_co", "sp", [-1, 1, 2]], ["tile_oh", "sp", [-1, 53, 1]], ["tile_ow", "sp", [-1, 3, 14]], ["reorder_0", "re", [0, 1, 2, 3, 4, 5, 6, 9, 7, 8]], ["ann_reduce", "an", ["none", "unroll"]], ["ann_spatial", "an", ["vec", "unroll", "unroll"]]]}, "result": [[0.0005970967333333334], 0, 70.22236633300781, 1630489296.5957994], "version": 0.2, "tvm_version": "0.8.dev0"}
{"input": ["opencl -keys=mali,opencl,gpu -device=mali -max_num_threads=512 -thread_warp_size=2", "conv2d_nchw_spatial_pack.mali", [["TENSOR", [1, 32, 53, 42], "float32"], ["TENSOR", [4, 32, 1, 1], "float32"], [1, 1], [0, 0, 0, 0], [1, 1], "float32"], {}], "config": {"index": 49397, "code_hash": null, "entity": [["tile_co", "sp", [-1, 1, 4]], ["tile_oh", "sp", [-1, 1, 1]], ["tile_ow", "sp", [-1, 7, 6]], ["reorder_0", "re", [0, 1, 2, 3, 4, 5, 6, 9, 7, 8]], ["ann_reduce", "an", ["unroll", "none"]], ["ann_spatial", "an", ["unroll", "unroll", "unroll"]]]}, "result": [[0.000774693986885246], 0, 78.5509614944458, 1630489304.9529116], "version": 0.2, "tvm_version": "0.8.dev0"}
{"input": ["opencl -keys=mali,opencl,gpu -device=mali -max_num_threads=512 -thread_warp_size=2", "conv2d_nchw_spatial_pack.mali", [["TENSOR", [1, 32, 53, 42], "float32"], ["TENSOR", [4, 32, 1, 1], "float32"], [1, 1], [0, 0, 0, 0], [1, 1], "float32"], {}], "config": {"index": 47453, "code_hash": null, "entity": [["tile_co", "sp", [-1, 1, 4]], ["tile_oh", "sp", [-1, 1, 1]], ["tile_ow", "sp", [-1, 7, 6]], ["reorder_0", "re", [0, 1, 2, 3, 4, 5, 6, 9, 7, 8]], ["ann_reduce", "an", ["none", "none"]], ["ann_spatial", "an", ["unroll", "unroll", "unroll"]]]}, "result": [[0.0007741899215116279], 0, 87.53282237052917, 1630489313.9334192], "version": 0.2, "tvm_version": "0.8.dev0"}
{"input": ["opencl -keys=mali,opencl,gpu -device=mali -max_num_threads=512 -thread_warp_size=2", "conv2d_nchw_spatial_pack.mali", [["TENSOR", [1, 32, 53, 42], "float32"], ["TENSOR", [4, 32, 1, 1], "float32"], [1, 1], [0, 0, 0, 0], [1, 1], "float32"], {}], "config": {"index": 15901, "code_hash": null, "entity": [["tile_co", "sp", [-1, 2, 1]], ["tile_oh", "sp", [-1, 53, 1]], ["tile_ow", "sp", [-1, 2, 7]], ["reorder_0", "re", [0, 1, 2, 3, 4, 5, 6, 7, 8, 9]], ["ann_reduce", "an", ["none", "none"]], ["ann_spatial", "an", ["none", "unroll", "unroll"]]]}, "result": [[0.0009212083369565216], 0, 96.04964995384216, 1630489322.4735572], "version": 0.2, "tvm_version": "0.8.dev0"}
{"input": ["opencl -keys=mali,opencl,gpu -device=mali -max_num_threads=512 -thread_warp_size=2", "conv2d_nchw_spatial_pack.mali", [["TENSOR", [1, 32, 53, 42], "float32"], ["TENSOR", [4, 32, 1, 1], "float32"], [1, 1], [0, 0, 0, 0], [1, 1], "float32"], {}], "config": {"index": 43602, "code_hash": null, "entity": [["tile_co", "sp", [-1, 1, 1]], ["tile_oh", "sp", [-1, 53, 1]], ["tile_ow", "sp", [-1, 2, 7]], ["reorder_0", "re", [0, 1, 2, 3, 4, 5, 6, 9, 7, 8]], ["ann_reduce", "an", ["none", "none"]], ["ann_spatial", "an", ["unroll", "unroll", "none"]]]}, "result": [[0.0013070977068965516], 0, 104.95793151855469, 1630489331.4106376], "version": 0.2, "tvm_version": "0.8.dev0"}
{"input": ["opencl -keys=mali,opencl,gpu -device=mali -max_num_threads=512 -thread_warp_size=2", "conv2d_nchw_spatial_pack.mali", [["TENSOR", [1, 32, 53, 42], "float32"], ["TENSOR", [4, 32, 1, 1], "float32"], [1, 1], [0, 0, 0, 0], [1, 1], "float32"], {}], "config": {"index": 15939, "code_hash": null, "entity": [["tile_co", "sp", [-1, 1, 2]], ["tile_oh", "sp", [-1, 53, 1]], ["tile_ow", "sp", [-1, 6, 7]], ["reorder_0", "re", [0, 1, 2, 3, 4, 5, 6, 7, 8, 9]], ["ann_reduce", "an", ["none", "none"]], ["ann_spatial", "an", ["none", "unroll", "unroll"]]]}, "result": [[0.0008257756653992396], 0, 113.56963586807251, 1630489340.0278096], "version": 0.2, "tvm_version": "0.8.dev0"}
{"input": ["opencl -keys=mali,opencl,gpu -device=mali -max_num_threads=512 -thread_warp_size=2", "conv2d_nchw_spatial_pack.mali", [["TENSOR", [1, 32, 53, 42], "float32"], ["TENSOR", [4, 32, 1, 1], "float32"], [1, 1], [0, 0, 0, 0], [1, 1], "float32"], {}], "config": {"index": 48854, "code_hash": null, "entity": [["tile_co", "sp", [-1, 4, 1]], ["tile_oh", "sp", [-1, 1, 1]], ["tile_ow", "sp", [-1, 7, 3]], ["reorder_0", "re", [0, 1, 2, 3, 4, 5, 6, 7, 8, 9]], ["ann_reduce", "an", ["unroll", "none"]], ["ann_spatial", "an", ["unroll", "unroll", "unroll"]]]}, "result": [[0.001849789275862069], 0, 122.0858416557312, 1630489348.5394428], "version": 0.2, "tvm_version": "0.8.dev0"}
{"input": ["opencl -keys=mali,opencl,gpu -device=mali -max_num_threads=512 -thread_warp_size=2", "conv2d_nchw_spatial_pack.mali", [["TENSOR", [1, 32, 53, 42], "float32"], ["TENSOR", [4, 32, 1, 1], "float32"], [1, 1], [0, 0, 0, 0], [1, 1], "float32"], {}], "config": {"index": 5770, "code_hash": null, "entity": [["tile_co", "sp", [-1, 2, 2]], ["tile_oh", "sp", [-1, 53, 1]], ["tile_ow", "sp", [-1, 3, 14]], ["reorder_0", "re", [0, 1, 2, 3, 4, 5, 6, 9, 7, 8]], ["ann_reduce", "an", ["none", "unroll"]], ["ann_spatial", "an", ["none", "none", "unroll"]]]}, "result": [[0.000856953304347826], 0, 130.95373487472534, 1630489357.4402092], "version": 0.2, "tvm_version": "0.8.dev0"}
{"input": ["opencl -keys=mali,opencl,gpu -device=mali -max_num_threads=512 -thread_warp_size=2", "conv2d_nchw_spatial_pack.mali", [["TENSOR", [1, 32, 53, 42], "float32"], ["TENSOR", [4, 32, 1, 1], "float32"], [1, 1], [0, 0, 0, 0], [1, 1], "float32"], {}], "config": {"index": 49955, "code_hash": null, "entity": [["tile_co", "sp", [-1, 1, 4]], ["tile_oh", "sp", [-1, 1, 1]], ["tile_ow", "sp", [-1, 6, 7]], ["reorder_0", "re", [0, 1, 2, 3, 4, 5, 6, 7, 8, 9]], ["ann_reduce", "an", ["unroll", "unroll"]], ["ann_spatial", "an", ["unroll", "unroll", "unroll"]]]}, "result": [[0.0008419930565476191], 0, 15.826897144317627, 1630489382.458651], "version": 0.2, "tvm_version": "0.8.dev0"}
{"input": ["opencl -keys=mali,opencl,gpu -device=mali -max_num_threads=512 -thread_warp_size=2", "conv2d_nchw_spatial_pack.mali", [["TENSOR", [1, 32, 53, 42], "float32"], ["TENSOR", [4, 32, 1, 1], "float32"], [1, 1], [0, 0, 0, 0], [1, 1], "float32"], {}], "config": {"index": 48983, "code_hash": null, "entity": [["tile_co", "sp", [-1, 1, 4]], ["tile_oh", "sp", [-1, 1, 1]], ["tile_ow", "sp", [-1, 6, 7]], ["reorder_0", "re", [0, 1, 2, 3, 4, 5, 6, 7, 8, 9]], ["ann_reduce", "an", ["unroll", "none"]], ["ann_spatial", "an", ["unroll", "unroll", "unroll"]]]}, "result": [[0.0008705810810810812], 0, 24.67003583908081, 1630489391.3229845], "version": 0.2, "tvm_version": "0.8.dev0"}
{"input": ["opencl -keys=mali,opencl,gpu -device=mali -max_num_threads=512 -thread_warp_size=2", "conv2d_nchw_spatial_pack.mali", [["TENSOR", [1, 32, 53, 42], "float32"], ["TENSOR", [4, 32, 1, 1], "float32"], [1, 1], [0, 0, 0, 0], [1, 1], "float32"], {}], "config": {"index": 74783, "code_hash": null, "entity": [["tile_co", "sp", [-1, 1, 4]], ["tile_oh", "sp", [-1, 53, 1]], ["tile_ow", "sp", [-1, 3, 14]], ["reorder_0", "re", [0, 1, 2, 3, 4, 5, 6, 9, 7, 8]], ["ann_reduce", "an", ["none", "none"]], ["ann_spatial", "an", ["vec", "unroll", "unroll"]]]}, "result": [[0.0006076646525679758], 0, 33.48857927322388, 1630489400.1438773], "version": 0.2, "tvm_version": "0.8.dev0"}
{"input": ["opencl -keys=mali,opencl,gpu -device=mali -max_num_threads=512 -thread_warp_size=2", "conv2d_nchw_spatial_pack.mali", [["TENSOR", [1, 32, 53, 42], "float32"], ["TENSOR", [4, 32, 1, 1], "float32"], [1, 1], [0, 0, 0, 0], [1, 1], "float32"], {}], "config": {"index": 77699, "code_hash": null, "entity": [["tile_co", "sp", [-1, 1, 4]], ["tile_oh", "sp", [-1, 53, 1]], ["tile_ow", "sp", [-1, 3, 14]], ["reorder_0", "re", [0, 1, 2, 3, 4, 5, 6, 9, 7, 8]], ["ann_reduce", "an", ["unroll", "unroll"]], ["ann_spatial", "an", ["vec", "unroll", "unroll"]]]}, "result": [[0.0006861470588235294], 0, 42.15969395637512, 1630489408.8202603], "version": 0.2, "tvm_version": "0.8.dev0"}
{"input": ["opencl -keys=mali,opencl,gpu -device=mali -max_num_threads=512 -thread_warp_size=2", "conv2d_nchw_spatial_pack.mali", [["TENSOR", [1, 32, 53, 42], "float32"], ["TENSOR", [4, 32, 1, 1], "float32"], [1, 1], [0, 0, 0, 0], [1, 1], "float32"], {}], "config": {"index": 47080, "code_hash": null, "entity": [["tile_co", "sp", [-1, 2, 2]], ["tile_oh", "sp", [-1, 53, 1]], ["tile_ow", "sp", [-1, 3, 14]], ["reorder_0", "re", [0, 1, 2, 3, 4, 5, 6, 7, 8, 9]], ["ann_reduce", "an", ["none", "none"]], ["ann_spatial", "an", ["unroll", "unroll", "unroll"]]]}, "result": [[0.0006750836363636364], 0, 51.023061752319336, 1630489417.710244], "version": 0.2, "tvm_version": "0.8.dev0"}
{"input": ["opencl -keys=mali,opencl,gpu -device=mali -max_num_threads=512 -thread_warp_size=2", "conv2d_nchw_spatial_pack.mali", [["TENSOR", [1, 32, 53, 42], "float32"], ["TENSOR", [4, 32, 1, 1], "float32"], [1, 1], [0, 0, 0, 0], [1, 1], "float32"], {}], "config": {"index": 74777, "code_hash": null, "entity": [["tile_co", "sp", [-1, 1, 4]], ["tile_oh", "sp", [-1, 1, 1]], ["tile_ow", "sp", [-1, 3, 14]], ["reorder_0", "re", [0, 1, 2, 3, 4, 5, 6, 9, 7, 8]], ["ann_reduce", "an", ["none", "none"]], ["ann_spatial", "an", ["vec", "unroll", "unroll"]]]}, "result": [[0.0011857627118644068], 0, 59.76449990272522, 1630489426.469085], "version": 0.2, "tvm_version": "0.8.dev0"}
{"input": ["opencl -keys=mali,opencl,gpu -device=mali -max_num_threads=512 -thread_warp_size=2", "conv2d_nchw_spatial_pack.mali", [["TENSOR", [1, 32, 53, 42], "float32"], ["TENSOR", [4, 32, 1, 1], "float32"], [1, 1], [0, 0, 0, 0], [1, 1], "float32"], {}], "config": {"index": 76727, "code_hash": null, "entity": [["tile_co", "sp", [-1, 1, 4]], ["tile_oh", "sp", [-1, 53, 1]], ["tile_ow", "sp", [-1, 3, 14]], ["reorder_0", "re", [0, 1, 2, 3, 4, 5, 6, 9, 7, 8]], ["ann_reduce", "an", ["unroll", "none"]], ["ann_spatial", "an", ["vec", "unroll", "unroll"]]]}, "result": [[0.0007045426116504854], 0, 68.30966401100159, 1630489435.0143886], "version": 0.2, "tvm_version": "0.8.dev0"}
{"input": ["opencl -keys=mali,opencl,gpu -device=mali -max_num_threads=512 -thread_warp_size=2", "conv2d_nchw_spatial_pack.mali", [["TENSOR", [1, 32, 53, 42], "float32"], ["TENSOR", [4, 32, 1, 1], "float32"], [1, 1], [0, 0, 0, 0], [1, 1], "float32"], {}], "config": {"index": 76721, "code_hash": null, "entity": [["tile_co", "sp", [-1, 1, 4]], ["tile_oh", "sp", [-1, 1, 1]], ["tile_ow", "sp", [-1, 3, 14]], ["reorder_0", "re", [0, 1, 2, 3, 4, 5, 6, 9, 7, 8]], ["ann_reduce", "an", ["unroll", "none"]], ["ann_spatial", "an", ["vec", "unroll", "unroll"]]]}, "result": [[0.0006636468273809524], 0, 77.15657448768616, 1630489443.8734689], "version": 0.2, "tvm_version": "0.8.dev0"}
{"input": ["opencl -keys=mali,opencl,gpu -device=mali -max_num_threads=512 -thread_warp_size=2", "conv2d_nchw_spatial_pack.mali", [["TENSOR", [1, 32, 53, 42], "float32"], ["TENSOR", [4, 32, 1, 1], "float32"], [1, 1], [0, 0, 0, 0], [1, 1], "float32"], {}], "config": {"index": 49511, "code_hash": null, "entity": [["tile_co", "sp", [-1, 1, 4]], ["tile_oh", "sp", [-1, 53, 1]], ["tile_ow", "sp", [-1, 3, 14]], ["reorder_0", "re", [0, 1, 2, 3, 4, 5, 6, 9, 7, 8]], ["ann_reduce", "an", ["unroll", "none"]], ["ann_spatial", "an", ["unroll", "unroll", "unroll"]]]}, "result": [[0.0007110971128608923], 0, 86.17309665679932, 1630489452.9149737], "version": 0.2, "tvm_version": "0.8.dev0"}
{"input": ["opencl -keys=mali,opencl,gpu -device=mali -max_num_threads=512 -thread_warp_size=2", "conv2d_nchw_spatial_pack.mali", [["TENSOR", [1, 32, 53, 42], "float32"], ["TENSOR", [4, 32, 1, 1], "float32"], [1, 1], [0, 0, 0, 0], [1, 1], "float32"], {}], "config": {"index": 49024, "code_hash": null, "entity": [["tile_co", "sp", [-1, 2, 2]], ["tile_oh", "sp", [-1, 53, 1]], ["tile_ow", "sp", [-1, 3, 14]], ["reorder_0", "re", [0, 1, 2, 3, 4, 5, 6, 7, 8, 9]], ["ann_reduce", "an", ["unroll", "none"]], ["ann_spatial", "an", ["unroll", "unroll", "unroll"]]]}, "result": [[0.0007863506802973978], 0, 94.75366926193237, 1630489461.5117352], "version": 0.2, "tvm_version": "0.8.dev0"}
{"input": ["opencl -keys=mali,opencl,gpu -device=mali -max_num_threads=512 -thread_warp_size=2", "conv2d_nchw_spatial_pack.mali", [["TENSOR", [1, 32, 53, 42], "float32"], ["TENSOR", [4, 32, 1, 1], "float32"], [1, 1], [0, 0, 0, 0], [1, 1], "float32"], {}], "config": {"index": 49991, "code_hash": null, "entity": [["tile_co", "sp", [-1, 1, 4]], ["tile_oh", "sp", [-1, 1, 1]], ["tile_ow", "sp", [-1, 3, 14]], ["reorder_0", "re", [0, 1, 2, 3, 4, 5, 6, 7, 8, 9]], ["ann_reduce", "an", ["unroll", "unroll"]], ["ann_spatial", "an", ["unroll", "unroll", "unroll"]]]}, "result": [[0.0006894279845679012], 0, 103.36047101020813, 1630489470.1357257], "version": 0.2, "tvm_version": "0.8.dev0"}
{"input": ["opencl -keys=mali,opencl,gpu -device=mali -max_num_threads=512 -thread_warp_size=2", "conv2d_nchw_spatial_pack.mali", [["TENSOR", [1, 32, 53, 42], "float32"], ["TENSOR", [4, 32, 1, 1], "float32"], [1, 1], [0, 0, 0, 0], [1, 1], "float32"], {}], "config": {"index": 75755, "code_hash": null, "entity": [["tile_co", "sp", [-1, 1, 4]], ["tile_oh", "sp", [-1, 53, 1]], ["tile_ow", "sp", [-1, 3, 14]], ["reorder_0", "re", [0, 1, 2, 3, 4, 5, 6, 9, 7, 8]], ["ann_reduce", "an", ["none", "unroll"]], ["ann_spatial", "an", ["vec", "unroll", "unroll"]]]}, "result": [[0.0007449926650366748], 0, 112.55532002449036, 1630489479.3473883], "version": 0.2, "tvm_version": "0.8.dev0"}
{"input": ["opencl -keys=mali,opencl,gpu -device=mali -max_num_threads=512 -thread_warp_size=2", "conv2d_nchw_spatial_pack.mali", [["TENSOR", [1, 32, 53, 42], "float32"], ["TENSOR", [4, 32, 1, 1], "float32"], [1, 1], [0, 0, 0, 0], [1, 1], "float32"], {}], "config": {"index": 47038, "code_hash": null, "entity": [["tile_co", "sp", [-1, 2, 2]], ["tile_oh", "sp", [-1, 1, 1]], ["tile_ow", "sp", [-1, 6, 7]], ["reorder_0", "re", [0, 1, 2, 3, 4, 5, 6, 7, 8, 9]], ["ann_reduce", "an", ["none", "none"]], ["ann_spatial", "an", ["unroll", "unroll", "unroll"]]]}, "result": [[0.0006093563636363637], 0, 121.17801475524902, 1630489487.9871488], "version": 0.2, "tvm_version": "0.8.dev0"}
{"input": ["opencl -keys=mali,opencl,gpu -device=mali -max_num_threads=512 -thread_warp_size=2", "conv2d_nchw_spatial_pack.mali", [["TENSOR", [1, 32, 53, 42], "float32"], ["TENSOR", [4, 32, 1, 1], "float32"], [1, 1], [0, 0, 0, 0], [1, 1], "float32"], {}], "config": {"index": 49019, "code_hash": null, "entity": [["tile_co", "sp", [-1, 1, 4]], ["tile_oh", "sp", [-1, 1, 1]], ["tile_ow", "sp", [-1, 3, 14]], ["reorder_0", "re", [0, 1, 2, 3, 4, 5, 6, 7, 8, 9]], ["ann_reduce", "an", ["unroll", "none"]], ["ann_spatial", "an", ["unroll", "unroll", "unroll"]]]}, "result": [[0.0006674188062678062], 0, 130.33421277999878, 1630489497.1365485], "version": 0.2, "tvm_version": "0.8.dev0"}
{"input": ["opencl -keys=mali,opencl,gpu -device=mali -max_num_threads=512 -thread_warp_size=2", "conv2d_nchw_spatial_pack.mali", [["TENSOR", [1, 32, 53, 42], "float32"], ["TENSOR", [4, 32, 1, 1], "float32"], [1, 1], [0, 0, 0, 0], [1, 1], "float32"], {}], "config": {"index": 74747, "code_hash": null, "entity": [["tile_co", "sp", [-1, 1, 4]], ["tile_oh", "sp", [-1, 53, 1]], ["tile_ow", "sp", [-1, 6, 7]], ["reorder_0", "re", [0, 1, 2, 3, 4, 5, 6, 9, 7, 8]], ["ann_reduce", "an", ["none", "none"]], ["ann_spatial", "an", ["vec", "unroll", "unroll"]]]}, "result": [[0.0005983744577922077], 0, 139.1851785182953, 1630489506.011163], "version": 0.2, "tvm_version": "0.8.dev0"}
{"input": ["opencl -keys=mali,opencl,gpu -device=mali -max_num_threads=512 -thread_warp_size=2", "conv2d_nchw_spatial_pack.mali", [["TENSOR", [1, 32, 53, 42], "float32"], ["TENSOR", [4, 32, 1, 1], "float32"], [1, 1], [0, 0, 0, 0], [1, 1], "float32"], {}], "config": {"index": 49505, "code_hash": null, "entity": [["tile_co", "sp", [-1, 1, 4]], ["tile_oh", "sp", [-1, 1, 1]], ["tile_ow", "sp", [-1, 3, 14]], ["reorder_0", "re", [0, 1, 2, 3, 4, 5, 6, 9, 7, 8]], ["ann_reduce", "an", ["unroll", "none"]], ["ann_spatial", "an", ["unroll", "unroll", "unroll"]]]}, "result": [[0.000871005332], 0, 147.9180977344513, 1630489514.7784033], "version": 0.2, "tvm_version": "0.8.dev0"}
{"input": ["opencl -keys=mali,opencl,gpu -device=mali -max_num_threads=512 -thread_warp_size=2", "conv2d_nchw_spatial_pack.mali", [["TENSOR", [1, 32, 53, 42], "float32"], ["TENSOR", [4, 32, 1, 1], "float32"], [1, 1], [0, 0, 0, 0], [1, 1], "float32"], {}], "config": {"index": 47567, "code_hash": null, "entity": [["tile_co", "sp", [-1, 1, 4]], ["tile_oh", "sp", [-1, 53, 1]], ["tile_ow", "sp", [-1, 3, 14]], ["reorder_0", "re", [0, 1, 2, 3, 4, 5, 6, 9, 7, 8]], ["ann_reduce", "an", ["none", "none"]], ["ann_spatial", "an", ["unroll", "unroll", "unroll"]]]}, "result": [[0.0006101925368956743], 0, 17.82137155532837, 1630489533.034081], "version": 0.2, "tvm_version": "0.8.dev0"}
{"input": ["opencl -keys=mali,opencl,gpu -device=mali -max_num_threads=512 -thread_warp_size=2", "conv2d_nchw_spatial_pack.mali", [["TENSOR", [1, 32, 53, 42], "float32"], ["TENSOR", [4, 32, 1, 1], "float32"], [1, 1], [0, 0, 0, 0], [1, 1], "float32"], {}], "config": {"index": 47039, "code_hash": null, "entity": [["tile_co", "sp", [-1, 1, 4]], ["tile_oh", "sp", [-1, 1, 1]], ["tile_ow", "sp", [-1, 6, 7]], ["reorder_0", "re", [0, 1, 2, 3, 4, 5, 6, 7, 8, 9]], ["ann_reduce", "an", ["none", "none"]], ["ann_spatial", "an", ["unroll", "unroll", "unroll"]]]}, "result": [[0.0005064702380952382], 0, 26.339974880218506, 1630489541.5724635], "version": 0.2, "tvm_version": "0.8.dev0"}
{"input": ["opencl -keys=mali,opencl,gpu -device=mali -max_num_threads=512 -thread_warp_size=2", "conv2d_nchw_spatial_pack.mali", [["TENSOR", [1, 32, 53, 42], "float32"], ["TENSOR", [4, 32, 1, 1], "float32"], [1, 1], [0, 0, 0, 0], [1, 1], "float32"], {}], "config": {"index": 47026, "code_hash": null, "entity": [["tile_co", "sp", [-1, 2, 2]], ["tile_oh", "sp", [-1, 53, 1]], ["tile_ow", "sp", [-1, 3, 7]], ["reorder_0", "re", [0, 1, 2, 3, 4, 5, 6, 7, 8, 9]], ["ann_reduce", "an", ["none", "none"]], ["ann_spatial", "an", ["unroll", "unroll", "unroll"]]]}, "result": [[0.0022849141363636364], 0, 34.6771936416626, 1630489549.927461], "version": 0.2, "tvm_version": "0.8.dev0"}
{"input": ["opencl -keys=mali,opencl,gpu -device=mali -max_num_threads=512 -thread_warp_size=2", "conv2d_nchw_spatial_pack.mali", [["TENSOR", [1, 32, 53, 42], "float32"], ["TENSOR", [4, 32, 1, 1], "float32"], [1, 1], [0, 0, 0, 0], [1, 1], "float32"], {}], "config": {"index": 50483, "code_hash": null, "entity": [["tile_co", "sp", [-1, 1, 4]], ["tile_oh", "sp", [-1, 53, 1]], ["tile_ow", "sp", [-1, 3, 14]], ["reorder_0", "re", [0, 1, 2, 3, 4, 5, 6, 9, 7, 8]], ["ann_reduce", "an", ["unroll", "unroll"]], ["ann_spatial", "an", ["unroll", "unroll", "unroll"]]]}, "result": [[0.0006470106569767442], 0, 43.68804049491882, 1630489558.9444752], "version": 0.2, "tvm_version": "0.8.dev0"}
{"input": ["opencl -keys=mali,opencl,gpu -device=mali -max_num_threads=512 -thread_warp_size=2", "conv2d_nchw_spatial_pack.mali", [["TENSOR", [1, 32, 53, 42], "float32"], ["TENSOR", [4, 32, 1, 1], "float32"], [1, 1], [0, 0, 0, 0], [1, 1], "float32"], {}], "config": {"index": 74741, "code_hash": null, "entity": [["tile_co", "sp", [-1, 1, 4]], ["tile_oh", "sp", [-1, 1, 1]], ["tile_ow", "sp", [-1, 6, 7]], ["reorder_0", "re", [0, 1, 2, 3, 4, 5, 6, 9, 7, 8]], ["ann_reduce", "an", ["none", "none"]], ["ann_spatial", "an", ["vec", "unroll", "unroll"]]]}, "result": [[0.0006995820895522388], 0, 52.35025215148926, 1630489567.6337593], "version": 0.2, "tvm_version": "0.8.dev0"}
{"input": ["opencl -keys=mali,opencl,gpu -device=mali -max_num_threads=512 -thread_warp_size=2", "conv2d_nchw_spatial_pack.mali", [["TENSOR", [1, 32, 53, 42], "float32"], ["TENSOR", [4, 32, 1, 1], "float32"], [1, 1], [0, 0, 0, 0], [1, 1], "float32"], {}], "config": {"index": 75754, "code_hash": null, "entity": [["tile_co", "sp", [-1, 2, 2]], ["tile_oh", "sp", [-1, 53, 1]], ["tile_ow", "sp", [-1, 3, 14]], ["reorder_0", "re", [0, 1, 2, 3, 4, 5, 6, 9, 7, 8]], ["ann_reduce", "an", ["none", "unroll"]], ["ann_spatial", "an", ["vec", "unroll", "unroll"]]]}, "result": [[0.0024709473684210526], 0, 60.91792893409729, 1630489576.2057018], "version": 0.2, "tvm_version": "0.8.dev0"}
{"input": ["opencl -keys=mali,opencl,gpu -device=mali -max_num_threads=512 -thread_warp_size=2", "conv2d_nchw_spatial_pack.mali", [["TENSOR", [1, 32, 53, 42], "float32"], ["TENSOR", [4, 32, 1, 1], "float32"], [1, 1], [0, 0, 0, 0], [1, 1], "float32"], {}], "config": {"index": 75719, "code_hash": null, "entity": [["tile_co", "sp", [-1, 1, 4]], ["tile_oh", "sp", [-1, 53, 1]], ["tile_ow", "sp", [-1, 6, 7]], ["reorder_0", "re", [0, 1, 2, 3, 4, 5, 6, 9, 7, 8]], ["ann_reduce", "an", ["none", "unroll"]], ["ann_spatial", "an", ["vec", "unroll", "unroll"]]]}, "result": [[0.0008404150673076923], 0, 69.63959574699402, 1630489584.939808], "version": 0.2, "tvm_version": "0.8.dev0"}
{"input": ["opencl -keys=mali,opencl,gpu -device=mali -max_num_threads=512 -thread_warp_size=2", "conv2d_nchw_spatial_pack.mali", [["TENSOR", [1, 32, 53, 42], "float32"], ["TENSOR", [4, 32, 1, 1], "float32"], [1, 1], [0, 0, 0, 0], [1, 1], "float32"], {}], "config": {"index": 74561, "code_hash": null, "entity": [["tile_co", "sp", [-1, 1, 4]], ["tile_oh", "sp", [-1, 1, 1]], ["tile_ow", "sp", [-1, 21, 2]], ["reorder_0", "re", [0, 1, 2, 3, 4, 5, 6, 9, 7, 8]], ["ann_reduce", "an", ["none", "none"]], ["ann_spatial", "an", ["vec", "unroll", "unroll"]]]}, "result": [[0.0010323311258278146], 0, 78.01396179199219, 1630489593.3425775], "version": 0.2, "tvm_version": "0.8.dev0"}
{"input": ["opencl -keys=mali,opencl,gpu -device=mali -max_num_threads=512 -thread_warp_size=2", "conv2d_nchw_spatial_pack.mali", [["TENSOR", [1, 32, 53, 42], "float32"], ["TENSOR", [4, 32, 1, 1], "float32"], [1, 1], [0, 0, 0, 0], [1, 1], "float32"], {}], "config": {"index": 50477, "code_hash": null, "entity": [["tile_co", "sp", [-1, 1, 4]], ["tile_oh", "sp", [-1, 1, 1]], ["tile_ow", "sp", [-1, 3, 14]], ["reorder_0", "re", [0, 1, 2, 3, 4, 5, 6, 9, 7, 8]], ["ann_reduce", "an", ["unroll", "unroll"]], ["ann_spatial", "an", ["unroll", "unroll", "unroll"]]]}, "result": [[0.0005193661213114755], 0, 86.70216679573059, 1630489602.0415437], "version": 0.2, "tvm_version": "0.8.dev0"}
{"input": ["opencl -keys=mali,opencl,gpu -device=mali -max_num_threads=512 -thread_warp_size=2", "conv2d_nchw_spatial_pack.mali", [["TENSOR", [1, 32, 53, 42], "float32"], ["TENSOR", [4, 32, 1, 1], "float32"], [1, 1], [0, 0, 0, 0], [1, 1], "float32"], {}], "config": {"index": 77693, "code_hash": null, "entity": [["tile_co", "sp", [-1, 1, 4]], ["tile_oh", "sp", [-1, 1, 1]], ["tile_ow", "sp", [-1, 3, 14]], ["reorder_0", "re", [0, 1, 2, 3, 4, 5, 6, 9, 7, 8]], ["ann_reduce", "an", ["unroll", "unroll"]], ["ann_spatial", "an", ["vec", "unroll", "unroll"]]]}, "result": [[0.0006660214733893557], 0, 95.68018794059753, 1630489611.0378811], "version": 0.2, "tvm_version": "0.8.dev0"}
{"input": ["opencl -keys=mali,opencl,gpu -device=mali -max_num_threads=512 -thread_warp_size=2", "conv2d_nchw_spatial_pack.mali", [["TENSOR", [1, 32, 53, 42], "float32"], ["TENSOR", [4, 32, 1, 1], "float32"], [1, 1], [0, 0, 0, 0], [1, 1], "float32"], {}], "config": {"index": 47008, "code_hash": null, "entity": [["tile_co", "sp", [-1, 2, 2]], ["tile_oh", "sp", [-1, 53, 1]], ["tile_ow", "sp", [-1, 2, 7]], ["reorder_0", "re", [0, 1, 2, 3, 4, 5, 6, 7, 8, 9]], ["ann_reduce", "an", ["none", "none"]], ["ann_spatial", "an", ["unroll", "unroll", "unroll"]]]}, "result": [[0.000883583802259887], 0, 104.57157874107361, 1630489619.9400828], "version": 0.2, "tvm_version": "0.8.dev0"}
{"input": ["opencl -keys=mali,opencl,gpu -device=mali -max_num_threads=512 -thread_warp_size=2", "conv2d_nchw_spatial_pack.mali", [["TENSOR", [1, 32, 53, 42], "float32"], ["TENSOR", [4, 32, 1, 1], "float32"], [1, 1], [0, 0, 0, 0], [1, 1], "float32"], {}], "config": {"index": 47998, "code_hash": null, "entity": [["tile_co", "sp", [-1, 2, 2]], ["tile_oh", "sp", [-1, 53, 1]], ["tile_ow", "sp", [-1, 3, 7]], ["reorder_0", "re", [0, 1, 2, 3, 4, 5, 6, 7, 8, 9]], ["ann_reduce", "an", ["none", "unroll"]], ["ann_spatial", "an", ["unroll", "unroll", "unroll"]]]}, "result": [[0.0006893435114503816], 0, 113.05290794372559, 1630489628.4514208], "version": 0.2, "tvm_version": "0.8.dev0"}
{"input": ["opencl -keys=mali,opencl,gpu -device=mali -max_num_threads=512 -thread_warp_size=2", "conv2d_nchw_spatial_pack.mali", [["TENSOR", [1, 32, 53, 42], "float32"], ["TENSOR", [4, 32, 1, 1], "float32"], [1, 1], [0, 0, 0, 0], [1, 1], "float32"], {}], "config": {"index": 77698, "code_hash": null, "entity": [["tile_co", "sp", [-1, 2, 2]], ["tile_oh", "sp", [-1, 53, 1]], ["tile_ow", "sp", [-1, 3, 14]], ["reorder_0", "re", [0, 1, 2, 3, 4, 5, 6, 9, 7, 8]], ["ann_reduce", "an", ["unroll", "unroll"]], ["ann_spatial", "an", ["vec", "unroll", "unroll"]]]}, "result": [[0.0005753310646258504], 0, 121.86323142051697, 1630489637.2700994], "version": 0.2, "tvm_version": "0.8.dev0"}
{"input": ["opencl -keys=mali,opencl,gpu -device=mali -max_num_threads=512 -thread_warp_size=2", "conv2d_nchw_spatial_pack.mali", [["TENSOR", [1, 32, 53, 42], "float32"], ["TENSOR", [4, 32, 1, 1], "float32"], [1, 1], [0, 0, 0, 0], [1, 1], "float32"], {}], "config": {"index": 74633, "code_hash": null, "entity": [["tile_co", "sp", [-1, 1, 4]], ["tile_oh", "sp", [-1, 1, 1]], ["tile_ow", "sp", [-1, 14, 3]], ["reorder_0", "re", [0, 1, 2, 3, 4, 5, 6, 9, 7, 8]], ["ann_reduce", "an", ["none", "none"]], ["ann_spatial", "an", ["vec", "unroll", "unroll"]]]}, "result": [[0.0009344935913461539], 0, 130.31533193588257, 1630489645.7452464], "version": 0.2, "tvm_version": "0.8.dev0"}
{"input": ["opencl -keys=mali,opencl,gpu -device=mali -max_num_threads=512 -thread_warp_size=2", "conv2d_nchw_spatial_pack.mali", [["TENSOR", [1, 32, 53, 42], "float32"], ["TENSOR", [4, 32, 1, 1], "float32"], [1, 1], [0, 0, 0, 0], [1, 1], "float32"], {}], "config": {"index": 48982, "code_hash": null, "entity": [["tile_co", "sp", [-1, 2, 2]], ["tile_oh", "sp", [-1, 1, 1]], ["tile_ow", "sp", [-1, 6, 7]], ["reorder_0", "re", [0, 1, 2, 3, 4, 5, 6, 7, 8, 9]], ["ann_reduce", "an", ["unroll", "none"]], ["ann_spatial", "an", ["unroll", "unroll", "unroll"]]]}, "result": [[0.0007142173913043478], 0, 138.96568870544434, 1630489654.404118], "version": 0.2, "tvm_version": "0.8.dev0"}
