example_04/auto_tvm_log/v9h-model-01-NCHW-opencl-C1000-T21-08-31-09-40.log.tmp
{"input": ["opencl -keys=mali,opencl,gpu -device=mali -max_num_threads=256 -thread_warp_size=1", "conv2d_nchw_spatial_pack.mali", [["TENSOR", [1, 16, 212, 168], "float32"], ["TENSOR", [15, 16, 1, 1], "float32"], [1, 1], [0, 0, 0, 0], [1, 1], "float32"], {}], "config": {"index": 1458386, "code_hash": null, "entity": [["tile_co", "sp", [-1, 1, 15]], ["tile_oh", "sp", [-1, 1, 2]], ["tile_ow", "sp", [-1, 3, 1]], ["reorder_0", "re", [0, 1, 2, 3, 4, 5, 6, 7, 8, 9]], ["ann_reduce", "an", ["unroll", "none"]], ["ann_spatial", "an", ["unroll", "unroll", "unroll"]]]}, "result": [[0.015945527749999997], 0, 8.595657348632812, 1630374104.1812263], "version": 0.2, "tvm_version": "0.8.dev0"}
{"input": ["opencl -keys=mali,opencl,gpu -device=mali -max_num_threads=256 -thread_warp_size=1", "conv2d_nchw_spatial_pack.mali", [["TENSOR", [1, 16, 212, 168], "float32"], ["TENSOR", [15, 16, 1, 1], "float32"], [1, 1], [0, 0, 0, 0], [1, 1], "float32"], {}], "config": {"index": 1458224, "code_hash": null, "entity": [["tile_co", "sp", [-1, 1, 15]], ["tile_oh", "sp", [-1, 1, 2]], ["tile_ow", "sp", [-1, 2, 1]], ["reorder_0", "re", [0, 1, 2, 3, 4, 5, 6, 7, 8, 9]], ["ann_reduce", "an", ["unroll", "none"]], ["ann_spatial", "an", ["unroll", "unroll", "unroll"]]]}, "result": [[0.018508777777777777], 0, 18.06515097618103, 1630374113.6754053], "version": 0.2, "tvm_version": "0.8.dev0"}
{"input": ["opencl -keys=mali,opencl,gpu -device=mali -max_num_threads=256 -thread_warp_size=1", "conv2d_nchw_spatial_pack.mali", [["TENSOR", [1, 16, 212, 168], "float32"], ["TENSOR", [15, 16, 1, 1], "float32"], [1, 1], [0, 0, 0, 0], [1, 1], "float32"], {}], "config": {"index": 1400066, "code_hash": null, "entity": [["tile_co", "sp", [-1, 1, 15]], ["tile_oh", "sp", [-1, 1, 2]], ["tile_ow", "sp", [-1, 3, 1]], ["reorder_0", "re", [0, 1, 2, 3, 4, 5, 6, 7, 8, 9]], ["ann_reduce", "an", ["none", "none"]], ["ann_spatial", "an", ["unroll", "unroll", "unroll"]]]}, "result": [[0.019226899999999998], 0, 27.102284908294678, 1630374122.724704], "version": 0.2, "tvm_version": "0.8.dev0"}
{"input": ["opencl -keys=mali,opencl,gpu -device=mali -max_num_threads=256 -thread_warp_size=1", "conv2d_nchw_spatial_pack.mali", [["TENSOR", [1, 16, 212, 168], "float32"], ["TENSOR", [15, 16, 1, 1], "float32"], [1, 1], [0, 0, 0, 0], [1, 1], "float32"], {}], "config": {"index": 1399904, "code_hash": null, "entity": [["tile_co", "sp", [-1, 1, 15]], ["tile_oh", "sp", [-1, 1, 2]], ["tile_ow", "sp", [-1, 2, 1]], ["reorder_0", "re", [0, 1, 2, 3, 4, 5, 6, 7, 8, 9]], ["ann_reduce", "an", ["none", "none"]], ["ann_spatial", "an", ["unroll", "unroll", "unroll"]]]}, "result": [[0.017562259333333337], 0, 35.78377342224121, 1630374131.4143472], "version": 0.2, "tvm_version": "0.8.dev0"}
{"input": ["opencl -keys=mali,opencl,gpu -device=mali -max_num_threads=256 -thread_warp_size=1", "conv2d_nchw_spatial_pack.mali", [["TENSOR", [1, 16, 212, 168], "float32"], ["TENSOR", [15, 16, 1, 1], "float32"], [1, 1], [0, 0, 0, 0], [1, 1], "float32"], {}], "config": {"index": 1487546, "code_hash": null, "entity": [["tile_co", "sp", [-1, 1, 15]], ["tile_oh", "sp", [-1, 1, 2]], ["tile_ow", "sp", [-1, 3, 1]], ["reorder_0", "re", [0, 1, 2, 3, 4, 5, 6, 7, 8, 9]], ["ann_reduce", "an", ["unroll", "unroll"]], ["ann_spatial", "an", ["unroll", "unroll", "unroll"]]]}, "result": [[0.016409166666666666], 0, 45.340606451034546, 1630374140.9807496], "version": 0.2, "tvm_version": "0.8.dev0"}
{"input": ["opencl -keys=mali,opencl,gpu -device=mali -max_num_threads=256 -thread_warp_size=1", "conv2d_nchw_spatial_pack.mali", [["TENSOR", [1, 16, 212, 168], "float32"], ["TENSOR", [15, 16, 1, 1], "float32"], [1, 1], [0, 0, 0, 0], [1, 1], "float32"], {}], "config": {"index": 1429226, "code_hash": null, "entity": [["tile_co", "sp", [-1, 1, 15]], ["tile_oh", "sp", [-1, 1, 2]], ["tile_ow", "sp", [-1, 3, 1]], ["reorder_0", "re", [0, 1, 2, 3, 4, 5, 6, 7, 8, 9]], ["ann_reduce", "an", ["none", "unroll"]], ["ann_spatial", "an", ["unroll", "unroll", "unroll"]]]}, "result": [[0.0170079334], 0, 54.037426471710205, 1630374149.7175663], "version": 0.2, "tvm_version": "0.8.dev0"}
{"input": ["opencl -keys=mali,opencl,gpu -device=mali -max_num_threads=256 -thread_warp_size=1", "conv2d_nchw_spatial_pack.mali", [["TENSOR", [1, 16, 212, 168], "float32"], ["TENSOR", [15, 16, 1, 1], "float32"], [1, 1], [0, 0, 0, 0], [1, 1], "float32"], {}], "config": {"index": 1487384, "code_hash": null, "entity": [["tile_co", "sp", [-1, 1, 15]], ["tile_oh", "sp", [-1, 1, 2]], ["tile_ow", "sp", [-1, 2, 1]], ["reorder_0", "re", [0, 1, 2, 3, 4, 5, 6, 7, 8, 9]], ["ann_reduce", "an", ["unroll", "unroll"]], ["ann_spatial", "an", ["unroll", "unroll", "unroll"]]]}, "result": [[0.017217], 0, 62.794801235198975, 1630374158.4881077], "version": 0.2, "tvm_version": "0.8.dev0"}
{"input": ["opencl -keys=mali,opencl,gpu -device=mali -max_num_threads=256 -thread_warp_size=1", "conv2d_nchw_spatial_pack.mali", [["TENSOR", [1, 16, 212, 168], "float32"], ["TENSOR", [15, 16, 1, 1], "float32"], [1, 1], [0, 0, 0, 0], [1, 1], "float32"], {}], "config": {"index": 1437820, "code_hash": null, "entity": [["tile_co", "sp", [-1, 3, 5]], ["tile_oh", "sp", [-1, 2, 2]], ["tile_ow", "sp", [-1, 8, 7]], ["reorder_0", "re", [0, 1, 2, 3, 4, 5, 6, 7, 8, 9]], ["ann_reduce", "an", ["none", "unroll"]], ["ann_spatial", "an", ["unroll", "unroll", "unroll"]]]}, "result": [[0.050184799999999995], 0, 72.00001096725464, 1630374167.693961], "version": 0.2, "tvm_version": "0.8.dev0"}
{"input": ["opencl -keys=mali,opencl,gpu -device=mali -max_num_threads=256 -thread_warp_size=1", "conv2d_nchw_spatial_pack.mali", [["TENSOR", [1, 16, 212, 168], "float32"], ["TENSOR", [15, 16, 1, 1], "float32"], [1, 1], [0, 0, 0, 0], [1, 1], "float32"], {}], "config": {"index": 1429064, "code_hash": null, "entity": [["tile_co", "sp", [-1, 1, 15]], ["tile_oh", "sp", [-1, 1, 2]], ["tile_ow", "sp", [-1, 2, 1]], ["reorder_0", "re", [0, 1, 2, 3, 4, 5, 6, 7, 8, 9]], ["ann_reduce", "an", ["none", "unroll"]], ["ann_spatial", "an", ["unroll", "unroll", "unroll"]]]}, "result": [[0.0900267334], 0, 81.45808339118958, 1630374177.1927764], "version": 0.2, "tvm_version": "0.8.dev0"}
{"input": ["opencl -keys=mali,opencl,gpu -device=mali -max_num_threads=256 -thread_warp_size=1", "conv2d_nchw_spatial_pack.mali", [["TENSOR", [1, 16, 212, 168], "float32"], ["TENSOR", [15, 16, 1, 1], "float32"], [1, 1], [0, 0, 0, 0], [1, 1], "float32"], {}], "config": {"index": 1749986, "code_hash": null, "entity": [["tile_co", "sp", [-1, 1, 15]], ["tile_oh", "sp", [-1, 1, 2]], ["tile_ow", "sp", [-1, 3, 1]], ["reorder_0", "re", [0, 1, 2, 3, 4, 5, 6, 7, 8, 9]], ["ann_reduce", "an", ["none", "none"]], ["ann_spatial", "an", ["unroll", "vec", "unroll"]]]}, "result": [[0.0168629333], 0, 90.16622495651245, 1630374185.9026], "version": 0.2, "tvm_version": "0.8.dev0"}
{"input": ["opencl -keys=mali,opencl,gpu -device=mali -max_num_threads=256 -thread_warp_size=1", "conv2d_nchw_spatial_pack.mali", [["TENSOR", [1, 16, 212, 168], "float32"], ["TENSOR", [15, 16, 1, 1], "float32"], [1, 1], [0, 0, 0, 0], [1, 1], "float32"], {}], "config": {"index": 525104, "code_hash": null, "entity": [["tile_co", "sp", [-1, 1, 15]], ["tile_oh", "sp", [-1, 1, 2]], ["tile_ow", "sp", [-1, 2, 1]], ["reorder_0", "re", [0, 1, 2, 3, 4, 5, 6, 7, 8, 9]], ["ann_reduce", "an", ["unroll", "none"]], ["ann_spatial", "an", ["none", "unroll", "unroll"]]]}, "result": [[0.036199999999999996], 0, 99.16616082191467, 1630374194.9289522], "version": 0.2, "tvm_version": "0.8.dev0"}
{"input": ["opencl -keys=mali,opencl,gpu -device=mali -max_num_threads=256 -thread_warp_size=1", "conv2d_nchw_spatial_pack.mali", [["TENSOR", [1, 16, 212, 168], "float32"], ["TENSOR", [15, 16, 1, 1], "float32"], [1, 1], [0, 0, 0, 0], [1, 1], "float32"], {}], "config": {"index": 1341746, "code_hash": null, "entity": [["tile_co", "sp", [-1, 1, 15]], ["tile_oh", "sp", [-1, 1, 2]], ["tile_ow", "sp", [-1, 3, 1]], ["reorder_0", "re", [0, 1, 2, 3, 4, 5, 6, 7, 8, 9]], ["ann_reduce", "an", ["unroll", "none"]], ["ann_spatial", "an", ["unroll", "unroll", "none"]]]}, "result": [[0.1191256668], 0, 109.10363411903381, 1630374204.9016953], "version": 0.2, "tvm_version": "0.8.dev0"}
{"input": ["opencl -keys=mali,opencl,gpu -device=mali -max_num_threads=256 -thread_warp_size=1", "conv2d_nchw_spatial_pack.mali", [["TENSOR", [1, 16, 212, 168], "float32"], ["TENSOR", [15, 16, 1, 1], "float32"], [1, 1], [0, 0, 0, 0], [1, 1], "float32"], {}], "config": {"index": 1438630, "code_hash": null, "entity": [["tile_co", "sp", [-1, 3, 5]], ["tile_oh", "sp", [-1, 2, 2]], ["tile_ow", "sp", [-1, 7, 8]], ["reorder_0", "re", [0, 1, 2, 3, 4, 5, 6, 7, 8, 9]], ["ann_reduce", "an", ["none", "unroll"]], ["ann_spatial", "an", ["unroll", "unroll", "unroll"]]]}, "result": [[0.0072900000000000005], 0, 118.37879586219788, 1630374214.1568708], "version": 0.2, "tvm_version": "0.8.dev0"}
{"input": ["opencl -keys=mali,opencl,gpu -device=mali -max_num_threads=256 -thread_warp_size=1", "conv2d_nchw_spatial_pack.mali", [["TENSOR", [1, 16, 212, 168], "float32"], ["TENSOR", [15, 16, 1, 1], "float32"], [1, 1], [0, 0, 0, 0], [1, 1], "float32"], {}], "config": {"index": 1050146, "code_hash": null, "entity": [["tile_co", "sp", [-1, 1, 15]], ["tile_oh", "sp", [-1, 1, 2]], ["tile_ow", "sp", [-1, 3, 1]], ["reorder_0", "re", [0, 1, 2, 3, 4, 5, 6, 7, 8, 9]], ["ann_reduce", "an", ["none", "none"]], ["ann_spatial", "an", ["unroll", "none", "unroll"]]]}, "result": [[0.01619227775], 0, 127.33494973182678, 1630374223.163063], "version": 0.2, "tvm_version": "0.8.dev0"}
{"input": ["opencl -keys=mali,opencl,gpu -device=mali -max_num_threads=256 -thread_warp_size=1", "conv2d_nchw_spatial_pack.mali", [["TENSOR", [1, 16, 212, 168], "float32"], ["TENSOR", [15, 16, 1, 1], "float32"], [1, 1], [0, 0, 0, 0], [1, 1], "float32"], {}], "config": {"index": 1808306, "code_hash": null, "entity": [["tile_co", "sp", [-1, 1, 15]], ["tile_oh", "sp", [-1, 1, 2]], ["tile_ow", "sp", [-1, 3, 1]], ["reorder_0", "re", [0, 1, 2, 3, 4, 5, 6, 7, 8, 9]], ["ann_reduce", "an", ["unroll", "none"]], ["ann_spatial", "an", ["unroll", "vec", "unroll"]]]}, "result": [[0.11095433340000001], 0, 137.0409116744995, 1630374232.895453], "version": 0.2, "tvm_version": "0.8.dev0"}
{"input": ["opencl -keys=mali,opencl,gpu -device=mali -max_num_threads=256 -thread_warp_size=1", "conv2d_nchw_spatial_pack.mali", [["TENSOR", [1, 16, 212, 168], "float32"], ["TENSOR", [15, 16, 1, 1], "float32"], [1, 1], [0, 0, 0, 0], [1, 1], "float32"], {}], "config": {"index": 1108304, "code_hash": null, "entity": [["tile_co", "sp", [-1, 1, 15]], ["tile_oh", "sp", [-1, 1, 2]], ["tile_ow", "sp", [-1, 2, 1]], ["reorder_0", "re", [0, 1, 2, 3, 4, 5, 6, 7, 8, 9]], ["ann_reduce", "an", ["unroll", "none"]], ["ann_spatial", "an", ["unroll", "none", "unroll"]]]}, "result": [[0.01759285188888889], 0, 146.2923505306244, 1630374242.1655219], "version": 0.2, "tvm_version": "0.8.dev0"}
{"input": ["opencl -keys=mali,opencl,gpu -device=mali -max_num_threads=256 -thread_warp_size=1", "conv2d_nchw_spatial_pack.mali", [["TENSOR", [1, 16, 212, 168], "float32"], ["TENSOR", [15, 16, 1, 1], "float32"], [1, 1], [0, 0, 0, 0], [1, 1], "float32"], {}], "config": {"index": 1108466, "code_hash": null, "entity": [["tile_co", "sp", [-1, 1, 15]], ["tile_oh", "sp", [-1, 1, 2]], ["tile_ow", "sp", [-1, 3, 1]], ["reorder_0", "re", [0, 1, 2, 3, 4, 5, 6, 7, 8, 9]], ["ann_reduce", "an", ["unroll", "none"]], ["ann_spatial", "an", ["unroll", "none", "unroll"]]]}, "result": [[0.11434346660000001], 0, 9.637055397033691, 1630374252.3127408], "version": 0.2, "tvm_version": "0.8.dev0"}
{"input": ["opencl -keys=mali,opencl,gpu -device=mali -max_num_threads=256 -thread_warp_size=1", "conv2d_nchw_spatial_pack.mali", [["TENSOR", [1, 16, 212, 168], "float32"], ["TENSOR", [15, 16, 1, 1], "float32"], [1, 1], [0, 0, 0, 0], [1, 1], "float32"], {}], "config": {"index": 1408660, "code_hash": null, "entity": [["tile_co", "sp", [-1, 3, 5]], ["tile_oh", "sp", [-1, 2, 2]], ["tile_ow", "sp", [-1, 8, 7]], ["reorder_0", "re", [0, 1, 2, 3, 4, 5, 6, 7, 8, 9]], ["ann_reduce", "an", ["none", "none"]], ["ann_spatial", "an", ["unroll", "unroll", "unroll"]]]}, "result": [[0.049684133400000004], 0, 18.78131341934204, 1630374261.4613018], "version": 0.2, "tvm_version": "0.8.dev0"}
{"input": ["opencl -keys=mali,opencl,gpu -device=mali -max_num_threads=256 -thread_warp_size=1", "conv2d_nchw_spatial_pack.mali", [["TENSOR", [1, 16, 212, 168], "float32"], ["TENSOR", [15, 16, 1, 1], "float32"], [1, 1], [0, 0, 0, 0], [1, 1], "float32"], {}], "config": {"index": 1409470, "code_hash": null, "entity": [["tile_co", "sp", [-1, 3, 5]], ["tile_oh", "sp", [-1, 2, 2]], ["tile_ow", "sp", [-1, 7, 8]], ["reorder_0", "re", [0, 1, 2, 3, 4, 5, 6, 7, 8, 9]], ["ann_reduce", "an", ["none", "none"]], ["ann_spatial", "an", ["unroll", "unroll", "unroll"]]]}, "result": [[0.007302190476190477], 0, 27.837726593017578, 1630374270.5336268], "version": 0.2, "tvm_version": "0.8.dev0"}
{"input": ["opencl -keys=mali,opencl,gpu -device=mali -max_num_threads=256 -thread_warp_size=1", "conv2d_nchw_spatial_pack.mali", [["TENSOR", [1, 16, 212, 168], "float32"], ["TENSOR", [15, 16, 1, 1], "float32"], [1, 1], [0, 0, 0, 0], [1, 1], "float32"], {}], "config": {"index": 1341584, "code_hash": null, "entity": [["tile_co", "sp", [-1, 1, 15]], ["tile_oh", "sp", [-1, 1, 2]], ["tile_ow", "sp", [-1, 2, 1]], ["reorder_0", "re", [0, 1, 2, 3, 4, 5, 6, 7, 8, 9]], ["ann_reduce", "an", ["unroll", "none"]], ["ann_spatial", "an", ["unroll", "unroll", "none"]]]}, "result": [[0.0330327334], 0, 36.8326313495636, 1630374279.5664458], "version": 0.2, "tvm_version": "0.8.dev0"}
{"input": ["opencl -keys=mali,opencl,gpu -device=mali -max_num_threads=256 -thread_warp_size=1", "conv2d_nchw_spatial_pack.mali", [["TENSOR", [1, 16, 212, 168], "float32"], ["TENSOR", [15, 16, 1, 1], "float32"], [1, 1], [0, 0, 0, 0], [1, 1], "float32"], {}], "config": {"index": 525266, "code_hash": null, "entity": [["tile_co", "sp", [-1, 1, 15]], ["tile_oh", "sp", [-1, 1, 2]], ["tile_ow", "sp", [-1, 3, 1]], ["reorder_0", "re", [0, 1, 2, 3, 4, 5, 6, 7, 8, 9]], ["ann_reduce", "an", ["unroll", "none"]], ["ann_spatial", "an", ["none", "unroll", "unroll"]]]}, "result": [[0.1907734666], 0, 47.70188093185425, 1630374290.453228], "version": 0.2, "tvm_version": "0.8.dev0"}
{"input": ["opencl -keys=mali,opencl,gpu -device=mali -max_num_threads=256 -thread_warp_size=1", "conv2d_nchw_spatial_pack.mali", [["TENSOR", [1, 16, 212, 168], "float32"], ["TENSOR", [15, 16, 1, 1], "float32"], [1, 1], [0, 0, 0, 0], [1, 1], "float32"], {}], "config": {"index": 1049984, "code_hash": null, "entity": [["tile_co", "sp", [-1, 1, 15]], ["tile_oh", "sp", [-1, 1, 2]], ["tile_ow", "sp", [-1, 2, 1]], ["reorder_0", "re", [0, 1, 2, 3, 4, 5, 6, 7, 8, 9]], ["ann_reduce", "an", ["none", "none"]], ["ann_spatial", "an", ["unroll", "none", "unroll"]]]}, "result": [[0.018846222222222223], 0, 55.704092025756836, 1630374298.4731412], "version": 0.2, "tvm_version": "0.8.dev0"}
{"input": ["opencl -keys=mali,opencl,gpu -device=mali -max_num_threads=256 -thread_warp_size=1", "conv2d_nchw_spatial_pack.mali", [["TENSOR", [1, 16, 212, 168], "float32"], ["TENSOR", [15, 16, 1, 1], "float32"], [1, 1], [0, 0, 0, 0], [1, 1], "float32"], {}], "config": {"index": 1808144, "code_hash": null, "entity": [["tile_co", "sp", [-1, 1, 15]], ["tile_oh", "sp", [-1, 1, 2]], ["tile_ow", "sp", [-1, 2, 1]], ["reorder_0", "re", [0, 1, 2, 3, 4, 5, 6, 7, 8, 9]], ["ann_reduce", "an", ["unroll", "none"]], ["ann_spatial", "an", ["unroll", "vec", "unroll"]]]}, "result": [[0.018852518444444445], 0, 64.6125340461731, 1630374307.3896008], "version": 0.2, "tvm_version": "0.8.dev0"}
{"input": ["opencl -keys=mali,opencl,gpu -device=mali -max_num_threads=256 -thread_warp_size=1", "conv2d_nchw_spatial_pack.mali", [["TENSOR", [1, 16, 212, 168], "float32"], ["TENSOR", [15, 16, 1, 1], "float32"], [1, 1], [0, 0, 0, 0], [1, 1], "float32"], {}], "config": {"index": 466946, "code_hash": null, "entity": [["tile_co", "sp", [-1, 1, 15]], ["tile_oh", "sp", [-1, 1, 2]], ["tile_ow", "sp", [-1, 3, 1]], ["reorder_0", "re", [0, 1, 2, 3, 4, 5, 6, 7, 8, 9]], ["ann_reduce", "an", ["none", "none"]], ["ann_spatial", "an", ["none", "unroll", "unroll"]]]}, "result": [[0.028250166625], 0, 73.53428936004639, 1630374316.3265545], "version": 0.2, "tvm_version": "0.8.dev0"}
{"input": ["opencl -keys=mali,opencl,gpu -device=mali -max_num_threads=256 -thread_warp_size=1", "conv2d_nchw_spatial_pack.mali", [["TENSOR", [1, 16, 212, 168], "float32"], ["TENSOR", [15, 16, 1, 1], "float32"], [1, 1], [0, 0, 0, 0], [1, 1], "float32"], {}], "config": {"index": 466784, "code_hash": null, "entity": [["tile_co", "sp", [-1, 1, 15]], ["tile_oh", "sp", [-1, 1, 2]], ["tile_ow", "sp", [-1, 2, 1]], ["reorder_0", "re", [0, 1, 2, 3, 4, 5, 6, 7, 8, 9]], ["ann_reduce", "an", ["none", "none"]], ["ann_spatial", "an", ["none", "unroll", "unroll"]]]}, "result": [[0.034360533400000004], 0, 82.37884306907654, 1630374325.1910152], "version": 0.2, "tvm_version": "0.8.dev0"}
{"input": ["opencl -keys=mali,opencl,gpu -device=mali -max_num_threads=256 -thread_warp_size=1", "conv2d_nchw_spatial_pack.mali", [["TENSOR", [1, 16, 212, 168], "float32"], ["TENSOR", [15, 16, 1, 1], "float32"], [1, 1], [0, 0, 0, 0], [1, 1], "float32"], {}], "config": {"index": 1079306, "code_hash": null, "entity": [["tile_co", "sp", [-1, 1, 15]], ["tile_oh", "sp", [-1, 1, 2]], ["tile_ow", "sp", [-1, 3, 1]], ["reorder_0", "re", [0, 1, 2, 3, 4, 5, 6, 7, 8, 9]], ["ann_reduce", "an", ["none", "unroll"]], ["ann_spatial", "an", ["unroll", "none", "unroll"]]]}, "result": [[0.0166181667], 0, 91.20254898071289, 1630374334.0342362], "version": 0.2, "tvm_version": "0.8.dev0"}
{"input": ["opencl -keys=mali,opencl,gpu -device=mali -max_num_threads=256 -thread_warp_size=1", "conv2d_nchw_spatial_pack.mali", [["TENSOR", [1, 16, 212, 168], "float32"], ["TENSOR", [15, 16, 1, 1], "float32"], [1, 1], [0, 0, 0, 0], [1, 1], "float32"], {}], "config": {"index": 1749824, "code_hash": null, "entity": [["tile_co", "sp", [-1, 1, 15]], ["tile_oh", "sp", [-1, 1, 2]], ["tile_ow", "sp", [-1, 2, 1]], ["reorder_0", "re", [0, 1, 2, 3, 4, 5, 6, 7, 8, 9]], ["ann_reduce", "an", ["none", "none"]], ["ann_spatial", "an", ["unroll", "vec", "unroll"]]]}, "result": [[0.0889120668], 0, 100.6795163154602, 1630374343.5337703], "version": 0.2, "tvm_version": "0.8.dev0"}
{"input": ["opencl -keys=mali,opencl,gpu -device=mali -max_num_threads=256 -thread_warp_size=1", "conv2d_nchw_spatial_pack.mali", [["TENSOR", [1, 16, 212, 168], "float32"], ["TENSOR", [15, 16, 1, 1], "float32"], [1, 1], [0, 0, 0, 0], [1, 1], "float32"], {}], "config": {"index": 1137626, "code_hash": null, "entity": [["tile_co", "sp", [-1, 1, 15]], ["tile_oh", "sp", [-1, 1, 2]], ["tile_ow", "sp", [-1, 3, 1]], ["reorder_0", "re", [0, 1, 2, 3, 4, 5, 6, 7, 8, 9]], ["ann_reduce", "an", ["unroll", "unroll"]], ["ann_spatial", "an", ["unroll", "none", "unroll"]]]}, "result": [[0.0168164334], 0, 109.4361343383789, 1630374352.3074954], "version": 0.2, "tvm_version": "0.8.dev0"}
{"input": ["opencl -keys=mali,opencl,gpu -device=mali -max_num_threads=256 -thread_warp_size=1", "conv2d_nchw_spatial_pack.mali", [["TENSOR", [1, 16, 212, 168], "float32"], ["TENSOR", [15, 16, 1, 1], "float32"], [1, 1], [0, 0, 0, 0], [1, 1], "float32"], {}], "config": {"index": 1283426, "code_hash": null, "entity": [["tile_co", "sp", [-1, 1, 15]], ["tile_oh", "sp", [-1, 1, 2]], ["tile_ow", "sp", [-1, 3, 1]], ["reorder_0", "re", [0, 1, 2, 3, 4, 5, 6, 7, 8, 9]], ["ann_reduce", "an", ["none", "none"]], ["ann_spatial", "an", ["unroll", "unroll", "none"]]]}, "result": [[0.027968208375], 0, 118.11781883239746, 1630374361.0106099], "version": 0.2, "tvm_version": "0.8.dev0"}
{"input": ["opencl -keys=mali,opencl,gpu -device=mali -max_num_threads=256 -thread_warp_size=1", "conv2d_nchw_spatial_pack.mali", [["TENSOR", [1, 16, 212, 168], "float32"], ["TENSOR", [15, 16, 1, 1], "float32"], [1, 1], [0, 0, 0, 0], [1, 1], "float32"], {}], "config": {"index": 1779146, "code_hash": null, "entity": [["tile_co", "sp", [-1, 1, 15]], ["tile_oh", "sp", [-1, 1, 2]], ["tile_ow", "sp", [-1, 3, 1]], ["reorder_0", "re", [0, 1, 2, 3, 4, 5, 6, 7, 8, 9]], ["ann_reduce", "an", ["none", "unroll"]], ["ann_spatial", "an", ["unroll", "vec", "unroll"]]]}, "result": [[0.016329083333333334], 0, 127.73512101173401, 1630374370.631614], "version": 0.2, "tvm_version": "0.8.dev0"}
{"input": ["opencl -keys=mali,opencl,gpu -device=mali -max_num_threads=256 -thread_warp_size=1", "conv2d_nchw_spatial_pack.mali", [["TENSOR", [1, 16, 212, 168], "float32"], ["TENSOR", [15, 16, 1, 1], "float32"], [1, 1], [0, 0, 0, 0], [1, 1], "float32"], {}], "config": {"index": 1370906, "code_hash": null, "entity": [["tile_co", "sp", [-1, 1, 15]], ["tile_oh", "sp", [-1, 1, 2]], ["tile_ow", "sp", [-1, 3, 1]], ["reorder_0", "re", [0, 1, 2, 3, 4, 5, 6, 7, 8, 9]], ["ann_reduce", "an", ["unroll", "unroll"]], ["ann_spatial", "an", ["unroll", "unroll", "none"]]]}, "result": [[0.037042399999999996], 0, 137.38167357444763, 1630374380.2970192], "version": 0.2, "tvm_version": "0.8.dev0"}
{"input": ["opencl -keys=mali,opencl,gpu -device=mali -max_num_threads=256 -thread_warp_size=1", "conv2d_nchw_spatial_pack.mali", [["TENSOR", [1, 16, 212, 168], "float32"], ["TENSOR", [15, 16, 1, 1], "float32"], [1, 1], [0, 0, 0, 0], [1, 1], "float32"], {}], "config": {"index": 1137464, "code_hash": null, "entity": [["tile_co", "sp", [-1, 1, 15]], ["tile_oh", "sp", [-1, 1, 2]], ["tile_ow", "sp", [-1, 2, 1]], ["reorder_0", "re", [0, 1, 2, 3, 4, 5, 6, 7, 8, 9]], ["ann_reduce", "an", ["unroll", "unroll"]], ["ann_spatial", "an", ["unroll", "none", "unroll"]]]}, "result": [[0.017436148222222222], 0, 146.12649273872375, 1630374389.0774875], "version": 0.2, "tvm_version": "0.8.dev0"}
{"input": ["opencl -keys=mali,opencl,gpu -device=mali -max_num_threads=256 -thread_warp_size=1", "conv2d_nchw_spatial_pack.mali", [["TENSOR", [1, 16, 212, 168], "float32"], ["TENSOR", [15, 16, 1, 1], "float32"], [1, 1], [0, 0, 0, 0], [1, 1], "float32"], {}], "config": {"index": 1414646, "code_hash": null, "entity": [["tile_co", "sp", [-1, 1, 15]], ["tile_oh", "sp", [-1, 1, 2]], ["tile_ow", "sp", [-1, 3, 1]], ["reorder_0", "re", [0, 1, 2, 3, 4, 5, 6, 9, 7, 8]], ["ann_reduce", "an", ["none", "none"]], ["ann_spatial", "an", ["unroll", "unroll", "unroll"]]]}, "result": [[0.01773122222222222], 0, 8.678280353546143, 1630374398.2607725], "version": 0.2, "tvm_version": "0.8.dev0"}
{"input": ["opencl -keys=mali,opencl,gpu -device=mali -max_num_threads=256 -thread_warp_size=1", "conv2d_nchw_spatial_pack.mali", [["TENSOR", [1, 16, 212, 168], "float32"], ["TENSOR", [15, 16, 1, 1], "float32"], [1, 1], [0, 0, 0, 0], [1, 1], "float32"], {}], "config": {"index": 1431764, "code_hash": null, "entity": [["tile_co", "sp", [-1, 1, 15]], ["tile_oh", "sp", [-1, 1, 1]], ["tile_ow", "sp", [-1, 3, 2]], ["reorder_0", "re", [0, 1, 2, 3, 4, 5, 6, 7, 8, 9]], ["ann_reduce", "an", ["none", "unroll"]], ["ann_spatial", "an", ["unroll", "unroll", "unroll"]]]}, "result": [[0.10969680000000001], 0, 18.145302772521973, 1630374407.7395039], "version": 0.2, "tvm_version": "0.8.dev0"}
{"input": ["opencl -keys=mali,opencl,gpu -device=mali -max_num_threads=256 -thread_warp_size=1", "conv2d_nchw_spatial_pack.mali", [["TENSOR", [1, 16, 212, 168], "float32"], ["TENSOR", [15, 16, 1, 1], "float32"], [1, 1], [0, 0, 0, 0], [1, 1], "float32"], {}], "config": {"index": 1460762, "code_hash": null, "entity": [["tile_co", "sp", [-1, 1, 15]], ["tile_oh", "sp", [-1, 1, 1]], ["tile_ow", "sp", [-1, 2, 2]], ["reorder_0", "re", [0, 1, 2, 3, 4, 5, 6, 7, 8, 9]], ["ann_reduce", "an", ["unroll", "none"]], ["ann_spatial", "an", ["unroll", "unroll", "unroll"]]]}, "result": [[0.017062592666666668], 0, 26.759183645248413, 1630374416.379806], "version": 0.2, "tvm_version": "0.8.dev0"}
{"input": ["opencl -keys=mali,opencl,gpu -device=mali -max_num_threads=256 -thread_warp_size=1", "conv2d_nchw_spatial_pack.mali", [["TENSOR", [1, 16, 212, 168], "float32"], ["TENSOR", [15, 16, 1, 1], "float32"], [1, 1], [0, 0, 0, 0], [1, 1], "float32"], {}], "config": {"index": 1837466, "code_hash": null, "entity": [["tile_co", "sp", [-1, 1, 15]], ["tile_oh", "sp", [-1, 1, 2]], ["tile_ow", "sp", [-1, 3, 1]], ["reorder_0", "re", [0, 1, 2, 3, 4, 5, 6, 7, 8, 9]], ["ann_reduce", "an", ["unroll", "unroll"]], ["ann_spatial", "an", ["unroll", "vec", "unroll"]]]}, "result": [[0.016461638916666667], 0, 36.007035970687866, 1630374425.637605], "version": 0.2, "tvm_version": "0.8.dev0"}
{"input": ["opencl -keys=mali,opencl,gpu -device=mali -max_num_threads=256 -thread_warp_size=1", "conv2d_nchw_spatial_pack.mali", [["TENSOR", [1, 16, 212, 168], "float32"], ["TENSOR", [15, 16, 1, 1], "float32"], [1, 1], [0, 0, 0, 0], [1, 1], "float32"], {}], "config": {"index": 1402604, "code_hash": null, "entity": [["tile_co", "sp", [-1, 1, 15]], ["tile_oh", "sp", [-1, 1, 1]], ["tile_ow", "sp", [-1, 3, 2]], ["reorder_0", "re", [0, 1, 2, 3, 4, 5, 6, 7, 8, 9]], ["ann_reduce", "an", ["none", "none"]], ["ann_spatial", "an", ["unroll", "unroll", "unroll"]]]}, "result": [[0.0166051334], 0, 44.746407985687256, 1630374434.402955], "version": 0.2, "tvm_version": "0.8.dev0"}
{"input": ["opencl -keys=mali,opencl,gpu -device=mali -max_num_threads=256 -thread_warp_size=1", "conv2d_nchw_spatial_pack.mali", [["TENSOR", [1, 16, 212, 168], "float32"], ["TENSOR", [15, 16, 1, 1], "float32"], [1, 1], [0, 0, 0, 0], [1, 1], "float32"], {}], "config": {"index": 1472804, "code_hash": null, "entity": [["tile_co", "sp", [-1, 1, 15]], ["tile_oh", "sp", [-1, 1, 2]], ["tile_ow", "sp", [-1, 2, 1]], ["reorder_0", "re", [0, 1, 2, 3, 4, 5, 6, 9, 7, 8]], ["ann_reduce", "an", ["unroll", "none"]], ["ann_spatial", "an", ["unroll", "unroll", "unroll"]]]}, "result": [[0.017109555555555555], 0, 53.33773994445801, 1630374443.0083182], "version": 0.2, "tvm_version": "0.8.dev0"}
{"input": ["opencl -keys=mali,opencl,gpu -device=mali -max_num_threads=256 -thread_warp_size=1", "conv2d_nchw_spatial_pack.mali", [["TENSOR", [1, 16, 212, 168], "float32"], ["TENSOR", [15, 16, 1, 1], "float32"], [1, 1], [0, 0, 0, 0], [1, 1], "float32"], {}], "config": {"index": 1414484, "code_hash": null, "entity": [["tile_co", "sp", [-1, 1, 15]], ["tile_oh", "sp", [-1, 1, 2]], ["tile_ow", "sp", [-1, 2, 1]], ["reorder_0", "re", [0, 1, 2, 3, 4, 5, 6, 9, 7, 8]], ["ann_reduce", "an", ["none", "none"]], ["ann_spatial", "an", ["unroll", "unroll", "unroll"]]]}, "result": [[0.017863194500000002], 0, 62.75631093978882, 1630374452.451852], "version": 0.2, "tvm_version": "0.8.dev0"}
{"input": ["opencl -keys=mali,opencl,gpu -device=mali -max_num_threads=256 -thread_warp_size=1", "conv2d_nchw_spatial_pack.mali", [["TENSOR", [1, 16, 212, 168], "float32"], ["TENSOR", [15, 16, 1, 1], "float32"], [1, 1], [0, 0, 0, 0], [1, 1], "float32"], {}], "config": {"index": 1490084, "code_hash": null, "entity": [["tile_co", "sp", [-1, 1, 15]], ["tile_oh", "sp", [-1, 1, 1]], ["tile_ow", "sp", [-1, 3, 2]], ["reorder_0", "re", [0, 1, 2, 3, 4, 5, 6, 7, 8, 9]], ["ann_reduce", "an", ["unroll", "unroll"]], ["ann_spatial", "an", ["unroll", "unroll", "unroll"]]]}, "result": [[0.015535952357142857], 0, 72.02998566627502, 1630374461.7404034], "version": 0.2, "tvm_version": "0.8.dev0"}
{"input": ["opencl -keys=mali,opencl,gpu -device=mali -max_num_threads=256 -thread_warp_size=1", "conv2d_nchw_spatial_pack.mali", [["TENSOR", [1, 16, 212, 168], "float32"], ["TENSOR", [15, 16, 1, 1], "float32"], [1, 1], [0, 0, 0, 0], [1, 1], "float32"], {}], "config": {"index": 554426, "code_hash": null, "entity": [["tile_co", "sp", [-1, 1, 15]], ["tile_oh", "sp", [-1, 1, 2]], ["tile_ow", "sp", [-1, 3, 1]], ["reorder_0", "re", [0, 1, 2, 3, 4, 5, 6, 7, 8, 9]], ["ann_reduce", "an", ["unroll", "unroll"]], ["ann_spatial", "an", ["none", "unroll", "unroll"]]]}, "result": [[0.0305410668], 0, 81.08067870140076, 1630374470.8074505], "version": 0.2, "tvm_version": "0.8.dev0"}
{"input": ["opencl -keys=mali,opencl,gpu -device=mali -max_num_threads=256 -thread_warp_size=1", "conv2d_nchw_spatial_pack.mali", [["TENSOR", [1, 16, 212, 168], "float32"], ["TENSOR", [15, 16, 1, 1], "float32"], [1, 1], [0, 0, 0, 0], [1, 1], "float32"], {}], "config": {"index": 1079144, "code_hash": null, "entity": [["tile_co", "sp", [-1, 1, 15]], ["tile_oh", "sp", [-1, 1, 2]], ["tile_ow", "sp", [-1, 2, 1]], ["reorder_0", "re", [0, 1, 2, 3, 4, 5, 6, 7, 8, 9]], ["ann_reduce", "an", ["none", "unroll"]], ["ann_spatial", "an", ["unroll", "none", "unroll"]]]}, "result": [[0.12330959999999999], 0, 90.99284601211548, 1630374480.7123518], "version": 0.2, "tvm_version": "0.8.dev0"}
{"input": ["opencl -keys=mali,opencl,gpu -device=mali -max_num_threads=256 -thread_warp_size=1", "conv2d_nchw_spatial_pack.mali", [["TENSOR", [1, 16, 212, 168], "float32"], ["TENSOR", [15, 16, 1, 1], "float32"], [1, 1], [0, 0, 0, 0], [1, 1], "float32"], {}], "config": {"index": 1460924, "code_hash": null, "entity": [["tile_co", "sp", [-1, 1, 15]], ["tile_oh", "sp", [-1, 1, 1]], ["tile_ow", "sp", [-1, 3, 2]], ["reorder_0", "re", [0, 1, 2, 3, 4, 5, 6, 7, 8, 9]], ["ann_reduce", "an", ["unroll", "none"]], ["ann_spatial", "an", ["unroll", "unroll", "unroll"]]]}, "result": [[0.0157091945], 0, 99.8737542629242, 1630374489.6428044], "version": 0.2, "tvm_version": "0.8.dev0"}
{"input": ["opencl -keys=mali,opencl,gpu -device=mali -max_num_threads=256 -thread_warp_size=1", "conv2d_nchw_spatial_pack.mali", [["TENSOR", [1, 16, 212, 168], "float32"], ["TENSOR", [15, 16, 1, 1], "float32"], [1, 1], [0, 0, 0, 0], [1, 1], "float32"], {}], "config": {"index": 554264, "code_hash": null, "entity": [["tile_co", "sp", [-1, 1, 15]], ["tile_oh", "sp", [-1, 1, 2]], ["tile_ow", "sp", [-1, 2, 1]], ["reorder_0", "re", [0, 1, 2, 3, 4, 5, 6, 7, 8, 9]], ["ann_reduce", "an", ["unroll", "unroll"]], ["ann_spatial", "an", ["none", "unroll", "unroll"]]]}, "result": [[0.034111999999999996], 0, 109.41861963272095, 1630374499.2118235], "version": 0.2, "tvm_version": "0.8.dev0"}
{"input": ["opencl -keys=mali,opencl,gpu -device=mali -max_num_threads=256 -thread_warp_size=1", "conv2d_nchw_spatial_pack.mali", [["TENSOR", [1, 16, 212, 168], "float32"], ["TENSOR", [15, 16, 1, 1], "float32"], [1, 1], [0, 0, 0, 0], [1, 1], "float32"], {}], "config": {"index": 496106, "code_hash": null, "entity": [["tile_co", "sp", [-1, 1, 15]], ["tile_oh", "sp", [-1, 1, 2]], ["tile_ow", "sp", [-1, 3, 1]], ["reorder_0", "re", [0, 1, 2, 3, 4, 5, 6, 7, 8, 9]], ["ann_reduce", "an", ["none", "unroll"]], ["ann_spatial", "an", ["none", "unroll", "unroll"]]]}, "result": [[0.029033333375], 0, 118.52241587638855, 1630374508.3200135], "version": 0.2, "tvm_version": "0.8.dev0"}
{"input": ["opencl -keys=mali,opencl,gpu -device=mali -max_num_threads=256 -thread_warp_size=1", "conv2d_nchw_spatial_pack.mali", [["TENSOR", [1, 16, 212, 168], "float32"], ["TENSOR", [15, 16, 1, 1], "float32"], [1, 1], [0, 0, 0, 0], [1, 1], "float32"], {}], "config": {"index": 1437982, "code_hash": null, "entity": [["tile_co", "sp", [-1, 3, 5]], ["tile_oh", "sp", [-1, 2, 2]], ["tile_ow", "sp", [-1, 12, 7]], ["reorder_0", "re", [0, 1, 2, 3, 4, 5, 6, 7, 8, 9]], ["ann_reduce", "an", ["none", "unroll"]], ["ann_spatial", "an", ["unroll", "unroll", "unroll"]]]}, "result": [[0.05011220000000001], 0, 127.8405020236969, 1630374517.6415672], "version": 0.2, "tvm_version": "0.8.dev0"}
{"input": ["opencl -keys=mali,opencl,gpu -device=mali -max_num_threads=256 -thread_warp_size=1", "conv2d_nchw_spatial_pack.mali", [["TENSOR", [1, 16, 212, 168], "float32"], ["TENSOR", [15, 16, 1, 1], "float32"], [1, 1], [0, 0, 0, 0], [1, 1], "float32"], {}], "config": {"index": 1489922, "code_hash": null, "entity": [["tile_co", "sp", [-1, 1, 15]], ["tile_oh", "sp", [-1, 1, 1]], ["tile_ow", "sp", [-1, 2, 2]], ["reorder_0", "re", [0, 1, 2, 3, 4, 5, 6, 7, 8, 9]], ["ann_reduce", "an", ["unroll", "unroll"]], ["ann_spatial", "an", ["unroll", "unroll", "unroll"]]]}, "result": [[0.12285706680000001], 0, 137.87673926353455, 1630374527.725021], "version": 0.2, "tvm_version": "0.8.dev0"}
{"input": ["opencl -keys=mali,opencl,gpu -device=mali -max_num_threads=256 -thread_warp_size=1", "conv2d_nchw_spatial_pack.mali", [["TENSOR", [1, 16, 212, 168], "float32"], ["TENSOR", [15, 16, 1, 1], "float32"], [1, 1], [0, 0, 0, 0], [1, 1], "float32"], {}], "config": {"index": 1472966, "code_hash": null, "entity": [["tile_co", "sp", [-1, 1, 15]], ["tile_oh", "sp", [-1, 1, 2]], ["tile_ow", "sp", [-1, 3, 1]], ["reorder_0", "re", [0, 1, 2, 3, 4, 5, 6, 9, 7, 8]], ["ann_reduce", "an", ["unroll", "none"]], ["ann_spatial", "an", ["unroll", "unroll", "unroll"]]]}, "result": [[0.017725866700000002], 0, 146.80243158340454, 1630374536.656375], "version": 0.2, "tvm_version": "0.8.dev0"}
{"input": ["opencl -keys=mali,opencl,gpu -device=mali -max_num_threads=256 -thread_warp_size=1", "conv2d_nchw_spatial_pack.mali", [["TENSOR", [1, 16, 212, 168], "float32"], ["TENSOR", [15, 16, 1, 1], "float32"], [1, 1], [0, 0, 0, 0], [1, 1], "float32"], {}], "config": {"index": 1437819, "code_hash": null, "entity": [["tile_co", "sp", [-1, 1, 5]], ["tile_oh", "sp", [-1, 2, 2]], ["tile_ow", "sp", [-1, 8, 7]], ["reorder_0", "re", [0, 1, 2, 3, 4, 5, 6, 7, 8, 9]], ["ann_reduce", "an", ["none", "unroll"]], ["ann_spatial", "an", ["unroll", "unroll", "unroll"]]]}, "result": [[0.0512428], 0, 8.885325193405151, 1630374546.0010157], "version": 0.2, "tvm_version": "0.8.dev0"}
{"input": ["opencl -keys=mali,opencl,gpu -device=mali -max_num_threads=256 -thread_warp_size=1", "conv2d_nchw_spatial_pack.mali", [["TENSOR", [1, 16, 212, 168], "float32"], ["TENSOR", [15, 16, 1, 1], "float32"], [1, 1], [0, 0, 0, 0], [1, 1], "float32"], {}], "config": {"index": 1283264, "code_hash": null, "entity": [["tile_co", "sp", [-1, 1, 15]], ["tile_oh", "sp", [-1, 1, 2]], ["tile_ow", "sp", [-1, 2, 1]], ["reorder_0", "re", [0, 1, 2, 3, 4, 5, 6, 7, 8, 9]], ["ann_reduce", "an", ["none", "none"]], ["ann_spatial", "an", ["unroll", "unroll", "none"]]]}, "result": [[0.0337808666], 0, 17.248830556869507, 1630374554.404645], "version": 0.2, "tvm_version": "0.8.dev0"}
{"input": ["opencl -keys=mali,opencl,gpu -device=mali -max_num_threads=256 -thread_warp_size=1", "conv2d_nchw_spatial_pack.mali", [["TENSOR", [1, 16, 212, 168], "float32"], ["TENSOR", [15, 16, 1, 1], "float32"], [1, 1], [0, 0, 0, 0], [1, 1], "float32"], {}], "config": {"index": 1321180, "code_hash": null, "entity": [["tile_co", "sp", [-1, 3, 5]], ["tile_oh", "sp", [-1, 2, 2]], ["tile_ow", "sp", [-1, 8, 7]], ["reorder_0", "re", [0, 1, 2, 3, 4, 5, 6, 7, 8, 9]], ["ann_reduce", "an", ["none", "unroll"]], ["ann_spatial", "an", ["unroll", "unroll", "none"]]]}, "result": [[0.020271916625], 0, 26.629626512527466, 1630374563.7981913], "version": 0.2, "tvm_version": "0.8.dev0"}
{"input": ["opencl -keys=mali,opencl,gpu -device=mali -max_num_threads=256 -thread_warp_size=1", "conv2d_nchw_spatial_pack.mali", [["TENSOR", [1, 16, 212, 168], "float32"], ["TENSOR", [15, 16, 1, 1], "float32"], [1, 1], [0, 0, 0, 0], [1, 1], "float32"], {}], "config": {"index": 1370744, "code_hash": null, "entity": [["tile_co", "sp", [-1, 1, 15]], ["tile_oh", "sp", [-1, 1, 2]], ["tile_ow", "sp", [-1, 2, 1]], ["reorder_0", "re", [0, 1, 2, 3, 4, 5, 6, 7, 8, 9]], ["ann_reduce", "an", ["unroll", "unroll"]], ["ann_spatial", "an", ["unroll", "unroll", "none"]]]}, "result": [[0.0326008], 0, 35.10926127433777, 1630374572.3055334], "version": 0.2, "tvm_version": "0.8.dev0"}
{"input": ["opencl -keys=mali,opencl,gpu -device=mali -max_num_threads=256 -thread_warp_size=1", "conv2d_nchw_spatial_pack.mali", [["TENSOR", [1, 16, 212, 168], "float32"], ["TENSOR", [15, 16, 1, 1], "float32"], [1, 1], [0, 0, 0, 0], [1, 1], "float32"], {}], "config": {"index": 1402442, "code_hash": null, "entity": [["tile_co", "sp", [-1, 1, 15]], ["tile_oh", "sp", [-1, 1, 1]], ["tile_ow", "sp", [-1, 2, 2]], ["reorder_0", "re", [0, 1, 2, 3, 4, 5, 6, 7, 8, 9]], ["ann_reduce", "an", ["none", "none"]], ["ann_spatial", "an", ["unroll", "unroll", "unroll"]]]}, "result": [[0.0965596], 0, 44.907631635665894, 1630374582.0957131], "version": 0.2, "tvm_version": "0.8.dev0"}
{"input": ["opencl -keys=mali,opencl,gpu -device=mali -max_num_threads=256 -thread_warp_size=1", "conv2d_nchw_spatial_pack.mali", [["TENSOR", [1, 16, 212, 168], "float32"], ["TENSOR", [15, 16, 1, 1], "float32"], [1, 1], [0, 0, 0, 0], [1, 1], "float32"], {}], "config": {"index": 1321990, "code_hash": null, "entity": [["tile_co", "sp", [-1, 3, 5]], ["tile_oh", "sp", [-1, 2, 2]], ["tile_ow", "sp", [-1, 7, 8]], ["reorder_0", "re", [0, 1, 2, 3, 4, 5, 6, 7, 8, 9]], ["ann_reduce", "an", ["none", "unroll"]], ["ann_spatial", "an", ["unroll", "unroll", "none"]]]}, "result": [[0.013591490176470588], 0, 54.466110944747925, 1630374591.6864889], "version": 0.2, "tvm_version": "0.8.dev0"}
{"input": ["opencl -keys=mali,opencl,gpu -device=mali -max_num_threads=256 -thread_warp_size=1", "conv2d_nchw_spatial_pack.mali", [["TENSOR", [1, 16, 212, 168], "float32"], ["TENSOR", [15, 16, 1, 1], "float32"], [1, 1], [0, 0, 0, 0], [1, 1], "float32"], {}], "config": {"index": 1408822, "code_hash": null, "entity": [["tile_co", "sp", [-1, 3, 5]], ["tile_oh", "sp", [-1, 2, 2]], ["tile_ow", "sp", [-1, 12, 7]], ["reorder_0", "re", [0, 1, 2, 3, 4, 5, 6, 7, 8, 9]], ["ann_reduce", "an", ["none", "none"]], ["ann_spatial", "an", ["unroll", "unroll", "unroll"]]]}, "result": [[0.008154140368421053], 0, 63.545100927352905, 1630374600.7560773], "version": 0.2, "tvm_version": "0.8.dev0"}
{"input": ["opencl -keys=mali,opencl,gpu -device=mali -max_num_threads=256 -thread_warp_size=1", "conv2d_nchw_spatial_pack.mali", [["TENSOR", [1, 16, 212, 168], "float32"], ["TENSOR", [15, 16, 1, 1], "float32"], [1, 1], [0, 0, 0, 0], [1, 1], "float32"], {}], "config": {"index": 1837304, "code_hash": null, "entity": [["tile_co", "sp", [-1, 1, 15]], ["tile_oh", "sp", [-1, 1, 2]], ["tile_ow", "sp", [-1, 2, 1]], ["reorder_0", "re", [0, 1, 2, 3, 4, 5, 6, 7, 8, 9]], ["ann_reduce", "an", ["unroll", "unroll"]], ["ann_spatial", "an", ["unroll", "vec", "unroll"]]]}, "result": [[0.017515611166666667], 0, 72.83576393127441, 1630374610.0994463], "version": 0.2, "tvm_version": "0.8.dev0"}
{"input": ["opencl -keys=mali,opencl,gpu -device=mali -max_num_threads=256 -thread_warp_size=1", "conv2d_nchw_spatial_pack.mali", [["TENSOR", [1, 16, 212, 168], "float32"], ["TENSOR", [15, 16, 1, 1], "float32"], [1, 1], [0, 0, 0, 0], [1, 1], "float32"], {}], "config": {"index": 2231126, "code_hash": null, "entity": [["tile_co", "sp", [-1, 1, 15]], ["tile_oh", "sp", [-1, 1, 2]], ["tile_ow", "sp", [-1, 3, 1]], ["reorder_0", "re", [0, 1, 2, 3, 4, 5, 6, 9, 7, 8]], ["ann_reduce", "an", ["none", "none"]], ["ann_spatial", "an", ["vec", "unroll", "unroll"]]]}, "result": [[0.016432099999999998], 0, 81.65533018112183, 1630374618.9313245], "version": 0.2, "tvm_version": "0.8.dev0"}
{"input": ["opencl -keys=mali,opencl,gpu -device=mali -max_num_threads=256 -thread_warp_size=1", "conv2d_nchw_spatial_pack.mali", [["TENSOR", [1, 16, 212, 168], "float32"], ["TENSOR", [15, 16, 1, 1], "float32"], [1, 1], [0, 0, 0, 0], [1, 1], "float32"], {}], "config": {"index": 1437334, "code_hash": null, "entity": [["tile_co", "sp", [-1, 3, 5]], ["tile_oh", "sp", [-1, 2, 2]], ["tile_ow", "sp", [-1, 3, 7]], ["reorder_0", "re", [0, 1, 2, 3, 4, 5, 6, 7, 8, 9]], ["ann_reduce", "an", ["none", "unroll"]], ["ann_spatial", "an", ["unroll", "unroll", "unroll"]]]}, "result": [[0.0486622666], 0, 91.1664776802063, 1630374628.4426007], "version": 0.2, "tvm_version": "0.8.dev0"}
{"input": ["opencl -keys=mali,opencl,gpu -device=mali -max_num_threads=256 -thread_warp_size=1", "conv2d_nchw_spatial_pack.mali", [["TENSOR", [1, 16, 212, 168], "float32"], ["TENSOR", [15, 16, 1, 1], "float32"], [1, 1], [0, 0, 0, 0], [1, 1], "float32"], {}], "config": {"index": 1437658, "code_hash": null, "entity": [["tile_co", "sp", [-1, 3, 5]], ["tile_oh", "sp", [-1, 2, 2]], ["tile_ow", "sp", [-1, 6, 7]], ["reorder_0", "re", [0, 1, 2, 3, 4, 5, 6, 7, 8, 9]], ["ann_reduce", "an", ["none", "unroll"]], ["ann_spatial", "an", ["unroll", "unroll", "unroll"]]]}, "result": [[0.05245913339999999], 0, 100.43021392822266, 1630374637.7037613], "version": 0.2, "tvm_version": "0.8.dev0"}
{"input": ["opencl -keys=mali,opencl,gpu -device=mali -max_num_threads=256 -thread_warp_size=1", "conv2d_nchw_spatial_pack.mali", [["TENSOR", [1, 16, 212, 168], "float32"], ["TENSOR", [15, 16, 1, 1], "float32"], [1, 1], [0, 0, 0, 0], [1, 1], "float32"], {}], "config": {"index": 408464, "code_hash": null, "entity": [["tile_co", "sp", [-1, 1, 15]], ["tile_oh", "sp", [-1, 1, 2]], ["tile_ow", "sp", [-1, 2, 1]], ["reorder_0", "re", [0, 1, 2, 3, 4, 5, 6, 7, 8, 9]], ["ann_reduce", "an", ["unroll", "none"]], ["ann_spatial", "an", ["none", "unroll", "none"]]]}, "result": [[0.0335021334], 0, 108.80454778671265, 1630374646.137158], "version": 0.2, "tvm_version": "0.8.dev0"}
{"input": ["opencl -keys=mali,opencl,gpu -device=mali -max_num_threads=256 -thread_warp_size=1", "conv2d_nchw_spatial_pack.mali", [["TENSOR", [1, 16, 212, 168], "float32"], ["TENSOR", [15, 16, 1, 1], "float32"], [1, 1], [0, 0, 0, 0], [1, 1], "float32"], {}], "config": {"index": 495944, "code_hash": null, "entity": [["tile_co", "sp", [-1, 1, 15]], ["tile_oh", "sp", [-1, 1, 2]], ["tile_ow", "sp", [-1, 2, 1]], ["reorder_0", "re", [0, 1, 2, 3, 4, 5, 6, 7, 8, 9]], ["ann_reduce", "an", ["none", "unroll"]], ["ann_spatial", "an", ["none", "unroll", "unroll"]]]}, "result": [[0.0356104], 0, 117.3985104560852, 1630374654.7294805], "version": 0.2, "tvm_version": "0.8.dev0"}
{"input": ["opencl -keys=mali,opencl,gpu -device=mali -max_num_threads=256 -thread_warp_size=1", "conv2d_nchw_spatial_pack.mali", [["TENSOR", [1, 16, 212, 168], "float32"], ["TENSOR", [15, 16, 1, 1], "float32"], [1, 1], [0, 0, 0, 0], [1, 1], "float32"], {}], "config": {"index": 1088710, "code_hash": null, "entity": [["tile_co", "sp", [-1, 3, 5]], ["tile_oh", "sp", [-1, 2, 2]], ["tile_ow", "sp", [-1, 7, 8]], ["reorder_0", "re", [0, 1, 2, 3, 4, 5, 6, 7, 8, 9]], ["ann_reduce", "an", ["none", "unroll"]], ["ann_spatial", "an", ["unroll", "none", "unroll"]]]}, "result": [[0.0835480668], 0, 3.9685590267181396, 1630374687.2951083], "version": 0.2, "tvm_version": "0.8.dev0"}
{"input": ["opencl -keys=mali,opencl,gpu -device=mali -max_num_threads=256 -thread_warp_size=1", "conv2d_nchw_spatial_pack.mali", [["TENSOR", [1, 16, 212, 168], "float32"], ["TENSOR", [15, 16, 1, 1], "float32"], [1, 1], [0, 0, 0, 0], [1, 1], "float32"], {}], "config": {"index": 1496950, "code_hash": null, "entity": [["tile_co", "sp", [-1, 3, 5]], ["tile_oh", "sp", [-1, 2, 2]], ["tile_ow", "sp", [-1, 7, 8]], ["reorder_0", "re", [0, 1, 2, 3, 4, 5, 6, 7, 8, 9]], ["ann_reduce", "an", ["unroll", "unroll"]], ["ann_spatial", "an", ["unroll", "unroll", "unroll"]]]}, "result": [[0.0433838], 0, 13.363699913024902, 1630374696.700752], "version": 0.2, "tvm_version": "0.8.dev0"}
{"input": ["opencl -keys=mali,opencl,gpu -device=mali -max_num_threads=256 -thread_warp_size=1", "conv2d_nchw_spatial_pack.mali", [["TENSOR", [1, 16, 212, 168], "float32"], ["TENSOR", [15, 16, 1, 1], "float32"], [1, 1], [0, 0, 0, 0], [1, 1], "float32"], {}], "config": {"index": 1437847, "code_hash": null, "entity": [["tile_co", "sp", [-1, 3, 5]], ["tile_oh", "sp", [-1, 1, 4]], ["tile_ow", "sp", [-1, 8, 7]], ["reorder_0", "re", [0, 1, 2, 3, 4, 5, 6, 7, 8, 9]], ["ann_reduce", "an", ["none", "unroll"]], ["ann_spatial", "an", ["unroll", "unroll", "unroll"]]]}, "result": [[0.0073249841428571424], 0, 23.383256435394287, 1630374706.7228932], "version": 0.2, "tvm_version": "0.8.dev0"}
{"input": ["opencl -keys=mali,opencl,gpu -device=mali -max_num_threads=256 -thread_warp_size=1", "conv2d_nchw_spatial_pack.mali", [["TENSOR", [1, 16, 212, 168], "float32"], ["TENSOR", [15, 16, 1, 1], "float32"], [1, 1], [0, 0, 0, 0], [1, 1], "float32"], {}], "config": {"index": 1420999, "code_hash": null, "entity": [["tile_co", "sp", [-1, 3, 5]], ["tile_oh", "sp", [-1, 1, 4]], ["tile_ow", "sp", [-1, 14, 4]], ["reorder_0", "re", [0, 1, 2, 3, 4, 5, 6, 9, 7, 8]], ["ann_reduce", "an", ["none", "none"]], ["ann_spatial", "an", ["unroll", "unroll", "unroll"]]]}, "result": [[0.0436950666], 0, 32.528035402297974, 1630374715.9078274], "version": 0.2, "tvm_version": "0.8.dev0"}
{"input": ["opencl -keys=mali,opencl,gpu -device=mali -max_num_threads=256 -thread_warp_size=1", "conv2d_nchw_spatial_pack.mali", [["TENSOR", [1, 16, 212, 168], "float32"], ["TENSOR", [15, 16, 1, 1], "float32"], [1, 1], [0, 0, 0, 0], [1, 1], "float32"], {}], "config": {"index": 1438657, "code_hash": null, "entity": [["tile_co", "sp", [-1, 3, 5]], ["tile_oh", "sp", [-1, 1, 4]], ["tile_ow", "sp", [-1, 7, 8]], ["reorder_0", "re", [0, 1, 2, 3, 4, 5, 6, 7, 8, 9]], ["ann_reduce", "an", ["none", "unroll"]], ["ann_spatial", "an", ["unroll", "unroll", "unroll"]]]}, "result": [[0.007420765407407408], 0, 43.283496141433716, 1630374726.6692595], "version": 0.2, "tvm_version": "0.8.dev0"}
{"input": ["opencl -keys=mali,opencl,gpu -device=mali -max_num_threads=256 -thread_warp_size=1", "conv2d_nchw_spatial_pack.mali", [["TENSOR", [1, 16, 212, 168], "float32"], ["TENSOR", [15, 16, 1, 1], "float32"], [1, 1], [0, 0, 0, 0], [1, 1], "float32"], {}], "config": {"index": 2266639, "code_hash": null, "entity": [["tile_co", "sp", [-1, 3, 5]], ["tile_oh", "sp", [-1, 1, 4]], ["tile_ow", "sp", [-1, 14, 4]], ["reorder_0", "re", [0, 1, 2, 3, 4, 5, 6, 9, 7, 8]], ["ann_reduce", "an", ["none", "unroll"]], ["ann_spatial", "an", ["vec", "unroll", "unroll"]]]}, "result": [[0.0435622], 0, 51.626272439956665, 1630374735.0587795], "version": 0.2, "tvm_version": "0.8.dev0"}
{"input": ["opencl -keys=mali,opencl,gpu -device=mali -max_num_threads=256 -thread_warp_size=1", "conv2d_nchw_spatial_pack.mali", [["TENSOR", [1, 16, 212, 168], "float32"], ["TENSOR", [15, 16, 1, 1], "float32"], [1, 1], [0, 0, 0, 0], [1, 1], "float32"], {}], "config": {"index": 1292830, "code_hash": null, "entity": [["tile_co", "sp", [-1, 3, 5]], ["tile_oh", "sp", [-1, 2, 2]], ["tile_ow", "sp", [-1, 7, 8]], ["reorder_0", "re", [0, 1, 2, 3, 4, 5, 6, 7, 8, 9]], ["ann_reduce", "an", ["none", "none"]], ["ann_spatial", "an", ["unroll", "unroll", "none"]]]}, "result": [[0.08337340000000001], 0, 61.20473074913025, 1630374744.6686532], "version": 0.2, "tvm_version": "0.8.dev0"}
{"input": ["opencl -keys=mali,opencl,gpu -device=mali -max_num_threads=256 -thread_warp_size=1", "conv2d_nchw_spatial_pack.mali", [["TENSOR", [1, 16, 212, 168], "float32"], ["TENSOR", [15, 16, 1, 1], "float32"], [1, 1], [0, 0, 0, 0], [1, 1], "float32"], {}], "config": {"index": 1085659, "code_hash": null, "entity": [["tile_co", "sp", [-1, 3, 5]], ["tile_oh", "sp", [-1, 1, 4]], ["tile_ow", "sp", [-1, 14, 4]], ["reorder_0", "re", [0, 1, 2, 3, 4, 5, 6, 7, 8, 9]], ["ann_reduce", "an", ["none", "unroll"]], ["ann_spatial", "an", ["unroll", "none", "unroll"]]]}, "result": [[0.0829522], 0, 70.76015424728394, 1630374754.2526762], "version": 0.2, "tvm_version": "0.8.dev0"}
{"input": ["opencl -keys=mali,opencl,gpu -device=mali -max_num_threads=256 -thread_warp_size=1", "conv2d_nchw_spatial_pack.mali", [["TENSOR", [1, 16, 212, 168], "float32"], ["TENSOR", [15, 16, 1, 1], "float32"], [1, 1], [0, 0, 0, 0], [1, 1], "float32"], {}], "config": {"index": 517039, "code_hash": null, "entity": [["tile_co", "sp", [-1, 3, 5]], ["tile_oh", "sp", [-1, 1, 4]], ["tile_ow", "sp", [-1, 14, 4]], ["reorder_0", "re", [0, 1, 2, 3, 4, 5, 6, 9, 7, 8]], ["ann_reduce", "an", ["none", "unroll"]], ["ann_spatial", "an", ["none", "unroll", "unroll"]]]}, "result": [[0.01362], 0, 79.59332084655762, 1630374763.1023126], "version": 0.2, "tvm_version": "0.8.dev0"}
{"input": ["opencl -keys=mali,opencl,gpu -device=mali -max_num_threads=256 -thread_warp_size=1", "conv2d_nchw_spatial_pack.mali", [["TENSOR", [1, 16, 212, 168], "float32"], ["TENSOR", [15, 16, 1, 1], "float32"], [1, 1], [0, 0, 0, 0], [1, 1], "float32"], {}], "config": {"index": 1439278, "code_hash": null, "entity": [["tile_co", "sp", [-1, 3, 5]], ["tile_oh", "sp", [-1, 2, 2]], ["tile_ow", "sp", [-1, 7, 12]], ["reorder_0", "re", [0, 1, 2, 3, 4, 5, 6, 7, 8, 9]], ["ann_reduce", "an", ["none", "unroll"]], ["ann_spatial", "an", ["unroll", "unroll", "unroll"]]]}, "result": [[0.00737965625], 0, 89.77258396148682, 1630374773.2848115], "version": 0.2, "tvm_version": "0.8.dev0"}
{"input": ["opencl -keys=mali,opencl,gpu -device=mali -max_num_threads=256 -thread_warp_size=1", "conv2d_nchw_spatial_pack.mali", [["TENSOR", [1, 16, 212, 168], "float32"], ["TENSOR", [15, 16, 1, 1], "float32"], [1, 1], [0, 0, 0, 0], [1, 1], "float32"], {}], "config": {"index": 1435579, "code_hash": null, "entity": [["tile_co", "sp", [-1, 3, 5]], ["tile_oh", "sp", [-1, 1, 4]], ["tile_ow", "sp", [-1, 14, 4]], ["reorder_0", "re", [0, 1, 2, 3, 4, 5, 6, 7, 8, 9]], ["ann_reduce", "an", ["none", "unroll"]], ["ann_spatial", "an", ["unroll", "unroll", "unroll"]]]}, "result": [[0.007430904761904762], 0, 98.75907158851624, 1630374782.3209202], "version": 0.2, "tvm_version": "0.8.dev0"}
{"input": ["opencl -keys=mali,opencl,gpu -device=mali -max_num_threads=256 -thread_warp_size=1", "conv2d_nchw_spatial_pack.mali", [["TENSOR", [1, 16, 212, 168], "float32"], ["TENSOR", [15, 16, 1, 1], "float32"], [1, 1], [0, 0, 0, 0], [1, 1], "float32"], {}], "config": {"index": 1450159, "code_hash": null, "entity": [["tile_co", "sp", [-1, 3, 5]], ["tile_oh", "sp", [-1, 1, 4]], ["tile_ow", "sp", [-1, 14, 4]], ["reorder_0", "re", [0, 1, 2, 3, 4, 5, 6, 9, 7, 8]], ["ann_reduce", "an", ["none", "unroll"]], ["ann_spatial", "an", ["unroll", "unroll", "unroll"]]]}, "result": [[0.007549111095238095], 0, 107.84704732894897, 1630374791.4309921], "version": 0.2, "tvm_version": "0.8.dev0"}
{"input": ["opencl -keys=mali,opencl,gpu -device=mali -max_num_threads=256 -thread_warp_size=1", "conv2d_nchw_spatial_pack.mali", [["TENSOR", [1, 16, 212, 168], "float32"], ["TENSOR", [15, 16, 1, 1], "float32"], [1, 1], [0, 0, 0, 0], [1, 1], "float32"], {}], "config": {"index": 1508479, "code_hash": null, "entity": [["tile_co", "sp", [-1, 3, 5]], ["tile_oh", "sp", [-1, 1, 4]], ["tile_ow", "sp", [-1, 14, 4]], ["reorder_0", "re", [0, 1, 2, 3, 4, 5, 6, 9, 7, 8]], ["ann_reduce", "an", ["unroll", "unroll"]], ["ann_spatial", "an", ["unroll", "unroll", "unroll"]]]}, "result": [[0.0436169334], 0, 116.9874095916748, 1630374800.6096668], "version": 0.2, "tvm_version": "0.8.dev0"}
{"input": ["opencl -keys=mali,opencl,gpu -device=mali -max_num_threads=256 -thread_warp_size=1", "conv2d_nchw_spatial_pack.mali", [["TENSOR", [1, 16, 212, 168], "float32"], ["TENSOR", [15, 16, 1, 1], "float32"], [1, 1], [0, 0, 0, 0], [1, 1], "float32"], {}], "config": {"index": 1785499, "code_hash": null, "entity": [["tile_co", "sp", [-1, 3, 5]], ["tile_oh", "sp", [-1, 1, 4]], ["tile_ow", "sp", [-1, 14, 4]], ["reorder_0", "re", [0, 1, 2, 3, 4, 5, 6, 7, 8, 9]], ["ann_reduce", "an", ["none", "unroll"]], ["ann_spatial", "an", ["unroll", "vec", "unroll"]]]}, "result": [[0.0425294], 0, 126.08647680282593, 1630374809.7396004], "version": 0.2, "tvm_version": "0.8.dev0"}
{"input": ["opencl -keys=mali,opencl,gpu -device=mali -max_num_threads=256 -thread_warp_size=1", "conv2d_nchw_spatial_pack.mali", [["TENSOR", [1, 16, 212, 168], "float32"], ["TENSOR", [15, 16, 1, 1], "float32"], [1, 1], [0, 0, 0, 0], [1, 1], "float32"], {}], "config": {"index": 1788550, "code_hash": null, "entity": [["tile_co", "sp", [-1, 3, 5]], ["tile_oh", "sp", [-1, 2, 2]], ["tile_ow", "sp", [-1, 7, 8]], ["reorder_0", "re", [0, 1, 2, 3, 4, 5, 6, 7, 8, 9]], ["ann_reduce", "an", ["none", "unroll"]], ["ann_spatial", "an", ["unroll", "vec", "unroll"]]]}, "result": [[0.0431967334], 0, 135.36392426490784, 1630374819.0452766], "version": 0.2, "tvm_version": "0.8.dev0"}
{"input": ["opencl -keys=mali,opencl,gpu -device=mali -max_num_threads=256 -thread_warp_size=1", "conv2d_nchw_spatial_pack.mali", [["TENSOR", [1, 16, 212, 168], "float32"], ["TENSOR", [15, 16, 1, 1], "float32"], [1, 1], [0, 0, 0, 0], [1, 1], "float32"], {}], "config": {"index": 1087927, "code_hash": null, "entity": [["tile_co", "sp", [-1, 3, 5]], ["tile_oh", "sp", [-1, 1, 4]], ["tile_ow", "sp", [-1, 8, 7]], ["reorder_0", "re", [0, 1, 2, 3, 4, 5, 6, 7, 8, 9]], ["ann_reduce", "an", ["none", "unroll"]], ["ann_spatial", "an", ["unroll", "none", "unroll"]]]}, "result": [[0.0721306], 0, 144.84394073486328, 1630374828.5496826], "version": 0.2, "tvm_version": "0.8.dev0"}
{"input": ["opencl -keys=mali,opencl,gpu -device=mali -max_num_threads=256 -thread_warp_size=1", "conv2d_nchw_spatial_pack.mali", [["TENSOR", [1, 16, 212, 168], "float32"], ["TENSOR", [15, 16, 1, 1], "float32"], [1, 1], [0, 0, 0, 0], [1, 1], "float32"], {}], "config": {"index": 1493899, "code_hash": null, "entity": [["tile_co", "sp", [-1, 3, 5]], ["tile_oh", "sp", [-1, 1, 4]], ["tile_ow", "sp", [-1, 14, 4]], ["reorder_0", "re", [0, 1, 2, 3, 4, 5, 6, 7, 8, 9]], ["ann_reduce", "an", ["unroll", "unroll"]], ["ann_spatial", "an", ["unroll", "unroll", "unroll"]]]}, "result": [[0.007257857142857142], 0, 18.356586456298828, 1630374847.5251236], "version": 0.2, "tvm_version": "0.8.dev0"}
{"input": ["opencl -keys=mali,opencl,gpu -device=mali -max_num_threads=256 -thread_warp_size=1", "conv2d_nchw_spatial_pack.mali", [["TENSOR", [1, 16, 212, 168], "float32"], ["TENSOR", [15, 16, 1, 1], "float32"], [1, 1], [0, 0, 0, 0], [1, 1], "float32"], {}], "config": {"index": 1770919, "code_hash": null, "entity": [["tile_co", "sp", [-1, 3, 5]], ["tile_oh", "sp", [-1, 1, 4]], ["tile_ow", "sp", [-1, 14, 4]], ["reorder_0", "re", [0, 1, 2, 3, 4, 5, 6, 9, 7, 8]], ["ann_reduce", "an", ["none", "none"]], ["ann_spatial", "an", ["unroll", "vec", "unroll"]]]}, "result": [[0.0438875334], 0, 27.497496843338013, 1630374856.7390265], "version": 0.2, "tvm_version": "0.8.dev0"}
{"input": ["opencl -keys=mali,opencl,gpu -device=mali -max_num_threads=256 -thread_warp_size=1", "conv2d_nchw_spatial_pack.mali", [["TENSOR", [1, 16, 212, 168], "float32"], ["TENSOR", [15, 16, 1, 1], "float32"], [1, 1], [0, 0, 0, 0], [1, 1], "float32"], {}], "config": {"index": 1406419, "code_hash": null, "entity": [["tile_co", "sp", [-1, 3, 5]], ["tile_oh", "sp", [-1, 1, 4]], ["tile_ow", "sp", [-1, 14, 4]], ["reorder_0", "re", [0, 1, 2, 3, 4, 5, 6, 7, 8, 9]], ["ann_reduce", "an", ["none", "none"]], ["ann_spatial", "an", ["unroll", "unroll", "unroll"]]]}, "result": [[0.007201166636363637], 0, 36.557130336761475, 1630374865.8279555], "version": 0.2, "tvm_version": "0.8.dev0"}
{"input": ["opencl -keys=mali,opencl,gpu -device=mali -max_num_threads=256 -thread_warp_size=1", "conv2d_nchw_spatial_pack.mali", [["TENSOR", [1, 16, 212, 168], "float32"], ["TENSOR", [15, 16, 1, 1], "float32"], [1, 1], [0, 0, 0, 0], [1, 1], "float32"], {}], "config": {"index": 1088737, "code_hash": null, "entity": [["tile_co", "sp", [-1, 3, 5]], ["tile_oh", "sp", [-1, 1, 4]], ["tile_ow", "sp", [-1, 7, 8]], ["reorder_0", "re", [0, 1, 2, 3, 4, 5, 6, 7, 8, 9]], ["ann_reduce", "an", ["none", "unroll"]], ["ann_spatial", "an", ["unroll", "none", "unroll"]]]}, "result": [[0.0793648], 0, 46.35017251968384, 1630374875.6487494], "version": 0.2, "tvm_version": "0.8.dev0"}
{"input": ["opencl -keys=mali,opencl,gpu -device=mali -max_num_threads=256 -thread_warp_size=1", "conv2d_nchw_spatial_pack.mali", [["TENSOR", [1, 16, 212, 168], "float32"], ["TENSOR", [15, 16, 1, 1], "float32"], [1, 1], [0, 0, 0, 0], [1, 1], "float32"], {}], "config": {"index": 1496167, "code_hash": null, "entity": [["tile_co", "sp", [-1, 3, 5]], ["tile_oh", "sp", [-1, 1, 4]], ["tile_ow", "sp", [-1, 8, 7]], ["reorder_0", "re", [0, 1, 2, 3, 4, 5, 6, 7, 8, 9]], ["ann_reduce", "an", ["unroll", "unroll"]], ["ann_spatial", "an", ["unroll", "unroll", "unroll"]]]}, "result": [[0.007841388900000001], 0, 56.69854211807251, 1630374886.0978892], "version": 0.2, "tvm_version": "0.8.dev0"}
{"input": ["opencl -keys=mali,opencl,gpu -device=mali -max_num_threads=256 -thread_warp_size=1", "conv2d_nchw_spatial_pack.mali", [["TENSOR", [1, 16, 212, 168], "float32"], ["TENSOR", [15, 16, 1, 1], "float32"], [1, 1], [0, 0, 0, 0], [1, 1], "float32"], {}], "config": {"index": 972070, "code_hash": null, "entity": [["tile_co", "sp", [-1, 3, 5]], ["tile_oh", "sp", [-1, 2, 2]], ["tile_ow", "sp", [-1, 7, 8]], ["reorder_0", "re", [0, 1, 2, 3, 4, 5, 6, 7, 8, 9]], ["ann_reduce", "an", ["none", "unroll"]], ["ann_spatial", "an", ["unroll", "none", "none"]]]}, "result": [[0.0426046], 0, 65.61871480941772, 1630374895.0704563], "version": 0.2, "tvm_version": "0.8.dev0"}
{"input": ["opencl -keys=mali,opencl,gpu -device=mali -max_num_threads=256 -thread_warp_size=1", "conv2d_nchw_spatial_pack.mali", [["TENSOR", [1, 16, 212, 168], "float32"], ["TENSOR", [15, 16, 1, 1], "float32"], [1, 1], [0, 0, 0, 0], [1, 1], "float32"], {}], "config": {"index": 1496977, "code_hash": null, "entity": [["tile_co", "sp", [-1, 3, 5]], ["tile_oh", "sp", [-1, 1, 4]], ["tile_ow", "sp", [-1, 7, 8]], ["reorder_0", "re", [0, 1, 2, 3, 4, 5, 6, 7, 8, 9]], ["ann_reduce", "an", ["unroll", "unroll"]], ["ann_spatial", "an", ["unroll", "unroll", "unroll"]]]}, "result": [[0.0075278888571428575], 0, 76.5656087398529, 1630374906.003337], "version": 0.2, "tvm_version": "0.8.dev0"}
{"input": ["opencl -keys=mali,opencl,gpu -device=mali -max_num_threads=256 -thread_warp_size=1", "conv2d_nchw_spatial_pack.mali", [["TENSOR", [1, 16, 212, 168], "float32"], ["TENSOR", [15, 16, 1, 1], "float32"], [1, 1], [0, 0, 0, 0], [1, 1], "float32"], {}], "config": {"index": 1479319, "code_hash": null, "entity": [["tile_co", "sp", [-1, 3, 5]], ["tile_oh", "sp", [-1, 1, 4]], ["tile_ow", "sp", [-1, 14, 4]], ["reorder_0", "re", [0, 1, 2, 3, 4, 5, 6, 9, 7, 8]], ["ann_reduce", "an", ["unroll", "none"]], ["ann_spatial", "an", ["unroll", "unroll", "unroll"]]]}, "result": [[0.0437336], 0, 6.663416147232056, 1630374914.4573884], "version": 0.2, "tvm_version": "0.8.dev0"}
{"input": ["opencl -keys=mali,opencl,gpu -device=mali -max_num_threads=256 -thread_warp_size=1", "conv2d_nchw_spatial_pack.mali", [["TENSOR", [1, 16, 212, 168], "float32"], ["TENSOR", [15, 16, 1, 1], "float32"], [1, 1], [0, 0, 0, 0], [1, 1], "float32"], {}], "config": {"index": 517040, "code_hash": null, "entity": [["tile_co", "sp", [-1, 1, 15]], ["tile_oh", "sp", [-1, 1, 4]], ["tile_ow", "sp", [-1, 14, 4]], ["reorder_0", "re", [0, 1, 2, 3, 4, 5, 6, 9, 7, 8]], ["ann_reduce", "an", ["none", "unroll"]], ["ann_spatial", "an", ["none", "unroll", "unroll"]]]}, "result": [[0.069774], 0, 18.01432728767395, 1630374925.8544126], "version": 0.2, "tvm_version": "0.8.dev0"}
{"input": ["opencl -keys=mali,opencl,gpu -device=mali -max_num_threads=256 -thread_warp_size=1", "conv2d_nchw_spatial_pack.mali", [["TENSOR", [1, 16, 212, 168], "float32"], ["TENSOR", [15, 16, 1, 1], "float32"], [1, 1], [0, 0, 0, 0], [1, 1], "float32"], {}], "config": {"index": 1089358, "code_hash": null, "entity": [["tile_co", "sp", [-1, 3, 5]], ["tile_oh", "sp", [-1, 2, 2]], ["tile_ow", "sp", [-1, 7, 12]], ["reorder_0", "re", [0, 1, 2, 3, 4, 5, 6, 7, 8, 9]], ["ann_reduce", "an", ["none", "unroll"]], ["ann_spatial", "an", ["unroll", "none", "unroll"]]]}, "result": [[0.03476313339999999], 0, 25.750035285949707, 1630374933.6094177], "version": 0.2, "tvm_version": "0.8.dev0"}
{"input": ["opencl -keys=mali,opencl,gpu -device=mali -max_num_threads=256 -thread_warp_size=1", "conv2d_nchw_spatial_pack.mali", [["TENSOR", [1, 16, 212, 168], "float32"], ["TENSOR", [15, 16, 1, 1], "float32"], [1, 1], [0, 0, 0, 0], [1, 1], "float32"], {}], "config": {"index": 1071079, "code_hash": null, "entity": [["tile_co", "sp", [-1, 3, 5]], ["tile_oh", "sp", [-1, 1, 4]], ["tile_ow", "sp", [-1, 14, 4]], ["reorder_0", "re", [0, 1, 2, 3, 4, 5, 6, 9, 7, 8]], ["ann_reduce", "an", ["none", "none"]], ["ann_spatial", "an", ["unroll", "none", "unroll"]]]}, "result": [[0.08764406659999999], 0, 45.37246108055115, 1630374953.304586], "version": 0.2, "tvm_version": "0.8.dev0"}
{"input": ["opencl -keys=mali,opencl,gpu -device=mali -max_num_threads=256 -thread_warp_size=1", "conv2d_nchw_spatial_pack.mali", [["TENSOR", [1, 16, 212, 168], "float32"], ["TENSOR", [15, 16, 1, 1], "float32"], [1, 1], [0, 0, 0, 0], [1, 1], "float32"], {}], "config": {"index": 1293478, "code_hash": null, "entity": [["tile_co", "sp", [-1, 3, 5]], ["tile_oh", "sp", [-1, 2, 2]], ["tile_ow", "sp", [-1, 7, 12]], ["reorder_0", "re", [0, 1, 2, 3, 4, 5, 6, 7, 8, 9]], ["ann_reduce", "an", ["none", "none"]], ["ann_spatial", "an", ["unroll", "unroll", "none"]]]}, "result": [[0.0764579334], 0, 65.39925122261047, 1630374973.3772166], "version": 0.2, "tvm_version": "0.8.dev0"}
{"input": ["opencl -keys=mali,opencl,gpu -device=mali -max_num_threads=256 -thread_warp_size=1", "conv2d_nchw_spatial_pack.mali", [["TENSOR", [1, 16, 212, 168], "float32"], ["TENSOR", [15, 16, 1, 1], "float32"], [1, 1], [0, 0, 0, 0], [1, 1], "float32"], {}], "config": {"index": 1321207, "code_hash": null, "entity": [["tile_co", "sp", [-1, 3, 5]], ["tile_oh", "sp", [-1, 1, 4]], ["tile_ow", "sp", [-1, 8, 7]], ["reorder_0", "re", [0, 1, 2, 3, 4, 5, 6, 7, 8, 9]], ["ann_reduce", "an", ["none", "unroll"]], ["ann_spatial", "an", ["unroll", "unroll", "none"]]]}, "result": [[0.013613472166666668], 0, 75.09865236282349, 1630374983.1012037], "version": 0.2, "tvm_version": "0.8.dev0"}
{"input": ["opencl -keys=mali,opencl,gpu -device=mali -max_num_threads=256 -thread_warp_size=1", "conv2d_nchw_spatial_pack.mali", [["TENSOR", [1, 16, 212, 168], "float32"], ["TENSOR", [15, 16, 1, 1], "float32"], [1, 1], [0, 0, 0, 0], [1, 1], "float32"], {}], "config": {"index": 1829239, "code_hash": null, "entity": [["tile_co", "sp", [-1, 3, 5]], ["tile_oh", "sp", [-1, 1, 4]], ["tile_ow", "sp", [-1, 14, 4]], ["reorder_0", "re", [0, 1, 2, 3, 4, 5, 6, 9, 7, 8]], ["ann_reduce", "an", ["unroll", "none"]], ["ann_spatial", "an", ["unroll", "vec", "unroll"]]]}, "result": [[0.0439923332], 0, 84.49669480323792, 1630374992.519762], "version": 0.2, "tvm_version": "0.8.dev0"}
{"input": ["opencl -keys=mali,opencl,gpu -device=mali -max_num_threads=256 -thread_warp_size=1", "conv2d_nchw_spatial_pack.mali", [["TENSOR", [1, 16, 212, 168], "float32"], ["TENSOR", [15, 16, 1, 1], "float32"], [1, 1], [0, 0, 0, 0], [1, 1], "float32"], {}], "config": {"index": 1322017, "code_hash": null, "entity": [["tile_co", "sp", [-1, 3, 5]], ["tile_oh", "sp", [-1, 1, 4]], ["tile_ow", "sp", [-1, 7, 8]], ["reorder_0", "re", [0, 1, 2, 3, 4, 5, 6, 7, 8, 9]], ["ann_reduce", "an", ["none", "unroll"]], ["ann_spatial", "an", ["unroll", "unroll", "none"]]]}, "result": [[0.07864733339999999], 0, 104.81926155090332, 1630375012.9064474], "version": 0.2, "tvm_version": "0.8.dev0"}
{"input": ["opencl -keys=mali,opencl,gpu -device=mali -max_num_threads=256 -thread_warp_size=1", "conv2d_nchw_spatial_pack.mali", [["TENSOR", [1, 16, 212, 168], "float32"], ["TENSOR", [15, 16, 1, 1], "float32"], [1, 1], [0, 0, 0, 0], [1, 1], "float32"], {}], "config": {"index": 1438631, "code_hash": null, "entity": [["tile_co", "sp", [-1, 1, 15]], ["tile_oh", "sp", [-1, 2, 2]], ["tile_ow", "sp", [-1, 7, 8]], ["reorder_0", "re", [0, 1, 2, 3, 4, 5, 6, 7, 8, 9]], ["ann_reduce", "an", ["none", "unroll"]], ["ann_spatial", "an", ["unroll", "unroll", "unroll"]]]}, "result": [[0.0648706666], 0, 120.36661076545715, 1630375028.426077], "version": 0.2, "tvm_version": "0.8.dev0"}
{"input": ["opencl -keys=mali,opencl,gpu -device=mali -max_num_threads=256 -thread_warp_size=1", "conv2d_nchw_spatial_pack.mali", [["TENSOR", [1, 16, 212, 168], "float32"], ["TENSOR", [15, 16, 1, 1], "float32"], [1, 1], [0, 0, 0, 0], [1, 1], "float32"], {}], "config": {"index": 2268907, "code_hash": null, "entity": [["tile_co", "sp", [-1, 3, 5]], ["tile_oh", "sp", [-1, 1, 4]], ["tile_ow", "sp", [-1, 8, 7]], ["reorder_0", "re", [0, 1, 2, 3, 4, 5, 6, 9, 7, 8]], ["ann_reduce", "an", ["none", "unroll"]], ["ann_spatial", "an", ["vec", "unroll", "unroll"]]]}, "result": [[0.04346073339999999], 0, 4.800898551940918, 1630375033.8433094], "version": 0.2, "tvm_version": "0.8.dev0"}
