example_04/auto_tvm_log/v9h-model-01-NCHW-opencl-C500-T21-09-01-19-46.log.tmp
{"input": ["opencl -keys=mali,opencl,gpu -device=mali -max_num_threads=512 -thread_warp_size=2", "conv2d_nchw_spatial_pack.mali", [["TENSOR", [1, 64, 14, 11], "float32"], ["TENSOR", [4, 64, 1, 1], "float32"], [1, 1], [0, 0, 0, 0], [1, 1], "float32"], {}], "config": {"index": 16139, "code_hash": null, "entity": [["tile_co", "sp", [-1, 1, 4]], ["tile_oh", "sp", [-1, 2, 7]], ["tile_ow", "sp", [-1, 11, 1]], ["reorder_0", "re", [0, 1, 2, 3, 4, 5, 6, 9, 7, 8]], ["ann_reduce", "an", ["none", "unroll"]], ["ann_spatial", "an", ["unroll", "unroll", "unroll"]]]}, "result": [[0.0006532244274809161], 0, 17.716068506240845, 1630496840.5660374], "version": 0.2, "tvm_version": "0.8.dev0"}
{"input": ["opencl -keys=mali,opencl,gpu -device=mali -max_num_threads=512 -thread_warp_size=2", "conv2d_nchw_spatial_pack.mali", [["TENSOR", [1, 64, 14, 11], "float32"], ["TENSOR", [4, 64, 1, 1], "float32"], [1, 1], [0, 0, 0, 0], [1, 1], "float32"], {}], "config": {"index": 15815, "code_hash": null, "entity": [["tile_co", "sp", [-1, 1, 4]], ["tile_oh", "sp", [-1, 2, 7]], ["tile_ow", "sp", [-1, 11, 1]], ["reorder_0", "re", [0, 1, 2, 3, 4, 5, 6, 9, 7, 8]], ["ann_reduce", "an", ["none", "none"]], ["ann_spatial", "an", ["unroll", "unroll", "unroll"]]]}, "result": [[0.0006515125600814665], 0, 26.71506977081299, 1630496849.5792034], "version": 0.2, "tvm_version": "0.8.dev0"}
{"input": ["opencl -keys=mali,opencl,gpu -device=mali -max_num_threads=512 -thread_warp_size=2", "conv2d_nchw_spatial_pack.mali", [["TENSOR", [1, 64, 14, 11], "float32"], ["TENSOR", [4, 64, 1, 1], "float32"], [1, 1], [0, 0, 0, 0], [1, 1], "float32"], {}], "config": {"index": 16145, "code_hash": null, "entity": [["tile_co", "sp", [-1, 1, 4]], ["tile_oh", "sp", [-1, 1, 14]], ["tile_ow", "sp", [-1, 11, 1]], ["reorder_0", "re", [0, 1, 2, 3, 4, 5, 6, 9, 7, 8]], ["ann_reduce", "an", ["none", "unroll"]], ["ann_spatial", "an", ["unroll", "unroll", "unroll"]]]}, "result": [[0.0008593286713286714], 0, 35.541096687316895, 1630496858.4059548], "version": 0.2, "tvm_version": "0.8.dev0"}
{"input": ["opencl -keys=mali,opencl,gpu -device=mali -max_num_threads=512 -thread_warp_size=2", "conv2d_nchw_spatial_pack.mali", [["TENSOR", [1, 64, 14, 11], "float32"], ["TENSOR", [4, 64, 1, 1], "float32"], [1, 1], [0, 0, 0, 0], [1, 1], "float32"], {}], "config": {"index": 15994, "code_hash": null, "entity": [["tile_co", "sp", [-1, 2, 2]], ["tile_oh", "sp", [-1, 2, 1]], ["tile_ow", "sp", [-1, 1, 11]], ["reorder_0", "re", [0, 1, 2, 3, 4, 5, 6, 7, 8, 9]], ["ann_reduce", "an", ["none", "unroll"]], ["ann_spatial", "an", ["unroll", "unroll", "unroll"]]]}, "result": [[0.0007670477766666666], 0, 44.085957050323486, 1630496866.96537], "version": 0.2, "tvm_version": "0.8.dev0"}
{"input": ["opencl -keys=mali,opencl,gpu -device=mali -max_num_threads=512 -thread_warp_size=2", "conv2d_nchw_spatial_pack.mali", [["TENSOR", [1, 64, 14, 11], "float32"], ["TENSOR", [4, 64, 1, 1], "float32"], [1, 1], [0, 0, 0, 0], [1, 1], "float32"], {}], "config": {"index": 16144, "code_hash": null, "entity": [["tile_co", "sp", [-1, 2, 2]], ["tile_oh", "sp", [-1, 1, 14]], ["tile_ow", "sp", [-1, 11, 1]], ["reorder_0", "re", [0, 1, 2, 3, 4, 5, 6, 9, 7, 8]], ["ann_reduce", "an", ["none", "unroll"]], ["ann_spatial", "an", ["unroll", "unroll", "unroll"]]]}, "result": [[0.0008231247014388489], 0, 52.91319274902344, 1630496875.7896597], "version": 0.2, "tvm_version": "0.8.dev0"}
{"input": ["opencl -keys=mali,opencl,gpu -device=mali -max_num_threads=512 -thread_warp_size=2", "conv2d_nchw_spatial_pack.mali", [["TENSOR", [1, 64, 14, 11], "float32"], ["TENSOR", [4, 64, 1, 1], "float32"], [1, 1], [0, 0, 0, 0], [1, 1], "float32"], {}], "config": {"index": 15821, "code_hash": null, "entity": [["tile_co", "sp", [-1, 1, 4]], ["tile_oh", "sp", [-1, 1, 14]], ["tile_ow", "sp", [-1, 11, 1]], ["reorder_0", "re", [0, 1, 2, 3, 4, 5, 6, 9, 7, 8]], ["ann_reduce", "an", ["none", "none"]], ["ann_spatial", "an", ["unroll", "unroll", "unroll"]]]}, "result": [[0.000852326164874552], 0, 61.85378289222717, 1630496884.758261], "version": 0.2, "tvm_version": "0.8.dev0"}
{"input": ["opencl -keys=mali,opencl,gpu -device=mali -max_num_threads=512 -thread_warp_size=2", "conv2d_nchw_spatial_pack.mali", [["TENSOR", [1, 64, 14, 11], "float32"], ["TENSOR", [4, 64, 1, 1], "float32"], [1, 1], [0, 0, 0, 0], [1, 1], "float32"], {}], "config": {"index": 5771, "code_hash": null, "entity": [["tile_co", "sp", [-1, 1, 4]], ["tile_oh", "sp", [-1, 2, 7]], ["tile_ow", "sp", [-1, 11, 1]], ["reorder_0", "re", [0, 1, 2, 3, 4, 5, 6, 9, 7, 8]], ["ann_reduce", "an", ["none", "unroll"]], ["ann_spatial", "an", ["none", "unroll", "unroll"]]]}, "result": [[0.0006335484505813953], 0, 70.94249248504639, 1630496893.8625755], "version": 0.2, "tvm_version": "0.8.dev0"}
{"input": ["opencl -keys=mali,opencl,gpu -device=mali -max_num_threads=512 -thread_warp_size=2", "conv2d_nchw_spatial_pack.mali", [["TENSOR", [1, 64, 14, 11], "float32"], ["TENSOR", [4, 64, 1, 1], "float32"], [1, 1], [0, 0, 0, 0], [1, 1], "float32"], {}], "config": {"index": 16787, "code_hash": null, "entity": [["tile_co", "sp", [-1, 1, 4]], ["tile_oh", "sp", [-1, 2, 7]], ["tile_ow", "sp", [-1, 11, 1]], ["reorder_0", "re", [0, 1, 2, 3, 4, 5, 6, 9, 7, 8]], ["ann_reduce", "an", ["unroll", "unroll"]], ["ann_spatial", "an", ["unroll", "unroll", "unroll"]]]}, "result": [[0.0008083049627659575], 0, 79.33602142333984, 1630496902.252554], "version": 0.2, "tvm_version": "0.8.dev0"}
{"input": ["opencl -keys=mali,opencl,gpu -device=mali -max_num_threads=512 -thread_warp_size=2", "conv2d_nchw_spatial_pack.mali", [["TENSOR", [1, 64, 14, 11], "float32"], ["TENSOR", [4, 64, 1, 1], "float32"], [1, 1], [0, 0, 0, 0], [1, 1], "float32"], {}], "config": {"index": 15670, "code_hash": null, "entity": [["tile_co", "sp", [-1, 2, 2]], ["tile_oh", "sp", [-1, 2, 1]], ["tile_ow", "sp", [-1, 1, 11]], ["reorder_0", "re", [0, 1, 2, 3, 4, 5, 6, 7, 8, 9]], ["ann_reduce", "an", ["none", "none"]], ["ann_spatial", "an", ["unroll", "unroll", "unroll"]]]}, "result": [[0.0005843544433333334], 0, 88.13407111167908, 1630496911.0601938], "version": 0.2, "tvm_version": "0.8.dev0"}
{"input": ["opencl -keys=mali,opencl,gpu -device=mali -max_num_threads=512 -thread_warp_size=2", "conv2d_nchw_spatial_pack.mali", [["TENSOR", [1, 64, 14, 11], "float32"], ["TENSOR", [4, 64, 1, 1], "float32"], [1, 1], [0, 0, 0, 0], [1, 1], "float32"], {}], "config": {"index": 15820, "code_hash": null, "entity": [["tile_co", "sp", [-1, 2, 2]], ["tile_oh", "sp", [-1, 1, 14]], ["tile_ow", "sp", [-1, 11, 1]], ["reorder_0", "re", [0, 1, 2, 3, 4, 5, 6, 9, 7, 8]], ["ann_reduce", "an", ["none", "none"]], ["ann_spatial", "an", ["unroll", "unroll", "unroll"]]]}, "result": [[0.0007178044770318021], 0, 96.87313437461853, 1630496919.8142076], "version": 0.2, "tvm_version": "0.8.dev0"}
{"input": ["opencl -keys=mali,opencl,gpu -device=mali -max_num_threads=512 -thread_warp_size=2", "conv2d_nchw_spatial_pack.mali", [["TENSOR", [1, 64, 14, 11], "float32"], ["TENSOR", [4, 64, 1, 1], "float32"], [1, 1], [0, 0, 0, 0], [1, 1], "float32"], {}], "config": {"index": 16642, "code_hash": null, "entity": [["tile_co", "sp", [-1, 2, 2]], ["tile_oh", "sp", [-1, 2, 1]], ["tile_ow", "sp", [-1, 1, 11]], ["reorder_0", "re", [0, 1, 2, 3, 4, 5, 6, 7, 8, 9]], ["ann_reduce", "an", ["unroll", "unroll"]], ["ann_spatial", "an", ["unroll", "unroll", "unroll"]]]}, "result": [[0.0005648540976430975], 0, 105.4650571346283, 1630496928.4273508], "version": 0.2, "tvm_version": "0.8.dev0"}
{"input": ["opencl -keys=mali,opencl,gpu -device=mali -max_num_threads=512 -thread_warp_size=2", "conv2d_nchw_spatial_pack.mali", [["TENSOR", [1, 64, 14, 11], "float32"], ["TENSOR", [4, 64, 1, 1], "float32"], [1, 1], [0, 0, 0, 0], [1, 1], "float32"], {}], "config": {"index": 5785, "code_hash": null, "entity": [["tile_co", "sp", [-1, 2, 1]], ["tile_oh", "sp", [-1, 2, 1]], ["tile_ow", "sp", [-1, 1, 11]], ["reorder_0", "re", [0, 1, 2, 3, 4, 5, 6, 9, 7, 8]], ["ann_reduce", "an", ["none", "unroll"]], ["ann_spatial", "an", ["none", "unroll", "unroll"]]]}, "result": [[0.001054205223880597], 0, 114.44405150413513, 1630496937.420136], "version": 0.2, "tvm_version": "0.8.dev0"}
{"input": ["opencl -keys=mali,opencl,gpu -device=mali -max_num_threads=512 -thread_warp_size=2", "conv2d_nchw_spatial_pack.mali", [["TENSOR", [1, 64, 14, 11], "float32"], ["TENSOR", [4, 64, 1, 1], "float32"], [1, 1], [0, 0, 0, 0], [1, 1], "float32"], {}], "config": {"index": 19871, "code_hash": null, "entity": [["tile_co", "sp", [-1, 1, 4]], ["tile_oh", "sp", [-1, 1, 14]], ["tile_ow", "sp", [-1, 11, 1]], ["reorder_0", "re", [0, 1, 2, 3, 4, 5, 6, 7, 8, 9]], ["ann_reduce", "an", ["none", "unroll"]], ["ann_spatial", "an", ["unroll", "vec", "unroll"]]]}, "result": [[0.0007638963498233216], 0, 123.33824849128723, 1630496946.328308], "version": 0.2, "tvm_version": "0.8.dev0"}
{"input": ["opencl -keys=mali,opencl,gpu -device=mali -max_num_threads=512 -thread_warp_size=2", "conv2d_nchw_spatial_pack.mali", [["TENSOR", [1, 64, 14, 11], "float32"], ["TENSOR", [4, 64, 1, 1], "float32"], [1, 1], [0, 0, 0, 0], [1, 1], "float32"], {}], "config": {"index": 5447, "code_hash": null, "entity": [["tile_co", "sp", [-1, 1, 4]], ["tile_oh", "sp", [-1, 2, 7]], ["tile_ow", "sp", [-1, 11, 1]], ["reorder_0", "re", [0, 1, 2, 3, 4, 5, 6, 9, 7, 8]], ["ann_reduce", "an", ["none", "none"]], ["ann_spatial", "an", ["none", "unroll", "unroll"]]]}, "result": [[0.0008065627906976744], 0, 132.48215293884277, 1630496955.4859676], "version": 0.2, "tvm_version": "0.8.dev0"}
{"input": ["opencl -keys=mali,opencl,gpu -device=mali -max_num_threads=512 -thread_warp_size=2", "conv2d_nchw_spatial_pack.mali", [["TENSOR", [1, 64, 14, 11], "float32"], ["TENSOR", [4, 64, 1, 1], "float32"], [1, 1], [0, 0, 0, 0], [1, 1], "float32"], {}], "config": {"index": 16463, "code_hash": null, "entity": [["tile_co", "sp", [-1, 1, 4]], ["tile_oh", "sp", [-1, 2, 7]], ["tile_ow", "sp", [-1, 11, 1]], ["reorder_0", "re", [0, 1, 2, 3, 4, 5, 6, 9, 7, 8]], ["ann_reduce", "an", ["unroll", "none"]], ["ann_spatial", "an", ["unroll", "unroll", "unroll"]]]}, "result": [[0.0008042303664921466], 0, 141.00682091712952, 1630496964.0290346], "version": 0.2, "tvm_version": "0.8.dev0"}
{"input": ["opencl -keys=mali,opencl,gpu -device=mali -max_num_threads=512 -thread_warp_size=2", "conv2d_nchw_spatial_pack.mali", [["TENSOR", [1, 64, 14, 11], "float32"], ["TENSOR", [4, 64, 1, 1], "float32"], [1, 1], [0, 0, 0, 0], [1, 1], "float32"], {}], "config": {"index": 15683, "code_hash": null, "entity": [["tile_co", "sp", [-1, 1, 4]], ["tile_oh", "sp", [-1, 14, 1]], ["tile_ow", "sp", [-1, 1, 11]], ["reorder_0", "re", [0, 1, 2, 3, 4, 5, 6, 7, 8, 9]], ["ann_reduce", "an", ["none", "none"]], ["ann_spatial", "an", ["unroll", "unroll", "unroll"]]]}, "result": [[0.0006621396253687316], 0, 149.94384908676147, 1630496972.9728765], "version": 0.2, "tvm_version": "0.8.dev0"}
{"input": ["opencl -keys=mali,opencl,gpu -device=mali -max_num_threads=512 -thread_warp_size=2", "conv2d_nchw_spatial_pack.mali", [["TENSOR", [1, 64, 14, 11], "float32"], ["TENSOR", [4, 64, 1, 1], "float32"], [1, 1], [0, 0, 0, 0], [1, 1], "float32"], {}], "config": {"index": 16793, "code_hash": null, "entity": [["tile_co", "sp", [-1, 1, 4]], ["tile_oh", "sp", [-1, 1, 14]], ["tile_ow", "sp", [-1, 11, 1]], ["reorder_0", "re", [0, 1, 2, 3, 4, 5, 6, 9, 7, 8]], ["ann_reduce", "an", ["unroll", "unroll"]], ["ann_spatial", "an", ["unroll", "unroll", "unroll"]]]}, "result": [[0.000839418416083916], 0, 17.150638818740845, 1630496990.4855285], "version": 0.2, "tvm_version": "0.8.dev0"}
{"input": ["opencl -keys=mali,opencl,gpu -device=mali -max_num_threads=512 -thread_warp_size=2", "conv2d_nchw_spatial_pack.mali", [["TENSOR", [1, 64, 14, 11], "float32"], ["TENSOR", [4, 64, 1, 1], "float32"], [1, 1], [0, 0, 0, 0], [1, 1], "float32"], {}], "config": {"index": 16318, "code_hash": null, "entity": [["tile_co", "sp", [-1, 2, 2]], ["tile_oh", "sp", [-1, 2, 1]], ["tile_ow", "sp", [-1, 1, 11]], ["reorder_0", "re", [0, 1, 2, 3, 4, 5, 6, 7, 8, 9]], ["ann_reduce", "an", ["unroll", "none"]], ["ann_spatial", "an", ["unroll", "unroll", "unroll"]]]}, "result": [[0.0008312333333333334], 0, 25.607959032058716, 1630496998.958708], "version": 0.2, "tvm_version": "0.8.dev0"}
{"input": ["opencl -keys=mali,opencl,gpu -device=mali -max_num_threads=512 -thread_warp_size=2", "conv2d_nchw_spatial_pack.mali", [["TENSOR", [1, 64, 14, 11], "float32"], ["TENSOR", [4, 64, 1, 1], "float32"], [1, 1], [0, 0, 0, 0], [1, 1], "float32"], {}], "config": {"index": 19547, "code_hash": null, "entity": [["tile_co", "sp", [-1, 1, 4]], ["tile_oh", "sp", [-1, 1, 14]], ["tile_ow", "sp", [-1, 11, 1]], ["reorder_0", "re", [0, 1, 2, 3, 4, 5, 6, 7, 8, 9]], ["ann_reduce", "an", ["none", "none"]], ["ann_spatial", "an", ["unroll", "vec", "unroll"]]]}, "result": [[0.0008880022026431719], 0, 35.006356716156006, 1630497008.368905], "version": 0.2, "tvm_version": "0.8.dev0"}
{"input": ["opencl -keys=mali,opencl,gpu -device=mali -max_num_threads=512 -thread_warp_size=2", "conv2d_nchw_spatial_pack.mali", [["TENSOR", [1, 64, 14, 11], "float32"], ["TENSOR", [4, 64, 1, 1], "float32"], [1, 1], [0, 0, 0, 0], [1, 1], "float32"], {}], "config": {"index": 19865, "code_hash": null, "entity": [["tile_co", "sp", [-1, 1, 4]], ["tile_oh", "sp", [-1, 2, 7]], ["tile_ow", "sp", [-1, 11, 1]], ["reorder_0", "re", [0, 1, 2, 3, 4, 5, 6, 7, 8, 9]], ["ann_reduce", "an", ["none", "unroll"]], ["ann_spatial", "an", ["unroll", "vec", "unroll"]]]}, "result": [[0.0008164066335078536], 0, 43.567201375961304, 1630497016.9414296], "version": 0.2, "tvm_version": "0.8.dev0"}
{"input": ["opencl -keys=mali,opencl,gpu -device=mali -max_num_threads=512 -thread_warp_size=2", "conv2d_nchw_spatial_pack.mali", [["TENSOR", [1, 64, 14, 11], "float32"], ["TENSOR", [4, 64, 1, 1], "float32"], [1, 1], [0, 0, 0, 0], [1, 1], "float32"], {}], "config": {"index": 5461, "code_hash": null, "entity": [["tile_co", "sp", [-1, 2, 1]], ["tile_oh", "sp", [-1, 2, 1]], ["tile_ow", "sp", [-1, 1, 11]], ["reorder_0", "re", [0, 1, 2, 3, 4, 5, 6, 9, 7, 8]], ["ann_reduce", "an", ["none", "none"]], ["ann_spatial", "an", ["none", "unroll", "unroll"]]]}, "result": [[0.000799648496855346], 0, 52.362332344055176, 1630497025.7505453], "version": 0.2, "tvm_version": "0.8.dev0"}
{"input": ["opencl -keys=mali,opencl,gpu -device=mali -max_num_threads=512 -thread_warp_size=2", "conv2d_nchw_spatial_pack.mali", [["TENSOR", [1, 64, 14, 11], "float32"], ["TENSOR", [4, 64, 1, 1], "float32"], [1, 1], [0, 0, 0, 0], [1, 1], "float32"], {}], "config": {"index": 6433, "code_hash": null, "entity": [["tile_co", "sp", [-1, 2, 1]], ["tile_oh", "sp", [-1, 2, 1]], ["tile_ow", "sp", [-1, 1, 11]], ["reorder_0", "re", [0, 1, 2, 3, 4, 5, 6, 9, 7, 8]], ["ann_reduce", "an", ["unroll", "unroll"]], ["ann_spatial", "an", ["none", "unroll", "unroll"]]]}, "result": [[0.0009345098058823531], 0, 60.67642664909363, 1630497034.0514934], "version": 0.2, "tvm_version": "0.8.dev0"}
{"input": ["opencl -keys=mali,opencl,gpu -device=mali -max_num_threads=512 -thread_warp_size=2", "conv2d_nchw_spatial_pack.mali", [["TENSOR", [1, 64, 14, 11], "float32"], ["TENSOR", [4, 64, 1, 1], "float32"], [1, 1], [0, 0, 0, 0], [1, 1], "float32"], {}], "config": {"index": 16153, "code_hash": null, "entity": [["tile_co", "sp", [-1, 2, 1]], ["tile_oh", "sp", [-1, 2, 1]], ["tile_ow", "sp", [-1, 1, 11]], ["reorder_0", "re", [0, 1, 2, 3, 4, 5, 6, 9, 7, 8]], ["ann_reduce", "an", ["none", "unroll"]], ["ann_spatial", "an", ["unroll", "unroll", "unroll"]]]}, "result": [[0.0007360415164835164], 0, 69.14023876190186, 1630497042.5458152], "version": 0.2, "tvm_version": "0.8.dev0"}
{"input": ["opencl -keys=mali,opencl,gpu -device=mali -max_num_threads=512 -thread_warp_size=2", "conv2d_nchw_spatial_pack.mali", [["TENSOR", [1, 64, 14, 11], "float32"], ["TENSOR", [4, 64, 1, 1], "float32"], [1, 1], [0, 0, 0, 0], [1, 1], "float32"], {}], "config": {"index": 5776, "code_hash": null, "entity": [["tile_co", "sp", [-1, 2, 2]], ["tile_oh", "sp", [-1, 1, 14]], ["tile_ow", "sp", [-1, 11, 1]], ["reorder_0", "re", [0, 1, 2, 3, 4, 5, 6, 9, 7, 8]], ["ann_reduce", "an", ["none", "unroll"]], ["ann_spatial", "an", ["none", "unroll", "unroll"]]]}, "result": [[0.0006209127823834197], 0, 77.82380032539368, 1630497051.2204058], "version": 0.2, "tvm_version": "0.8.dev0"}
{"input": ["opencl -keys=mali,opencl,gpu -device=mali -max_num_threads=512 -thread_warp_size=2", "conv2d_nchw_spatial_pack.mali", [["TENSOR", [1, 64, 14, 11], "float32"], ["TENSOR", [4, 64, 1, 1], "float32"], [1, 1], [0, 0, 0, 0], [1, 1], "float32"], {}], "config": {"index": 16133, "code_hash": null, "entity": [["tile_co", "sp", [-1, 1, 4]], ["tile_oh", "sp", [-1, 1, 7]], ["tile_ow", "sp", [-1, 11, 1]], ["reorder_0", "re", [0, 1, 2, 3, 4, 5, 6, 9, 7, 8]], ["ann_reduce", "an", ["none", "unroll"]], ["ann_spatial", "an", ["unroll", "unroll", "unroll"]]]}, "result": [[0.0007540928950819672], 0, 86.71313905715942, 1630497060.1327715], "version": 0.2, "tvm_version": "0.8.dev0"}
{"input": ["opencl -keys=mali,opencl,gpu -device=mali -max_num_threads=512 -thread_warp_size=2", "conv2d_nchw_spatial_pack.mali", [["TENSOR", [1, 64, 14, 11], "float32"], ["TENSOR", [4, 64, 1, 1], "float32"], [1, 1], [0, 0, 0, 0], [1, 1], "float32"], {}], "config": {"index": 16792, "code_hash": null, "entity": [["tile_co", "sp", [-1, 2, 2]], ["tile_oh", "sp", [-1, 1, 14]], ["tile_ow", "sp", [-1, 11, 1]], ["reorder_0", "re", [0, 1, 2, 3, 4, 5, 6, 9, 7, 8]], ["ann_reduce", "an", ["unroll", "unroll"]], ["ann_spatial", "an", ["unroll", "unroll", "unroll"]]]}, "result": [[0.0009054880107913669], 0, 95.20596528053284, 1630497068.6452708], "version": 0.2, "tvm_version": "0.8.dev0"}
{"input": ["opencl -keys=mali,opencl,gpu -device=mali -max_num_threads=512 -thread_warp_size=2", "conv2d_nchw_spatial_pack.mali", [["TENSOR", [1, 64, 14, 11], "float32"], ["TENSOR", [4, 64, 1, 1], "float32"], [1, 1], [0, 0, 0, 0], [1, 1], "float32"], {}], "config": {"index": 25225, "code_hash": null, "entity": [["tile_co", "sp", [-1, 2, 1]], ["tile_oh", "sp", [-1, 2, 1]], ["tile_ow", "sp", [-1, 1, 11]], ["reorder_0", "re", [0, 1, 2, 3, 4, 5, 6, 9, 7, 8]], ["ann_reduce", "an", ["none", "unroll"]], ["ann_spatial", "an", ["vec", "unroll", "unroll"]]]}, "result": [[0.0009536803099415204], 0, 103.80539774894714, 1630497077.261209], "version": 0.2, "tvm_version": "0.8.dev0"}
{"input": ["opencl -keys=mali,opencl,gpu -device=mali -max_num_threads=512 -thread_warp_size=2", "conv2d_nchw_spatial_pack.mali", [["TENSOR", [1, 64, 14, 11], "float32"], ["TENSOR", [4, 64, 1, 1], "float32"], [1, 1], [0, 0, 0, 0], [1, 1], "float32"], {}], "config": {"index": 16469, "code_hash": null, "entity": [["tile_co", "sp", [-1, 1, 4]], ["tile_oh", "sp", [-1, 1, 14]], ["tile_ow", "sp", [-1, 11, 1]], ["reorder_0", "re", [0, 1, 2, 3, 4, 5, 6, 9, 7, 8]], ["ann_reduce", "an", ["unroll", "none"]], ["ann_spatial", "an", ["unroll", "unroll", "unroll"]]]}, "result": [[0.000809535925795053], 0, 112.63308668136597, 1630497086.0921907], "version": 0.2, "tvm_version": "0.8.dev0"}
{"input": ["opencl -keys=mali,opencl,gpu -device=mali -max_num_threads=512 -thread_warp_size=2", "conv2d_nchw_spatial_pack.mali", [["TENSOR", [1, 64, 14, 11], "float32"], ["TENSOR", [4, 64, 1, 1], "float32"], [1, 1], [0, 0, 0, 0], [1, 1], "float32"], {}], "config": {"index": 19541, "code_hash": null, "entity": [["tile_co", "sp", [-1, 1, 4]], ["tile_oh", "sp", [-1, 2, 7]], ["tile_ow", "sp", [-1, 11, 1]], ["reorder_0", "re", [0, 1, 2, 3, 4, 5, 6, 7, 8, 9]], ["ann_reduce", "an", ["none", "none"]], ["ann_spatial", "an", ["unroll", "vec", "unroll"]]]}, "result": [[0.0007484967105263158], 0, 121.49486112594604, 1630497094.9765737], "version": 0.2, "tvm_version": "0.8.dev0"}
{"input": ["opencl -keys=mali,opencl,gpu -device=mali -max_num_threads=512 -thread_warp_size=2", "conv2d_nchw_spatial_pack.mali", [["TENSOR", [1, 64, 14, 11], "float32"], ["TENSOR", [4, 64, 1, 1], "float32"], [1, 1], [0, 0, 0, 0], [1, 1], "float32"], {}], "config": {"index": 5780, "code_hash": null, "entity": [["tile_co", "sp", [-1, 4, 1]], ["tile_oh", "sp", [-1, 1, 1]], ["tile_ow", "sp", [-1, 1, 11]], ["reorder_0", "re", [0, 1, 2, 3, 4, 5, 6, 9, 7, 8]], ["ann_reduce", "an", ["none", "unroll"]], ["ann_spatial", "an", ["none", "unroll", "unroll"]]]}, "result": [[0.0008194092052238806], 0, 130.03420495986938, 1630497103.532224], "version": 0.2, "tvm_version": "0.8.dev0"}
{"input": ["opencl -keys=mali,opencl,gpu -device=mali -max_num_threads=512 -thread_warp_size=2", "conv2d_nchw_spatial_pack.mali", [["TENSOR", [1, 64, 14, 11], "float32"], ["TENSOR", [4, 64, 1, 1], "float32"], [1, 1], [0, 0, 0, 0], [1, 1], "float32"], {}], "config": {"index": 6419, "code_hash": null, "entity": [["tile_co", "sp", [-1, 1, 4]], ["tile_oh", "sp", [-1, 2, 7]], ["tile_ow", "sp", [-1, 11, 1]], ["reorder_0", "re", [0, 1, 2, 3, 4, 5, 6, 9, 7, 8]], ["ann_reduce", "an", ["unroll", "unroll"]], ["ann_spatial", "an", ["none", "unroll", "unroll"]]]}, "result": [[0.0011536342592592592], 0, 139.09867334365845, 1630497112.6006985], "version": 0.2, "tvm_version": "0.8.dev0"}
{"input": ["opencl -keys=mali,opencl,gpu -device=mali -max_num_threads=512 -thread_warp_size=2", "conv2d_nchw_spatial_pack.mali", [["TENSOR", [1, 64, 14, 11], "float32"], ["TENSOR", [4, 64, 1, 1], "float32"], [1, 1], [0, 0, 0, 0], [1, 1], "float32"], {}], "config": {"index": 5452, "code_hash": null, "entity": [["tile_co", "sp", [-1, 2, 2]], ["tile_oh", "sp", [-1, 1, 14]], ["tile_ow", "sp", [-1, 11, 1]], ["reorder_0", "re", [0, 1, 2, 3, 4, 5, 6, 9, 7, 8]], ["ann_reduce", "an", ["none", "none"]], ["ann_spatial", "an", ["none", "unroll", "unroll"]]]}, "result": [[0.0012145125628140704], 0, 148.02650713920593, 1630497121.5510845], "version": 0.2, "tvm_version": "0.8.dev0"}
{"input": ["opencl -keys=mali,opencl,gpu -device=mali -max_num_threads=512 -thread_warp_size=2", "conv2d_nchw_spatial_pack.mali", [["TENSOR", [1, 64, 14, 11], "float32"], ["TENSOR", [4, 64, 1, 1], "float32"], [1, 1], [0, 0, 0, 0], [1, 1], "float32"], {}], "config": {"index": 6109, "code_hash": null, "entity": [["tile_co", "sp", [-1, 2, 1]], ["tile_oh", "sp", [-1, 2, 1]], ["tile_ow", "sp", [-1, 1, 11]], ["reorder_0", "re", [0, 1, 2, 3, 4, 5, 6, 9, 7, 8]], ["ann_reduce", "an", ["unroll", "none"]], ["ann_spatial", "an", ["none", "unroll", "unroll"]]]}, "result": [[0.0008087699889298893], 0, 17.393637657165527, 1630497139.31402], "version": 0.2, "tvm_version": "0.8.dev0"}
{"input": ["opencl -keys=mali,opencl,gpu -device=mali -max_num_threads=512 -thread_warp_size=2", "conv2d_nchw_spatial_pack.mali", [["TENSOR", [1, 64, 14, 11], "float32"], ["TENSOR", [4, 64, 1, 1], "float32"], [1, 1], [0, 0, 0, 0], [1, 1], "float32"], {}], "config": {"index": 15809, "code_hash": null, "entity": [["tile_co", "sp", [-1, 1, 4]], ["tile_oh", "sp", [-1, 1, 7]], ["tile_ow", "sp", [-1, 11, 1]], ["reorder_0", "re", [0, 1, 2, 3, 4, 5, 6, 9, 7, 8]], ["ann_reduce", "an", ["none", "none"]], ["ann_spatial", "an", ["unroll", "unroll", "unroll"]]]}, "result": [[0.0006841235850340136], 0, 25.982553243637085, 1630497147.9093242], "version": 0.2, "tvm_version": "0.8.dev0"}
{"input": ["opencl -keys=mali,opencl,gpu -device=mali -max_num_threads=512 -thread_warp_size=2", "conv2d_nchw_spatial_pack.mali", [["TENSOR", [1, 64, 14, 11], "float32"], ["TENSOR", [4, 64, 1, 1], "float32"], [1, 1], [0, 0, 0, 0], [1, 1], "float32"], {}], "config": {"index": 16468, "code_hash": null, "entity": [["tile_co", "sp", [-1, 2, 2]], ["tile_oh", "sp", [-1, 1, 14]], ["tile_ow", "sp", [-1, 11, 1]], ["reorder_0", "re", [0, 1, 2, 3, 4, 5, 6, 9, 7, 8]], ["ann_reduce", "an", ["unroll", "none"]], ["ann_spatial", "an", ["unroll", "unroll", "unroll"]]]}, "result": [[0.0008678060618181818], 0, 34.762707233428955, 1630497156.7058296], "version": 0.2, "tvm_version": "0.8.dev0"}
{"input": ["opencl -keys=mali,opencl,gpu -device=mali -max_num_threads=512 -thread_warp_size=2", "conv2d_nchw_spatial_pack.mali", [["TENSOR", [1, 64, 14, 11], "float32"], ["TENSOR", [4, 64, 1, 1], "float32"], [1, 1], [0, 0, 0, 0], [1, 1], "float32"], {}], "config": {"index": 15829, "code_hash": null, "entity": [["tile_co", "sp", [-1, 2, 1]], ["tile_oh", "sp", [-1, 2, 1]], ["tile_ow", "sp", [-1, 1, 11]], ["reorder_0", "re", [0, 1, 2, 3, 4, 5, 6, 9, 7, 8]], ["ann_reduce", "an", ["none", "none"]], ["ann_spatial", "an", ["unroll", "unroll", "unroll"]]]}, "result": [[0.0007415230125523012], 0, 44.19163250923157, 1630497166.1437392], "version": 0.2, "tvm_version": "0.8.dev0"}
{"input": ["opencl -keys=mali,opencl,gpu -device=mali -max_num_threads=512 -thread_warp_size=2", "conv2d_nchw_spatial_pack.mali", [["TENSOR", [1, 64, 14, 11], "float32"], ["TENSOR", [4, 64, 1, 1], "float32"], [1, 1], [0, 0, 0, 0], [1, 1], "float32"], {}], "config": {"index": 25228, "code_hash": null, "entity": [["tile_co", "sp", [-1, 2, 2]], ["tile_oh", "sp", [-1, 2, 1]], ["tile_ow", "sp", [-1, 1, 11]], ["reorder_0", "re", [0, 1, 2, 3, 4, 5, 6, 9, 7, 8]], ["ann_reduce", "an", ["none", "unroll"]], ["ann_spatial", "an", ["vec", "unroll", "unroll"]]]}, "result": [[0.0008708995815899581], 0, 53.244102001190186, 1630497175.1997626], "version": 0.2, "tvm_version": "0.8.dev0"}
{"input": ["opencl -keys=mali,opencl,gpu -device=mali -max_num_threads=512 -thread_warp_size=2", "conv2d_nchw_spatial_pack.mali", [["TENSOR", [1, 64, 14, 11], "float32"], ["TENSOR", [4, 64, 1, 1], "float32"], [1, 1], [0, 0, 0, 0], [1, 1], "float32"], {}], "config": {"index": 16801, "code_hash": null, "entity": [["tile_co", "sp", [-1, 2, 1]], ["tile_oh", "sp", [-1, 2, 1]], ["tile_ow", "sp", [-1, 1, 11]], ["reorder_0", "re", [0, 1, 2, 3, 4, 5, 6, 9, 7, 8]], ["ann_reduce", "an", ["unroll", "unroll"]], ["ann_spatial", "an", ["unroll", "unroll", "unroll"]]]}, "result": [[0.0006240838908685969], 0, 61.95252561569214, 1630497183.920272], "version": 0.2, "tvm_version": "0.8.dev0"}
{"input": ["opencl -keys=mali,opencl,gpu -device=mali -max_num_threads=512 -thread_warp_size=2", "conv2d_nchw_spatial_pack.mali", [["TENSOR", [1, 64, 14, 11], "float32"], ["TENSOR", [4, 64, 1, 1], "float32"], [1, 1], [0, 0, 0, 0], [1, 1], "float32"], {}], "config": {"index": 24901, "code_hash": null, "entity": [["tile_co", "sp", [-1, 2, 1]], ["tile_oh", "sp", [-1, 2, 1]], ["tile_ow", "sp", [-1, 1, 11]], ["reorder_0", "re", [0, 1, 2, 3, 4, 5, 6, 9, 7, 8]], ["ann_reduce", "an", ["none", "none"]], ["ann_spatial", "an", ["vec", "unroll", "unroll"]]]}, "result": [[0.0010645226863905326], 0, 70.4925148487091, 1630497192.4832468], "version": 0.2, "tvm_version": "0.8.dev0"}
{"input": ["opencl -keys=mali,opencl,gpu -device=mali -max_num_threads=512 -thread_warp_size=2", "conv2d_nchw_spatial_pack.mali", [["TENSOR", [1, 64, 14, 11], "float32"], ["TENSOR", [4, 64, 1, 1], "float32"], [1, 1], [0, 0, 0, 0], [1, 1], "float32"], {}], "config": {"index": 25873, "code_hash": null, "entity": [["tile_co", "sp", [-1, 2, 1]], ["tile_oh", "sp", [-1, 2, 1]], ["tile_ow", "sp", [-1, 1, 11]], ["reorder_0", "re", [0, 1, 2, 3, 4, 5, 6, 9, 7, 8]], ["ann_reduce", "an", ["unroll", "unroll"]], ["ann_spatial", "an", ["vec", "unroll", "unroll"]]]}, "result": [[0.00110150788], 0, 79.50523209571838, 1630497201.5018892], "version": 0.2, "tvm_version": "0.8.dev0"}
{"input": ["opencl -keys=mali,opencl,gpu -device=mali -max_num_threads=512 -thread_warp_size=2", "conv2d_nchw_spatial_pack.mali", [["TENSOR", [1, 64, 14, 11], "float32"], ["TENSOR", [4, 64, 1, 1], "float32"], [1, 1], [0, 0, 0, 0], [1, 1], "float32"], {}], "config": {"index": 20519, "code_hash": null, "entity": [["tile_co", "sp", [-1, 1, 4]], ["tile_oh", "sp", [-1, 1, 14]], ["tile_ow", "sp", [-1, 11, 1]], ["reorder_0", "re", [0, 1, 2, 3, 4, 5, 6, 7, 8, 9]], ["ann_reduce", "an", ["unroll", "unroll"]], ["ann_spatial", "an", ["unroll", "vec", "unroll"]]]}, "result": [[0.000758008658008658], 0, 88.63975524902344, 1630497210.636241], "version": 0.2, "tvm_version": "0.8.dev0"}
{"input": ["opencl -keys=mali,opencl,gpu -device=mali -max_num_threads=512 -thread_warp_size=2", "conv2d_nchw_spatial_pack.mali", [["TENSOR", [1, 64, 14, 11], "float32"], ["TENSOR", [4, 64, 1, 1], "float32"], [1, 1], [0, 0, 0, 0], [1, 1], "float32"], {}], "config": {"index": 6095, "code_hash": null, "entity": [["tile_co", "sp", [-1, 1, 4]], ["tile_oh", "sp", [-1, 2, 7]], ["tile_ow", "sp", [-1, 11, 1]], ["reorder_0", "re", [0, 1, 2, 3, 4, 5, 6, 9, 7, 8]], ["ann_reduce", "an", ["unroll", "none"]], ["ann_spatial", "an", ["none", "unroll", "unroll"]]]}, "result": [[0.0010989189633027522], 0, 97.27687573432922, 1630497219.2813764], "version": 0.2, "tvm_version": "0.8.dev0"}
{"input": ["opencl -keys=mali,opencl,gpu -device=mali -max_num_threads=512 -thread_warp_size=2", "conv2d_nchw_spatial_pack.mali", [["TENSOR", [1, 64, 14, 11], "float32"], ["TENSOR", [4, 64, 1, 1], "float32"], [1, 1], [0, 0, 0, 0], [1, 1], "float32"], {}], "config": {"index": 5456, "code_hash": null, "entity": [["tile_co", "sp", [-1, 4, 1]], ["tile_oh", "sp", [-1, 1, 1]], ["tile_ow", "sp", [-1, 1, 11]], ["reorder_0", "re", [0, 1, 2, 3, 4, 5, 6, 9, 7, 8]], ["ann_reduce", "an", ["none", "none"]], ["ann_spatial", "an", ["none", "unroll", "unroll"]]]}, "result": [[0.000871389690647482], 0, 105.89463591575623, 1630497227.9366157], "version": 0.2, "tvm_version": "0.8.dev0"}
{"input": ["opencl -keys=mali,opencl,gpu -device=mali -max_num_threads=512 -thread_warp_size=2", "conv2d_nchw_spatial_pack.mali", [["TENSOR", [1, 64, 14, 11], "float32"], ["TENSOR", [4, 64, 1, 1], "float32"], [1, 1], [0, 0, 0, 0], [1, 1], "float32"], {}], "config": {"index": 6428, "code_hash": null, "entity": [["tile_co", "sp", [-1, 4, 1]], ["tile_oh", "sp", [-1, 1, 1]], ["tile_ow", "sp", [-1, 1, 11]], ["reorder_0", "re", [0, 1, 2, 3, 4, 5, 6, 9, 7, 8]], ["ann_reduce", "an", ["unroll", "unroll"]], ["ann_spatial", "an", ["none", "unroll", "unroll"]]]}, "result": [[0.0007938548597785978], 0, 114.33403468132019, 1630497236.3700397], "version": 0.2, "tvm_version": "0.8.dev0"}
{"input": ["opencl -keys=mali,opencl,gpu -device=mali -max_num_threads=512 -thread_warp_size=2", "conv2d_nchw_spatial_pack.mali", [["TENSOR", [1, 64, 14, 11], "float32"], ["TENSOR", [4, 64, 1, 1], "float32"], [1, 1], [0, 0, 0, 0], [1, 1], "float32"], {}], "config": {"index": 16331, "code_hash": null, "entity": [["tile_co", "sp", [-1, 1, 4]], ["tile_oh", "sp", [-1, 14, 1]], ["tile_ow", "sp", [-1, 1, 11]], ["reorder_0", "re", [0, 1, 2, 3, 4, 5, 6, 7, 8, 9]], ["ann_reduce", "an", ["unroll", "none"]], ["ann_spatial", "an", ["unroll", "unroll", "unroll"]]]}, "result": [[0.0007375971812688822], 0, 122.99793982505798, 1630497245.0397263], "version": 0.2, "tvm_version": "0.8.dev0"}
{"input": ["opencl -keys=mali,opencl,gpu -device=mali -max_num_threads=512 -thread_warp_size=2", "conv2d_nchw_spatial_pack.mali", [["TENSOR", [1, 64, 14, 11], "float32"], ["TENSOR", [4, 64, 1, 1], "float32"], [1, 1], [0, 0, 0, 0], [1, 1], "float32"], {}], "config": {"index": 16148, "code_hash": null, "entity": [["tile_co", "sp", [-1, 4, 1]], ["tile_oh", "sp", [-1, 1, 1]], ["tile_ow", "sp", [-1, 1, 11]], ["reorder_0", "re", [0, 1, 2, 3, 4, 5, 6, 9, 7, 8]], ["ann_reduce", "an", ["none", "unroll"]], ["ann_spatial", "an", ["unroll", "unroll", "unroll"]]]}, "result": [[0.0008924871775147928], 0, 131.44289135932922, 1630497253.5038276], "version": 0.2, "tvm_version": "0.8.dev0"}
{"input": ["opencl -keys=mali,opencl,gpu -device=mali -max_num_threads=512 -thread_warp_size=2", "conv2d_nchw_spatial_pack.mali", [["TENSOR", [1, 64, 14, 11], "float32"], ["TENSOR", [4, 64, 1, 1], "float32"], [1, 1], [0, 0, 0, 0], [1, 1], "float32"], {}], "config": {"index": 15682, "code_hash": null, "entity": [["tile_co", "sp", [-1, 2, 2]], ["tile_oh", "sp", [-1, 14, 1]], ["tile_ow", "sp", [-1, 1, 11]], ["reorder_0", "re", [0, 1, 2, 3, 4, 5, 6, 7, 8, 9]], ["ann_reduce", "an", ["none", "none"]], ["ann_spatial", "an", ["unroll", "unroll", "unroll"]]]}, "result": [[0.0008217097119205297], 0, 139.8936722278595, 1630497261.986222], "version": 0.2, "tvm_version": "0.8.dev0"}
{"input": ["opencl -keys=mali,opencl,gpu -device=mali -max_num_threads=512 -thread_warp_size=2", "conv2d_nchw_spatial_pack.mali", [["TENSOR", [1, 64, 14, 11], "float32"], ["TENSOR", [4, 64, 1, 1], "float32"], [1, 1], [0, 0, 0, 0], [1, 1], "float32"], {}], "config": {"index": 12106, "code_hash": null, "entity": [["tile_co", "sp", [-1, 2, 2]], ["tile_oh", "sp", [-1, 2, 1]], ["tile_ow", "sp", [-1, 1, 11]], ["reorder_0", "re", [0, 1, 2, 3, 4, 5, 6, 7, 8, 9]], ["ann_reduce", "an", ["none", "unroll"]], ["ann_spatial", "an", ["unroll", "none", "unroll"]]]}, "result": [[0.0011519356984478937], 0, 149.2140874862671, 1630497271.3204322], "version": 0.2, "tvm_version": "0.8.dev0"}
{"input": ["opencl -keys=mali,opencl,gpu -device=mali -max_num_threads=512 -thread_warp_size=2", "conv2d_nchw_spatial_pack.mali", [["TENSOR", [1, 64, 14, 11], "float32"], ["TENSOR", [4, 64, 1, 1], "float32"], [1, 1], [0, 0, 0, 0], [1, 1], "float32"], {}], "config": {"index": 25220, "code_hash": null, "entity": [["tile_co", "sp", [-1, 4, 1]], ["tile_oh", "sp", [-1, 1, 1]], ["tile_ow", "sp", [-1, 1, 11]], ["reorder_0", "re", [0, 1, 2, 3, 4, 5, 6, 9, 7, 8]], ["ann_reduce", "an", ["none", "unroll"]], ["ann_spatial", "an", ["vec", "unroll", "unroll"]]]}, "result": [[0.0006822234157706093], 0, 17.273292779922485, 1630497288.9797945], "version": 0.2, "tvm_version": "0.8.dev0"}
{"input": ["opencl -keys=mali,opencl,gpu -device=mali -max_num_threads=512 -thread_warp_size=2", "conv2d_nchw_spatial_pack.mali", [["TENSOR", [1, 64, 14, 11], "float32"], ["TENSOR", [4, 64, 1, 1], "float32"], [1, 1], [0, 0, 0, 0], [1, 1], "float32"], {}], "config": {"index": 24904, "code_hash": null, "entity": [["tile_co", "sp", [-1, 2, 2]], ["tile_oh", "sp", [-1, 2, 1]], ["tile_ow", "sp", [-1, 1, 11]], ["reorder_0", "re", [0, 1, 2, 3, 4, 5, 6, 9, 7, 8]], ["ann_reduce", "an", ["none", "none"]], ["ann_spatial", "an", ["vec", "unroll", "unroll"]]]}, "result": [[0.0007583500033333333], 0, 26.184476852416992, 1630497297.891643], "version": 0.2, "tvm_version": "0.8.dev0"}
{"input": ["opencl -keys=mali,opencl,gpu -device=mali -max_num_threads=512 -thread_warp_size=2", "conv2d_nchw_spatial_pack.mali", [["TENSOR", [1, 64, 14, 11], "float32"], ["TENSOR", [4, 64, 1, 1], "float32"], [1, 1], [0, 0, 0, 0], [1, 1], "float32"], {}], "config": {"index": 20195, "code_hash": null, "entity": [["tile_co", "sp", [-1, 1, 4]], ["tile_oh", "sp", [-1, 1, 14]], ["tile_ow", "sp", [-1, 11, 1]], ["reorder_0", "re", [0, 1, 2, 3, 4, 5, 6, 7, 8, 9]], ["ann_reduce", "an", ["unroll", "none"]], ["ann_spatial", "an", ["unroll", "vec", "unroll"]]]}, "result": [[0.0008303225243243244], 0, 34.57829570770264, 1630497306.2931907], "version": 0.2, "tvm_version": "0.8.dev0"}
{"input": ["opencl -keys=mali,opencl,gpu -device=mali -max_num_threads=512 -thread_warp_size=2", "conv2d_nchw_spatial_pack.mali", [["TENSOR", [1, 64, 14, 11], "float32"], ["TENSOR", [4, 64, 1, 1], "float32"], [1, 1], [0, 0, 0, 0], [1, 1], "float32"], {}], "config": {"index": 20513, "code_hash": null, "entity": [["tile_co", "sp", [-1, 1, 4]], ["tile_oh", "sp", [-1, 2, 7]], ["tile_ow", "sp", [-1, 11, 1]], ["reorder_0", "re", [0, 1, 2, 3, 4, 5, 6, 7, 8, 9]], ["ann_reduce", "an", ["unroll", "unroll"]], ["ann_spatial", "an", ["unroll", "vec", "unroll"]]]}, "result": [[0.0007985694479166667], 0, 42.94024610519409, 1630497314.6757097], "version": 0.2, "tvm_version": "0.8.dev0"}
{"input": ["opencl -keys=mali,opencl,gpu -device=mali -max_num_threads=512 -thread_warp_size=2", "conv2d_nchw_spatial_pack.mali", [["TENSOR", [1, 64, 14, 11], "float32"], ["TENSOR", [4, 64, 1, 1], "float32"], [1, 1], [0, 0, 0, 0], [1, 1], "float32"], {}], "config": {"index": 16477, "code_hash": null, "entity": [["tile_co", "sp", [-1, 2, 1]], ["tile_oh", "sp", [-1, 2, 1]], ["tile_ow", "sp", [-1, 1, 11]], ["reorder_0", "re", [0, 1, 2, 3, 4, 5, 6, 9, 7, 8]], ["ann_reduce", "an", ["unroll", "none"]], ["ann_spatial", "an", ["unroll", "unroll", "unroll"]]]}, "result": [[0.0006415299319470699], 0, 51.71253442764282, 1630497323.463351], "version": 0.2, "tvm_version": "0.8.dev0"}
{"input": ["opencl -keys=mali,opencl,gpu -device=mali -max_num_threads=512 -thread_warp_size=2", "conv2d_nchw_spatial_pack.mali", [["TENSOR", [1, 64, 14, 11], "float32"], ["TENSOR", [4, 64, 1, 1], "float32"], [1, 1], [0, 0, 0, 0], [1, 1], "float32"], {}], "config": {"index": 25876, "code_hash": null, "entity": [["tile_co", "sp", [-1, 2, 2]], ["tile_oh", "sp", [-1, 2, 1]], ["tile_ow", "sp", [-1, 1, 11]], ["reorder_0", "re", [0, 1, 2, 3, 4, 5, 6, 9, 7, 8]], ["ann_reduce", "an", ["unroll", "unroll"]], ["ann_spatial", "an", ["vec", "unroll", "unroll"]]]}, "result": [[0.00072054111], 0, 60.44580268859863, 1630497332.1972678], "version": 0.2, "tvm_version": "0.8.dev0"}
{"input": ["opencl -keys=mali,opencl,gpu -device=mali -max_num_threads=512 -thread_warp_size=2", "conv2d_nchw_spatial_pack.mali", [["TENSOR", [1, 64, 14, 11], "float32"], ["TENSOR", [4, 64, 1, 1], "float32"], [1, 1], [0, 0, 0, 0], [1, 1], "float32"], {}], "config": {"index": 25549, "code_hash": null, "entity": [["tile_co", "sp", [-1, 2, 1]], ["tile_oh", "sp", [-1, 2, 1]], ["tile_ow", "sp", [-1, 1, 11]], ["reorder_0", "re", [0, 1, 2, 3, 4, 5, 6, 9, 7, 8]], ["ann_reduce", "an", ["unroll", "none"]], ["ann_spatial", "an", ["vec", "unroll", "unroll"]]]}, "result": [[0.0008225496031746033], 0, 69.57010960578918, 1630497341.329995], "version": 0.2, "tvm_version": "0.8.dev0"}
{"input": ["opencl -keys=mali,opencl,gpu -device=mali -max_num_threads=512 -thread_warp_size=2", "conv2d_nchw_spatial_pack.mali", [["TENSOR", [1, 64, 14, 11], "float32"], ["TENSOR", [4, 64, 1, 1], "float32"], [1, 1], [0, 0, 0, 0], [1, 1], "float32"], {}], "config": {"index": 6424, "code_hash": null, "entity": [["tile_co", "sp", [-1, 2, 2]], ["tile_oh", "sp", [-1, 1, 14]], ["tile_ow", "sp", [-1, 11, 1]], ["reorder_0", "re", [0, 1, 2, 3, 4, 5, 6, 9, 7, 8]], ["ann_reduce", "an", ["unroll", "unroll"]], ["ann_spatial", "an", ["none", "unroll", "unroll"]]]}, "result": [[0.0007690241157556271], 0, 78.75433468818665, 1630497350.5371253], "version": 0.2, "tvm_version": "0.8.dev0"}
{"input": ["opencl -keys=mali,opencl,gpu -device=mali -max_num_threads=512 -thread_warp_size=2", "conv2d_nchw_spatial_pack.mali", [["TENSOR", [1, 64, 14, 11], "float32"], ["TENSOR", [4, 64, 1, 1], "float32"], [1, 1], [0, 0, 0, 0], [1, 1], "float32"], {}], "config": {"index": 16781, "code_hash": null, "entity": [["tile_co", "sp", [-1, 1, 4]], ["tile_oh", "sp", [-1, 1, 7]], ["tile_ow", "sp", [-1, 11, 1]], ["reorder_0", "re", [0, 1, 2, 3, 4, 5, 6, 9, 7, 8]], ["ann_reduce", "an", ["unroll", "unroll"]], ["ann_spatial", "an", ["unroll", "unroll", "unroll"]]]}, "result": [[0.0007481388888888889], 0, 87.54955625534058, 1630497359.3316743], "version": 0.2, "tvm_version": "0.8.dev0"}
{"input": ["opencl -keys=mali,opencl,gpu -device=mali -max_num_threads=512 -thread_warp_size=2", "conv2d_nchw_spatial_pack.mali", [["TENSOR", [1, 64, 14, 11], "float32"], ["TENSOR", [4, 64, 1, 1], "float32"], [1, 1], [0, 0, 0, 0], [1, 1], "float32"], {}], "config": {"index": 16007, "code_hash": null, "entity": [["tile_co", "sp", [-1, 1, 4]], ["tile_oh", "sp", [-1, 14, 1]], ["tile_ow", "sp", [-1, 1, 11]], ["reorder_0", "re", [0, 1, 2, 3, 4, 5, 6, 7, 8, 9]], ["ann_reduce", "an", ["none", "unroll"]], ["ann_spatial", "an", ["unroll", "unroll", "unroll"]]]}, "result": [[0.0007458472631578948], 0, 96.19983553886414, 1630497368.0037565], "version": 0.2, "tvm_version": "0.8.dev0"}
{"input": ["opencl -keys=mali,opencl,gpu -device=mali -max_num_threads=512 -thread_warp_size=2", "conv2d_nchw_spatial_pack.mali", [["TENSOR", [1, 64, 14, 11], "float32"], ["TENSOR", [4, 64, 1, 1], "float32"], [1, 1], [0, 0, 0, 0], [1, 1], "float32"], {}], "config": {"index": 15983, "code_hash": null, "entity": [["tile_co", "sp", [-1, 1, 4]], ["tile_oh", "sp", [-1, 1, 14]], ["tile_ow", "sp", [-1, 11, 1]], ["reorder_0", "re", [0, 1, 2, 3, 4, 5, 6, 7, 8, 9]], ["ann_reduce", "an", ["none", "unroll"]], ["ann_spatial", "an", ["unroll", "unroll", "unroll"]]]}, "result": [[0.0006588272655246251], 0, 105.07178115844727, 1630497376.8836071], "version": 0.2, "tvm_version": "0.8.dev0"}
{"input": ["opencl -keys=mali,opencl,gpu -device=mali -max_num_threads=512 -thread_warp_size=2", "conv2d_nchw_spatial_pack.mali", [["TENSOR", [1, 64, 14, 11], "float32"], ["TENSOR", [4, 64, 1, 1], "float32"], [1, 1], [0, 0, 0, 0], [1, 1], "float32"], {}], "config": {"index": 6104, "code_hash": null, "entity": [["tile_co", "sp", [-1, 4, 1]], ["tile_oh", "sp", [-1, 1, 1]], ["tile_ow", "sp", [-1, 1, 11]], ["reorder_0", "re", [0, 1, 2, 3, 4, 5, 6, 9, 7, 8]], ["ann_reduce", "an", ["unroll", "none"]], ["ann_spatial", "an", ["none", "unroll", "unroll"]]]}, "result": [[0.000875385593220339], 0, 113.66398882865906, 1630497385.4947119], "version": 0.2, "tvm_version": "0.8.dev0"}
{"input": ["opencl -keys=mali,opencl,gpu -device=mali -max_num_threads=512 -thread_warp_size=2", "conv2d_nchw_spatial_pack.mali", [["TENSOR", [1, 64, 14, 11], "float32"], ["TENSOR", [4, 64, 1, 1], "float32"], [1, 1], [0, 0, 0, 0], [1, 1], "float32"], {}], "config": {"index": 19870, "code_hash": null, "entity": [["tile_co", "sp", [-1, 2, 2]], ["tile_oh", "sp", [-1, 1, 14]], ["tile_ow", "sp", [-1, 11, 1]], ["reorder_0", "re", [0, 1, 2, 3, 4, 5, 6, 7, 8, 9]], ["ann_reduce", "an", ["none", "unroll"]], ["ann_spatial", "an", ["unroll", "vec", "unroll"]]]}, "result": [[0.0007426158177966101], 0, 122.25211715698242, 1630497394.0990093], "version": 0.2, "tvm_version": "0.8.dev0"}
{"input": ["opencl -keys=mali,opencl,gpu -device=mali -max_num_threads=512 -thread_warp_size=2", "conv2d_nchw_spatial_pack.mali", [["TENSOR", [1, 64, 14, 11], "float32"], ["TENSOR", [4, 64, 1, 1], "float32"], [1, 1], [0, 0, 0, 0], [1, 1], "float32"], {}], "config": {"index": 16812, "code_hash": null, "entity": [["tile_co", "sp", [-1, 1, 1]], ["tile_oh", "sp", [-1, 14, 1]], ["tile_ow", "sp", [-1, 1, 11]], ["reorder_0", "re", [0, 1, 2, 3, 4, 5, 6, 9, 7, 8]], ["ann_reduce", "an", ["unroll", "unroll"]], ["ann_spatial", "an", ["unroll", "unroll", "unroll"]]]}, "result": [[0.0008319986477732794], 0, 130.84211802482605, 1630497402.681397], "version": 0.2, "tvm_version": "0.8.dev0"}
{"input": ["opencl -keys=mali,opencl,gpu -device=mali -max_num_threads=512 -thread_warp_size=2", "conv2d_nchw_spatial_pack.mali", [["TENSOR", [1, 64, 14, 11], "float32"], ["TENSOR", [4, 64, 1, 1], "float32"], [1, 1], [0, 0, 0, 0], [1, 1], "float32"], {}], "config": {"index": 17850, "code_hash": null, "entity": [["tile_co", "sp", [-1, 1, 1]], ["tile_oh", "sp", [-1, 7, 2]], ["tile_ow", "sp", [-1, 1, 1]], ["reorder_0", "re", [0, 1, 2, 3, 4, 5, 6, 7, 8, 9]], ["ann_reduce", "an", ["unroll", "unroll"]], ["ann_spatial", "an", ["unroll", "unroll", "vec"]]]}, "result": [[0.00130530900729927], 0, 139.1794149875641, 1630497411.0374198], "version": 0.2, "tvm_version": "0.8.dev0"}
{"input": ["opencl -keys=mali,opencl,gpu -device=mali -max_num_threads=512 -thread_warp_size=2", "conv2d_nchw_spatial_pack.mali", [["TENSOR", [1, 64, 14, 11], "float32"], ["TENSOR", [4, 64, 1, 1], "float32"], [1, 1], [0, 0, 0, 0], [1, 1], "float32"], {}], "config": {"index": 11584, "code_hash": null, "entity": [["tile_co", "sp", [-1, 2, 2]], ["tile_oh", "sp", [-1, 1, 2]], ["tile_ow", "sp", [-1, 11, 1]], ["reorder_0", "re", [0, 1, 2, 3, 4, 5, 6, 9, 7, 8]], ["ann_reduce", "an", ["unroll", "unroll"]], ["ann_spatial", "an", ["unroll", "none", "none"]]]}, "result": [[0.0012019455359477125], 0, 147.6436710357666, 1630497419.5300705], "version": 0.2, "tvm_version": "0.8.dev0"}
{"input": ["opencl -keys=mali,opencl,gpu -device=mali -max_num_threads=512 -thread_warp_size=2", "conv2d_nchw_spatial_pack.mali", [["TENSOR", [1, 64, 14, 11], "float32"], ["TENSOR", [4, 64, 1, 1], "float32"], [1, 1], [0, 0, 0, 0], [1, 1], "float32"], {}], "config": {"index": 16479, "code_hash": null, "entity": [["tile_co", "sp", [-1, 1, 2]], ["tile_oh", "sp", [-1, 2, 1]], ["tile_ow", "sp", [-1, 1, 11]], ["reorder_0", "re", [0, 1, 2, 3, 4, 5, 6, 9, 7, 8]], ["ann_reduce", "an", ["unroll", "none"]], ["ann_spatial", "an", ["unroll", "unroll", "unroll"]]]}, "result": [[0.0005333621011904761], 0, 11.985097646713257, 1630497436.9899352], "version": 0.2, "tvm_version": "0.8.dev0"}
{"input": ["opencl -keys=mali,opencl,gpu -device=mali -max_num_threads=512 -thread_warp_size=2", "conv2d_nchw_spatial_pack.mali", [["TENSOR", [1, 64, 14, 11], "float32"], ["TENSOR", [4, 64, 1, 1], "float32"], [1, 1], [0, 0, 0, 0], [1, 1], "float32"], {}], "config": {"index": 15845, "code_hash": null, "entity": [["tile_co", "sp", [-1, 1, 4]], ["tile_oh", "sp", [-1, 14, 1]], ["tile_ow", "sp", [-1, 1, 11]], ["reorder_0", "re", [0, 1, 2, 3, 4, 5, 6, 9, 7, 8]], ["ann_reduce", "an", ["none", "none"]], ["ann_spatial", "an", ["unroll", "unroll", "unroll"]]]}, "result": [[0.0007577843750000001], 0, 20.720770120620728, 1630497445.7363365], "version": 0.2, "tvm_version": "0.8.dev0"}
{"input": ["opencl -keys=mali,opencl,gpu -device=mali -max_num_threads=512 -thread_warp_size=2", "conv2d_nchw_spatial_pack.mali", [["TENSOR", [1, 64, 14, 11], "float32"], ["TENSOR", [4, 64, 1, 1], "float32"], [1, 1], [0, 0, 0, 0], [1, 1], "float32"], {}], "config": {"index": 12591, "code_hash": null, "entity": [["tile_co", "sp", [-1, 1, 2]], ["tile_oh", "sp", [-1, 2, 1]], ["tile_ow", "sp", [-1, 1, 11]], ["reorder_0", "re", [0, 1, 2, 3, 4, 5, 6, 9, 7, 8]], ["ann_reduce", "an", ["unroll", "none"]], ["ann_spatial", "an", ["unroll", "none", "unroll"]]]}, "result": [[0.0010582581106194692], 0, 29.127885580062866, 1630497454.1548388], "version": 0.2, "tvm_version": "0.8.dev0"}
{"input": ["opencl -keys=mali,opencl,gpu -device=mali -max_num_threads=512 -thread_warp_size=2", "conv2d_nchw_spatial_pack.mali", [["TENSOR", [1, 64, 14, 11], "float32"], ["TENSOR", [4, 64, 1, 1], "float32"], [1, 1], [0, 0, 0, 0], [1, 1], "float32"], {}], "config": {"index": 15183, "code_hash": null, "entity": [["tile_co", "sp", [-1, 1, 2]], ["tile_oh", "sp", [-1, 2, 1]], ["tile_ow", "sp", [-1, 1, 11]], ["reorder_0", "re", [0, 1, 2, 3, 4, 5, 6, 9, 7, 8]], ["ann_reduce", "an", ["unroll", "none"]], ["ann_spatial", "an", ["unroll", "unroll", "none"]]]}, "result": [[0.0007104172227171492], 0, 38.182756662368774, 1630497463.2250557], "version": 0.2, "tvm_version": "0.8.dev0"}
{"input": ["opencl -keys=mali,opencl,gpu -device=mali -max_num_threads=512 -thread_warp_size=2", "conv2d_nchw_spatial_pack.mali", [["TENSOR", [1, 64, 14, 11], "float32"], ["TENSOR", [4, 64, 1, 1], "float32"], [1, 1], [0, 0, 0, 0], [1, 1], "float32"], {}], "config": {"index": 16325, "code_hash": null, "entity": [["tile_co", "sp", [-1, 1, 4]], ["tile_oh", "sp", [-1, 7, 1]], ["tile_ow", "sp", [-1, 1, 11]], ["reorder_0", "re", [0, 1, 2, 3, 4, 5, 6, 7, 8, 9]], ["ann_reduce", "an", ["unroll", "none"]], ["ann_spatial", "an", ["unroll", "unroll", "unroll"]]]}, "result": [[0.0007206022515337424], 0, 46.86048245429993, 1630497471.9041553], "version": 0.2, "tvm_version": "0.8.dev0"}
{"input": ["opencl -keys=mali,opencl,gpu -device=mali -max_num_threads=512 -thread_warp_size=2", "conv2d_nchw_spatial_pack.mali", [["TENSOR", [1, 64, 14, 11], "float32"], ["TENSOR", [4, 64, 1, 1], "float32"], [1, 1], [0, 0, 0, 0], [1, 1], "float32"], {}], "config": {"index": 11957, "code_hash": null, "entity": [["tile_co", "sp", [-1, 1, 4]], ["tile_oh", "sp", [-1, 14, 1]], ["tile_ow", "sp", [-1, 1, 11]], ["reorder_0", "re", [0, 1, 2, 3, 4, 5, 6, 9, 7, 8]], ["ann_reduce", "an", ["none", "none"]], ["ann_spatial", "an", ["unroll", "none", "unroll"]]]}, "result": [[0.0007116030194174758], 0, 55.71186661720276, 1630497480.7823954], "version": 0.2, "tvm_version": "0.8.dev0"}
{"input": ["opencl -keys=mali,opencl,gpu -device=mali -max_num_threads=512 -thread_warp_size=2", "conv2d_nchw_spatial_pack.mali", [["TENSOR", [1, 64, 14, 11], "float32"], ["TENSOR", [4, 64, 1, 1], "float32"], [1, 1], [0, 0, 0, 0], [1, 1], "float32"], {}], "config": {"index": 11295, "code_hash": null, "entity": [["tile_co", "sp", [-1, 1, 2]], ["tile_oh", "sp", [-1, 2, 1]], ["tile_ow", "sp", [-1, 1, 11]], ["reorder_0", "re", [0, 1, 2, 3, 4, 5, 6, 9, 7, 8]], ["ann_reduce", "an", ["unroll", "none"]], ["ann_spatial", "an", ["unroll", "none", "none"]]]}, "result": [[0.001005553067264574], 0, 71.29496788978577, 1630497496.355341], "version": 0.2, "tvm_version": "0.8.dev0"}
{"input": ["opencl -keys=mali,opencl,gpu -device=mali -max_num_threads=512 -thread_warp_size=2", "conv2d_nchw_spatial_pack.mali", [["TENSOR", [1, 64, 14, 11], "float32"], ["TENSOR", [4, 64, 1, 1], "float32"], [1, 1], [0, 0, 0, 0], [1, 1], "float32"], {}], "config": {"index": 16485, "code_hash": null, "entity": [["tile_co", "sp", [-1, 1, 2]], ["tile_oh", "sp", [-1, 7, 1]], ["tile_ow", "sp", [-1, 1, 11]], ["reorder_0", "re", [0, 1, 2, 3, 4, 5, 6, 9, 7, 8]], ["ann_reduce", "an", ["unroll", "none"]], ["ann_spatial", "an", ["unroll", "unroll", "unroll"]]]}, "result": [[0.0007957385947368422], 0, 80.43690729141235, 1630497505.4996793], "version": 0.2, "tvm_version": "0.8.dev0"}
{"input": ["opencl -keys=mali,opencl,gpu -device=mali -max_num_threads=512 -thread_warp_size=2", "conv2d_nchw_spatial_pack.mali", [["TENSOR", [1, 64, 14, 11], "float32"], ["TENSOR", [4, 64, 1, 1], "float32"], [1, 1], [0, 0, 0, 0], [1, 1], "float32"], {}], "config": {"index": 16480, "code_hash": null, "entity": [["tile_co", "sp", [-1, 2, 2]], ["tile_oh", "sp", [-1, 2, 1]], ["tile_ow", "sp", [-1, 1, 11]], ["reorder_0", "re", [0, 1, 2, 3, 4, 5, 6, 9, 7, 8]], ["ann_reduce", "an", ["unroll", "none"]], ["ann_spatial", "an", ["unroll", "unroll", "unroll"]]]}, "result": [[0.0007707534159836066], 0, 89.56059670448303, 1630497514.6642616], "version": 0.2, "tvm_version": "0.8.dev0"}
{"input": ["opencl -keys=mali,opencl,gpu -device=mali -max_num_threads=512 -thread_warp_size=2", "conv2d_nchw_spatial_pack.mali", [["TENSOR", [1, 64, 14, 11], "float32"], ["TENSOR", [4, 64, 1, 1], "float32"], [1, 1], [0, 0, 0, 0], [1, 1], "float32"], {}], "config": {"index": 5957, "code_hash": null, "entity": [["tile_co", "sp", [-1, 1, 4]], ["tile_oh", "sp", [-1, 7, 1]], ["tile_ow", "sp", [-1, 1, 11]], ["reorder_0", "re", [0, 1, 2, 3, 4, 5, 6, 7, 8, 9]], ["ann_reduce", "an", ["unroll", "none"]], ["ann_spatial", "an", ["none", "unroll", "unroll"]]]}, "result": [[0.0007530857621359223], 0, 98.60697150230408, 1630497523.7136002], "version": 0.2, "tvm_version": "0.8.dev0"}
{"input": ["opencl -keys=mali,opencl,gpu -device=mali -max_num_threads=512 -thread_warp_size=2", "conv2d_nchw_spatial_pack.mali", [["TENSOR", [1, 64, 14, 11], "float32"], ["TENSOR", [4, 64, 1, 1], "float32"], [1, 1], [0, 0, 0, 0], [1, 1], "float32"], {}], "config": {"index": 11927, "code_hash": null, "entity": [["tile_co", "sp", [-1, 1, 4]], ["tile_oh", "sp", [-1, 2, 7]], ["tile_ow", "sp", [-1, 11, 1]], ["reorder_0", "re", [0, 1, 2, 3, 4, 5, 6, 9, 7, 8]], ["ann_reduce", "an", ["none", "none"]], ["ann_spatial", "an", ["unroll", "none", "unroll"]]]}, "result": [[0.0005812269736842106], 0, 107.56056547164917, 1630497532.6945474], "version": 0.2, "tvm_version": "0.8.dev0"}
{"input": ["opencl -keys=mali,opencl,gpu -device=mali -max_num_threads=512 -thread_warp_size=2", "conv2d_nchw_spatial_pack.mali", [["TENSOR", [1, 64, 14, 11], "float32"], ["TENSOR", [4, 64, 1, 1], "float32"], [1, 1], [0, 0, 0, 0], [1, 1], "float32"], {}], "config": {"index": 14549, "code_hash": null, "entity": [["tile_co", "sp", [-1, 1, 4]], ["tile_oh", "sp", [-1, 14, 1]], ["tile_ow", "sp", [-1, 1, 11]], ["reorder_0", "re", [0, 1, 2, 3, 4, 5, 6, 9, 7, 8]], ["ann_reduce", "an", ["none", "none"]], ["ann_spatial", "an", ["unroll", "unroll", "none"]]]}, "result": [[0.0007632566581469649], 0, 116.57687401771545, 1630497541.7177677], "version": 0.2, "tvm_version": "0.8.dev0"}
{"input": ["opencl -keys=mali,opencl,gpu -device=mali -max_num_threads=512 -thread_warp_size=2", "conv2d_nchw_spatial_pack.mali", [["TENSOR", [1, 64, 14, 11], "float32"], ["TENSOR", [4, 64, 1, 1], "float32"], [1, 1], [0, 0, 0, 0], [1, 1], "float32"], {}], "config": {"index": 15029, "code_hash": null, "entity": [["tile_co", "sp", [-1, 1, 4]], ["tile_oh", "sp", [-1, 7, 1]], ["tile_ow", "sp", [-1, 1, 11]], ["reorder_0", "re", [0, 1, 2, 3, 4, 5, 6, 7, 8, 9]], ["ann_reduce", "an", ["unroll", "none"]], ["ann_spatial", "an", ["unroll", "unroll", "none"]]]}, "result": [[0.0011482118072916668], 0, 125.31593632698059, 1630497550.4795082], "version": 0.2, "tvm_version": "0.8.dev0"}
{"input": ["opencl -keys=mali,opencl,gpu -device=mali -max_num_threads=512 -thread_warp_size=2", "conv2d_nchw_spatial_pack.mali", [["TENSOR", [1, 64, 14, 11], "float32"], ["TENSOR", [4, 64, 1, 1], "float32"], [1, 1], [0, 0, 0, 0], [1, 1], "float32"], {}], "config": {"index": 15653, "code_hash": null, "entity": [["tile_co", "sp", [-1, 1, 4]], ["tile_oh", "sp", [-1, 2, 7]], ["tile_ow", "sp", [-1, 11, 1]], ["reorder_0", "re", [0, 1, 2, 3, 4, 5, 6, 7, 8, 9]], ["ann_reduce", "an", ["none", "none"]], ["ann_spatial", "an", ["unroll", "unroll", "unroll"]]]}, "result": [[0.0007887544433333333], 0, 134.36569094657898, 1630497559.5323646], "version": 0.2, "tvm_version": "0.8.dev0"}
{"input": ["opencl -keys=mali,opencl,gpu -device=mali -max_num_threads=512 -thread_warp_size=2", "conv2d_nchw_spatial_pack.mali", [["TENSOR", [1, 64, 14, 11], "float32"], ["TENSOR", [4, 64, 1, 1], "float32"], [1, 1], [0, 0, 0, 0], [1, 1], "float32"], {}], "config": {"index": 12597, "code_hash": null, "entity": [["tile_co", "sp", [-1, 1, 2]], ["tile_oh", "sp", [-1, 7, 1]], ["tile_ow", "sp", [-1, 1, 11]], ["reorder_0", "re", [0, 1, 2, 3, 4, 5, 6, 9, 7, 8]], ["ann_reduce", "an", ["unroll", "none"]], ["ann_spatial", "an", ["unroll", "none", "unroll"]]]}, "result": [[0.0010031474204793029], 0, 143.29554080963135, 1630497568.4893937], "version": 0.2, "tvm_version": "0.8.dev0"}
{"input": ["opencl -keys=mali,opencl,gpu -device=mali -max_num_threads=512 -thread_warp_size=2", "conv2d_nchw_spatial_pack.mali", [["TENSOR", [1, 64, 14, 11], "float32"], ["TENSOR", [4, 64, 1, 1], "float32"], [1, 1], [0, 0, 0, 0], [1, 1], "float32"], {}], "config": {"index": 15831, "code_hash": null, "entity": [["tile_co", "sp", [-1, 1, 2]], ["tile_oh", "sp", [-1, 2, 1]], ["tile_ow", "sp", [-1, 1, 11]], ["reorder_0", "re", [0, 1, 2, 3, 4, 5, 6, 9, 7, 8]], ["ann_reduce", "an", ["none", "none"]], ["ann_spatial", "an", ["unroll", "unroll", "unroll"]]]}, "result": [[0.0008670670731707319], 0, 151.8266851902008, 1630497577.019002], "version": 0.2, "tvm_version": "0.8.dev0"}
{"input": ["opencl -keys=mali,opencl,gpu -device=mali -max_num_threads=512 -thread_warp_size=2", "conv2d_nchw_spatial_pack.mali", [["TENSOR", [1, 64, 14, 11], "float32"], ["TENSOR", [4, 64, 1, 1], "float32"], [1, 1], [0, 0, 0, 0], [1, 1], "float32"], {}], "config": {"index": 16481, "code_hash": null, "entity": [["tile_co", "sp", [-1, 1, 4]], ["tile_oh", "sp", [-1, 2, 1]], ["tile_ow", "sp", [-1, 1, 11]], ["reorder_0", "re", [0, 1, 2, 3, 4, 5, 6, 9, 7, 8]], ["ann_reduce", "an", ["unroll", "none"]], ["ann_spatial", "an", ["unroll", "unroll", "unroll"]]]}, "result": [[0.0006882], 0, 8.465254545211792, 1630497585.853446], "version": 0.2, "tvm_version": "0.8.dev0"}
{"input": ["opencl -keys=mali,opencl,gpu -device=mali -max_num_threads=512 -thread_warp_size=2", "conv2d_nchw_spatial_pack.mali", [["TENSOR", [1, 64, 14, 11], "float32"], ["TENSOR", [4, 64, 1, 1], "float32"], [1, 1], [0, 0, 0, 0], [1, 1], "float32"], {}], "config": {"index": 17775, "code_hash": null, "entity": [["tile_co", "sp", [-1, 1, 2]], ["tile_oh", "sp", [-1, 2, 1]], ["tile_ow", "sp", [-1, 1, 11]], ["reorder_0", "re", [0, 1, 2, 3, 4, 5, 6, 9, 7, 8]], ["ann_reduce", "an", ["unroll", "none"]], ["ann_spatial", "an", ["unroll", "unroll", "vec"]]]}, "result": [[0.0007196597232142858], 0, 17.197233200073242, 1630497594.6032434], "version": 0.2, "tvm_version": "0.8.dev0"}
{"input": ["opencl -keys=mali,opencl,gpu -device=mali -max_num_threads=512 -thread_warp_size=2", "conv2d_nchw_spatial_pack.mali", [["TENSOR", [1, 64, 14, 11], "float32"], ["TENSOR", [4, 64, 1, 1], "float32"], [1, 1], [0, 0, 0, 0], [1, 1], "float32"], {}], "config": {"index": 15189, "code_hash": null, "entity": [["tile_co", "sp", [-1, 1, 2]], ["tile_oh", "sp", [-1, 7, 1]], ["tile_ow", "sp", [-1, 1, 11]], ["reorder_0", "re", [0, 1, 2, 3, 4, 5, 6, 9, 7, 8]], ["ann_reduce", "an", ["unroll", "none"]], ["ann_spatial", "an", ["unroll", "unroll", "none"]]]}, "result": [[0.0010907934010416667], 0, 26.2568519115448, 1630497603.674576], "version": 0.2, "tvm_version": "0.8.dev0"}
{"input": ["opencl -keys=mali,opencl,gpu -device=mali -max_num_threads=512 -thread_warp_size=2", "conv2d_nchw_spatial_pack.mali", [["TENSOR", [1, 64, 14, 11], "float32"], ["TENSOR", [4, 64, 1, 1], "float32"], [1, 1], [0, 0, 0, 0], [1, 1], "float32"], {}], "config": {"index": 16319, "code_hash": null, "entity": [["tile_co", "sp", [-1, 1, 4]], ["tile_oh", "sp", [-1, 2, 1]], ["tile_ow", "sp", [-1, 1, 11]], ["reorder_0", "re", [0, 1, 2, 3, 4, 5, 6, 7, 8, 9]], ["ann_reduce", "an", ["unroll", "none"]], ["ann_spatial", "an", ["unroll", "unroll", "unroll"]]]}, "result": [[0.0006560869141104294], 0, 34.9402277469635, 1630497612.3614578], "version": 0.2, "tvm_version": "0.8.dev0"}
{"input": ["opencl -keys=mali,opencl,gpu -device=mali -max_num_threads=512 -thread_warp_size=2", "conv2d_nchw_spatial_pack.mali", [["TENSOR", [1, 64, 14, 11], "float32"], ["TENSOR", [4, 64, 1, 1], "float32"], [1, 1], [0, 0, 0, 0], [1, 1], "float32"], {}], "config": {"index": 12592, "code_hash": null, "entity": [["tile_co", "sp", [-1, 2, 2]], ["tile_oh", "sp", [-1, 2, 1]], ["tile_ow", "sp", [-1, 1, 11]], ["reorder_0", "re", [0, 1, 2, 3, 4, 5, 6, 9, 7, 8]], ["ann_reduce", "an", ["unroll", "none"]], ["ann_spatial", "an", ["unroll", "none", "unroll"]]]}, "result": [[0.0008851340586956522], 0, 43.73138070106506, 1630497621.1509402], "version": 0.2, "tvm_version": "0.8.dev0"}
{"input": ["opencl -keys=mali,opencl,gpu -device=mali -max_num_threads=512 -thread_warp_size=2", "conv2d_nchw_spatial_pack.mali", [["TENSOR", [1, 64, 14, 11], "float32"], ["TENSOR", [4, 64, 1, 1], "float32"], [1, 1], [0, 0, 0, 0], [1, 1], "float32"], {}], "config": {"index": 15184, "code_hash": null, "entity": [["tile_co", "sp", [-1, 2, 2]], ["tile_oh", "sp", [-1, 2, 1]], ["tile_ow", "sp", [-1, 1, 11]], ["reorder_0", "re", [0, 1, 2, 3, 4, 5, 6, 9, 7, 8]], ["ann_reduce", "an", ["unroll", "none"]], ["ann_spatial", "an", ["unroll", "unroll", "none"]]]}, "result": [[0.0012101370967741935], 0, 52.256558418273926, 1630497629.6813266], "version": 0.2, "tvm_version": "0.8.dev0"}
{"input": ["opencl -keys=mali,opencl,gpu -device=mali -max_num_threads=512 -thread_warp_size=2", "conv2d_nchw_spatial_pack.mali", [["TENSOR", [1, 64, 14, 11], "float32"], ["TENSOR", [4, 64, 1, 1], "float32"], [1, 1], [0, 0, 0, 0], [1, 1], "float32"], {}], "config": {"index": 14519, "code_hash": null, "entity": [["tile_co", "sp", [-1, 1, 4]], ["tile_oh", "sp", [-1, 2, 7]], ["tile_ow", "sp", [-1, 11, 1]], ["reorder_0", "re", [0, 1, 2, 3, 4, 5, 6, 9, 7, 8]], ["ann_reduce", "an", ["none", "none"]], ["ann_spatial", "an", ["unroll", "unroll", "none"]]]}, "result": [[0.000979334896713615], 0, 61.40422463417053, 1630497638.8514936], "version": 0.2, "tvm_version": "0.8.dev0"}
{"input": ["opencl -keys=mali,opencl,gpu -device=mali -max_num_threads=512 -thread_warp_size=2", "conv2d_nchw_spatial_pack.mali", [["TENSOR", [1, 64, 14, 11], "float32"], ["TENSOR", [4, 64, 1, 1], "float32"], [1, 1], [0, 0, 0, 0], [1, 1], "float32"], {}], "config": {"index": 15677, "code_hash": null, "entity": [["tile_co", "sp", [-1, 1, 4]], ["tile_oh", "sp", [-1, 7, 1]], ["tile_ow", "sp", [-1, 1, 11]], ["reorder_0", "re", [0, 1, 2, 3, 4, 5, 6, 7, 8, 9]], ["ann_reduce", "an", ["none", "none"]], ["ann_spatial", "an", ["unroll", "unroll", "unroll"]]]}, "result": [[0.0007848795396039604], 0, 70.07161951065063, 1630497647.5369663], "version": 0.2, "tvm_version": "0.8.dev0"}
{"input": ["opencl -keys=mali,opencl,gpu -device=mali -max_num_threads=512 -thread_warp_size=2", "conv2d_nchw_spatial_pack.mali", [["TENSOR", [1, 64, 14, 11], "float32"], ["TENSOR", [4, 64, 1, 1], "float32"], [1, 1], [0, 0, 0, 0], [1, 1], "float32"], {}], "config": {"index": 25397, "code_hash": null, "entity": [["tile_co", "sp", [-1, 1, 4]], ["tile_oh", "sp", [-1, 7, 1]], ["tile_ow", "sp", [-1, 1, 11]], ["reorder_0", "re", [0, 1, 2, 3, 4, 5, 6, 7, 8, 9]], ["ann_reduce", "an", ["unroll", "none"]], ["ann_spatial", "an", ["vec", "unroll", "unroll"]]]}, "result": [[0.0006622549040247678], 0, 78.69696593284607, 1630497656.1616592], "version": 0.2, "tvm_version": "0.8.dev0"}
{"input": ["opencl -keys=mali,opencl,gpu -device=mali -max_num_threads=512 -thread_warp_size=2", "conv2d_nchw_spatial_pack.mali", [["TENSOR", [1, 64, 14, 11], "float32"], ["TENSOR", [4, 64, 1, 1], "float32"], [1, 1], [0, 0, 0, 0], [1, 1], "float32"], {}], "config": {"index": 16487, "code_hash": null, "entity": [["tile_co", "sp", [-1, 1, 4]], ["tile_oh", "sp", [-1, 7, 1]], ["tile_ow", "sp", [-1, 1, 11]], ["reorder_0", "re", [0, 1, 2, 3, 4, 5, 6, 9, 7, 8]], ["ann_reduce", "an", ["unroll", "none"]], ["ann_spatial", "an", ["unroll", "unroll", "unroll"]]]}, "result": [[0.0007427420030959752], 0, 87.42734789848328, 1630497664.9330297], "version": 0.2, "tvm_version": "0.8.dev0"}
{"input": ["opencl -keys=mali,opencl,gpu -device=mali -max_num_threads=512 -thread_warp_size=2", "conv2d_nchw_spatial_pack.mali", [["TENSOR", [1, 64, 14, 11], "float32"], ["TENSOR", [4, 64, 1, 1], "float32"], [1, 1], [0, 0, 0, 0], [1, 1], "float32"], {}], "config": {"index": 11941, "code_hash": null, "entity": [["tile_co", "sp", [-1, 2, 1]], ["tile_oh", "sp", [-1, 2, 1]], ["tile_ow", "sp", [-1, 1, 11]], ["reorder_0", "re", [0, 1, 2, 3, 4, 5, 6, 9, 7, 8]], ["ann_reduce", "an", ["none", "none"]], ["ann_spatial", "an", ["unroll", "none", "unroll"]]]}, "result": [[0.0007411800248091604], 0, 96.1076295375824, 1630497673.6336455], "version": 0.2, "tvm_version": "0.8.dev0"}
{"input": ["opencl -keys=mali,opencl,gpu -device=mali -max_num_threads=512 -thread_warp_size=2", "conv2d_nchw_spatial_pack.mali", [["TENSOR", [1, 64, 14, 11], "float32"], ["TENSOR", [4, 64, 1, 1], "float32"], [1, 1], [0, 0, 0, 0], [1, 1], "float32"], {}], "config": {"index": 4661, "code_hash": null, "entity": [["tile_co", "sp", [-1, 1, 4]], ["tile_oh", "sp", [-1, 7, 1]], ["tile_ow", "sp", [-1, 1, 11]], ["reorder_0", "re", [0, 1, 2, 3, 4, 5, 6, 7, 8, 9]], ["ann_reduce", "an", ["unroll", "none"]], ["ann_spatial", "an", ["none", "unroll", "none"]]]}, "result": [[0.0009461720841300191], 0, 105.17776250839233, 1630497682.717614], "version": 0.2, "tvm_version": "0.8.dev0"}
{"input": ["opencl -keys=mali,opencl,gpu -device=mali -max_num_threads=512 -thread_warp_size=2", "conv2d_nchw_spatial_pack.mali", [["TENSOR", [1, 64, 14, 11], "float32"], ["TENSOR", [4, 64, 1, 1], "float32"], [1, 1], [0, 0, 0, 0], [1, 1], "float32"], {}], "config": {"index": 15647, "code_hash": null, "entity": [["tile_co", "sp", [-1, 1, 4]], ["tile_oh", "sp", [-1, 1, 7]], ["tile_ow", "sp", [-1, 11, 1]], ["reorder_0", "re", [0, 1, 2, 3, 4, 5, 6, 7, 8, 9]], ["ann_reduce", "an", ["none", "none"]], ["ann_spatial", "an", ["unroll", "unroll", "unroll"]]]}, "result": [[0.0005441368078175896], 0, 113.98299217224121, 1630497691.531722], "version": 0.2, "tvm_version": "0.8.dev0"}
{"input": ["opencl -keys=mali,opencl,gpu -device=mali -max_num_threads=512 -thread_warp_size=2", "conv2d_nchw_spatial_pack.mali", [["TENSOR", [1, 64, 14, 11], "float32"], ["TENSOR", [4, 64, 1, 1], "float32"], [1, 1], [0, 0, 0, 0], [1, 1], "float32"], {}], "config": {"index": 13887, "code_hash": null, "entity": [["tile_co", "sp", [-1, 1, 2]], ["tile_oh", "sp", [-1, 2, 1]], ["tile_ow", "sp", [-1, 1, 11]], ["reorder_0", "re", [0, 1, 2, 3, 4, 5, 6, 9, 7, 8]], ["ann_reduce", "an", ["unroll", "none"]], ["ann_spatial", "an", ["unroll", "none", "vec"]]]}, "result": [[0.0008770853728813559], 0, 122.809743642807, 1630497700.3800933], "version": 0.2, "tvm_version": "0.8.dev0"}
